,hebrewFromSub,englishFromSub,englishTranslation,ratio
0,אני צריכה לעבור  בספרייה בדרך העירה ,I have to stop at the library on my way downtown ,I have to go through the library on the way to town,65
1,את שקטה היום  את מדברת בדרך כלל,You're silent today Usually you're quite talkative ,"You're quiet today, you usually talk",80
2,אין לי מה לומר,I-I have nothing to say ,I have nothing to say,95
3,כלומר אין לי מה לספר,I-I have nothing to say ,I mean I have nothing to tell,77
4,את כועסת,Are you angry ,You're mad,70
5,לא שידוע לי  אבל אין לך מה לומר,No not that I'm aware of But you have nothing to say ,Not that I know but you have nothing to say,86
6,לא,No ,No,100
7,היא ראתה אותנו סקוט  ביקשתי שתנעל את הדלת  אמרת שהם מטיילים ביער,She saw us Scott I asked you to lock the door You said they were walking in the woods ,She saw us Scott I asked her to lock the door you said they were hiking in the woods,86
8,"אבא אמר שהוא לא רוצה  שנהיה כאן בסופ""ש  וניסיתי להסביר  לשכנע אותו לבטוח בי",Dad said he was uncomfortable about us being here for the weekend and I tried to explain make him trust me and I said it would be all right and this  ,Dad said he did not want us to be here on the weekend and I tried to explain to convince him to trust me,64
9,כן אתה לא מכיר את מריון  חשבתי שאמרת שהיא מגניבה  כן היא נהדרת-,- Yeah you don't know Marion - I thought you said she was pretty hip - Yeah she is she's great ,Yes you do not know Marion I thought you said she's cool yes she's great-,76
10,היא נהדרת   לא יודעת ,She's  She's great She  ,She's great I do not know,61
11,היא שיפוטית מעט היא מציבה עצמה מעל אנשים  ואומדת את ערכם,She's a little  judgmental You know She sort of stands above people and evaluates them ,She is a little judgmental she places herself above people and values ​​them,72
12,שמעתי אותה מדברת על אחיה,I've heard her make remarks about her brother and  ,I heard her talking about her brother,74
13,ואני תמיד חושבת  שהיא תשפוט אותי ככה,I always think that she's gonna judge me that way ,And I always think she's going to judge me that way,84
14,עכשיו אני מרגישה ממש זולה  זולה ,I just  Now I feel really cheap for some reason - Cheap ,Now I feel really cheap and cheap,68
15,-כן  זולה ,- Cheap - Yes ,-Yes cheap,100
16,-כן- חשבתי שזה היה  רומנטי מאוד ,- I thought it was very romantic ,-Yes- I thought it was very romantic,94
17,-נכון  האש והיין  כן נכון-,- It was With the fire and the wine  Yeah ,- True fire and wine Yes true-,68
18,לא יכולתי לעבוד עוד  באותו היום הרגשתי שאני צריכה  לנשום אוויר צח,I couldn't work any more that day I felt I needed some fresh air ,I could no longer work that day I felt I needed to breathe fresh air,82
19,שוטטתי ברחובות ללא מטרה  וניסיתי לעשות סדר במחשבותיי,I walked the streets aimlessly just trying to put some jumbled thoughts in order ,I wandered the streets aimlessly and tried to put my thoughts in order,79
20,אני לא יודעת כמה זמן שוטטתי  אבל כשהבטתי סביבי  הייתי רחוקה מחדר הכתיבה שלי,I don't know how long I wandered but when I looked up I was quite far from my writing room ,I do not know how long I wandered but when I looked around I was far from my desk,80
21,מה קרה,What's happened ,What happened,93
22,אני לא יודעת,I don't know ,I do not know,88
23,מה את עושה כאן,Well what are you doing here ,what are you doing here,90
24,בטח קרה משהו  אל תגיד דבר כזה-,- Something must be wrong - Oh don't say that ,Something must have happened. Do not say such a thing.,67
25,מריון אינך רוצה בחברתי  לעתים קרובות,Marion you don't seek out my company very often ,Marion you do not want in my company often,76
26,את בטח צריכה משהו  כן אני צריכה משהו  אבל אני לא יודעת מה,You must need something Yes I do need something Only I don't know what it is exactly ,You probably need something yes I need something but I do not know what,76
27,מה יש לי שאוכל להציע  תוכל להיות כן אתי פול-,- Well what do I have I could offer ,What do I have to offer you can be yes with me Paul-,60
28,היינו קרובים מאוד בצעירותנו,You and I were so close when we were young ,We were very close in our youth,63
29,כמה כן את רוצה שאהיה רק היום הבנתי  כמה זמן חלף מאז שדיברנו,How honest do you want me to be It was just today that I realised how long it's been since we've even spoken ,How much do you want me to be just today I realized how long it's been since we talked,78
30,הפסקתי לרדוף אחרייך  כשהבנתי שזה גורם לך אי נוחות  זה לא נכון  בחייך מריון-,I gave up pursuing you when I realised how uncomfortable it made you feel - That's not true - Don't deny it ,I stopped chasing you when I realized it's making you uncomfortable. It's not right in your life Marion-,60
31,הבנתי שאכזבתי אותך  וגרוע מכך שאני מביך אותך,You know  I realised  that I disappointed you And worse I realised that I embarrass you ,I realized I had let you down and worse that I am embarrassing you,72
32,איך אני חי  למי אני נשוי,How I live and who I marry and  ,How I live to whom I am married,75
33,זה מתפרק עכשיו  אז לא צריך לדאוג בגלל זה,Of course that's falling apart now so we don't have to worry about it ,It's falling apart now so no need to worry because of it,69
34,היא רוצה שאעבוד  אצל הדודן אנדרו,She wants me to work for Cousin Andrew ,She wants me to work for Cousin Andrew,100
35,אבל היא צודקת כי מעולם לא פרנסתי  אותה ואת הילדים כראוי,But she's right you know because I never have supported her and the kids properly ,But she's right because I never supported her and the children properly,86
36,יהיה נורא כל כך ,Well would that be so awful ,It would be so awful,72
37,לעבוד אצל אנדרו,Working for Andrew ,Work for Andrew,91
38,נהגת לומר את זה   אני יודעת אבל-,You used to say that I know I know I did but  ,You used to say that I know but-,83
39,הזמנים משתנים  כן אין ספק-,- Times change - Yeah they certainly do ,Times change yes no doubt-,63
40,זוכרת שהראיתי לך משהו  שכתבתי לפני כמה שנים ,Do you remember some years ago when I uh I showed you something I'd written ,Remember I showed you something I wrote a few years ago,75
41,זוכרת מה אמרת  אני לא זוכרת- סביר להניח שניסיתי  להיות כנה ,You remember what you said No I don't remember I was probably just trying to be truthful ,Remember what you said I do not remember - I probably tried to be honest,77
42,"אך למתבונן מהצד זה מביך""","""It's so embarrassing ""","But to the onlooker it is embarrassing """,62
43,אמרתי את זה  ציטוט מדויק-,I said that ,I said that exact quote-,65
44,כך שאני משתדל  לא להביך אותך עוד,So I try not to embarrass you  any more ,So I'm trying not to embarrass you anymore,88
45,כל אחר הצהריים חשבתי על מקום נהדר לקחת אתכם כדי לחגוג את יום הנישואים  שלכם ביום שישי,I've spent all afternoon trying to think of a great place to take you two to celebrate your anniversary on Friday ,Every afternoon I thought of a great place to take you to celebrate your wedding anniversary on Friday,82
46,מה רע במלון בפילדלפיה שבו חוויתם את הרגע הראשון ,What's wrong with the hotel in Philadelphia where you had your first illicit moments of passion - You see ,What's wrong with a hotel in Philadelphia where you experienced the first moment,72
47,באמת- היא שימשה מקור השראה  לכל אישה בפקולטה לפילוסופיה  נחמד מצדך לומר,- I did You  she was the inspiration for every woman in the philosophy department - That's very kind of you ,Really- she served as an inspiration to every woman in the Faculty of Philosophy nice of you to say,66
48,עד היום אני זוכרת  את ההרצאות כה בבהירות נתת הרצאה אחת  על אתיקה ואחריות מוסרית,- I still remember the lectures so clearly There was a particular talk you gave on ethics and moral responsibility that  ,To this day I remember the lectures so clearly you gave one lecture on ethics and moral responsibility,76
49,הרעיונות שלך הדהימו אותי אז  ומדהימים אותי גם היום,Well your ideas were amazing to me and they're still amazing to me ,Your ideas amazed me then and amaze me even today,64
50,לא התכוונתי להפריע  רק רציתי לומר לך  ראיתי אותך כאן בעבר,Well didn't mean to interrupt but I wanted to tell you ,I did not mean to disturb you just wanted to tell you I've seen you here before,63
51,ומעולם לא יצא לי  לומר לך ששינית את חיי ,I've seen you here before and I never was able to say that you changed my life ,And I never got to tell you that you changed my life,71
52,תודה,Thanks ,Thanks,100
53,כל הכבוד ,Well done ,Well done,100
54,את זוכרת את ההרצאה הזו   נפלא שהיא ניגשה ו,Do you remember that lecture It's terrific that she just turned around and  ,Do you remember this wonderful lecture she went to and,64
55,זה מרגש מאוד,It's very touching ,This is very exciting,67
56,עברתי לילה שני ללא שינה  ולמחרת בעבודה הרגשתי את זה,I had spent a second sleepless night and the following day at work I felt it ,I went through a sleepless Monday night and the next day at work I felt it,69
57,לא יכולתי לכתוב בכלל  ומה שכתבתי היה מאולץ,I couldn't write at all and what little I did try was forced ,I could not write at all and what I wrote was forced,79
58,איני מצליחה לישון ביום  בדרך כלל אך הייתי תשושה  עצמתי את עיניי לכמה דקות  ואז הגיע החלום,Usually I can't sleep in the day but I was exhausted I closed my eyes for a few minutes and that's when the dream must have come ,I can't sleep during the day but I was exhausted for a few minutes and then the dream came true,72
59,לא תגידי כלום,You're not gonna say anything ,Do not say anything,75
60,לא אמרת כלום  והשעה שלך כמעט הסתיימה,You haven't said a thing and your hour's almost up ,You did not say anything and your hour was almost over,62
61,אני לא מאמין  שאין לך מה לומר,I don't believe you have nothing to say ,I do not believe you have anything to say,80
62,אני חושב שזה בגלל שאת כועסת,I think it's because you're angry ,I think it's because you're angry,100
63,עמוסת זעם מכדי לדבר ,Too choked with rage to speak ,Loaded with rage to speak,81
64,מה מעורר בך זעם,What is it that enrages you ,What makes you angry,60
65,החיים,Life ,Life,100
66,החיים ,Life ,Life,100
67,-היקום,- The  the universe ,-the universe,86
68,האכזריות והאי צדק  סבלה של האנושות  מחלות זקנה מוות,The cruelty the injustice The suffering of humanity Illness ageing  death ,The cruelty and injustice of humanity suffered from old age diseases and death,69
69,"""זה מופשט מאוד ""האנושות  אל תדאגי כל כך לאנושות  תעשי סדר בחיים שלך  כן ","All very abstract ""Humanity "" Don't worry about humanity all the time Get your own life in order - Yeah ","""It's very abstract"" humanity do not worry so much about humanity make order in your life yes",74
70,-נמשיך מחר-,- We'll continue this tomorrow ,-we'll continue tomorrow-,90
71,ממה היא סובלת לדעתך,What would you say she was suffering from ,What do you think she suffers from,69
72,מהונאה עצמית  טוב ,- Self-deception - Good It's a little general ,From good self-deception,65
73,זה כללי מעט- אני חושבת שהיא לא מסוגלת  להיפרד מהשקרים ,- I don't think she can part with the lies - No ,This is a bit general- I think she is unable to part with the lies,63
74,לא שהיא לא רוצה  זה העניין ,- Not that she doesn't want to - It's precisely that she doesn't want to ,Not that she does not want that is the point,64
75,היא לא רוצה- כשהיא תרצה  היא תעשה את זה,When she wants to she will ,She does not want to - when she wants she will do it,68
76,הכול קורה מהר כל כך  אני מוכרח למהר  אני מנסה למנוע ממנה להתאבד,- It's all happening so fast - I have to hurry I'm trying to prevent her from killing herself ,Everything happens so fast I have to hurry I try to stop her from committing suicide,60
77,אתה לא חושב שהיא תתאבד  היא כבר התחילה-,- You don't think she would - She's already begun ,- You do not think she's suicidal. She's already started.,67
78,-לא באופן דרמטי  זה לא הסגנון שלה היא עושה את זה  בצורה אטית ושיטתית  ועשתה את זה מגיל צעיר,- Oh not very dramatically That's not her style She's doing it slowly and methodically and has been since she was very young ,-Not dramatically it's not her style she does it slowly and systematically and did it from a young age,65
79,אם תסלחי לי  יש לי מטופל אחר,Now if you'll pardon me I have another patient ,"If you'll excuse me, I have another patient",80
80,כעת משחיי מגיעים לקיצם,Now that my life is  drawing to a close ,Now my life is coming to an end,72
81,יש לי רק חרטות,I have only regrets ,I only have regrets,100
82,חרטות על כך שהאישה שאיתה חלקתי את חיי  אינה זו שאהבתי יותר מכול,Regrets that the woman I shared my life with is not the one I loved the most deeply ,Regrets that the woman I shared my life with is not the one I loved most,93
83,חרטות על כך שבני ואני  לא אוהבים זה את זה  זו אשמתי,Regrets that there is no love between my son and myself That is my fault ,Regrets that my son and I do not like each other is my fault,68
84,חרטות על כך  שהייתי נוקשה מדי כלפי בתי  תובעני מדי  שלא הענקתי לה די רגש,Regrets that perhaps I've been too severe with my daughter too demanding that I haven't given her enough feeling ,Regrets that I was too rigid towards my daughter was too demanding that I did not give her enough emotion,67
85,אבל הייתי אומלל כל כך בעצמי  שקוע בחקר דמויות היסטוריות,But I was so unhappy myself so caught up in those stupid studies of historical figures ,But I was so miserable myself immersed in the study of historical figures,67
86,דרשתי מעט מדי מעצמי,I asked too little of myself ,I demanded too little of myself,88
87,פתאום החלום השתנה  ומצאתי את עצמי ברחוב מוכר,Suddenly the dream shifted and I found myself on a street that was familiar ,Suddenly the dream changed and I found myself on a familiar street,82
88,זה היה הרחוב שבו פגשתי  את קלייר מול התאטרון,It seemed to be where I had run into Claire in front of the theatre ,This was the street where I met Claire in front of the theater,71
89,על רצפת הסלון  את רוצה ,Would you ever think of making love to me on the living room floor ,On the living room floor you want,63
90,זה מעליב- אתה הטיפוס שלא מתעלס  אלא בחדר השינה בחושך ,That's a pretty insulting thing to say It's you that's the type not to make love anywhere but in bed with the lights out - Now who's being insulting ,This is insulting - you are the type who does not make love except in the bedroom in the dark,61
91,בוא נהיה כנים ,Let's try being honest ,Let's be honest,81
92,לא נותרה  תשוקה רבה בנישואים נכון,There's not much passion left in this marriage is there ,There was not much passion left in the right marriage,85
93,מריון אני עייף אנחנו בקושי שוכבים וכשזה  קורה זה מתבצע לפי הספר,Marion I'm tired We rarely sleep together any more and when we do it's by the book ,Marion I'm tired we're barely lying down and when that happens it's done according to the book,64
94,זה אותה שגרה ,It's the same routine ,It's the same routine,100
95,אני יודעת  מה תעשה ובאיזה סדר,I know what you're going to do and in what order ,I know what you will do and in what order,81
96,נכון שנינו יצורים של שגרה  נוכל ללכת לישון ,Yeah it's true we are both creatures of routine Now can we go to sleep It's late ,True we are both creatures of routine we can go to sleep,82
97,מאוחר תוכלי לא להתהפך  ולדבר בשנתך,And could you please try not to toss and talk in your sleep ,Late you can not turn around and talk in your sleep,71
98,"אתמול אמרת ""לארי"" כל הזמן  אני מניח שחלמת על לארי לואיס","Last night you kept saying ""Larry"" I assume you dreamed about Larry Lewis ","Yesterday you said ""Larry"" all the time I guess you dreamed of Larry Lewis",63
99,רציתי לבכות בחלום  אבל הדמעות לא באו,I wanted to weep in the dream but the tears wouldn't come ,I wanted to cry in a dream but the tears did not come,75
100,אתה נשוי  כן ,- Are you married ,You'm married yes,75
101,ידעת שהתחתנתי-,You knew I got married ,Did you know I got married-,88
102,כן ,- Yes ,Yes,100
103,כן שמעתי  לארי רוצה שנחזור לניו יורק  אבל אני לא ,Yes I had heard that Larry wants us to move back to New York but I don't ,Yes I heard Larry wants us to go back to New York but I do not,87
104,אתה מאושר  אני מאושר-,I hope you're happy with Ken ,You're happy I'm happy-,72
105,אני אשאיר אתכם לבד אני בטוחה שיש לכם  נושאי שיחה רבים,Why don't I leave you two I'm sure you have a lot to talk about ,I'll leave you alone I'm sure you have many topics of conversation,64
106,אני רואה את הכותרות שלך  במגזינים מדי פעם,I see your by-line now and then in magazines ,I see your headlines in magazines every now and then,83
107,קראת את הרומן שלי  יש לי אותו- אבל מביך אותי לומר  שטרם קראתי אותו  היית השראה לאחת הדמויות,I have it but I am embarrassed to say I haven't read it yet You inspired one of the characters ,You read my novel I have it - but it embarrasses me to say that I have not yet read it You were the inspiration for one of the characters,74
108,אני מקווה שלא היית  קשה מדי כלפיי לא ,- I hope you weren't too rough on me - No ,I hope you were not too hard on me no,78
109,כתבתי עלייך  באהבה רבה,I wrote of you with great love ,I wrote about you with great love,86
110,אשתך נהדרת פגשתי אותה  ישר אחרי שנפרדת ממני,Your wife is lovely Yes I met her right after you said goodbye to me ,Your wonderful wife I met her right after you broke up with me,68
111,שמה ג'ניפר  גם היא כותבת היטב,Her name's Jennifer She's also quite a good writer ,Her name is Jennifer and she also writes well,72
112,יש לכם ילדים  כן ,- Do you have any children ,You have children yes,76
113,יש לנו בת-,We have a daughter ,We have a daughter,100
114,זו הייתה החוויה  הגדולה והיפה ביותר בחיי,It's been the greatest most beautiful experience of my life ,It was the greatest and most beautiful experience of my life,87
115,אתה חושב עליי לפעמים ,Do you ever think of me ,You think of me sometimes,62
116,את חושבת עליי לפעמים-,Do you ever think of me ,Do you think of me sometimes-,71
117,מדי פעם בפעם,Once in a while ,once in a while,100
118,אני מקווה שאת מאושרת עם קן,I hope you're happy with Ken ,I hope you'm happy with Ken,95
119,פגשתי אותו ברחוב לא מזמן  הוא בטח אמר לך,I ran into him on the street not too long ago ,I met him on the street recently he must have told you,65
120,"אני חושבת עליך  ""יותר מ""לפעמים",I think of you more than once in a while ,"I think of you ""more than"" sometimes",73
121,אך בלי חרטה בבקשה  אל תאמרי לי שיש בך חרטה  יקירי בוא הנה  אני רוצה שתראה שקיעה יפה,But without regret Please don't tell me you have any regret Darling come here for a moment ,But no regrets please do not tell me you have regrets darling come here I want you to see a beautiful sunset,78
122,לאיזו דמות ברומן שלך ,Which character in your novel did I inspire ,To which character in your novel,77
123,שימשתי השראה  הלנקה  נתתי לך שם יפה ,Hlenka I gave you a beautiful name ,I was inspired by Lanka I gave you a beautiful name,71
124,הלנקה,Hlenka ,Lanka,73
125,תיארתי את התקופה שלנו יחד  את תזהי את זה,I described our times together You'll recognise it ,I described our period together you will recognize it,78
126,אני צריך ללכת  אשתי זקוקה לי,I have to go now My wife needs me ,I have to go my wife needs me,94
127,מריון בבקשה אל תבכי למרות שאני שמח לשמוע  שהסצנה שלנו מרגשת,Marion please don't cry Although I am glad to hear our little scene is moving ,Marion please do not cry even though I am glad to hear that our scene is moving,78
128,אני רוצה ללכת הביתה  את תלכי- חשבתי שתרצי לראות  את סיום המערכה השנייה,- I'd like to go home - And you will I just thought you might like to see our second act finale ,I want to go home - go - I thought you would like to see the end of the second act,71
129,סצנת ההתאבדות  של בעלך הראשון,Your first husband's suicide scene ,The scene of your first husband's suicide,91
130,איך את יודעת ,How do you know ,how do you know,100
131,זה קרה  15 שנה לאחר שהתגרשתם,It was 15 years after you divorced ,It happened 15 years after you divorced,82
132,הוא מת בשנתו  כי ערבב כדורים ואלכוהול,He died in his sleep from mixing pills and alcohol ,He died in his sleep because he mixed pills and alcohol,82
133,הייתי בלוויה שלו  זה תמיד תחום אפור-  לבד בחדר במלון מדוכא,I was at his funeral Well you know that's always a grey area Alone in a hotel room depressed  ,"I was at his funeral, it's always a gray area - alone in a room in a depressed hotel",86
134,הייתה לנו תקופה נפלאה יחד,Sam was a wonderful man ,We had a wonderful time together,62
135,לימדת אותי הרבה  היית תלמידה נהדרת  המעניינת ביותר בכיתתי,You taught me so much You were a wonderful pupil Certainly the most interesting one in my class ,You taught me a lot You were the most interesting great student in my class,69
136,ובכל זאת הפרש הגילים  אסור היה לי לפתות אותך  כלומר מבחינה אינטלקטואלית,Still the age difference  I shouldn't have seduced you Intellectually that is ,And yet the age difference I was not allowed to seduce you that is intellectually,70
137,הייתי צריך להתנגד לפיתוי לא הייתי צריך  לגרום לך להעריץ אותי,I shouldn't have made you adore me but you were such a dazzling pupil the temptation was too great ,I had to resist the temptation I did not have to make you admire me,63
138,אבל היית תלמידה כה מבריקה  הפיתוי היה גדול מדי,I shouldn't have made you adore me but you were such a dazzling pupil the temptation was too great ,But you were such a brilliant student the temptation was too great,67
139,אז שילמתי את המחיר  שנינו שילמנו את המחיר,And so I paid the price We both paid the price ,So I paid the price we both paid the price,95
140,מגיע רגע שבו התלמיד  סופג את כל מה שהוא יכול,Inevitably there comes a time when the pupil absorbs all that he or she can ,There comes a moment when the student absorbs everything he can,65
141,ומה שנראה כמו חליפה מהנה  של ידע ודעות הופך לחנק,And what seemed like constant joyous imparting of knowledge and opinions becomes suffocation ,And what looks like a fun suit of knowledge and opinions becomes suffocating,71
142,"למרבה האירוניה זה מה  שכתבו בתעודת הפטירה שלי  ""חנק""","Ironically that's what they wrote on my death certificate ""Suffocation ""","Ironically this is what they wrote on my death certificate ""suffocation""",91
