,hebrewFromSub,englishFromSub,englishTranslation,ratio
264,מוזר  לין ואני עוברים גיהינום  ואנחנו נשארים יחד  את וקן לעולם לא רבים  ואתם נפרדים,Lynn and I go through hell and we're staying together you and Ken never fight and you're breaking up ,Strange Lynn and I go through hell and we stay together and you never fight and you break up,90
265,אני רוצה לפתוח דף חדש אני רוצה לעשות הרבה דברים  בצורה שונה,I really do want a clean start I wanna do a lot of things differently ,I want to open a new page I want to do a lot of things differently,73
266,וזה כולל גם אותנו,And that does mean between us too ,And that includes us,60
267,אני רוצה לבלות יותר  אתך ועם לין,I'd like to spend a lot more time with you and Lynn ,I want to spend more time with you and Lynn,81
268,אני רוצה להכיר את כולם,I'd like to get to know everyone ,I want to know everyone,73
269,אם זה בסדר מבחינתך,If that's OK with you ,If this is OK with you,79
270,זו הייתה אשמתו של אבא ,So was it Dad's fault ,It was Dad's fault,92
271,רציתי לוודא שההלם  לא יזעזע אותך מדי  למען האמת  אני לא בהלם אני מופתעת,I just wanted to make sure that the shock of it didn't upset you too badly Well I  to tell you the truth I'm really  I'm not shocked I'm just surprised you know ,I wanted to make sure the shock would not shock you too much to be honest I am not in shock I am surprised,61
272,למען האמת תמיד הרגשתי   שיש ביניכם משהו,I mean  If I can be honest I always felt there was something between you two that was  ,"To be honest, I always felt there was something between you two",82
273,לא יודעת ,I don't know ,Do not know,78
274,נוח מדי  זו לא המילה הנכונה,Maybe too comfortable or  that's not the right word ,Too comfortable is not the right word,80
275,פשוט משהו יודעת,Just something you know ,Just something knows,88
276,כן  שלום אני השכנה שלך- וחשבתי שתרצה לדעת  שבגלל איזו בעיית אקוסטיקה אני שומעת בבירור ,I'm your next-door neighbour and I thought you should know that through some acoustical oddness - I can hear all your patients quite clearly - Really ,Yes Hello I am your neighbor - and I thought you would like to know that because of some acoustic problem I hear clearly,69
277,תודה אני אטפל בזה  נתקלתי בבעיה בעבר  אני יודע מה לעשות,Well thank you I'll take care of it I've had the problem before ,Thanks I will take care of this I have encountered a problem in the past I know what to do,61
278,מטופלת צעירה אישה בהיריון תהיתי אם תוכל לומר לי  כיצד אוכל ליצור איתה קשר  כן ,The pregnant one I wonder if you could tell me how I could get in touch with her Oh yes ,A young patient and a pregnant woman I was wondering if you could tell me how I could contact her yes,67
279,היא הפסיקה את הטיפול,She's terminated her treatment ,She stopped the treatment,65
280,היא עזבה  אין לי דרך ליצור איתה קשר אני חושש שיותר מזה  לא אוכל להוסיף,She's gone away I don't have any way of reaching her I'm afraid I can't say more ,She left I have no way to contact her I am afraid I can not add more than that,67
281,נראה שהכתיבה זרמה  והייתי מלאת אנרגיה  פעם אחת בבוקר שטוף שמש  עשיתי הפסקה,The writing seemed to flow and I was full of energy ,The writing seemed to flow and I was full of energy once on a sunny morning I took a break,72
282,שנאמר שהתבססה עליי  פתחתי את הספר עלעלתי בו  והתיישבתי כשראיתי את שמה,I opened the book leafed through and sat down as my eye was caught by her name ,That being said it was based on me I opened the book I flipped through and sat down when I saw her name,65
283,"הכרתי אותה כי היא הייתה""  המאהבת של מישהו שהכרתי היטב  הם החליטו להינשא""  זה היה אסון מבחינתי","""I knew her because she was the lover of a man I knew quite well "" ""Recently they had decided to marry ","I knew her because she was ""the mistress of someone I knew well they decided to get married"" It was a disaster for me",69
284,"כי מהרגע שבו הכרתי אותה""  הייתי מאוהב בה שכנעתי אותה""  לצאת אתי למשקה","This was a catastrophe for me personally because from the moment he introduced me to her I was in love with her "" ""I convinced her to have a drink with me ""","Because from the moment I met her ""I was in love with her I convinced her"" to go out with me for a drink",77
285,"זו הייתה הפעם היחידה""  שהייתי לבד איתה מאז שנפגשנו","""It was the only time I'd ever been alone with her since we met """,It was the only time I'm been alone with her since we met,92
286,"היא הייתה נהדרת""  ודיברתי יותר מדי ומהר מדי כי הייתי נבוך""  בגלל רגשותיי כלפיה  שלדעתי היו ברורים להכאיב""","""She was lovely and I spoke too much and too rapidly because I was embarrassed over my feelings toward her which I felt were painfully obvious ""","She was great ""and I talked too much and too fast because I was embarrassed"" because of my feelings towards her which I think were clearly painful """,76
287,"טיילנו בסנטרל פארק""  ודיברנו על דברים רבים","""We walked around in Central Park and talked about lots of things ""","We walked in Central Park ""and talked about many things",85
288,"סיפרתי לה על ספר""  שאני מתכוון לכתוב  ועל רצוני לגור במערב""","""I told her about a book I was planning to write and my wanting to live out west ""","I told her about a book ""I intend to write and about my desire to live in the West""",70
289,"היא דיברה בהתלהבות""  על נישואיה הקרבים אבל חשבתי שדיברה""  בהתלהבות רבה מדי כאילו ניסתה""  לשכנע את עצמה ולא אותי","""She spoke enthusiastically about her upcoming marriage but I thought it was too enthusiastic as if she were trying to convince herself rather than me ""","She spoke enthusiastically ""about her impending marriage but I thought she spoke"" too enthusiastically as if trying to ""convince herself and not me",83
290,"עד מהרה החל לרדת גשם""","""Soon it began to rain ""","It soon started to rain """,68
291,"אני זוכר שחשבתי""  כמה היא נפלאה  וכמה יפה נראתה באותו הרגע""","""I remember thinking how wonderful she was and how beautiful she looked at that moment ""","I remember thinking ""how wonderful she was and how beautiful she looked at that moment""",100
292,"ורציתי לומר לה כל כך הרבה""  כי הרגשות שלי סערו","""And I wanted to tell her so many things because my feelings were swirling so ""","And I wanted to tell her so much ""because my feelings were stormy",83
293,"ואני חושב שהיא ידעה הכול""  וזה הפחיד אותה אבל דחף כלשהו אמר לי""  שאם אנשק אותה היא תיענה","""And I think she knew everything and that frightened her "" ""And yet some instinct told me that if I kissed her she would respond ""","And I think she knew everything ""and it scared her but some urge told me"" that if I kissed her she would answer",80
294,"הנשיקה שלה""  הייתה מלאת תשוקה וידעתי שלא אוכל לחלוק""  את ההרגשה הזאת עם איש","""Her kiss was full of desire and I knew I couldn't share that feeling with anyone else ""","Her kiss ""was full of passion and I knew I could not share"" this feeling with anyone",81
295,"ואז עלתה בינינו חומה""  והורחקתי במהירות  אבל היה מאוחר מדי""","""And then a wall went up and just as quickly I was screened out ""","Then a wall came up between us ""and I was driven away quickly but it was too late""",61
296,"כי כעת ידעתי""  שהיא מסוגלת לתשוקה עזה אם יום אחד"" "" תרשה לעצמה להרגיש אותה","""But it was too late because I now knew that she was capable of intense passion if she would one day just allow herself to feel ""","Because now I knew ""that she is capable of intense desire if one day"" ""will allow herself to feel it",77
297,סגרתי את הספר וחשתי  תערובת מוזרה של ערגה ותקווה,I closed the book and felt a strange mixture of wistfulness and hope ,I closed the book and felt a strange mixture of longing and hope,85
298,ותהיתי אם זיכרון הוא משהו  שיש לך או משהו שאיבדת,And I wondered if a memory is something you have or something you've lost ,And I was wondering if memory is something you have or something you have lost,89
299,בפעם הראשונה זה זמן רב  הייתי שלווה,For the first time in a long time I felt at peace ,For the first time in a long time I was at peace,91
300,השמש מכה ושורפת את הזפת על הגגות ,Oh the sun beats down And burns the tar up on the roof,The sun hits and burns the tar on the roofs,80
301,ונעלייך הופכות כה חמות אתה מייחל שכפות רגליך תהינה חסינות אש,And your shoes get so hot You wish your tired feet were fireproof,And your shoes become so hot you wish your feet would be fireproof,76
302,מתחת לטיילת ,Under the boardwalk,Under the promenade,68
303,ליד הים ,Down by the sea,by the sea,80
304,עם שמיכה עם אהובי זה המקום שבו אני נמצאת ,On a blanket with my baby Is where I'll be,With a blanket with my lover this is where I am,74
305,מהפרק אתה שומע קולות שמחים מהקרוסלות ,From the park you hear Happy sounds from the carrousel,From the episode you hear happy voices from the turnstiles,64
306,כמעט שאתה יכול לטעום מהנקניקיות ואת הצ'יפסים שהם מוכרים,You can almost taste the hot dogs And french fries they sell,You can almost taste the sausages and chips they sell,78
307,מתחת לטיילת ליד הים ,Under the boardwalk Down by the sea,Under the promenade by the sea,71
308,בשמיכה עם אהובי זה המקום שבו אני נמצאת ,On a blanket with my baby Is where I'll be,In a blanket with my lover this is where I am,76
309,מתחת לטיילת ,Under the boardwalk,Under the promenade,68
310,בצל מתחת לטיילת ,Under the boardwalk,Onion under the boardwalk,86
311,אנחנו עושים כיף מתחת לטיילת ,Out of the sun Under the boardwalk,We have fun under the boardwalk,80
312,אנשים הולכים מעל ,People walking above,People walk over,83
313,מתחת לטיילת ,Under the boardwalk,Under the promenade,68
314,אנחנו מרגישים מאוהבים ,We'll be falling in love,We feel in love,67
315,מתחת לטיילת ,Under the boardwalk,Under the promenade,68
316,טיילת ,Boardwalk,Boardwalk,100
317,אם כלי המיתר ו והקרנות יעמדו פה בסדר ,Now if the strings and horns would only come here right ,If the strings and horns stand here fine,69
318,אני יודעת זה כמו התזמורת של קלוד ריינס ,I know It's like the Claude Rains Orchestra ,I know it's like the Claude Raines Orchestra,99
319,הודעה בשבילך סיסי ,Message for you CC ,Message for you Sissy,77
320,אני חייבת לדבר עם הקבלן הזה ,I gotta talk to that contractor ,I have to talk to this contractor,81
321,דיאנה דיאנה הביאי את התיקים שלי ,Diana Diana get my bag ,Diana Diana brought my bags,73
322,-ברט ברט אני צריכה להגיע לשדה התעופה ,- Brett - Brett I've got to go to the airport ,- Brett Brett I need to get to the airport,84
323,עכשיו ,No ,now,80
324,את בטוחה שאינך רוצה שאקח אותך ישירות לשער מיס בלום לא לא לא ,Are you sure you don't want me to take you up to the gate ,You're sure you do not want me to take you directly to Miss Bloom's gate no no no,67
325,אני בסדר ,No no I'm fine ,I'm fine,73
326,פשוט תגיד לדיאנה שאתקשר אליה כשאגיע לשם ,Just tell Diana I'll call her when I get there ,Just tell Diana I'll call her when I get there,100
327,ניסינו להשיג לך טיסה להלילה מיס בלום  אך זה בלתי אפשרי ,We tried everything to get you a flight out tonight Miss Bloom ,We tried to get you a flight tonight Miss Bloom but it's impossible,78
328,אין מטוסים שנוחתים בסן פרנסיסקו ,But there are no planes landing in San Francisco ,There are no planes landing in San Francisco,96
329,יש ערפל ,There's a fog ,There is fog,88
330,למה את מתכוונת אין טיסות שנוחתות כרגע בסן פרנסיסקו ,What do you mean no flights landing in San Francisco ,What do you mean there are no flights currently landing in San Francisco,84
331,זהו העולם המודרני או מה ,- Is this the modern world or what ,This is the modern world or what,100
332,זה נכון  אבל  אפילו בעולם המודרני  מטוסים לא נוחתים בסן פרנסיסקו כאשר יש ערפל ,- Even in the modern world planes don't land in San Francisco when it's foggy ,This is true but even in the modern world planes do not land in San Francisco when there is fog,81
333,לינדה מדוע שלא תבדקי את מתי הערפל מתפוגג ,Linda why don't you check about the status of the fog lifting ,Linda why do not you check when the fog dissipates,65
334,בדקתי לפני 5 דקות ,- I checked five minutes ago - Fogs lift ,I checked 5 minutes ago,71
335,-בדקי שוב אני חושבת שזה יהיה נחמד ,Please check again I think it would be nice ,- Check again I think it would be nice,91
336,הם אמרו שיתקשרו אליי כשהערפל מתפוגג ,They said they would call me when the fog lifted ,They said they would call me when the fog cleared,85
337,התקשרי אליהם המכונית פה המפתחות בפנים ,You call them Get  The car's right over here ,Call them the car here and the keys inside,61
338,זו המפה שלך והחוזה ,The keys are in it Here's your map and your contract ,This is your map and contract,67
339,בדקתי את המגבים ,I checked the wipers ,I checked the wipers,100
340,הם בסדר ,They're all right ,they are fine,67
341,יהיה גשום כל הדרך אז היי זהירה ,It's raining all the way up I-5 so be careful ,It's going to be rainy all the way so be careful,82
342,כשהשמש שוקעת ושורפת את הזפת על הגגות ,Oh when the sun beats down And burns the tar up on the roof,When the sun goes down and burns the tar on the roofs,88
343,ונעלייך הופכות כל כך חמות ואתה מייחל שכפות רגלייך העייפות תהיינה חסינות אש  ,And your shoes get so hot You wish your tired feet were fireproof,And your shoes get so hot and you wish your tired feet would be fireproof,87
344,-הנקניקיות הכי טובות באטלנטיק סיטי ,Best hot dogs in Atlantic City ,- The best sausages in Atlantic City,72
345,מתחת לטיילת  לייד הים ,Under the boardwalk Down by the sea,Under the promenade by the sea,71
346,אל תגידי לי הלכת לאיבוד ,Don't tell me You're lost ,Do not tell me you got lost,81
347,אני חייבת לראות הרבה מקרים כמוך כל יום ,I must see a hundred cases like you every day ,I have to see a lot of cases like you every day,80
348,את יודעת  סיגריה ,You know a drag on my cigarette ,You know a cigarette,78
349,זה ירגיע לך את העצבים ,It'll calm your nerves ,It will calm your nerves,83
350,אני רק רוצה לחזור למלון ,I just want to get back to our hotel ,I just want to go back to the hotel,87
351,אבל אני לא זוכרת את שמו ,But I can't remember the name ,But I do not remember his name,68
352,קטן או גדול ,- Big or small ,Small or large,77
353,-גדול ,- Big ,-big,100
354,יש בו מזרקה בכניסה או בריכה בפנים ולהקה בחליפת קופים שמנגנת בכינור בלובי ,Does it have a fountain in front a pool inside and a bunch of fruits in monkey suits playing violins in the lobby ,It has a fountain at the entrance or a pool inside and a band in a monkey suit playing the violin in the lobby,78
355,כן!,Yes!,Yes!,100
356,אני מהמרת איתך שאת עשירה ,Bet your ass it's ritzy ,I bet you're rich,60
357,"זה ""מרלבורו בלנהיים""",It's the Marlboro Blenheim ,It's Marlboro Blenheim,92
358,זהו זה!,That's it!,that's it!,100
359,1 את יודעת היכן זה כן ,Do you know where it is ,1 You know where it is,93
360,אני אחזור איתך אם את רוצה ,Yeah I'll walk you back if you want ,I'll be back with you if you want,79
361,בבקשה ,CC where are you ,you are welcome,71
362,רק תני לי לנעול את נעליי ,- Just let me put on my shoes ,Just let me put on my shoes,100
363,איפה הם לעזאזל מה שמך ,Where the hell are they ,Where the hell are they?,100
364,מה שמי ,What's my name ,What is my name?,83
365,אני מי אם לא הפנטסטית המפורסמת בעולם כולו  ילדת הפלא  סיסי בלום!,I am none other than the fantastic world-famous child wonder CC Bloom!,I am who if not the most famous fantastic in the whole world Wonder Girl Sissy Bloom!,71
366,היי אני הילרי ויטני ,Hi I'm Hillary Whitney ,Hi I'm Hillary Whitney,100
367,את לא מזהה אותי ,Don't you recognize me ,You do not recognize me,84
368,לא ,No ,No,100
369,אני עושה כמה תפקידים בתוכנית הילדים של סמי פיקרס ה ,I do a couple of routines in the Sammy Pinkers Kiddie Show ,I do some roles in Sammy Pickers' children's show,68
370,מה ,- The what ,what,67
371,על איזו פלנטה את חייה ,What planet do you live on ,On what planet is her life,73
372,המופע של סמי פינקרס היא התוכנית הכי פופולארית באטלנטיק סיטי ,The Sammy Pinkers Show just happens to be the most popular show in Atlantic City ,Sammy Pinkers' show is the most popular show in Atlantic City,84
373,ואני השחקנית הכי פופולארית ביחד עם איריס מנדווסקי המוזרה שהולכת על הידיים ,And I'm the most popular act in it along with Iris Myandowski the hand-walking queer ,And I'm the most popular actress along with the weird Iris Mendowski going on hands,72
374,רוצה קצת ,- Come on!,Want some,62
375,-לא ,No ,-No,100
376,את יודעת כשלא מצאתי אותך בחדר ההלבשה שלך את יודעת מה חשבתי ,I'm down here When I didn't find you in your dressing room you know what I thought ,You know when I did not find you in your locker room you know what I thought,73
377,חשבתי שאת מתה!,I thought you were dead!,I thought you were dead!,100
378,את צופה ביותר מידי סרטים ליאונה ,You watch too many movies Leona ,You're watching too many movies Leona,91
379,צייד כשרונות הוליוודי רוצה לראות אותך משחקת ,There's a Hollywood talent scout wants to see your act ,A Hollywood talent hunter wants to see you play,75
380,זה רעיון שלך או איזו בדיחה חולנית ליאונה ,- Is this your idea of a sick joke - No honey ,It's your idea or some sick joke Leona,68
381,הוא מחפש ילד שיככב בסרטו החדש קדימה!,He was crazy about you And he's looking for a kid to star in his new movie ,He's looking for a kid to star in his new movie Forward!,78
382,זו הפריצה הגדולה שלי ,This is my break into the big time ,This is my big break,74
383,כמה פעמים אני צריכה לומר לך  אל תלבשי את החליפה הזו בחוף ,How many times do I have to tell you Don't wear that costume on the beach ,How many times do I have to tell you not to wear this suit on the beach,81
384,אני לא עשויה מכסף את יודעת ,I am not made of money you know ,I'm not made of money you know,92
385,-רדי ממני ליאונה ,Get off my back Leona!,"- Get rid of me, Leona",70
386,אני לא יכולה לנשום מה אתה גמל או משהו ,What are you a camel or something Skedaddle! I gotta have a sip!,I can not breathe what you camel or something,64
387,איזו אישה ,- What woman ,What a woman,91
388,שום אישה זו אימא שלי ,That's no woman that's my mother ,No woman is my mother,68
389,בואי נלך ליאונה ,Okay Leona Let's go home ,Let's go to Leona,68
390,אני באה אני תורן ששר מפה לשמיים ,I am schvitzing from here to high heaven ,I come I'm on duty singing from heaven to heaven,68
391,-אני באה ,- I'm coming!,-I'm coming,100
392,יש אבנים ברגליים שלי אלוהים אני שאנת את אטלנטיק סיטי ,I've got splinters in my toes Oy God I hate Atlantic City!,There are stones in my feet God I hated Atlantic City,71
393,מה שמה סיסי בלום ,- What's this one's name ,"What's her name, Sissy Bloom?",65
394,נשמע כמו חשפנית -לא סיסי בום בלום ,- CC Boom it sounds like a stripper ,Sounds like a stripper - not Sissy Boom Bloom,74
395,בלום ,- CC Bloom ,Bloom,77
396,אתה צריך לתת קצת לקחת קצת ולתת ללב העני שלך להשבר,You got to give a little Take a little And let your poor heart break a little,You need to let a little take a little and let your poor heart break,86
397,זהו סיפורה של  זוהי תהילתה של האהבה ,That's the story of That's the glory of love,This is the story of This is the glory of love,76
398,אתה צריך לצחוק קצת לבכות קצת,Oh yeah You got to laugh a little Cry a little,You have to laugh a little and cry a little,79
399,עד שהעננים ירעימו קצת זהו סיפורה של,Until the clouds roll by a little That's the story of,Until the clouds thunder a little this is the story of,77
400,זוהי תהילתה של האהבה ,That's the glory of love,This is the glory of love,78
401,כל הזמן ששנינו ביחד קיבלנו את כל העולם וכל קסמיו ,As long as there's the two of us We've got the world and all its charms,All the while we were both together we got the whole world and all its charms,69
402,וכשהעולם ביחד איתנו אנחנו בזרועות אחד של השני,And when the world is through with us We've got each other's arms,And when the world is together with us we are in each other's arms,85
403,אתה צריך לנצח קצת להפסיד קצת,You've got to win a little Lose a little,You have to win a little bit and lose a little bit,78
404,זוהי תהילתה של האהבה ,That's the glory of love,This is the glory of love,78
405,אימי אמרה לי זוהי תהילתה של האהבה,My mama told me That's the glory of love,My mother told me this is the glory of love,77
406,סיסי בואי לפה ותפגשי את מר מלמן ,CC come here and meet Mr Melman ,"Sisi, come here and meet Mr. Melman",88
407,היי מר מלמן היי סיסי ,- Hi Mr Melman - Hi CC ,Hi Mr. Melman Hi Sissy,77
408,מר מלמן בא כל הדרך מהוליוד,Mr Melman came all the way from Hollywood  ,Mr. Melman came all the way from Hollywood,100
409,איריס מנדווסקי עוברת גם כן אודישן ,Iris Myandowski's auditioning too ,Iris Mendowski is also auditioning,75
410,סיסי זה לא יהיה הוגן לא לתת לה  חשבתי שזו רק אני ליאונה!,Hey CC it wouldn't be fair not to let  - I thought it was just me Leona! - It was sweetie ,Sissy it would not be fair not to let her I thought it was just me Leona!,83
411,התרברבת שוב נכון ליאונה ,You were bragging again Weren't you Leona!,You bragged right again to Leona,68
412,-אני כל כך גאה בך מותק ,I'm so proud of you sweetheart ,- I'm so proud of you baby,70
413,איריס מוכנה מר מלמן ,Iris is ready Mr Melman ,Iris is ready Mr. Melman,100
414,איזו ילדה יפה,- What a beautiful child ,What a beautiful girl,88
415,-אמרתי לך ,- I told you ,-I told you,100
416,למי אכפת איך היא נראית ,Who cares what she looks like ,Who cares what she looks like,100
417,כל מה שהיא יודעת לעשות זה ללכת על הידיים ,All she knows how to do is walk on her hands ,All she knows how to do is walk on her hands,100
418,זו אשמתך!,It's your fault!,It's your fault!,100
419,זו אשמתך שהם בחרו בה ,It's your fault!,It's your fault they chose her,67
420,אני לא יכולה לנשום  את ממשיכה להתרברב בי את חייבת להפסיק!,- I can't breathe - It should have been me! You keep bragging about me!,"I can not breathe, you keep bragging about me, you must stop!",75
421,את הורסת את הקריירה שלי!,- Everybody's gonna hear - You're ruining my career!,You're ruining my career!,68
422,אני שאנת את איריס מנדווסקי,Iris Myandowski's auditioning too ,I hated Iris Mendowski,62
