,hebrewFromSub,englishFromSub,englishTranslation,ratio
610,את לא מבינה ,You don't understand ,You do not understand,93
611,אני בוכה כי אני שמחה ,I'm crying because I'm happy ,I cry because I'm happy,90
612,זה מזכיר לי שאני חופשיהה את לא יודעת איך זה בשבילי ,It just hit me that I'm free You don't know what it's been like for me ,It reminds me that I'm free. You do not know what it's like for me,80
613,ועכשיו פעם ראשונה בחיי אני עושה בדיוק מה שאני רוצה לעשות ,And now for the first time in my life ,And now for the first time in my life I'm doing exactly what I want to do,67
614,אני מרגישה שאני צועקת:,I feel like shouting ,I feel like I'm shouting:,91
615,"""תודה לאל שאני סופסוף חופשייה""","""Thank God Almighty I'm free at last!""","""Thank God I'm finally free""",72
616,אז  את תמיד כזו ,So - are you always like this ,So you're always like that,79
617,את יכולה להשאר ,Good Then you can stay ,You can stay,71
618,בואי נוציא את המיטה הזו החוצה ,Come on! Let's put this bed out ,Let's get this bed out,77
619,כמעט 10: 30 מה את חושבת ,What do you think ,Almost 10:30 what do you think,72
620,תשארי שם הרבה ,It's a gale out there ,Stay there a lot,70
621,לא אם זה תלוי בי את רוצה שאחכה לך ,- Not if I can help it Then you want me to wait for you ,Not if it's up to me you want me to wait for you,77
622,את לא חושבת שאת צריכה לחכות ,Don't you really think you ought to wait ,You do not think you have to wait,79
623,אני לבושה כמו ארנב בסדר ,- I am dressed like a rabbit - All right ,I'm dressed like a fine rabbit,70
624,-הינה זה ,- Here it is ,- Here it is,100
625,האוזניים שלי ישרות מה לגבי השיער כן ,Are my ears on straight ,My ears are straight what about the hair yes,60
626,זה נראה בסדר ,- Do I look okay ,It looks okay,81
627,את תהיי נהדרת ,- You gonna be long ,You'll be great,69
628,את נשמעת כל כך מטופשת כשאת אומרת את זה ,Oh you sound so silly when you say that ,You sound so stupid when you say that,79
629,אם את קוראת לי באגס את מתה ,If you call me Bugs you're dead ,If you call me Bugs you're dead,100
630,אני שאנת את החיים שלי ,I hate my life ,I hate my life,100
631,רק דקה ,Just a minute ,just a minute,100
632,הודעה לילד יום ההולדת מהארנבת שלו ברברה ,Message for the birthday boy from his darling bunny girl Barbara ,A message to the birthday boy from his rabbit Barbara,70
633,ממי ,From my what ,From whom,67
634,יום הולדת שמח ארנבוני ,Happy birthday ,Happy Birthday Rabbit,80
635,אהבה היא כזו מצחיקה עם ארנבוני הוא אוהב אותי כל כך הוא האושר שלי,Love's kind of funny with a bunny boy He loves me so hard He's my bundle of joy,Love is so funny with a rabbit he loves me so much he is my happiness,64
636,כל מה שאני רוצה לעשות זה לשחזר יום הולדת שמח,'Cause all he really wants to do is reproduce Happy birthday to you,All I want to do is recreate a happy birthday,70
637,יום הולדת שמח יקירי ,Happy birthday darling Johnny,happy Birthday my dear,78
638,יום הולדת שמח ,Happy birthday ,Happy Birthday,100
639,אוהבת: מהארנבונת היקירה שלך ברברה ,Love from your darling bunny girl Barbara ,LOVE: From your dear rabbit Barbara,69
640,היי חכי רגע ,- Hey wait a minute - Nope ,Hey wait a minute,87
641,לא אני עושה הדרן במזומן ,I only do encores for cash ,No I'm doing an encore in cash,68
642,את יודעת יש לך קול יפה ,You know you've got a great voice ,You know you have a beautiful voice,71
643,תודה ,Thanks ,Thanks,100
644,למה את מבזבזת את זמנך בלעשות את זה ,Why do you waste your time doing this ,Why are you wasting your time doing this?,88
645,אני לא יכולה לעזור לעצמי ,I can't help myself ,I can not help myself,95
646,אני אוהבת להתלבש כמו ארנבת וללכת ככה בציבור ,I love to get dressed up like a rabbit and go out in public ,I like to dress like a rabbit and walk like that in public,74
647,"יש איזה שהוא מקום שאני יכול לקראות אותך עובדת או  אני אהיה בפארק ""גראמרסי"" בשעה 4:",Well is there any place I can see your work or  I'll be at Gramercy Park at 4:00 in a chicken suit ,Is there any place I can call you working or I'll be at Gramercy Park at 4:,80
648,זה שלך ,- This is yours ,It's yours,78
649,-תודה ,Thanks ,-Thanks,100
650,אני ג'ון פירס ,I'm John Pierce ,I'm John Pierce,100
651,אני הארנבת ברברה ,I'm Brer Rabbit ,I'm the rabbit Barbara,76
652,אוקיי היה נעים לפגוש אותך הארנבת ברברה ,Well it was nice to meet you Brer Rabbit you and your voice ,"Okay, it's been nice to meet you, Barbara the Rabbit",62
653,אותך ואת הקול שלך ,You know you've got a great voice ,You and your voice,63
654,טוב אני לא באמת הארנבת ברברה בוודאי ניחשת את זה ,I'm not really Brer Rabbit but I guess you knew that ,Well I'm not really the rabbit Barbara you must have guessed it,71
655,יום הולדת שמח ,Happy birthday ,Happy Birthday,100
656,תודה ,Thanks ,Thanks,100
657,עשיתי עבודות בקיץ מאז שהייתי ילדה  את צוחקת ,- Me Oh yeah I've done summer stock since I was a kid ,I've been doing summer jobs since I was a girl and you're laughing,62
658,אני מנהל תיאטרון במערב  ואנחנו מחפשים מישהו עם קול חזק ,You're kidding I run a little theater on the West Side and we're always looking for someone with a strong voice ,I'm running a theater in the West and we'm looking for someone with a strong voice,80
659,כן בטח מה שם החברה ,What's the name of the company ,Yes sure what the company name is,76
660,"""פאלקון פלייארס -""",- The Falcon Players ,"""Falcon Flyers -""",77
661,"""פאלקון פלייארס"" ",- The Falcon Players ,"""Falcon Flyers""",77
662,ראיתי כמה מההופעות שלך בברודווי ראיתי את ההצגה בה הבחור נקבר בחול עד הצוואר שלו ,I've seen some of the shows you've sent up to Broadway I saw that play where the guy was buried in sand up to his neck ,I saw some of your Broadway shows I saw the show where the guy was buried in the sand up to his neck,85
663,-עמוק מאוד ,- Very deep ,- Very deep,100
664,אני ביימתי את ההצגה הזו,- I directed that ,I directed this play,74
665,אז מתי אתה רוצה לראות אותי ,So when do you want to see me ,So when do you want to see me,100
666,-מתי את רוצה לבוא ,When do you want me to come in ,-when do you want to come,89
667,יום שישי ב 4:,- Friday at 4:00 ,Friday at 4:,88
668,מעולה אם את רוצה שאנהג אנחנו צריכות לעזוב עכשיו ,If you want me to drive we have to leave now ,Great if you want me to drive we need to leave now,87
669,הוא במאי באמת ,- He's a director ,He's a real director,86
670,-זוהי שותפתי לחדר ,- This is my roommate ,- This is my roommate,100
671,אני הילרי ויטני,- I'm Hillary Whitney ,I'm Hillary Whitney,100
672,-נעים להכיר אותך ,- John Pierce Nice to meet you ,-Nice to meet you,73
673,ג'ון פירס נעים להכיר ,- John Pierce Nice to meet you ,John Pierce is nice to meet,87
674,את מאחרת לאודישן ,Would you be interested in auditioning ,You're late for the audition,61
675,אודישן לא  ,Audition ,Audition No,84
676,אני  חשבתי רק בגלל שאת נראית טוב  את עוברת אודישן ,Oh I  Oh I just thought because you look so good I thought you were auditioning ,I thought only because you look good you're auditioning,75
677,טוב אנחנו צריכות ללכת עכשיו ביי ,Well we have to be going now ,Well we have to go now bye,93
678,נעים להכיר אותך ג'ון ,- John Pierce Nice to meet you ,Nice to meet you John,86
679,אני צריכה להראות מיוחדת ,I gotta look special ,I need a special show,63
680,מה את חושבת ,What do you think ,what do you think,100
681,זה מדהים!,- This is it!,This is amazing!,64
682,אני נראית כמו מרילין ,Do I look like Marilyn ,I look like Marilyn,93
683,-אני לא נראית בכלל כמו מרילין ,Do I look like Marilyn ,- I do not look like Marilyn at all,80
684,תורי ,- My turn ,My turn,100
685,איך זה ,- How is it ,how is it,100
686,זה בדיוק אותו הצבע -מה קרה לא זה לא ,- Hillary it's exactly the same color ,It's exactly the same color -what happened no it's not,68
687,בזבזת שעתיים השיער שלך בדיוק אותו הדבר ,No it isn't No You just spent two hours dying your hair exactly the same color ,You spent two hours your hair exactly the same,74
688,יש קצת שוני ,It's a subtle difference ,There is some difference,71
689,אני לא חושבת כך ,I don't think so ,I do not think so,79
690,היא אומרת שהיא מרגישה חולה  והיא בהריון והוא עשה את זה,She says that she's feeling ill and that she's pregnant and he did it ,She says she feels sick and she is pregnant and he did it,81
691,אל תדאג בקשר לזה ,Don't worry about it ,Do not worry about it,93
692,כבר טיפלתי בזה ,I already took care of it ,I've already dealt with it,67
693,"למה הכוונה: ""כבר טיפלתי בזה"" ",What do you mean you already took care of it ,"What does it mean: ""I've already taken care of it""",75
694,קראתי לרופא ואנחנו יודעים מה זה אומר נכון ,I called in the doctor And we know what that means don't we ,I called the doctor and we know what that means right,88
695,למה את פשוט לא סותמת ,Why don't you just shut up ,Why are you just not blocking,62
696,המפקח יודע מה הוא עושה ,The warden knows what he's doing ,The inspector knows what he is doing,68
697,הרופא כאן ,- The doctor is here ,The doctor is here,100
698,-תודה ,Thanks ,-Thanks,100
699,חכה רגע חתכנו את השורה הזו ,Wait We cut that line ,Wait a minute we cut that line,82
700,תוכלי להראות לה את התסריט ,Hey would you show her the script ,You can show her the script,77
701,תקפיץ את כל העצב ותראה מה יש לנו כאן ,Pop up all the blues and see what we have on this ,Bounce all the sadness and see what we have here,70
702,בוא נראה את זה,Let's see it ,Let's see it,100
703,אני יודע ,I know ,I know,100
704,אני עשיתי את הליהוק ,I did the casting ,I did the casting,100
705,חשבתי שאקבל תפקיד יותר טוב ,Well I thought I'd have a better part ,I thought I would get a better job,73
706,עדיין לא ,Not yet ,Not yet,100
707,אבל זו לא אני ,But this isn't me ,But it's not me,75
708,הוא שונא את השיער שלי ,He hates my hair ,He hates my hair,100
709,אני מתכוונת באמת באמת הגידי לי את האמת ,I mean really really tell me the truth ,I mean really really told me the truth,89
710,בסדר,Okay ,OK,67
711,את חושבת שאני באמת מוכשרת או שאת חושבת שאין לי כישרון מיוחד ,Do you think I'm really truly talented or do you think I'm only moderately talented ,Do you think I'm really talented or do you think I have no special talent,76
712,אני חושבת שאת באמת מיוחדת ,I think you're truly talented ,I think you're really special,62
713,אמרתי לך את זה לפחות 8 מיליון פעמים ,I've told you this at least eight million times ,I've told you this at least 8 million times,91
714,אני יודעת  אולי את סתם מנסה להיות נחמדה ,Yes I know but maybe you were only being nice ,I know maybe you're just trying to be nice,71
715,כלומר איך אני אדע שאת באמת מתכוונת לזה ולא מנסה סתם להיות נחמדה ,I mean how do I know you really mean it and you're not just being nice ,I mean how will I know you really mean it and not just try to be nice,85
716,אני מתכוונת לזה!,I mean it!,I mean it!,100
717,עכשיו בואי נחזור לכביסה ,Gin - Now let's get back to the laundry ,Now let's go back to the laundry,90
718,-הילרי!,- Oh Hillary ,- Hillary!,82
719,אני לעולם לא אשכח את זה כל הזמן שאני חיה מה ,- I'll never forget this as long as I live ,I will never forget it all the time I live what,62
720,את עושה את הכביסה בשבילי כלומר אני שאנת לעשות כביסה יותר מכל דבר אחר בעולם ,You doing the laundry for me I mean I hate to do laundry more than anything in the whole world and I think this is probably the nicest thing anybody ever did for me ,You do the laundry for me which means I hate doing laundry more than anything else in the world,69
721,גבר לעולם לא יעשה אתזהבשבילך לאמשנה  כמה הוא אוהב אותך ,A man would never do this for you no matter how much he loved you ,A man will never do that for you for last night how much he loves you,76
722,נולד בחג המולד להציל אותנו מכוחו של השטן,Was born on Christmas Day To save us all from Satan's power,Born at Christmas to save us from the power of Satan,83
723,נחמה ואושר בשורות של נחמה ואושר,Comfort and joy O tidings Of comfort and joy,Comfort and happiness in the ranks of comfort and happiness,62
724,לא ,No ,No,100
725,בבקשה שרתי את כל שירי חנוכה בשבילך ,Oh please I sang all those dreidel songs for you ,Please I sang all the Hanukkah songs for you,76
726,הילרי אני עייפה ,- I'm Hillary Whitney ,Hillary I'm tired,78
727,אני רוצה ללכת לישון הצטננתי ,Well I thought I'd have a better part ,I want to go to bed I have a cold,63
728,בסדר ,Okay ,OK,67
729,לילה טוב,Good night Hill ,Good night,80
730,הילרי תיק מפעיל הסירות בטלפון ,Hillary the Waterman case is on the phone ,Hillary Bag operates the boats on the phone,64
731,לא לא לא ,- No no no no ,no no no,84
732,תגיד להם שנדון בזה בבית המשפט ,- Tell them I'll discuss it in court ,Tell them we're discussing it in court,86
733,בסדר ,Okay ,OK,67
734,בסדר ,Okay ,OK,67
735,גיליתי שבעל הבית שלך קיבל הרשאה ממשרד הבריאות רשות לשים טפטים בביתך,I found out your landlord's been served with enough citations from the Health Department to wallpaper your house ,I found out that your landlord has received permission from the Ministry of Health for permission to put wallpaper in your home,62
736,"נחשי מי קיבל את התפקיד הראשי במחזמר החדש של ""ניו פאלקון"" ",Guess who got the lead in the Falcon Players' new musical ,"Guess who got the lead role in the new musical ""New Falcon""",90
737,זהו זה!,Why is that ,that's it!,70
738,-אני יודעת את מרגישה את זה ,- Do you feel it - I feel it!,- I know you feel it,67
739,אני המפקד וזהו מקדשי,I am the captain And this is my shrine,I'm the commander and this is my temple,68
740,רואה מה עזבתי מאחור נהר של להבות,See what I leave behind A river in flames,See what I left behind a river of flames,86
741,וזה בוער זורם בוורידים,It burns so clean Throbs in the veins,And it burns and flows in the veins,64
742,של אהובתי המכאנית ,Of my beloved machine,Of my mechanical lover,70
743,היא אישתי הלב המכאני שלה,She is my wife Her mechanical heart,She is the wife of her mechanical heart,89
744,תמיד משרת עד שהמוות יפריד בנינו ,Constantly serving till death do us part,Always serves until death do us part,76
745,מלחמתינו המפוארת מגיעה לסופה הרוחות נושבות ,Now our glorious war draws to a close The yellow winds blow,Our glorious war is coming to an end the winds are blowing,72
746,מה שיקרה לי,My God what happened to you ,What will happen to me,69
747,חריצות מה ישקרה לי,My God what happened to you ,Diligence what will happen to me,64
748,לי ,Of me,to me,80
749,לא הבנתי דבר אחד בהצגה:,Well I didn't understand one damn thing in that play ,I did not understand one thing in the show:,70
750,זה היה גרוע פרהק איך אתה יכול להגיד את זה ,How can you say that It was brilliance ,It was a bad freak how can you say that,78
751,זה היה מבריק ,Brilliance ,It was brilliant,62
752,מבריק ,Brilliance ,brilliant,84
753,הם לימדו אותו איך לעשות את זה בשיטת קרנגי זה הכי מוזר  אני לא יכול לעזוב את המחשבה שאני מכיר אותך ,Fifteen cases he bought this afternoon They taught him how to do it at Carnegie Tech It's the strangest thing but I just can't shake the feeling that I know you well ,They taught him how to do it the Carnegie method it's the weirdest I can not leave the thought I know you,62
754,אני יודעת אני מרגישה את אותו דבר למה זה ,I know I feel the same way about you ,I know I feel the same why this is,71
755,אני מניחה שזה לא קשור לעובדה שדיברתי עליכם ללא הרף ,I don't suppose it has anything to do with the fact that I talk about the two of you incessantly ,I guess it has nothing to do with the fact that I talked about you constantly,66
756,אוקיי כולם זהו זה,Okay everybody this is it!,Okay everyone this is it,90
757,בלום היא חנה ארנדט של השירים מי זו ,"""Earth Mother Bloom is a veritable Hannah Arendt of song """,Bloom is Hannah Arendt of the songs Who Is It,70
758,היא זמרת ,Is she a singer ,she is a singer,100
759,-לא  ,No ,-No,100
760,היא  היא סוציולוגית פילוסופית רדיקלית זו חות דעת חיובית ,No a sociologist philosopher radical ,She is a radical philosophical sociologist and this is a positive opinion,64
761,איפה המוזיקה ,Where's the music ,Where's the music?,100
762,-בואו ננגן!,Yeah let's party!,- Let's play!,69
763,לבמאי הנהדר - ג'ון נהדר  ,And to a great director John ,To the great director - John is great,70
764,-בסדר סיסי האם תסכימי להצטלם עם הדודנים שלי ,Okay CC Will you take a picture with my cousins here ,"- Okay, Sisi, would you agree to be photographed with my cousins?",62
765,בסדר עכשיו חייכו ,Good good good Okay now smile ,Okay now smile,65
766,עוד שמפניה סיסי ,More champagne CC ,More Sisi champagne,78
767,את כן ,Yes you are ,Yes you are,100
768,בואי נלך ,Come on let's go ,Let's go,67
769,קחי כוס קפה תשני עד שתתפכחי ,You'll get a cup of coffee ,Take a second cup of coffee until you sober up,61
770,אל תגעי בי!,- Don't touch me! - Shut up!,Do not touch me!,70
771,אגיד לך בפעם האחרונה אני לא ראש כנופייה!,I'll tell you for the last time I wasn't the ringleader!,I'll tell you one last time I'm not a gang leader!,65
772,אלוהים אדירים מה קרה לך ,My God what happened to you ,"My God, what happened to you?",100
773,יצאתי לשחות באגם בסנטרל פארק עם החברים האמיתיים שלי ,I went for a swim in the Central Park boating pond with my real friends ,I went swimming in a lake in Central Park with my real friends,75
774,שכבת איתו ,Did you sleep with him ,You slept with him,85
775,איזו ערמומית ,What a snake ,What a cunning,62
776,אז התאהבתם ,So did the two of you fall in love ,So you fell in love,68
777,אני לא יודעת זה היה רומנטי במידה שלא תאמן ,I don't know It was incredibly romantic ,I do not know it was unbelievably romantic,64
778,הלכנו לכיכר המרכזית שתינו שמפניה הוא האדם הכי מושך שפגשתי אי פעם בחיים שלי ,We went to The Plaza We drank champagne I think he's the most attractive man I've ever met in my life ,We walked to the main square and both of us Champagne is the most attractive person I have ever met in my life,73
779,את והעקרונות הפמניסטים שלך אני יודעת מה את חושבת עליו אני מרגישה חולני בקשר למה שעשיתי ,You and your feminist principles I know how you feel about him I feel sick about what I've done ,You and your feminist principles I know what you think of me I feel sick about what I did,77
780,הראיתי אופי מלא חסרונות ,I showed a complete lack of character ,I showed a character full of flaws,70
781,למשיכה מינית אין קשר לאופי אלא אם כן   ,Sexual attraction has nothing to do with character unless you're Eleanor Roosevelt ,Sexual attraction has nothing to do with character unless,82
782,את אלינור רוזוולט את מתכונת שהיית עושה בדיוק אותו דבר ,You mean you would have done the same thing Me Never ,The Eleanor Roosevelt is the format you would do exactly the same,60
783,אני נשבעת אני לעולם לא אתראה איתו שוב ,- I swear I'll never see him again ,I swear I'll never see him again,100
784,עם מי את צוחקת ,- Where are you going ,Who are you laughing at?,71
785,חוץ מזה מה ההבדל ,Besides what's the difference ,Besides what's the difference,100
786,העובדה היא שהוא אפילו לא יודע שאני חיה ,The fact is he doesn't even know I'm alive ,"The fact is, he does not even know I'm alive",96
787,נראה שהוא משוגע עלייך ,Looks like he's crazy about you ,He seems crazy about you,76
788,מה תעשי ,What do you think ,what will you do,67
789,את רוצה שאעבור דירה ,You want me to move out ,You want me to move,90
790,בשביל מה שארצה שתעברי ,What do I want you to move out for ,For what I want you to go through,75
791,אני התרגלתי אלייך ,I'm used to you ,I got used to you,81
792,חוץ מזה אם זאת לא היית את זו הייתה ילדה אחרת ,Besides if it hadn't been you it would have been some other girl ,Besides if it was not you it would have been a different girl,75
793,עדיין תשקי את העציצים שלי כאשר לא אהיה פה ,Will you still water my plants while I'm gone ,Still water my pots when I'm not here,68
794,לאן את הולכת ,- Where are you going ,Where are you going,100
795,אמרתי לך לסאן פרנסיסקו אבי חולה ,- I told you San Francisco ,I told you my father was sick in San Francisco,69
796,"היי היל ג'ון אומר שאני גדולה מידי ל""פאלקון פלייארס""",Hey Hill John says I'm outgrowing the Falcon Players and I ought to move on ,Hi Hill John says I'm too big for Falcon Players,63
797,ואני צריכה להמשיך הלאה מה את חושבת ,What do I want you to move out for ,And I have to move on with what you think,69
798,אני מצטערת שהיית צריכה לעזוב את עבודתך באגודה לזכויות האזרח אבל  אלוהים אל תכנעי ,I'm sorry you had to let go of your job at the ACLU but jeez don't give up ,I'm sorry you had to quit your job at the Civil Rights Association but God don 't give up,75
799,אביך יהיה בסדר בקרוב ואת תחזרי ,Your father will be better soon and you'll be back ,Your father will be fine soon and you will be back,82
800,סיסי היקרה אני מתגעגעת אלייך ,Dear Ceece I miss you ,"Dear Sisi, I miss you",73
801,אני מתגעגעת לקניות לטיפולים הקוסמטים  מה אני אגיד ,I miss shopping at Bergdorf's I miss our facials What can I say ,I miss shopping for cosmetic treatments what can I say,60
802,עכשיו אני המבוגרת ואבי הוא הילד ,I'm now the adult and my father's the child ,Now I am the oldest and my father is the child,85
803,אני גם מתראה עם עורך דין צעיר מייקל אסקס ,I'm also dating a young lawyer Michael Essex ,"I also see a young lawyer, Michael Essex",84
804,הילרי את לא תאמיני לזה ,Hillary you'll never believe it ,Hillary you will not believe it,81
805,קיבלתי הצעה לשחק בברודוואי ,I got offered a Broadway revue ,I got an offer to play on Broadway,72
806,"ההצגה נקראת ""תסיסה"" הטעם הכי גרוע שיש ",It's called Sizzle It's in the worst possible taste ,"The show is called ""Fermentation"" the worst taste there is",62
807,זה גס מלוכלך ואת יודעת מה ,It's vulgar it's gross it's dirty and you know what ,It's dirty dirty and you know what,73
808,הסתכל! זה חזר ,- Look it came back ,Look! It's back,77
809,בסדר ,- Okay ,OK,67
810,זה מה שאת מקבלת עצרי חכי עצרי ,- That's all you get Stop Wait ,This is what you get stop waiting wait,73
811,אני אוהבת את הצליל ,Stop - I like the sound ,I love the sound,76
812,זה צליל נחמד ,That's all I know ,That's a nice sound,61
813,שמעת משהו מהילרי ,So you hear anything about Hillary ,Did you hear anything from Hillary?,74
