,hebrewFromSub,englishFromSub,englishTranslation,ratio
590,כן וקצת שרימפס בשום ,And some scampi and garlic ,Yes and some shrimp in garlic,69
591,מה שאצליח להשיג קודם אני צריך ללכת ,Whatever I get Earl I first have to get going ,What I can achieve first I have to go,68
592,אביא את המפתחות ,I'll get the keys ,I'll get the keys,100
593,הישאר כאן ותרגיש בבית אחזור בעוד שניה ,Why don't you stay here and make yourself at home ,Stay here and you will feel at home in a second,62
594,אהיה ממש כאן ,I'll be right here ,I'll be right here,100
595,עשיתי אמבטיה ,Took a bath ,I took a bath,92
596,וויק אמר לא להזיז אותו ,Vic said not to move it ,Vic said not to move him,94
597,לקחתי כדור ,Took a pill ,I took a pill,92
598,לעבור דירה גורם לי להרגיש קצת היפר אקטיבית ,Moving always makes me kind of hyper ,Moving apartment makes me feel a little hyperactive,60
599,אני מקווה שאין לך התנגדות ,I hope you don't mind ,I hope you have no objection,61
600,או כן איכפת לך נכון ,What are you doing ,Or do you care right,74
601,וויק יוצא להביא אוכל איטלקי ,Vic's going out for Italian food ,Vic goes out to fetch Italian food,73
602,את תרדי למטה ותצטרפי אלינו כשתוכלי בסדר ,You come down and join us whenever you can okay ,You go downstairs and join us when you can,74
603,למה אתה כל כך עצבני ארל ,What are you so nervous about Earl ,Why are you so nervous Earl?,85
604,אתה פוחד שוויק יחשוב שאתה כאן למעלה  וטוחןאותי ,Afraid Vic will think you're up here chewing me ,You're afraid Vick will think you'm up here and grind me,82
605,מה אתה עושה ,What are you doing ,What are you doing,100
606,שודד אותי ,Robbing me ,Robbery me,70
607,אני מחפש עיפרון לרשום מה אתה רוצה לארוחת ערב ,Looking for a pencil to write down what you want for supper ,I'm looking for a pencil to write down what you want for dinner,85
608,יש לך עיפרון ביד ,You got a pencil in your hand ,You have a pencil in hand,74
609,327 דולר ,$327 ,$ 327,100
610,זה כל מה שהיה לך בסוף החודש שעבר ,Is that all you had at the end of last month ,That's all you had at the end of last month,94
611,זה לא העסק שלך ,That's none of your business ,it's none of your business,85
612,אל תתקרב לשם בבקשה ,Stay out of there please ,Do not go near there please,67
613,רק רציתי לרשום נכון את ההזמנה ,-I just wanted to get the order right ,I just wanted to register the order correctly,81
614,למה שלא נרד למטה ,-Why don't we go downstairs ,Why not go downstairs,81
615,אחרייך ,After you ,After you,100
616,אז מה אתה רוצה ,-So what do you want ,Then what do you want,85
617,לא חשוב תעשה את זה פשוט ,-Make it simple ,"No matter, make it simple",74
618,ספגטי כדורי בשר וסלט ,Spaghetti meatballs a salad ,Spaghetti meatballs and salad,96
619,מה שתרצה בשבילך ו  הדבר היחיד שלא פשוט זה איך אני מגיע למסעדה ,Whatever you want for you and- What's not simple is how I get to the restaurant ,What you want for you and the only thing that is not simple is how I get to the restaurant,81
620,יש לזה מפתח או רצועת גומי  שליפפת שם ,-Has it got a key or a rubber band  ,It has a key or a rubber band that you wrapped there,68
621,למה שלא אבוא איתך ,Oh you met them ,Why not come with you,67
622,אתה פוחד שאגנוב לך את המכונית ,Afraid I'll steal your car ,You're afraid I'll steal your car,88
623,זוהסיבהשעברתילגורכאן ,That's why I moved in next door ,That's why I moved here,74
624,כדי שאוכל לגנוב לך את המכונית ולעבור למקום אחר ,So I could rip off your car and move somewhere else ,So I can steal your car and move somewhere else,78
625,הנה לך ,-There you go ,there you are,80
626,הוופלים משחימים ,Waffles are browning ,The waffles are browned,79
627,זה תמיד מחזה מרהיב ,Always a thrilling sight ,It's always a spectacular sight,62
628,חדשות טובות אניד ,Good news Enid ,Good news Enid,100
629,יש אוכל איטלקי בדרך ,Italian food is on the way ,There is Italian food on the way,90
630,ובכן פחות או יותר ,Well more or less ,Well more or less,100
631,הזמנתי את השכנים ,I invited the neighbors ,I invited the neighbors,100
632,או פגשת אותם ,Oh you met them ,Or did you meet them,80
633,מה דעתך ,What did you think ,What do you think,91
634,ארל ,Earl ,Earl,100
635,הם  שונים ,They're different ,They are different,80
636,אעלה למעלה להתלבש ,I guess I'll go up and get dressed ,I'm going upstairs to get dressed,66
637,בשביל מה ,What for ,for what,100
638,אמרת שהם באים לכאן ,You said they were coming over ,You said they were coming here,93
639,הם לא מתלבשים ,Well they're not dressing ,They do not dress,67
640,הם בקושי לבושים ,They're barely dressed ,They are barely dressed,84
641,כלומר את יכולה ללכת למטבח ולהכין את השולחן ,I mean you could go in the kitchen and set the table ,That means you can go to the kitchen and set the table,81
642,ולהוציא את הוופלים ,And turn the waffles off ,And take out the waffles,75
643,אבוא בעוד רגע לעזור לך ,I'll be there in a minute to help you ,I'll come in a moment to help you,77
644,כן יש משהו ששכחתי לעשות ,Yeah there is something I forgot to do ,Yes there is something I forgot to do,96
645,רוצה קצת סטייק ,You want some steak ,Want some steak,88
646,אל תגלי לי את בוודאי השכנה החדשה שלנו ,Don't tell me you must be our new neighbor ,Do not reveal to me surely our new neighbor,66
647,מישהו גנב את הרכב שלנו  ואני צריכה להשתמש בטלפון כדי להתקשר למשטרה ,Someone's stolen our truck and I need to use the phone to call the police ,Someone stole our car and I have to use the phone to call the police,85
648,השתמשי בטלפון שבמטבח ,Use the phone in the kitchen ,Use the phone in the kitchen,100
649,איזה דבר נורא ביום הראשון שלך ,What a terrible thing your first day ,What a terrible thing on your first day,96
650,זה אפילו יותר גרוע מזה ,It's even worse than just that ,It's even worse,67
651,ויק ,Vic ,Vic,100
652,התינוקשלךטובע!,Your baby's drowning!,My baby is drowning!,87
653,למה שהכלב שלי יטבע ,Why should my dog be drowning ,Why would my dog ​​drown,71
654,כלב ,Dog ,Dog,100
655,חשבתי שזה ילד ,Baby was in the back ,I thought it was a boy,62
656,אין לנו ילדים ,We haven't any children ,We have no children,81
657,אלא אם כן רמונה הפליצה אחד  ולא סיפרה לי ,Unless Ramona just pumped one out and didn't tell me ,Unless Ramona farted one and did not tell me,77
658,"""היא קוראת לכלב ""תינוק ","She calls the dog "" Baby ""","""She calls the dog"" a baby",96
659,"""היא קוראת לכלב ""תינוק ","She calls the dog "" Baby ""","""She calls the dog"" a baby",96
660,הוא בסדר ,He's fine ,he is fine,95
661,ראיתי אותו שם מאחור כשנסעתי משם ,I just saw him around the back there When I drove up ,I saw him there in the back as I drove away,74
662,הוא חופר שם משהו בערוגת הפרחים שלך ,He's digging up something in your flowerbed ,He's digging something in your flower bed there,84
663,בערוגת הפרחים שלי ,My flowerbed ,In my flower bed,64
664,היי אניד ,Hi Enid ,Hi Enid,100
665,או נפגשנו לפני שעות ,Oh we met hours ago ,Or we met hours ago,95
666,ארל היה מודאג בקשר לתינוק ,Earl here was worried about Baby ,Earl was worried about the baby,95
667,או הוא בכלל לא מהווה בעיה ,Oh he's no trouble at all ,Or it is not a problem at all,67
668,הוא ג'נטלמן מושלם ,He's a perfect gentleman ,He is a perfect gentleman,90
669,השאר אותו איתי מתי שתרצה ,-Leave him with me any time you want ,Leave it with me whenever you want,70
670,אל תדאגי אעשה זאת ,-Don't worry I will ,Do not worry I will do it,79
671,אני רוצה שהוא יזכה בכל פינוק שנמנע ממני ככלב צעיר ,I want him to have every advantage I was denied as a young dog ,I want him to get every treat he avoids as a young dog,71
672,הנה המפתחות שלך מר קייס ,Well here are your keys Mr Keese ,Here are your keys Mr. Case,72
673,בואו נחפור בחומר הזה לפני שהרוטב הופך לפניצילין ,Let's dig into this stuff before the sauce turns into penicillin ,Let's dig into this material before the sauce turns into penicillin,89
674,למה שלא תחפש את רמונה ,Why don't you Look for Ramona ,Why not look for Ramona,73
675,המוצא זוכה ארל ,-And the wine ,The origin wins Earl,62
676,אחרי הכל  אני יודע מה קורה בפרברים ,After all I know what goes on out here in the suburbs ,After all I know what's going on in the suburbs,86
677,זו הסיבה שעברנו הנה ,That's why we moved here ,That's why we moved here,100
678,או וויק ,Oh Vic ,Or wick,62
679,מה דעתך ארל ,-What do you think Earl ,"What do you think, Earl?",100
680,אל תעשה את זה אתה מזעזע ,-Don't do that You are outrageous ,Do not do it you are shocking,62
681,חבל על הרכב של וויק ארל ,Too bad about Vic's truck Earl ,Too bad for Vic Earl's vehicle,67
682,רק דחפתי אותו למוסך שלי  להחביא אותו את מבינה סתםבדיחהכזו ,Well I was just pushing it into my garage to hide it from him you know kind of a joke ,I just shoved it into my garage to hide it and you just understand such a joke,67
683,זו הייתה תאונה ,-It was an accident ,It was an accident,100
684,זה יכול לקרות לכל אחד ,-It could happen to anybody ,It can happen to anyone,78
685,דולרים ,Dollars ,Dollars,100
686,זו הייתה רק בדיחה ,It was just a joke ,It was just a joke,100
687,כלומר אני בטוח שהביטוח שלכם יכסה את הרוב  ואני אשלם את ההשתתפות העצמית  ,I mean I'm sure your insurance will cover most of it and I'll pay the deductible ,I mean I'm sure your insurance will cover the majority and I will pay the deductible,82
688,לגרום לי לשתוק זה תשלום נוסף ,Keeping me quiet is a little extra ,Making me shut up is an extra charge,60
689,אני לא מאמין ,I don't believe it ,I do not believe,82
690,את סוחטת אותי ,You're blackmailing me ,You're blackmailing me,100
691,היי בשביל מה יש שכנים ,Hey what are neighbors for ,Hey what are neighbors for,100
692,ושיהיה במזומן ,-And the wine ,And be in cash,62
693,ובכן הנה כולנו כאן ,Well here we all are ,Well here we are all here,89
694,לחיי וויק ורמונה ,To Vic and Ramona ,To the life of Vic and Ramona,74
695,שהביאו משב רוח רענן לשכונה שלנו ,For bringing a breath of fresh air to our neighborhood ,Which brought a fresh breeze to our neighborhood,69
696,הלואי ויהיו לנו המון שנים של חברתכם הנעימה ,May we have many many years of your lovely company ,I wish we had many years of your pleasant company,67
697,ששם עושים דברים למשל כמו לבדוק לאיזהפריש את הביציםהכי גדולות ,Where they do things Like see which bull has the biggest balls ,"That's where things are done, for example, like checking which one has laid the largest eggs",62
698,זה יותר מעין פרבר שינה קהילתי ,It's more a suburban bedroom community ,It's more of a community sleeping suburb,72
699,המקומיים הם בעיקר סוחרים ,The locals are in service trades ,The locals are mostly merchants,60
700,הם לא בעלי חוות ,They're not farmers ,They do not own farms,75
701,אולי נוכל למדוד להם את הביצים ,Maybe we can measure their balls ,Maybe we can measure their eggs,83
702,או שנוכל להתחיל עם שלך אם תרצה ,Or we could start with yours if you Like ,Or we can start with yours if you like,92
703,זה טוב נכון ,That's right ,That's good right,83
704,אני חייב להתקשר לקיסר  ולהחמיא לשף ,-Delicious -I must call Caesar's and compliment the chef ,I must call the emperor and compliment the chef,77
705,מה ,-What ,what,100
706,הקיסר ,They're not farmers ,The emperor,60
707,יום שישי בערב המקום היחיד בעיירה ,Friday night the only place in town ,Friday night the only place in town,100
708,בסדר בוודאי התקשרת לשם  וגילית שהם עדיין לא פתוחים לקהל נכון ,Okay you probably called the place and found out they're not open for business yet right ,Okay you must have called there and found out they are not yet open to the right audience,70
709,נכון ,Right ,Right,100
710,אז זה הופך אותי לשקרן ,So does that make me a liar ,So that makes me a liar,88
711,אולי הגעתי לשם ראיתי שהמקום סגור  והלכתי למקום אחר להביא את האוכל ,Maybe I got there saw the place was closed and went somewhere else to pick up the food ,Maybe I got there I saw the place was closed and went somewhere else to get the food,92
712,איפה ,Where ,where,100
713,הכל סגור בשעה כזו ,Everything's shut at this hour ,Everything is closed at such an hour,73
714,הכל ,Everything ,Everything,100
715,והיין ,-And the wine ,And the wine,100
716,מה העניין ,-What's the matter ,what is the deal,73
717,וויק הביא ארוחה נפלאה ואתה מעביר אותו חקירה ,Vic brings a wonderful dinner and you give him the third degree ,Vic brought a wonderful meal and you pass him an investigation,61
718,אין בזה שום מיסתורין ,There's no mystery about it ,There is no mystery in this,70
719,יש שם חנות קטנה לספגטי ויין ,There's a small spaghetti and wine dealership there ,There's a small spaghetti and wine shop there,88
720,ליד מרכז התפירה שך זינגר ,Next to the Singer Sewing Centre ,Near Singer's sewing center,75
721,שם השגת את זה ,That's where you got it ,There you got it,82
722,נכון ,Right ,Right,100
723,נתחיל בזה שהוואלי פילד מול סגור ,Well to begin with Valley Field Mall is closed ,Let's start with the fact that the Valley Field is closed,60
724,וכשהואהיהפתוח זה היה בכביש חמש עשרה ולא שלוש ,When it was open it was on Route 15 not Route 3 ,And when it was open it was on road fifteen and not three,73
725,ולא יכולה להיות חנות ספגטי קטנה  ליד מרכז התפירה של זינגר ליד קולנוע סינפלקס   בגלל שאין שום קולנוע סינפלקס ואין שום מרכז תפירה של זינגר ,And there can't be a small spaghetti dealership next to the Singer Centre across from the Cineplex because there is no Cineplex and there is no Singer Sewing Centre ,And there can be no small spaghetti shop near Singer's sewing center near Synflex Cinema because there is no Synflex cinema and no Singer sewing center,70
726,כן כן כן אני מודה ,Yes yes yes I admit it ,Yes yes yes I admit,93
727,אני הכנתי את הארוחה   כדי לחלוק את הלילה הראשון שלנו יחד עם שכנינו ,It was me who prepared this meal to share on our first night together as neighbors ,I prepared the meal to share our first night with our neighbors,80
728,הכנתי תערובת מיוחדת סודית ומקודשת  של רוטב ספגטי של דודתי מינוטה מצטער שדפקתי לכם את הערב נכון מותק ,Mixing up a special batch of my Aunt Minota's secret sacred spaghetti sauce ,I made a special secret and sacred mixture of spaghetti sauce from my aunt Minuta sorry I knocked you out tonight right baby,67
729,נכון ,Right ,Right,100
730,לאור התחושות של ארל אני חושב שעדיף שנעזוב ,In light of Earl's feelings I think it would be best if we left ,In light of Earl's feelings I think it's better for us to leave,78
731,או לא לא ,Oh no no ,Or not no,82
732,בואו נסיים את הארוחה הנפלאה הזו ,Let's finish this magnificent meal ,Let's finish this wonderful meal,67
733,אל תדאג בקשר לארל ,Don't worry about Earl ,Do not worry about Earl,93
734,הוא יתגבר על התחושות שלו ,He'll get over his feelings ,He will overcome his feelings,71
735,הוא זילזל ברוטב שלי ,-He spurned my sauce ,He underestimated my sauce,71
736,לא הוא אוהב את הרוטב שלך ,-No he loves your sauce ,No he likes your sauce,91
737,הוא מקנא כי הוא לא יודע לבשל ,He's just jealous he can't cook ,He is jealous because he does not know how to cook,62
738,ארל האם לא הגיע תורך לעשות ווידוי קטן ,Earl isn't it your turn to do a Little confessing ,Earl Mother it was not your turn to make a small confession,69
739,מה ,-What ,what,100
740,וויק היה מספיק גבר כדי להודות  שהוא זה שבישל את הארוחה ,-Vic's been man enough to admit he was the one who cooked supper ,Vic was man enough to admit he was the one who cooked the meal,82
741,אין לך שום דבר להגיד ,You've got nothing to say ,You have nothing to say,79
742,אינני חושב שזה נחוץ ,I don't think that'll be necessary ,I do not think it is necessary,72
743,יש ביננינו הסכם נכון ,We do have an agreement don't we ,We have the right agreement,71
744,אני מדברת על מה שעשית בחוץ ,I'm talking about what you did outside ,I'm talking about what you did outside,100
745,כן רמונה אני מכיר ומקבל אתהדבריםשציינת ,Yes Ramona I know and I accept the figures you mentioned ,Yes Ramona I know and accept the things you mentioned,84
746,דברים ארל ,""" Figures "" Earl ",Earl's things,64
747,רק איזה הסדר קטן שיש לי עם רמונה ,Just a Little arrangement I have with Ramona ,Just what a small arrangement I have with Ramona,80
748,איזה מין הסדר ,What sort of arrangement ,What kind of arrangement,79
749,אנחנו מחכים ,We're waiting ,We wait,70
750,או שאאלץ לסחוט את זה ממך ,Or do I have to pound it out of you ,Or I'll have to squeeze it out of you,78
751,אל תדבר אלי בצורה כזו בבית שלי ,Don't speak to me Like that in my own house ,Do not talk to me in this way in my house,71
752,הרגע עשית ,-You just did ,You just did,100
753,אני אף פעם לא מדבר ככה אני לא מאשים אותך ,-I never say it -I don't blame you ,I never talk like that I do not blame you,77
754,רמונה  למה שאת לא תהיי מספיק גבר לספר לנו מכיוון שארל הוא לא ,-Ramona why don't you be man enough to tell us since Earl isn't ,Ramona why you will not be a man enough to tell us because Charles is not,70
755,הוא ניסה לאנוס אותי ,He tried to pork me ,He tried to rape me,84
756,לאנוס אותך ,Pork you ,Rape you,62
757,מה ,-What ,what,100
758,!,!,!,100
759,אתה יודע שניסית ,You know you did ,You know you tried,71
760,אני נשבע אף פעם לא נגעתי בה ,I swear I never touched her ,I swear I never touched her,100
761,ובכן לא נולדתי עם הידיים שלך בשיח שלי ,Well I wasn't born with your hand in my bush ,Well I was not born with your hands in my discourse,86
762,אניד עיזרי לי ,Enid help me ,Enid helped me,92
763,תגידי להם שלא יכולתי לעשות דבר כזה ,Tell them I couldn't do something Like that ,Tell them I could not do such a thing,62
764,בוא נשאיר את זה למשטרה ,-Let's Leave that to the police ,Let's leave it to the police,86
765,וויק היא לא הטיפוס שלי ,-Vic she's not my type ,Vic is not my type,77
766,אניד תגידי לארל שתהיה לו הזדמנות להגן על עצמו ,Enid you tell Earl he'll have a chance to defend himself ,Enid will tell Earl that he will have a chance to defend himself,83
767,נדמה לי שאתם יכולים להבין מדוע עלינו לעזוב ,I think you can see why we have to Leave ,I think you can understand why we have to leave,83
768,אני יודע שהיו לכם כוונות טובות נכון ,And you hated it right ,I know you had good intentions right,62
769,יכולה הייתה להיות לנו מערכת יחסים נפלאה ,We might have had a wonderful relationship ,We could have had a wonderful relationship,86
770,אבל אז כפי שארתור ברמר אמר:,But then as Arthur Bremer once said:,But then as Arthur Bremer said:,92
771,כמה דברים כבר מסתדרים נכון בעולם המטורף הזה ,""" How many things go right in this crazy world """,Some things are already getting right in this crazy world,69
772,רמונה בואי נלך ,Ramona let's go ,"Ramona, let's go",100
773,בואי לפני שהוא נעשה מסוכן ,Come on before he gets dangerous ,Come before it gets dangerous,89
774,חשבתי שתהיה לי הזדמנות להגן על עצמי!,-I thought I'd be able to defend myself!,I thought I would have a chance to defend myself!,74
775,לא כל כך בקול רם ארל ,-Not so loud Earl ,Not so loud Earl,100
776,פוחדת שנפריע לשכנים ,Afraid we'll disturb the neighbors ,Afraid we will disturb the neighbors,89
777,אלה השכנים הארורים שלנו!,These are the goddamn neighbors!,These are our damn neighbors!,85
778,הירגע ארל ,""" Figures "" Earl ",Relax Earl,64
779,זה יגרום ליחסי איבה ,We might have had a wonderful relationship ,It will cause a hostile relationship,64
780,אני נשבע באלוהים אניד אולי נצטרך לעבור דירה ,I swear to God Enid we may have to move ,I swear to God Enid might have to move apartment,78
781,הם אנשים מאוד מוזרים ,They're very strange people ,They are very strange people,87
782,אחרי חמש הדקות הראשונות אחרי שפוגשים מישהו  אפשר לדעת הכל עליהם ,You know how after five minutes when you meet someone you know everything about them ,After the first five minutes after meeting someone you can know everything about them,76
783,מה הם עושים את שם המשפחה שלהם ,What they do their last name ,What they do their last name,100
784,איננו יודעים כלום עליהם ,We know nothing about them ,We know nothing about them,100
785,אז מה ,-So what ,So what,100
786,אז למה את לא אומרת משהו ,-So why didn't you say something ,So why do not you say something,87
787,היית בתוך הבית משך כל הזמן שהאישה הייתה כאן ,You were in the house the whole time she was here ,You were inside the house the whole time the woman was here,89
788,חוץ מזה את יודעת כמה זמן לוקח לאנוס מישהי ,Besides you know how Long it takes to pork someone ,"Besides, you know how long it takes to rape someone",94
789,לא כמה זמן זה לוקח ארל ,No how Long does it take Earl ,Not how long it takes Earl,87
790,את אומרת שאת מאמינה לה ,Are you saying you believe her ,You say you believe her,87
791,אניד אני אותו אדם שאת מכירה כבר שש עשרה שנים ,Enid I'm the same man you've known for 16 years ,Enid I'm the same person you've known for sixteen years,82
792,אני יודעת ,I know ,I know,100
793,מה לעזאזל קורה כאן ,What the hell's going on around here ,What the hell is going on here,82
794,הוא נכנס הנה בצעד קליל ואת אומרת: היי וויק ,"He comes waltzing in and you say "" Hi Vic """,He comes in here in a light step and you say: Hi Wick,66
795,איך ידעת את שמו ,-How did you know his name ,How did you know his name?,100
796,הוא בא הנה אחר הצהריים ,-He came over this afternoon ,He came here in the afternoon,82
797,לא הייתה לי הזדמנות לספר לך ,I didn't have a chance to tell you ,I did not have a chance to tell you,96
798,יכולת לספר לי במכונית ,-You could've told me in the car ,You could tell me in the car,85
799,אתה יודע שאנחנו לא מדברים במכונית ,-You know we never talk in the car ,You know we do not talk in the car,87
800,היום יכולת לחרוג מזה ,Today you could've made an exception ,Today you could go beyond that,64
801,הבית שלידינו היה ריק במשך שישה חודשים ואת פגשת  את הדיירים החדשים לפני ולא מצאת לנכון לספר לי כלום ,That house next door is empty for six months and you meet the new occupants before I do and you don't say anything ,The house next to us was empty for six months and you met the new tenants before and did not find it appropriate to tell me anything,72
802,אתה סיפרת לי על כל מי שפגשת היום ,Did you tell me everybody you met today ,You told me about everyone you met today,71
