,hebrewFromSub,englishFromSub,englishTranslation,ratio
332,והעוגייהלאבעמדהשללדעת עלכך  זהדומהלכלסוג שהואשלנבואה  אוסימן או אות ,And I mean you know it's the same  with any kind of uh prophecy or a sign or an omen ,And the cookie to the position of knowing that it is similar to any type of prophecy or a sign,63
333,כיאםאתהמאמיןבאותות אזזהאומרש  ,Because if you believe in omens then that means that the universe -,Because if you believe in signals then it means that,75
334,שהעולם  אניאפילולא יודעאיך להתחיללתאר אתזה ,I mean I don't even know how to begin to describe this ,That the world I do not even know how to begin to describe it,83
335,זה אומר שהעתיד מוסר מסרים איכשהו לאחור להווה!,That means that the future is somehow sending messages  backwards to the present ,This means that the future is somehow sending messages back to the present!,93
336,מה שאומר שהעתיד חייב להתקיים כעת באופןמסוייםכי לשלוחלנו מסריםמסוג זה ,Which-Which means that the future must exist in some sense already  in order to be able to send these messages ,Which means that the future must exist now in a certain way for us to send messages of this kind,73
337,וזה גם אומר שהדברים ביקום נמצאים שם יש יעוד לתת לנו מסרים בעודשאניחושבשהיקוםפשוט נמצא ,And it also means that things in the universe are there for a purpose - to give us messages Whereas I think that things in the universe are just there ,And it also means that things in the universe are there and there is a purpose to give us messages while I think the universe is just there,89
338,איןלמסריםאלושום משמעות ,I mean they don't mean anything ,The messages do not mean anything,81
339,ולהחליט אם לשלוח ספינות למלחמה עלבסיסמקרהזה נראהליכטעות גדולה ,And-And to decide whether to send my ships off to war on the basis of that  seems a big mistake to me ,And decide whether to send ships to war on the basis of this case seems to be a big deal,78
340,ובכן על איזו אינפורמציה תשלח את הספינות למלחמה ,Well what information would you send your ships to war on ,Well on what information will send the ships to war,83
341,משוםשאםהכלחסר משמעות מה ההבדל אם אתה מסכים למסרמעוגייתמזל  או לסטטיסטיקה של קרן פורד ,Because if it's all meaningless  what's the difference whether you accept the fortune cookie  or the statistics of the Ford Foundation ,Because if the meaningless thing is the difference if you agree with the fortune teller message or the Ford Foundation statistics,79
342,בעוד שקבוצת עובדות חסרות משמעות הנאספותומפורשותבהליךמדעי עלולהכןלהיותרלונטית ,Whereas a group of meaningless facts that are collected and interpreted  in a scientific way may quite possibly be relevant ,While a set of meaningless facts collected and explained in a scientific procedure may be more relevant,70
343,משום שהדבר הנפלא בתיאוריות מדעיותהואשהןמבוססותעלניסיונות  ניתן לחזור עליהם!,Because the wonderful thing about scientific theories about things  is that they're based on experiments that can be repeated ,Because the wonderful thing about scientific theories is based on experiments that can be repeated!,88
344,ובכן זהנכון וואלי ,Well it's true Wally ,Well that's true Valley,74
345,'אני מתכוון אתה יודע לעקוב אחר אותות וכו זהכנראהדרךלגרוםלעצמנולהתנתק כך שלא נצטרך לקבל על עצמנו אחריותאישיתלמעשנו ,I mean you know following omens and so on  is probably just a way of letting ourselves off the hook  so that we don't have to take individual responsibility for our own actions ,'I mean you know how to keep track of signals etc. This is probably a way to make ourselves disconnected so we do not have to take personal responsibility for our actions,71
346,אני מתכוון למסור את עצמך לתת מודע עלול להותיר אותך פגיע וחשוף לכלמינימניפולציותמפחידות ,But I mean giving yourself over to the unconscious  can leave you vulnerable to all sorts of very frightening manipulation ,I intend to dedicate yourself to giving aware may leave you vulnerable and exposed to scary manipulative manipulations,64
347,ובכל העבודות בהן הייתי שותףהייתהקיימתסכנהזו ,And in all the work that I was involved in there was always that danger ,"And in all the works in which I was a partner, there was this danger",71
348,ותמידהייתההשאלהשלההתערבותבחייאנשים משוםשאםאובילאחת מסדנאותאלו אזאניהופךלקצתלרופא קצתתרפיסטוקצתכומר ,And there was always that question of tampering with people's lives  because if I lead one of these workshops then I do become partly a doctor  and partly a therapist and partly a priest ,"And there has always been the question of intervening in people's lives, because if I lead one of these workshops, I will become a bit of a doctor.",68
349,"אתה יודע יש את אלו האליטיסטים פראנוידיםהמרוציםמעצמםהגדלים יוצרים תחושה של ""והם"" ו ""אנחנו"" זהמאודמבלבל ","You know there's a sort of self-satisfied elitist paranoia that grows up - a feeling of""them"" and ""us"" - that is very unsettling ","You know there are those paranoid elitists who are self-satisfied and the sizes create a sense of ""and they"" and ""we"" that is very confusing",64
350,העניין הוא וואלי שהסגידה המוגזמת למדעמכניסהאותנולמצבזה ,But I mean uh the thing is Wally I think it's the exaggerated worship of science  that has led us into this situation ,"The thing is, Wally, the excessive worship of the tears brings us into a state of disrepair",60
351,אני מתכוון מדע הוצג לנו ככוח קסוםשאיכשהויפתורכלדבר ,I mean science has been held up to us as a magical force  that would somehow solve everything ,I mean science has been presented to us as a magical power that somehow has to solve everything,80
352,אז זה מה שבאמת מוביל לתגובה חזקה ועמוקהנגדהמדעשאנורואיםעכשיו  כמו השטנה הנאצית בשנות שהתפתחה בשנות השלושים בגרמניה הייתה כנראה תגובה נגד סוג הידע והתרבות הרודניים וחשיבהראציונלית ,So that is what has really led I think  to this very strong deep reaction against science that we're seeing now  just as the Nazi demons that were released in the '30s in Germany  were probably a reaction against a certain oppressive kind of knowledge  and culture and rational thinking ,So this is what really leads to a strong and profound reaction against the Madanas and now as Nazi hatred in the years that developed in the 1930s in Germany there was probably a reaction against the kind of tyrannical knowledge and culture and rational thinking,76
353,אז אני מסכיר שאנו מדברים על אפשרותל משהומאודמסוכן אבל מדע עכשוי לא ממש פחות מסוכן,So I agree that we're talking about something potentially very dangerous But modern science has not been particularly less dangerous Right ,So I'm suing that we'm talking about the possibility of something very dangerous but contemporary science is no less dangerous,70
354,נכון אנימסכיםאיתך אנימסכים לגמרי ,Well I agree with you I completely agree ,True I agree with you I totally agree,70
355,אתהיודע האמת היא אני חושב שאני יודע מה באמת מפריע לי בעבודה שתיארת,No you know the truth is  I think I do know what really disturbs me about the work you've described  and I don't even know if I can express it ,You know the truth is I think I know what really bothers me in the job you described,69
356,אבל איכשהו נראה שכל העניין בעבודה שעשיתבאותןסדנאות כשאתה יורד לעומק העניין ואתה שואל:,But somehow it seems that the whole point of the work that you did in those workshops  when you get right down to it and you ask what was it really about -,But somehow it seems that the whole point of the work you have done in those workshops is when you go into the depths of the matter and you ask:,79
357,והנקודה בעניין שאז יכולתם כולכם לחוות איכשהו מעיןקיוםטהור ,And the point of it was so that you would then all be able to experience  somehow just pure being ,And the point is that then you could all experience some kind of pure existence,72
358,במיליםאחרות ניסיתםלגלותאיךזהיהיהלחיות  למשך כמה רגעים מבלי שיהיה  משהוספציפישעליכםלעשות ,In other words you were trying to discover what it would be like to live for certain moments  without having any particular thing that you were supposed to be doing ,"In other words, you tried to find out how it would be to live for a few moments without having anything specific for you to do.",69
359,ואניחושבשאניפשוטמתנגדלזה ,And I think I just simply object to that ,And I think I'm just opposed to that,76
360,אני מתכוון אני לא חושב שאני מקבל את הרעיון שאמורים להיות רגעים שבהם אתהלאמנסהלעשותמשהו ,I mean I just don't think I accept the idea that there should be moments  in which you're not trying to do anything ,I mean I do not think I get the idea that there should be moments when you try to do something,77
361,אניחושב שמטבענולעשותדברים אניחושבשעלינולעשותדברים ,[ Chuckling ] I think uh it's our nature uh to do things I think we should do things ,I think it's natural to do things I think we should do things,84
362,זה כמו לומר שעץ מסוגל להתקיים מבליענפיםאו שורשים אבללמעשה מבליענפיםושורשים לאיהיהעץ ,And to say that we ought to be able to live without it  is like saying that uh a tree ought to be able to live without branches or roots But - But actually without branches or roots it wouldn't be a tree ,"It's like saying that a tree can exist without branches or roots, but in fact without branches and roots to the tree.",65
363,אתה מבין למה אני מתכוון ,I mean what would that mean ,You know what I mean,68
364,במיליםאחרות אם אנייושבבבית ואין לידברלעשות באופןטבעיאניקוראספר ,And in all the work that I was involved in there was always that danger ,In other words if I live in a house and there is no way to do it in a natural way,63
365,מה יכול להיות כל כך נהדר בפשוט לשבת שם ולעשות כלום ,I mean what would be so great about just sitting there and uh doing nothing It just seems absurd ,What could be so great about just sitting there and doing nothing,73
366,זהנראהאבסורדי ואם דבי שם ,And if Debby is there ,This seems absurd and if Debbie is there,66
367,אזזהאותוהדבר אנימתכון   האםישנובאמתמצב שבו   שני אנשים לא עושים דבר אלא רק נמצאים ביחד  ,Well that's just the same thing I mean is there really such a thing as uh  two people doing nothing but just being together ,I'm going to do this and that's an anime recipe is really a situation where two people do nothing but are just together,69
368,"האם אז הם ""מתאחדים"" להשתמש במילה שבה כולנו משתמשים ","I mean would they simply then  be uh ""relating "" to use the word we're always using ","Do they then ""unite"" to use the word we all use",61
369,אני מתכוון  אתה מבין מה אני אומר ,I mean do you see what I'm saying ,I mean you understand what I'm saying,80
370,מה זה אומר פשוט רק לשבת שם ,I mean what does it mean to just uh simply uh sit there ,What does it mean to just sit there,78
371,למה שזה לא ילחיץ אותי ,I mean what would that mean ,Why it would not stress me,64
372,זה פשוט נראה לי מגוחך!,It just seems ridiculous to me ,It just seems ridiculous to me!,100
373,זהמעניין וואלי ,That's interesting Wally ,It's interesting Valley,77
374,אתה יודע שהייתי בלאדק במערב טיבטושהייתיחודשבחווה ושם אתהיודע כשאנשיםמגיעיםבערבלתה ,You know when I went to Ladakh in western Tibet and stayed on a farm for a month  well there you know when people come over in the evening for tea nobody says anything ,You know I was in Ladek in western Tibet and I was a month on the farm and there you know when people come in the heat,73
375,אנימתכוון אתהעושהאתכל הדבריםהאלה אבל האם אתה עושה אותם כי אתה באמת מרגיש דחף לעשות אותם או שאתה עושה אותם באופןמכני כפישאמרנוקודם ,I mean you're doing all these things but are you doing them  because you really feel an impulse to do them  or are you doing them mechanically as we were saying before ,I mean you do all these things but do you do them because you really feel the urge to do them or do you do them mechanically as before?,82
376,כיאניבאמתחושבשאםאתהחי רקבאופןמכני אזאתהחייבלשנותאתחייך ,Because I really do believe that if you're just living mechanically  then you have to change your life ,"When I really think that if you live only in a mechanical way, then you have to change your life.",76
377,אתהיודע שאתהצעיר אתהיוצאלפגישותכלהזמן אתההולךלרקודאומשהו אתהמרגיש חופשי ,I mean you know when you're young you go out on dates all the time You go dancing or something You're floating free ,"You know you're young, you're going out for meetings, all the time you're going to dance, or something, you feel free.",82
378,ואזיוםאחד אתה מוצאעצמך במערכתיחסים  ופתאוםהכלקופא ,And then one day suddenly you find yourself in a relationship  and suddenly everything freezes ,And suddenly one you find yourself in a relationship and suddenly everything freezes,95
379,ואתיכולהלהיותהאמתגםבעבודתך ,And this can be true in your work as well ,And I can be the truth in your work,79
380,אנימתכוון ברורשאםאתהבאמתחי בפנים אזכמובןשאיןבעיה אםאתהחי עם מישהובחדרקטן  וישנם חיים המתרחשים בינך  ,I mean if you're living with somebody in one little room  and there's a life going on between you and the person you're living with  well then a whole adventure can be going on right in that room ,I mean obviously if you really live inside I will of course have no problem if I live with someone in a small room and there is life going on between you,61
381,אבלתמידקיימתהסכנהשהדבריםעלוליםלמות ,But there's always the danger that things can go dead ,But there is always a danger that things could die,82
382,אניבאמתמאמיןבזה ,I really believe that ,I really believe in that,93
383,זהלאכזהנהדרלבלותאתחייךבדרכים ההעדפהשליהיאלהישארבחדר הזהאםאתה יכול ,You know it's not that wonderful to spend your life on the road My own overwhelming preference is to stay in that room if you can ,It's such a wonderful way to smile in your preferred ways to stay in this room if you can,63
384,עכשיו אניממשלאמסכיםעםזה ,Now I totally disagree with that ,Now I do not agree with it,62
385,אבל אני חושב שעליך לשאול את עצמך בעקביות ובמלוא הכנות:,But I do think that you have to constantly ask yourself the question with total frankness:,But I think you need to ask yourself consistently and sincerely:,64
386,האם נישואיך עדיין נישואין ,Is your marriage still a marriage ,Is your marriage still a marriage,100
387,האם יש הערך הסקרמנטי שם ,Is the sacramental element there ,Is there the sacramental value there,71
388,ממש כמו שאתה שואל אם ישנוערךדומהבעבודתך האם הוא עדיין ישנו שם ,Just as you have to ask about the sacramental element in your work- Is it still there ,Just like you ask if there will be a similar youth in your work if he still sleeps there,66
389,לא חייתי אני שיחקתי!,What kind of things did I like ,I did not live I played!,60
390,שיחקתיאתתפקידהאבא שיחקתיאתתפקידהבעל שיחקתיאתתפקידהחבר ,- I've acted the role of the father I've acted the role of the husband I've acted the role of the friend ,I played the role of the father I played the role of the husband I played the role of the friend,76
391,לאבאמתשמעתיאותם ,I haven't really heard them ,To my father I heard them,65
392,לאבאמתהייתיאיתם ,I really believe that ,I really wanted them,63
393,לאתבחיןבזה לא אתה לאתבחיןבזה ,And it wouldn't be noticed no It wouldn't be noticed ,To notice it is not you to notice it,70
394,כשהייתיבישראללא מזמן ,I mean when I was in Israel a little while ago -,When I was in Israel not long ago,71
395,אני מתכוון  יש לי את התמונה הזאת של צ 'יקיטהשצולמהכאשר  אניתמידנושאאותהאיתי  ,I mean I have this picture of Chiquita that was taken when she - I always carry it with me It was taken when she was about 26 or something ,I mean I have this picture of Chikita taken when I'm always carrying it with me,69
396,תמיד הסתכלתי בתמונה וחשבתי רקעלכמהסקסיתהיאנראית ,And I've always looked at that picture and just thought about just how sexy she looks ,I always looked at the picture and thought only of how sexy she looked,76
397,ואזשנהשעברהבישראל הבטתיבתמונהוהבנתי   שהפניםהאלובתמונה   הםהפניםהעצוביםביותרבעולם ,And then last year in Israel I looked at the picture  and I realized that that face in the picture was the saddest face in the world ,Vazhana in the past in Israel I looked at the picture I realized that the white face in the picture is the saddest face in the world,83
398,ואזבנקודהמסויימתהבנתישנעלמתי  לשמונהעשרהשניםיקרותמבלי להרגיש מלבדבמצביםקיצונייםבמיוחד ,And then at a certain point  I realized I'd just gone for a good 1 8 years unable to feel  except in the most extreme situations ,"And at a certain point, I realized that I had disappeared for eighteen years, without feeling other than in particularly extreme situations.",71
399,זאתהסיבהשהייתימכורלעבודה חשבתי שכל מחזה שעשיתי הואענייןשל חייאומותי ,That was why I was such a work junkie That was why I felt that every play that I did was a matter of my life or my death ,That's why I was addicted to work. I thought every play I did was a matter of my life,74
400,אבלבחייהאמיתייםהייתימת ,But in my real life I was dead ,But in real life I was orphaned,75
401,אפילולאהרשתילעצמילכעוסאולהתרגז ,I mean I didn't even allow myself to get angry or annoyed ,I did not even allow myself to be angry and upset,70
402,אנימתכוון אתהיודע היום  צ 'יקיטה ניקולאס מרינה  כלהיום כמושאר האנשים  ,I mean you know today Chiquita Nicolas Marina - All day long as people do they do things that annoy me and they say things that annoy me ,I mean you know today Chikita Nicholas Marina all day as the rest of the people,68
403,הםעושיםדבריםשמרגיזיםאותי  הםאומריםדבריםשמטרידיםאותי  והיום אני אני מתרגז:,I mean you know today Chiquita Nicolas Marina - All day long as people do they do things that annoy me and they say things that annoy me ,"They do things that upset me, they say things that bother me and today I get angry:",64
404,"והם אומרים: ""למה אתה מתרגז "" ואניאומר:""כיאתה מרגיז!""אתהיודע ","And today I get annoyed And they say ""Why are you annoyed ""","And they say, ""Why are you upset?"" And I say, ""You are upset!""",64
405,וכשאנימרשהלעצמילשקולאתהאפשרות  שלאלבלותאת שאריתחיי עםצ 'יקיטה  ,And when I allowed myself to consider the possibility  of not spending the rest of my life with Chiquita  ,And when I allow myself to consider the possibility of mourning the rest of my life with Chikita,86
406,אני מבין שהדבר שאני הכי רוצה בחיי הואלהיותאיתהכלהזמן ,I realized that what I wanted most in life was to always be with her ,I understand that the thing I want most in my life is to be with the bride all the time,61
407,אבל באותו זמן לא למדתי איך זה לאפשרלעצמךלהגיבלאדםאחר ,But at that time I hadn't learned what it would be like to let yourself react  to another human being ,But at the time I did not learn what it is like to allow yourself to respond to another person,67
408,ואםאינךיכוללהגיבלאדם אחר אזאיןאפשרותלאקטיביותאולאינטראקטיביות ,And if you can't react to another person  then there's no possibility of action or interaction ,"And if you can not respond to another person, then there is no possibility of activism or interactivity.",86
409,"""ואםאיןאת זה אנילאיודע מהאומרת המלה"" אהבה  חוץמ ""חובה"" "" התחייבות"" "" סנטימנטליות"" "" פחד ""","And if there isn't I don't really know what the word ""love"" means  except duty obligation sentimentality fear ","""And if I do not know it, I know from the word"" love outside """" duty """" commitment """" sentimentality """" fear """,65
410,אנילאיודעמהאיתך וואלי אבלאני  הייתי חייב להכניס עצמי לתוכנית לימודכדיללמודאיך להיותבןאדם ,I don't know about you Wally but I - I just had to put myself into a kind of training program to learn how to be a human being ,I did not know you were Vali Ablani. I had to put myself in a curriculum to learn how to be a human being.,72
411,איזהדבריםאניאוהב עם אלו אנשים אני באמת רוצה להיות אתה יודע ,What kind of people did I really want to be with You know ,What things I love about these people I really want to be you know,72
412,והדרךהיחידהשחשבתישאדע היאלהפסיקאת כל הרעש להפסיקלשחקכל הזמן ורקלהקשיבלמהשיש בתוכי ,And the only way that I could think of to find out  was to just cut out all the noise and stop performing all the time  and just listen to what was inside me ,And the only way you thought you would know is to stop all the noise to stop playing all the time and just get the marble inside me,66
413,אניחושבשמגיעהזמןכשעליךלעשות זאת ,See I think a time comes when you need to do that ,I think it's time for you to do this,64
414,ואוליביכולתךלעשותזאת בבית עבלעליךלהפסיקאתהרעש ,Now maybe in order to do it you have to go to the Sahara  and maybe you can do it at home ,"And maybe you can do it at home, you have to stop the noise",73
415,כן כמובן אישית אני  ,Of course personally I-I just uh -,Yes of course I personally,79
416,רק  אני בדרך כלללאאוהבאתרגעי השקט האלו ,I usually don't uh - [ Chuckles ] like those quiet moments you know ,Only I usually do not like these quiet moments,67
417,אנימתכוון אנילאיודעאםזהקטעפרודיאניאומשהו ,I don't know if this is true of you but I think it must be quite common ,I mean I don't know if this is a quiet parody thing,66
418,'אבל הפחד מדחפים לא מודעים או האגרסיות שלי וכו אם הדברים נעשים שקטים מדי אז אנימוצאעצמייושבשם אתהיודע  כמו שאמרנו קודם אני מתכוון אם אני לבדי,But uh you know the fear of unconscious impulses  or my own aggression or whatever but uh  if things get too quiet and I find myself just uh sitting there  you know as we were saying before  ,'But the fear of unconscious impulses or my aggressions etc. If things get too quiet then I will find myself sitting there knowing as I said before I mean if I'm alone,76
419,"פשוט יש לי את התחושה הזאת של ""אלוהים! אני הולך להיחשף""",I just uh - I just have this feeling of  uh my God I'm going to be revealed ,"I just have this feeling of ""God! I'm going to be exposed""",74
