,hebrewFromSub,englishFromSub,englishTranslation,ratio
0,הםהורידואותיבמדרגות לתוך המרתף והחדרהיהמוצףבאורלבןנוקשה ,And they took me down the steps into this basement  and the room was just filled with harsh white light ,They lowered the stairs into the basement and the room was flooded with rigid light,68
1,ואז הם ביקשט ממני להתפשט ולתתלהםאת כל חפצי הם השכיבו אותי על השולחן והחלו לשטוףאותיבספוג ,Then they told me to get undressed and give them all my valuables Then they put me on a table and they sponged me down ,Then they asked me to undress and hang all my belongings. They laid me on the table and began to wash it with a sponge.,71
2,ואז הם הרימו אותי על רגליוצלמואותי עירום ,Uh then-then they got me to my feet and they took photographs of me naked ,Then they lifted me to his feet and photographed me naked,72
3,ועירום עם עיניים מכוסות רצתי ביער והגענו לאוהל עשוי סדינים היו סדינים על הרצפה וכל הגופות העירומותשרועותצפופותמפאתהקור ,And then naked again blindfolded I was run through these forests  and we came to a kind of tent made of sheets with sheets on the ground And there were all these naked bodies  huddling together for warmth against the cold ,And naked with his eyes covered I ran in the woods and we came to a tent made of sheets there were sheets on the floor and all the naked bodies were sprawled from the cold,70
4,והרגשתי שמניחים אותי עלמשהודומהלאלונקה והאלונקההובלהבאיטיותרבה בתוךהיער  ואז הרגשתי שמובילים אותי אל תוך האדמה!,And the stretcher was carried a long way very slowly through these forests  and then I felt myself being lowered into the ground ,And I felt like I was being put on a stretcher and the stretcher was being led into the woods and then I felt like I was being led into the ground!,66
5,5 מטר הרגשתישמניחיםעליחתיכותעץ ,And then I felt these pieces of wood being put on me ,⁇ 5⁇ meters⁇⁇ felt⁇⁇ put⁇⁇ put⁇ on⁇ pieces⁇⁇ wood⁇,66
6,ואז האלונקה הורדה לקבר היה את העץ שהונחעלי ואתכלהחפציםשלישמובידיי הם לקחו סדין או קנבס ופרסו אותובגובהכזההעל ראשי ,And then the stretcher was lowered into the grave  and then this wood was put on me  and then my valuables were put on me in my hands ,Then the stretcher was lowered to the grave and the tree was put in.,65
7,זההיהממש המאורעהגדולהאחרון ,And that was really the last big event I mean that was the end ,It was really the last big event,66
8,התחלתי להבין שאני לא רוצה לעשותיותראת הדבריםהאלה ,I just didn't want to do these things anymore you know ,I began to realize that I did not want to do these things anymore,72
9,"הרגשתי מעין ""רגיעה"" כמו בפרק במובידיקשבוהרוחעוזבתאתהמפרשים ",I felt sort of becalmed you know like that chapter in Moby Dick  where the wind goes out of the sails ,"I felt a kind of ""relaxation"" like in the episode in Mobidik, where the wind leaves the sails",63
10,ואז בחורףהאחרון מבלילחשובעלזההרבה  הלכתי לפגוש סוכן שאני מכיר לומר לושאנימעונייןלבייםשובמחזות ,And then last winter without uh thinking about it very much  I went to see this agent I know to tell him I was interested in directing plays again ,Then last winter I was thinking about it a lot I went to meet an agent I know who says I'm interested in directing plays again,80
11,הוא נראה מופתע לראות שואן ווינקול עדיין בחיים!,Actually he seemed a little surprised  to see that Rip Van Winkle was still alive ,He looks surprised to see Sean Wincol still alive!,64
12,אלוהים!,God ,God!,100
13,לא ידעתי שהם כל כך קטנים!,I didn't know they were so small [ André Chuckles ],I did not know they are so small!,72
14,בכנות אנימוצאשכל הסיפורהזהדוחה אםאתהבאמתרוצהלדעת ,I'm sort of repelled by the whole story if you really want to know - What ,Honestly I'm the whole story it's repulsive if you really want to know,79
15,השאה של אירן אני באמת תוהה אם אנשים כמוני הםלאבאמתאלברטספיר וואלי ,You know I really wonder if people such as myself are really not Albert Speer Wally ,The Shah of Iran I really wonder if people like me are not really Albert Sapphire Valley,75
16,אתה יודע ,- Ah you know -,You know,84
17,אלברט ספיר הארכיטקט של היטלר ,- You know Hitler's architect Albert Speer ,Albert Sapir Hitler's architect,82
18,מה לא אניחושבעלזההרבהלאחרונה כיאניחושבשאניספיר ,No I've been thinking a lot about him recently because uh I think I am Speer ,What I do not think about it a lot lately as I think I think,63
19,אבל מדוע ,But why ,But why,100
20,תראה ראיתי הרבה מוות בשניםהאחרונות וואלי ודבר אחד שהוא בטוח לגבי המוות:,-You see I've seen a lot of death in the last few years Wally  and there's one thing that's for sure about death - You do it alone you see ,Look I've seen a lot of deaths in recent years Valley and one thing he's sure about death:,68
21,אתהעושהזאתלבדך ,Whatever it is you do it alone ,You do it alone,67
22,זאתנראיתכוודאות בזה נוכחתי ,That seems quite certain you see ,It seems like a certainty that I was present,68
23,איןשוםמשמעותלאנשיםסביב למטיתך ,That I've seen That the people around your bed mean nothing ,There is no meaning to people around your bed,71
24,איןשוםמשמעותלביקורותשלך ,Your reviews mean nothing ,There is no meaning to your visit,66
25,למה שתרגיש כך ,Why should you feel that way ,Why would you feel that way?,76
26,הייתהליתקופהמאודקשהבחודשיםהאחרונים וואלי ,You see I've had a very rough time in the last few months Wally ,I've had a very difficult time in the last few months Valley,70
27,שלושה אנשים שונים ממשפחתי היובביתחוליםבאותוזמן ,Three different people in my family were in the hospital at the same time Then my mother died ,Three different people from my jubilee family are hospitalized at the same time,72
28,אנילאיכוללישון אניחסום אנימושפעמכלדבר ,I mean I'm affected by everything ,I can not sleep I am blocked I am affected by everything,65
29,"הוא רק דיבר ודיבר אמא שלו הייתהקומיקאיתמפורסמתבנורווגיה שמתי לב שהוא אמר: ""אני זוכר את אימי"" לפחותארבעמאותפעמיםבמשך הערב ","His mother had been a famous Norwegian comedienne I realized he had said ""I remember my mother"" at least 400 times during the evening And he was telling story after story about his mother ","He just talked and talked his mother was a famous comedian in Norway I noticed he said: ""I remember my mother"" at least four hundred times during the evening",72
30,אתהיודע יכולתילשמועאת הצחוק את הכאב בצחוק הזה החלול מה שאמועוללהלבנה ,His laugh was so horrible You know I could hear his laugh - the pain in that laugh the hollowness ,You know you can hear the laughter the pain in this hollow laughter that I will whiten.,65
31,אז בנקודה מסויימת נאלצתי לבקשממנובנימוסלעזוב אמרתי לו שאני צריך להתעורר מוקדם בבוקרכיזה היהכהנורא ,I told him I had to get up early the next morning 'cause it was so horrible ,So at one point I had to ask him to leave. I told him I had to wake up early in the morning.,72
32,היהנראהכאילושמת בחדראורחיםשלי ,It was just as if he had died in my living room ,It looked like you died in my living room,61
33,לאחר מכן הלכתי למקלחת ובכיתי כיחשבתישאיבדתיחבר ,You know then I went into the bathroom and cried 'cause I felt I'd lost a friend ,Then I went to the shower and cried as if I thought I had lost a friend,64
34,"הסתכלתי בבחור הזה וחשבתי: ""איזה בוגד מניפולטבי וריק!""","""What a horrible empty manipulative rat ""","I looked at this guy and thought, ""What a manipulative and empty traitor!""",61
35,"ואז חשבתי: ""הבחור הזה הוא אני!""","Then I thought ""That guy is me "" [ Laughing ]","Then I thought, ""This guy is me!""",75
36,ואתמול בלילה ביום הנישואין לקחתי אתצ 'יקיטהלראותמופעעלבילי הולידיי והבטתיעלאנשיעסקיהבידור הםאינםיודעיםדבר עלבילי הולידיי ,Then last night actually you know it was our 20th wedding anniversary  and I took Chiquita to see this show about Billie Holiday I looked at these show business people who know nothing about Billie Holiday nothing ,And last night on the wedding day I took it to Chicky to see a show on Holiday Stamps and I watched the people in the entertainment business who do not know about Stable Holiday,66
37,ושכל חיי היו מזויפים וגם לי לא היהאומץלהיותביליהולידיי הרגשתי שאני באמת אחד שנסחף!,He wasn't really listening to the guy who was interviewing him  but he was smiling malevolently at his friends and I looked at that guy and I thought  ,And that all my life was fake and I too did not have the courage to be on Christmas Eve I felt like I was really one who was swept away!,60
38,פשוט ביזבזתי את חיי!,I feel I've just squandered my life ,I just wasted my life!,64
39,אנדרה איך אתה יכול לומר משהו כזה ,André now how can you say something like that I mean -,Andre how can you say something like that,87
40,בשבוע שעבר הלכתי אחר הצהריים לתיאטרון וכשנכנסתיאמרתישלוםלכולם כיאנימכיראתכולם והםמכיריםאותי ,You know when I walked in I said hello to everybody  'cause I know them all and they all know me they're always very friendly ,Last week I went to the theater in the afternoon and when I came in I said hello to everyone as I know everyone and they know me,65
41,והאחות הייתה כה רשלנית היא לא הרימהאתמעקההמיטה אז הדודה נפלה מהמיטה ועכשיו היא נכה לגמרי!,But the nurse was so sloppy she didn't put the bed rails up  and so the aunt fell out of bed and is now a complete cripple So you know we were talking about hospitals ,And the nurse was so careless she did not lift the bed rail so the aunt fell out of bed and now she is completely crippled!,73
42,עכשיו האישההזאת בגללמישהיא כיזהקרהממש לאחרונה היאיכלהלראותאותיבבירורמושלם ,You know 'cause this had happened to her very very recently - She could see me with complete clarity - Uh-huh ,Now this woman because of someone who is so cold very recently she could see it clearly and perfectly,60
43,ליזהנראהמאודמוזר  נכון הם לא ראו דברים פרט לדבריםהספוריםשהםרצו לראות ,Right because they just didn't see anything somehow  except uh the few little things that they wanted to see ,They looked very strange. They saw nothing but the few things they wanted to see,61
44,הלכנולביתהחוליםלבקראתאימי ניגשתילראותאותה וראיתי את האישה הזאת שנראה כמו שנראיתניצולתאוושויץאודכאו ,You know we'd gone to the hospital to see my mother  and I went in to see her  and I saw this woman who looked as bad as any survivor of Auschwitz or Dachau ,I went to the hospital to see my mother and went to see her and I saw this woman who looked like she looked like a survivor.,76
45,הייתיבמסדרון ניחמתיאתאבי וכשרופאהמתחמחהבבעייהממנהסבלה  שנכנסלחדרהויצאכשהואזורח ,And I was out in the hall sort of comforting my father  when a doctor who was a specialist in a problem she had with her arm  went into her room and came out just beaming ,I was in the hallway comforting my father and when a doctor interns with a problem she suffered from entering her room and leaving when he was a citizen,72
46,"הוא אמר: ""האם אין לנו הרבה סיבות להרגיש נפלא!","And he said ""Boy don't we have a lot of reason to feel great ","He said: ""Don't we have many reasons to feel wonderful!",67
47,כעת כלמה שהואראה הייתההזרוע זהכלמה שהואראה ,Now all he saw was the arm That's all he saw ,Now all that was shown was the arm that is all that was shown,69
48,שמעללכלזה הואמעיןקצב שמבצעמעיןרצחמשפחתי משום כשיצא מהחדר הוא הרג אותנו פסיכולוגיתבכךשלקחאותנולעולםהחלום  שבוהפכנולמבולבליםומפוחדים ,Who on top of that is a kind of butcher  who's committing a kind of familial murder  because when he comes out of that room he psychically kills us  by taking us into a dream world  where we become confused and frightened  'cause the moment before we saw somebody who already looked dead  and now here comes a specialist who tells us they're in wonderful shape ,"Above all, there is a kind of rhythm that carries out a family murder because when he left the room, he killed us psychologically by taking us into the world of the dream in which he became confused and frightened.",64
49,הנהאדםבן 82 במצבמאודעדין רגשית אם אתה הולך לרגע אחד ואתה רואה את אשתךגוססת ואינךרוצהשתמות ,I mean you know here's an 82-year-old man who's very emotional  and you know and if you go in one moment and you see the person's dying  and you don't want them to die and then a doctor comes out five minutes later  and tells you they're in wonderful shape -,The 82-year-old man is in a very emotional state if you go for a moment and you see your wife dying and you do not want to die,62
50,אנו מסתובבים כמו זומביטים!,We're walking around like zombies ,We walk around like zombies!,90
51,אני חושב שאנו בכלל לא מודעים לעצמנו אולתגובותשלנולדברים ,"And he said ""Boy don't we have a lot of reason to feel great ",I think we are not at all aware of all the reactions we have to say,60
52,"אני זוכר ששיחקתי במחזה המבוסס על ""האמן ומרגריטה"" של בולגקוב ואנישיחקתיבתפקידהחתול ",I mean I remember when I was uh acting in this play  based on The Master and Margarita by Bulgakov And I was playing the part of the cat ,"I remember playing in a play based on Bulgakov's ""The Artist and Margarita"" and I played the role of a cat clerk",72
53,אתה עלול לשמוע דברים בצורה שונה לגמרי!,"""You may hear everything completely differently  ",You may hear things in a completely different way!,76
54,"ומישהו אחר אמר: ""אפילו אם אחבוש כובעעלהבמה אני נוטהלהתעלף ""","And then another one said ""Oh you know whenever I wear even a hat on stage  I tend to faint ""","And someone else said, ""Even if I wear a hat on stage, I tend to faint.""",69
55,ההערותהאלוהיומלאותבעויינות כי אם הייתי מקשיב לאנשים אלו לא הייתי עולה לבמה לא הייתי שומע דבר והייתי מתעלף!,I mean those remarks were just full of hostility  because I mean if I'd listened to those people I would have gone out there on stage  and I wouldn't have been able to hear anything and I would have fainted ,Her divine remarks would be filled with hostility because if I had listened to these people I would not have taken the stage I would not have heard anything and I would have fainted!,78
56,העויינותהייתהבלתיהולמתכילמעשה  האנשיםהאלוחיבבואותי משום שהעויינות הזאת מקורה בשאריות שכנראהמהתנסויותקודמותשלהם ,But the hostility was completely inappropriate  because in fact those people liked me I mean that hostility was just some feeling that was you know  left over from some previous experience ,The hostility was inconsistent with the act of the people who came to me because this hostility originated in remnants that were probably from their previous experiences.,64
57,משוםשאיכשהו כיוםבקיוםהחברתישלנו לבטאאתרגשותנובאופןמוזר ובלתיישיר אםתבטאאת רגשותיךבאופןישיר  כולם ישתגעו!,Because somehow in our social existence today  we're only allowed to express our feelings uh  weirdly and indirectly If you express them directly everybody goes crazy ,Because somehow today in the existence of society we have to express our feelings in a strange and straightforward way if you express your feelings in a direct way everyone will go crazy!,73
58,ובכן אתה הבעת את רגשותיך לגבי מה שאותם אנשים אמרו לך לא!,Well did you express your feelings about what those people said to you ,Well you expressed your feelings about what those people told you not to!,86
59,אני אפילו לא יודע מה הרגשתי עדשחשבתיעל זה אחרכך ,No [ Chuckles ] I mean I didn't even know what I felt till I thought about it later ,I do not even know how I felt until I thought I would channel it later,74
60,לרוב במצבים כאלו אפילו אם הייתייודעמה הרגשתי אני עלול לומר:,And I mean at the most you know in a situation like that uh  even if I had known what I felt  ,Most of the time in situations like this even if I were to feel it I might say:,60
61,עשיתיבדיוקאת אותוהדברבעצמי ,I do just the same thing myself ,I did the exact same thing myself,81
62,איננו מסוגלים להיות ישירים אזאנואומריםדבריםמוזרים ,We can't be direct so we end up saying the weirdest things ,We are not able to be direct and we say strange things,64
63,העברנו את כל הערב מבלי יכולת אפילו לרגע להתקרב אתהיודע לא שרציתי להעביר ערב קודר ולדברעלכל הכאבשעברעלי ,You know that we went through that entire evening without my being able to  for a moment get anywhere near what - Not that I wanted to sit and have this dreary evening  in which I was talking about all this pain that I was going through and everything ,We spent the whole evening without even being able to get close for a moment. You know I did not want to spend a gloomy evening talking about all the pain,63
64,"באמת ממש לא אבל העובדה שאיש מהם לא יכולהיהלומר:""אלוהים!",Really not at all But the fact that nobody could say  ,"Really really not but the fact that none of them can say: ""God!",66
65,"כמהמצערשאמךנפטרה "" או: ""איך אתה מרגיש ""","""Gee what a shame about your mother"" or ""How are you feeling ""","How sad is your mother who died ""or:"" How do you feel """,69
66,זה נראה כאילו כלום לא קרה!,It was just as if nothing had happened ,It looks like nothing happened!,65
67,הםכולםסיפרובדיחותוצחקו ,They were all making these jokes and laughing ,They all told jokes and laughed,68
68,אחד מהם הזכיר מישהו שאנילאכל כך מחבב ואני התחלתי לצווח איך הוא נמצא בנהר ברונקס ואיךהזיןשלו נפל מזיבה כלמינישטויות ,One of these people mentioned a certain man whom I don't like very much  and I started screeching about how he had just been found in the Bronx River  and his penis had dropped off from gonorrhea and all kinds of insane things ,One of them mentioned someone I was so fond of eating and I started screaming how he was in the Bronx River and how his cock fell from a gonorrhea,63
69,מאוחר יותר כשהגעתי לבית הבנתי שהייתי נואש לשבור את הקרח!,And later when I got home I realized I'd just been desperate to break through this ice ,Later when I got home I realized I was desperate to break the ice!,81
70,זההיהפשוט פשוטמאוד מוזר וואלי ,That would be simply- simply so weird Wally ,Golden simple simple very strange valley,61
71,"אם ארבעה טיבטים היו נפגשים וטרגדיהפקדהאחדמהם  הם היו מבלים כל הערב ב ""הה הה הה הו הו הי הי!""",If four Tibetans came together and tragedy had just struck one of the ones  and they spent the whole evening going - [ Loud Laughing ],"If four Tibetans had met and tragedy deposited one of them they would have spent the whole evening in ""Ha ha ha ha ha ha!""",66
72,טיבטים היו מבטים בזה והיו חושבים שזאתהתנהגותשלאתעלהעלהדעת ,I mean you know Tibetans would have looked at that  and would have thought that was the most unimaginable behavior ,Tibetans would look at it and would think it was an unthinkable behavior,65
73,עבורנו זאתהתנהגותרגילה ,- But for us that's common behavior ,"For us, this is a behavioral exercise",64
74,באמת האפריקנים היו כנראה דוחפים בנו את החניתות שלהם בארבעתנו כיזההיהמשגעאותם ,- Mm-hmm I mean really the - the Africans would have probably put their spears into all four of us  'cause it would have driven them crazy ,Truly the Africans would probably be pushing their spears at us in the four of us as if it were their madness,69
75,הםיחשבושאנוחיותמסוכנותאומשהוכזה ,They would have thought we were dangerous animals or something like that ,They are considered dangerous and dangerous or something like that,65
76,זהממשהתנהגותלאנורמלית ,- Right - I mean that's absolutely abnormal behavior ,This is an abnormal behavior,66
77,האם הכל בסדר רבותי מצויין ,Is everything all right gentlemen ,Is everything fine gentlemen excellent,65
78,אנוהולכיםלארוחותערב ומסיבותכלהזמן ,I mean we go to dinners and parties like that all the time ,We go to dinners and parties all the time,83
79,הערביםהאלונראיםכמו חלומותחולניים משוםשאנשיםמדבריםבסמלים ,These evenings are really like sort of sickly dreams  because people are talking in symbols ,These Arabs look like sick dreams because people are talking symbols,78
80,נראה שכולם צפים בערפל של ערפלורגשותלא מודעים ,Everyone is sort of floating through this fog of symbols and unconscious feelings ,Everyone seems to be floating in a fog of unconscious fog,70
81,אף אחד לא אומר על מה הוא חושב ואזאנשיםהתחילולהמציאאתאותםבדיחות ,No one says what they're really thinking about ,No one says what he's thinking and then people start making jokes,63
82,"""היי זה יכול להיות נהדר אם פרנק סינטרה וגברת ניקסון ובלה בלה בלה היו בסיטואציה כזאת או אחרת""","""Hey wouldn't it be great if Frank Sinatra and Mrs Nixon and blah-blah-blah  were in such and such a situation ""","""Hey it could be great if Frank Sinatra and Mrs. Nixon and Bella Bella Bella were in one situation or another""",77
83,תמיד עם אנשים מפורסמים ותמיד גרוטסקים ,You know always with famous people and always sort of grotesque ,Always with famous people and always grotesque,84
84,אנשים מדברים על דברים נוראיים כמו כמו המוותשלהילדההזאתבמכוניתעםטדקנדי  בזמן שהם שואגים בצחוק!,Or people will be talking about some horrible thing  like - like uh the death of that girl in the car with Ted Kennedy  and they'll just be roaring with laughter ,People talk about horrible things like the death of this girl in the car with a toddler while they roar with laughter!,74
85,זהממשמדהים זהפשוט לאייאמן ,I mean it's really amazing It's just unbelievable ,It's really amazing it's just unbelievable,92
86,זההדברהיחידשמבטאיםבאמצעותאותןבדיחות מטורפות ,That's the only way anything is expressed through these completely insane jokes ,That's the only thing they express through those crazy jokes,66
87,זאתאוליהסיבהשלעולםלאהבנתי מהקרה במסיבה  ואניתמידמבולבללגמרי ,I mean I think that's why I never understand what's going on at a party I'm always completely confused ,That's maybe the reason I never understood the cold at the party and I'm always confused,67
