,hebrewFromSub,englishFromSub,englishTranslation,ratio
0,טוב אני מקווה שתדעי שאני מאחוריך לאמשנהאם את רוצהלהיותפרופסורית  או אישה אוהבת המקדישה את יומה כדילתמוךבבעלהשעובדקשה  ולשמור על הבית ללא רבב,well I hope you know I'm behind you whether you want to be a professor or  a loving wife who devotes her day to supporting her hardworking husband  and keeping an immaculate home,"Well, I hope you know I am behind you in the last you want a professor or loving woman who dedicates her day as an expression of the process of being unficit",63
1,כי קיבלתי החלטה,Because I've made a decision,Because I made a decision,94
2,לא!,No!,No!,100
3,אני הולכת לרקוד,I'm gonna dance,I am going to dance,71
4,טוב אני מוכנה לשיעור ריקוד,well I'm all set for dance class,Well i'm ready for a dance lesson,68
5,איפה הארנק שלי,Where's my car,Where is my wallet,62
6,איפה המכונית שלי,Where's my car,Where is my car,83
7,דודה ויו אולי כדאי שאני אסיע אותך,Aunt Viv maybe I should drive you,Aunt Weo may I better drive you,69
8,אני צריך לנסוע לג'ז בכל מקרה,I gotta go down to Jazz's anyway,I have to travel to jazz anyway,60
9,אני אעריך את זה וויל,I'd appreciate that will,I will appreciate this Will,78
10,אימא לפני שאת הולכת את יכולה לחתום על זה כדי שאוכל ללכת למבחני מעודדות,Mom before you go could you sign this so I can go to cheerleader tryouts,Mama before you go you can sign it so I can go to cheerleaders,78
11,אשלי אני כל כך גאה בך,Oh ashley I am so proud of you,Ashley I am so proud of you,95
12,מותק אני יודעת שרצית לעשות את זה מאז שהיית ילדה קטנה,Sweety I know you've wanted to do this since you were a child,Honey I know you wanted to do it since you were a little girl,66
13,אבל רק תזכרי:,But just remember:,But just remember:,100
14,לא משנה מה הסיכויים,No matter what the odds,No matter what the odds,100
15,אפילו אם את מרגישה מטופשת לעזוב עמדה חשובה בבית ספרך,Even if you feel foolish leaving an important position at your school,Even if you feel stupid to leave an important position in your school,80
16,את חייבת להיות חזקה  לצאת מהדלת הזאת להיכנס למכונית וללכת בעקבות החלום שלך,You have to hold your head up high  walk out that door get in your car and follow your dream,You must be strong to get out of this door to enter the car and follow your dream,62
17,אתם זוכרים את הסרט הזה אחד עף מעל קן המשוגעים,Y'aII remember that movie One Flew Over the Cuckoo's Nest,You remember this movie one flying over the crazy nest,70
18,כיתת הריקודים הישראלים בהמשך המסדרון,The israeli foIk-dancing class is down the hall,Israeli dance class later in the hallway,74
19,-האם זה ג'ז למתקדמים,-Is this Advanced Jazz,-Is it advanced jazz,80
20,-כן,-Yes,-Yes,100
21,אז אני במקום הנכון,Then I'm in the right place,So i'm in the right place,88
22,אז בכל מקרה בקיץ שעבר אני הייתי במקהלה באוקלהומה,So anyway last summer I was in A Chorus Line and Oklahoma,So in any case last summer I was in a choir in Oklahoma,79
23,באמת,really,really,100
24,באמת,really,really,100
25,למעשה הדבר האחרון שהייתי בו היה סופרמרקט,actually the Iast thing I was in was the supermarket,In fact the last thing I was in was a supermarket,79
26,אני אוהב ריקוד תיאטרון אופרה,I Iike dance the theater opera,I like opera theater dance,89
27,אני אח די מתורבת,I'm a pretty cultured brother,I'm a pretty civilized brother,85
28,וואו רק ככה מה,Wow just like that huh,Wow just like that what,80
29,בסדר אנחנו נתחיל בעוד דקה,Okay we'II start in a minute,Ok we will start in another minute,74
30,וחמש שש שבע שמונה כיווץ,And five six seven eight And contract,And five seven eight contractions,83
31,חמש ושש ראש שבע שמונה,Five and six head seven eight,Five and six heads of seven eight,94
32,אצבעות פתוחות למתוח אותן,Fingers open straighten out,Fingers open to stretch them,62
33,נעילת ראש כיווץ שחרור,Head look contract release,Locking Head of Release,65
34,למעלה,Up,up,100
35,חמש ושש ושבע שמונה טוב,Five and six and seven eight Good,Five and six and seven eight good,100
36,זרועות למעלה כיווץ,Arms up contract,Arms up a contraction,86
37,טוב,Good,are good,67
38,למעלה!,Up!,up!,100
39,אימא איך היה שיעור ריקוד,So how was dance class,Mama how was a dance lesson,73
40,זה היה כמו גן עדן,It was like heaven,It was like heaven,100
41,היה כמו גיהינום על פני האדמה,It was hell on earth,Was like a hell on earth,86
42,איך היה שיעור ריקוד,So how was dance class,How was a dance lesson,82
43,את יודעת ויויאן אולי קפצת לזה יותר מדי מהר את רק צריכה להירגע,You know Vivian maybe you jumped into this too fast You might just need to relax,You know Vivian may have jumped too quickly you just have to relax,73
44,שני כרטיסים במחלקה ראשונה להוואי!,Two first-cIass tickets to Hawaii!,Two first class tickets to Hawaii!,97
45,פיליפ איך יכולת,philip how could you,Philip how you could,100
46,הרגע חשבתי שאת רוצה לקחת את זה בקלות,I just thought you might want to take it easy,Just thought you would like to take it easily,80
47,קל,Easy,easy,100
48,פיליפ לקחתי את זה בקלות כבר 20 שנה כשקיבלתי את תעודת ההוראה הזו אני לא רוצה לקחת את הדרך הנוחה יותר,Easy philip I took it easy 20 years ago when I got that teaching degree I don't want to take the comfortable road anymore,Philip I have taken this easily for 20 years when I got this teaching certificate I don't want to take the more comfortable way,69
49,ואת לא צריכה,And you shouldn't have to,And you don't need,60
50,תני לי את המפתחות לבנז שלך,Hand over the keys to your Benz,Give me the keys to your ben,78
51,אף אחת לא הולך לעצור אותי מלהפוך לרקדנית,No one is going to stop me from being a dancer,No one is going to stop me from becoming a dancer,97
52,יש מבחן בד בעוד שלושה שבועות ואני הולכת לקחת של שיעור שאני יכולה,Now there's an audition in three weeks and I am going to take every class I can,There is a fabric test in three weeks and I am going to take a lesson I can,70
53,אני הולכת להראות לעולם שויויאן בנקס יכולה לרקוד,I'm gonna show the world that Vivian Banks can dance,I am going to show the world that Vivian Banks can dance,89
54,טוב זהו זה,well this is it,Well this is that,88
55,אני מניחה שאני קצת מתוחה אבל זה טיפשי,I guess I'm a little nervous but that's silly,I guess I'm a little tense but it's stupid,71
56,אני רק צריכה לעשות כמה צעדי ריקוד בפניכוריאוגרףמקצועי  ולפני חדר מלא באנשים בני 20 שרקדו כל החיים שלהם,I just have to do a few dance steps in front of a professional choreographer  and a room full of 20-year-oIds who've been dancing their whole lives,I just have to take some dance steps to a professional choreographer and before a room full of 20 -year -old people who have been all their life,76
57,אני הולכת למיטה ולאכול עוגת גבינה,I'm gonna go to bed and eat a cheesecake,I go to bed and eat cheesecake,86
58,לא לא ויויאן,No no Vivian,No no Vivian,100
59,תודה רבה פיליפ,Thank you philip,Thanks many Philip,71
60,אני מניח שזה מה שאמון בנישואים הוא כל העניין,I guess that's what trust in a marriage is all about,I guess that is what trust in marriage is the whole thing,70
61,תודה לך וויל,Thank you will,Thank you Will,100
62,ויויאן!,Vivian!,Vivian!,100
63,סלחו לי,Excuse me,Excuse me,100
64,יש כאן מבחן בד היום,There's an audition here today,There is a cloth test here today,71
65,אני יודעת,I know,I know,100
66,מבחני בד דורשים בדרך כלל אימוני ריקוד,Auditions usually require dance training,Fabric tests usually require dance training,72
67,-לא היית בשום שיעור,-You haven't been to any classes,-You haven't been in any lesson,69
68,למעשה אני לקחתי שיעורים פרטיים עם נטליה ברושקובה,well actually I've been taking private instruction with NataIia Broshkova,Actually i took private lessons with Natalia Broshkova,74
69,טוב אנשים,Okay people,Good people,73
70,אנחנו מחפשים את שלושת התפקידים הראשיים שלנו אז בואו נתחיל,We're looking for three of our leading roles so let's get started,We are looking for our three main roles so let's start,77
71,אנחנו צריכים ללמוד את השילוב הזה,We have to Iearn this combination,We need to learn this combination,82
72,חמש שש  חמש שש שבע שמונה,Five six  five six seven eight,Five six five six seven eight,100
73,ואחד שתיים שלוש ארבע חמש שש שבע שמונה למטה למעלה לנענע לנענע ואחת שתיים שלוש ארבעוחמש שש  שבע שמונה,A one two three four five six seven eight Down up and rock and rock and one two three four and five six  seven eight,And one two three four five six seven eight down to mint for mint and one two three four -year -olds,69
74,אחת שתיים שלוש ארבע חמש שש שבע שמונה אחת שתיים ראש ראש ראש ולך ןלך ולך,One two three four five six seven eight One two head head head over up pop-pop And walk it and walk it and walk it,One two three four five six eight eight one two heads head and go and go,66
75,וצעד צעד פנייה כפולה למטה לחצות להסתובב,And step step double turn down cross swing around,And step -by -step step down to cross around,77
76,למעלה שינוי,Up change,Up change,100
77,בוא ניקח אותך  אותך  אותך ואותך,Let's have you  you  you and you,Let's take you you and you,75
78,חמש שש  חמש שש שבע שמונה אחת,Five six  five six seven eight,Five six five six seven eight,100
79,טוב מאוד!,Very good!,Very Good!,100
80,בסדר,Okay,OK,67
81,אתם מוכנים,Are you ready,are you ready,100
82,חמש שש שבע שמונה  את בבית,Five six seven eight   So you're home,Five seven seven eight in the house,69
83,אז יש משהו  את יודעת חדש,So is there anything  you know new,So there's something you know new,64
84,זה היה יותר טוב מבסדר,It was better than okay,It was better than order,85
85,זה היה מעולה,It was great,that was great,85
86,הם הציעו לי את אחד מהתפקידים הראשיים!,They offered me one of the lead roles!,They offered me one of the main roles!,92
87,מתי מסיבת הצוות,When's the cast party,When is the team party,79
88,אני מתכוון אם זה בסדר מבחינתך,I mean if that's okay with you,I mean if it's okay for you,70
89,פיליפ  במשך 20 שנה אני תהיתי אם יכולתי להצליח כרקדנית,philip  for the Iast 20 years I have wondered if I couId have made it as a dancer,Philip for 20 years I wondered if I could succeed as a dancer,77
90,ועכשיו אני יודעת שיכולתי  לפני 20 שנה,And now I know I couId have  twenty years ago,And now I know I could 20 years ago,78
91,אלה היו שלוש השבועות הכי קשים בחיי אין חלק בגופי שלא זועק לבנגיי,These have been the hardest three weeks of my Iife There isn't a part of my body that isn't aching for Bengay,These were the three hardest weeks in my life there is no part of my body that does not cry out to Bangi,69
92,אבל אני מתגעגעת לספרים,But I miss books,But I miss books,100
93,אני מתגעגעת לילדיי,I miss my kids,I miss my children,62
94,ואתם יודעים למה אני הכי מתגעגעת,And do you know what I miss the most,And you know why I miss the most,91
95,מה מותק,What honey,What honey,100
96,הלוואי ויכולתי לראות את הבעות הפנים של הילדים האלו,I wish I couId have seen those kids' expressions,I wish I could see these children's facial expressions,75
97,נראה כאילו השארת אותם רוקדים באבק שלך,Sounds like you left them dancing in your dust,Looks like you left them dancing in your dust,92
98,פיליפ אתה חושב שאני זקנה,philip do you think I'm old,Philip you think I'm old,94
99,בטח שלא,Of course not,Of course not,100
100,אתה חושב שאני יפה,Do you think I'm pretty,do you think I'm pretty,100
101,אשה הסתכלי במראה ותגידי לי מה את רואה,Woman look in that mirror and tell me what you see,A woman looked in the mirror and tell me what you see,93
102,אני לא יודעת,I don't know,I do not know,88
103,טוב תני לי לספר לך,well Iet me tell you,Well let me tell you,95
104,עיניים כה כהות ועמוקות אדם יכול ללכת לאיבוד בהן,Eyes so dark and deep a man could get lost in them,So dark and deep eyes can get lost in them,87
105,תראי כמה יפה את,Look how beautiful you are,Look how beautiful you are,100
106,תראי כמה יפה את,Look how beautiful you are,Look how beautiful you are,100
107,חשבתי שזה בשביל הדברים הקטנים מגבינה שג'פרי מכין,I thought it was for those little cheese things Geoffrey makes,I thought it was for the little things from the cheese that Jeffrey prepares,70
108,טוב זה לא,well it's not,Well it is not,81
109,את עייפה מדי לעוד ריקוד אחד,Are you too tired for one more dance,You too tired for one more dance,94
110,מותק לא איתך,Oh baby not with you,Honey not with you,74
111,פיליפ!,philip!,Philip!,100
112,אולי כדאי שאשב,Maybe I should sit this one out,Maybe I should sit,73
113,רעיון אפילו יותר טוב,An even better idea,An idea even better,100
114,-כן!,-Yes!,-Yes!,100
115,בסדר וויל אבל אתה תהיה חייב לשחק את בובי גרינספן הקטן,Okay will but you'II have to fill in for little Bobby Greenspan,Ok Will but you will have to play Bobby Greenspan,73
116,אחד שתיים שלוש ארבע,One two three four,One two three four,100
117,לא משנה מאיפה באתם רק תעיפו את התחת בחזרה!,Wherever y'aII came from just take your butts back!,"No matter where you just came from, you just got your ass!",64
118,וויל נחמד מצדך לעזור לאימא ואבא עם המזוודות,will it's nice of you to help Mom and Dad with their bags,Will nice on your part to help Mom and Dad with the luggage,79
119,-האם בארי וויט רוצה מנה שנייה,-Does Barry White want seconds,-Th Barry White want a second dose,87
120,"טוב בתור האדם האחראי על הבית בסופ""ש הזה  אני חושב שתראה שאני קשוח אבל הוגן",well as acting head of the household this weekend  I think you'II find me tough yet fair,Good as the person in charge of the house in this weekend I think you will see that I am tough but fair,65
121,היי חוץ מי זה בנאדם הילארי הכי גדולה,Hey besides man hilary's the oldest,Hey except who's the biggest Hillary man,67
122,אבל לא מתאימה להוביל,But not equipped to lead,But not suitable to lead,62
123,כמו המלכה אליזבת דן קוול קולונל סנדרס,Like Queen elizabeth Dan QuayIe colonel Sanders,As Queen Elizabeth Dan Kol Colonel Sanders,83
124,אתה לחוץ מדי,You're too tight,You are too stressed,67
125,שלא תתעטש ותפיל את התחתונים,Wonder you don't sneeze and pop your drawers,Don't sneeze and pray the underwear,63
126,וויל באמת החיים על הקצה ממש לא זרים לי,will please I'm hardly a stranger to life on the edge,Will really live on the edge really not strangers to me,70
127,אני לא יכול למנות את מס' הפעמים בהם הלכתי לשחות מיד לאחר האוכל,I can't count the number of times I've gone swimming right after eating,I can't appoint the number of times when I went to swim immediately after eating,66
128,עברתי בכל השכונה ולא הצלחתי למכור אפילו קופסת עוגיות אחת,I've been through the whole neighborhood and I haven't sold one box of cookies,I moved throughout the neighborhood and couldn't even sell one box of cookies,77
129,אפילו שלי ווינטרס לא קנתה ממני,Even SheIIey Winters turned me down,Even my Winter didn't bought me,64
130,ראי מה שאת צריכה זה אסטרטגית מכירה שונה,Look what you need is a different sales strategy,See what you need is a different sales strategic,88
131,הנה אחת שתמיד עובדת בשבילי:,Look here's one that always worked for me:,Here's one that always works for me:,89
132,"""אדוני עמדתי למכור לך עוגיות","""Mister I was going to sell you some cookies",“Sir I was about to sell you cookies,69
133,"""אבל מעדתי בחנייה שלך ואני חושבת ששברתי את הקרסול","""but I tripped on your driveway and I think I broke my ankle",“But I stumbled in your parking and I think I broke the ankle,64
134,"""תוכל בבקשה להתקשר לאבא שלי","""could you please call my daddy",“You can please call my dad,86
135,הוא עורך-דין,He's a lawyer,Is a lawyer,75
136,"הוא יידע מה לעשות ""","He'II know what to do """,He will know what to do ”,82
137,בסדר הילארי אני משאירה לך 100$ למצרכים  והנה מספר הטלפון של המקום שבו נשהה בזמן ועידת החוקים,Okay hilary I'm leaving you $100 for groceries  and here's the number where we'II be staying for the legal convention,Ok Hillary I leave you $ 100 for groceries and here's the phone number where we will be paid during the Law Conference,75
138,אני לא יכולה לומר שאני מצפה לזה,I can't say I'm looking forward to it,I can't say I am looking forward to that,83
139,אני לא יכולה לומר זאת בגלל שזה שקר אחד גדול,I can't say it because it wouId be a big fat lie,I can't say that because it's one big lie,70
140,להתראות כולם,Goodbye everyone,Goodbye to everyone,91
141,אני בחופש לסוף השבוע,I'm off for the weekend,I'm in freedom for the weekend,68
142,להתראות ג'פרי,Bye Geoffrey,Alert Jeffrey,64
143,מה זה כמו לעלות זיכרונות על מר צרפת,What is it Iike reminiscing about Mr French,What is like to rise memories about Mr. France,64
144,הנושא של השנה הוא,This year's theme is,The subject of the year is,70
145,נתראה ביום שני בבוקר,See you all Monday morning,See you on Monday morning,86
146,מוכנה לועידה מתוקה,Ready for the convention sweetheart,Ready for a sweet conference,67
147,לא משנה כמה תתכונן אף פעם לא תהיה באמת מוכן למשהו כזה,Oh no matter how you prepare  you can never really be ready for something like this,No matter how much you will never really be ready for something like this,83
148,עכשיו ילדים כולכם אנשים בוגרים  אני ואימכם בוטחים בכם לחלוטין,Now kids you're all mature young adults  and your mother and I trust you completely,Now kids all of you older people me and you trust you completely,70
149,אבל באותו נושא אם מישהו מכם ינסה לנצל את סוף-השבוע הזה  לעשות דברים פזיזים ואסורים  הוא יצטרך לחשוב שנית,But by the same token if any of you are planning on using this weekend  as an excuse to engage in reckless activities  you'II have to think again,But on the same topic if any of you try to take advantage of this week to do reckless and forbidden things he will have to think again,64
150,האם הבהרתי את עצמי,Do I make myself clear,Did I clarified myself,68
151,זה קטע גזעי נכון,This is a racial thing right,This is a correct racial segment,63
152,"פרק אחד עשר ""רב-המשרתים עשה זאת"" פיליפ איזו הפתעה נפלאה",philip what a wonderful surprise,"Chapter Eleven ""Multi-Maids did so"" Philip What a wonderful surprise",65
153,אני לא יודעת איך הצלחת לעשות זאת ללא ידיעתי  אבל אני שמחה שעשית,Now I don't know how you pulled this off without me knowing it  but I'm glad you did,I don't know how you were able to do this without my knowledge but I am happy that you did,66
154,טוב חשבתי שזה יהיה עדיף על ועידת חוקים משעממת,well I thought this might be a little bit better than a boring legal convention,Well I thought it would be better than a boring law conference,68
155,"אני מקווה שתיהנו כאן ב -""מלון דומי"" (גם:",I hope you folks enjoy yourselves here at the Doomie Inn,"I hope you enjoy here in ""Domi Hotel"" (also:",65
156,אני בוב דומי,I'm Bob Doomie,I am a domain bob,65
157,טוב את יודעת השגתי את אותו חדר שהיה לנו ביום הנישואין העשירי שלנו,well you know I got the same room we had on our tenth anniversary,Well you know I got the same room we had on our tenth marriage day,85
158,"סוויטת ""חדר התהילה של רומא""","The ""glory That Was Rome"" suite","""Rome's glory"" suite",68
159,ואם את זוכרת מיטת המרכבה לא היית צריכה סוסים בשביל לזוז,And if you recall the chariot bed didn't need horses to move it across the room,And if you remember the carriage bed you didn't need horses to move,74
160,ברוכים הבאים ל-קסבה (מצודה),welcome to the Casbah,Welcome to Maxba (Citadel),67
161,מה קרה לרומא,What happened to Rome,What happened to Rome,100
162,תודה אדוני אבל ה-200 שלו אומרים שכן,Thank you sir but his $200 says that it is,Thanks sir but his 200 is saying yes,78
163,אני בטוחה שיהיה רומנטי גם פה,I'm sure it'II be just as romantic,I am sure to be romantic here too,63
164,בסדר ילדים לכו לסרט,Okay kids go to the movies,Ok kids go for a movie,67
165,בסדר הכוכב שהכי קרוב לשמש,Okay the planet closest to the sun,OK the closest to the sun,85
166,אתה יודע אתה די חכם בשביל מישהו שהיה בכיתה י' רק פעם אחת,You know you're pretty smart  for a guy that's only been through the tenth grade once,You know you are pretty smart for someone who was in 10th grade only once,71
167,טוב אתה יודע מה זה אומר:,well you know what that means:,Well you know what it means:,86
168,חכה רגע,Wait a minute,Wait a moment,69
169,שיחקתי את המשחק הזה פעם,I've played this game before,I played this game once,71
170,וויל אנו צריכות טרמפ לסופר,will we need a ride to the grocery store,Will we need a ride to a writer,65
171,אנחנו אמורות למכור עוגיות היום,We're supposed to sell cookies today,We are supposed to sell cookies today,90
172,אשלי אהובתי דובשנית פרח תפוח  למה שלא תלכי לשאול את קרלטון או הילארי,ashley love pumpkin blossom apple  why don't you go ask carlton or hilary,Ashley my loved one and a flower flower for what you won't go to ask Carlton or Hillary,63
173,ואל תחזרי לכאן עד שתהיי בת 17 או בליווי של מבוגר,And don't come back through here until you're 17 or accompanied by an adult,And don't come back here until you are 17 or accompanied by an adult,90
174,עכשיו היכן היינו,Now where were we,Now where we were,100
175,חבל,Too bad,Too bad,100
176,כן ההורים שלי מחוץ לעיר אז אני יכול לעשות כל מה שאני רוצה,Yes well my parents are out of town so I can do anything I want,Yes my parents out of town so i can do whatever i want,82
177,אני רוצה את זה מהר וחם,I want it fast and I want it hot,I want it fast and warm,76
178,ואם יש על זה פפרוני אני מחזיר את הפיצה הזאת חזרה!,And if it has any pepperoni on it I'm sending that puppy back!,And if there is a pepperoni I bring this pizza back!,61
179,קרלטון אנו אמורות למכור עוגיות היום ואימא אמרה שאחד מכם צריך,carlton we're supposed to sell cookies today  -and Mom said one of you had to take us,Carlton we are supposed to sell cookies today and Mama said one of you should,80
180,הילארי אנו צריכות טרמפ למכולת,hilary we need a ride to the grocery store,Hillary we need a ride to the grocery store,99
181,עשו דיאטה,Take a hike,Made a diet,64
182,אני צריכה את הכסף למצרכים בשביל לקנות תכשיטים,I need the grocery money to buy jewelry,I need the money for groceries to buy jewelry,90
