,hebrewFromSub,englishFromSub,englishTranslation,ratio
726,מתי שהירח בתוך הבית השביעי,When the moon is in the seventh house,When is the seventh -home moon,85
727,השישה קרנות של האנרגיה שבתאי עד נפטון השמש השביעית שנולדה למזל טוב  הכל מספרים,The sixth-ray energies Saturn to Neptune  the seventh sun born for good luck  all numbers,Six funds of the Saturn Energy to Neptune the Seventh Sun born to good luck all numbers,89
728,"ג'ימסון למה שאני לא ""יסדר"" אותך עם משקה",Jameson why don't I fix you a drink,"Jimimson what I would not ""arrange"" you with a drink",61
729,אני לא שותה אני מעדיף להשאיר את הראש שלי צלול,I don't drink I like to keep my mind clear,I don't drink i would rather leave my head clear,67
730,מספרי המזל שלי היו תמיד שלוש ושבע,My lucky numbers have always been three and seven,My lucky numbers were always three and seven,84
731,וויל מתי יום ההולדת שלך,-Will when's your birthday,Will when did your birthday,92
732,-שלוש ביולי,-July 3,-3 in July,80
733,אז אתה נולדת ב-7/3/73  מספרי המזל שלי,So you were born on 7-3-73  my lucky numbers,Then you were born on 7/3/73 my lucky numbers,93
734,ג'ימסון זה פשוט צירוף מקרים,Jameson that's just a coincidence,Jimson is just a coincidence,79
735,צירוף מקרים,Coincidence,Coincidence,100
736,אני לא חושב,I don't think so,I do not think so,79
737,-אני נולדתי ברביעי לאוגוסט 1974,-l was born August 4 1974,-I was born on Wednesday to August 1974,68
738,-מזל אריה,-A Leo,-Leo,75
739,וויל יש לי משימה בשבילך,Will I have an assignment for you,Will I have a task for you,71
740,אני רוצה שתעבור על התיקיות האלו,I want you to go through these files,I want you to go through these folders,95
741,זה בעניין החברה שנקראת ינרמרק,They're about a company called lnnermark,This is about the company called Janmerk,72
742,אני ניתחתי את הנתונים שלהם כבר חודשים  מנסה להחליט האם אני צריך או לא לקנות אותם,I've been analyzing the data for months  trying to decide whether or not I should buy it,I have been analyzing their data for months trying to decide whether I need or not buy them,87
743,אתה רוצה שאני יקרא את כל זה,You want me to read all this,You want me to read all this,100
744,זה לא הכרחי,That's not necessary,It is not necessary,67
745,פשוט תרגיש את העמודים,Just feel the pages,Just feel the pillars,85
746,תגיד לי איזה סוג של אנרגיה אתה מקבל בחזרה,Tell me what kind of energy you get back,Tell me what kind of energy do you get back,96
747,ג'ימסון אני חייב לומר שכל זה נשמע קצת  מטורף,Jameson I have to say this all sounds a little  insane,Jimson I must say that all sounds a little crazy,73
748,שמרני  יש לך מתווכים מצויינים בחברה כדי לייעץ לך,unorthodox You have an excellent brokerage firm to advise you,Conservative you have excellent brokers in the company to advise you,67
749,ויל אתה לא יודע שאתה יודע  אבל תאמין לי אתה יודע,Will you don't know that you know  but believe me you know,Will you don't know you know but believe me you know,95
750,בנאדם אני לא יודע,Man I don't know,Man I don't know,100
751,בדיוק,Exactly,exactly,100
752,נדבר מחר,We'll talk tomorrow,We'll talk tomorrow,100
753,פיליפ ויוויאן שיהיה לכם יום נעים,Philip Vivian have a nice day,Philip Vavian to have a nice day,92
754,למה הבנאדם הזה מסתובב חופשי ברחובות מבלי שהוא לוקח תרופות,Why is that man running loose on the streets without medication,Why is this person walking freely on the streets without taking medication,67
755,הוא קצת מוזר ויוויאן אבל יש לו ראש פיננסי מבריק לעסקים,He's a little eccentric Vivian but he has a brilliant financial mind,He is a bit strange and vowed but he has a brilliant financial head for business,61
756,יש לו,He does,he has,62
757,פיליפ למה אתה לא מספר לוויל על ספארקי,Philip why don't you tell Will about Sparky,Philip why you don't tell the Will on Sparks,83
758,אני לא חושב שאנחנו צריכים להיכנס לזה,I don't think we need to go into that,I don't think we should get into it,72
759,בשנה שעברה  ג'ימסון היה מקבל את כל העצות על המניות מהכלב שלו,Last year  Jameson was taking all of his stock advice from his dog,Last year Jimimson would get all the tips on his shares from his dog,68
760,הוא רק לקח עצות של מיסים מספארקי,He only took tax advice from Sparky,He only took tips of spareworks taxes,61
761,אבל כמובן זה לא עצר מג'ימסון לדבר איתו,Sparky met with an untimely run-in with a milk truck  but of course that didn't stop Jameson from talking to him,But of course it didn't stop from Jimimson to talk to him,62
762,הוא מדבר לרוח של כלב מת,He talks to the spirit of a dead dog,He speaks to the spirit of a dead dog,82
763,לא,No,No,100
764,הוא פיחלץ אותו ושם אותו במשרדו,He had him stuffed and put in his office,He has gone out and put him in his office,79
765,הכוכב שהוא נמצא עליו עדיין לא היתגלה,The planet he's on ain't even been discovered yet,The star he is on is not yet discovered,61
766,הוא לקוח חשוב  והא רק הפקיד בידך החלטה פיננסית חשובה מאוד,He's an important client  and he's just entrusted you with a very serious financial decision,Is an important customer and only your hand has a very important financial decision,68
767,-מה אני אמור לעשות,-What am I supposed to do,-What am I supposed to do,100
768,מחר אתה תלך למשרד של ויטוורט השקעות  תמצא את ג'ימסון ותגיד לו שאתה רק ילד בן 17  ושאתה לא בעמדה מוסמכת שיכולה לתת עצות פיננסיות,Tomorrow you to go down to Whitworth's Capital Investments  find Jameson Whitworth and tell him that you're a 17-year-old kid  and you're in no position to give financial advice,Tomorrow you will go to the VitoT Investment office you will find Jimson and tell him that you are just a 17 -year -old and you are not in a qualified position that can give financial advice,78
769,בדיוק,Exactly,exactly,100
770,זה העבודה של ספארקי,That's Sparky's job,This is Sparki's work,60
771,האיש החשוב שלך נמצא כאן מר ויטוורט,Your main man is in effect Mr Whitworth,Your important man is here Mr. Vitwart,63
772,תודה גלדיס,Thank you Gladys,Thanks Gladis,76
773,וויל אתה יכול להיכנס,Will come in,Will you can get in,65
774,אתה יודע אני רק רציתי לבוא אז  משהו לא טוב,You know I just wanted to come so-- is something wrong Will,You know i just wanted to come then something not good,77
775,לא,No,No,100
776,תראה אני קצת דחוק בזמן אז בוא נגיע ישר לנקודה,Look I'm a little pressed for time so let's just get right to the point,Look I'm a bit urgent in time so let's get straight to the point,64
777,מצויין,Excellent,Excellent,100
778,שנקנה את המניה או לא,Do we buy this stock or not,We bought the stock or not,79
779,תראה זה מה שבאתי לדבר איתך עליו,Look that's what I came to talk to you about,Look this is what I came to talk to you,82
780,לא נראה לי שאני בעמדה לתת לך עצות פיננסיות,I don't think I'm in any position to give you financial advice,I don't think I'm in a position to give you financial tips,88
781,האם אמרת 17,Did you say 17,Did you say 17,100
782,זה סימן,This is a sign,This is a sign,100
783,המכונה הזו מראה לי את מחירי המניות הקיימים,This machine gives me stock quotes,This machine shows me existing stock prices,70
784,עשית את זה שוב וויל,You've done it again Will,You did it again Will,83
785,אני מתקשר למתווך שלי,I'm calling my broker,I call my broker,86
786,חכה אני לא חושב שאתה צריך,Wait I really don't think you should--,Wait I don't think you need,79
787,מיילס,Miles,Miles,100
788,תקנה מניות בסך מליון דולר של ינמרק השקעות,Buy me one million shares of lnnermark lndustries,Pick up Denmark's $ 1 million shares,60
789,אתה קנית מניות בסך מיליון דולר כי אמרתי לך שאני בן 17,You bought a million shares of stock because I told you I was 17,You bought shares of a million dollars because i told you i'm 17 years old,83
790,זה רק צירוף מקרים אחד גדול חוץ מזה אני עוד מעט בן 18,This is just one big coincidence Besides I'm about to turn 18,This only one big coincidence besides I am a little more 18 years old,71
791,-לא,-No,-No,100
792,כן אמרת,Yes you did,Yes you said,87
793,תראה את זה וויל,Look at this Will,Look this Will,90
794,המניה עלתה ל-18 דולר,The stock just went up to $18,The stock rose to $ 18,71
795,הרגע אתה עשית לי מיליון דולר,You just made me $1 million,You just made me a million dollars,83
796,זה לא אומר כלום מר ויטוורט,That doesn't mean anything Mr Whitworth,This does not mean anything Mr. Vitwart,83
797,אני מבין שאתה מפוחד מהכח שלך,I can understand you being frightened by your powers,I understand you are scared of your power,69
798,אבל יש כוחות ביקום שהם מעבר להבנה שלנו,But there are forces at work in the universe beyond our understanding,But there are forces in the universe that are beyond our understanding,91
799,אל תילחם בהם וויל,Don't fight them Will,Don't fight them Will,100
800,תלמד לקבל אותם  ותמיד יהיה לך מקום כאן וויל,Learn to accept them  and there will always be a place for you here,You will learn to get them and you will always have a place here,75
801,אתה יודע וויל נמצא שם שעות,You know Will's been gone for hours,You know Will is there for hours,72
802,מעניין איך הפגישה שלו עם מר ויטוורט הולכת,I wonder how his meeting with Mr Whitworth is going,Interesting how his meeting with Mr. Whittwort goes,75
803,אין מה לדאוג אשלי,Nothing to worry about Ashley,Nothing to worry about Ashley,100
804,התנועה ממאדים מאוד עמוסה בשעות האלו,Traffic from Mars is very heavy this time of day,Movement from Mars is very busy at these hours,60
805,אני בבית,I'm home,I'm home,100
806,קרלטון תביא את המצלמה,Carlton get the camera,Carlton will bring the camera,71
807,אני רוצה שתצלם אותי פותחת את הצ'ק הראשון שלי,I want a picture of me opening my first paycheck,I want you to photograph me opening my first check,65
808,-זה נפלא,-That's wonderful,-it's wonderful,73
809,אמא אבא אני מתחילה לשלם בדרך שלי על הכל כאן ואני לא מקבלת לא כתשובה,Mom Dad I'll start paying my own way around here  and I won't accept no for an answer,Mother Dad I start paying my way for everything here and I don't get no as an answer,71
810,את עדיין חייבת לי 5 דולר על כל המגאזינים שאת קנית אשלי תפסיקי להיות קטנונית,You still owe me $5 for those magazines you bought Ashley don't be petty,You still owe me $ 5 on all the megasins you bought Ashley stop being petty,75
811,אתם לא מרגישים כחלק מההיסטוריה,Don't you all feel like a part of history,You don't feel as part of the history,82
812,מה,What,what,100
813,מיסים פדרלים,Federal taxes,Federal taxes,100
814,"האם הנשיא בוש אמר ""אין יותר מיסים חדשים""","Didn't President Bush say ""No new taxes""","Did President Bush say ""there are no more new taxes""",80
815,אבל מיסים פדרלים הם לא חדשים,But federal taxes aren't new,But federal taxes are not new,95
816,הם חדשים בשבילי,They are to me,They are new to me,88
817,הילרי מיסים נלקחים מהמשכורות של כולם,Hilary taxes are taken out of everybody's salary,Hillary taxes are taken from everyone's salaries,77
818,אני חשבתי שהממשלה אמורה לשלם על כל זה,I thought the government was supposed to pay for all that,I thought the government was supposed to pay for all this,95
819,בסדר אני יודעת את הפתרון,Okay I know the solution,Ok I know the solution,96
820,אני הולכת לדרוש העלאה,I'm going to demand a raise,I am going to demand a raise,91
821,הילרי את עובדת שם רק שבוע,Hilary you've only been there a week,Hillary you just a week,64
822,זה נשמע מצויין ג'ימסון,Yeah that sounds great Jameson,This sounds great Jimimson,75
823,וויל אני רוצה שתחזיר הכל לפני שהשוטרים יגיעו לכאן,Will I want you to return all that stuff before the cops get here,Will I want you to return everything before the police arrive here,70
824,ג'יי נתן לי את הכל מתנת תודה קטנה,J gave me this stuff as a little thank-you gift,Jay gave me everything a little thanks gift,69
825,-על מה,-For what,-What,67
826,זה נראה לך המון כסף וויל אבל חכה שיקחו לך את כל המיסים,That may seem like a lot Will but wait till they take out all the taxes,It looks like a lot of money Will but waits for you to take all the taxes,69
827,וויל איך הרווחת לג'ימסון מיליון דולר,Will how did you make Jameson $1 million,Will how did you earn a $ 1 million Jimson,81
828,בכל הכנות אין לי שום מושג,To be honest I have no idea,In any preparation I have no idea,60
829,ג'ימסון חושב שאני נותן מזל טוב,Jameson seems to think I'm good luck,Jimson thinks I give good luck,70
830,וויל אין דבר כזה מזל טוב או מזל רע,Will there's no such thing as good luck or bad luck,Will have no such thing as good luck or bad luck,87
831,כן יש דבר כזה לי יש מזל רע,Yes there is I've got bad luck,Yes there is such a thing to me there is bad luck,63
832,אתה נראה נאה וויל,You look handsome Will,You look handsome,87
833,חליפה מהממת,Just asking,A stunning suit,62
834,מותאמת אישית,Custom-made,Custom,71
835,מתי שאתה עובד בשביל ויטוורט יש כל מיני הטבות,When you work for Whitworth you get all the fringe benefits,When you work for Vitwart there are all kinds of benefits,66
836,רק שאלתי,Just asking,I just asked,78
837,בשביל חבר,For a friend,For a friend,100
838,וויל אתה לא חושב שאתה מסוגל להביא עצות פיננסיות נכון שלא,Will you don't really think you're capable of giving financial advice do you,Will you don't think you are able to bring in financial advice correctly not,67
839,דודה ויו  יש עוצמות שעובדות ביקום שלנו שהם מעבר להבנות שלנו,Aunt Viv  there are forces at work in this universe that are beyond our understanding,Aunt Viu has strengths that work in our universe that are beyond our understandings,77
840,ואם הכוחות הללו רוצים לתת לי לימוזינה טלפון סלולרי וחליפה של ארמני,And if these forces want to give me a limo  a cellular phone and an Armani suit  who are we to argue with them,And if these forces want to give me a mobile phone and an Armenian suit,72
841,וויל אני שלחתי אותך לשם כדי שתצא מההסדר הזה עם ג'ימסון ועכשיו אתה נכנסת לזה יותר עמוק ממקודם,Will I sent you there to get out of this arrangement with Jameson  and now you're in deeper than before,Will I sent you there to get out of this arrangement with Jimson and now you get into it deeper than the first place,84
842,אני יודע אני מרגיש נורא,I know I just feel terrible,I know I feel terrible,90
843,-מה אתה עושה,-What are you doing,-What are you doing,100
844,-אני הולך לשים לזה סוף,-l'm gonna put an end to this,-I'm going to put an end to it,77
845,כן פיליפ בנקס את ג'ימסון ויטוורט,Yes Philip Banks for Jameson Whitworth,Yes Philip Banks the Jimson Vitwart,79
846,כן אני דיברתי אם וויל כאן,Yes I've been talking to Will here,Yes I spoke if Will here,69
847,קודם כל אני רוצה להגיד שזה מאוד מחמיא לו אבל זה קצת סיכון לתת לתלמיד תיכון שיתן עצות פיננסיות,First of all I'd like to say he's very flattered  but it's a little risky having a high-school student give financial advice,"First of all, I would like to say it is very flattering to him but it is a bit of a risk of giving a high school student to give financial tips",74
848,ובתור העורך דין שלך אני מציע לך לשים סוף לזה,As your lawyer I'd advise you put an end to it,And as your lawyer I suggest you put an end to that,70
849,בוודאי אתה רוצה לדבר איתו בעצמך,Sure you want to talk to him yourself,Certainly you would like to talk to yourself,69
850,בסדר,Okay,OK,67
851,באמת,Really,really,100
852,כן אם זה מה שאתה רוצה זה סבבה,Yeah if that's the way you want it that's cool,Yes if that's what you want it is a round,67
853,מה הוא אומר,What did he say,what is he saying,69
854,דוד פיל אתה מפוטר,Uncle Phil you're fired,David Phil you are fired,60
855,אז מר ויטוורט מוכן לראות אותנו כבר,So is Mr Whitworth ready to see us yet,So Mr. Whittwort is ready to see us already,82
856,"הוא עדיין בפנים מדבר עם ""אח"" שלו",He's still in there talking to his homey,"He is still in the face talking to his ""brother""",74
857,אתם רק צריכים להירגע,You'll just have to chill,You just have to relax,77
858,טוב אנחנו לא יכולים להרשות לעצמנו להפסיד את החשבון של ויטוורט,All right We can't afford to lose Whitworth's account,Well we can't afford to lose Vitwart's account,71
859,-אנחנו צריכים תוכנית,-We need a game plan,-We need a plan,85
860,-אני חשבתי שסיכמנו לנדנד לו,-l thought we had agreed on groveling,-I thought we agreed to swing him,62
861,כן אבל אנחנו צריכים לקבוע באיזה סדר נעשה את זה,Yes but we need to straighten out the order in which we grovel,Yes but we have to determine what order we will do this,60
862,אני אלך ראשון,I'll go first,I will go first,93
863,פיליפ אתה יכול להזכיר לו את כל העבודה המסורה שעשינו לחברה שלו,Philip you can remind him of all our dedicated service to his company,Philip you can remind him of all the dedicated work we did to his girlfriend,70
864,-מה אני יגיד,-What do I say,-What will I say,71
865,-כלום,-Nothing,-is nothing,82
866,אתה כאן רק בגלל שמספר המזל שלו הוא שלוש,You're only here because his lucky number is three,You are here just because his lucky number is three,83
867,כמובן,Of course,of course,100
868,ג'יי קדימה בנאדם אתה חייב להיפגש איתם,J come on man you've got to meet with them,Jay forward in person you must meet with them,62
869,-הם יושבים בחוץ,-They're sitting right outside,-They sit outside,71
870,אני מצטער אבל ההילה שלהם גרועה,I'm sorry but the aura is wack,I am sorry but their aura is bad,74
871,מה אמרת ספארקי,What did you say Sparky,What did you say sparky,100
872,הוא מדבר,He's talking,He's talking,100
873,הוא לא דיבר כבר שבועות,He hasn't talked in weeks,He hasn't spoke for weeks,64
874,אתה חושב שזה רעיון טוב לקיים את הפגישה,You think it's a good idea to have the meeting,You think it's a good idea to have the meeting,100
875,מילה,Word,Word,100
876,מה זה,What's that,What is,67
877,להתקדם לפגישה,Go ahead with the meeting,Move forward to a meeting,60
878,הנה לך,There you have it,there you are,80
879,ספארקי אמר לקיים את הפגישה,Sparky says have the meeting,Sparks told to hold the meeting,64
880,זה שתיים נגד אחד,It's two against one,It's two against one,100
881,גלדיס תשלחי אותם פנימה בבקשה,Gladys send them in please,Gladis will send them in and please,82
882,-ג'ימסן טוב לראות אותך,-Jameson good to see you,-Jamesen is good to see you,90
883,וויל תסלח לנו בבקשה,-Will excuse us please -Sure,Will Forgive us please,67
884,הוא נשאר אני רוצה אותו כאן,He stays I want him here,He stays I want him here,100
885,וספארקי רוצה אותו כאן,Sparky wants him here,And Sparki wants him here,87
886,בסדר,Okay,OK,67
887,פורת וינד ומאייר יצגה אותך  בעשרים השנים האחרונות,Jameson Furth Wind Meyer has represented you  for the past 20 years,Porat Wind and Air has been presenting you in the last twenty years,60
888,ואני חושב שאני מדבר בשם כל העורכי דין שבחברה  ואני אומר שכולנו הקדשנו להמשיך בתפקיד הזה,And I think I speak for all the lawyers in the firm  when I say that we're dedicated to continuing in that capacity,And I think I'm talking on behalf of all the lawyers in the company and I say we all devoted to this role,61
889,אז מה,What,So what,73
890,פיליפ אתה רצית לעלות כאן נקודה מעניינת נכון,You had an interesting point you wanted to make didn't you,Philip you wanted to go up here an interesting point right,69
891,כן הנרי,Yes Henry,Yes Henry,100
892,ג'ימסון אם להתבסס על מה שהנרי אמר  כן,Jameson to elaborate on what Henry was saying it   Yes,Jimson if to be based on what Henry said yes,75
893,מה,What,what,100
894,זה נורא,This is terrible,It is terrible,73
895,-זה היה הסוכן שלי,-That was my broker,-This was my agent,63
896,הם ירדו כבר בעשר נקודות,It's already down 10 points,They have already dropped in ten points,61
897,וויל אתה חייב לי 14 מליון דולר,Will you owe me $14 million,Will you owe me $ 14 million,100
898,הנה 5 דולר,Here's $5,Here is 5 dollars,64
899,זה רציני אתה לא מבין כלום,This is serious Don't you know anything,It's serious you don't understand anything,77
900,לא כמה פעמים אני צריך להגיד לך,No How many times do I have to tell you,Not how many times I have to tell you,95
901,למה אמרת לי לקנות את המניות האלו,Why did you tell me to buy that stock,Why did you tell me to buy these shares,82
902,אתה יצאת מדעתך,You're out of your mind,You have come out of your mind,75
903,אני יצאתי מדעתי,I'm out of my mind,I got out of my mind,84
904,אתה זה ששמת את לאסי להיות סגן הנשיא,You're the one that's got Lassie as your vice president,You the one who puts Lassie to be a vice president,78
905,אתה קללה צא מייד מהמשרד שלי,You're a curse Get out of my office,You curse immediately from my office,62
906,-שלא תדבר אליו ככה,-Don't you talk to him like that,-Don't talk to him like this,86
907,-תסלח לי,-Excuse me,-Excuse me,100
908,בינואר שעבר ביום ההולדת שלי  מתי שיכולתי להיות בבית עם אישתי והילדים שלי איפה אני הייתי,Last January on my birthday  when I could have been home with my wife and family where was I,Last January on my birthday when I could be at home with my wife and my kids where I would,81
909,"תקוע במשרד קבור תחת ניירות עבודה  בגלל שספארקי רדף אחרי ביואיק  ואתה חשבת שזה הדרך שלו להגיד לך להשקיע ב -""ג'נרלס מוטורס""",Stuck in the office buried under paperwork  because Sparky chased a Buick  and you thought that was his way of telling you to take over General Motors,"Stuck in the office is buried under work papers because Sparks pursued Beoik and you thought it was his way to tell you to invest in ""Jenners Motors""",71
910,ג'ימסון אני גמור מהטירוף שלך,Jameson I am through with your craziness,Jimson I am finished with your madness,64
911,ואם זה אומר שנפסיד חשבון של 20 מליון דולר אז שיהיה כך,If that means we lose a $20 million account then so be it,And if that means we will lose a $ 20 million account then there will be so,82
912,"ג'ימסון אני חושב שזה הדרך של פיליפ להגיד ""אני מצטער""","Jameson I think that's Philip's way of saying ""l'm sorry ""","Jimson I think this is Philip's way to say ""I'm sorry""",71
913,-פיליפ למה לא אמרת לי את זה לפני,-Why didn't you ever say this before,-Filpa why didn't you tell me this before,75
