,hebrewFromSub,englishFromSub,englishTranslation,ratio
384,אתה יכול להגיד את כל זה רק מהחתימה שלי,You can tell all that from just my signature,You can say all this only from my signature,74
385,-זה מדהים,-That's amazing,-This is amazing,83
386,תעשה לי תעשה לי!,Do me do me!,Do me do!,84
387,תחתמי כאן מתחת לאשלי,Sign right there under Ashley,Underneath here under Ashley,60
388,אז מה אתה רואה עליי,So what do you see about me,So what do you see about me,100
389,ובכן המשיכות האנכיות הנועזות מראות שאת אימפולסיבית,Well the bold vertical strokes show that you're impulsive,Well the bold vertical strokes show that you are impulsive,94
390,האותיות הגדולות מראות שאת מסורה,The large capital letters show that you're committed,The Big letters show that you are traditional,60
391,והסמיילי הקטן שאת עושה מעל האיי מראה שיש לך יותר מדי זמן פנוי,"And the little smiley face you use to dot your ""l""  shows that you got way too much time on your hands",And the little smiley you do over the island shows you have too much free time,73
392,כל זה נכון,That's all true,All that is true,97
393,כוכב קולנוע חתיך שישמח רק אם תבזבזי כמויות כסף בלתי סבירות,"""Handsome movie star who will only be happy  ""if you spend obscene amounts of money """,A studwed star who will only be happy if you waste unreasonable amounts of money,64
394,אתה טוב,You're good,you are good,70
395,שלום כולם,-Hello everybody,Hello everyone,83
396,אבא'לה וויל יודע איך לנתח כתב יד,Daddy Will knows how to analyze people's handwriting,Daddy Will know how to analyze manuscript,69
397,מבט אחד בחתימה שלי והוא הסיק שאני אמיץ מחוכם ושיש לי כוח של עשרה,One look at my signature and he deduced that I was valiant  ingenious and have the strength of 10,One look at my signing and he concluded that I was brave and I had a power of ten,66
398,תן לי לעשות את שלך דוד פיל,-Let me do yours Uncle Phil,Let me do your uncle Phil,98
399,-לא אני לא מאמין בשטויות האלה,-No I don't believe in that nonsense,-I don't believe in these nonsense,88
400,אני לא הייתי קורא לזה שטויות,I'd hardly call it nonsense,I wouldn't call it nonsense,67
401,בבקשה אבא'לה זה כייף,Please Daddy it's fun,Please Dad this is fun,84
402,איפה לחתום,Where do I sign,Where to sign,71
403,לא דוד פיל,No Uncle Phil,Not uncle Phil,96
404,מגיעה לך חתיכת נייר חדשה,You deserve a fresh piece of paper,You deserve a new piece of paper,91
405,מה איתך דודה ויו,-How about you Aunt Viv,What about you aunt,78
406,למה לא,Why not,Why not,100
407,וויל זה תמיד רגע כל כך עצוב,Will this is always such a sad moment,Will is always such a sad moment,93
408,מה,What is,what,73
409,לגרום לך ולאמא לחתום על הבוחן המביש שלו בהיסטוריה,"Getting you and Mom to sign his ""Hall of Shame"" History exam",Make you and mom sign his shameful examiner in history,73
410,בוחן בהיסטוריה,History exam,Examining in history,75
411,מצטער וויל,Sorry Will,Sorry Will Will,80
412,אמא אבא אם זה מנחם אתכם אני קיבלתי ציון מעולה בבוחן ואני חייב לומר שהוא היה ממש קל,"Mom Dad if it's any consolation I got an ""A"" on the test  and I must say I found it very easy",Mother Dad if it comforted you I got a great score in the exam and I must say he was really easy,62
413,קרלטון אשלי אנחנו רוצים לדבר עם וויל לבד,Carlton Ashley we'd like to talk to Will alone,Carlton Ashley we want to talk to Will alone,87
414,וויל מה קורה פה,Will what is going on here,Will what happens here,67
415,אתה מצליח כל כך באנגלית ומתמטיקה,You do so well in English and Math,You succeed so in English and math,82
416,למה אתה כל כך גרוע בהיסטוריה,How could you do so poorly in History,Why are you so bad in history,61
417,זו לא אשמתי,It's not my fault,it's not my fault,100
418,אל תיתן לנו תירוצים וויל,Don't give us that Will,Don't give us excuses Will,73
419,לא אני מתכוון שהם לא מלמדים את כל הסיפור,No what I meant was they don't teach the whole story,No i mean they don't teach the whole story,89
420,אנחנו לא לומדים שום דבר על שחורים בהיסטוריה האמריקאית,We don't learn nothing about the Black people in American history,We don't learn anything about blacks in American history,76
421,אם היו מלמדים את זה אולי הייתי מתעניין ועובד קשה יותר,If they taught that maybe I'd be more interested and work harder,If they were taught maybe I would have been interested and working harder,76
422,זה לא רעיון רע כל כך,That's not a bad idea,It's not a bad idea so,79
423,זה לא,It's not,It is not,71
424,-זה לא,It's not,-It is not,71
425,זה לא,It's not,It is not,71
426,קרלטון תפסיק לצותת!,Carlton stop eavesdropping!,Carlton will stop hiring!,68
427,סליחה אמא,Sorry Mom,Sorry mom,100
428,זה לא מתרץ את הציון הגרוע שלך אבל נגעת בנקודה נכונה בנוגע לתוכנית הלימודים,This does not excuse your bad grade  but you've made a good point about the curriculum,This does not mourn your bad score but touched on a correct point regarding the curriculum,62
429,אז כולנו מסכימים כאן,So we all agree here,So we all agree here,100
430,שום דבר מזה הוא לא באשמתי,None of this is any of my fault,Nothing of that is not my fault,71
431,העלית נקודה חשובה אבל אם אתה רוצה ללמוד את ההיסטוריה של השחורים מה תעשה בנידון,You brought up a valid point here  but if you want to learn Black history what are you gonna do about it,You have an important point but if you want to learn the history of blacks what you will do,70
432,כתוב הצהרה מדוע ההיסטוריה של השחורים צריכה להיכנס לתוכנית הלימודים,Write a statement about why more Black history  should be added to the curriculum,Write a statement why the history of blacks should enter the curriculum,81
433,הצג זאת בישיבת ההורים והמורים בשבוע הבא,Present it at next week's parent-teachers' meeting,View this at the next week's parents and teachers meeting,75
434,אני אלך איתך,I'll go with you,I will go with you,94
435,ההנהלה תשקול את העתירה המציעה לנו לשנות את סיסמת בית הספר,The administration will consider the petition  suggesting that we change the school motto to,Management will consider the petition that offers us to change the school password,66
436,"לסיסמא ""אקדמיית בל אייר:","""Bel-Air Academy:","For the password ""Bell Air Academy:",62
437,"""או לך לבית ספר ציבורי ""","""Or Go To Public School ""","""Or you to a public school""",85
438,'מר סמית,Mr Smith,'Mr. Smith,100
439,אני חושב שמונעים מהתלמידים בבית הספר הזה חוויית לימודים בעלת ערך,I think the students at this school are being cheated  out of a valuable learning experience,I think students in this school experience with valuable study,69
440,אני מדבר על שיעור ההיסטוריה של המאמן סמיילי,I'm talking about Coach Smiley's History class,I am talking about the classroom of coach Smiley,74
441,'זה פרופסור סמיילי סמית,That's Professor Smiley Smith,'It's Professor Smith,69
442,'מהי דאגתך מר סמית,What's your concern Mr Smith,'What is your concern Mr. Smith,91
443,זה כמו כשלא היו סרטים של אף אח שחור,It's like when there wasn't no pictures of any brothers on the wall,It's like when there were no black brother movies,64
444,אתם מכירים את הסרט של ספייק לי עשה את הדבר הנכון,You know Spike Lee's movie Do the Right Thing,You know Spike Lee's movie did the right thing,97
445,אני מצטער,I'm sorry,I'm sorry,100
446,הסרט האחרון שראיתי היה ללכת שבי אחריו,The last movie I saw was Dead Poets Society,The last movie I saw was to go after me,63
447,עם המנהל הנכון זה היה יכול להיות סיפור שונה לגמרי,With the right headmaster  that would have been a completely different story,With the right manager it could have been a completely different story,80
448,אני מעוניין להעלות שלוש נקודות,I'd like to make three points,I would like to upload three points,69
449,דבר ראשון בקורס שלי אנחנו מנסים לדחוס מאתיים ומשהו שנים של היסטוריה לתוך תשעה חודשים של שיעורים,First in my course we are trying to condense 200 and  some odd years of history  into nine months of lessons,First thing in my course we try to compress two hundred and years of history into nine months of lessons,79
450,ברור שעלינו להתרכז בכמה דמויות היסטוריות ולהימנע מאחרות,Obviously we have to concentrate  on some historical figures and exclude others,Obviously we have to concentrate on some historical characters and avoid others,79
451,זה נכון,That's true,This is true,78
452,דבר שני בבית ספרנו ישנה ספרייה מצויינת כך אומרים שבה יכול כל תלמיד ללמוד יותר על ההיסטוריה של השחורים,Second our school  has a fine library or so I've been told  where any student can study more about Black history,Secondly in our school there is an excellent library so it is said that each student can learn more about the history of blacks,72
453,עוד נקודה טובה,Another good point,Another good point,100
454,דבר שלישי:,Third:,Third thing:,62
455,מזה שנים שאני מלמד את הקורס שלי מספר הלימוד המכובד הזה ולמען האמת אני לא יודע דבר מעבר למה שנמצא בספר הזה,For years I have taught my course from this well-respected textbook  and quite frankly I don't know a lick more than what's in this book,For years I have been teaching my course of this respectable study number and in fact I know nothing beyond what is in this book,63
456,אז תשכח מזה,So forget it,So forget it,100
457,אבל אני חושב שזה חשוב,-But I think it's important,But I think it's important,100
458,וזה חשוב,-But I think it's important,And that is important,68
459,לצערי בספר החוקים של בית הספר כתוב בבירור שאל כל בקשה בנוגע לתוכנית הלימודים צריכה להתלוות  עצומה חתומה על ידי 150 תלמידים,Unfortunately the school rulebook clearly states that any requests pertaining to  curriculum changes be accompanied by-- A petition signed by 150 student signatures,"Unfortunately, the school's law book is clearly written on the curriculum should be accompanied by a huge signed by 150 students",68
460,סעיף 4 פסקה 9,Article 4 Section 9,Section 4 paragraph 9,70
461,איפה מצאת את הספר הזה,Where'd you get ahold of that book,Where did you find this book,68
462,ייקח זמן מה כדי לשנות את תוכנית הלימודים,It certainly will take some time to revise the curriculum,Will take some time to change the curriculum,81
463,מה בנוגע למציאת מישהו שיחליף את המאמן סמיילי לחודש וילמד קצת היסטוריה שחורה,What about having somebody  come in to replace Coach Smiley for a month  to teach some Black history,What about finding someone to replace the Smiley coach for a month and learn some black history,80
464,ארמסטרונג אני חושב שיש משהו בדבריו,Armstrong I think the kid's got something here,Armstrong I think there is something in his words,78
465,יהיה מה שיהיה אני בטוח שייקח קצת זמן עד שנמצא מורה,Be that as it may I'm sure it will be some while  before we can find a teacher,Will be whatever I will be sure to take some time until a teacher is found,61
466,חס וחלילה גברת בנקס אנחנו רוצים להיות בטוחים שהאדם שנעסיק מוסמך,Not at all Mrs Banks  we want to make sure that the person we get is properly qualified,God forbid Mrs. Banks we want to be sure that the person who has been employed is qualified,66
467,לדוגמא פרופסור בקולג' עם תואר דוקטור שלימד היסטוריה שחורה וספרות ברמה של אוניברסיטה,For example a college professor with a Ph D  who's taught Black History and Literature  at the university level,"For example, a college professor with a Doctor degree taught black history and literature at a university level",88
468,איפה תמצאו מישהו כזה,-Where would we find someone like that,Where will you find someone like that,86
469,-אתה מסתכל עליה,-You're looking at her,-You look at her,83
470,נתראה בעוד חודש,See you in a month,See you in a month,100
471,בסדר עכשיו שאנחנו לומדים משהו שאני יודע אני אהיה הכוכב של הכיתה הזאת,All right now that we're studying something I know  I'm gonna be the star of this class,Ok now that we learn something I know I'll be the star of this class,75
472,לא אתה לא אני אהיה,No you're not I am,No you no i will be,70
473,מה אתה על סמים,What are you tripping,What are you on drugs,71
474,איך אתה מתכנן לעשות את זה,How do you figure that,How do you plan to do this,62
475,כי המורה היא האמא שלי,Because the teacher's my mommy,That the teacher is my mom,71
476,בוקר טוב תלמידים,Good morning class,good morning students,62
477,אמא הייתי רוצה לברך אותך ולהגיד לך בשם כל הכיתה כמה שאנחנו שמחים שאת כאן,Mom I'd like to welcome you and say on behalf of the entire class  how happy we are to have you here,Mom I would like to greet you and tell you in the name of all the class as we are happy to be here,72
478,איך קראת לי מר בנקס,What did you call me Mr Banks,How did you call me Mr. Banks,84
479,"איך שאני תמיד קורא לך: ""אמא ""","What I always call you: ""Mom ""","The way I always call you: ""Mom""",84
480,"השם שלי אינו ""אמא"" שמי פרופסור בנקס","My name is not ""Mom "" My name is Professor Banks",My name is not “mom” my name is Professor Banks,100
481,כן פרופסור בנקס,Yes Professor Banks,Yes Professor Banks,100
482,היסטוריה אמריקאית שחורה רבותיי מאפריקה לעבדות להווה,Black American history gentlemen  from Africa to slavery to the present,Black American history from Africa to slavery to present,89
483,כולנו שמענו על פרדריק דאגלאס מרטין לותר קינג ובוקר טי וושינגטון,We've all heard of Frederick Douglass  Martin Luther King and Booker T Washington,We all heard about Frederick Douglas Martin Luther King Booker T. Washington,89
484,אבל בהיסטוריה השחורה יש הרבה אנשים ששמותיהם ופניהם אינם זכורים כיום,But Black history includes a lot of people  whose names and faces aren't remembered today,But in black history there are many people whose names and their faces are not remembered today,82
485,כמה מכם שמעו את שירי הדת ששרו העבדים,How many of you have heard the spirituals sung by the slaves,Some of you have heard the Slames Religious Songs,61
486,אני שמעתי,I have,I heard,62
487,הקשיבו לזה:,Now listen to this:,Listen to that:,75
488,זה היה ממש מגניב,That was pretty cool,It was really cool,63
489,מה אתם משערים שהיתה מטרת השיר הזה,What do you suppose the purpose of that song was,What do you speculate that this song purpose,80
490,תנו לי לטפל בזה,Let me handle this one,Let me take care of that,65
491,העבדים נהגו לשיר אותם כדי לשמור על מצב רוח מרומם ועל מחשבתם על אלוהים בפני הדיכוי שהם סבלו,The slaves used to sing them  to keep their spirits up and their minds on God  in the face of all the oppression that they suffered,The slaves used to sing them to maintain an uplifting mood and thought of God to the oppression they suffered from,69
492,השיר הזה נכתב בתור קוד סודי במחתרת השחרור,That song was written to be used  as a secret code of the Underground Railroad,This song was written as a secret code in the release of the release,69
493,קוד סודי,Secret code,secret code,100
494,למה את מתכוונת,What do you mean,What do you mean,100
495,מחתרת השחרור היתה קבוצת אנשים שהובילה את השחורים לחופש,The Underground Railroad was a group of people  that led the slaves to freedom,The Liberation underground was a group of people who led blacks to freedom,69
496,'זה מכסה בערך 250 שנה מר סמית,That covers about 250 years Mr Smith,'It covers about 250 years Mr. Smith,89
497,את מתכוונת עכשיו,What do you mean,You mean now,71
498,'שב מר סמית,Sit down Mr Smith,'Sit Mr. Smith,83
499,היא נוסדה בשנות ה-40 של המאה ה-19,It was established during the 1840s,She was founded in the 1940s,60
500,הארייט טובמן שפחה לשעבר היתה אחת המנהיגים,Harriet Tubman an ex-slave was one of the leaders,Harrite Tobman former slave was one of the leaders,87
501,שירי הנשמה האלה היו בעצם מסרים סודיים שנשלחו כדי לספר לעבדים הנמלטים איך להגיע לחופש,These gospel songs were actually secret messages sent  to tell the runaway slaves how to get to freedom,These soul songs were actually secret messages sent to tell the slaves fugitive how to get to freedom,86
502,"לדוגמא ""כלי השתיה"" המתייחס לקבוצת הכוכבים העגלה הגדולה","For example ""the drinking gourd"" referred to the Big Dipper","For example, ""drinking tools"" referring to the Great Star Group",68
503,כשהעבדים שרו עקוב אחר כלי השתיה הם סימנו לעבדים הנמלטים לרוץ לעבר העגלה הגדולה,When the slaves sang follow the Drinking Gourd  that signaled to the runaway slaves to run towards the Big Dipper,"When the slaves sang a trace of drinking instruments, they marked the slaves fleeing to run toward the big cart",67
504,לזה התכוונתי,That's what I meant,this is what I meant,77
505,תוכלי ללמד אותנו שיר אחד פרופסור,Could you teach us one of the songs Professor,You can teach us one professor song,82
506,הנה אחד הנקרא לחצות את הנהר,Here's one called Wade in the Water,Here is one called to cross the river,67
507,השיר הזה אמר לעבדים הנמלטים שדרך הבריחה הכי טובה היא לאורך הנהר,This song told runaway slaves that the best escape route was along the river,This song told the fugitive slaves that the best escape way is along the river,79
508,מאוחר בלילה השירים האלה הגיעו מביתני העבדים לאורך הדרך הם הנחו את הנמלטים אל עבר החופש,Late at night these songs could be heard  coming from slave cabins along the route  guiding the runaways to freedom,Late at night these songs came from slave homes along the way they placed the fugitives toward freedom,68
509,כולם הצטרפו עכשיו,Everybody join in now,Everyone joined now,80
510,לא רע חבר'ה,Not bad guys,Not bad guys,100
511,המשימה לשבוע הבא היא חיבור על ניסוי פורט רויאל 'ובית הספר פן  כתוב בידי מר סמית,Next week's assignment will be a report on the Port Royal Experiment  and the Penn School written by Mr Smith,The next week's mission is a connection on Fort Royal experiment and the Penn School is written by Mr. Smith,72
512,מי אני,Who me,Who am I,71
513,הקורס הזה היה הרעיון שלך,This course was your idea,This course was your idea,100
514,איזה כבוד,What an honor,What an honor,100
515,מר סמית' יכתוב את החצי הראשון של החיבור את החצי השני יכתוב מר בנקס,Mr Smith will write the first half of the report  the second half will be written by Mr Banks,Mr. Smith will write the first half of the connection the other half will write Mr. Banks,85
516,מי אני,Who me,Who am I,71
517,אני מצפה לחיבור של לפחות 15 עמודים מודפסים עם רווחים כפולים עם הערות שוליים וביבליוגרפיה,I expect it to be at least 15 pages  typed double-spaced with footnotes and a bibliography,I look forward to connecting at least 15 pages printed with dual profits with footnotes and bibliography,67
518,הקורס הזה היה רעיון מבריק,This course was a brilliant idea,This course was a brilliant idea,100
519,היא אמא שלך!,She's your mom !,She's your mom!,100
520,אני לא מאמין שאמא בחרה בנו לעשות את המטלה המיוחדת,I can't believe Mom picked us to do that special assignment,I don't believe Mom has chosen us to do the special task,68
521,המאמן סמיילי לעולם לא היה עושה דבר כזה,Coach Smiley never would have did that,Coach Smiley would never do such a thing,74
522,"הוא נהג לומר ""עבודה נוספת לכם","He used to say ""Extra work for you",He used to say “extra work for you,100
523,תסלח לי,Excuse me,Excuse me,100
524,אולי את יכולה לעזור לי כאן,Maybe you can help me out here,Maybe you can help me here,93
525,איבדתי את התחושה בשפתיים,I've lost the feeling in my lips,I lost the feeling in the lips,90
526,אני קרלטון בנקס,I'm Carlton Banks,I am Carlton Banks,86
527,זה נכון הקרלטון בנקס,That's right the Carlton Banks,This is true Carlton Banks,79
528,רוצות ללכת מפה לאכול משהו,Want to slide out of here get something to eat,Want to go a map to eat something,71
529,וויל קרלטון  חיפשתי אתכם,Will Carlton I've been looking for you,Will Carlton I was looking for you,86
530,כן,Yes,Yes,100
531,שנייה יש לי משהו בשבילכם,Just a second I've got something for you,Second I have something for you,76
532,הספר הזה יעזור לכם עם החיבור,This book will help you with your research paper,This book will help you with the connection,66
533,הוא בנוגע לבית הספר פן,It's about the Penn School,Is about Penn School,83
534,שארלוט פורטן היתה אחת המורות השחורות הראשונות שלימדו בו  וויל!,Charlotte Forten was one of its first Black teachers and she   Will!,Charlotte Fortan was one of the first black teachers to study Will!,82
535,אתה מקשיב לי,-Are you listening to me,You listen to me,82
536,-כמובן,-Of course,-of course,100
537,את מדברת על בית הספר פן,You were talking about the Penn School,You're talking about Penn School,83
538,מה אמרתי בנוגע לבית הספר פן,What did I say about the Penn School,What did I say about Penn School,94
539,זה מעבר לפינה של בית הספר של פיטר פן,It's right around the corner from the Pencil School,This is around the corner of Peter Penn's school,75
540,תודה אמא,Thanks Mom,Thanks Mom,100
541,קרלטון כמה פעמים אני צריכה להגיד לך תכניס את החולצה למכנסיים!,Carlton how many times do I have to tell you  tuck in your shirt!,Carlton how many times I have to tell you to put the shirt into my pants!,77
542,תסתכל על עצמך,Look at you,look at yourself,81
543,באמת וויל הגבות האלה!,Honestly Will  those eyebrows!,Really these eyebrows Will!,81
544,אנחנו הולכים לספרייה,We're going to the library,We are going to the library,87
545,ג'פרי אני הולכת לראיון העבודה הראשון שלי בגלריה לאמנות ואני צריכה כמה עצות,Geoffrey I'm going on my first job interview at an art gallery  and I need some advice,Jeffrey I'm going to my first job interview at the Art Gallery and I need some tips,75
546,אתה היית בהרבה ראיונות עבודה נכון,You've been on a lot of job interviews haven't you,You have been in a lot of job interviews right,83
547,ובכן כן העלמה הילרי,Why yes Miss Hilary,Well yes Miss Hillary,85
548,אני עובד כל חיי,I've worked my entire life,I work all my life,68
549,באמת,Really,really,100
550,למה,Why,Why,100
551,כי תמיד הייתי משוחד בנוגע לאוכל ומחסה,Because I've always been partial to food and shelter,Because I was always bribery about food and shelter,72
