,hebrewFromSub,englishFromSub,englishTranslation,ratio
665,אז צא לשם ומה שתתפוס תתפוס ומה שלא תתפוס לא תתפוס ,So just go on out there  and what you catch you catch and what you miss you miss ,So go out there and what you catch will catch and what you do not catch you will not catch,75
666,-טוב אבא ,Okay Dad ,- Good Dad,62
667,יפה מאוד קווין!,You´re beautiful ,Very beautiful Kevin!,63
668,תודה לכם ,Thank you ,Thank you,100
669,אני היום האדם המאושר הבטוח והמאוזן ביותר בעולם ,And thanks to him today  I´m the happiest most confident  and most well-adjusted person in this world ,"I am today the safest, happiest and most balanced happy person in the world",70
670,אבא אני אוהב אותך ,Dad I love you ,"Dad, I love you",100
671,אתה הגדול מכולם ,You´re the greatest ,You are the greatest of them all,64
672,בואו נוציא עוד אחד חבר'ה!,All right! One more out guys!,Let's get another one out guys!,60
673,בסדר אדם ,Okay Dad ,Okay man,75
674,אלוהים תן להם לנצח במשחק אחד!,Please God let ´em win one game ,God let them win in one game!,76
675,למה ביקשת ממני לשחק בסיס שני ,Why´d you make me play second base ,Why did you ask me to play second base,79
676,מישהו טיפס למגדל הפעמונים עם רובה ,Someone´s climbed to the roof of the bell tower with a rifle!,Someone climbed the bell tower with a rifle,84
677,זה קווין בקמן!,It´s Kevin Buckman ,This is Kevin Beckman!,79
678,הכרחת אותי לשחק בסיס שני!,You made me play second base!,You forced me to play second base!,82
679,קווין אני מצטער עשיתי כמיטב יכולתי ,Kevin I´m sorry I did the best I could ,Kevin I'm sorry I did my best,73
680,ירייה טובה בן!,Nice shot son ,Good shot son!,69
681,חשוב לתת תמיכה ,It´s important to be supportive ,It is important to give support,82
682,בוא נשיר אחד מהשירים הישנים ההם ,Come on Let´s sing one of the old tunes ,Let's sing one of those old songs,65
683,"""כשאתה מחליק לבסיס הבית עם משהו דביק במכנסיים  """,When you´re sliding into home and your pants are full of foam,"""When you slip into the base of the house with something sticky in your pants""",60
684,ובכן ,Well ,Well,100
685,-למה אתה שופך מים לדיאפרגמה שלי ,Why are you pouring water through my diaphragm ,-Why are you pouring water into my diaphragm,85
686,כדי לבדוק ,To check ,to check,100
687,לראות אם היא בסדר ,To see if it´s okay ,See if she's okay,69
688,לא ידעת שאני עושה את זה נכון -לא ,You didn´t know I did that huh ,You did not know I was doing it right - no,67
689,אתה מאשים אותי שעשיתי את החור הזה ,Are you accusing me of making that hole ,You blame me for making this hole,69
690,לא נקר התעופף לכאן נכנס לאמבטיה פתח את המגירה וחורר את הדיאפרגמה!,No a woodpecker came in here went into the bathroom  opened the drawer with his wing and pecked holes in your diaphragm ,No woodpecker flew here and went into the bathroom opened the drawer and punctured the diaphragm!,76
691,אני לא מאמין שסיכנת את התכניות שלנו!,I can´t believe you would jeopardize our plan ,I can not believe I risked our plans!,65
692,זוכרת מה שקראנו ,Remember what we read ,Remember what we read,100
693,רוב האנשים המיוחדים במינם הם ילדים יחידים או בכורים ויש הפרש של 5 שנים לפחות בין הצאצאים ,A majority of exceptional people are either only children  or firstborns with five years between sibs ,Most of the special people are single or eldest children and there is a difference of at least 5 years between the offspring,61
694,אנחנו הסכמנו ש  ,- We agreed--,We agreed that,78
695,-לא אתה הסכמת ,- No you agreed ,- You did not agree,87
696,ואני רוצה עוד אחד!,They´re babies and I want another one ,And I want another one!,76
697,וזו הדרך שלך ,- We discussed this years ago!,And this is your way,60
698,-דנתי בזה אתך לפני שנים!,- We discussed this years ago!,- I discussed this with you years ago!,84
699,אני חושבת שטעינו ,I think we were wrong ,I think we were wrong,100
700,-אני חושב שצדקנו לא אדון בזה שוב!,I think we were right and I´m not discussing it again ,- I think we were right I will not discuss this again!,80
701,טוד!,- Tod ,Todd!,86
702,רוצה שאכין לך ארוחת בוקר ,- Yeah - Do you want me to make breakfast ,Want me to make you breakfast,88
703,לא תודה הלן ,- No thanks Helen ,No thanks Helen,100
704,אני אביא את מכשיר כיבוי ,- l´ll get the fire extinguisher ,I'll bring the fire extinguisher,82
705,נתראה בארוחת ערב ישו!,I´ll see you guys at dinner ,See you at Jesus' dinner!,82
706,מה אתם עושים ,Sweet Jesus! What are you doing ,What are you doing,75
707,את מתגייסת לחיל הנחתים ,Are you joining the Marines ,You enlist in the Marine Corps,70
708,ידעתי שתעשי מזה עניין אימא ,I knew you´d make a thing out of this Mom ,I knew you were going to make it a matter of mom,61
709,-תנקו את השערות!,Just clean up the hair ,- Clean your hair!,65
710,רוצה משהו לאכול ,Want anything to eat ,Want something to eat,68
711,כמה זמן הם יגורו כאן ,How long are they gonna be living here ,How long will they live here?,67
712,-אני חושבת שלא הרבה ,Not much longer I think ,- I think not much,82
713,חשבתי קצת ,Not yet I thought I´d call him ,I thought a little,60
714,נעשה פה די צפוף ,It´s getting pretty crowded here ,It's getting pretty crowded here,95
715,-לא כל כך צפוף ,It´s not so crowded ,-Not so crowded,88
716,התפנה מקום מאז שהם גילחו את הראש ,There´s a lot more room since they shaved their heads ,A place has become vacant since they shaved their heads,65
717,חשבתי  אולי אוכל לגור קצת אצל אבא ,Maybe I should live with him for a while ,I thought maybe I could live with Dad for a while,79
718,מה ,What ,what,100
719,אני גר פה הרבה זמן ,I´ve been here a long time ,I have lived here for a long time,76
720,אולי אני צריך לגור קצת אצלו ,Maybe I should live with him for a while ,Maybe I should live with him for a while,100
721,אתה רוצה לגור עם אביך ,You wanna live with your father ,You want to live with your father,91
722,דיברת אתו על זה ,Have you talked to your father about that ,You talked to him about it,66
723,חשבתי להתקשר אליו ,Not yet I thought I´d call him ,I thought of calling him,75
724,מותק אתה לא מכיר את אביך כמוני ,Honey  you don´t know your father like I do ,"Honey, you do not know your father as well as I do",80
725,אני לא מכיר אותו בכלל ,I don´t know him at all ,I do not know him at all,87
726,מה המספר שלו ,What´s his number ,What's his number?,91
727,"כן  ד ""ר למקין נמצא ",is Dr Lampkin there ,"Yes, Dr. Lemkin is here",65
728,לא אבא זה לא ג'ואי ,No Dad it´s not Joey ,No Dad it's not Joey,92
729,זה גרי בנך השני ,It´s Garry your other son ,This is your second son Gary,69
730,עליי לשאול אותך משהו ,I need to ask you something ,I need to ask you something,100
731,האם זה בסדר  שאגור אצלך במשך זמן מה ,Would it be okay if I stay with you for a while ,Is it okay for me to live with you for a while?,73
732,כמה חודשים ,A few months ,A few months,100
733,הוא  זה לא נראה לו רעיון טוב ,He didn´t think it was such a good idea ,He it does not seem to him a good idea,61
734,"מתי ""קאובוי דן"" אקדוחן הבלונים מגיע ",When´s Cowboy Dan the gun-fighting balloon man gonna be here ,"When the ""Cowboy Dan"" Balloon Gun arrives",63
735,זה השמוק שהביא את הסוס ,That´s the schmuck who brought the horse ,It's the dick that brought the horse,75
736,אני לא חושב שהוא יבוא ,- l don´t think he´s coming ,I do not think he will come,64
737,הוא מקצוען ,He´s a professional ,He is a professional,95
738,חושב שהוא ירצה להטיל כתם על כל מקצוע כיפוף הבלונים ,You think he wants to put a blot on the entire balloon-bending profession ,Think he would want to put a stain on any balloon bending profession,81
739,לכו תיהנו תכף תקבלו המבורגרים ונקניקיות ,Go on and have fun We´ll have burgers and dogs in a second ,Go enjoy and soon you will get burgers and hot dogs,67
740,בואו נראה איך הסוס מחרבן! -כן!,Let´s go watch the horse shit ,Let's see how the horse shit! -Yes!,67
741,פטי אולי תשחקי עם ג'סטין ,Why don´t you play with Justin ,Patty might play with Justin,60
742,אני לא מבינה מה הוא עושה ,I don´t understand what he´s doing ,I do not understand what he is doing,79
743,לשם מה ,What for ,For what,100
744,-בלי סיבה בשביל הכיף ,No reason Just for fun ,- For no reason for fun,79
745,זה לא נראה כיף ,Doesn´t look like fun ,It does not seem fun,60
746,-זה לא ,It isn´t ,-It is not,62
747,ניסית את זה ,You tried it ,You tried it,100
748,לג'ולי יש בית נחמד ,So does Julie have a nice place ,Julie has a nice home,65
749,-כן יש לה בית נחמד מאוד ,Yeah she has a lovely place ,"- Yes, she has a very nice house",64
750,יש לה הבית שלי ,She has my place ,She has my house,62
751,היא וטוד שניהם גרים אצלי ,Maybe I should live with him for a while ,She and Todd both live with me,63
752,למעשה זה היה הרעיון שלי ,Actually it was my idea ,In fact that was my idea,72
753,בסדר בסדר  הנה תעלול האגודל ,- The thumb trick Show her Dad ,All right All right here's the thumb trick,66
754,מוכנים תעשה את תעלול האגודל!,Here we go The thumb trick Ready ,Ready to do the thumb trick!,78
755,מה אתה עושה ,- What are you doing ,What are you doing,100
756,-תראה לה אבא ,- The thumb trick Show her Dad ,"- Show her, Dad",60
757,זו הפעם האחרונה ,Okay but this is the last time ,This is the last time,82
758,מוכנים ,Really ,Ready,73
759,ג'סטין יוכל ללכת לכל היום בשנה הבאה אז כולם שואלים מתי אני חוזרת לעבודה כאילו שזה מה שעליי לעשות ,I mean Justin is gonna go full-time next year  so everybody´s askin´ when I´m gonna go back to work like I´m supposed to ,Justin will be able to go all day next year so everyone asks when I'm going back to work like that's what I need to do,64
760,אני חושבת על זה פעם עבדתי ,And I´m thinkin´ about it ,I think about it once I worked,64
761,אני חושבת שאני טובה יותר בזה ,But I think I´m better at this ,I think I'm better at it,79
762,אני חושבת שאני די טובה בזה ,I think I´m sort of good at it so--,I think I'm pretty good at it,79
763,אני לא יודעת ,Oh I don´t know ,I do not know,81
764,-מה אומר גיל ,What does Gil say ,- What does age say?,76
765,שעליי לעשות מה שאני רוצה ,He says I should do whatever I want ,That I have to do what I want,72
766,יכולתי להרוג אותו על זה ,I could have killed him for that ,I could have killed him for it,87
767,מה מטריד אותך כל כך ,What are you so upset about ,What bothers you so much,67
768,נתן היא משונה ,Nathan she´s weird ,Nathan is weird,75
769,כמה ימים בשבוע בגן ילדים יועילו לה מאוד ,I think a few days a week of preschool could be very helpful ,A few days a week in kindergarten will be very helpful to her,66
770,היא לא בגיל הנכון להפעלה חברתית ,This is not the right age for Patty to be socially activated ,She is not at the right age for social activation,73
771,את רוצה שהיא תתקשר אתו ,You want her to relate to him ,You want her to call him,72
772,כשפגשתי אותו הייתי קצת פראית קצת חסרת שליטה ,When I met him I was a little wild I was a little out of control ,When I met him I was a little wild and a little out of control,92
773,הוא  לקח אותי בידיים ,He kind of took me in hand ,He took me in his arms,71
774,זה מצא חן בעיניי ,I liked that ,I liked it,64
775,הוא לוקח פיקוד ,He´s very commanding ,He takes command,69
776,הוא ממש הדליק אותי ,Boy he really turned me on ,He really turned me on,92
777,-באמת ,Really ,-really,100
778,כלומר  כן באמת ,I mean of course really ,I mean yes really,65
779,נתן ואני היינו ממש חמים ,Nathan and I used to be hot ,Nathan and I were really hot,69
780,הוא לא נראה כזה אבל היינו כמו שפנים ,I know he doesn´t look it but we were like rabbits ,He did not look like that but we were like rabbits,75
781,הייתי עושה לו את יודעת  אוראלי  על הכביש ,I used to give him you know  oral you know on the highway ,I would make him know oral on the road,60
782,מה ,What ,what,100
783,ואת חשבת שזה יעזור ,And you thought that would help ,And you thought it would help,93
784,כשהייתי רואה שהוא באמת מתוח מאוד הייתי מתכופפת אליו כשהוא נהג  סוזן ,So if I saw him getting really tense I´d just  lean over while he was driving and I´d--,When I saw he was really very tense I would bend over to him as he drove Susan,65
785,-דיברתי עם אמך ,I just spoke to your mother ,- I talked to your mother,76
786,סבתא רוצה לגור אצל הלן ,Grandmother wants to stay at Helen´s for a while ,Grandma wants to live with Helen,63
787,תוכלי לקחת אותה מחר לשם -בוודאי ,- Can you drive her there tomorrow ,You can take her there tomorrow - for sure,78
788,הוא אוהב לחבוט בראשו ,He likes to butt things with his head ,He likes to bang his head,71
789,-את בוודאי גאה בו מאוד ,How proud you must be ,- You must be very proud of him,76
790,כן תן מכה טובה!,Really give it a good shot ,Yes give a good blow!,61
791,כשאני נולדתי גרובר קליבלנד היה נשיא ,When I was born Grover Cleveland was president ,When I was born Gruber Cleveland was president,96
792,איפה לעשות את זה ,Where should I do it ,Where to do it,76
793,מי את ומה בכוונתך לעשות ,Who are you and what are you going to do ,Who you are and what you intend to do,86
794,אני החשפנית שלכם ,I´m your stripper ,I'm your stripper,97
795,כן הם בלבלו ביני לבין קאובוי דן אני מצטערת שלום ,It was a mix-up I got Cowboy Dan´s card and he got mine I´m sorry ,Yes they confused me and Cowboy Dan I'm sorry hello,63
796,רקרגע ,Wait a minute ,just a minute,62
797,קאובוי דן לא בא ,Cowboy Dan´s not coming ,Cowboy Dan did not come,80
798,-ידעתי! אמרתי לך!,I told you ,-I have known! I told you!,61
799,כל הילדים ישנאו אותי ,All the kids are gonna hate me ,All the kids will hate me,73
800,זה יהיה כמו בליגת הנוער ,It´s gonna be just like Little League ,It will be like in the youth league,62
801,קאובוי דן יבוא ,- Cowboy Dan is coming ,Cowboy Dan will come,80
802,-הוא בא!,He´s coming!,-He is coming!,91
803,קאובוי דן מגיע!,- Cowboy Dan is coming ,Cowboy Dan is coming!,100
804,שלום חבר'ה ,- Hello Helen ,Hello friend,70
805,אתה אבא של קווין לא קאובוי דן!,You´re Kevin´s father You´re not Cowboy Dan ,"You're Kevin's dad, not a cowboy Dan!",75
806,קוראים לי קאובוי גיל כמו בגיל-יוטינה!,They call me Cowboy Gil  as in guilty ,My name is Cowboy Gil as in Age-Yutina!,62
807,הפרצוף של קאובוי דן לא מצא חן בעיניי ,I saw Cowboy Dan I didn´t like the look on his face ,I did not like Cowboy Dan's face,73
808,הוא היה ככה אז הרגתי אותו ,It was like this so I killed him ,He was like that so I killed him,84
809,עשיתי בו חור  כזה גדול!,I blew a hole in him this big ,I made such a big hole in it!,63
810,האמת היא שהוא היה  כזה גדול!,- No Gran this is a tape ,The truth is he was so great!,60
811,עכשיו כשאני חושב על זה בעצם החור היה כזה גדול!,You know when I think about it that hole was about this big ,Now that I think about it actually the hole was that big!,73
812,המעיים שלו נשפכו החוצה על הרצפה ,And his guts were spilled out all over the floor ,His intestines spilled out on the floor,60
813,וכשהלכתי משם החלקתי על המעיים שלו ,As I was walkin´ away I slip around on his guts ,And as I walked away I slipped on his gut,83
814,אחרי שאני עושה חור במישהו ואחרי שאני מחליק על המעיים שלו  אני תמיד אוהב לעשות חיות מבלונים ,After I blow a hole in somebody and slip around on their guts  afterwards I always like to make balloon animals ,After I make a hole in someone and after I slide on his gut I always like to make animals out of balloons,78
815,המעי הגס שלכם!,I told you ,Your colon!,60
816,לאן הלך קאובוי גיל ,Where´s Cowboy Gil ,Where did Cowboy Gil go?,80
817,זו האישה של קאובוי גיל ,That´s Cowboy Gil´s woman ,This is Cowboy Gil's wife,71
818,קודי קידה גברת קטנה ,Take a bow little lady ,Little lady bow codes,70
819,אני מקווה שאם אשוב לכאן באחד הימים לא תתנגדי אם אכנס לומר לך שלום ,I sure hope that when I mosey back this way one day  you don´t mind if I stop in and say hello ,I hope that if I come back here one day you will not object if I go in to say hello to you,66
820,קווין אני מקווה שלא תשכח את יום ההולדת הזה ,Kevin I hope this is the best danged birthday you ever had ,Kevin I hope you do not forget this birthday,71
821,אל תנסו לבוא אחריי לאביליין ,Don´t try and follow me to Abilene ,Do not try to follow me to Evelyn,61
822,לילה טוב חמודי ,- Good night Mom ,Good night darling,62
823,-לילה טוב אימא ,- Good night Mom ,- Good night mom,100
824,נהנית מיום ההולדת ,Did you have a nice birthday ,Enjoying your birthday,64
825,אבא היה מצחיק ,- Dad was funny ,Dad was funny,100
826,-ועוד איך ,- Yeah ,-Hell yeah,62
827,לילה טוב ילד בן 9 ,Well good night nine-year-old boy ,Good night 9 year old boy,79
828,יום הולדת שמח ילד ,Happy birthday kiddo - Dad ,Happy birthday boy,71
829,כשאגדל אוכל לעבוד איפה שאתה עובד ,When I grow up can I work where you work ,When I grow up I can work where you work,100
830,למה ,Why ,Why,100
831,-ככה נוכל להמשיך להיפגש כל יום ,That way we can still see each other every day ,- That way we can continue to meet every day,66
832,לילה טוב אני אוהב אותך ,Good night I love you ,good night I love you,100
833,-גם אני אוהב אותך ,I love you too ,-I love you too,100
834,אימא ,- Mom ,Mom,100
835,-מה ,- What ,-what,100
836,הובה הובה ,Hubba-hubba ,Huba Huba,90
837,שלום הלן ,- Hello Helen ,Hello Helen,100
838,הדלת הייתה פתוחה אלוהים ,The door was unlocked ,The door was open to God,62
839,-איזה ערוץ זה ,Oh my God - What channel is this ,-Which channel is this,71
840,סבתא זו קלטת ,- No Gran this is a tape ,This grandmother is a tape,79
841,היא זקוקה לגבר עכשיו ,She needs a man ,She needs a man now,88
842,זה לא שלי ,This isn´t mine ,it's not mine,74
843,אני לא צופה בזה ,I don´t watch this ,I'm not watching this,68
844,מה כולם עושים פה ,What´s everybody doing in here ,What is everyone doing here,86
845,פרצת את המנעול שלי ,Did you break my lock ,You broke my lock,79
846,סוזי סבתא אתן מוכנות ללכת לחדרי ,Susie Gran would you please go to my room Sure ,"Susie, Grandma, you're ready to go to my room",74
847,-בטח אחד מהגברים האלה הזכיר לי את סבך יברכו האל ,One of those men reminded me of your grandpa ,-Surely one of these men reminded me of the tangle God will bless,63
848,גרי הקשב ,- Listen ,Gary listened,63
849,-איך יכולת לפרוץ אותו ,- How could you break my lock ,-How could you break it,82
850,באתי לכאן כי חשבתי שאתה משתמש בסמים ,I came in here because I was afraid you were on drugs ,I came here because I thought you were using drugs,78
851,מדוע חשבת כך ,Why would you think that ,Why did you think so,64
852,-בגלל מה שעשית למרפאה של אביך ,Because of what you did to your father´s office ,-Because of what you did to your father's clinic,84
853,למה כוונתך ,What do you mean ,What do you mean?,100
854,-הוא מצא את הפטיש שלך ,He found your hammer ,- He found your hammer,100
855,ראשי-התיבות של שמך חרוטים על הידית ,Those were your initials burned into the handle ,The initials of your name are engraved on the handle,73
856,אתה צודק בכל מה שאתה מרגיש  אתה ילד נהדר ,You´re right to have all these feelings You´re a great kid honey ,You are right in everything you feel you are a great kid,63
857,פשוט יש לך אבא מחורבן ,Did you have a nice birthday ,You just have a damn dad,62
858,"ועליך ללמוד להגיד: ""שילך לעזאזל!""","You´ve just got to learn to say ""The hell with him ""","And you must learn to say, ""Let him go to hell!""",67
859,זו עצה טובה בשביל שנינו ,Actually that´s good advice for both of us ,This is good advice for both of us,80
860,שילך לעזאזל!,- He sure was ,screw him!,60
861,אני לא יודעת מה להגיד על הסרטים ,I don´t know what to say about the tapes ,I do not know what to say about the movies,79
862,אני משערת שאתה צופה בהם משום שאתה סקרן בקשר למין ,I assume you´re watching these  because you´re curious about sex  you know or filmmaking ,I guess you'm watching them because you're curious about sex,74
863,את מי ,Who ,Who,100
864,אותי ,Me ,me,100
865,הוא עסוק עם הילדים שלו ,He´s busy with his own kids ,He is busy with his children,70
866,-איפה אשתי ,-Where´s my wife ,- Where's my wife?,90
867,יש לה אימון מעודדות ,She´s at cheerleading practice ,She has cheerleading training,62
868,מגניב ,-School ,Cool,80
869,אז מה העניינים ,- What´s the matter ,So what matters,77
870,אתה רוצה לשוחח עם טוד ,Would you like to speak to Tod ,You want to talk to Todd,67
871,את בטוחה שאני יכול לדבר ישירות ,Sure we can talk straight ,You're sure I can talk directly,61
872,לפני כמה חודשים עמד לו בפעם הראשונה ,A few months ago Garry got his first boner ,A few months ago he stood for the first time,60
873,את יודעת מה זה ,You know what that is ,You know what it is,80
874,לא נראה שהוא הולך על שיא עולמי ,Apparently he´s goin´ for a world record ,He does not seem to be going for a world record,66
875,העוף שלך נשרף ,Chicken´s burnin´ ,Your chicken was burned,68
876,זה נראה טוב לעזאזל ,Damn! That looked good too ,It looks damn good,65
877,בכל אופן הוא פחד שמשהו אצלו לא בסדר את יודעת ,Anyway he was afraid there was something wrong with him ,"However, he was afraid that something was wrong with him, you know",76
878,שהוא סוטה או משהו כזה ,Like he was a pervert or something ,That he is a pervert or something like that,83
879,אמרתי לו שזה מה שנערים עושים ,I told him that´s what little dudes do ,I told him that was what boys do,70
880,זאת אומרת כולנו עשינו את זה ,I mean we´ve all done it ,I mean we all did it,84
881,זה עשה אותו מאושר ,That made him happy ,It made him happy,78
882,גרי היה מאושר ,- Garry was happy ,Gary was happy,97
883,כן הוא אפילו חייך ,- Yeah He even smiled ,Yes he even smiled,92
884,לא ידעתי בכלל שיש לו שיניים ,I never even knew he had teeth ,I did not even know he had teeth,81
885,אני מניחה שילד בגילו של גרי זקוק לגבר בבית ,I guess a boy Garry´s age really needs a man around ,I guess a kid Gary's needs a man at home,64
886,"""טומטום תקום ותכין לי ארוחת בוקר!""","""Hey asshole get up and make me breakfast ""","""Stupid, get up and make me breakfast!""",75
887,גב' בקמן צריך רישיון כדי לקנות כלב או כדי לנהוג במכונית ,You know Miss Buckman you need a license to buy a dog or drive a car ,Ms. Beckman needs a license to buy a dog or to drive a car,86
888,לעזאזל צריך רישיון לדוג!,Hell you need a license to catch a fish ,Damn you need a fishing license!,71
