,hebrewFromSub,englishFromSub,englishTranslation,ratio
0,קרוגר משתמש בחלומות של ג'ייקוב ,Krueger's using Jacob's dreams ,Kruger uses Jacob's dreams,86
1,אנחנו חייבים לעצור אותו ,We gotta stop him ,We must stop him,67
2,טוב יש  דרך אחת ,Well there is  one way ,Well there is one way,100
3,חשבת על לא לגדל תינוק ,Have you thought about not having the baby ,You thought about not raising a baby,72
4,אני מתככון בלי תינוק-- בלי חלומות של תינוק ,I mean no baby  no baby's dreams ,I'm rummaging without a baby-- without a baby's dreams,63
5,לא אני לא יכולה לעשות את זה ,No I can't do that ,No I can not do it,72
6,אני רואה אותו בתוכי גדל ,I saw him inside of me growing ,I see him inside me growing,88
7,הוא חלק ממני ומדן ,He's part of me and Dan ,He's part of me and Madan,83
8,אני רוצה לגדל אותו ,I want to keep him ,I want to raise him,81
9,בסדר אז נמצא דרך אחרת ,OK then we'll find another way ,Okay so find another way,74
10,אני ראיתי אותה ,I've seen her ,I saw her,64
11,אליס את יכולה להירגע לדקה ,Alice can you come down a minute ,"Alice, you can relax for a minute",75
12,מר ג'ורדן ואני רצינו לראות איך את מרגישה ,Mr Jordan and I wanted to see how you're feeling ,Mr. Jordan and I wanted to see how you felt,91
13,זה באמת לא זמן טוב ,This really isn't a good time ,This is really not a good time,92
14,אולי אתם יכולים לחזור ,Maybe you could come back ,Maybe you can come back,79
15,בכנות תהינו מה את מתכוונת לעשות עם התינוק שלך ,Frankly we wondered what you intend to do with your baby ,Honestly wonder what you intend to do with your baby,87
16,מה אני מה ,What I what ,What I what,100
17,חשבתי על זה ואני מתכננת לגדל אותו ,Well I've thought about it and I plan to keep him ,I thought about it and I plan to grow it,76
18,דאגנו שכל זה  יהיה קצת יותר מדי בשבילך ,We were concerned that all this  might be a little bit too much for you ,We made sure all this would be a little too much for you,71
19,אני מתכוון להיות אם חד הורית והכל ,I mean being single and everything ,I intend to be a single mother and everything,73
20,מה שמר ג'ורדן מתכוון זה שאנחנו מודעים למעמסה  שגידול ילד יעמיס עלייך ,What Mr Jordan means is that we're aware of the burden  that raising a child would place on you ,What Mr. Jordan means is that we are aware of the burden that raising a child will put on you,90
21,אנחנו רוצים עזרה ,We want to help ,We want help,89
22,אנחנו רוצים לאמץ ולגדל את זה כאילו שהוא היה שלנו ,We want to adopt it and raise it as though it were our own ,We want to embrace and grow it as if it were ours,65
23,תראו אני מעריכה את מה שאתם מציעים  אבל לא ,Look I appreciate what you're offering  but no ,Look I appreciate what you offer but no,93
24,הוא באחריותי ,He's my responsibility ,He's my responsibility,100
25,ושלנו ,And ours ,And ours,100
26,הוא הנכד שלנו ,It's our grandchild ,He's our grandson,67
27,עכשיו דוריס אולי זה לא היה רעיון כל כך טוב ,Now Doris maybe this wasn't such a good idea ,Now Doris maybe it was not such a good idea,83
28,אליס אנחנו חוששים שבמצבך הנוכחי  אין לך את היכולת  לטפל בילד ,Alice we're worried that in your present condition  that you don't have the ability  to take care of a child ,Alice we are afraid that in your current situation you do not have the ability to take care of the child,74
29,"מה את מדבר על ""המצב שלי"" ","What are you talking about ""my condition"" ","What are you talking about ""my situation""",82
30,"אנחנו חייבים להתקשר לד""ר מור ",We got a call from Dr Moore ,We must call Dr. Moore,67
31,אתה לא מבין ,You don't understand ,You do not understand,93
32,אנחנו יודעים שעברת הרבה  אבל עוד דברים מונחים על כף המאזניים מלבד הרגשות שלך ,We know you've been through a lot  but there is more at stake here than just your feelings ,We know you've been through a lot but other things are at stake besides your feelings,77
33,אתם לא לוקחים את התינוק שלי ,You're not taking my baby ,You do not take my baby,79
34,בית המשפט אולי לא יסכים איתך ,Well the courts might not agree with you ,The court may not agree with you,83
35,אבל אני כן ,But I do ,But I do,100
36,הקשבתי מספיק לזבל הזה ,I've heard enough of this crap ,I listened enough to this crap,67
37,אתם חושבים שאתם יכולים פשוט להיכנס לבית שלי  ולאיים על הבת שלי ,You think you can just walk into my house  and threaten my daughter ,You think you can just walk into my house and threaten my daughter,100
38,בבקשה יש לנו תביעה חוקית לזה ,Please we have a legitimate claim to it ,Please we have a legal claim to this,80
39,הוא חלק ממני  ואני לא נותנת לכם אותו או לאף אחד אחר!,He's part of me  and I'm not giving him to you or anyone else!,He's a part of me and I'm not giving it to you or anyone else!,96
40,הם חושבים שאני משוגעת ,They think I'm nuts ,They think I'm crazy,72
41,זו הבעיה שלהם ,That's their problem ,This is their problem,68
42,לא זו הבעיה שלנו ,No it's our problem ,That's not our problem,78
43,אם אני לא אטפל בזה  הם אולי באמת ינסו לקחת את ג'ייקוב ,If I don't deal with this  they really might try to take Jacob ,If I do not take care of it they may really try to take Jacob,72
44,אמרת שהיא התאבדה ,You said she committed suicide ,You said she committed suicide,100
45,כן זה מה שהעיתונים חשבו ,Yeah that's what the papers thought ,Yes that's what the newspapers thought,90
46,היא בילתה את שארית חייה בבית המשוגעים ,She spent the rest of her life in the asylum ,She spent the rest of her life in the asylum,100
47,אחרי המשפט של קרוגר היא השתגעה  היא תלתה את עצמה-- אז הם חשבו ,After Krueger's trial she flipped out  and hung herself  so they thought ,After Kruger's trial she went crazy she hanged herself-- so they thought,77
48,כלומר  הם לא יכלו להוכיח את זה ,Meaning  they couldn't prove it ,"That is, they could not prove it",75
49,אין גופה ,No body ,There is no body,61
50,אבל ראיתי את הקבר שלה ,But I've seen her grave ,But I saw her grave,81
51,אה חלקה ריקה ,Ah empty plot ,Oh empty plot,77
52,אבן זיכרון ,A memorial stone ,A memorial stone,100
53,הם אף פעם לא קברו אותה ,They never put her under ,They never buried her,62
54,קריר הא ,Cool huh ,Cool huh,100
55,אני לא מבינה ,I don't understand ,I do not understand,92
56,אם היא הרגה את עצמה הנשמה צריכה להיות בייסורים ,If she killed herself her soul's gonna be in torment ,If she killed herself the soul should be in agony,77
57,איפה שמעת את זה ,Where'd you hear that ,Where did you hear that?,95
58,"כן ""לכוד במקום המנוחה הארצי שלו ""","Yeah ""Trapped in its earthly resting place ""","Yes ""trapped in his earthly resting place""",89
59,בחלום היא ניסתה לעצור אותו ,In the dream she was trying to stop him ,In the dream she tried to stop him,88
60,היא התחילה להגיד לי איך ואז הדלת נטרקה ,She started to tell me how then the door slammed ,She started telling me how and then the door slammed shut,86
61,אנחנו חייבים לגלות איפה היא מתה ולשחרר את נשמתה ,We have to find where she died to release her soul ,We must find out where she died and release her soul,76
62,אני רוצה שתישאר ער ותצפה בי בסדר ,I want you to stay awake and watch me OK ,I want you to stay awake and watch me fine,90
63,אין בעיה ,No problem ,No problem,100
64,מה קרה ,What happened ,What happened,100
65,התאהבת ,You fall in love ,You fell in love,94
66,אל תשאל ,Don't ask ,do not ask,84
67,אתה אפילו לא רוצה לדעת ,You don't even want to know ,You do not even want to know,95
68,הבריכה עדיין סגורה ,Pool still open ,The pool is still closed,67
69,אני חושב אם אתה ממהר ,I think if you hurry ,I think if you're in a hurry,83
70,לאן אתה הולך חזירון ,Where are you going piglet ,Where are you going piglet,100
71,אני יודע בדיוק מה אתה מתכנן ,I know exactly what you're up to ,I know exactly what you're planning,78
72,חשבתי שאני מוכן לאיבון!,I thought I was up to Yvonne!,I thought I was ready for Yvonne!,73
73,מה קרה ,What happened ,What happened,100
74,הוא פוחד לבוא בגלל אמנדה ,He's scared to come in because of Amanda ,He's afraid to come because of Amanda,78
75,היי אתה בסדר ,You leave her alone!,Hi you're fine,61
76,אלוהים ,Oh God ,God,67
77,אתה לא משוגע ,You're not crazy ,You're not crazy,100
78,אתה חייב למצוא את אמנדה ,We have to find Amanda ,You must find Amanda,67
79,היא המפתח ,She's the key ,She's the key,100
80,ישו ,Jesus ,Jesus,100
81,מארק תעזור לי בבקשה!,Mark help me please!,Mark help me please!,100
82,היא טעימה או שאני משוגע ,Is she delicious or am I crazy ,She's delicious or I'm crazy,86
83,תעזוב אותה!,You leave her alone!,Leave her!,64
84,זמן למות זין צולע עם פני צלקת שכמוך!,Time to die you scar-faced limp-dick!,Time to die a lame cock with a scar face like you!,73
85,מהר יותר ממניאק מנובל!,Faster than a bastard maniac!,Faster than a noble maniac!,74
86,רב עוצמה יותר ממטורף!,More powerful than a loco-madman!,More powerful than crazy!,75
87,סופר פרדי!,Super Freddy!,Super Freddy!,100
88,אמרתי לך שספרי הקומיקס היו רעים בשבילך!,Told you comic books was bad for ya!,I told you the comic books were bad for you!,82
89,אלוהים!,God!,God!,100
90,הו חרא!,Oh shit!,Oh shit!,100
91,לעזאזאל!,Damn it!,Damn!,73
92,שום דבר בחדר הזה לא היה מוכן לקוד ,Nothing in that room was up to code ,Nothing in this room was ready for code,73
93,זה נס ששניהם לא נהרגו ,It's a miracle they both weren't killed ,It's a miracle they were both not killed,91
94,לא!,No!,No!,100
95,הוא לא יפגע בי ,He won't hurt me ,He will not hurt me,80
96,הוא צריך אותי חי ,He needs me alive ,He needs me alive,100
97,על מה היא מדברת ,What's she talking about ,What is she talking about?,98
98,אולי שניכם צריכים לבוא לתחנה ,Maybe both of you should come down to the station ,Maybe you two should come to the station,81
99,מה קורה ,What's going on ,What's going on,100
100,איפה מארק ,Where's Mark ,Where's Mark?,100
101,מארק נרדם ,Mark fell asleep ,Mark falls asleep,91
102,קרוגר תפס אותו ,Krueger got him ,Kruger caught him,81
103,לא!,No!,No!,100
104,אלוהים!,God!,God!,100
105,אני צריך שתהיה חזק עכשיו!,I need you to be strong now!,I need you to be strong now!,100
106,תקשיב אנחנו חייבים להגיע לקרוגר   לפני שהוא שוב מגיע לג'ייקוב ,Listen we have to get to Krueger  before he gets to Jacob again ,Listen we must get to Kruger before he gets to Jacob again,92
107,איך אנחנו עוצרים אותו ,How do we stop him ,How do we stop him?,100
108,דרך אמנדה ,Through Amanda ,Through Amanda,100
109,אז  אנחנו צריכים למצוא אותה ,So  we have to find her ,So we need to find her,82
110,רק אל תבקש ממני להיות שוב בג'קוזי עם הבחור הזה ,Just don't ask me to take a Jacuzzi with that guy again ,Just do not ask me to be in the hot tub again with this guy,74
111,אתה יודע  היית במגדל כשהוא השתמש בך כדי להפריע לי ,You know  I was in the tower when he used you to distract me ,You know you were in the tower when he used you to disturb me,87
112,מה נעשה ,What are we gonna do ,what should we do,65
113,אני רוצה שתלך לבית המשוגעים  שסיפרתי לך עליו איפה שכל זה התחיל  ותמצא אותה!,I want you to go to the asylum  the one I told you about where all of this started  and find her!,I want you to go to the asylum I told you about where it all started and find her!,90
114,אליס את באה איתי הביתה ,Alice you're coming home with me ,"Alice, you're coming home with me",100
115,לא אבא אני צריכה לעשות משהו ,No Dad I've got something to do ,No Dad I need to do something,80
116,אליס את באה איתי עכשיו ,Alice you're coming with me right now ,"Alice, you're coming with me now",91
117,תמצא את אמנדה ומהר!,Find Amanda! And hurry!,Find Amanda and fast!,73
118,צא החוצה קרוגר!,Come on out Krueger!,Get out Kruger!,73
119,המשחק נגמר!,The game's over!,game over!,75
120,הייתי יותר חזקה ממך!,I was stronger than you!,I was stronger than you!,100
121,אז נטפלת אל ג'ייקוב!,Jacob he's not your father!,Then you take care of Jacob!,64
122,אתה מנסה לעשות אותו כמוך  כך שתוכל לחיות באמצעות החלומות שלו!,You're trying to make him like you  so you can live through his dreams!,You're trying to make him like you so you can live through his dreams!,100
123,אני לא אתן לך!,Well I won't let you!,I will not let you!,79
124,אתה שומע אותי קרוגר ,You hear me Krueger ,You hear me Kruger,97
125,או קיי אם לא תדבר אליי  אולי תרצה לדבר אל אמנדה!,OK if you won't talk to me  maybe you'd like to talk to Amanda!,Okay if you do not talk to me you may want to talk to Amanda!,84
126,קדימה פחדן מזדיין!,Come on you fucking coward!,Come on fucking coward!,92
127,לילה טוב טמבל!,Good night asshole!,Good night fool!,79
128,אני החבר האמיתי שלך ג'ייקוב ,I'm your real friend Jacob ,I'm your real friend Jacob,100
129,בדיוק כמו אבא ,Just like a daddy ,Just like Dad,87
130,סידרתי אותך!,You hear me Krueger ,I arranged you!,61
131,סידרתי אותך!,You hear me Krueger ,I arranged you!,61
132,אמא תפגשי את החבר שלי ,Mommy meet my friend ,"Mom, meet my friend",95
133,תודה מותק ,Thank you ,Thank you sweetie,69
134,זה המראה החדש שלי ,It's my new look ,This is my new look,86
135,אוהבת את זה ,Like it ,I like it,88
136,בוא למטה ,Come on!,Come down,88
137,הוא לא יפגע בך ,He won't hurt you ,He will not hurt you,81
138,הוא צריל את שתינו ,He needs us both ,He needs both of us,91
139,אני צריך את שתיכם ,He needs us both ,I need both of you,71
140,קדימה ג'ייקוב ,Come on Jacob ,Come on Jacob,100
141,זה הזמן ללכת הביתה ,It's time to go home ,It's time to go home,100
142,ג'ייקוב רוץ!,Jacob run!,Jacob Rutz!,84
143,בוא לאבא!,Come on!,Come on Dad!,78
144,זה בסדר בן ,It's my new look ,It's okay son,62
145,הוא בא איתי ,Now come with me ,He came with me,71
146,גייקוב הוא לא אבא שלך!,Jacob he's not your father!,Jacob is not your father!,88
147,תמיד אכזבה ,Always a disappointment ,Always a disappointment,100
148,איפה הוא ,Where is he ,where is he,100
149,בתוכך  איפה שהוא מתחבה ,Inside you  where he hides ,Inside you where he is hiding,85
150,למה אתה מתכוון ,What do you mean ,What do you mean,100
151,איפה שהוא מתחבא ,Where is he ,Where he's hiding,79
152,כך הוא מצא אותך ,That's how he found me ,That's how he found you,84
153,אבל איך ,But how ,but how,100
154,הוא אומר שזה קל בגלל שהוא מכיר אותך כל כך טוב ,He says it's easy because he knows you so well ,He says it's easy because he knows you so well,100
155,בסדר קרוגר  הפעם זה לתמיד!,All right Krueger  this time it's for keeps!,Okay Kruger this time it's forever!,68
156,קדימה אליס  עכשיו אנחנו באמת יכולים להכיר אחד את השני ,Come on Alice  now we can really get to know each other ,Come on Alice now we can really get to know each other,100
157,אחות אמנדה ,Sister Amanda ,Amanda's sister,93
158,תודה לך ,Thank you ,Thank you,100
159,ג'ייקוב!,Jacob!,Jacob!,100
160,אליס לא תצליח!,Alice will not triumph!,Alice will not succeed!,73
161,רק אתה יכול לעזור לה עכשיו ,Only you can help her now ,Only you can help her now,100
162,היי עזוב אותה!,Hey leave her!,Hey leave her!,100
163,בוא נלך!,Let's go!,let's go!,100
164,אני רוצה ללמוד משהו ממך ,I want to learn stuff from you ,I want to learn something from you,84
165,היא לא משעשעת יותר ,She's no fun anymore ,It's not fun anymore,80
166,למד אותי ,Teach me ,teach me,100
167,עכשיו ג'ייקוב ,Now Jacob ,Now Jacob,100
168,שחרר את הכח שהוא נתן לך ,Unleash the power he has given you ,Unleash the power he has given you,100
169,הבית ספר נגמר קרוגר ,School's out Krueger ,School is over Kruger,73
170,שאר מאחור!,Hey leave her!,Leave behind!,64
171,קח את התינוק שלך ותעזוב!,Take your baby and leave!,Take your baby and leave!,100
172,תוציא אותי!,Let me out!,Get me out!,90
173,את עושה עבודה טובה אליס ,You do good work Alice ,"You're doing a good job, Alice",78
174,הוא עדיין משאיר אתכם ערים בלילה ,Is he still keeping you up at night ,He still leaves you awake at night,70
175,הו זה בסדר ,Oh it's OK ,Oh it's okay,91
176,היה לו את שארית חייו להשיג בשנתו ,He has the rest of his life to catch up on his sleep ,He had the rest of his life to achieve in his sleep,83
177,חלומות מתוקים ג'ייקוב דניאל ,Sweet dreams Jacob Daniel ,Sweet Dreams Jacob Daniel,100
178,איך הנכד הקטן שלי ,How's my little grandson huh ,How's my little grandson,92
179,תראה ,Look ,Look,100
180,רעב ,Hungry ,hunger,83
181,מממ ,Mm-hmm ,Hmmm,80
182,כולנו ,We all are ,We all,75
183,היי חומד ,Hi honey ,Hi honey,100
184,בוטנים!,Peanuts!,peanuts!,100
185,קנו פה בוטנים!,Get your peanuts here!,Buy peanuts here!,70
186,"""חובט בשביל ה ""קרדינלז מ 'ס 14 סטנלי בויאר!",Now batting for the Cardinals number 14 Stanley Boyer!,"""Beating for the"" Cardinals No. 14 Stanley Boyer!",90
187,אני רוצה שתשגיח על בני ,I want to learn stuff from you ,I want you to look after my son,66
188,גיל זה סטן ,Gil this is Stan ,Age is Stan,67
189,עליי לפגוש חברים ,I have some friends I´m meeting ,I need to meet friends,65
190,תכניות!,Peanuts!,Plans!,67
191,אבא מרבה להביא אותך לכאן ,Dad bring you here a lot ,Dad often brings you here,86
192,פעם בשנה ביום הולדתי והוא משלם לסדרן שישגיח עליי ,Once a year on my birthday Then he pays an usher to watch me ,Once a year on my birthday and he pays a usher to look after me,80
193,תבין אבא שלי כשהיה ילד חסרה לו השפעה גברית חיובית ,You have to understand my father in his own childhood  was without a positive male influence ,Understand my dad when he was a kid he lacked positive masculine influence,67
194,אתה מבין מה שאני אומר ,You understand what I´m saying ,You understand what I'm saying,98
195,אני לא באמת ילד ,- Well I´m not really a kid ,I'm not really a kid,82
196,-אתה לא ברווז ,- You´re not a duck ,- You're not a duck,85
197,זה זיכרון מהזמן שהייתי ילד ,- l´m remembering when I was a kid ,It's a memory from when I was a kid,64
198,יש לי ילדים משלי ,I have kids of my own ,I have children of my own,70
199,-מה ,- A what ,-what,80
200,שילוב של כל הסדרנים שאבי הפקיד אותי בידיהם במשך השנים ,A combination of several ushers my dad left me with over the years ,A combination of all the ushers my father had entrusted to me over the years,72
201,צירפתי אותם לאחד בזיכרוני ,- l combined them into one memory ,I attached them to one in my memory,67
202,- מדוע ,- Why ,- Why,100
203,זה היה רגע סמלי מאוד בחיי כשאבי השליך אותי לידיך ,This was a great symbolic moment in my life My father dumping me with you ,It was a very symbolic moment in my life when my father threw me into your arms,76
204,בגלל זה נשבעתי שעם ילדיי זה יהיה אחרת ,It´s why I swore things would be different with my kids ,That's why I swore it would be different with my kids,92
205,זה החלום שלי ילדים חזקים מאושרים ובעלי ביטחון עצמי ,It´s my dream-- strong happy confident kids ,This is my dream strong children happy and confident,74
206,מי זאת ,Where is she ,Who is she,82
207,-זאת אשתי ,- That´s my wife ,- This is my wife,79
208,נחמדה ,- Nice ,Nice,100
209,-כן ,Yes sir ,-Yes,60
210,"ה ""קרדינלז "" מסנט לואיס מודים לכם ע ל שבאתם היום לצפות במשחק ",The St Louis Cardinals thank you for attending today´s game ,"The ""Cardinals"" from St. Louis thank you for coming today to watch the game",72
211,סעו הביתה בשלום ובזהירות ,Please drive home safely and soberly ,Drive home safely and carefully,63
212,בואו!,Come on!,Come!,73
213,בוא ג'סטין!,Come on Justin ,Come on Justin!,100
214,רוצה ללכת ,Do you want to walk ,want to go,62
215,בוא נלך ,Let´s go ,let's go,93
216,ג'סטין  ,Come on Justin ,Justin,60
217,-בוא נלך ,Let´s go ,-let's go,93
218,אתה לא רוצה ללכת ,Want me to put you down ,You do not want to go,77
219,רוצה שאוריד אותך ,Want me to put you down ,Wants me to take you down,88
220,איפה הילדה ,Where is she ,Where's the girl?,79
221,איפה היא ,Where is she ,where is she,100
222,-הנה היא!,Where is she ,-there she is!,92
223,"""בקיץ ",Get in the seat ,"""In the summer",64
224,מותק טיילור!,- Honey Taylor ,Baby Taylor!,70
225,"""כשאתה מחליק לבסיס ראשון ""ומרגיש שמשהו מתפוצץ  ",When you´re sliding´ into first and you´re feelin´ something burst,"""When you slide to first base"" and feel something explode",70
226,שלשול שלשול  ,Diarrhea diarrhea,Diarrhea Diarrhea,100
227,"""כשאתה מחליק לבסיס שלישי ומשאיר שם גלל עסיסי  ",When you´re sliding´ into third and you lay a juicy turd,"""When you slip into a third base and leave a juicy dung there",70
228,"""שלשול שלשול  ",Diarrhea diarrhea,"""Diarrhea Diarrhea",100
229,"""כשאתה במכוניתך ותחתוניך כבדים עליך  ",When you´re sitting in your Chevy and your shorts are feeling heavy,"""When you're in your car and your underwear is heavy on you",65
230,קווין איפה למדת את השיר הזה ,Kevin honey where did you learn that song ,Kevin where did you learn this song,87
231,במחנה הקיץ אימא ,Last summer at camp Mom ,"At the summer camp, mother",71
232,"""כשאתה מחליק לבסיס ראשון  ""ומרגיש שמשהו מתפוצץ  ",When you´re sliding´ into first and you´re feelin´ something burst,"""When you slide to first base"" and feel something explode",70
233,"שלשול שלשול  """,Diarrhea diarrhea,"Diarrhea Diarrhea """,100
234,בזה אתה מתכוון לישון ,That´s what you´re gonna sleep in ,By that you mean sleep,64
235,זה מושלם ,Perfect ,It is perfect,70
236,טיילור מרגישה לא טוב ,Gil Taylor isn´t feeling well ,Taylor is not feeling well,89
237,היא רוצה אותך ,She wants you ,She wants you,100
238,-אני אטפל בקווין ובג'סטין ,- l´ll deal with Kevin and Justin ,- I'll take care of Kevin and Justin,72
239,מה דעתך שאחר כך כשהילדים יישנו  אני אמדוד את התלבושת הזאת ,Hey what do you say Later when the kids are asleep I wear this outfit ,How about then that when the kids are asleep I will measure this outfit,67
240,-היא במיטה שלנו ,She´s in our bed ,- She's in our bed,90
241,היי אבא ,Hi Daddy ,Hi Dad,86
242,את רוצה להקיא -בסדר  גיל  ,Do you want to walk ,You want to vomit - okay,68
243,טיילור בובה ,- Honey Taylor ,Taylor Doll,70
244,מותק  גיל מה אתה עומד שם ,Gil why are you just standing there ,Baby age what are you standing there for,72
245,אני מחכה שהראש שלה יתחיל להסתחרר הכול יהיה בסדר ,I´m waiting for her head to spin around ,I'm waiting for her head to start spinning and everything will be fine,65
246,תוכל לבוא אתי ביום ב' בבוקר למנהל של קווין ,Oh can you come with me to see Kevin´s principal on Monday ,You can come with me on Monday morning to Kevin's manager,75
