,hebrewFromSub,englishFromSub,englishTranslation,ratio
247,אני כל כך אוהב כשאת מדברת על בית-הספר ועל פגישות ,Oh I love it when you talk to me about school and meetings ,I love it so much when you talk about school and meetings,89
248,דברי אתי עכשיו על קניות -לא אני יודעת  דברי -מצטערת ,- Now talk to me about shopping ,Talk to me now about shopping -no I know what -sorry,73
249,מה הבעיה ,There´s a kid with problems ,What is the problem,71
250,-שום דבר הייתי קצת מתוחה קודם אבל  ,Nothing I was a little tense before but--,-Nothing I was a little tense before but,100
251,מדוע אנחנו הולכים למנהל ,Why are we going to see his principal ,Why we're going to the manager,63
252,המורה אמרה שהוא שוב עושה פרצוף ,Oh because his teacher said he´s been making that face again ,The teacher said he was making a face again,73
253,-כן הפרצוף המתוח ,Yes the tense face ,-Yes the taut face,80
254,הוא עושה אותו פרצוף במשחקי ליגת הנוער ,He makes that same face at Little League ,He makes the same face in youth league games,69
255,אתה יודע מה שאלה המורה שלו ,- You know what his teacher asked me ,You know what his teacher asked,95
256,-מה ,- What ,-what,100
257,אם לקחנו אותו פעם לבדיקה פסיכיאטרית ,If we´d ever taken him for a psychiatric evaluation ,If we once took him for a psychiatric examination,77
258,מה ,- What ,what,100
259,מדוע ,Why ,why,100
260,כי הוא עושה פרצוף ,Because he makes a face ,Because he makes a face,100
261,היא הסתכלה פעם במראה ,Has she ever looked in the mirror ,She once looked in the mirror,77
262,-ובכן אתה יודע  הפרצוף הבכי והעצבנות -הם הזכירו את הבכי ,Well you know the face the crying the nervousness ,-Well you know the crying face and the nervousness -they mentioned the crying,79
263,נדבר אתם ביום שני ,Hey we´ll talk to them on Monday ,We'll talk to you on Monday,72
264,בוא הנה ,Come here ,Come here,100
265,איפה הייתי ,Where was I ,where was I,100
266,כאן הייתי כאן ,- Was I here ,Here I was here,80
267,-כן  כבר הגעתי לשם ,- Yeah - l was there already ,"- Yes, I'm already there",76
268,כן  את יודעת זה באמת מרגיז!,- Yeah You know he doesn´t really finish his work ,Yes you know it's really annoying!,63
269,"הילד קצת שונה מיוחד דורש תשומת לב והמורה שמה עליו תווית "" ילד בעייתי"" ","The kid needs a little more attention  so the teacher´s gonna put a label on him: ""problem kid ""","The child is a little different and requires special attention and the teacher puts a ""problematic child"" label on it.",65
270,נשאל את המנהל מי תלמד אותו בשנה הבאה ונוודא שזו לא תהיה עוד היסטרית אחת!,Let´s find out who Kevin´s teacher is gonna be next year  and make sure it´s not one of these hysterics!,We will ask the principal who will teach him next year and make sure it will not be one more hysterical!,64
271,אתה צודק גיל ,You´re right Gil ,You're right age,71
272,קווין ילד נהדר ,Kevin´s great ,Kevin is a great kid,69
273,לא ייתכן שהוא בעייתי עד כדי כך ,He can´t be that much of a problem ,It may not be that problematic,67
274,-נכון ,Right ,-Right,100
275,אילו היה מדובר בבן של אחותי  גרי  ,Now if it was my sister´s kid-- Garry ,If it was my sister Gerry's son,80
276,-זה ילד בעייתי ,There´s a kid with problems ,- This is a problematic child,60
277,היי גרי ,Hi Garry ,Hey Gary,75
278,קמת מוקדם ,You´re up so early ,You got up early,85
279,לאן אתה הולך ,- Where are you going ,Where are you going,100
280,-החוצה ,- Out ,-outside,60
281,מה יש לך שם -שום דבר ,- Where are you going ,What do you have there - nothing,65
282,כל המשפחה באה הערב ,The whole family´s coming tonight ,The whole family came tonight,89
283,זו תהיה הפתעה גדולה ,There´s a big surprise ,That would be a big surprise,69
284,סבתא וסבא יהיו פה ודוד גיל ודודה קארן יבואו עם הילדים ,Grandma and Grandpa are gonna be here Uncle Gil and Aunt Karen are bringing their kids ,Grandma and Grandpa will be here and Uncle Gil and Aunt Karen will come with the kids,75
285,ודודה סוזי תהיה ודוד נתן והילדים שלהם  היה נחמד לשוחח אתך ,Aunt Susie´s gonna be here and Uncle Nathan and their kids It was nice talking to ya ,And Aunt Susie will be and Uncle Nathan and their kids it was nice to talk to you,82
286,ג'ולי!,Julie ,Julie!,100
287,ג'ולי! -כן ,Julie ,Julie! -Yes,71
288,ג'ולי אני יכולה להיכנס לרגע ,- Yeah - Can I come in for a minute ,Julie I can come in for a moment,76
289,ג'ולי אני זקוקה לעזרתך ,I really need your help ,Julie I need your help,71
290,כל המשפחה באה הערב ,The whole family´s coming tonight ,The whole family came tonight,89
291,את בסדר שמעתי אותך גונחת בלילה ,Are you all right I heard you moaning last night ,You're fine I heard you moaning at night,80
292,הכאב עבר -את שונאת אותי ,See you later honey ,The pain is gone - you hate me,64
293,-מה ,- What ,-what,100
294,על שאילצתי אותך ללמוד הרבה ולוותר על כל הבחורים שלך ,For making you study so much and giving up all your dates ,For forcing you to learn a lot and give up all your guys,64
295,לא את צדקת ,No you were right ,You're not right,73
296,-הציונים האלה הם הכרטיס שלך ,Honey I´m telling you those SAT scores are your ticket ,-These scores are your ticket,67
297,וברגע שתגיעי למכללה טובה את תפגשי בחורים שימצאו חן בעינייך לא פחות מטוד ,And sweetie once you get to school  you´re gonna meet a lot of guys you like just as well as that Tod ,And once you get to a good college you will meet guys that you will like no less than Todd,71
298,"למה את תמיד אומרת "" הטוד הזה"" ","Why do you always say ""that Tod"" It sounds so--","Why do you always say ""this todd""",76
299,את צודקת אני מצטערת ,You´re right I´m sorry ,You're right I'm sorry,86
300,היה נחמד במשך כמה רגעים ,It´s been pleasant for a moment ,Was nice for a few moments,64
301,אני חושבת שפשוט אתן לכולם ספגטי וסלט  וכדאי שאכין לאבי אומצה ,I´m just gonna give everybody spaghetti and salad  and I better cook a steak for my dad ,I think I'll just give everyone spaghetti and salad and I should make my father adopt,66
302,אתה בסדר ,You okay ,Are you okay,80
303,בחיי אימא שלך יודעת לדבר!,Man your mother can talk!,In your life your mother knows how to talk!,61
304,אלוהים היא שונאת את התחת שלי ,Gosh she hates my ass ,God she hates my ass,93
305,ויש לך תחת כזה חמוד ,And it´s such a cute ass ,And you have such a cute ass,78
306,היא שמעה אותנו בלילה היא חשבה שזו אני ,She thought it was me ,She heard us at night she thought it was me,66
307,-תצטרך ללמוד לשלוט בעצמך טוד ,So you´re gonna have to try and control yourself Tod ,-You will have to learn to control yourself Todd,71
308,אתך זה בלתי אפשרי ,With you it´s impossible ,With you it is impossible,92
309,חכי -מה הבאתי משהו ,Wait I brought something ,Wait - what did I bring something,73
310,נוכל לתעד את אהבתנו ,We can record our love ,We can document our love,65
311,סוזן ,Susan ,Susan,100
312,השאלתי לך את המגש הגדול שלי ,Did I loan you my big platter ,I lent you my big tray,71
313,חשבתי  הביאי אותו הערב כדי שאוכל להגיש עליו ,Would you bring it tonight I just need it to serve ,I thought bring it tonight so I can file on it,60
314,הקשיבי ג'ולי קיבלה ציון גבוה מאוד בבחינות ,Listen Julie got 1291 on her SAT´s ,Listen Julie got a very high score on the exams,62
315,אני יודעת ,I know ,I know,100
316,אני כל כך גאה בה ,I feel so proud of her ,I'm so proud of her,83
317,זה נהדר ,It´s great ,It's great,95
318,מה עם פטי ,Patty a doctor yet ,What about Patty,65
319,אנחנו קצת מאוכזבים מהעבודה שלה בזמן האחרון ,We´re a little disappointed with the effort  she´s been giving lately towards her work ,We've been a little disappointed with her work lately,76
320,נתן מדבר איתה עכשיו ,Nathan´s talking to her right now ,Nathan is talking to her now,83
321,הוא מנסה לברר מה קרה ,He´s trying to figure out what´s wrong ,He's trying to find out what happened,68
322,הביטי פטי כל מה שאני אומר הוא שאם את רוצה קריירה אקדמית רגילה  ורוצה ללמוד באוניברסיטה רגילה זו זכותך ,Look Patty all I´m saying is  if you want to have just an ordinary academic career  and attend an ordinary university that´s your prerogative ,Look Patti All I'm saying is that if you want a regular academic career and want to study at a regular university it's your right,70
323,אך עליי לומר לך שלדעתי את מוכרת את עצמך בזול איך הולך ,But I must tell you I think you´re selling yourself way short ,But I have to tell you that I think you sell yourself cheaply how it goes,65
324,לפעמים נדמה לי שאנחנו רוצים את זה יותר ממנה ,- l don´t know Sometimes I feel as though we want it more than she does ,Sometimes it seems to me that we want it more than her,69
325,פטי את יודעת שאנחנו אוהבים אותך ,Patty you know we love you ,"Patty, you know we love you",100
326,בסדר אימא ,Okay Mama ,Okay mom,82
327,זה כל מה שאני מבקש ,That´s all I ask ,That's all I'm asking for,70
328,תפסתי אותך קווין ,Come on Kevin I got you ,"I caught you, Kevin",73
329,קווין טיילור היכנסו ילדים! -בסדר ,Come on Kevin I got you ,Kevin Taylor Get kids in! -OK,60
330,בסדר סבתא ,- Hi Grandma ,All right Grandma,67
331,גיל לך יש זיכרון טוב ,- Grandma - Gil you have a good memory ,Age you have a good memory,80
332,השתכרתי בחתונה של הלן של סוזן או שלך ,Was it yours or Helen´s or Susan´s wedding I got drunk at ,I got drunk at Susan's or yours wedding,81
333,בשלושתן אבא ,It was all three Dad ,"In all three, Dad",83
334,ברכותיי ,Congratulations ,my congratulations,91
335,באיזו מהן הרבצתי למנהל התזמורת ,At which one did I punch the bandleader ,In which one did I beat the director of the orchestra,61
336,אני אגדיל אותן בשביל ועדת הבירורים ,I´m having them blown up for the commitment hearings ,I will increase them for the inquiry committee,60
337,את חושבת שהוא מצחיק מה ,You think he´s funny huh ,Do you think he's funny?,83
338,כשהוא היה ילד הוא לא היה כל כך מצחיק ,He wasn´t this funny as a kid ,When he was a kid he was not that funny,69
339,הוא הסתגר בחדרו כל היום ,Stayed in his room all day ,He locked himself in his room all day,60
340,היית בן-כלבה קטן ומצוברח ,You were a moody son of a bitch ,You were a grumpy little bitch,66
341,מעניין למה ,Gee I wonder why ,I wonder why,86
342,עכשיו שאני עושה צעד לעברו הוא עושה צעד לאחור ,I know Now if I take a step toward him he takes a step away ,Now that I'm taking a step towards him he's taking a step back,74
343,אין לי מושג מה קורה לו ,I don´t know what´s happening to him ,I have no idea what's happening to him,72
344,הוא אומלל והוא מסרב לדבר אתי ואני לא יודעת איך לעזור לו ,He´s just so unhappy and he won´t talk to me  and I don´t know how to help him ,He's miserable and he refuses to talk to me and I do not know how to help him,70
345,את מתלוצצת ,Are you kidding ,You'm kidding,79
346,"הוא אומר שזה גורם לו "" אי נוחות"" ",He says it makes him uncomfortable ,"He says it makes him ""uncomfortable""",100
347,הלוואי שהמקדחה תיפול לו למכנסיים ,I wish he´d drop his drill down his pants ,I wish the drill would fall into his pants,61
348,את יוצאת עם מישהו ,- You look great Dad!,You're dating someone,62
349,המורה לביולוגיה של גרי הזמין אותי ,Well Garry´s biology teacher asked me out ,Gary's biology teacher invited me,66
350,ביולוגיה ,Biology ,Biology,100
351,זה נשמע מבטיח ,That´s promising ,That sounds promising,78
352,לא זה לא הטיפוס שמושך אותי בדרך כלל ,Oh no He´s not the type I usually go for ,No it's not the type that usually appeals to me,70
353,"""מושבת העונשין"" מאת פרנץ קפקא ","""The Penal Colony"" by Franz Kafka ","""The Penal Colony"" by Franz Kafka",100
354,-בסדר  הילדים שלנו מסוגלים לקלוט ולעכל מידע טוב יותר מאתנו ובכל זאת אנו מתעקשים להתייחס אליהם כמו אל אידיוטים חמודים ,All right Our children are more capable of absorbing information than we are  yet we insist on treating them like adorable little morons ,-On our children are able to absorb and digest information better than us and yet we insist on treating them like cute idiots,68
355,מה אתה אומר שפטי יכולה ללמוד דברים שאני לא יכול ,Are you saying Patty can learn things I can´t learn ,What do you say Petty can learn things I can not,76
356,איזה מאלה הוא השורש של 946 8 ,Patty which one of these  is the square root of 8 649 ,Which of these is the root of 946 8,71
357,תשעים ושלוש ,Ninety-three ,ninety three,100
358,הם כמו ספוגים שממתינים לקלוט ,They´re like sponges Gil just waiting to absorb ,They are like sponges waiting to be absorbed,82
359,אני רוצה את זה ,I want this ,I want it,80
360,-אתה רואה ,You see ,-You see,100
361,שמע בעצתי ,Take my advice ,Hear my advice,64
362,שכח את קווין ואת טיילור ,Forget about Kevin and Taylor ,Forget Kevin and Taylor,88
363,בשבילם זה כבר מאוחר מדי ,It´s too late ,For them it is too late,63
364,תתרכז בג'סטין ,Congratulations ,Concentrate on Justin,61
365,זוכרת את ג'פרי סנדרס שיצאת אתו במכללה ,You remember that guy you went out with in college Jeffrey Sanders ,Remember Jeffrey Sanders you went to college with,83
366,תמיד גירשת אותי מהחדר כשהוא בא ,He always chased me out of the room when he came over ,You always kicked me out of the room when he came,78
367,ראיתי אותו היום ,- Oh yeah - l saw him today ,I saw him today,74
368,-התכוונתי אליי ,- ln a Rolls I meant me ,- I meant me,65
369,מה זה ,What is that ,What is,74
370,-נתן פטי ואני עברנו לתזונת כוח ,"Oh Nathan and Patty and I are ""power eating """,-Nathan Patty and I switched to a power diet,68
371,אנחנו מביאים את האוכל שלנו אתנו לכל מקום ,We bring our own food everywhere ,We bring our food with us everywhere,85
372,איפה משיגים את זה ,- Where do you get that stuff ,Where to get it,62
373,-זהו זה!,What is that ,-that's it!,67
374,כולם לחדר האורחים!,Everybody in the living room ,Everyone to the living room!,84
375,ההפתעה הגדולה!,This is the big surprise ,The big surprise!,80
376,לארי!,Oh Larry!,Larry!,77
377,אתה נראה מצוין אבא ,- You look great Dad!,You look great Dad,100
378,-בני  טוב לראות אותך ,Great to see you!,"- My son, it's good to see you",60
379,זה אחי הקטן לארי דודך ,That´s my kid brother Larry your uncle ,This is my little brother Larry your uncle,84
380,אל תיתן לו כסף ,- Don´t give him any money ,Do not give him money,77
381,משהו קטן בשביל האבא הכי טוב בעולם ,Just a little something for being the best dad in the world ,Something small for the best dad in the world,83
382,מצאתי את זה לפני כמה חודשים ,I found it a couple of months ago ,I found this a few months ago,74
383,לאוסף שלך ,It´s for your collection ,To your collection,83
384,מכונית צעצוע!,- A toy car!,toy car!,88
385,כן יש לך אז תן לאנשים שאתה אוהב ,Yeah if you´ve got it spend it on the people you love ,Yes you have so give to the people you love,67
386,נכון ,Right ,Right,100
387,זו סבתא ,- ls this Grandma ,This is Grandma,93
388,-כן היא עדיין חיה ,- Yeah she´s still alive ,"- Yes, she's still alive",86
389,ישו סבתא!,- ls this Grandma ,Jesus Grandma!,71
390,-אני מתכווצת ,I´m shrinking ,- I'm shrinking,96
391,באסה!,Bummer!,Bummer!,100
392,כמה זמן עבר 3 שנים ,- How long has it been ,How long has it been 3 years,83
393,-הפסקת לחבוש את הטורבן ,- About that You stopped wearing your turban ,- You stopped wearing the turban,81
394,אלוהים סוזן את נראית נהדר!,My God! Susan you look great ,God Susan you look great!,94
395,אלמלא היית אחותי  הלן  אני יודע שהיה קשה ,If you weren´t my sister-- I know it´s been hard ,If you were not my sister Helen I know it would have been difficult,70
396,-אבא  אמרנו שתחכה בחוץ כדי שאוכל להציג אותך ,Dad You were supposed to wait outside so I could introduce you ,"- Dad, we told you to wait outside so I could introduce you",90
397,תעשה את זה עכשיו לארי ,Well why don´t you do it now Larry ,Do it now Larry,62
398,הבן שלך ,- Your son ,your son,100
399,-זה סיפור ארוך ,- lt´s a long story ,-it's a long story,85
400,בואו נאכל ,Let´s eat ,Let's eat,94
401,תרחיק את פטי מאחי ,Keep Patty away from my brother ,Keep Patty away from my brother,100
402,הוא ימצוץ ממנה את כל האינטליגנציה ,He´ll suck the intelligence out of her ,He will suck all the intelligence out of her,86
403,למה לא כתבת לנו שיש לך בן ,Why didn´t you ever write us you had a son ,Why did you not write to us that you have a son,77
404,לא ידעתי בעצמי עד לפני כמה חודשים ,I didn´t know myself until a couple of months ago ,I did not know myself until a few months ago,83
405,אתם מבינים  לפני כמה שנים גרתי בווגאס עם  ,See  a few years ago I was living in Vegas with this girl ,"You see, a few years ago I lived in Vegas with",77
406,בכל אופן אנחנו התרחקנו זה מזה כפי שקורה בתקופה המסובכת הזאת שלנו  ולפני כחודשיים היא מופיעה עם קול ואומרת לי:,Anyway we drifted apart  as people do in these complicated times  and then a couple of months ago she shows up with Cool tells me  ,Anyway we moved away from each other as happens in this complicated period of ours and about two months ago she shows up with a voice and tells me:,67
407,ל זה קוראים הורה ,That´s a parent ,This is called a parent,65
408,בכל אופן חזרנו העירה כי אני מבשל איזו עסקה ענקית ,Anyway  we´re back in town because I´ve got something really huge cooking ,Anyway we went back to town because I'm cooking up some huge deal,76
409,משהו גדול ועצום ,Something´s busted ,Something big and huge,67
410,אבא זהו זה ,Dad this is it ,Dad this is it,100
411,מעכשיו אני אדאג לכולכם ,From now on I´m gonna be taking care of all of you ,From now on I will take care of you all,77
412,עוד תכנית להתעשרות מהירה לארי ,This isn´t another get-rich-quick scheme is it Larry ,Another plan for getting rich quick for Larry,62
413,מה רע בלהתעשר מהר ,What´s wrong with getting rich quick ,What's wrong with getting rich quick,96
414,הכי טוב להתעשר מהר ,Quick is the best way to get rich ,It is best to get rich quick,82
415,תראו עם מי אני מדבר ,Look who I´m talking to ,Look who I'm talking to,93
416,ראיתם פעם את המשפחה שלה ,You ever see her family ,Have you ever seen her family?,88
417,הם מוצאים אגורה ומחביאים אותה כמו סנאים ,They find a nickel they huddle together and bury it like squirrels ,They find a penny and hide it like squirrels,71
418,באיזו עסקה מדובר בן ,What is this ,What deal is this?,83
419,מישהו שמע פעם על הידרופוניקה ,Coarse sand or suspension hydroponics ,Someone once heard of hydroponics,66
420,זו שיטה לגידול צמחים ללא אדמה זה מרגש מאוד ,Hydroponics is the growing of plants without soil ,This is a method of growing plants without soil and it is very exciting,67
421,במה אתה משתמש ,What are you using ,What you use,73
422,חול גס או הידרופוניקה בתלייה ,Coarse sand or suspension hydroponics ,Coarse sand or hanging hydroponics,73
423,אני ל א  יש לי ברנש עם משקפיים וחלוק מעבדה שמחליט על זה ,I don´t-- There´s a guy with a lab coat that makes that decision I make the deal ,I don 't have a guy with glasses and a lab coat who decides on that,62
424,יהיה נחמד אם נגור אצלכם -אצלנו ,Why didn´t you ever write us you had a son ,It would be nice if we lived with you - with us,60
425,-לשבוע שבועיים ,- A couple of weeks ,-For two weeks,60
426,יש חדר-שינה אחד לנו ואחד לסבתא ,We just have the one bedroom for us and one for Grandma ,We have one bedroom and one for Grandma,83
427,סבתא יכולה לגור אצלנו במשך זמן מה ,Grandma´s welcome to stay with us for a while ,Grandma can live with us for a while,70
428,זה יהיה טוב בשביל פטי ליהנות מהשפעה רב-דורית ,It´d be valuable for Patty to have a multigenerational influence ,It would be good for Patty to enjoy multi-generational influence,61
429,אצטרך לתת לכם רשימה של התרופות מתי וכמה ותצטרכו לקחת את הכיסא שלה וסוללות למכשיר השמיעה שלה ,Well I´ll have to give you a list of her medications-- and you´ll have to pick up her shower chair There´s her hearing aid batteries magnifying glass for reading ,I will have to give you a list of the medications when and how much and you will need to take her chair and batteries for her hearing aid,73
430,-מה קרה ,- What happened ,-What happened,100
431,הפה שלך השתמש בכל החשמל ,- Your mouth used up all the power ,Use your mouth for all the electricity,63
432,אימא אבא מה קרה ,Mom Dad what happened ,Mom Dad what happened,100
433,-זה בחדר השינה ,- Where is it In the bedroom ,- It's in the bedroom,76
434,-אימא אבא מה קרה -קווין!,Mom Dad what happened ,"- Mom, Dad, what happened? - Kevin!",88
435,את יודעת שאני לא אוהב חושך!,- You know I don´t like it in the dark ,You know I do not like darkness!,76
436,הפסקה זמנית באספקת החשמל לתצרוכת ביתית ,It´s a temporary interruption in the home´s electrical supply ,Temporary interruption in the supply of electricity for domestic consumption,73
437,הבא אותו לכאן -הנה ,- Bring it here ,Bring him here - here,75
438,מה זה ,What is this ,What is,74
439,אימא מה זה היה ,- Mommy what was that ,Mom what was that,94
440,זה היה מנקה אוזניים חשמלי ,- That was an electric ear cleaner ,It was an electric ear cleaner,94
441,זה היה די גדול ,- lt was kind of big ,It was pretty big,63
442,את באמת לא צריכה לדאוג ,I don´t think we really have to worry about him ,You really do not have to worry,62
443,נצטרך להיות זהירים מאוד בקשר לסביבה החינוכית של קווין ,I think we have to be very careful about Kevin´s educational environment ,We'll have to be very careful about Kevin's educational environment,91
444,"אני אמליץ להעבירו לבי""ס שמקיים כיתות לחינוך מיוחד ",I recommend that he be transferred to a school  that offers special education classes ,I would recommend transferring him to a school that holds special education classes,83
445,זה בגלל ש  שהוא נבון כל כך ,You mean because he´s so smart ,It's because he's so smart,76
446,מצטער על האיחור ,Hi I´m sorry I´m late ,sorry for being late,67
447,אתם הזוג בקמן ,You must be the Buckmans ,You are the Beckman couple,72
448,"אני ד ""ר ג'פרי לוקאס ",I´m Dr Jeffrey Lucas ,I'm Dr. Jeffrey Lucas,92
449,"ד ""ר לוקאס הוא פסיכולוג לילדים ",Dr Lucas is a child psychologist ,Dr. Lucas is a child psychologist,100
450,הוא עוקב אחר קווין זה חודשיים ,He´s been observing Kevin for the last couple of months ,He's been following Kevin for two months,66
451,מדוע ,Why ,why,100
452,"-מר בקמן זה בי ""ס ממלכתי ",Mr Buckman this is a public school ,- Mr. Beckman is a public school,89
