,hebrewFromSub,englishFromSub,englishTranslation,ratio
453,להערכתנו המורה של קווין עסוקה בו לפחות %20 מזמנה ,We estimate that Kevin´s teacher spent at least  20% of her time dealing with Kevin ,We estimate Kevin's teacher is busy with him for at least 20% of her time,78
454,הכיתה הזאת תפגר השנה זה לא הוגן ,That class is going to finish the year behind lt isn´t fair ,This class will fall behind this year it's not fair,68
455,קווין הוא ילד מתוק מאוד רגיש מאוד ומתוח עד מאוד ,Kevin is a very sweet sensitive extremely tense little boy ,Kevin is a very sweet boy who is very sensitive and very tense,70
456,הוא זקוק לתשומת-לב מיוחדת ,He needs some special attention ,He needs special attention,91
457,זה משום שהוא היה הראשון ,It´s because he was our first ,This is because he was the first,80
458,הוא היה ילדנו הראשון ,It´s because he was our first ,He was our first child,72
459,כלומר  היינו מתוחים מאוד כשקווין היה קטן ,I mean I think we were very tense when Kevin was little ,I mean we were very tense when Kevin was little,92
460,ייתכן שקווין כבר היה כזה ברחם ,On the other hand Kevin may have been like this in the womb ,Kevin may have been in the womb already,63
461,המדע מגלה שהדברים האלה כולם כימיים ,Recent studies indicate that these things are all chemical ,Science finds that these things are all chemical,81
462,"היא עישנה ""עשב "" !",She smoked grass ,"She smoked ""grass""!",100
463,לא עישנתי בהיריון!,- l never smoked when I was pregnant ,I did not smoke while pregnant!,72
464,כן אבל במכללה עישנת כמו ארובה ,- ln college you were like a chimney--,Yes but in college you smoked like a chimney,74
465,לפני 15 שנה ,Fifteen years ago ,15 years ago,62
466,אתה נותן להם לעשות הכול!,Well you let them do anything ,You let them do everything!,69
467,אתה נותן להם לצפות בטלוויזיה  ,You let them watch TV just like that ,You let them watch TV,74
468,העובדה שקווין ילך לבית-ספר מיוחד אינה מעידה על כישלון מצדכם ,You should not look upon Kevin´s going to a special school  as any kind of failure on your part ,The fact that Kevin will go to a special school does not indicate a failure on your part,67
469,לא אני אאשים את הכלב ,No I´ll blame the dog ,No I'm blaming the dog,81
470,בסביבה חינוכית רגישה יותר לצרכיו  קודם כול קווין לא הולך לבית-ספר מיוחד ,In an educational environment that´s more sensitive to his needs First of all Kevin is not going to a special school ,In a more sensitive educational environment for his needs first of all Kevin does not go to a special school,88
471,בני-אדם הם אכזריים במיוחד הילדים ואני לא אחשוף אותו לאכזריות הזאת ,Children are cruel I won´t subject Kevin to that kind of cruelty ,Humans are especially cruel to children and I will not expose him to this cruelty,64
472,אם נצטרך נשלח אותו לבית-ספר פרטי ,If we have to we´ll send him to a private school ,"If we need to, we'll send him to a private school",84
473,אשיג עבודה נוספת ,I´ll get a second job ,I'll get another job,60
474,מר ומרת בקמן זו בעיה שלא תיעלם לה ככה סתם ,Mr and Mrs Buckman this problem won´t just go away ,Mr. and Mrs. Beckman is a problem that will not go away for nothing,70
475,אם נצטרך נשלח אותו למטפל פרטי ,If we need to we´ll send Kevin to a private therapist ,If we need to we will send him to a private therapist,90
476,זו בעיה אנו מודעים לה ,Look it´s a problem We´re aware of it ,This is a problem we are aware of,71
477,אבל אנחנו הוריו ,But we´re his parents ,But we are his parents,86
478,שנת הלימודים הבאה מתחילה בעוד 4 חודשים נראה מה תצליחו לעשות עד אז ,Well the next school year is four months off  so let´s see what can be accomplished hmm ,The next school year begins in 4 months and we will see what you will be able to do by then,61
479,-אני מוכרח לראות!,I have no life!,- I have to see!,74
480,לא לא ברחוב אנא!,- No not in the street Please ,No not on the street please!,89
481,מה זה ,What is this ,What is,74
482,-זו מסיבה לכבוד אמי כשקיבלה קידום בבנק ,It´s the party celebrating my mother´s promotion at the bank ,- This is a party in honor of my mother when she received a promotion at the bank,70
483,צריכה להיות פה מעטפה נוספת על שם בקמן ,There should be another envelope for Buckman ,There should be another envelope named Beckman here,86
484,זה היה סתם שעשוע אימא ,This is just-- lt was just for fun Mom ,It was just a fun mom,70
485,-אני שמחה שזו לא עבודה ,Well I´m glad to know it´s not a job ,- I'm glad it's not a job,74
486,זה  זה טוד נכון ,It´s that Tod isn´t it ,That's it Todd right,80
487,בתמונה הזאת רואים את פניו ,There´s one where you can see his face ,In this picture you can see his face,74
488,מטריד אותך שעשיתי את זה או שעשיתי את זה עם טוד ,Does it bother you that I did those things or that I did them with Tod ,It bothers you that I did it or that I did it with Todd,77
489,ג'ולי כל כך הרבה דברים מטרידים אותי בעניין הזה שקשה לי להבדיל ביניהם ,Gee whiz Julie There´s so many things that bother me about this  I don´t know how to separate them ,Julie so many things bother me in this matter that it is hard for me to distinguish between them,65
490,הנה משהו בשביל הארנק שלי ,Whoo! Here´s something for my wallet ,Here's something for my wallet,88
491,טוד חשוב לי מאוד ,Tod is very important to me ,Todd is very important to me,98
492,ויש לנו תמונות שמוכיחות את זה ,And we´ve got the pictures to prove it ,And we have pictures that prove it,82
493,אימא  ,- Mom ,Mom,100
494,-זה חדרך ,- This is your room ,- It's your room,84
495,עשית את הדברים האלה פה בביתי ,You did these things right here in my house ,You did these things here in my house,92
496,חשבתי שמישהו בבית חייב לעשות סקס ,Well I thought someone in this house ought to be having sex ,I thought someone in the house must have sex,78
497,עם משהו שלא דורש סוללות!,I mean with something that doesn´t require batteries ,With something that does not require batteries!,91
498,מה אמרת לי ,What did you say to me ,what did you say to me,100
499,לעזאזל חזרי לכאן!,Goddamn it! You get back here!,"Damn, come back here!",68
500,פתחי את הדלת לכל הרוחות!,Open this door!,Open the door to hell!,69
501,את יודעת למה אני עושה מין עם אביזרים ,Do you know why I´m having sex with machinery ,You know why I have sex with props,74
502,כי אביך עזב כדי לעשות חיים ואני נשארתי לגדל שני ילדים!,Because your father left to have a party and I stayed to raise two kids!,Because your father left to make a living and I stayed to raise two children!,78
503,אין לי חיים!,I have no life!,I have no life!,100
504,לכל הרוחות!,Goddamn it!,Damn it!,82
505,מה את עושה ,- What do you need ,What do you do,87
506,אני עוזבת לפני שנגיד משהו שנצטער עליו ,I´m leaving before we say things we´ll regret ,I'm leaving before we say anything we'm sorry about,62
507,משהו גרוע יותר ממה שאמרת על הסוללה ,You´re gonna say something worse than the battery remark ,Something worse than what you said about the battery,73
508,טוד ואני מאוהבים ,Tod and I are in love ,Todd and I are in love,98
509,זו לא חברות אימא זו אהבה ,"It´s not ""going steady"" love It´s love ","It's not motherhood, it's love",60
510,אני זקוקה לו!,I need him ,I need him!,100
511,הוא החיים שלי!,He´s my life ,He is my life!,92
512,הוא נוגע בי ואני רוטטת ,He touches me and I quiver ,He touches me and I vibrate,72
513,את רואה ,You see ,you see,100
514,את לא מסוגלת להתמודד עם זה ,You can´t handle it ,You can 't handle that,82
515,טוד עובד ,Tod´s working now ,Todd works,62
516,אנחנו נמצא מקום לגור בו ,We´ll find a place to live somewhere ,We'll find a place to live,75
517,היי גרי ,- Hi Garry ,Hey Gary,75
518,-להתראות ,You see ,-See you,100
519,את רואה הרגזת את אחיך!,You´ve upset your brother!,You see you annoyed your brother!,64
520,ג'ולי אני אומרת לך אם תצאי מהבית הזה נגד רצוני שלא תעזי לחזור!,Julie I´m telling you  if you walk out of this house don´t ever think about coming back ,Julie I tell you if you leave this house against my will you will not dare to return!,60
521,-בסדר גמור!,Fine ,-Fine!,100
522,מותק אני תמיד פה אם תזדקקי לי ,Honey I´m always here if you need me ,"Honey, I'm always here if you need me",96
523,יקירה מותק היזהרי!,Sweetheart! Honey be careful ,"Dear baby, be careful!",60
524,אם תרצי משהו תתקשרי אליי ,If you want anything just call me!,"If you want anything, call me",92
525,ידעתי שאתה תדע להעריך את זה ,Just incredible! I knew you´d be the one who´d appreciate this ,I knew you would appreciate it,63
526,שלוש שנים בכל ערב בכל סוף שבוע אני אכלתי פה ,Three years every night every weekend I had dinner out here ,Three years every night every weekend I ate here,86
527,היא הייתה גרוטאה כשמצאתי אותה ,Yeah it was a piece of junk when I found it ,She was junk when I found her,67
528,במכונית כזאת עשיתי אהבה בפעם הראשונה ,First time I got laid was in a car like this ,In a car like this I made love for the first time,73
529,פרנק ,- Frank ,franc,80
530,-מה ,- What ,-what,100
531,אני אתקשר לעיתון ,I´ll call the newspaper ,I'll call the paper,88
532,חשבתי שאתה ולארי תיקחו אותו לטיול ,I thought you and Larry could take him somewhere ,I thought you and Larry would take him for a walk,70
533,אני מראה ללארי את המכונית ,I am showing Larry my car ,I show Larry the car,71
534,תושיבי אותו מול הטלוויזיה ,Just plop him in front of the TV ,Sit him in front of the TV,79
535,זה מה שהוא עושה תמיד ,That´s what he always does ,This is what he always does,88
536,משחק הסופרבול היה מדהים נכון ממש עד הרגע האחרון ,Wasn´t that Super Bowl incredible right down to the last minute ,The Super Bowl game was amazing right up until the last minute,69
537,-כן  בדרך כלל הקבוצה המובילה מגדילה את הפער ואפשר לדעת מראש מי ינצח ,And usually the winning team covers the point spread Usually you can count on it ,-Yes usually the leading team widens the gap and you can know in advance who will win,62
538,-מה אתה צריך ,- What do you need ,-what do you need,100
539,לא באתי הנה כדי שתעליב אותי ,I didn´t come here to be insulted ,I did not come here to insult me,81
540,כשאתה סוגר עסקה עליך להיראות כמי שמסוגל להשתין עם הגדולים ,Puttin´ together a deal you gotta look like you can piss with the big boys ,When you close a deal you need to look like someone who is able to pee with the big ones,65
541,אתה רואה ,You see ,You see,100
542,אתה יודע ,You know ,You know,100
543,-שלושת אלפים ,A couple thousand Three tops ,-three thousand,67
544,סבתא פטי לומדת פילוסופיה מזרחית ,See Grandma Patty studies Eastern philosophy ,Grandma Petty is studying Oriental philosophy,65
545,נתן תנחש ,- Nathan guess what ,Nathan guess,83
546,-חזרת הביתה מוקדם ,- Oh you´re home early ,- You got home early,76
547,כן יש לי חדשות טובות -מה ,- l have good news ,Yes I have good news -what,73
548,מקסיקו  ,Mexico ,Mexico,100
549,גיל וקארן ייקחו את פטי ,Gil and Karen will watch Patty ,Gil and Karen will take Patti,85
550,אתקשר אליהם ,I´ll call the newspaper ,I'll call them,67
551,לא כדאי שפטי תבלה שבוע עם גיל למה לא ,Gee honey I´m really not too pro on Patty spending a week with Gil ,It's not worth spending a week with Gil why not,61
552,הוא בחור נפלא אבל הוא מתייחס ב  ,He´s a wonderful guy ,He's a wonderful guy but he's referring to,62
553,היא נהנית שם ,She has fun over there ,She enjoys it there,63
554,מה דעתך ,- What do you need ,What do you think,79
555,ניקח את פטי אתנו ,We take Patty with us ,We'll take Patti with us,89
556,למקסיקו ,To Mexico ,To Mexico,100
557,זו הזדמנות מושלמת להתחיל ללמד אותה ספרדית ,It´s a perfect opportunity to start her on Spanish ,This is a perfect opportunity to start teaching her Spanish,83
558,זה יהיה כיף ,It´ll be fun ,it will be fun,88
559,חשבתי שיהיה נחמד אם נהיה לבד ,Nathan I thought it would be nice if you and I could be alone ,I thought it would be nice if we were alone,67
560,נהיה לבד ,We will be ,We will be alone,77
561,ניקח שני חדרים ,We´ll get two rooms ,We'll take two rooms,68
562,באיזה מהם אהיה אני ,Which one will I be in ,Which one will I be in?,100
563,"זה אומר ""בואי הנה"" בספרדית ","That means ""come here"" in Spanish ","It means ""come here"" in Spanish",87
564,"""פור פבור "" בבקשה אני רוצה שתקשיבי למשהו ",Please I want you to listen to something ,"""For Power"" please I want you to listen to something",89
565,גיל בוקר טוב ,- Gil good morning ,Good morning age,88
566,-שלום סינדי ,- Hello Cindy ,Hello Cindy,100
567,מתי התכוונת לספר לי ,When were you gonna tell me ,When were you going to tell me?,88
568,לספר מה ,Tell you what ,Tell what,82
569,לני התקשר הבוקר ,Lenny called this morning ,Lenny called this morning,100
570,הם תהו אם חשבתי לקחת את ריצ'רדס לחגוג את השותפות ,He wondered where we should take Phil Richards to celebrate his partnership ,They wondered if I was thinking of taking Richards to celebrate the partnership,68
571,איש לא צריך היה לדעת על זה עד החודש הבא ,Nobody was supposed to have that information until next month ,No one should have known about it until next month,63
572,השותפות הייתה שלי ,That partnership is mine ,The partnership was mine,83
573,אני יודע שאתה חכם יותר מפיל אבל  הוא עובד כמו סוס טרויאני ,I know you´re smarter than Phil but the guy works like a Trojan He schmoozes clients ,I know you're smarter than an elephant but he works like a Trojan horse,75
574,הוא פה בלילות בסופי-שבוע ,He´s here nights weekends ,He's here at night on weekends,78
575,הוא בכיסי ולכן השם שלך מופיע על הדלת ,I own the guy And that´s what puts your name on the door ,Is in my pocket so your name appears on the door,60
576,אני כאן 8 שנים ,I´ve been here eight years ,I've been here 8 years,81
577,אני יודע שאני עמוד השדרה של כל העסק ,I´m the backbone of the operation I know that ,I know I'm the backbone of the whole business,67
578,אם לא אקבל את השותפות כדאי שאתחיל לחפש מקום אחר ,If I don´t get this partnership I gotta think about going elsewhere ,If I do not accept the partnership I should start looking elsewhere,62
579,מדוע ,- Why ,why,100
580,-אם תלך למקום אחר תצטרך לעמוד בתור מאחורי בחורים צעירים ממך שיש להם יותר ותק והם מוכנים לעבוד יותר תמורת פחות כסף ,You go somewhere else you´re gonna have to get in line  behind guys who are younger who have been there longer  who are more committed and are willing to work for less money ,-If you go somewhere else you will have to stand in line behind guys younger than you who have more seniority and are willing to work more for less money,73
581,תראה העניין הזה עם פיל עדיין לא סגור ,Look this thing with Phil is not etched in stone ,Look at this thing with an elephant not yet closed,63
582,אוכל לדחות אותו למשך החודש הבא ,I can jerk him along for the next month ,I can postpone it for the next month,69
583,סנוור אותי!,Dazzle me ,Dazzle me!,100
584,לסנוור אותך ,Dazzle you ,Dazzle you,100
585,שמע דייב יש לי בעיה בבית ,Listen Dave I´m having a problem at home ,Hear Dave I have a problem at home,77
586,עלי להקדיש יותר זמן לבני כרגע ,I really need to spend a lot of extra time with my son ,I need to spend more time with my son right now,75
587,אני לא יודע מה אנחנו יכולים לעשות ,Then I don´t know what we can do ,I do not know what we can do,88
588,"הם רעים בגלל זה קוראיםלמשחק""הרעים""!","They´re bad dudes That´s why they call the game ""Bad Dudes ""","They're bad because that's why they call the game ""bad guys""!",74
589,למה אני נפגש עם פסיכיאטר ,How come I´m seeing a psychiatrist ,Why I're meeting with a psychiatrist,61
590,מה לא בסדר אצלי -שום דבר ,- What´s wrong with me ,What's wrong with me - nothing,77
591,שום דבר אתה נהדר ,- Nothing - You´re great ,Nothing you are great at,79
592,אתה ילד כפי שאני הייתי ,You´re a kid like I was ,You're a kid like I was,89
593,יש לך דאגות ,You have a lot of worries ,You have worries,78
594,זה הכול ,That´s all ,It's all,71
595,הרופאים האלה מומחים בלעזור ל אנשים להתגבר על דאגותיהם ,And these doctors are experts at helping people with their worries ,These doctors are experts in helping people overcome their worries,82
596,זה לא צריך לגרום לך להרגיש רע ,It´s nothing to feel bad about ,It should not make you feel bad,60
597,אתה ילד נהדר ואני אוהב אותך מאוד ,You´re a great kid and I love you very much okay ,You are a great kid and I love you very much,88
598,אתה יודע מה אני חושב ,Hey you know what I think ,You know what I think,91
599,זה יהיה קיץ נהדר בשבילך ,This is gonna be a great summer for you ,This will be a great summer for you,81
600,ואל תשכח שיום-הולדתך מתקרב ,And don´t forget you got a birthday coming up ,And do not forget that your birthday is approaching,65
601,אפשר להזמין את קאובוי דן ,Can we have Cowboy Dan ,You can order the Cowboy Dan,72
602,-את מי ,- Who ,-Who,100
603,-קאובוי דן ,- Cowboy Dan ,-Cowboy Dan,100
604,הוא היה במסיבה של בילי ,He was at Billy´s party ,He was at Billy's party,93
605,הוא טוב ,He´s cool ,he is good,67
606,עשינו עסק ,It´s a done deal ,we made a deal,69
607,אני מתחיל להתרגש ,Now you´ve got me excited ,I'm starting to get excited,63
608,הובה-הובה ,Hubba-hubba ,Hoba-huba,80
609,אל ת ספר לאימא שלימדתי אותך את זה קדימה ,Don´t tell your mom I taught you that ,Do not tell the mother I taught you this ahead,66
610,מוצא חן בעיניך ,- You like it ,do you like it,88
611,היא הייתה גרוטאה כשמצאתי אותה ,- Yeah And you know it was junk when I found it ,She was junk when I found her,62
612,הי אבא!,Hi Dad ,Hi Dad!,100
613,מה זה היה ,What was that ,what was that,100
614,חברים ,Friends ,Friends,100
615,חברים מאטים חברים אפילו עוצרים!,Friends slow down They even stop ,Friends slow friends even stop!,71
616,הייתי צריכה כסף כדי למצוא דירה ,I needed money for a place to stay ,I needed money to find an apartment,61
617,-ג'ולי זה הבית שלך ,- Honey Julie´s home ,- Julie is your home,63
618,לא רציתי לספר לך מה שקרה ,I´d have to tell you what happened ,I did not want to tell you what happened,74
619,מה קרה ,- What did happen ,What happened,79
620,-אמרתי שאני לא רוצה לספר!,- l don´t want to tell you ,- I said I did not want to tell!,65
621,עזבת את הטוד הזה -כן ,- Did you leave that Tod ,You left that todd -yes,68
622,הוא הבטיח שיתחיל לעבוד בסיוד בתים ,He promised me he was gonna start a house-painting business ,He promised to start plastering houses,64
623,אבל הוא אמר שהוא שינה את דעתו ,Then he said he changed his mind ,But he said he changed his mind,86
624,הוא רוצה לצאת למרוצים עם אחיו ,He´s gonna race dragsters with his brothers ,He wants to race with his brother,64
625,האחים שלו באו והתחלנו לריב והוא אמר:,So his brothers came over and we got in a fight ,His brothers came and we started a fight and he said:,75
626,"""אף כלבה לא תגיד לי מה לעשות כדי להתפרנס ""","He said ""No bitch is gonna tell me what to do for a living ""","""No bitch will tell me what to do to make a living""",68
627,הוא אמר לי שהוא אוהב אותי ,He told me he loved me ,He told me he loved me,100
628,הם אומרים את זה ואז הם גומרים ,They say that  and then they come ,They say it and then they finish,72
629,למה אפשר לצפות מילד כזה ,Honey what can you expect from a kid like that ,What to expect from such a child,62
630,האחרון שיצאת אתו גנב לנו רהיטים!,The last guy you dated stole our furniture ,The last one you went out with stole furniture from us!,67
631,גברים הם חלאות!,- Men are scum ,Men are scum!,100
632,אני יודעת מותק גברים הם חלאות ,- Men are scum ,I know baby men are scum,67
633,בואי נלך לאכול המון גלידה ,Come on Let´s go eat lots of ice cream ,Let's go eat lots of ice cream,87
634,רוצה גלידה עם סודה -לא ,You want an ice-cream soda ,Want ice cream with soda - no,75
635,גלידה ובננות -לא ,You want an ice-cream soda ,Ice cream and bananas - no,60
636,-אולי משהו כמו צ'יפס ,Do you want something like french fries ,-Maybe something like French fries,75
637,-כן!,- Yes ,-Yes!,100
638,-חשבתי שאמצא אותך פה ,I thought I´d find you here ,- I thought I would find you here,88
639,שרלוק הולמס!,Does that make you Sherlock Holmes ,Sherlock Holmes!,61
640,אני חיה פה ,I live here ,I live here,100
641,-את חיה אתי ,You live with me ,- You live with me,100
642,לא אחיה אתך גם אם העולם יוצף בביוב ואתה תחיה על עץ!,I wouldn´t live with you  if the world were flooded with piss and you lived in a tree ,I will not live with you even if the world is flooded with sewage and you live on a tree!,78
643,סלח לי אני הולכת לסרט ,I´m going to the movies ,Excuse me I'm going to the movies,80
644,את לא הולכת עד שתשמעי אותי!,Are you out of your mind ,You do not go until you hear me!,62
645,לא! - ג'ולי הקשיבי לי ,- Let her go! - Just listen to me ,"No! - Julie, listen to me",69
646,-עזוב אותה!,I love her ,- Leave her!,74
647,לעזאזל עזוב אותה!,Hi Dad ,Damn it!,62
648,גב' בקמן אני אוהב אותה ,I love her ,Mrs. Beckman I love her,62
649,-עזוב אותה!,I love her ,- Leave her!,74
650,את מה ,- His what ,The what,75
651,אשתו ,His wife ,His wife,100
652,נישאנו לפני יומיים ,We got married a couple of days ago ,We got married two days ago,81
653,-יצאת מדעתך ,Are you out of your mind ,-you lost your mind,67
654,גב' בקמן בבקשה!,Please Mrs Buckman ,"Mrs. Beckman, please!",94
655,ג'ולי לא התכוונתי ,Julie I didn´t mean it ,Julie I did not mean,78
656,אני מצטער ,I´m sorry ,I'm sorry,94
657,האחים שלי נדנדו לי ולא יכולתי לסרב ,My brothers were ragging on me and I couldn´t back down ,My brothers rocked me and I could not refuse,67
658,אבל אתמול בלילה אמרתי להם  הם לא חשובים לי ,But last night I told them They mean nothing ,But last night I told them they were not important to me,76
659,אתם חבורת בוהמיינים ,You´re a bunch of wild young Bohemians ,You're a bunch of bohemians,78
660,בסיס שני! קדימה!,Second base here we go ,Second base! forward!,68
661,מי משחקני השדה רוצה לנסות בסיס שני ,Which one of you outfielders wants to try second base ,Who field players want to try a second base,75
662,רוצה לשחק בסיס שני קווין ,You made me play second base!,Wants to play second base Kevin,68
663,בואו נהיה צוות ,Let´s be a team ,Let's be a team,97
664,"קווין תזכור מילתהמפתחהיא""ליהנות"" ","Remember the word is ""fun ""","Kevin will remember the word developer ""enjoy""",62
