,hebrewFromSub,englishFromSub,englishTranslation,ratio
809,העסק הנורא ההוא עם משפחת אברנת'י ,That dreadful business of the Abernetty family ,That horrible business with the Abernathi family,70
810,קשה לקרוא לביתורה של משפחה שלמה משהו פעוט ,I hardly call the dismemberment of an entire family trivial ,It's hard to call an entire family home something tiny,62
811,ובכן ווטסון האם תואיל בטובך להסביר ,Well Watson would you be so kind as to e xplain What ,Well Watson would you please explain,61
812,העניין הוא שתשומת ליבו של הולמס הוסבה אך ורק בגלל העומק בו שקעה הפטרוזיליה אל תוך החמאה ביום חם ,Well the point is that it only came to Holmes' notice because the depths which the parsley had sunk into the butter on a hot day Awe ,"The thing is, Holmes' attention was diverted solely because of the depth at which the parsley sank into the butter on a hot day.",73
813,אז איני מרשה לעצמי לחייך על שלושת הפסלים שלך לסטראד ,So you see I cannot afford to smile at your three busts Lestrade ,So I do not allow myself to smile at your three sculptures for Strad,61
814,מכל מקום אודה לך מאוד אם תעדכן אותי באשר להתפתחויות ,However I would be obliged if you would keep me informed as to developments ,Anyway I would be very grateful if you would update me on developments,66
815,הקשב לזה הולמס: 'בוא מיד 'רחוב פיט 131 קנסינגטון ,Listen to this Holmes Come I nstantly 1-3-1 Pitt S treet Kensington ,Listen to this Holmes: 'Come right away' 131 Pete Street Kensington,73
816,לסטראד ,Lestrade ,Lestrad,93
817,-במה העניין ,What's it about ,- What's the point?,65
818,-זה יכול להיות כל דבר אך אני חושד שזה המשך לסיפורו מאמש אתה יודע האידיאה-פיקס שלי סיים את הקפה יש כרכרה בחוץ ,Well it could be anything but I suspect it's a sequel to his story of last night you know my 'idée fixe ' Finish your coffee there's a cab at the door ,-It could be anything but I suspect it's a sequel to last night's you know the idea -Pix finished my coffee there is a carriage outside,80
819,שתי דקות ,Two minutes ,Two minutes,100
820,זה לפחות נסיון לרצח ,It's attempted murder at least ,It's at least an attempted murder,95
821,אקט של אלימות נקלט מכתפי הבחור הצעיר ומצוארו המתוח ,There's a deed of violence in that young fellow's round shoulders and outstretched neck ,An act of violence was absorbed from the young man's shoulders and strained neck,63
822,לסטראד מיד יספר לנו ,Well Lestrade will soon tell us ,Lestrad will immediately tell us,63
823,הבט בזה ווטסון ,Look at this Watson ,Look at that Watson,89
824,זה שוב העסק עם פסלי נפוליאון רבותיי ,It's the Napoleon bust business again gentlemen ,This is again the business with the statues of Napoleon gentlemen,73
825,הם ניפצו עוד אחד ,They smashed another ,They smashed another one,91
826,חוששני שהפרשה עשתה תפנית רצינית יותר ,I 'm afraid the affair has taken a graver turn ,I'm afraid the affair has taken a more serious turn,79
827,"מר הארקר הרשה לי להציג את מר שרלוק הולמס וד""ר ווטסון ",Mr Harker allow me to present Mr Sherlock Holmes and Doctor Watson ,Mr. Harker allowed me to introduce Mr. Sherlock Holmes and Dr. Watson,82
828,מר הוראס הארקר מאיגוד העיתונות המרכזי ,Mr Horace Harker of the Central Press Syndicate ,Mr. Horace Harker of the Central Press Union,82
829,טוב שבאתם רבותיי ,Good of you to come gentlemen ,"Good that you came, gentlemen",84
830,אנא סלחו לי על סערת רוחי ,Please forgive my agitation ,Please forgive me for my storm,67
831,-אין צורך להתנצל מר הארקר ,No apology necessary Mr Harker ,- No need to apologize Mr. Harker,77
832,סיפרת לו אם כך ,You've told him then Not a word ,You told him so,61
833,כל חיי ליקטתי חדשות של אנשים אחרים ועכשיו יש לי סיפור חיים משלי ואני לא מסוגל לחבר שתי מילים ,All my life I 've been collecting other people's news and now I have a real life story of my own and I can't put two words together ,All my life I've been collecting other people's news and now I have my own life story and I'm unable to put two words together,91
834,אילו הייתי עיתונאי ונכנס דרך דלת זו הייתי מראיין את עצמי וזוכה לשני טורים בכל עיתון לונדוני ,If I had been a journalist and walked in through that door I would have interviewed myself and had two columns in every London newspaper ,If I were a journalist and came in through this door I would interview myself and win two columns in every London newspaper,86
835,והנה אני מוותר על עותק בעל ערך  בכך שאני מספר שוב ושוב את סיפורי לשורה של אנשים שונים ,And here I am giving away valuable cop y by telling my story over and over again to a string of different people ,And here I am giving up a valuable copy by repeatedly telling my stories to a host of different people,77
836,אז אם תוכל להסביר את העסק המשונה הזה אראה בזה שכר יותר מראוי על טרחתי בסיפור המעשה ,Mr Sherlock Holmes so if you could e xplain this queer business I 'd be more than paid for my trouble in telling you my story ,So if you can explain this strange business I will see in it a more than worthy reward for my hassle in the story of the act,61
837,חלק ניכר מעבודתי העיתונאית נעשה בלילה במאורה שלי בחדר הסמוך לזה ,A great deal of my journalistic work is done at night in my den in that room adjacent to this one ,Much of my journalistic work was done at night in my lair in the room next door,66
838,מתישהו בשעות הקטנות של הבוקר הזה  אני אחייה את הרגע הזה שוב ושוב בחלומותיי ,At some time in the small hours of this morning [scream] I shall live that moment over and over again in my dreams ,Sometime in the small hours of this morning I will relive this moment again and again in my dreams,76
839,אנו יודעים מי היה הנרצח ,Do we know who the murdered man was ,We know who the murdered man was,96
840,-עדיין לא אך תוכל לראות את הגופה בחדר המתים אם תרצה ,Not yet but you can see the body at the mortuary if you wish ,- Not yet but you can see the body in the morgue if you want,85
841,היכן קנית את הפסל מר הארקר ,Where did you purchase your bust Mr Harker ,Where did you buy the sculptor Mr. Harker,76
842,ממר האדסון מדרך קנינגטון ,From Mr Hudson of Kennington Road ,Mr. Hudson from Cunnington Road,60
843,אנו יודעים מה עלה בגורלו ,Do we know what became of it ,We know what happened to him,71
844,-השוטר בפתח מספר לי שזה נמצא בחזית הגינה של בית ריק בדרך קמדן-האוס ,The officer at the door tells me it's been found in the front garden of an empty house on Campden House Road ,- The policeman in the doorway tells me that it is in front of the garden of an empty house on Camden House Road,80
845,בדיוק עמדתי ללכת ולראות ,I was just going round to see it ,I was just about to go and see,68
846,תרצה לבוא ,Will you come ,You will want to come,76
847,לפורץ היו רגליים מאוד ארוכות או שהוא היה איש נמרץ ביותר ,Well the intruder either had very long legs or was a most active man ,The burglar had very long legs or he was a very energetic man,67
848,עם השטח למטה לא היה זה מבצע פשוט לטפס אל האדן הזה כל שכן לפתוח את החלון ,With that area beneath it was no mean feat to climb up to this ledge let alone to open the window ,With the area down it was not a simple operation to climb to this ledge let alone open the window,75
849,מר הארקר האם תבוא איתנו לראות את שרידי הפסל שלך ,Mr Harker will you come with us to see the remains of your bust ,Mr. Harker Will you come with us to see the remains of your statue,91
850,אני חייב להפיק משהו מזה אף שאין לי ספק שכל עיתון בלונדון ייצא לרחוב עם תיאור מלא ומפורט ,I must make something of it although I have no doubt that every newspaper in London will be on the streets with a full and detailed account ,I have to get something out of it though I have no doubt that every London newspaper will take to the streets with a full and detailed description,76
851,אתה זוכר כשהיציע קרס במירוצי דונקאסטר ,Do you remember when the stand fell down at the Downcaster Races ,You remember the stand collapsed in Doncaster racing,69
852,הייתי העיתונאי היחיד ביציע והעיתון שלי היה היחיד שלא פרסם תיאור כי הייתי מזועזע מדי מכדי לכתוב ,I was the only journalist in that stand and my journal was the only one that didn't have a published account because I was too shaken to write a word ,I was the only journalist in the stands and my newspaper was the only one that did not publish a description because I was too shocked to write,77
853,עכשיו אאחר את המועד עם רצח על סף הבית שלי ,Now I should be too late with a murder on my own doorstep ,I'll now be late with a murder on my doorstep,82
854,ובכן ,Well ,Well,100
855,דרך ארוכה עוד לפנינו אך יש עובדה אחת מעוררת מחשבה ,We have a long way to go but there is one suggestive fact ,There is still a long way to go but there is one thought-provoking fact,70
856,הוא לא ניפץ את זה בבית או מיד מחוצה לו ,He didn't smash this in the house or immediately outside it ,He did not smash it inside or immediately outside,76
857,ייתכן שהיה כה נרעש ונסער מן הפגישה עם הברנש האחר שהוא בקושי ידע מה הוא עושה ,Well perhaps he was so rattled and bustled by meeting this other fellow that he hardly knew what he was doing That's likely enough ,He may have been so upset and upset by the meeting with the other guy that he barely knew what he was doing,65
858,-זה די סביר אך מדוע הוא בחר להרוס את זה דווקא מחוץ לבית הזה ,But why did he choose to destroy it outside this particular house ,-It's quite reasonable but why did he choose to destroy it precisely outside this house,79
859,הוא ריק אז הוא ידע שלא יפריעו לו ,It's empty so he knew he wouldn't be disturbed ,He is empty so he knew he would not be disturbed,87
860,כן אבל יש בית ריק נוסף במעלה הרחוב שהוא בטח חלף על פניו ,Yes but there's another empty house further up the street he must have passed ,Yes but there's another empty house up the street that he must have passed,91
861,למה לא להרוס את זה שם ,Why not destroy it there ,Why not ruin it there,71
862,הולמס ,Holmes ,Holmes,100
863,לזכור זאת ,Remember it ,Remember this,67
864,לרשום זאת ,Don't I ,Write it down,70
865,אולי נעלה בהמשך על משהו שיתייחס לזה ,We may come on something later which will bear upon it ,Maybe we'll come up with something to address later,70
866,בינתיים בטרם ניפרד אני מציע שנערוך ביקור אחד משותף אחרון ,Meanwhile before we go our separate ways I suggest we make one last concerted visit Where to ,"In the meantime, before we part, I suggest that we make one last joint visit",71
867,לאן -חדר המתים ,The morgue ,Where - the morgue,77
868,הוא היה לבוש באופן עלוב אך לא נראה שהוא היה פועל ,He was poorly dressed but doesn't seem to have been a laborer ,He was poorly dressed but did not appear to be running,66
869,זה היה כלי הרצח היה לו להב משונן ,Oh that was the murder weapon had a serrated blade ,It was a murder weapon he had a serrated blade,79
870,אך אנו טרם יודעים אם זה היה שייך לרוצח או למת ,But whether it belonged to the murderer or the dead man we don't yet know ,But we do not yet know if it belonged to the killer or the dead,75
871,משהו בכיסיו שיסייע בזיהויו ,Anything in his pockets to help identify him Precious little ,Something in his pockets to help identify him,72
872,אם זה עשוי לעניין אותך מר הולמס ,If it might interest you Mr Holmes ,"If this may interest you, Mr. Holmes",79
873,סלח לי לסטראד ,Forgive me Lestrade ,Forgive me for Strad,72
874,בדיוק הרהרתי  בתעלומה האחת שאף אני לא מסוגל לפענח ,I was just contemplating the one mystery that not even I can solve ,I was just pondering the one mystery that even I can not decipher,79
875,המוות עצמו ,Death itself ,Death itself,100
876,אנא המשך ,Pray continue ,Please continue,79
877,כפי שאתה רואה הוא נשא מעט מאוד עליו ,As you can see he carried very little ,As you can see he carried very little on him,91
878,תפוח איזה שרוך מפת תיור של לונדון ותצלום ,An apple some string map of London and a photograph ,Apple What a drawstring A tour map of London and a photograph,75
879,הוא קרוע בצד אחד ,Well on part one it's torn ,It is torn on one side,67
880,הבט ,Look ,Look,100
881,הדרך הכי מעשית להגיע למשהו היא לזהות את המת לדעתי ,Well the most practical way of getting at it in my opinion is to identify the dead man ,The most practical way to get to something is to identify the dead in my opinion,77
882,ברגע שנדע מיהו ומיהם שותפיו תהיה לנו התחלה טובה בגילוי מי שהרג אותו על סף ביתו של מר הוראס הארקר ,Once we know who he is and who his associates are we should have a good start in learning who killed him on the doorstep of Mr Horace Harker ,Once we know who and who his accomplices are we will have a good start in discovering who killed him on the doorstep of Mr. Horace Harker's house,80
883,אינך סבור כך מר הולמס ,Don't you think so Mr Holmes ,"You do not think so, Mr Holmes",88
884,בלי ספק ,No doubt ,Without a doubt,61
885,זו לא הדרך בה אני הייתי מנהל את החקירה ,It is not the way that I would conduct the case ,This is not the way I would conduct the investigation,76
886,ומה אתה היית עושה ,And what would you do ,And what would you do,100
887,-אל תניח לי להשפיע עליך לסטראד ,Oh don't let me influence you Lestrade ,- Do not let me influence you to Strad,73
888,אני מציע שאתה תנהג על פי קו החקירה שלך ואני בשלי ,I suggest that you follow your line of inquiry and I mine ,I suggest you follow your line of inquiry and I'm mine,94
889,ונוכל להחליף רשמים ולהעשיר זה את זה ,And we can compare notes and each supplement the other ,And we can exchange impressions and enrich each other,60
890,אך אם אתה חוזר לרחוב פיט אודה לך אם תאמר למר הארקר  שהגעתי לכלל מסקנה  בעניין הזה ,But if you are returning to Pitt S treet I would be grateful if you would tell Mr Harker that I have quite made up my mind in this matter ,But if you're coming back to Pete Street I'll thank you if you tell Mr. Harker that I've come to a conclusion on this matter.,62
891,ואכן מטורף מסוכן ורצחני בעל הזיות נפוליאוניות היה אמש בביתו ,And so there was a dangerous and homicidal lunatic with Napoleonic delusions at his house last night ,Indeed a dangerous and murderous madman with Napoleonic hallucinations was at his house last night,69
892,זה יעזור לו בכתבה ,It will help him in his article ,This will help him in the article,81
893,-אתה לא באמת מאמין לזה הולמס ,You don't seriously believe that Holmes ,- You do not really believe it Holmes,73
894,בטוחני שזה ישביע את רצונם של מר הוראס הארקר והמנויים של סוכנות העיתונות המרכזית ,I 'm sure it will please Mr Horace Harker and the subscribers to the Central Press Agency ,I'm sure it will satisfy Mr. Horace Harker and the Central Press Agency subscribers,88
895,עד אז הייתי רוצה להחזיק בתצלום הזה שנמצא בכיס המת ,And until then I would like to keep this photograph found in the dead man's pocket ,Until then I would like to hold on to this photo that is in my dead pocket,79
896,מר הולמס זה עשוי להיות רמז חיוני!,Oh Mr Holmes that might be a vital clue ,Mr. Holmes This may be a vital hint!,71
897,אני סומך על זה אחרת אין לי שום עניין בו ,I trust it is otherwise it's of no interest to me ,I trust it otherwise I have no interest in it,74
898,בהצלחה לסטראד ,Good luck Lestrade ,Good luck to Strad,67
899,לשם מה אנו משלמים מיסים אינני יודע!,What we pay our taxes for I don't know ,What we pay taxes for I do not know!,90
900,כשכל פרחח יכול לצעוד פנימה ולנתץ את סחורתך מתחת לאפך ,When any ruffian can walk in and break one's goods under one's nose ,When any brat can step in and smash your goods under your nose,70
901,על פי העתק שיש של ראש הקיסר האלוהי ,Taken from a marble cop y of the Emperor's head by Dupr'e ,According to a marble replica of the head of the Divine Emperor,65
902,אכן כן ,Yes indeed ,Yes indeed,100
903,אם מדברים על היכרות אתה מזהה את הגבר שבתצלום ,Speaking in familiarly do you recognize the man in this photograph ,Speaking of dating you recognize the man in the photo,79
904,הגבר בתצלום ,Man in the photograph ,The man in the photo,83
905,אכן כן מר הולמס ,Yes indeed I do Mr Holmes ,"Indeed, yes, Mr Holmes",89
906,-בפו ,Beppo ,-Bepu,67
907,התחלתי להעסיקו לפני כעשרה ימים אך הוא נשאר רק שבוע ואז פשוט נעלם ,I took him on about ten days ago but he only stayed a week and then just disappeared ,I started employing him about ten days ago but he only stayed a week and then just disappeared,85
908,אפילו לא נטל את שכרו ,Didn't even collect his wages ,He did not even take his wages,68
909,אולי הוא היה אחראי לנזקי השבירה ,Perhaps he was responsible for the breakages ,Maybe he was responsible for the breakage damage,80
910,אחראי לנזקי השבירה ,Responsible for the breakages ,Responsible for breakage damage,80
911,אחראי לנזקי השבירה ,Responsible for the breakages ,Responsible for breakage damage,80
912,! אדוני הנכבד זוהי קנוניה בינלאומית ,My dear sir this is an international conspiracy ,"! Dear Sir, This is an international conspiracy",97
913,אני מכנה אותם רפובליקנים אדומים ,Red republications I call them ,I call them Red Republicans,95
914,כן ,Yes ,Yes,100
915,איש מלבד אנרכיסט לא היה הולך ומנתץ פסלים ,No one but an Anarchist would go about breaking statues ,No one but an anarchist would go and smash statues,82
916,האם הם שברו כל אחד שמכרת ,Did they break every one that you sold ,Did they break anyone you sold,68
917,"רק השניים שנקנו ע""י הרופא והאחד שנותר כאן בחנות ",Just the two bought by a local doctor and the one left here in my shop ,Only the two bought by the doctor and the one left here in the store,78
918,אם קרה משהו לשלושת האחרים אינני יודע על כך ,If anything happened to the other three I know nothing of it Three ,If anything happened to the other three I do not know,84
919,-כן כן אוסף של שישה ,Six to begin with yes yes A batch of six ,-Yes yes a collection of six,63
920,הזמנתי אותם במיוחד מ'גלדר ושות' מסטפני ,I ordered them especially from Gelder Company of S tepney ,I ordered them specifically from Gelder & Co. from Stephanie,67
921,ידועים לך במקרה השמות והכתובות של יתר הלקוחות ,Do you happen to know the names and addresses of the other customers ,In case you know the names and addresses of the other customers,87
922,ספרי החשבונות שלי סודיים מר הולמס ,My ledgers Mr Holmes are confidential ,My account books are confidential Mr. Holmes,72
923,מר האדסון אם התיאוריה שלך נכונה האין זה מחובתנו להזהיר אנשים אלה  מהמזימה המסוכנת מאוד הזאת ,Mr Hudson if you're theory's correct ought we to warn these people of this  this most dangerous plot ,"Mr. Hudson, if your theory is correct, it's not our duty to warn these people of this very dangerous plot.",83
924,ומי ייטיב לעשות כן מאשר מר שרלוק הולמס ,And who better to do that than Mr Sherlock Holmes ,And who better to do so than Mr. Sherlock Holmes,92
925,מר שרלוק הולמס ,Mr Sherlock Holmes ,Mr. Sherlock Holmes,100
926,כן הארץ נמה את שנתה אך אנו נעמוד על המשמר ,Yes the country slumbers but we shall remain vigilant ,"Yes, the country will sleep its sleep, but we will be vigilant",71
927,אחריי אדוני ,Follow me sir ,Follow me sir,100
928,מר ג'וסיה בראון מצ'יזיק וגברת סאנדפורד מרדינג ,Mr Josiah Brown of Chiswick and Mrs Sandeford of Reading ,Mr. Josia Brown of Chizik and Mrs. Sandford Marding,76
929,-גברת ,Mrs ,-Mrs,100
930,-כן ,Yes ,-Yes,100
931,מר האדסון ,Mr Hudson ,Mr. Hudson,100
932,האם שני הפסלים שלך נבדלו במשהו משאר הארבעה ,Did your two busts differ in anyway from the other four ,Have your two sculptures differed in anything from the other four,73
933,נבדלו משאר הארבעה ,Differ from the other four ,Differed from the other four,96
934,כולם עם קישוט יפה שהזמנתי במיוחד ,They're all with a beautiful decoration which I ordered especially ,All with beautiful decoration that I specially ordered,73
935,פרט לקישוט האם ששת הפסלים היו כמו כל האחרים ,Apart from the decoration were your six busts the same as all the others ,Except for the decoration the mother of the six sculptures was like all the others,61
936,כמו כל האחרים ,The same as all the others ,Like all the others,67
937,אבל יהיה עליכם לפנות ישירות אל 'גלדר ושות' כדי לברר זאת ,But you'd have to apply direct to Gelder Company to find that out ,But you will need to contact Gelder & Co. directly to find out,69
938,באופן אישי ,I n person ,Personally,60
939,רבותיי ,Gentlemen ,Gentlemen,100
940,רבותיי!,Gentlemen ,Gentlemen!,100
941,כשתפגשו את המנהל התואילו בטובכם להזהירו מהקנוניה ,When you meet the manager would you be good enough to warn him of the conspiracy ,"When you meet the manager, please warn him of the conspiracy",75
942,עם כל הפסלים שיש להם במקום הרפובליקנים האדומים יכולים לחגוג יום ספורט ,With all the busts they have on the premises the Red republicans could have field day ,With all the statues they have in place the Red Republicans can celebrate Sports Day,69
943,בדרך כלל אנו מוכרים את הפסל ללא קישוט אך מר האדסון הורה לצבוע את בגד השרד בשלמותו ,Normally we sell the bust without decoration but Mr Hudson ordered that the whole uniform be painted ,We usually sell the statue without decoration but Mr. Hudson ordered the ministry garment to be painted in its entirety,70
944,זה היה פרט נוסף שהפך את הפסל למיוחד ,It was e xtra detail and made it a very special statue ,It was another detail that made the statue special,73
945,בעת הבנייה על כל פנים אין שום סיבה מדוע ששת הנפוליאונים שמכרנו לו אמורים להיות שונים ממאות אחרים ,I n times of the construction however there is no reason why the six napoleons we sold to him should be different from hundreds of others ,At the time of construction in any case there is no reason why the six Napoleons we sold to him should be different from hundreds of others,91
946,אתם רואים שתי התבניות מורכבות יחד וממולאות בגבס כדי ליצור את הפסל השלם ,You see the two molds are put together and filled with plaster to make the complete bust ,You see the two molds put together and filled with plaster to create the complete sculpture,83
947,האם הן מוצקות ,Are they solid ,Are they solid,100
948,-מוצקות ,Solid ,-solidity,77
949,כן כמובן בוודאי ,Yes of coarse,Yes of course for sure,69
950,הם עוברים אז ייבוש בחדר מיוחד ולאחר מכן מאחסנים אותם ,Then they are placed in a special room to dry and afterwards stored ,They are then dried in a special room and then stored,77
