,hebrewFromSub,englishFromSub,englishTranslation,ratio
0,יש לי כרכרה בחוץ אתה חוזר עכשיו הביתה! אני חייב ,I've got a cab outside you're going home now!,I have a carriage outside and you're coming home now! I must,70
1,קייט המסכנה ,Oh poor Kate ,Poor Kate,86
2,אני צריך לשלם ,I have to pay ,I need to pay,62
3,אני חייב למנהל כסף אתה צריך לשלם על ההרס העצמי שלך ,You don't have to pay for your own destruction ,I owe the money manager you have to pay for your self-destruction,74
4,רק צא מהמקום הנורא הזה ,I'll see to it Just get out of this dreadful place ,Just get out of this awful place,76
5,הרפה!,Let go!,Let go!,100
6,הסר את ידיך!,Get your hands off!,Remove your hands!,69
7,הולמס!,Holmes!,Holmes!,100
8,מה מעשיך במאורה הזאת למען השם ,What on earth are you doing in this den ,What are you doing in this lair for God's sake,68
9,יש לך כרכרה בחוץ ,You have a cab outside ,You have a carriage outside,86
10,-כן ,Yes ,-Yes,100
11,-אנא שלח אותו הביתה ,I pray send him home ,-Please send it home,72
12,אראה אותך תוך 5 דקות -בסדר ,I'll see you in five minutes ,I'll see you in 5 minutes - okay,83
13,תן את זה לבעלת הבית ,Give this to the lady of the house ,Give it to the landlady,60
14,הולמס!,Holmes!,Holmes!,100
15,אני אדוני ,I sir ,I'm sir,83
16,-הייתי בהחלט מופתע לראותך במקום הזה ,I was certainly surprised to see you in that place ,-I was definitely surprised to see you in this place,87
17,אני מניח שאתה סבור שהוספתי עישון אופיום על כל שאר חולשותיי ,I suppose you think I've added opium to smoking to all of my other little weaknesses ,I guess you think I added opium smoking to all my other weaknesses,81
18,רק אמרתי שהופתעתי לראותך שם ,I merely said I was surprised to see you there ,I just said I was surprised to see you there,89
19,-כפי שאני אכן הופתעתי לראותך שם ,I merely said I was surprised to see you there ,- As I was indeed surprised to see you there,84
20,חיפשתי אחר ידיד ,I was searching for a friend ,I was looking for a friend,81
21,-ואני חיפשתי אויב -אויב ,And I for an enemy ,- And I was looking for an enemy - An enemy,63
22,אילו היו מזהים אותי במקום הזה חיי לא היו שווים כקליפת השום ,An enemy Had I been recognized in that place my life would not of been worth an hours purchase ,Had they recognized me in this place my life would not have been worth as much as a garlic peel,69
23,אני מקווה שאינך מעשן את תוכן המקטרת הזאת הולמס ,I hope your not smoking the substance in that pipe Holmes ,I hope you are not smoking the contents of this pipe Holmes,69
24,רק במידה הנחוצה להתמזגות עם הסביבה ,Only to the extent necessary to merge with the surroundings ,Only to the extent necessary to blend in with the environment,68
25,אני בדרכי אל לי במחוז קנט ,I'm off to Lee in Kent ,I'm on my way to Kent County,60
26,אתה בא ,Are you coming ,You come,64
27,-כמובן ,Of course ,-of course,100
28,נראה לי שאנו בטוחים עכשיו ,I think we shall be safe now Watson ,It seems to me that we are safe now,66
29,תוכל לאחוז במושכות לאן בדיוק אנו נוסעים ,Where exactly are we going The Cedars a lovely villa near Lee in Kent ,You will be able to hold the reins of where exactly we are going,62
30,בית סידרס וילה יפה בקרבת לי שבקנט ,Where exactly are we going The Cedars a lovely villa near Lee in Kent ,Cedars House A beautiful villa near Lee in Kent,60
31,מותר לשאול למה אני נוסע אל לי בקנט   באישון ליל שישי ,May I ask why I'm going to Lee in Kent in the middle of the night ,May I ask why I am going to Lee in Kent in the middle of Friday night,88
32,כי אתה עמיתי המהימן וידידי הנאמן ואני עשוי להזדקק לשניכם ,Because you are my trusty comrade and my loyal friend ,Because you are my trusted colleague and loyal friend and I may need both of you,75
33,הנה העובדות כפי שאני מבין אותן ,I may need both Here are the facts as I understand them ,Here are the facts as I understand them,83
34,לפני מספר שנים הגיע אל לי שבקנט אדון בשם נוויל סנט קלייר ,Several years ago there came to Lee in Kent a gentleman by name Neville St Clair ,A few years ago a gentleman named Neville St. Claire came to me in Kent,81
35,הוא רכש וילה גדולה את הסידרס (הארזים) וכשנה לאחר מכן נשא לאישה את בתו של מבשל שיכר מקומי ,He took a large villa The Cedars and about a year later married the daughter of a local brewer ,He bought a large villa the cedars and about a year later married the daughter of a local brewer,94
36,יש להם שני ילדים קטנים ,They have two small children ,They have two small children,100
37,יש לו עסקים בכמה חברות והוא נוסע כל בוקר לסיטי ושב כל ערב ברכבת של 17: 14 מרחוב קאנון ,He has interests in several companies and travels to the city every morning returning by the 5:14 train from Cannon Street every night ,He has businesses in several companies and he travels every morning to the City and returns every evening by a 17:14 train from Canon Street,80
38,הוא איש בעל הרגלים מתונים בעל טוב אב אוהב והוא מקובל על כל מכריו ,He is a man of temperate habits a good husband an affectionate father and is popular with all who know him ,He is a man of moderate habits and a good loving father and is acceptable to all his acquaintances,70
39,הילכך אין כל סיבה לחשוב שבעיות כספיות הכבידו עליו ,Therefore there is no reason to think that money troubles have been weighing down ,There is no reason to think that financial problems have weighed on him,63
40,-ווטסון  יש רמז לספקנות בקולך שלא מוסיף לך ,Watson there's a hint of skepticism in your voice which does you no credit ,-Watson has a hint of skepticism in your voice that does not add to you,81
41,אני משער שמרת סנט קלייר באה אליך בטענה שבעלה נעלם בדיוק!,I expect Mrs St Clair came to you saying that her husband has disappeared ,I guess Mrs. St. Clair came to you claiming her husband had just disappeared!,75
42,ווטסון מה זה ,Watson what is this ,Watson what is it,89
43,אתעלם מאווירת ההשלמה עם תלאות העולם ואמשיך ,I shall ignore your air of resignation to the world's frailties and continue ,I will ignore the atmosphere of reconciliation with the hardships of the world and I will continue,60
44,אנא ,Oh please do ,please,67
45,ביום שני יצא סנט קלייר כהרגלו אל הסיטי ,On Monday St Clair left for the city as usual ,"On Monday, St. Clair left for City as usual",95
46,טרם צאתו הבטיח להביא הביתה קופסת לבני הרכבה לילדיו ,Before he left he promised that he would bring home a box of building bricks for his children ,"Before he left, he promised to bring home a box of assemblies for his children",78
47,לבני הרכבה ,Building bricks ,Mounting bricks,73
48,-זכור זאת היטב ווטסון ,Mark that well Watson ,-Remember this well Watson,74
49,זמן קצר לאחר עזיבתו קיבלה מרת סנט קלייר מברק האומר שהגיעה עבורה חבילה בעלת ערך ניכר במשרדי חברת הספנות של אברדין ,Soon after he left Mrs St Clair received a telegram to say that a parcel of considerable value had arrived for her at the offices of the Aberdeen Shipping Company ,"Shortly after his departure, Mrs. St. Clair received a telegram saying that a package of considerable value had arrived for her at the offices of the Aberdeen Shipping Company.",89
50,היא החליטה לנסוע העירה לאסוף את החבילה לאכול צהריים ולערוך קניות ,She decided to travel to the city collect her parcel have lunch and do some shopping ,She decided to drive to town to pick up the package for lunch and go shopping,66
51,ביד המקרה היא מצאה עצמה בסמטת סוונדום עילית אותה סימטה נתעבת בה ביקרנו הערב ווטסון ,It was by chance that she found herself in Upper Swandam Lane that same vile alley that we both visited this evening Watson ,By chance she found herself in the Upper Swandom Alley the same despicable alley we visited tonight Watson,75
52,ובנקודה זו התרחש משהו די ייחודי ,And it was at this point that something quite singular took place ,And at this point something quite unique happened,65
53,כסף בבקשה ,Money please ,Money please,100
54,צאי מכאן!,Get out of here!,Get out of here!,100
55,נוויל!,Neville!,Neville!,100
56,נוויל!,Neville!,Neville!,100
57,לאן את הולכת ,Where are you going ,Where are you going,100
58,-אני עולה למעלה ,I'm going upstairs ,- I'm going upstairs,100
59,אין איש למעלה ,There's nobody upstairs ,No one upstairs,68
60,-ראיתי את בעלי מנופף מחלון למעלה ,I saw my husband waving from an upstairs window ,- I saw my husband waving from a window upstairs,99
61,אין איש למעלה -ראיתי אותו ,There is nobody upstairs ,No one upstairs - I saw him,61
62,אני מכירה את בעלי ,I saw him I know my own husband ,I know my husband,71
63,מה הוא עושה כאן ,What's he doing here ,What is he doing here,98
64,-אין איש למעלה ,There's nobody upstairs ,- No one upstairs,68
65,נוויל! -לכי ,Neville!,Neville! -Go,82
66,הם השליכו אותה החוצה ,Go on And they threw her out ,They threw her out,78
67,ועם זאת הוא מהלך חופשי ,A murderer Yet he goes free ,And yet it is a free move,62
68,יש אפילו פתח ברצפה לסילוק הגופות ,There's even a convenient trap door for the disposal of bodies ,There is even an opening in the floor for disposing of the bodies,61
69,מדוע המשטרה לא עוצרת את שני הרוצחים הללו ,Why don't the police arrest these two murderers ,Why the police are not arresting these two killers,74
70,-יש עוד כל כך הרבה לספר לך אך הנה הגענו לסידרס ,There's so much more yet to tell you but here we are at The Cedars ,-There is so much more to tell you but here we come to Cedars,78
71,תודה ,Thank you ,Thanks,67
72,מר הולמס ,Mr Holmes ,Mr. Holmes,100
73,שינה לא באה בקלות בשעה שכזאת ,I thought you'd be asleep Sleep does not come easily at a time like this ,Sleep does not come easily at a time like this,78
74,"זהו ידידי ועמיתי ד""ר ווטסון שהסכים בטובו לסייע לי בחקירה ",This is my friend and colleague Doctor Watson who has kindly agreed to help me in my investigation ,It is my friend and colleague Dr. Watson who kindly agreed to assist me in the investigation,85
75,מר הולמס דיבר אודותיך ,Mr Holmes has spoken of you ,Mr. Holmes spoke about you,81
76,-מרת סנט קלייר ,Mrs St Clair,- Mrs. St. Claire,96
77,"הרשיתי לעצמי לבקש מהד""ר לשהות למשך הלילה ",I have taken the liberty of asking the doctor to stay overnight ,I allowed myself to ask the Dr. to stay for the night,61
78,"ד""ר ווטסון קח את מקומי ",Oh Doctor Watson you take my place ,Dr. Watson Take my place,81
79,-לא באמת  ,Oh no really ,-Not really,82
80,-ווטסון מרת סנט קלייר היא אשה חזקה ונחושה מאוד בסירובך לה אתה מסתכן על אחריותך בלבד ,Watson Mrs St Clair is a very strong willed woman you refuse her at your peril ,-Watson Mrs. St. Claire is a very strong and determined woman in your refusal to her you risk only your responsibility,68
81,-תודה,Thank you ,-Thanks,67
82,כעת מר שרלוק הולמס בטרם נאכל הייתי רוצה לשאול שאלה אחת פשוטה או שתיים ,Now Mr Sherlock Holmes before we eat,Now Mr. Sherlock Holmes before we eat I would like to ask one simple question or two,61
83,האם עמוק בתוך ליבך אתה סבור שנוויל עודו בחיים ,Do you in your heart of hearts think that Neville is still alive ,Is deep in your heart you think Neville is still alive,83
84,בכנות עכשיו איני היסטרית ואף לא נוטה להתעלפות ,Frankly now I'm not hysterical nor am I given to fainting ,Honestly now I am not hysterical and not even prone to fainting,70
85,בכנות אם כך אינני סבור כך ,Frankly then I do not ,Honestly then I do not think so,65
86,אתה סבור שהוא מת ,You think he is dead ,You think he's dead,97
87,-נרצח ,Murdered ,-murdered,100
88,לא אמרתי זאת ,I didn't say that ,I did not say that,80
89,ובאיזה יום הוא מצא את מותו ,And on what day did he meet his death ,And on what day he found his death,85
90,-ביום שני ,On Monday ,-On Monday,100
91,אז איך אתה מסביר את זה שקיבלתי ממנו מכתב היום ביום שישי ,So then how do you explain that I received a letter from him today being Friday ,So how do you explain that I got a letter from him today on Friday,83
92,עכשיו מרת סנט קלייר ,Now Mrs St Clair,Now Mrs. St. Claire,97
93,אני תוהה באם תואילי לעשות לי טובה ,I wonder if you would do me a favor ,I wonder if you will do me a favor,84
94,"סיפרתי לד""ר ווטסון מה קרה עד לרגע בו סולקת מהבניין ",I have told Doctor Watson what happened up to the moment when you were ejected from that building ,I told Dr. Watson what happened until the moment she was removed from the building,69
95,האם תואילי לספר לנו מה התרחש לאחר מכן בבקשה ,Would you tell us what happened subsequently please ,Would you please tell us what happened next please,81
96,"למען ד""ר ווטסון ",For Doctor Watson's benefit ,For Dr. Watson,65
97,-ולמעני ,And for mine ,-And for me,91
98,גם אני צריך לבחון מחדש את העובדות כפי שידועות לנו עתה ,I too have to reexamine the facts as we know them ,I too need to re-examine the facts as we now know them,76
99,אם אינך עייפה מדי ,Now if you're not too tired ,If you are not too tired,78
100,-כמובן ,Of course ,-of course,100
101,כפי שאתם מתארים לעצמכם לא קיבלתי באהדה את סילוקי בכוח מן הבניין ,As you may imagine I do not take kindly to being forcibly removed from a building ,As you can imagine I did not sympathetically accept my forcible removal from the building,71
102,חיפשתי ומצאתי סיוע משטרתי ,I sought and found police help ,I searched and found police assistance,62
103,בראדסטריט ,Bradstreet ,Broad Street,91
104,-בראדסטריט ,Bradstreet ,-Broad Street,91
105,ואז חזרת לבניין ,And then you returned to the building ,Then you went back to the building,73
106,-כן ,Yes ,-Yes,100
107,מה היה משך הזמן בין שני הביקורים ,The period of time between these two visits was ,What was the length of time between the two visits,78
108,-בערך 20 דקות ,About twenty minutes ,-About 20 minutes,72
109,בשובנו הדלת לא היתה מוברחת ,By the time we returned the door was unbolted ,"When we returned, the door was not smuggled",60
110,אני רוצה להביט בחדרים למעלה ,I want to look at your upstairs rooms ,I want to look at the rooms upstairs,88
111,אין שם איש ,There's nobody there ,There is no one there,73
112,-אם אין שם איש אינך יכול להתנגד שאביט ,If there's nobody there you can't object that I look ,-If there is no one there you can not resist Shavit,75
113,אתם הישארו פה ,You men stay here ,You stay here,87
114,הוא היה בחדר הזה!,He was in this room!,He was in this room!,100
115,שוב ושוב אני אומר לך אין כאן איש ,Time and again I tell you there's nobody here ,Again and again I tell you there is no one here,76
116,אפשר להסתכל בחדר הזה ,I want to look at your upstairs rooms ,You can look in this room,68
117,אל לך לדאוג מן האדון הזה מרת סנט קלייר ,You mustn't be worried by this gentleman Mrs St Clair ,"Do not worry about this gentleman, Mrs. St. Claire",74
118,אתה יודע מפקח על פי וו ס גילברט חיי שוטר אינם מאושרים ,You know Inspector according to W S Gilbert a policeman's life isn't a happy one ,You know a supervisor according to W. Gilbert's cop life is not happy,73
119,מר בון הוא קבצן מקצועי ,Mr Boone is a professional beggar ,Mr. Boone is a professional beggar,100
120,-כן ,Yes ,-Yes,100
121,-אמרת שאף אחד לא גר כאן ,You told me nobody lived here ,- You said no one lives here,69
122,גברת הקבצן הוא אף אחד ,Madame the beggar is nobody ,The beggar's lady is nobody,85
123,אם תדקור אותנו לא נדמם ,If you prick us do we not bleed ,If you stab us we will not bleed,73
124,-שייקספיר מר בון ,Shakespeare Mr Boone ,-Shakespeare Mr. Boone,100
125,את זה אני מכיר סיפרת לי פעם ,I know that one you've told it to me before ,I know you once told me that,76
126,מפקח ,Inspector ,inspector,100
127,זה נהר התמזה מרת סנט קלייר ,That would be the Thames Mrs St Clair ,It's the Thames River Mrs. St. Claire,64
128,החלון הגדול ,And the large window ,The big window,71
129,מרת סנט קלייר חלון ונהר בסמיכות קרובה לא מעידים אוטומטית על מוות אלים ,Mrs St Clair a window and a river in close proximity does not automatically mean violent death ,Mrs. St. Clair Window and River in close proximity do not automatically indicate a violent death,93
130,היית פה בשעה החולפת ,You been here in the past hour ,You were here last hour,72
131,-כן ,Yes ,-Yes,100
132,מישהו אחר היה פה ,He was standing here ,Someone else was here,63
133,-אבוי לא הייתי בודד כענן ,Alas no I've been as lonely as a cloud ,"- Alas, I was not alone as a cloud",67
134,טניסון -וורדסוורת' מפקח ,Wordsworth Inspector ,Tennyson-Wordsworth Supervisor,64
135,הוא עמד פה ,He was standing here ,He was standing here,100
136,ראיתי אותו ,I saw him ,I saw him,100
137,מרת סנט קלייר אין שום עדות המרמזת שהוא בכלל היה פה ,Mrs St Clair there is no evidence to suggest that he was ever here ,Mrs. St. Clair has no evidence to suggest he was even here,84
138,לבני הרכבה מפקח ,Building bricks Inspector ,Bricks Assembly Inspector,64
139,בעלי יצא לסיטי הבוקר והדבר האחרון שהוא אמר לי היה שעליו לקנות לבני הרכבה ליום הולדתה של בתנו הקטנה ,My husband left for the city this morning and the last thing he said to me was that he had to buy some building bricks for our little girl's birthday ,My husband went out to City this morning and the last thing he told me was that he had to buy the assembly line for our little daughter's birthday,78
140,מישהו בטח השאיר אותם ,Somebody must have left them ,Someone must have left them,91
141,ואלה בגדיו של בעלי!,And these are my husband's clothes!,And these are my husband's clothes!,100
142,את בטוחה ,Are you sure ,are you sure,100
143,שאתאר לך אותם בפרוטרוט בעת שאתה בוחן אותם ,Shall I describe them to you in detail as you examine them ,I will describe them to you in detail as you examine them,90
144,שם החייט של בעלי הוא סמוד אם תדאג לבחון את התווית ,My husband's tailor's name is Smud if you care to examine the label ,My husband's tailor's name is smooth if you take care to examine the label,92
145,באותו רגע המפקח בראדסטריט החל להאמין לסיפור שלי ,At that moment Inspector Bradstreet began to believe my story ,At that moment Inspector Brad Street began to believe my story,89
146,הוא ואנשיו ערכו חיפוש מקיף במבנה הם מצאו כתם דם על אדן החלון ,He and his men made an extensive search of the building they found a bloodstain upon the windowsill ,He and his men conducted a thorough search of the building and they found a blood stain on the windowsill,77
147,הם חיפשו על המלאיי על ההודי ועל בון אך לא מצאו דבר ,They searched the malay the lascar and Boone but found nothing ,They searched for the stock on the Indian and Boone but found nothing,78
148,הם כשלו מלמצוא את המעיל העליון של בעלי ,They failed to find my husband's overcoat ,They failed to find my husband's top coat,78
149,מעיל עליון ,Well Overcoat ,overcoat,76
150,פריט הלבוש האחד שעליו לא נמסר ,The one item of clothing that was not accounted for ,The one item of clothing that was not delivered,80
151,עד השפל בנהר ,Until low tide ,Until the low tide in the river,62
152,זה כבד אדוני ,It's heavy sir ,It's heavy sir,100
153,משהו מכביד עליו ,It's heavy sir ,Something heavy on him,61
154,המסקנה שלך ווטסון ,Your conclusion Watson ,Your conclusion Watson,100
155,חייתי עם כל אפשרות בשבוע החולף זוועתית ככל שהיא ,Speak freely Doctor Watson I've lived with every possibility this past week however hideous ,I lived with every possibility this past week as horrible as it is,66
156,הרוצח חייב להיות בון הקבצן ,The murderer must have been Boone the beggar ,The killer must be Bon the beggar,75
157,למי עוד יש גישה  לכמות כה גדולה של מטבעות כאלה ,Who else could have access to such a vast number of pennies and halfpennies ,Who else has access to such a large amount of such coins,66
158,-זו המסקנה שאליה הגיעה המשטרה ,That is the conclusion reached by the police ,- This is the conclusion reached by the police,93
159,הם עצרו את בון והוא כרגע בתחנת המשטרה ברחוב באו ,They've arrested Boone and he is presently in,They arrested Boone and he is currently at the police station on Bao Street,63
160,כעת מרת סנט קלייר הבה נבחן שוב את משמעות המכתב הזה ,Now Mrs St Clair let us reexamine the significance of this letter ,Now Mrs. St. Claire let us examine again the meaning of this letter,65
161,"יורשה לי לקרוא אותו לד""ר ווטסון ",May I read it to Doctor Watson ,May I call him Dr. Watson,63
162,"""חכי בסבלנות ",Wait in patience ,"""Wait patiently",73
163,"נוויל"" ",Neville ,"Neville """,100
164,"נכתב בעפרון על דף ספר חלק גודל 6/9"" אין סימן מים ",Written in pencil on the flyleaf of a book octavo size no watermark ,"Written in pencil on book page part size 6/9 ""No watermark",73
165,נשלח בדואר בגרייבס-הנד בידי אדם בעל בוהן מלוכלכת ,Posted in Gravesend by a man with a dirty thumb ,Sent by mail in Graves-Hand by a man with a dirty toe,76
166,זה לא כתב ידו של בעלך ,This is not your husband's writing ,This is not your husband's handwriting,72
167,-לא ,No ,-No,100
168,-אך הפתק כן ,But the note is ,-But the note is yes,88
169,זה כתב ידו תמיד כשהוא ממהר ,It's the hand he always used when he was in hurry ,It is always his handwriting when he is in a hurry,73
170,מי שהדביק את המעטפה שגה מאוד בדרך טיפולו  בכך שהוא לעס טבק ,Whoever gummed down the envelope handled this very much in error Been chewing tobacco ,The person who pasted the envelope was very mistaken in his treatment by chewing tobacco,60
171,זה דבר פעוט כמובן ווטסון אך אין משהו כה חשוב כדברים פעוטי ערך ,This is a trifle of course Watson but there is nothing so important as trifles ,This is a petty thing of course Watson but there is nothing as important as trivial things,82
172,מרת סנט קלייר היה חותם סגירה ,Mrs St Clair there was an enclosure ,Mrs. St. Claire was a closing seal,72
173,טבעת החותם שלו ,His signet ring ,His seal ring,79
174,מרת סנט קלייר האם בעלך דיבר פעם על בר-הזהב בסימטת סוונדום עילית ,Mrs St Clair has your husband ever spoken of the Bar of Gold in Upper Swandam Lane ,Mrs. St. Claire Is your husband's mother once talking about the Golden Bar in Upper Swandom Alley,69
175,מעולם לא ,Never ,never,100
176,"-אני חושד שיש לד""ר ווטסון שאלה אלייך ",I suspect that Doctor Watson has a question to put to you ,- I suspect Dr. Watson has a question for you,79
177,זו שאלה קשה להצגה מרת סנט קלייר אך  האם בעלך הראה אי פעם סימנים לשימוש באופיום ,This is a difficult question to ask Mrs St Clair but has your husband ever shown any signs of taking opium ,This is a difficult question to ask Mrs. St. Clair but has your husband ever shown signs of opium use,93
