,hebrewFromSub,englishFromSub,englishTranslation,ratio
413,אני מציע שתישק לי בתחת קוויק!,I suggest you kiss my ass Quick ,I suggest you kiss my ass Quick!,100
414,מה אתה חושב שאתה עושה עם האקדח הקטנצ'יק הזה ,What do you think you're doing with that little shit ,What do you think you're doing with this tiny gun?,79
415,לעזאזל עם זה!,Fuck this ,screw this!,63
416,-מה הוא עושה במונית ,- What's he doing in a cab ,- What is he doing in the taxi?,69
417,-היתה לי תאונה קטנה ,Can I have a seat ,- I had a small accident,62
418,-אתה בסדר ,Junior are you OK ,-Are you okay,69
419,-אני צריך כמה שניות להירגע ,- I need a second to collect myself ,- I need a few seconds to relax,65
420,מה גילית על החברה של קלהון ,What did you learn about Calhoune's girlfriend ,What did you find out about Calhoun's company?,75
421,אני לא יודע מה גיליתי ,I don't know what I just found out ,I do not know what I found out,84
422,שוגר  ,Sugar  ,Sugar,100
423,כן ,- Yes ,Yes,100
424,תודה אני אחזור אליך ,Thanks man I'll get back to you ,Thanks I'll get back to you,93
425,אותו אדם שביצע את האיסוף בשנה שעברה יבצע אותו השנה ריצ'י ונטו ,The same gentleman is doing the pick-up this year Mr Richie Vento ,The same person who made the pick last year will be made that year by Richie Veneto,61
426,ורה אני רוצה שתצמידי אליו מישהי ,Vera I want you to put somebody on him ,Vera I want you to have someone close to him,68
427,-יש לך בחורה שתשתלט עליו ,Thanks man I'll get back to you ,- You have a girl to take over,61
428,יש לי בחורה עם כוס כל כך טוב שאם תזרוק אותו באוויר הוא יאיר כמו השמש ,I have got a girl whose pussy is so good if you threw it up in the air it would turn into sunshine ,I have a girl with a pussy so good that if you throw it in the air it will shine like the sun,72
429,-אני לא רוצה לפגוש אותה ,- I don't want to meet her ,- I do not want to meet her,94
430,תצמידי אותה אליו ,Catch him Come on ,Attach it to him,61
431,כן מי זה ,Yeah Who is it ,"Yes, who is this",76
432,רגע אחד ,Come on!,one moment,71
433,דומיניק לה-רו ,Dominique La Rue ,Dominique Le Roux,85
434,כלבת הוודו ,That voodoo bitch ,Voodoo bitch,83
435,הלו ,Hello ,Hello,100
436,אני יכול להיפגש איתך ,I can meet with you ,I can meet with you,100
437,תני לי חצי שעה ,Give me a half hour ,Give me half an hour,97
438,כן ,Yes ,Yes,100
439,יפה מאוד ,Very nice ,Very nice,100
440,מרשים מאוד ,Very impressive ,very impressive,100
441,מרשים מאוד ,Very impressive ,very impressive,100
442,-קוויק זה השם האמיתי שלך ,- Is your real name Quick ,-Quick is your real name,100
443,קוויק זה השם האמיתי שלך ,- Is your real name Quick ,Quick is your real name,100
444,לא לא קוראים לי קוויק ,No my name is not Quick ,"No, my name is not Quick",100
445,שמי האמיתי הוא  אף פעם לא שאלו אותי את זה ,My real name is  No one's asked me that ,My real name is I was never asked that,76
446,שמי האמיתי הוא אל תצחקי ורנסט ,My real name is  don't laugh  is Vernest ,My real name is Don 't Laugh,83
447,אני רואה שאת צוחקת ,I see you are laughing ,I see you're laughing,84
448,שמי הוא ורנסט בראון ,My name is Vernest Brown ,My name is Ernest Brown,68
449,אני מעדיף את השם קוויק כי ורנסט בראון זה שם דפוק והייתי רוצה לשנות את הנושא ,I use Quick because Vernest Brown is a fucked up name I'd like to change the subject ,I prefer the name Quick because Ernest Brown is a fucked up name and I would like to change the subject,78
450,אפשר לשבת ,I can meet with you ,You can sit,67
451,זה בית יפה מאוד ,This is a very beautiful house ,It is a very beautiful house,93
452,אני שוהה פה מדי פעם ,I stay here sometimes ,I stay here occasionally,62
453,-אז זה נכון מה שמספרים עליכם ,- lt's true what they say about you two ,-So it's true what they say about you,88
454,את יודעת מספרים ש  אומרים שאת עושה לקלהון  כל מיני דברים ,You know they say that  They say that you give Calhoune stuff ,You know numbers that say you do all kinds of things to Calhoun,62
455,-אני עובדת עבור מר קלהון ,- I work for Mr Calhoune ,- I work for Mr. Calhoun,98
456,-איזה מין עבודה את עושה ,- What kind of work do you do ,- What kind of work are you doing?,86
457,והעניין שלך בי הוא עסקי או אישי ,And your interest in me is that business or is it personal ,And your interest in me is business or personal,90
458,שניהם ,Both ,both,100
459,אני רוצה לעלות לחדר ,I'd like to go upstairs ,I want to go upstairs,73
460,נחמד ,Very nice ,Nice,62
461,חשבתי שאני היחיד שישן עם האקדח מתחת לכרית איזה אקדח חמוד  זה כל כך מתוק  ,I thought I was the only person who slept with his guns under the pillow ,I thought I was the only one sleeping with the gun under the pillow what a cute gun it is so sweet,73
462,מה את עושה שם ,What are you doing in there ,What are you doing there,94
463,בואי הנה ,Come here ,come here,100
464,היית מדהימה ,I see you are laughing ,You were amazing,63
465,גם אתה ורנסט בראון ,So were you Vernest Brown ,"You're and Ernest Brown, too",73
466,רק את יכולה לגרום לשם ורנסט בראון להישמע טוב ,Only you can make 'Vernest Brown' sound good ,Only you can make Ernest Brown sound good,82
467,את היחידה שיכולה לקרוא לי ככה בלי לחטוף ,You are the only person who can get away with it ,The only one who can call me that without snatching,63
468,יש לי שאלה ,I got a question ,I have a question,79
469,אני יודע שעבדנו ,I know work was being done ,I know we worked,62
470,אני עבדתי קשה בהחלט עבדתי אבל זה היה עבודה בשבילך או משהו אישי ,I was doing serious work I was working But was that work for you or was that personal ,I worked hard I definitely worked but it was a job for you or something personal,61
471,שניהם ,Both ,both,100
472,זה עניין אישי עבורי ועניין עסקי עבור מר קלהון ,It was personal for me and business for Mr Calhoune ,This is a personal matter for me and a business matter for Mr. Calhoun,80
473,מר קלהון פה ,- I work for Mr Calhoune ,Mr. Calhoun here,65
474,חשבתי שהרגשתי עוד יד על התחת שלי  לפני כמה דקות ,I thought I felt another hand on my ass a while ago ,I thought I felt another hand on my ass a few minutes ago,83
475,חשבתי שהשתגעתי אבל נראה שהוא מתחת למיטה תופס ישבנים ,I thought you were going crazy but he's under the bed grabbing asses ,I thought I was crazy but he seems to be under the bed grabbing buttocks,73
476,-לא הוא לא פה ,- No he's not here ,"- No, he's not here",100
477,-אז איפה הוא ,- Well where is he ,-So where is he?,80
478,הוא עם אשתו ,He's with his wife ,He is with his wife,97
479,באגסי נשוי ,Bugsy is married ,Bugsy is married,100
480,הבן אדם הזה נשוי ו  אני מנסה להבין את זה מאז שראיתי אותך בפעם הראשונה ,The man is married to  I've been trying to figure this out since I first saw you ,This person is married and I'm trying to figure it out since I first saw you,83
481,למה שבחורה כמוך תתעניין  בבן זונה גדול שמן מלוכלך נפוח ורופס כזה ,Why would a woman like you be interested in a big fat greasy bloated stinking gelatin-ass motherfucker ,Why would a girl like you be interested in such a big son of a bitchy swollen and loose fat,67
482,מה מושך אותך באיש הזה ,What's the attraction to this man ,What attracts you to this man,77
483,הוא אדם מבריק והוא לימד אותי הרבה ,He's a very brilliant man and he's taught me a lot ,He is a brilliant person and he taught me a lot,80
484,באמת הרבה על מה ,A lot about what ,Really a lot about what,82
485,על העסקים ,It's only business ,On business,76
486,מה בנוגע לעסקים ,What about the business ,What about business,90
487,שאי אפשר לבטוח באף אחד ,That you can't trust anybody ,That no one can be trusted,63
488,כל מי שבעסק הזה  הוא פושע ,Everybody in the business is a criminal ,Everyone in this business is a criminal,90
489,ואיך אפשר לבטוח בפושע ,And how can you ever trust a criminal ,And how to trust a criminal,75
490,אז זה העניין ,So that's what this is about ,So that's the point,64
491,את אמורה להרוג אותי ,You're supposed to kill me ,You're supposed to kill me,100
492,כן ,Yes ,Yes,100
493,והיית אמורה לשכב איתי ואז להרוג אותי ,You're supposed to kill me ,And you were supposed to sleep with me and then kill me,62
494,אני מצטערת ורנסט ,- I shot her man ,I'm sorry Ernest,60
495,אלה רק עסקים ,Like about the business ,These are just businesses,62
496,זה אישי ,This is personal ,It's personal,83
497,מה איתך ,What are you talking about ,What about you,70
498,-אני לא מסתכלת על כולם ,- I ain't looking at every guy ,- I'm not looking at everyone,73
499,-תשימי לב אליי אני הדייט שלך!,- Pay attention to me I'm your date ,"- Pay attention to me, I'm your date!",100
500,-אתה לא מספיק בשבילי -מה ,I've got enough sense to get away from you ,- You're not enough for me,61
501,שמעת מה אמרתי ,What are you doing in there ,You heard what I said,62
502,אני הולכת להשיג לעצמי גבר אמיתי ,I'm going to get myself a real man ,I'm going to get myself a real man,100
503,יש לי מספיק שכל להתרחק ממך לעזאזל ,I've got enough sense to get away from you ,I have enough mind to get away from you to hell,74
504,תקני לעצמך את המשקאות מעכשיו ,Buy your own drinks from now on ,Buy yourself the drinks from now on,85
505,הבחורה הזאת מסתכלת עליך מאז שהיא נכנסה ,That girl's been staring at you Richie ,This girl has been looking at you since she came in,63
506,היא רוצה משהו ,She wants something ,She wants something,100
507,-למה היא נפטרה מהבחור ההוא ,- Why did she get rid of that guy ,- Why did she get rid of that guy?,100
508,-היא רוצה אותנו ,- She wants us ,- She wants us,100
509,את שלושתנו ,The three of us Richie ,The three of us,81
510,היא יפהפייה ,She's beautiful ,She's beautiful,100
511,תראה ריצ'י היא מחייכת אליך ,Richie she is smiling at you ,Look Ritchie she's smiling at you,85
512,ריצ'י הבחורה שם רוצה לקנות לך משקה ,Richie the lady would like to buy you a drink ,Richie the girl there wants to buy you a drink,73
513,אמרתי לך שהיא חמה עליך ,I told you she was hot ,I told you she's hot on you,78
514,היא רוצה זיון ,She wants to fuck ,She wants to fuck,100
515,-היא אמרה משהו עלינו ,She wants something ,- She said something about us,65
516,ריצ'י אתה ממזר בר מזל ,Richie you lucky bastard ,Richie you're a lucky bastard,91
517,תשמע  תגיד לגברת שאני אקבל את הצעתה אם היא תבוא לשבת איתי ,Listen tell the lady I'll accept her offer if she'll come sit with me ,Listen tell the lady I'm going to accept her offer if she comes to sit with me,87
518,-אתה בעניינים ריצ'י!,- You're in Richie You're in ,- You're in Richie's business!,75
519,-אני אתקשר אליך כשזה יקרה טוב ,- l'll tell you when I'm in I'll call you ,- I'll call you when it's good,66
520,שמת לב שהסתכלתי עליך ,Did you notice me watching you ,You noticed I was looking at you,65
521,-האמת שלא ,We're not ,-Not really,63
522,-טוב אז הסתכלתי ,Well look  ,-Well so I looked,72
523,אני חדשה בעיר ואין לי חברים ואתה נראה חברותי למדי ,I'm new in town and I haven't any friends You look quite friendly ,I'm new to town and have no friends and you look pretty sociable,73
524,תרצה להיות חבר שלי ,Would you like to be my friend ,You want to be my friend,78
525,תראי  בטח אני רוצה להיות חבר שלי  כלומר שלך ,Would you like to be my friend ,"Look, I'm sure I want to be my friend, that's yours",61
526,שמי ריצ'י ,My name is Richie Richie Vento ,My name is Richie,72
527,ומה שמך יקירתי ,And what's your name darling dear ,And what's your name my dear,82
528,סנשיין(אור שמש) ,Sunshine ,Sunshine (Sunlight),64
529,כן לעזאזל אני בא!,Yes goddammit I'm coming ,Yes damn I'm coming!,84
530,אני בא!,I'm coming ,I'm coming!,100
531,-איך היתה הפגישה ,- How was it ,- How was the meeting?,69
532,-הרגתי אותה ,- I killed her ,- I killed her,100
533,-קרעת לה את הכוס מה ,- Tore the pussy up ,- You tore her pussy,69
534,-לא הרגתי אותה ,- No man I killed her ,- I did not kill her,70
535,על מה לעזאזל אתה מדבר ,What are you talking about ,What the hell are you talking about?,85
536,-יריתי בה בנאדם ,- I shot her man ,"- I shot her, man",100
537,לא היא ניסתה להרוג אותי ,She tried to kill me ,No she tried to kill me,93
538,בגלל זה היא רצתה לפגוש אותי ,That's why she wanted to see me ,That's why she wanted to meet me,89
539,קלהון ניסה להשתמש בה כדי להרוג אותי ,Calhoune tried to use her to take me out ,Calhoun tried to use it to kill me,76
540,הוא ניסה פעמיים הלילה!,He tried twice tonight ,He tried twice tonight!,100
541,הם ניסו להרוג אותי אחרי ארוחת הערב עם דומיניק שבעצם היתה מתברר הזמנה להצטרף לכנופיה של קלהון ,They tried to kill me after that dinner which was really an invitation to join Calhoune's gang ,"They tried to kill me after dinner with Dominic, who turned out to be an invitation to join Calhoun's gang.",78
542,למה לא סיפרת לי את זה קודם ,Why didn't you tell me this earlier ,Why didn 't you tell me that before?,72
543,כי לקח לי זמן להבין ,Let's figure out what to do ,Because it took me a while to figure out,60
544,אני יורה במי שמנסה להרוג אותי ,She tried to kill me ,I shoot anyone who tries to kill me,65
545,שב!,Sit down ,Sit down!,100
546,-למה אני צריך לשבת ,- Why should I sit down ,-Why should I sit,86
547,-שב לעזאזל!,- Why should I sit down ,- Sit the hell down!,68
548,קוויק אתה לא גנגסטר ,Quick you're not a gangster ,"Quick, you're not a gangster",100
549,אנחנו לא ,We're not ,we are not,63
550,אנחנו בעלי מועדון ,We're club owners ,We own a club,73
551,אנחנו מנהלים מועדון ריקודים ,We run a dancehall ,We run a dance club,76
552,קלהון הוא רוצח אכזרי ,Calhoune is a cold-hearted killer ,Calhoun is a ruthless killer,62
553,הוא יהרוג אותך ,He'll have your ass killed ,He will kill you,67
554,הוא בטח לא יודע עדיין על לה-רו אבל בבוקר הוא ממש ירצה להרוג אותך ,The man probably doesn't know about La Rue yet ,He probably does not know about La Roe yet but in the morning he will really want to kill you,62
555,אז צריך למצוא מקום שתוכל להתחבא בו עד שנוכל לבצע את התוכנית ולהסתלק ,But in the morning he's going to want you dead so we're going to find a place where we can lay low until we can run this scam and split ,So we need to find a place where we can hide until we can carry out the plan and get away,62
556,-אתה אומר שאני צריך להתחבא ,- Are you saying I should hide ,- You say I have to hide,76
557,-אתה באמת תתחבא!,- You're going to hide ,- You will really hide!,60
558,אם לא תתחבא הם יהרגו אותך ,If you don't they'll kill you ,"If you do not hide, they will kill you",76
559,"מה אתה רוצה שיכתבו על המצבה שלך ""כאן קבור גבר בן 27 ",What about your tombstone 'Here lies a man 27 years old ',"What do you want them to write about your tombstone? ""A 27-year-old man is buried here",74
560,"""הוא מת אבל הוא לא ילד"" ",'He died but he ain't no punk ',"""He's dead but he's not a child""",69
561,אם תמות בגיל 89 כשהילדים והנכדים שלך סביב מיטתך זה מגניב אבל זה לא מגניב למות בגיל 27 ,When you die at 89 with your children and grandchildren around the bed that's cool It ain't cool to die at 27 I won't let you do that ,If you die at 89 when your children and grandchildren are around your bed it's cool but it's not cool to die at 27,81
562,אני לא אתן לך לעשות את זה לך או לי ,I won't let you do it to me ,I will not let you do it to you or me,81
563,אם הם יהרגו אותך הם יהיו חייבים להרוג אותי כי אני אהרוג אותם ,If they kill you they'll have to kill me because I'm going to kill them ,If they kill you they will have to kill me because I will kill them,84
564,אוקיי רבותיי זו פשיטה!,- Sorry she only said this gentleman ,Okay gentlemen this is a raid!,63
565,אם מישהו ינסה לעזוב אני אירה לו בתחת ,Anybody try to leave I'll pump one in your ass ,If anyone tries to leave I'll shoot him in the ass,65
566,בבקשה תשתפו פעולה עם השוטרים שנוכל לגמור עם זה מהר ,Cooperate with the officers so we can get this done as quickly as possible ,Please cooperate with the cops we can get it over with quickly,69
567,להקה!,Band!,a band!,80
568,תנגנו מוזיקה של נסיעות ,Play some travelling music ,Play travel music,79
569,ג'ק ג'נקינס!,Jack Jenkins!,Jack Jenkins!,100
570,ג'ק ג'נקינס! אלוף העולם במשקל כבד!,Jack Jenkins the Heavyweight Champion of the World!,Jack Jenkins! Heavyweight World Champion!,88
571,אני לא מאמין ,I can't believe it ,I do not believe,71
572,מה אתה עושה פה ,What are you doing here ,what are you doing here,100
573,אתה אלוף העולם במשקל כבד! הילדים שלי מתים עליך ,You're the Heavyweight Champion of the World ,You are the world heavyweight champion! My kids are dying for you,67
574,כל מי שאני מכיר מת עליך ,My kids love you Everybody I know loves you ,Everyone I know is dead on you,60
575,אתה האלוף! מה אתה עושה פה ,What are you doing here ,You are the champion! what are you doing here,69
576,אתה אמור להיות באימון!,You should be in training ,You're supposed to be in training!,76
577,אתה תהיה מוכן לקרב ,Will you be ready for the fight ,You will be ready for battle,75
578,אני אהיה בסדר ,I'll be fine ,I will be fine,92
579,אתה תהיה בסדר ,You'll be fine ,You'll be fine,100
580,שוגר בוא נלך לדבר במשרד ,Sugar let's talk in the office ,Sugar Let's go talk in the office,95
581,ג'ק יכול לבוא ,Can Jack come ,Jack can come,100
582,-למי להקדיש את זה ,- Who do I make this out to ,- To whom to dedicate it,64
583,"-לחברי הטוב פיל"""" ",- 'To my good friend Phil ',"- To my good friend Phil """"",100
584,ריי לא אעצור אותך הלילה כי אני רוצה שתנסה למצוא בשבילי את החבר שלך קוויק ,Ray I won't take you down tonight because I want you to find out where your friend Quick is ,Ray I will not stop you tonight because I want you to try to find for me your friend Quick,80
585,אבל המועדון שלך סגור ,But your place is closed down ,But your club is closed,73
586,מה זה משנה כל עוד אתה ממשיך לכסח אותם מה ,What difference does it make As long as you keep knocking them out ,What does it matter as long as you keep mowing them what,70
587,הוא בחור טוב ,He's a good kid ,He's a good guy,73
588,אם תשמע משהו תודיע לי כן ,If you hear anyhing let me know OK ,If you hear anything let me know,94
589,זו  אני יודע ,I know ,This I know,71
590,למה שלא תלך הביתה לישון ,- Who do I make this out to ,Why not go home to sleep,61
591,קח מונית אתה צריך לנוח ,You need your rest ,Take a taxi you need to rest,65
592,טוב בסדר ,OK man ,OK fine,62
593,בבקשה אלוף ,- Bitch please ,Please Champion,67
594,שלום מר קלהון ,Hi Mr Calhoune ,Hello Mr. Calhoun,80
595,מה שלומך ,How are you doing ,How are you,79
596,איך העניינים ,How's things going ,How are things,69
597,תיכנס ריי ,Get in Ray ,Ray enters,60
598,איפה קוויק ,Where's Quick ,Where's Quick,100
599,קוויק קצת עצבני ,Quick has nerve problems ,Quick a little nervous,61
600,אנשים ניסו להרוג אותו אז שחררתי אותו לכמה ימים שיירגע ,People have been trying to kill him So I let him off for a few days to relax ,People tried to kill him so I released him for a few days to calm down,75
601,קוויק עצבני כי אנשים מנסים להרוג אותו ,Quick's nerves are bad from people trying to kill him ,Quick nervous because people are trying to kill him,85
602,אתה יודע משהו על העניין הזה ,You've got to do something about them eyes ,You know something about this,68
603,קוויק ,Quick ,Quick,100
604,בחייך איפה שמעת את זה ,Oh man Where did you hear that ,"Come on, where did you hear that?",82
605,אני שומע הרבה דברים ריי ,I hear a lot of things Ray ,I hear a lot of things Ray,100
606,הרבה דברים ,A lot of things ,many things,62
607,שמעתי שאתם הורסים את העסקים שלי עם המועדון שלך ,I hear you are ruining my business with your club ,I heard you're ruining my business with your club,92
608,ואז שמעתי שאתם לא רוצים לעבוד איתי ,I hear you don't want to go into business with me ,Then I heard that you do not want to work with me,65
609,אתה יודע אני שומע את כל הדברים האלה ריי וחיברתי בין כל הפרטים ואתה יודע מה אני חושב ,You know I hear all these things Ray And I add them up Know what I come up with ,You know I hear all these things Ray and I connected all the details and you know what I think,76
610,-לא ,- No ,-No,100
611,-אתה לא יודע ,- You don't ,-you do not know,75
612,זה מה שאני חושב ,I think that's all ,That's what I think,76
613,ילד קטן ומטומטם שיגרום לכך שיהיו שני כושים פחות בעולם אחד זקן ואחד צעיר ,A young dumb fuck who's going to make it two less jigs in this world One old and one young ,A dumb little boy who will make there two less Negroes in the world one old and one young,68
614,כשתפגוש את קוויק אני מציע שתתכוננו לעבור למקום אחר כי נמאס לי לשחק עם כושים מחורבנים ,When you see Quick I suggest you guys make plans to go elsewhere because I'm tired of playing around with jigs ,When you meet Quick I suggest you get ready to move somewhere because I'm tired of playing with shitty niggers,69
615,זה הכל ,Is that all ,that's it,70
616,-מה ,- What ,-what,100
617,-זה הכל ,Is that all ,-that's it,70
618,כן ריי ,Yeah Ray yeah ,Yes Ray,60
619,אני חושב שזה הכל ,I think that's all ,I think that's all,100
620,לילה טוב ,Goodnight ,Good night,95
621,אני רוצה לשחרר בערבות את האנשים שברשימה ,I'd like to have the people on that list bailed out ,I want to bail out the people on the list,76
622,יש 125 אנשים ברשימה הזאת ,There are 125 people on this list ,There are 125 people in this list,91
623,אתה משלם ערבות ל-125 איש ,You're posting bail for 125 people ,You pay bail to 125 people,73
624,יש בעיה ,Is that a problem ,There is a problem,86
625,-מי זה ,- Who is he ,-Who is,80
626,תגיד לו כמה זה יעלה הוא בטח יברח בפחד ,Tell him how much it'll cost and he'll run off scared ,Tell him how much it will cost he will probably run away in fear,62
627,טוב בוא נראה  ‏125 איש על עבירה מהסוג הזה  ,There are 125 people on this list ,Well let's see 125 people for an offense of this kind,63
628,‏7 500 דולר ,$7 500 ,"$ 7,500",100
629,כן ‏7 500 דולר ,Yes $7 500 ,"Yes $ 7,500",100
630,תן לי קבלה ,Give me a receipt ,Give me a receipt,100
631,היית צריך לראות את זה קוויק ,Quick you should have seen it ,You should have seen this quick,87
632,‏30 לימוזינות נוסעות לעבר השקיעה ,30 limousines driving off into the sunset ,30 limousines drive towards sunset,72
633,הלבנים האלה לא ידעו מה לעשות ,Them white boys didn't know what to think ,These whites did not know what to do,73
