,hebrewFromSub,englishFromSub,englishTranslation,ratio
200,לעזאזל! זו הפעם השלישית שמדלגים על המספר שלי!,That's the third time they slapped my number ,damn it! This is the third time my number has been skipped!,61
201,שמישהו ידאג לכסף שלי!,You'll take care of my money ,Someone take care of my money!,74
202,תדאג לו אתה  ,You'll take care of my money ,Take care of him,64
203,אז היא עדיין איתו ,So is she still with him ,So she's still with him,98
204,לא יודע היא לא מוכנה לדבר על זה בטלפון ,I don't know She wouldn't talk on the phone ,Do not know she is not ready to talk about it on the phone,65
205,העסקים טובים הערב מה ,We're doing good tonight ,Business is good tonight what,68
206,לעזאזל!,Damn  !,damn it!,73
207,עד לפני כמה שניות ,Until a couple of seconds ago ,Until a few seconds ago,81
208,-מי זה ,- Who's that ,-Who is,62
209,-זה השוטר שבא אליי הביתה ,- The cop who came by my house ,- This is the cop who came to my house,78
210,הי ריי ,Hey Ray ,Hi Ray,77
211,איש הממתקים ,The candy man ,The candy man,100
212,שלום סרג'נט קנטון ,Hello Sergeant Cantone ,Hello Sergeant Canton,98
213,תכיר זה חבר שלי מר קוויק ,I'd like you to meet a friend Mr Quick ,Meet this my friend Mr. Quick,67
214,בטח מאז 1911 ,Probably been like 1911 ,Probably since 1911,62
215,-כן אז הרופא נתן לך מכה בתחת ,- When the doctor slapped your ass ,-Yes so the doctor gave you a blow to the ass,63
216,-כן אז זה היה אני עוד מחפש אותו ,It was you I was looking for ,-Yes so it was I was still looking for him,75
217,אני קצת כועס עליך ריי ,I'm kind of mad at you Ray ,I'm a little mad at you Ray,75
218,-למה אתה כועס עליי ,- Why are you mad at me ,-Why are you mad at me,100
219,-שיקרת לי ,- You lied to me ,-you lied to me,100
220,אמרתי לי שאתה בעסקי הממתקים ,You said you were in the candy business ,I told you you were in the candy business,88
221,מתברר שאתה הריי שחיפשתי ,It was you I was looking for ,Turns out you're the Ray I was looking for,69
222,אתה רוצה לאסור אותי בגלל זה ,With that you can relocate ,You want to ban me because of that,63
223,לא אני לא אאסור אותך ,I want to talk business with you ,No I will not ban you,60
224,אני רוצה לדבר איתך בענייני עסקים ,I want to talk business with you ,I want to talk to you about business,79
225,איפה אפשר לדבר ,Where can we talk ,Where to talk,73
226,-במשרד שלי ,- My office ,-In my office,86
227,-איפה המשרד שלך ,- Where's your office ,- Where's your office?,100
228,התקשר אליי חבר בשם באגסי קלהון ,I got a call from a friend by the name of Bugsy Calhoune ,A friend named Bugsy Calhoun called me,72
229,אל תבין לא נכון  אני יודע שתמיד יהיו מועדוני לילה ,Now don't get me wrong there's always going to be after-hour places ,Do not get me wrong I know there will always be nightclubs,67
230,לרוב אנחנו מניחים להם הכסף הוא לא כזה גדול אבל אתם מרוויחים בין 10 000 ל-15 000 דולר בשבוע ,We generally leave them alone but you guys are doing 10 000-15 000 a week ,Usually we assume them the money is not that big but you earn between 10 000 and 15 000 dollars a week,62
231,זה הרבה כסף ,That's a lot of money ,it's a lot of money,80
232,אם לדבר בכנות מר קלהון ואני רוצים חלק מהכסף ,To be perfectly honest Mr Calhoune and myself want some of it ,To be honest Mr. Calhoun and I want some of the money,76
233,על כמה כסף אתה מדבר חלאה עלובה ,How much money are you talking about you maggot motherfucker ,How much money are you talking about poor scum,72
234,אתם מרוויחים 15 000 ,You guys are doing 15 000 ,"You earn 15,000",70
235,הייתי אומר שהחלק שלנו הוא 10 000 ,Let's say our cut is 10 000 ,I would say our share is 10 000,66
236,אתה שודד אותנו בן זונה ,You're robbing us you son of a bitch ,You're robbing us son of a bitch,94
237,לא לא ,No no ,no no,100
238,אתה שודד מהמערכת ריי ,You're robbing the system Ray ,You're a robber from the Ray system,81
239,אתה רוצה שארחם עליך ,Are you going to take me in for that ,You want me to take pity on you,63
240,אתם פושעים בשם אלוקים ,Are you going to take me in for that ,You are criminals in the name of Gd,62
241,לדעתי זו עסקה הוגנת למדי ,It's a pretty fair deal ,I think this is a pretty fair deal,77
242,רציתי יותר ,I wanted more ,I wanted more,100
243,אבל באגסי אמר שזה הוגן ,But Bugsy said it was fair ,But Bugsy said it was fair,100
244,אם זה היה תלוי בי הייתי נותן לכם הרבה פחות ,If it was up to me I'd give you jigs just enough money to function ,If it was up to me I would give you much less,61
245,כשאני רואה אנשים כמוכם בחליפות יפות עם מכוניות פאר ובתים יפים ואני חי בצריף מזוין!,When I see you guys with the fancy suits and cars and nice houses and I'm living in a fucking hovel!,When I see people like you in beautiful suits with luxury cars and beautiful houses and I live in a fucking hut!,68
246,זה מציק לי ,I mean that bothers me ,it bothers me,69
247,אז עשינו עסק או מה ,I want to talk business with you ,So we did business or what,62
248,נוכל לחזור אליך ,Can we get back to you ,We can get back to you,100
249,לא אני אחזור אליכם ,No I'll get back to you ,No I'll get back to you,100
250,ריי תתנגד אם אקח קופסת לבבות שוקולד ,Ray would you mind if I take a box of chocolate hearts ,Ray would object if I took a box of chocolate hearts,83
251,-זה יום ההולדת של אשתי ,- lt's my wife's birthday ,- It's my wife's birthday,96
252,קח מה שאתה רוצה ,- What are you talking about ,Take what you want,68
253,תודה ,Thanks ,Thanks,100
254,אני רוצה שתאסוף את כולם ,Quick I want to talk to you ,I want you to pick them all up,70
255,אנחנו חייבים אבל לפני זה נבעט לו בביצים ,We've got to but before we do we're going to kick him in the nuts ,We must but before that we kicked him in the balls,66
256,יש לי תוכנית שבעזרתה נוכל להרוויח כסף טוב ,I have a plan where we can all make heavy money ,I have a plan with which we can make good money,72
257,אם הכל יעבוד כמתוכנן כל אחד יקבל 5 0000 דולר ,If everything works out the way I plan you'll have $50 000 each ,"If everything works out as planned everyone will receive $ 5,000",65
258,עם הכסף הזה תוכלו לעבור למקום אחר ,Are you with this gentleman ,With this money you can move somewhere else,60
259,תוכלו להתחיל להיות שומרי חוק אם תרצו תפתחו עסק משלכם ,Go legit if you want to open your own business ,You can start being a law enforcer if you want to start your own business,61
260,שוגר איך נרוויח 5 0000 דולר ,How do we make $50 000 ,Sugar how do we earn 5 0000 dollars,61
261,כולם יודעים שהקרב הגדול הוא השבוע ,Everybody knows the big fight is this week ,Everyone knows the big battle is this week,79
262,עד יום שישי יהיו בערך ‏750 000 דולר בבתי ההימורים ,There will be 3/4 of a million dollars in the booking houses by Friday ,"By Friday there will be about $ 750,000 in the gambling houses",63
263,נשמע כאילו באגסי קלהון ירוויח הרבה כסף ,Calhoune's going to make a lot of money ,Sounds like Bugsy Calhoun will make a lot of money,72
264,כל בתי ההימורים בעיר שייכים לו חוץ מזה שלנו ,He owns all the booking houses except ours ,All the gambling houses in the city belong to him except ours,66
265,אז איך אנחנו נרוויח 5 0000 דולר ,How are we going to make $50 000 each ,So how do we earn 5 0000 dollars,62
266,אנחנו נשדוד את באגסי קלהון ,We'll rob Bugsy Calhoune ,We'll rob Bagsy Calhoun,94
267,שוגר אמר שאנחנו לא יכולים לעמוד מולו איך נשדוד אותו ,We can't stand up to him so how can we rob him ,Sugar said we could not stand before him how we would rob him,64
268,תקשיבו אם הכל ילך כמתוכנן כבר לא נהיה פה כשהוא יבין ששדדו אותו ,If everything goes the way I plan we'll be gone before he realises he's been hit ,Listen if everything goes as planned we will no longer be here when he realizes he has been robbed,65
269,-ג'נקינס יהרוג אותו ,- Jenkins will kill that boy ,- Jenkins will kill him,77
270,-בדיוק ,- Exactly ,-exactly,100
271,וקלהון יודע שאנחנו מכירים אותו וכשהוא יראה שהימרנו על הלבן הוא יחשוב שאמרנו לג'נקינס להפסיד בקרב כדי להרוויח קצת כסף ,Calhoune knows we know Jenkins so if he sees us betting on the white boy he'll think we talked Jenkins into taking a dive to make money to relocate ,And Calhoun knows we know him and when he sees we're betting on White he's going to think we told Jenkins to lose the battle to make some money.,71
272,הבנתי הוא יוסיף את הכסף שלו וזה לא משנה מי ינצח אנחנו נקבל את כל הכסף ,He puts his money with the other money so it doesn't matter who wins we're hitting all the money ,I figured he would add his money and no matter who wins we will get all the money,62
273,שוגר אתה בן זונה חכם מאוד ,You're robbing us you son of a bitch ,Sugar You are a very smart son of a bitch,62
274,-כולכם איתי ,- Are you guys with me ,- You're all with me,68
275,נתראה מחר אם כך ,We'll see you all tomorrow then ,See you tomorrow then,81
276,קוויק אני רוצה לדבר איתך ,Quick I want to talk to you ,Quick I want to talk to you,100
277,אולי כדאי שתדבר עם טומי סמולס מחר ,You might want to talk to Tommy Smalls tomorrow ,Maybe you should talk to Tommy Smalls tomorrow,77
278,-בשביל מה ,- For what ,-for what,100
279,אולי תרכך אותו קצת והוא יספר לך משהו על קנטון ,You loosen him up maybe he'll tell you something about Cantone ,Maybe soften it up a bit and he'll tell you something about Canton,75
280,-לדעתך סמולס עד כדי כך טיפש ,- You think Smalls is that stupid ,- You think Smalls is so stupid,87
281,-אני יודע שהוא עד כדי כך טיפש ,- I know he's that stupid ,- I know he's so stupid,82
282,סרג'נט פיל קנטון ,Sergeant Phil Cantone ,Sergeant Phil Canton,98
283,את איתו ,- Are you guys with me ,You're with him,63
284,-לא אני לא ,- No I'm not ,-No I do not,76
285,-נעים להכיר אותך ,- lt's nice to meet you ,-Nice to meet you,86
286,קדימה טומי ,Come on Tommy ,Come on Tommy,100
287,קדימה!,- For what ,forward!,67
288,-מה לעזאזל קורה פה ,- What is going on here ,-What the hell is going on here,82
289,! -אתה ער עכשיו ,- Are you awake now ,! - You're awake now,79
290,כן לכל הרוחות אני ער ,Hell yeah I'm awake ,Yes to hell I'm awake,85
291,מה לעזאזל קורה כאן ,- What is going on here ,What the hell is going on here,82
292,עכשיו תגיד לי מה קורה פה ,- What is going on here ,Now tell me what's going on here,72
293,בשביל מה הכית אותי ,So what do you do now ,What did you beat me for?,62
294,אני צריך לכסח אותך!,- lt's nice to meet you ,I need to mow you!,63
295,-הגיע הזמן לשלם את המחיר ,- lt's time to pay the piper Tommy ,- It's time to pay the price,79
296,-איזה מחיר על מה אתה מדבר ,- What are you talking about ,-What price are you talking about,90
297,חכו אני לא יודע על מה אתם מדברים אבל אם יש לכם בעיה אפשר לדבר עם קלהון ,Wait I don't know what you're talking about If there's a problem we can talk to Calhoune ,Wait I do not know what you are talking about but if you have a problem you can talk to Calhoun,77
298,כבר שוחחתי עם מר קלהון ,I spoke to Mr Calhoune ,I've already talked to Mr. Calhoun,65
299,יש עוד דבר אחד ,And there is one other thing ,There is one more thing,78
300,באגסי אמר לי לחתוך לו את הגרון ,Bugsy said I was to cut his throat ,Bugsy told me to cut his throat,77
301,אז תחתוך ,Then cut it ,Then cut,84
302,זה נעשה ,It's done ,It is done,74
303,החבר שלנו הוא היסטוריה ,Our friend's a memory ,Our friend is history,67
304,יודע משהו קרה דבר מוזר מאוד ,But you know the strangest thing just happened ,Know something happened a very strange thing,67
305,אחד האנשים של שוגר ריי הימר ב-200 000 דולר על הקרב ,One of Sugar Ray's people just put a $200 000 bet on the fight ,"One of Sugar Ray's men gambled $ 200,000 on the fight",71
306,זה שום דבר ,That's nothing ,It's nothing,69
307,הם מנסים להרוויח קצת כי הם יודעים שהם עומדים לסגור ,They're just trying to make some cash before closing down ,They're trying to make some money because they know they're about to close,64
308,אל תדאג ,Don't worry ,Do not worry,87
309,כולם יודעים שהכושי יחסל את קירקפטריק ,Everybody knows that jig is going to kill Kirkpatrick ,Everyone knows the Negro will kill Kirkpatrick,69
310,כן אני יודע ,Yes I know ,Yeah I know,86
311,אבל הם לא מהמרים על ג'נקינס ,But they're not betting on Jenkins ,But they are not betting on Jenkins,90
312,הם שמים את הכסף על קירקפטריק ,They're putting their money on Kirkpatrick ,They put the money on Kirkpatrick,88
313,ביחס של 3 ל - 1 הם ירוויחו ‏600 000 דולר אם הוא ינצח ,At 3-1 they are going to make six hundred grand if he wins ,"At a 3 to 1 ratio they will earn $ 600,000 if he wins",61
314,הממזרים המלוכלכים האלה ,Those sneaky bastards ,These dirty bastards,73
315,הם קנו את הקרב ,They put the fix on ,They bought the battle,63
316,ג'נקינס עומד להפסיד את הקרב ,Jenkins is going to throw the fight ,Jenkins is about to lose the battle,60
317,זה הגיוני ,It makes sense ,it makes sense,100
318,אז מה תעשה ,So what do you do now ,So what will you do?,70
319,למה שהם יהיו היחידים שירוויחו מנדיבותו של מר ג'נקינס ,Why should they be the only ones to benefit from Mr Jenkins's generosity ,Why they would be the only ones to benefit from Mr. Jenkins' generosity,89
320,אני אשים 5 00000 על קירקפטריק ,I'm going to put 500 000 on Kirkpatrick to win ,I will put 5 00000 on Kirkpatrick,76
321,אולי כדאי לך לגרד כל מה שאתה יכול ולעשות אותו הדבר ,You should scrape together whatever you can and do the same thing ,You may want to scratch everything you can and do the same,65
322,-אתה בטוח שסמולס נמצא שם ,- Is Smalls up there ,- You're sure Smalls is there,76
323,-לפעמים הזמזם לא עובד ,- Sometimes the buzzers don't work ,-Sometimes the buzzer does not work,88
324,שמי קוויק אני חבר ותיק שלו ,My name is Quick I'm an old friend ,"My name is Quick, I'm an old friend of his",91
325,אני יכול לעלות ולדפוק בדלת ,Do you think I could knock on the door ,I can go up and knock on the door,68
326,סמולס ,Smalls ,Smalls,100
327,טומי הדלת שלך פתוחה ,Tommy your door is open ,"Tommy, your door is open",100
328,זה קוויק ,It's Quick ,It's Quick,100
329,הי הדלת שלך פתוחה ,Hey your door is open ,Hi your door is open,93
330,זה קוויק ,It's Quick ,It's Quick,100
331,סמולס!,Smalls ,Smalls!,100
332,הי סמולס ,Hey Smalls ,Hi Smalls,84
333,טומי ,Tommy ,Tommy,100
334,טומי  הי בנאדם אתה ישן ,Tommy   Hey man are you asleep ,Tommy Hi man are you sleeping,74
335,אני חושב שכדאי שאלך אתה בטח רוצה לשבת לבד ולנסות להבין את מי עצבנת אני אתן לך קצת מרווח נשימה ,I think I'm going to leave because you probably want to sit by yourself and think about who you pissed off so I'll let you have your space ,I think I should go. You probably want to sit alone and try to figure out who's nervous. I'll give you some breathing space.,63
336,תסלח לי ,Excuse me ,Excuse me,100
337,-זה לא קוויק ,It's Quick ,- It's not quick,83
338,-כן זה הוא ,- Yes that's him ,- Yes it is,70
339,למה לעזאזל הוא יוצא מהבית של אחי ,He messed with the wrong nigger's brother ,Why the hell is he leaving my brother's house,60
340,גברת לה-רו האורח שלך הגיע ,Miss La Rue your guest has arrived ,"Mrs. Le Roux, your guest has arrived",88
341,שלום מר קוויק ,Hello Mr Quick ,Hello Mr. Quick,100
342,אני רוצה שתכיר את מר באגסי קלהון ואת עוזרו ג'וזף ליאוני ,Meet Mr Bugsy Calhoune and his assistant Joseph Leoni ,I want you to meet Mr. Bugsy Calhoun and his assistant Joseph Leoni,87
343,-הפרחים והשוקולד הם בשבילי ,- Are those flowers and candy for me ,-The flowers and chocolate are for me,83
344,-לא הבאתי אותם לגברת ,- No I brought them for the lady ,- I did not bring them to the lady,74
345,אז תן לה אותם ,Give them to her ,So give her them,81
346,היא אוהבת פרחים ושוקולד ,She loves flowers and candy ,She loves flowers and chocolate,83
347,אז איך העסקים מר קוויק ,So how's business Mr Quick ,So how's business Mr Quick,100
348,-העסקים במועדון של שוגר ריי ,- Business over at Sugar Ray's ,Business at Sugar Ray's Club,86
349,העסקים לא רעים ,Business is all right ,Business is not bad,75
350,דומיניק סיפרה שהייתם מלאים ביום שני בערב ,Dominique says your place was packed Monday night ,Dominic said you were full on Monday night,66
351,אני לא מבין בדברים האלה ,And there is one other thing ,I do not understand these things,60
352,-אני סומך על השותף שלי ריי ,- Well I trust my partner Ray ,- I trust my partner Ray,90
353,כולם בעסק הזה פושעים איך אתה יכול לבטוח בהם ,Everybody in this business is a criminal ,Everyone in this business is criminal about how you can trust them,70
354,נראה לי שאלך הביתה ,I think I'm going to go home ,It seems to me that I will go home,61
355,חכה רגע מה אתה ממהר ,Wait a second What's your rush ,Wait a minute what are you in a hurry,63
356,תשתה קצת יין ,Here have some wine ,Drink some wine,65
357,דרך אגב מר קוויק סרג'נט פיל קנטון ביקר אצלכם לאחרונה ,By the way Mr Quick did a Sergeant Phil Cantone come by the other day ,By the way Mr. Quick Sergeant Phil Canton recently visited you,66
358,הוא סיפר לכם על ההצעה העסקית שלי ,He told you about my business proposition ,He told you about my business proposal,91
359,הוא סיפר לנו על ההצעה שלך ,He told us about your offer ,He told us about your offer,100
360,לא הייתי אומר שזו היתה הצעה עסקית ,I wouldn't call that a business proposition ,I would not say it was a business proposition,77
361,זו היתה הצעה עסקית ,I make business propositions ,It was a business proposition,81
362,ויש לי הצעה טובה מאוד בשבילך ,I've got a very good one for you ,And I have a very good offer for you,74
363,אני רוצה שתעבוד בשבילי במועדון פיטי פאט ,I want you to work for me at the Pitty Pat Club ,I want you to work for me at the Petty Pat Club,98
364,אני רוצה שתנהל אותו עם דומיניק ,I want you to run it with Dominique ,I want you to run it with Dominic,94
365,-לא נראה לי ,- I don't think so ,-I do not think so,79
366,-תוכל לעשות הרבה כסף ,- Lots of money for you ,- You can make a lot of money,71
367,אחרי ששוגר ריי יתחיל לשלם לנו לא תרוויח יותר כמו פעם ,After Sugar Ray starts paying us off your cut won't be what it used to be ,After Sugar Ray starts paying us you will not earn as much as you used to,75
368,תוכל להפוך אותו למועדון נהדר ,You could turn it into a hot spot ,You can turn it into a great club,70
369,אתה מבין את האנשים שלך ואתה יודע איך לנהל מועדון ,You understand your people ,You understand your people and you know how to run a club,63
370,מר קוויק ,Mr Quick ,Mr. Quick,100
371,זה יהיה לטובת כולנו  אם תצטרף לארגון של מר קלהון ,It would be an advantage to all of us if you'd join Mr Calhoune's organisation ,It would be to the benefit of us all if you joined Mr. Calhoun's organization,81
372,אתם ממש מדהימים ,I hear you guys are going great ,You guys are really amazing,66
373,אני לא מאמין שהזמנתם אותי לכאן ו  זה נחמד מאוד מצדכם אבל לא תודה ,I can't believe you called me down here and  This is very nice but no thanks I'm sorry ,I can not believe you invited me here and it's very nice of you but no thanks,74
374,מר קוויק אין לך סיבה להתרגז ,There's no reason for you to get upset ,"Mr. Quick, you have no reason to be upset",65
375,אני רק רוצה שתחשוב על זה ,I just want you to think it over ,I just want you to think about it,83
376,ג'ו תלווה את מר קוויק למכוניתו ,- Joe show Mr Quick to his car ,Joe will accompany Mr. Quick to his car,70
377,תודה אבל לא תודה ,Thank you but no thanks ,Thanks but no thanks,88
378,-מה דעתך על מר קוויק ,- What do you think of Mr Quick ,- What do you think of Mr. Quick?,100
379,-למה אתה מתכוון ,- What do you mean ,-What do you mean,100
380,את מחבבת אותו ,Do you like him ,You like him,89
381,את חושבת שאולי תרצי לזיין אותו ,Do you think he is someone you might want to fuck ,You think you might want to fuck him,82
382,-כן ,- Yes ,-Yes,100
383,בשביל טומי!,Tommy ,For Tommy!,71
384,מה זה החרא הזה ,What is this shit about ,What is this shit,85
385,-הוא הרג את אחי ,- He killed my brother ,- He killed my brother,100
386,הוא התעסק עם האח של הבנאדם הלא נכון!,He messed with the wrong nigger's brother ,He messed with the wrong man's brother!,86
387,קוויק שלי!,Mr Quick ,My Quick!,88
388,תתקרב אליו נפוצץ לו את הראש ,Pull up to his bumper we'll blow his head off ,Get close to him and blow his head off,60
389,לעזאזל! אני חושב ששברתי את האף!,Damn I think I broke my nose!,damn it! I think I broke my nose!,95
390,ג'וניור אתה בסדר ,Junior are you OK ,Junior you're fine,74
391,ג'וניור!,Junior ,Junior!,100
392,ירית בו בעורף!,You shot him in the back of the head!,You shot him in the back!,80
393,זאת היתה טעות ,It was a mistake ,It was a mistake,100
394,תשתוק זאת היתה טעות ,Shut up it was a mistake!,"Shut up, it was a mistake",100
395,זאת היתה תאונה ג'וניור אני מצטער ,It was an accident Junior ,It was a junior accident I'm sorry,78
396,אני מצטער ג'וניור!,I'm sorry Junior ,I'm sorry Junior!,100
397,אני מצטער ג'וניור ,I'm sorry Junior ,I'm sorry Junior,100
398,תשתוק לעזאזל!,Shut the fuck up!,Shut the hell up!,75
399,אתה תמיד בוכה בן זונה!,You're always crying motherfucker ,You're always crying son of a bitch!,68
400,תתפוס אותו!,Catch him Come on ,Catch him!,69
401,זה הסוף שלך בן זונה ,You shot him in the back of the head!,This is your end son of a bitch,60
402,תעצור את המכונית!,Stop the car!,Stop the car!,100
403,תעצור את המכונית המזוינת!,Stop the fucking car!,Stop the fucking car!,100
404,בואו נתפוס אותו!,Let's get him ,Let's catch him!,79
405,אני אהרוג אותך קוויק!,I'm going to kill you Quick!,I'll Kill You Quick!,74
406,בגללך יריתי בחבר שלי בעורף!,You shot him in the back of the head!,"Because of you, I shot my friend in the back!",73
407,אני לא יודע על מה אתה מדבר!,I don't know what you're talking about ,I do not know what you're talking about!,91
408,אתה יודע על מה אני מדבר!,You know what I'm talking about ,you know what I'm talking about!,100
409,שברת לי את האף בנאדם!,You broke my nose man ,You broke my nose man!,100
410,אני אומר את זה עוד פעם אחת!,I'll say this one more time ,I say this one more time!,94
411,אין לי מושג על מה אתם מדברים ואני מציע שתיתנו לי להמשיך בדרכי!,I don't know what you're talking about And I suggest you let me go on my way ,I have no idea what you are talking about and I suggest you let me continue on my way!,80
412,אה באמת ,Oh really ,Oh really,100
