,hebrewFromSub,englishFromSub,englishTranslation,ratio
441,-אני חושב שאמרתי לך לחזור לשם ולהישאר עם הדלת נעולה ,I think I told you to get back in there and stay with that door locked ,- I think I told you to go back there and stay with the door locked,93
442,-תיזהר איך שאתה מדבר איתי ,Be careful how you talk to me ,- Be careful how you talk to me,100
443,שמעת מה ג'ו אמר ,You hear what Joe said ,You heard what Joe said,98
444,אתה לבדך מלבד שתיין ונכה זקן ,You're alone except for a barfly and an old cripple ,You are alone besides a drunkard and an old cripple,69
445,לכנות אותי נכה זקן ,Calling me an old cripple ,Call me an old cripple,94
446,אהבתי איך שאמרת את זה ג'ו ,I like hearing you say that Joe ,I loved the way you said it Joe,68
447,-סניור צ'אנס ,Senor Chance ,-Senior Chance,96
448,זה אני קרלוס ,It's me Carlos ,It's me Carlos,100
449,מה אתה רוצה ,What do you want ,What you want,90
450,אני רוצה לדבר איתך ,I want to talk to you ,I want to talk to you,100
451,-הבחורה  מה קרה לעין שלך ,Did the girl   What happened to your eye ,-Girl what happened to your eye,88
452,-אתה אמרת לי לשים את הגב' על הכרכרה ,You told me to put her on the stage ,- You told me to put Ms. on the carriage,75
453,-היא עשתה את זה ,-Did she go ,- She did it,80
454,מה עשית -לא היא לא עשתה את זה ,She did that What'd you do ,What did you do - no she did not,75
455,-הבנתי שאמרת שהיא עשתה ,-I thought you said she did ,- I understand you said she did,76
456,-אני אמרתי שאמרת לי לשים אותה על הכרכרה ,You told me to put her on the stage ,-I said you told me to put her on the carriage,80
457,קונסואלה היא הכתה אותי בעין ,Consuelo she hit me in the eye ,Consuela she hit me in the eye,97
458,חכה רגע אני קצת מבולבל ,-I'm a little mixed up ,Wait a minute I'm a little confused,61
459,אני אספר לך ,I tell you ,I'll tell you,87
460,אוקיי ,-Okay ,Okay,100
461,-יותר טוב שאני אספר לך ,-It's better if I tell you ,- I better tell you,81
462,אתה אמרת לי לשים אותה על הכרכרה ,You told me to put her on the stage ,You told me to put her on the carriage,79
463,"אני צעקתי לה ""רדי למטה"" והיא אמרה ""לא"" ","I yell at her ""Come down "" She said ""No ""","I yelled at her ""get down"" and she said ""no""",80
464,אני עליתי אליה והיא אמרה שהיא לא באה ,Did she say why she wasn't going No ,I went up to her and she said she was not coming,67
465,אני אמרתי שאמרת לה ללכת ,I tell her you say go ,I said you told her to go,78
466,היא אמרה לא היא אחראית ,She say no she is responsible ,She said no she is responsible,95
467,ואני אמרתי שזה יכול להיות ,And I said that may be ,And I said it could be,64
468,"והרמתי אותה וקונסואלה אמרה ""מה אתה עושה עם האישה הזאת""","I pick her up And Consuelo say ""What are you doing with that woman ""","And I picked her up and Consuela said ""what are you doing with this woman""",89
469,"ואמרתי ""אני לוקח אותה לכרכרה"" האישה אמרה שהיא לא רוצה ללכת ","I say ""I take her to the stage "" The woman said she don't want to go ","And I said ""I'm taking her to the carriage"" The woman said she did not want to go",74
470,-קונסואלה אמרה לי להניח אותה ,Consuelo tell me put her down ,- Consuela told me to put it down,77
471,"ואני אמרתי ""אני אחראי""",And I said that may be ,"And I said ""I'm in charge""",61
472,קונסואלה חשבה שהכוונה למשהו אחר ,Consuelo thinks that mean something else ,Consuela thought she was referring to something else,70
473,אז היא עשתה לי את העין הזאת ,So she give me this eye ,So she made that eye on me,73
474,-ומה עשית ,What'd you do Do ,- And what did you do?,86
475,-עשיתי מה יכולתי לעשות ,What can I do ,- I did what I could,65
476,הפלתי אותה לרצפה ,I drop her on the floor ,I dropped her to the floor,82
477,ואמרה שאני מנסה להרוג אותה ,And she says I tried to kill her ,And said I'm trying to kill her,76
478,-קרלוס הבחורה על הכרכרה ,Did the girl get on the stage ,-Carlos the girl on the carriage,63
479,-לא היא לא הלכה!,No she did not go!,"- No, she did not go!",100
480,אבל ג'ייק אמר שהוא לא יכול לחכות ,But Jake says he couldn't wait ,But Jake said he could not wait,82
481,-למה ,-Why ,-Why,100
482,-הוא אמר שהוא חייב לעזוב ,-He says he must leave ,- He said he must leave,90
483,-התכוונתי לבחורה ,I mean the girl ,- I meant a girl,83
484,היא אמרה למה היא לא יכולה ללכת ,Did she say why she wasn't going No ,She said why she could not go,69
485,-לא היא לא אמרה ,No she did not go!,"- No, she did not say",80
486,איך אני יכול לדעת אם היא לא אמרה ,How can I know if she don't say ,How can I know if she did not say,84
487,-בבקשה סניור תבוא ותאמר לקונסואלה מה הכוונה אחראי ,Please come and tell Consuelo what responsible means ,-Please a senior will come and tell the consulate what the intent is responsible,73
488,-סטמפי אנחנו יוצאים ,Stumpy we're going out ,-Stampy We're coming out,89
489,אני אוהב להישאר לבד ,I like to be left alone ,I like to be left alone,100
490,התרגלתי לזה ,I'm getting used to it ,I got used to it,79
491,-הדלת פתוחה ,I drop her on the floor ,-the door is open,67
492,-לא הלכתי ,I didn't go ,-I did not go,87
493,-אני יכול לראות את זה ,I can see that ,- I can see it,69
494,-אני לא יודעת  ארזתי את הכל ואז קרלוס צעק שהכרכרה מוכנה  ושמעתי מישהו צועק שהם לא הולכים ,I don't know I had everything all packed then Carlos yelled the stage was ready and I heard somebody saying they weren't going ,- I do not know I packed everything and then Carlos shouted that the carriage is ready and I heard someone shouting that they are not going,71
495,ואתה רוצה לדעת למה אני לא הלכתי נכון שריף ,And you want to know why I didn't go don't you Sheriff  ,And you want to know why I did not go right sheriff,78
496,מה השם שלך בכל אופן ,What's your name anyway ,What's your name anyway,100
497,אפילו את זה אני לא יודעת ,I don't even know that ,Even that I do not know,93
498,-צ'אנס ג'ון טי ,Chance John T ,- Chance John T.,100
499,אני תמיד מרגיזה אותך לא כך ג'ון טי ,I always make you mad don't I John T ,I'm always annoying you not so John T.,71
500,אז אל תגרום לי לספר לך למה אני נשארתי ,Then don't make me tell you why I stayed ,So do not make me tell you why I stayed,81
501,אני לא רוצה לעשות את זה קשה יותר עבורך ,I won't make it any harder for you ,I do not want to make it harder for you,82
502,אני רק אשאר כאן ,I'll just be here ,I'll just stay here,78
503,אל תתייחס אלי בכלום ,Anything happen when Burdette left ,Do not treat me with anything,60
504,כשזה יקרה רק תאמר לי ללכת ואני אלך ,When that happens just tell me to go and I'll go ,When that happens just tell me to go and I'll go,100
505,לא אפילו לא תצטרך לומר לי ,No you won't even have to tell me ,You will not even have to tell me,91
506,אז אני אדע ואני פשוט אלך ,I'll know by then and I'll just go ,Then I'll know and I'll just go,95
507,זה הוגן ג'ון טי ,Is that fair John T ,That's fair John T.,86
508,אתה לא חייב לענות לי כעת אם אתה לא רוצה ,You don't have to answer me now if you don't want to ,You do not have to answer me now if you do not want to,91
509,אבל רק  תאמר משהו ,But just say something ,But just say something,100
510,-אם לא הייתי בכל הבלגן הזה זה יכל להיות אחרת ,If I weren't in this mess it might be different ,-If I was not in all this mess it could have been different,70
511,אבל אני כן ,But I am ,But I do,62
512,-זה כל מה שרציתי לשמוע ,That's all I wanted to hear ,- That's all I wanted to hear,100
513,שמחתי שעשינו זאת בפעם השנייה ,I'm glad we tried it a second time ,I was glad we did it a second time,79
514,יותר טוב כששני אנשים עושים את זה ,It's better when two people do it ,Better when two people do it,92
515,עדיף שתלך ותעשה את העבודה שלך ,You'd better run along now and do your job ,You better go and do your job,76
516,-היי צ'אנס ,Hi Chance ,- Hi Chance,100
517,נהיה מדי חשוך מכדי שיצא משהו טוב מעמידה בחוץ ,It's getting too dark to do any good out there ,It's getting too dark for something good to come out of it,75
518,אני אהיה רק ברווז במטווח ,I'd just be a sitting duck ,I'll just be a duck in range,70
519,-קרה משהו כשבורדט עזב ,Anything happen when Burdette left ,- Something happened when Bordett left,66
520,-נחמד כמו פשטידה ,Nice as pie ,- Nice as a pie,92
521,לא אמר מילה ,Didn't say a word ,Did not say a word,86
522,-מה הייתה הירייה כשהם נכנסו ,What was the shot when they came in ,-What was the shot when they entered,86
523,-מה הוא עשה ,What'd he do ,-what did he do,92
524,-כלום רק נהם ורטן עשה כמה פרצופים,Nothing just grunted and growled made a few faces ,-Nothing just growled and grumbled made some faces,84
525,מה קרה כאן ,What happened here ,what happened here,100
526,-לא הרבה ,Not much ,-Not much,100
527,-הניגון שהם נגנו כל היום ,That tune they been playing it all day ,-The melody they played all day,62
528,מה הוא ,What is it ,What is he,70
529,-איזה יצירה מקסיקנית ,It's some Mexican piece ,-What a Mexican piece,70
530,שמעתי אותה בדרום ,I heard it farther south ,I heard her in the south,71
531,-ערב טוב שריף ,Good evening Sheriff ,Good evening Sheriff,100
532,-קולורדו מה רצית ,Colorado What do you want ,- Colorado what you wanted,90
533,-אני רק מסתקרן שוב ,Just curious again ,- I'm just intrigued again,67
534,-הוא רצה לדבר עם אח שלו ,He wanted to talk to his brother ,- He wanted to talk to his brother,100
535,-מה היה לו להגיד ,-What'd he have to say ,-What did he have to say,95
536,-כלום ,-Nothing ,-is nothing,82
537,-אתה חושב שהוא לא אמר כלום ,You mean he didn't say anything ,- You think he did not say anything,84
538,-למה אתה כל כך מתעניין ,Why are you so interested ,- Why are you so interested?,100
539,-בגלל שהוא מדבר כעת ,Because he's talking now ,-Because he's talking now,100
540,שומע את המוסיקה ,Hear that music ,Hears the music,87
541,הוא אמר לאיש לנגן את זה ,He told the man to play it ,He told the man to play it,100
542,-מה זה ,What is it ,-What is,82
543,"-הם מכנים אותה ""העריפה"" שיר האכזרים ",They call it The Deguello the cutthroat song ,"-They call it the ""decapitation"" of the cruel song",70
544,המקסיקנים נגנו את זה לבחורים מטקסס כשהם צרו עליהם באלמו ,The Mexicans played it for the Texas boys when they had them pent up at the Alamo ,The Mexicans played it to the guys from Texas when they yelled at them in Elmo,73
545,נגנו את זה ביום ובלילה עד שהכל נגמר ,Played it day and night till it was all over ,We played it day and night until it was all over,93
546,-אין רחמים אין חנינה למפסידים ,No quarter No mercy for the losers ,"- No mercy, no pardon for losers",79
547,-אתה תשמע את זה הרבה ,You'll be hearing a lot of it ,- You'll hear it a lot,82
548,-אני משער שגרמנו לו לדבר אחרי הכל ,I guess we made him talk after all ,- I guess we made him talk after all,100
549,-רק חשבתי שתרצה לדעת שריף ,Just thought you'd like to know Sheriff ,- I just thought you would like to know Sheriff,90
550,-סטמפי !,Stumpy!,-Stampy!,83
551,-מה ,-What ,-what,100
552,-הם לא צריכים עזרה עם המנגינה ,-They don't need any help with that tune ,- They do not need help with the melody,71
553,-דרך אגב הכרכרה יצאה בשלום ,By the way the stage got off all right ,"- By the way, the carriage left safely",63
554,צפיתי בה בבירור בעמק ,I watched it clear through the valley ,I watched it clearly in the valley,82
555,בסביבות שישה יום המרשל יגיע הנה ,In about six days the marshal will get here ,Around six days the marshal will arrive here,78
556,-זה מה שחשבתי ,I know that ,-I thought so,61
557,-אני יודע ,I know that ,-I know,71
558,-אמרת לה שהיא יכולה להישאר ,Tell her she could stay ,- You told her she could stay,84
559,-כן אמרתי ,Yes I did ,- Yes I said,74
560,מה העניין ,What is it ,what is the deal,69
561,-כלום שום דבר ,Nothing nothing at all ,-Nothing nothing,81
562,-אתה התכוונת לומר משהו ,You were going to say something ,- You meant something,60
563,-נזכרתי באותו זמן ,I remembered in time ,-I remembered that time,81
564,נזכרתי בבחורה אחרת שהגיעה בכרכרה לחניית ביניים ,I remembered another girl came through on a stage that stopped over ,I remembered another girl who came in a carriage for a stopover,66
565,נזכרתי שאמרת לי שהיא לא בסדר ,I remember you told me she was no good ,I remembered you told me she was wrong,79
566,לא האמנתי לך אבל אתה צדקת ,I didn't believe you but you were right ,I did not believe you but you were right,91
567,אז אני מניח שאתה מומחה ,So naturally I figured you're an expert ,So I guess you're an expert,76
568,ואתה יודע בדיוק מה לעשות כל הזמן ,And you know just what you're doing all the time ,And you know exactly what to do all the time,76
569,אני פשוט מקווה שיש לך מבט יותר טוב משלי ,I just hope you have better luck than I had ,I just hope you have a better look than mine,80
570,אתה יודע זאת הפעם הראשונה שאני מסוגל לצחוק על זה ,You know that's the first time I've been able to laugh about that ,You know this is the first time I'm able to laugh about it,78
571,אולי יש איזו תקווה בשבילי אחרי הכל ,Maybe there's some hope for me yet ,Maybe there is some hope for me after all,75
572,-אולי ,Maybe ,-Maybe,100
573,אבל אני בספק ,But I doubt it ,But I doubt it,100
574,-זה מה שאני אוהב אצלך אתה בנאדם שיודע לעודד ,That's what I like about you you're such an encouraging man ,"- This is what I like about you, you are a person who knows how to encourage",68
575,-אם אתה הולך למלון תביא קצת קפה וסוכר בסדר ,If you go by the hotel pick up some coffee and sugar will you ,-If you go to the hotel bring some coffee and sugar fine,78
576,-ג'ו מתלונן ,Joe complaining ,- Joe complains,86
577,הוא לא מקבל שום סוכר ,He didn't get no sugar ,He does not get any sugar,72
578,הקפה שלו הוא מים שנשפכו על הרצפה ,His coffee's water poured over the old grounds ,His coffee is water spilled on the floor,67
579,אני לימדתי אותו מה זה לדבר בלי רשות ,What's the matter is it getting through to you ,I taught him what it is to speak without permission,60
580,-לפני שאשכח הרובה שלך קצת קשה ,Before I forget your gun's a little stiff ,-Before I forget your rifle a little hard,81
581,-אני לא רוצה שתשחרר את הרובה שלי ,I remember you told me she was no good ,- I do not want you to release my rifle,67
582,לא רוצה שהוא יפעל בקלות ,I don't want no easy pull ,Do not want it to operate easily,74
583,למה אתה לא נותן את האקדחים שלו ,Why don't you give him his own guns ,Why do not you give his guns,86
584,-שכחתי מהם לגמרי ,-I forgot all about them ,- I completely forgot about them,83
585,הזיכרון שלך לא יותר טוב משלי ,-Your memory is no better than mine ,Your memory is no better than mine,100
586,הם נעולים שם יותר משנה אלא אם אתה  הוצאת אותם לנקות ולשמן אותם ,They been locked up over a year except when you took them out to clean them and oil them ,They are locked there for more than a year unless you take them out to clean and lubricate them,69
587,-מאיפה יש לך אותם ,Where'd you get these ,- Where do you get them from?,81
588,-קניתי אותם מברנש שאתה מכרת לו ,Bought them off the fellow you sold them to ,- I bought them from a guy you sold him,60
589,-לא יודע איך ל  ,I don't know how to  ,- Do not know how to,86
590,-בוא ניקח סיבוב בעיירה נביא לסטמפי את הקפה ,Let's take a turn around the town Get Stumpy his coffee ,- Let's take a tour of the town and bring Stampi the coffee,70
591,-אתה לא הולך להגיד לי להיכנס חזרה לשם ,Ain't you going to tell me to get back in there ,- You're not going to tell me to go back in there,87
592,-לא תעמוד כאן בחוץ ותחטוף ירייה ,No stay out here and get shot ,- You will not stand outside here and get shot,79
593,כדי שתצחק קצת ,Might get a laugh out of you ,To make you laugh a little,63
594,-הרגשה טובה ,Feels good ,-Good feeling,82
595,-בוא הנה ,Come on ,-Come here,62
596,-דרך אגב אני אקבל משכורת ,By the way am I drawing pay ,-By the way I will get a salary,67
597,-כמו קודם ,Same as before ,-like before,64
598,-במקרה הזה תקבל כמה שנתת על הרובים הללו ,In that case take out what you gave for these guns ,-In this case you will get how much you gave for these guns,67
599,-אל תמהר ,No hurry ,-do not hurry,80
600,-אם אתה כל כך נדיב אני יוכל להשתמש בזה כמקדמה ,If you're feeling so generous I could use an advance ,-If you're so generous I could use that as a down payment,72
601,לקנות זוג מכנסיים כותנת חדשה ,Buy a new pair of pants new shirt ,Buy a new pair of cotton pants,79
602,-אין בזה צורך ,No need of that ,- There is no need for that,60
603,כשעזבת השארת משהו מאחריך ,When you lit out you left some things behind ,When you left you left something behind,89
604,לקחתי אותם למלון ,I got them at the hotel ,I took them to the hotel,68
605,-שמרת אותם כל הזמן הזה ,You been keeping them all this time ,- You kept them all this time,84
606,-הם חיכו עד שיהיו שוב ראויים עבורך ,Been waiting till they fit you again ,-They waited until they were worthy of you again,63
607,תוכל גם לעשות אמבטיה וגילוח ,You could use a bath and a shave too ,You can also take a bath and shave,77
608,-אני לא יודע בקשר לגילוח ,I don't know about the shave ,- I do not know about shaving,73
609,אני מסוגל לחתוך לעצמי את הגרון ,I'm liable to cut my own throat ,I'm able to cut my throat,71
610,צ'אנס ,Chance ,chance,100
611,תודה ,Thanks ,Thanks,100
612,-זהו זה ,They'll fit ,-that's it,60
613,מה בקשר אליך ג'ון טי ,How about you John T ,What about you John T.?,78
614,לעבוד עליך ,Shall I work on you ,Work on you,73
615,אני רק הזכרתי לך ,-I just wanted to ask you--,I just mentioned you,73
616,-בטח אפשר לקנות עם זה המון משקה ,Sure buy a lot of drinks with that ,- Of course you can buy a lot of drink with it,62
617,-אתן לך לשמור את זה עבורי ,I'll let you keep it for me ,- I'll let you keep it for me,100
618,-תודה על הגילוח ,Feathers thanks for the shave ,-Thanks for the shave,82
619,אבקר אותך שוב ,Might call on you again ,I will visit you again,62
620,או לא סיפרתי לך ג'ון טי קרלוס נתן לי תפקיד ,I didn't tell you John T  Carlos is giving me a job ,Or I did not tell you John T. Carlos gave me a role,76
621,שניקח לסטמפי את הקפה שלו ,Shall we take Stumpy his coffee and things ,Let's take Stampi his coffee,63
622,-אתה ממהר ג'ון טי ,You in a hurry John T ,"- You're in a hurry, John T.",93
623,הייתי מעוניינת לשוחח איתך ,I'd like to talk to you ,I was interested in talking to you,63
624,-אחכה לך ,-I'll wait for you ,-Wait for you,83
625,-תודה דאוד ,-Thanks Dude ,-Thank you Daoud,69
626,רק רציתי לשאול אותך  ,-I just wanted to ask you--,I just wanted to ask you,100
627,-מה התפקיד הזה ,-What's this about a job ,-What is this role,60
628,-קרלוס אמר שהוא לא ישן טוב ,Carlos says he's not sleeping very well ,-Carlos said he did not sleep well,75
629,-בין היתר ,Among other things ,-Among other things,100
630,אתה חושב שאני לא צריכה ,You think I shouldn't ,You think I should not,84
631,-למה את שואלת אותי ,Why ask me ,- Why are you asking me?,65
632,בסדר אני לא אעשה את זה ,-I didn't say not to ,Okay I will not do that,62
633,-אני לא אמרתי לא ,-I didn't say not to ,- I did not say no,74
634,-אתה לא אוהב את הרעיון ,You don't like the idea ,- You do not like the idea,94
635,-מה זה שייך אלי ,Why should it be up to me ,-What it belongs to me,61
636,למה שיהיה לי אכפת ,Why should I care ,Why should I care,100
637,-לא יודעת למה התרגזת כששאלתי אותך ,I don't know why you get mad when I ask you ,- I do not know why you got upset when I asked you,84
638,-אתה לא ,-You're not ,-You do not,70
639,-כל זמן שאין לך התנגדות אני אקח את התפקיד ,As long as you haven't anything against it I'll take the job ,- As long as you have no objection I will take the job,64
640,-תודה ,-Thanks Dude ,-Thanks,71
641,-מה התכוונת לשאול אותי ,What were you going to ask me ,-What did you mean to ask me,71
642,אתה לא במצב רוח טוב ,What were you going to ask me ,You're not in a good mood,63
643,-מה רצית לשאול ,-What were you going to ask ,-What did you want to ask,76
644,-אם אתה תישן הלילה במלון ,Whether you were going to sleep in the hotel tonight ,-If you sleep in the hotel tonight,71
645,לא יהיו עוד ישיבות לילה מחוץ לדלת ,There'll be no more chair-sitting outside this door ,There will be no more night meetings outside the door,65
646,-אני יודעת אני מוותרת על זה ,I know I've given that up ,- I know I'm giving it up,71
647,בכל מקרה יש לי רעיון יותר טוב ,Anyway I have a better idea ,Anyway I have a better idea,100
648,הלילה תישן בחדר שלי ,Tonight you sleep in my room ,Tonight will sleep in my room,88
649,ויהיה לך יותר זמן אם משהו יתרחש ,You'd have more time if anything did happen ,And you'll have more time if something happens,72
650,בנוסף יש לי כורסת נדנדה היא יותר נוחה ,Besides I have a rocking chair it's more comfortable ,Plus I have a rocking chair that is more comfortable,81
651,רק רעיון ,Just an idea ,Just an idea,100
652,אתה יכול לחשוב על זה ,You can think about it ,You can think of it,78
653,כשתהיה במצב רוח יותר טוב ,When you're in a little better humor ,When you are in a better mood,65
654,-צ'אנס!,Chance!,-chance!,100
655,-הירייה מגיעה מהכלא ,The shot came from the jail ,- The shot comes from prison,72
656,אל תלך לשם ,Don't go in there ,Do not go there,88
657,-האידיוט הזה ניסה לירות עלי ,That idiot just took a shot at me ,-This idiot tried to shoot me,62
658,-סטמפי!,Stumpy!,-Stampy!,83
659,-ואני הברנש הזה ,And I'm that fellow ,- And I'm that guy,74
660,-אנחנו נכנסים ,Coming in ,- We're coming in,75
661,-תראה מה הוא עשה לכובע שלי ,Look what he did to my hat ,- Look what he did to my hat,100
662,-סטמפי זה היה דאוד שירית עליו ,Stumpy that was Dude you shot at ,-This stamp was Daoud you shot at him,79
663,-דאוד ,Dude ,-Daud,75
664,לא ידעתי ,I didn't know ,I did not know,89
665,הוא לא נראה כמו דאוד ,Didn't look like Dude ,He does not look like Daoud,71
666,-איך אדע שזה אתה ,How'd I know it was you ,-How will I know it's you,81
667,אתה התגנדרת כמו סוס אסטור שמן  ותקעת את האף שלך בדלת בלי להגיד כלום ,You get yourself dolled up like Astor's pet horse and then stick your nose in that door and don't say nothing ,You dressed like a fat Astor horse and stuck your nose in the door without saying anything,66
668,-הסתכל על הכובע הזה ,Look at this hat ,- Look at that hat,88
