,hebrewFromSub,englishFromSub,englishTranslation,ratio
228,-אם אני אישן בזריחה תעיר אותי ,But tonight you will sleep well ,-If I sleep at sunrise you will wake me,64
229,-אבל זה לא מספיק ,-But it's not enough ,-But it's not enough,100
230,-טוב סניור ,Bueno senor ,- Good senior,64
231,לא רוצה להתערב בעסקים שלך ,I don't want to meddle in your business ,Do not want to interfere in your business,82
232,אם לא אראה אותך בבוקר אז להתראות ,If I don't see you in the morning so long ,If I do not see you in the morning then goodbye,73
233,-דרך אגב לאן את הולכת ,By the way where are you going ,"- By the way, where are you going?",100
234,-לאיזה מקום שאין שם הודעות ,Some place where there aren't any handbills ,-Where there are no messages,60
235,הדברים האלו פוגעים זאת הסיבה שאני קצת רגישה לזה ,That thing keeps popping up That's why I'm a little touchy about it ,These things hurt that which is why I'm a little sensitive to it,67
236,-אני מכיר את השריף שפרסם את זה ,I know the sheriff that got these out ,- I know the sheriff who posted this,70
237,אני אכתוב לו יותר מאוחר שיבטל את זה ,I'll write him a letter get them called in ,I'll write to him later to cancel it,69
238,ואז אנשים כמוני לא יעשו לך צרות ,Then you won't have people like me making trouble for you ,Then people like me will not make trouble for you,77
239,-תודה ,Thanks ,-Thanks,100
240,-קרלוס!,Carlos!,-Carlos!,100
241,-כן סניור ,Si senor ,"- Yes, senior",78
242,למה לא הערת אותי ,Why didn't you wake me up ,Why did you not wake me up?,94
243,-הבחורה ,-The girl ,- The girl,100
244,-הבחורה ,-The girl ,- The girl,100
245,-זאת עם הפרווה ,-That one with the feathers ,- The one with the fur,78
246,-היא אמרה לי לא להעיר אותך ,She told me not to wake you ,- She told me not to wake you,100
247,היא ישבה על הכיסא ליד החדר שלך ,She was sitting outside your room in a chair ,She was sitting on the chair next to your room,78
248,-ישבה מחוץ לחדר שלי על הכיסא ,Sitting outside my room in a chair ,-Sitting outside my room on the chair,83
249,-כל הלילה ,All night long ,-all night,78
250,היא ישבה שם עד לפני שלוש דקות ,She was still there two three minutes ago ,She sat there until three minutes ago,74
251,כנראה היא שמעה שהתעוררת היא אמרה לי לא להעיר אותך ,Most likely she hear you get up She told me not to wake you ,Apparently she heard you woke up she told me not to wake you,77
252,תוכל לומר לה  שזה טיפשי!,You tell her she's a fool ,You can tell her it's stupid!,68
253,-לומר לה שזה טיפשי ,No! I'll tell her myself ,-Tell her it's stupid,60
254,-לא אומר לה בעצמי ,No! I'll tell her myself ,- Do not tell her myself,80
255,-תאמר לה טיפשה ,Tell her she's a fool ,-Tell her a fool,83
256,-לא אמרתי הייתי ,I didn't say I was ,- I did not say I was,81
257,"-הוא אמר ""לא להעיר אותו""","He say ""Not to wake him up ""","-He said ""do not wake him""",75
258,"היא אומרת ""להעיר אותו""","She say ""To wake him up ""","She says ""wake him up""",90
259,אני אני באמצע ,Me I'm in the middle ,I'm in the middle,92
260,-מי זה ,Who is it ,-Who is,80
261,-אני השריף ,It's me The sheriff ,- I'm the sheriff,88
262,-רק רגע ,Just a minute ,-just a minute,100
263,-כן את ,Yes you ,-Yes you,100
264,אין כאן בחדר מישהו אחר ,There's nobody else in the room ,There's no one else in the room here,84
265,-קרלוס הלך וסיפר לך ,Carlos had to go and talk ,-Carlos went and told you,69
266,אז הייתי במסדרון ,I was just as well off out there in the hall ,So I was in the hallway,60
267,-אם מישהו היה נכנס היית צועקת לפני שהם היו יורים בך נכון ,If anybody had come in you'd have yelled before they shot you Is that it ,- If someone came in you would shout before they shot you right,65
268,-לא שמעת אותי אומר ש  ,-Didn't you hear me say that--,- You did not hear me say that,87
269,-אני יודעת ,-I know ,-I know,100
270,אתה לא רוצה שאף אחד יעזור לך ,You don't want anyone to help you ,You do not want anyone to help you,96
271,שמעתי שאמרת לקרלוס ,I heard you tell Carlos ,I heard you told Carlos,91
272,-למה עשית את זה ,-Why did you do it ,-why did you do this,89
273,-אתה לא צריך לדעת ,You can't go to bed now!,- You do not need to know,65
274,למה לא יצאת החוצה בלי לדבר עם קרלוס ,Why didn't you just go out and not talk to Carlos ,Why did not you go out without talking to Carlos,76
275,-הוא לא העיר אותי!,He didn't wake me up!,- He did not wake me!,84
276,-אל תאשים אותו זאת האשמה שלי ,Don't blame him that was my fault ,"- Do not blame him, it's my fault",79
277,-בסדר לא קרה כלום אף אחד לא נפגע ,All right nothing happened nobody got hurt ,- Okay nothing happened no one was hurt,63
278,כעת אני עייפה ואתה מרוגז ואני הולכת להתרגז ,Now I'm tired and you're mad and I'm getting mad ,Now I'm tired and you're upset and I'm going to get upset,74
279,אז  עדיף שתלך ,So you'd better go on ,So you better go,86
280,וגם אני אתפוס קצת שינה ,You got some sleep I lost some ,And I'll catch some sleep too,64
281,-את לא יכולה ללכת עכשיו למיטה !,You can't go to bed now!,- You can not go to bed now!,88
282,-לא יכולה ,I can't ,-Can not,71
283,אתה תראה האם או לא אני יכולה ללכת למיטה או שלא ,You can't go to bed now!,You'll see if I can go to bed or not,71
284,-את צריכה ללכת לכרכרה ,You don't want anyone to help you ,- You have to go to the carriage,60
285,-מה אמרת ,-What'd you say ,-what did you say,93
286,-הכרכרה עוזבת בתוך שעה ,-The stage it leaves in an hour ,- The carriage leaves within an hour,62
287,-למה לא אמרת לי ,-Why didn't you tell me ,-why did not you tell me,93
288,-כרגע אמרתי !,I just wanted to  ,- I just said!,67
289,-אז מוטב שתצא שאוכל להתרחץ ולארוז את חפצי ,Then you better get out then so I can get a bath and pack my things ,-So you better go out so I can bathe and pack my things,83
290,אני לא יכולה לעשות את זה אם אתה מסתובב כאן ומדבר ,I can't do it if you stand around talking ,I can not do that if you walk around here and talk,73
291,-זה נכון ואני לא יכולה לדבר ולעשות אמבטיה ולארוז ,That's right And I can't do that and bathe and pack ,-It's true and I can not talk and take a bath and pack,71
292,אתה מוכן פשוט להמשיך וללכת ,I'm going to get some sleep too ,You are ready to just keep going,60
293,-אני הולך ,-I'm going ,-I'm going to,86
294,-אז לך אל תדבר יותר ,Then do it don't talk any more ,-So go do not talk anymore,62
295,אז רק לך ותן לי להגיע לכרכרה ,So just go on and let me get on the stage ,So just go and let me get in the carriage,71
296,-או לעזאזל!,Oh hell!,-Oh hell!,100
297,להתראות ,So I see ,See you,67
298,-אני רק רוצה ל  ,I just wanted to  ,- I just want to,93
299,- לא יכולת לתת לי לסיים ,You could have at least let me finish ,You could not let me finish,72
300,את מנסה לעזור למישהו שלא רוצה שום עזרה ,You try to help someone who doesn't want any help ,You're trying to help someone who does not want any help,88
301,כנראה דיברתי מדי הרבה ,I guess I talk too much ,I probably talked too much,61
302,-אמרת לה ,You tell her ,- You told her,83
303,-אמרתי מה ,-What'd you say ,- I said what,64
304,-היא הולכת לכרכרה ,She's going on the stage ,- She's going to the carriage,63
305,-היא הולכת לכרכרה ,She's going on the stage ,- She's going to the carriage,63
306,תוודא שהיא תעשה את זה ,You make sure she does ,Make sure she does,90
307,-אתה אמרת לה ללכת למה אני צריך לוודא את זה ,He told me to tell you he's gone ,- You told her to go why I need to make sure,68
308,-בגלל שאמרתי לך לוודא שהיא הולכת ,Because I say for you to make sure she does ,-Because I told you to make sure she's going,79
309,אני מאמין שאתה אחראי ,I hold you responsible ,I believe you are responsible,75
310,-כן ,Yes ,-Yes,100
311,-דאוד במעלה הרחוב ,Dude he's up the street ,- Daoud up the street,81
312,הוא אמר לי להגיד לך שהוא הלך ,He told me to tell you he's gone ,He told me to tell you he was gone,91
313,-אני רואה ,So I see ,-I see,77
314,המון אנשים היום בעיירה ,There's a lot of people in town today ,Lots of people in town today,83
315,שמעת למה ,Did you hear why ,You heard why,83
316,-מישהו אמר שהוא שמע שאולי נתן בורדט יבוא לראות אותך היום ,A man say he hear maybe Nathan Burdette will come to see you today ,- Someone said he heard maybe Nathan Bourdett would come see you today,82
317,כנראה הם הגיעו לצפות ,Most likely they here to watch ,Apparently they came to watch,68
318,-אם הוא יבוא הם יוכלו לראות משהו ,If he does they may see something ,-If he comes they will be able to see something,71
319,-זה לא מוצא חן בעיני ,I don't like it ,- I do not like it,90
320,-גם לא אני ,Neither do I ,-Me neither,73
321,-טום שים את הרובה שלך על הגדר ,Tom hang your gun on the fence ,-Tom put your rifle on the fence,72
322,קח אותו משם כשתעזוב ,You'll pick it up when you leave ,Take it away when you leave,64
323,-זה מספיק ,Sure enough ,-It is enough,70
324,-יש לי הוראות לקחת את האקדחים שלכם ,I got orders to take your guns ,- I have instructions to take your guns,66
325,-תתאר שאנחנו לא רוצים למסור אותם ,Suppose we don't want to give them up ,-Describe that we do not want to hand them over,60
326,אתה חושב שאתה מספיק טוב לצאת נגד כל השישה שלנו ,Think you're good enough to take them against six of us ,You think you're good enough to go out against all six of us,78
327,-בשביל אדם פיקח מר בורדט זה היה די מטופש ,For a smart man Mr Burdette that's pretty stupid ,"- For a smart man, Mr. Burtett it was pretty stupid",86
328,אתה לא תצטרך את האקדח יותר בגלל שאתה האיש הראשון שאירה בו ,You won't need a gun no more because you'd be the first man I'd get ,You will not need the gun anymore because you are the first man to fire it,74
329,-בואו נלך ,Come on let's go ,-lets go,61
330,-תירגע האריס!,Hold it Harris!,- Relax Harris!,62
331,-הוא חתך את המושכות שלי ,He cut my reins ,- He cut my reins,100
332,-אמרתי שהוא עשה את זה במכוון ,I'd say he did it on purpose ,- I said he did it on purpose,91
333,ואמרתי לך להירגע ,He told me to tell you he's gone ,And I told you to relax,62
334,-כעת הניחו את האקדחים שלכם על הגדר תוכלו לאסוף אותם כשתעזבו ,Now hang your guns on the fence and you can pick them up when you leave ,-Now put your guns on the fence you can pick them up when you leave,91
335,-אתה די טוב עם האקדח כשאתה פיכח ,You're pretty good with that gun when you're sober ,- You're pretty good with the gun when you're sober,97
336,-לא רע ,Not bad ,-Not bad,100
337,-איך זה קרה ,How does that happen ,-How did it happen,76
338,-אם הכוונה להיות טוב עם אקדח עשיתי המון אימונים ,If you mean being good with a gun I've had a lot of practice ,-If the intention is to be good with a gun I did a lot of training,61
339,אם אתה מתכוון לפיכחות  אני התרגלתי לזה בזכות אחיך ,If you mean being sober I'm getting practice on account of your brother ,If you mean sobriety I got used to it thanks to your brother,60
340,-אני לא עוקב אחריך ,I don't follow you ,- I'm not following you,72
341,אתה לא צריך לעקוב אחרי מר בורדט מאט!,You don't have to follow me Matt!,You do not have to follow Mr. Bordt Matt!,85
342,אתה לא שמעת את הבוס אומר שהיתי פיכח ,Didn't you hear the boss say that I was sober ,You did not hear the boss say I was sober,86
343,את האקדח הנוסף שבאפוד שלך תניח גם על הגדר ,That extra gun in your vest lay that on the fence too ,Put the extra gun in your vest on the fence as well,77
344,-אתה נהנה מעצמך לא ,-You're enjoying yourself aren't you ,-You enjoy yourself no,71
345,-בסדר מר בורדט   המשך ,-All right Mr Burdette get going ,"- All right, Mr Boredt",68
346,אין לי עוד על מה לדבר איתך ,I got no more to talk to you about ,I have nothing more to talk about with you,79
347,-אתה תהנה מזה דאוד ,You should enjoy it Dude ,- You'll enjoy it Daoud,80
348,כל אחד צריך לטעום קצת כוח לפני שהוא עובר ,Every man should have a little taste of power before he's through ,Everyone needs to taste some power before he passes,66
349,-סטמפי!,Stumpy!,-Stampy!,83
350,בורדט ואנשיו הגיעו ,Burdette and his men are coming in ,Bordt and his men arrived,68
351,-אל תשטח בפניהם שטיח אדום ,Don't put down no red carpet for them ,- Do not cover them with a red carpet,67
352,ואני עומד בדיוק איפה שאני אמור להיות ,And I'm staying right where I'm supposed to ,And I'm standing right where I'm supposed to be,93
353,-ככה צריך ,Didn't you hear the boss say that I was sober ,-that's the way it should be,61
354,-בוקר טוב שריף ,Good morning Sheriff ,Good morning Sheriff,100
355,-שלום בורדט ,Hello Burdette ,- Hello Bordt,80
356,-אני רוצה לראות את אחי ,I want to see my brother ,- I want to see my brother,100
357,-אתה יכול להיכנס ,You can come in ,- You can enter,71
358,הוא לא אח שלך ,He's not your brother ,He's not your brother,100
359,לך לצידו השני של הרחוב עם כולם ,Go on across the street with the others ,Go across the street with everyone,74
360,-עשה כדבריו ,Do as he says ,- Do as he says,100
361,-מה כל האנשים האלה עושים בעיירה ,What are all those people doing in town ,- What are all these people doing in town?,97
362,-לא שאלתי ,I didn't ask ,- I did not ask,88
363,לא ביקשתי מהם לבוא ולא שאלתי אותם למה הם כאן ,Didn't ask them to come or ask them why they're here ,I did not ask them to come and I did not ask them why they were here,78
364,אבל אני חושב שהם מחכים לראות מה אתה תעשה ,But I think they're watching to see what you're going to do ,But I think they're waiting to see what you do,86
365,אתה לא אוהב את זה נכון ,You don't like that do you ,You do not like it right,68
366,יותר מדי עדים ,Too many witnesses ,Too many witnesses,100
367,אתה רוצה להמשיך לדבר איתי או לראות את אחיך ,Now do you want to keep talking to me or see your brother ,You want to keep talking to me or see your brother,93
368,-לראות את אחי ,See my brother ,-See my brother,100
369,-אנחנו נכנסים סטמפי ,We're coming in Stumpy ,- We're entering Stampi,65
370,-אז תיכנס ,Come on ,- Then come in,63
371,אל תחכה שאני אסחב אותך ,Don't wait for me to carry you ,Do not wait for me to carry you,95
372,-מה הסיסמא ,What's the password ,-What is the password,87
373,-בוא הנה ,Come on ,-Come here,62
374,-אני בא ,I'm coming ,-I'm coming,100
375,לא הייתי מפספס את זה ,I wouldn't miss this ,I would not miss it,72
376,רק כדי שהוא יראה איך אנחנו מוכנים ,Just want him to see how we're set up ,Just so he can see how ready we are,64
377,ובכן תראו מי כאן ,Look who's here ,Well look who's here,86
378,-המקום מקבל מעמד עם הברודטים ,Go on across the street with the others ,- The place gets status with the Brodettes,61
379,הבחור שם בפינה עם הפנים היפות הוא אחיך ,That fellow round the corner with a banged-up face is your brother ,The guy in the corner with the pretty face is your brother,69
380,-נתן ,Nathan ,-Nathan,100
381,-נראה כמו שהם עברו עליך ,Looks like they gave you a going over ,- Looks like they passed you by,67
382,-החבר שלנו כאן ,Our friend here ,- Our friend is here,91
383,-למה ,Why ,-Why,100
384,-הוא לא קיבל בסבר פנים את המעצר על רצח ,He didn't take too kindly to being arrested for murder ,- He did not accept the arrest for murder,62
385,-זה לא היה רצח ,It wasn't murder ,- It was not murder,91
386,-אם הוא אומר שזה לא היה רצח למה אתה אומר שזה היה ,If he says it wasn't murder why do you say it was ,-If he says it was not murder why do you say it was,93
387,אתה ידעת את כבר את זה אחרת לא היית מסדר ככה את הדברים ,You knew that already otherwise you wouldn't have set things up like you did ,"You already knew that, otherwise you would not have arranged things that way",79
388,-אתה איש עשיר בורדט ,You're a rich man Burdette ,"- You're a rich man, Bordett",94
389,משלם להרבה אנשים שיעשו את מה שאתה רוצה שהם יעשו ,Pay a lot of people to do what you want them to do ,Pays for a lot of people who will do what you want them to do,85
390,ויש לך אח ,And you got a brother ,And you have a brother,84
391,הוא לא בסדר אבל הוא אחיך ,He's no good but he's your brother ,He's not okay but he's your brother,84
392,אם הוא יבצע עשרים רציחות אתה תנסה ותדאג שלא יתלו אותו עליהם ,If he committed 20 murders you'd try and see he didn't hang for them ,If he commits twenty murders you will try and make sure he is not hanged,66
393,-אני לא אוהב דיבורים כאלה ,I don't like that kind of talk ,- I do not like such talk,64
394,אתה מאשים אותי  ,-You're accusing me--,You blame me,60
395,אתה לא אוהב את זה אני לא אוהב הרבה דברים ,You don't like it I don't like a lot of things ,You do not like it I do not like a lot of things,89
396,אני לא אוהב שהאנשים שלך צופים בנו מנסים לתפוס אותנו כשאנחנו מפנים את הגב ,I don't like your men watching us trying to catch us with our backs turned ,I do not like your people watching us trying to catch us as we turn our backs,86
397,ואני לא אוהב כשחבר שלי מציע עזרה  ועשרים דקות מאוחר יותר הוא מת!,And I don't like it when a friend of mine offers to help and 20 minutes later he's dead!,And I do not like when my friend offers help and twenty minutes later he is dead!,84
398,ואני לא אוהב אתך בורדט בגלל שאתה סידרת את זה ,And I don't like you Burdette because you set it up ,And I do not like you Burdett because you arranged it,81
399,-מה אתה הולך לעשות עם זה ,What're you going to do about it ,-What are you going to do with it,78
400,אני הולך לשבת כאן עם אחיך ברשותי  עד שמרשל אמריקאי יגיע לכאן ,I'm going to sit here with your brother in my lap until the United States Marshal gets here ,I'm going to sit here with your brother in my possession until an American marshal arrives here,72
401,זה יהיה בערך ששה ימים ,That'll be about six days ,It will be about six days,76
402,הוא יוכל לשאול כמה שאלות על סיבת המעצר ,He may ask a few questions about that busted wheel ,He will be able to ask some questions about the reason for the arrest,61
403,אב אתה מדי חכם מכדי לעכב את הכרכרה לגמרי ,But I think you're too smart to have stopped that stage completely ,Dad you're too smart to delay the carriage completely,62
404,כעת אני יוצא החוצה לנשום ,Now I'm running out of breath ,Now I'm going out to breathe,67
405,תדבר אם אתה רוצה ,You talk if you want to ,Talk if you want,82
406,-הדיבורים שלו מאד גדולים בשביל בנאדם שהוא לבדו  חוץ משתיין ונכה ,He talks awful big for a man that's all alone except for a barfly and a cripple ,- His speech is very big for a man who is alone except a drinker and a cripple,63
407,אתה יכול להוציא אותי מכאן בכל  ,-You can get me out of here any--,You can get me out of here at any time,88
408,אתה לא פיקח כמו אחיך ג'ו ,You're not as smart as your brother Joe ,You're not as smart as your brother Joe,100
409,הוא רואה את סטמפי עומד כאן מעבר לפינה נעול איתך ,He sees Stumpy here sitting around the corner locked in with you ,He sees Stampi standing here around the corner locked with you,84
410,ואם זה לא מספיק ברור אני אומר לך למה ,And if that isn't plain enough I'll tell you why ,And if that's not clear enough I'll tell you why,81
411,-אני רואה שעדיין יש לך קצת טינה נגדנו ,I see you still have a little grudge against us ,- I see you still have some resentment against us,72
412,1800 דונם זה קצת בשבילך נתן ,460 acres might be little to you Nathan ,1800 acres is a bit for you Nathan,66
413,אבל זה המון שטח עבורי ,But it was a lot of country to me ,But it's a lot of space for me,76
414,הוא נראה משוגע מספיק כדי לירות עלי ,He looks just crazy enough to shoot me ,He looks crazy enough to shoot me,93
415,הוא פיקח יותר משחשבתי ,He's smarter than I thought ,He's smarter than I thought,100
416,אתה יודע בית המשפט יכול לקרוא גם את זה רצח ,You know a court might just call that murder too ,You know the court can also call it murder,73
417,כולנו נהיה מתים עד אז ,We'd all be dead by then ,We will all be dead by then,86
418,-רק משהו אחד ,Just one thing ,-Only one thing,64
419,לג'ו יש חברים ,Joe has friends ,Joe has friends,100
420,אתה לא יכול להחשיב את ג'ו או אותי כאחראי עליהם  מה אמרת שהם יעשו או מה שהם יכולים לעשות ,You can't hold Joe or me responsible for them what you say they've done or what they might do ,You can not hold Joe or me responsible for what you said they would do or what they could do,82
421,אני רוצה להבהיר את זה ,I want to make that clear ,I want to make that clear,100
422,אני אעזור לך להבהיר את זה ,I'll help you make it clear ,I'll help you make that clear,86
423,אני לא חושב שיש בעולם חבר לג'ו ,I don't think Joe's got a friend in the world ,I do not think there is a friend of Joe in the world,80
424,וגם לא יהיה לו אלא אם כן מישהו ישלם לו חמישים דולר לראש ,And he won't have any unless somebody buys them for him at $50 a head ,Nor will he have it unless someone pays him fifty dollars a head,61
425,אתה הבהרת את זה ,You made it clear ,You made it clear,100
426,-בסדר סטמפי ,All right Stumpy ,- All right stampy,94
427,-נתן ,-Nathan ,-Nathan,100
428,-שלח לי בקבוק לפני שאתה עוזב את העיירה ,Send me a bottle before you leave town ,- Send me a bottle before you leave town,100
429,תעשה את זה כי חלק מהעבודה שלי זה לראות אם זה לא מורעל ,You do that because part of my job is to see that it ain't poisoned ,Do it because part of my job is to see if it's not poisoned,75
430,לפעמים לוקח הרבה זמן לגלות את זה ,Sometimes takes quite a spell to find out ,Sometimes it takes a long time to find out,72
431,-לא היה לו הרבה מה להגיד נכון ,-He didn't have much to say did he ,- He did not have much to say right,70
432,-לא ,-No ,-No,100
433,למה נתת לו לעזוב ,What did you leave him go for ,Why did you let him leave?,74
434,יש לך הרבה סיבות להחזיק אותו ,You had plenty to hold him on ,You have many reasons to hold it,62
435,-אין שום דבר שהם יעשו  שהוא כבר מתוכנן אחרת הוא לא היה נכנס לכאן ,Anything they're going to do is planned already or he wouldn't have come in here ,- There's nothing they will do that is already planned otherwise he would not have come in here,69
436,לזרוק אותו כאן עם ג'ו היה נותן לו אליבי ללא יודע מה ,Throwing him with Joe would give him an alibi for whatever happens ,Throwing him here with Joe would have given him an alibi without knowing what,76
437,-לא חשבתי על זה ,-She did not do it ,-I did not think about it,63
438,מה אתה חושב שיקרה ,-What do you think will happen ,What do you think will happen,100
439,-אני לא יודע ,-I don't know ,-I do not know,88
440,-אתה יכול לחשוב לא ,You can think can't you ,- You can think no,77
