,hebrewFromSub,englishFromSub,englishTranslation,ratio
408,היא תגרום לך לשום דבר פרט לשיברון לב ,She'll bring you nothing but heartache ,It will cause you nothing but heartbreak,62
409,חוץ מזה כל מה שהיא רצתה היה פרסום ,Besides all she wanted was the publicity ,Besides all she wanted was publicity,95
410,אמא  לא ייתכן שאת רצינית ,Mother  you can't be serious ,"Mom, you may not be serious",75
411,אני לא מאמין שזה קורה ,I can't believe this is happening ,I do not believe this is happening,90
412,שכח אותה ,Forget her ,forget her,100
413,את מתנהגת כאילו כל הזמן רצית שאני יהיה במקום הזה ,You act as though you wanted me here for all time ,You act like you always wanted me to be in this place,67
414,את שהיית הקשר היחיד שלי לעולם שבחוץ ,With you as my only outside connection ,You were my only connection to the outside world,77
415,אז  אז בחרת בה במקום באמא שלך ,Then  Then you choose her instead of your own mother ,So then you chose her instead of your mother,91
416,זוהי ההחלטה שלך ,That's your decision ,It's your decision,79
417,גברת סטראוד ,Mrs Stroud ,Mrs. Stroud,100
418,שמי פטרסון ,My name is Peterson ,My name is Patterson,92
419,אני כתב של קנזס סיטי סטאר ,I'm a reporter from the Kansas City Star ,I'm a Kansas City Star reporter,87
420,העיתון שלי מעוניין בסיפור מעקב על הנישואין של הבן שלך ,My paper wants a follow-up story on your son's marriage ,My newspaper is interested in a follow-up story about your son's marriage,73
421,אין תגובה ,No comment ,No Comment,100
422,"ובכן האם ""הנישואין"" האלה באו לך כהפתעה גברת סטראוד ",Well does this so-called marriage come as a surprise to you Mrs Stroud ,"Well did this ""marriage"" come as a surprise to you, Mrs. Stroud",88
423,לא ידעתי על זה כלום ,I knew nothing of it ,I knew nothing about it,79
424,את או סטלה ג 'ונסון ,You or Stella Johnson ,You or Stella Johnson,100
425,לא יהיה מאבק ,There will be no fight ,There will be no struggle,68
426,רק רגע גברת סטראוד ,Wait a minute Mrs Stroud ,Just a moment Mrs. Stroud,67
427,מה זאת אומרת לא יהיה שום מאבק ,What do you mean there'll be no fight ,What does it mean there will be no struggle,70
428,הבן שלי נמצא היכן שהוא שייך ,My son is where he belongs ,My son is where he belongs,100
429,אני לא יעשה שום דבר לקידום שחרורו מבית הכלא ,I shall do nothing to obtain his release from the penitentiary ,I will do nothing to promote his release from prison,68
430,וזה לציטוט ,And this is for quotation ,And that's for a quote,64
431,אני יודעת שהוא בטוח היכן שהוא נמצא ,I know he's safe where he is ,I know he's safe where he is,100
432,גברת סטראוד אני רוצה להיות בטוח ,Wait a minute Mrs Stroud ,Mrs. Stroud I want to be sure,65
433,אתה אומרת שאת מעדיפה שהוא יהיה בכלא משאר שיהיה חופשי ,Are you saying you'd rather have him in there than free ,You say you prefer him to be in jail over the rest to be free,60
434,את מתנגדת לשחרור של הבן שלך ,You now oppose your own son's parole ,You oppose the release of your son,74
435,אני עושה את זה לטובתו ,I'm doing it for his own good ,I do it for him,64
436,ובכן בוב אתה האסיר הראשון בהיסטוריה שהיו לו שני תאים ,Well Bob you're the first con in history that ever had two cells ,Well Bob you're the first prisoner in history to have had two cells,78
437,זה יהיה טוב לציפורים ,Gonna be great for the birds ,It will be good for birds,68
438,זה מופיע בכל העיתונים ,It's in all the papers ,It appears in all the newspapers,74
439,אני לא יכול להבין כיצד היא הפנתה לך את גבה ,I can't understand how she could turn on you that way ,I can not understand how she turned her back on you,71
440,האם אתה יודע מה אמא נמרה עושה כאשר היא מודאגת ,Do you know what a mother tiger does when she's upset ,Do you know what a tiger mother does when she's worried,87
441,היא אוכלת את הגורים שלה ,She eats her young ,She eats her puppies,63
442,אולי אני יכול לדבר עם אמא שלך אנסה לסדר את זה ,Maybe I could talk to your old lady try and fix it up ,Maybe I can talk to your mom and I'll try to sort it out,72
443,אני מבטיח לך שהיא תשנה את דעתה ,Your son's parole hearing is coming up ,I promise you she's going to change her mind,63
444,בוב!,Bob!,Bob!,100
445,מבחינתי היא מתה ,And she's kind ,To me she's dead,60
446,אתם יודעים מה זה חברים ,You know what this is friends ,You know what friends are,78
447,אני הולך להכין לעצמי את הקוקטייל של לונוורט ,I'm gonna make me a Leavenworth cocktail ,I'm going to make myself the Lonworth cocktail,74
448,עופו חבריי הציפורים ,Fly my avian friends ,My bird friends flew,75
449,אני אתן לכם אשליה של חופש ,I give you the illusion of freedom ,I will give you the illusion of freedom,93
450,תהנו ממנה ,Enjoy it ,Enjoy it,100
451,קדימה פתח את זה ,No comment ,Come on open it,64
452,לקחתי את זה אתמול הלילה מבֵּית עֲבוֹט חשבתי שאולי תרצה להציץ בזה ,Picked it up last night in a hockshop Thought you might get a kick out of it ,I took it last night from a nursing home I thought you might want to take a look at it,65
453,למה שלא תסתכל על משהו תראה האם זה עובד ,Why don't you look at somethin' see if it works ,Why not take a look at something and see if it works,80
454,מר רנסום אתה אדם יקר!,Mr Ransom you sure are a darlin' man!,Mr. Ransom you are a dear person!,73
455,שמור את שתי העיניים פתוחות ,Keep both eyes open ,Keep both eyes open,100
456,כעבור זמן קצר תראה רק דרך העֵינִית ,After a while you'll see only through the eye of the eyepiece ,Soon you will only see through the eyepiece,73
457,זה הרעיון ,That's the ticket ,That's the idea,62
458,(גאדיס) המקרוסקופ הזה היה המגדלור שסטראוד תמיד חיפש שיאיר את דרכו לתוך המחקר המדעי הנפלא והמרתק ,For Stroud that microscope was the lantern he had been waiting for to light his way into the marvellous and exacting truth of scientific research ,(Gadis) This macroscope was the lighthouse that Stroud had always sought to illuminate his way into the wonderful and fascinating scientific research,67
459,הנושא שלו:,His object:,His subject:,86
460,הציפורים ,The bird ,The birds,94
461,הכלים שלו:,His tools:,His tools:,100
462,צִיטוֹלוֹגְיָה (חקר התאים) מורפולוגיה ביוכימיה ,Cytology morphology biochemistry ,Cytology (cell research) Morphology Biochemistry,82
463,סטראוד החליט שהוא יכול להשיק את הפרוייקט שהוא חולם עליו שנים עבודה מקיפה על מחלות של ציפורים ,Stroud decided he was equipped to launch a project he had long dreamed about - a definitive work on the diseases of birds ,Stroud decided he could launch the project he had been dreaming of for years of extensive work on bird diseases,71
464,הוא גילה תרופות למחלות שאת שמם הוא בקושי יכול לבטא כמו המורהג'יק ספטיכמיה דִּיפְתֶּרְיָת ציפורים אספרג'ילוסיס כולירת הציפורים,He had found cures for diseases he could hardly pronounce like haemorrhagic septicaemia bird diphtheria aspergillosis avian cholera ,He discovered drugs for diseases whose name he could hardly pronounce as the Moragic Bird Diphtheria Aspergillosis Bird Cholera,69
465,הוא גם מצא תרופה נגד שיתוק בעופות ובכך הציל את חייהם של אלפי עופות ,He even found a specific for fowl paralysis thereby saving poultry ranches the lives of thousands of chickens ,He also found a remedy for paralysis in birds and thus saved the lives of thousands of birds,62
466,"שם הספר שלו היה: ""מאמרים של סטראוד על מחלות ציפורים""","The title of his book was ""Stroud's Digest of the Diseases of Birds"" ","The title of his book was: ""Stroud's Articles on Bird Disease""",78
467,תוכן הספר הוכיח ללא כל צל של ספק שלאסיר המזדקן היה את הידע הנרחב בעולם בתחומו ,Its contents established beyond doubt that the ageing prisoner was the world's foremost authority in his field ,The contents of the book proved without a shadow of a doubt that the aging prisoner had the extensive knowledge in the world in his field,62
468,כתיבת הספר נמשכה שבע שנים ,The book took seven years to complete ,The writing of the book took seven years,75
469,אני רוצה את הדעה המדעית שלך אודות הספר של סטראוד ,I want your scientific opinion about this book of Stroud's ,I want your scientific opinion about Stroud's book,93
470,ובכן דוקטור ,Well Doctor ,Well Doctor,100
471,זה מחקר מדעי ברמה גבוהה על פתולוגיה  מחלות של ציפורים ,It's a highly scientific study of the pathology - diseases - of birds ,It is a high-level scientific study on the pathology and diseases of birds,86
472,אני חושב שהוא גאון ,I think he's a genius ,I think he's a genius,100
473,מדוע ,Why ,why,100
474,רק בגלל שהוא כתב ספר על ציפורים ,Just because he's written a book about birds ,Just because he wrote a book about birds,93
475,לא לא לא בגלל זה ,No No not because of that ,No no not because of it,83
476,כי עם חינוך 'ברמה של כיתה ג הוא הפך למומחה בנושאים כמו הימוטוליג'י זה דם ,Because with only a third-grade education he's become expert in subjects like haematology - that's blood ,Because with education 'at the third grade level he became an expert on topics like hematology is blood,75
477,היסטולוגיה - רקמות ,Histology - tissue ,Histology - Tissue,100
478,אנטומיה ,Anatomy ,anatomy,100
479,נושאים קשים ללימוד גם בהנחיית מרצה בקולג ' אך לימוד עצמי בתא זה השג שעולה על כל דמיון ,Studies tough enough with an instructor in college but self-taught in a cell an accomplishment that staggers imagination ,"Difficult topics to study even under the guidance of a lecturer in college, but self-study in this cell is an achievement that surpasses all imagination",64
480,הוא חכם ,He's smart ,he is smart,95
481,יש לו מנת משכל גבוהה ,He has a high IQ ,He has a high IQ,100
482,יותר מזה ,He's more than that ,More than that,85
483,הוא התעסק מעל 3 000 שעות עם המיקרוסקופ שלו ביצע מאות רישומים מעל 5000 חלקי רקמות ,He's spent over 3 000 hours at that microscope of his made hundreds of drawings over 5 000 tissue sections ,"He fiddled over 3,000 hours with his microscope and made hundreds of drawings over 5,000 pieces of tissue",82
484,יש לו את אחד האוספים הגדולים של דגימות מיקרוסקופיות של ציפורים ,He has one of the finest collections of slides on birds in existence ,It has one of the largest collections of microscopic specimens of birds,69
485,הוא מתמצא באנטומיה של עופות ופתולוגיה יותר מכל אדם בעולם ,Knows more about avian anatomy and pathology than any man alive ,He is more versed in avian anatomy and pathology than any person in the world,64
486,בסדר ,OK ,OK,100
487,אני ימליץ שהספר יגיע למוציא לאור ,I'll recommend his book go to the publisher's ,I would recommend the book to a publisher,77
488,אם סטראוד ישוחרר על תנאי ויתחיל לעבוד במעבדה תאר לך מה הוא יוכל לעשות ,If Stroud's paroled and gets a laboratory there's no telling what he might do ,"If Stroud is released on parole and starts working in a lab, tell him what he can do",61
489,הוא יוכל לחקור מחלות של בני אדם לא של ציפורים ,He should be working on human diseases not birds' ,He will be able to study diseases of humans not of birds,75
490,לא בעיניי הלשכה ,Not in the eyes of the bureau ,Not in the eyes of the bureau,100
491,הגישה שלו גרועה ,His attitude is poor ,His attitude is poor,100
492,הוא חושב שכל העולם שייך לו הוא חושב שאנחנו חיילי חייל האפסנאות שלו ,He thinks he's a world unto himself like we were his own personal quartermaster corps ,He thinks the whole world belongs to him he thinks we are his bodyguard soldiers,62
493,כימיקלים ציוד מעבדה אוכל לציפורים ,Chemicals laboratory equipment birdseed ,Chemicals Laboratory equipment Food for birds,86
494,הוא צריך להפסיק מתישהו ,It's got to stop someplace ,He needs to stop sometime,63
495,הייתי נותן לו 500 ליבראות קרח ביום אם הוא רק היה רוצה ,I'd give him 500lbs of ice a day if he wanted it ,I would give him 500 ice cubes a day if he just wanted to,80
496,כך היית עושה הא ,You would huh ,That's how you would do,67
497,אני תוהה האם הלשכה מפחדת מסטראוד ,I wonder if the bureau isn't afraid of Stroud ,I wonder if the bureau is afraid of Stroud,97
498,מפחדת שהציבור יידע אילו מוחות אתם נועלים כאן ,Afraid to let the public know what kind of a brain they're keeping locked up here ,Afraid the public will know what minds you are locking in here,60
499,דוקטור אנחנו נועלים כאן רוצח ,Doctor we're keeping a killer locked up here ,"Doctor, we're locking up a killer here",84
500,אל תשכח את זה ,Don't forget it ,Do not forget it,90
501,שמעתי מהפרופסור הזה מאוניברסיטת קנזס ,I heard from that professor the one at the university of Kansas ,I heard from this professor from the University of Kansas,85
502,הוא אמר שאם הייתי בחוץ יש סיכוי טוב שהייתי מקבל מענק מחקר ,He said if I were out I might have a good chance to get a research grant ,He said that if I had been out there was a good chance I would have received a research grant,73
503,-מה זה ,- What's that ,-What is,67
504,-ובכן משלמים לך לעשות מחקר ,- Well they pay you to do research ,-Well you get paid to do research,81
505,בוב!,Bob!,Bob!,100
506,זה נפלא!,But that's wonderful!,it's wonderful!,76
507,ובכן איך ייתכן שועדת השחרורים תדחה אותך עכשיו ,Well how can the parole board turn you down now ,Well how can the parole board reject you now,81
508,הספר הזה והתרופות שגילית  מה הם רוצים ,Boy they talk about rehabilitation This book and the cures you discovered  What do they want ,This book and the drugs you found out what they want,63
509,חבל שאת לא בועדה הזו סטל ,I wish you were on that board Stell ,"Too bad you're not on this committee, Stell",60
510,בואי לא מתכנן תוכניות ,But let's not make any plans ,Let's not make plans,83
511,אתה עדיין לא מרשה לעצמך לחשוב על כך שתצא החוצה נכון ,You still won't let yourself think about getting out will you ,You still do not allow yourself to think about getting out right,74
512,בוב מה רע בקצת אמונה ,Bob what's wrong with having a little faith ,Bob what's wrong with a little faith,91
513,את תמיד מלמדת אותי מילים חדשות ,You're always bringing me new words ,You always teach me new words,78
514,"כמו ""אהבה"" ו ""אמונה ""","Like ""love"" and ""faith"" ","Like ""love"" and ""faith""",100
515,אתה איש נפלא ,You're a wonderful man ,You are a wonderful man,84
516,עשית כמה דברים נפלאים ,You're a wonderful man ,You did some wonderful things,67
517,יש לי אמונה כי ועדת השחרורים תראה כמה אתה טוב ,I have faith that the parole board will see how good you are ,I have faith that the parole board will see how good you are,100
518,אֱלוהִים אַדִּירִים! אתה לא יכול לחשוב כל הזמן שתישאר פה לשארית חייך ,Golly you just can't go on thinking that you're gonna be here the rest of your life ,God Almighty! You can not think all the time that you will stay here for the rest of your life,67
519,אבל אל תתחילי לקנות לי עניבות חדשות בסדר ,But don't you start buying me any new neckties yet OK ,But do not start buying me new ties fine,69
520,את נראית יפה היום ,You look pretty today ,You look beautiful today,62
521,בוב קדימה תתעורר ,Bob wake up ,Bob forward will wake up,63
522,בוב תתעורר ,Bob wake up ,Bob will wake up,81
523,קום ,Get up ,get up,100
524,מה קרה בול ,What's up Bull ,What happened to Bull,63
525,פקודת העברה שלך ,Your transfer orders ,Your transfer order,97
526,אלקטרז ,Alcatraz ,Alcatraz,100
527,הנה ,Here ,here,100
528,עדיף שתתלבש ,Better get dressed ,You better get dressed,90
529,-להתלבש ,- Dressed ,-get dress,75
530,-עכשיו ,- Now ,-now,100
531,הם בדרכם למטה ,They're on their way down ,They're on their way down,100
532,-למה בשעה זו של הלילה ,- Why this time of night ,-Why at this time of night,94
533,מה עם הציוד שלי ,What about my equipment ,What about my equipment?,100
534,הציפורים שלי ,My birds ,My birds,100
535,ההוראות שקיבלנו הן לך ללכת רק עם הבגדים שלך ,Our instructions are you walk outta here with just the clothes you have on ,The instructions we received are for you to go only with your clothes,70
536,יש לי שם ציפור חולה אני יכול לתת לה תרופה ,I got a sick bird in there Can I fix it ,I have a sick bird there I can give her medicine,71
537,כמובן שאתה יכול ,Of course you can ,Of course you can,100
538,תקשיב לי בול ,Listen to me Bull ,Listen to me Bull,100
539,אני רוצה שתדבר עם סטלה ,I want you to talk to Stella ,I want you to talk to Stella,100
540,אני רוצה להגיד לה לא ללכת אחריי ,I want you to tell her not to follow me ,I want to tell her not to follow me,95
541,בשום תנאי ,Under no conditions ,Under no circumstances,68
542,מבין ,Understand ,Understand,100
543,עדיף שתצא לפנסיה ותעוף מהמקום הזה לפני שהקירות האלה ישיגו אותך ,You better grab that pension and beat it before these walls get to ya ,It's better for you to retire and fly out of this place before these walls catch up with you,63
544,אני אנסה לכתוב לך ,I want you to talk to Stella ,I'll try to write to you,69
545,אל תבזבז את הזמן שלך בלדאוג לי ,Don't waste your time grieving over me ,Do not waste your time worrying about me,62
546,כשזה נגמר זה נגמר ,When it's cut it's cut ,When it's over it's over,61
547,להתראות חבר ,So long friend ,Goodbye friend,64
548,כן ,Yes ,Yes,100
549,תודה ,Thank you ,Thanks,67
550,שם מעניין ,Interesting name ,Interesting name,100
551,-השקט שולט כאן ,- Silence rule ,- Silence reigns here,65
552,שלום בוב ,Hello Bob ,Hello Bob,100
553,-די טוב יחסית לאיש זקן ,- Pretty good for an old man ,- Pretty good for an old man,100
554,אני תמיד נהנה מנסיעות ,Well I've always enjoyed travelling ,I always enjoy traveling,81
555,הוא מודרני מחומם היטב נקי ,It's modern well-heated clean ,It is modern and well heated and clean,81
556,זה הדבר הראשון ששמתי לב אליה אַנְטִיסֶפְּטִי (חומר מחטא) ,First thing I noticed Almost antiseptic ,This is the first thing I noticed antiseptic (disinfectant),67
557,כן פה לא תמצא מקקים ,Yeah you'll find no cockroaches here ,"Yes, you will not find cockroaches here",84
558,יש לנו לִינוֹלֵאוּם (חומר בלתי חדיר למים) על כל הרצפה והתאים ,We have linoleum on all the floors of the cells ,We have linoleum (a waterproof material) all over the floor and cells,74
559,כשניכנסתי ראיתי ילדים משחקים ,Do the children enjoy living here ,When I entered I saw children playing,63
560,הם של השומרים ושל שאר אנשי צוות ,They belong to the guards and all the other personnel ,They are of the guards and of the rest of the staff,60
561,כולנו חיים על הסלע (אלקטרז) ,We all live on the Rock too ,We all live on the rock (Alcatraz),78
562,מעניין לא ,Interesting name ,Interesting no,87
563,לא נראה שעבר זמן רב מידיי מאז ששיחקתי בזה בעצמי ,Doesn't seem so long ago I played it myself ,It does not seem to have taken too long since I played it myself,71
564,יש לי חוות דעת טובה עלייך מלונוורט בוב ,I got a good report on you from Leavenworth Bob ,I have a good opinion of you from Lonvert Bob,72
565,אבל אם תקפיד לא להפר את הכללים בסופו של דבר נוכל לשפר את זה התנאים יהיו לך יותר נוחים ,But I think if you toe the mark eventually we can improve on that make things a little more pleasant for you ,But if you take care not to break the rules in the end we can improve it and the conditions will be more favorable for you,62
566,המשרד שלי תמיד פתוח ,My office is always open ,My office is always open,100
567,אם לא מטפלים בך כראוי פשוט תודיע לי ,If you're not treated right just let me know ,If you are not treated properly just let me know,85
568,האם הילדים נהנים לחיות כאן ,Do the children enjoy living here ,Do the kids enjoy living here,77
569,אני מניח שאף אחד מאיתנו באמת נהנה לחיות על האי הזה ,I don't suppose any of us truly enjoy living on this island ,I guess none of us really enjoy living on this island,66
570,הוא לא תוכנן עבור תענוג ,It wasn't designed for pleasure ,It is not designed for pleasure,77
571,סטראוד ,Stroud ,Stroud,100
572,היי סטראוד ,Hey Stroud ,Hi Stroud,84
573,בז זקן שכמותך ,Of course you can ,An old falcon like you,62
574,שמעתי שהגעת לכאן ,I heard you was comin' ,I heard you came here,67
575,-טוב לראות אותך ,- It's good to see ya ,-good to see you,76
576,איך אתה מרגיש ,How do you feel ,How do you feel,100
577,זוכר את הציפורים ,Remember the birds ,Remember the birds,100
578,אה ,- Yeah ,Ah,67
579,אייפ וג'קי ,Ape and Jackie ,Ape and Jackie,100
580,היו זמנים טובים אתה יודע ,Them was good times you know ,There were good times you know,86
581,בטח שהיו אלוהים אתה נראה טוב ,They sure were Gee you look good ,Surely they were God you look good,91
582,אני עדיין זוכר שגנבת ממני את תינוק הקנרית ,I still figure you stole them baby canaries from me ,I still remember you stole the canary baby from me,79
583,אתה מכיר אותי פיטו אני רק גנב זקן ,Well you know me Feto I'm just an old thief ,You know me Phyto I'm just an old thief,80
584,ראית את שומקר לאחרונה ,Have you seen the Shoemaker lately ,You've seen Shumkar recently,68
585,הוא פגש אותי ליד הדלת של האסם ,He met me at the barn door ,He met me at the barn door,100
586,ובכן הוא לא כזה בחור רע ,Well he ain't such a bad old guy ,Well he's not such a bad guy,80
587,אנחנו מסתדרים פה די טוב לאחרונה ,We been cutting it pretty good lately ,We've been getting along pretty well here lately,66
588,הוא גרם לי להיות נאמן ,He made me trusty ,He made me loyal,61
589,בטח אני מבין פיטו ,Sure I understand Feto ,Sure I understand Phyto,80
590,אתה עדיין אוהב פאי בשר טחון ,You still go for the mince pie ,You still like minced meat pie,70
591,פיטו גומז יכול להגניב לך שניים אולי אפילו שלוש חתיכות מידי פעם ,And old Feto Gomez can sneak you two maybe even three pieces every so often ,Phyto Gomez can sneak you two maybe even three pieces at a time,75
592,אני לא יודע ,I don't know ,I do not know,88
593,תן לי להזכר ,Let me recollect ,Let me remind you,61
594,ישבתי ארבע שנים באטלנטה ,I knocked off four at Atlanta ,I lived in Atlanta for four years,61
595,שלוש בג'לייט ,I did three at Juliet ,Three in Jelite,67
596,ואז הייתי 10 שנים איתך בלונוורט ,And then I did that ten-spot with you at Leavenworth ,Then I was with you at Lonworth for 10 years,60
597,ואז הייתי ברחובות ארבע שנים ,And then I was on the street for four ,Then I was on the streets for four years,86
598,ואני כאן כבר שש שנים ,And then I been here for six ,And I've been here for six years,83
599,-כמה זה ,- How much is that ,-how much is this,88
