,hebrewFromSub,englishFromSub,englishTranslation,ratio
206,מר סטראוד אני מאוד מצטערת על שביזבזתי את זמנך ,Mr Stroud I'm terribly sorry for taking so much of your time ,Mr. Stroud I'm so sorry I wasted your time,69
207,בהצלחה עם הרולר ,Good luck with the roller ,Good luck with the roller,100
208,גברת ג 'ונסון ,Mrs Johnson ,Mrs. Johnson,100
209,תודה על שהבאת אותו ,Thank you for bringing him ,Thanks for bringing it,83
210,ובכן למעשה אתה יודע אני  היה לי רעיון כלשהו שבגללו הגעתי לכאן ,Well actually you know I  I did have an idea when I came here ,Well actually you know I had some idea why I came here,82
211,רעיון ,Idea ,idea,100
212,האם חשבת אי פעם למכור את התרופות לציפורים ,Have you ever thought of selling your bird remedies ,Have you ever considered selling the drugs to birds,61
213,ובכן  יש לי קצת כסף ,Well  I have a little money Not much ,Well I have some money,67
214,לא הרבה אך אני מאמינה שזו תהייה השקעה טובה ,But I believe it would be a good investment ,Not much but I believe it will be a good investment,85
215,אתה תייצר את זה ואני אמכור את זה ,You make 'em and I sell 'em ,You'll make it and I'll sell it,75
216,ובכן אני נרגש ,Well I'll be darned ,Well I'm excited,63
217,אמרת ששמך הוא גברת סטלה ג 'ונסון ,You said your name was Mrs Stella Johnson ,You said your name is Mrs. Stella Johnson,91
218,-אני אלמנה ,- I'm a widow woman ,- I'm a widow,79
219,בעלי נפטרה לפני שמונה שנים ,My husband passed away eight years ago ,My husband passed away eight years ago,100
220,אני מצטער ,I'm sorry ,I'm sorry,100
221,האמת היא שכל מה שיש לי בחיים אלו הציפורים ,Truth is about all I've got in life is my birds ,The truth is that all I have in life are the birds,62
222,מה את יודעת לגביי גברת ג 'ונסון ,What do you know about me Mrs Johnson ,What do you know about Mrs. Johnson?,96
223,שהרגת שני אנשים ,That you killed two men ,You killed two people,73
224,-יש לך שאלות כלשהן ,- Any questions ,- You have any questions,74
225,-לא ,- No ,-No,100
226,טוב ,Good ,are good,67
227,-את שומעת תיפוף של תופים ,- You hear a roll of the drums just then ,- You hear the drumming of drums,65
228,-תופים ,- Drums ,-Drums,100
229,-יהיה גם אפילו טרומבון ,- There was even a trombone there ,- There will even be a trombone,77
230,-למה אתה מתכוון ,That you killed two men ,-What do you mean,67
231,תהליך הווצרות החברה החדשה שלנו ,The formation of our new company ,The process of forming our new company,83
232,ישנו דבר אחד שלמדתי וזה לא לבזבז זמן ,One thing I've learned is not to abuse time ,There is one thing I have learned and that is not to waste time,74
233,אף פעם לא חשבתי שניתן לסגור עסקאות בזמן כה קצר ,I never thought a business could be set up this fast ,I never thought transactions could be closed in such a short time,62
234,-את יכולה לשנות את דעתך אם את רוצה ,- You can change your mind if you want ,-You can change your mind if you want,100
235,-אני לא רוצה ,What is it ,-I do not want,61
236,כן אני משערת ,Yes I guess so ,Yes I guess,88
237,סליחה ,I'm sorry ,Sorry,71
238,אני רק אמרתי שלום לשליביל אינדיאנה ,I was just saying goodbye to Shelbyville Indiana ,I just said hello to Shlibil Indiana,71
239,אני יעבור ללונוורט ,I'll be moving to Leavenworth ,I'll move to Lonworth,64
240,אני כצריכה להיות ליד המפעל שלי ,I've got to be near my factory ,I should be near my factory,77
241,זהו יום גדול עבורי גברת ג 'ונסון ,This is a big day for me Mrs Johnson ,"This is a big day for me, Mrs. Johnson",100
242,יש לי תחושה שהבאת לי מזל ,I have a feeling you've brought me luck ,I have a feeling you brought me luck,96
243,-אני מקווה שכן ,- I hope so ,-I hope so,100
244,-הזמן הסתיים ,- Time's up ,- The time is up,78
245,לפני שאת הולכת תוכלי לעשות לי טובה ,Before you go would you do me a favour ,Before you go you can do me a favor,85
246,כמובן ,Of course ,of course,100
247,על מה מדובר ,What is it ,what is it about,77
248,שתיתני לי לחטט בתיק שלך ,to let me look through your purse ,Let me rummage through your briefcase,63
249,ליפסטיק ,Lipstick ,Lipstick,100
250,-קופסה לפודרה ,- Powder compact ,- Powder box,67
251,אה כן ,Oh yes ,Oh yes,100
252,מה אתה מחפש ,What were you looking for ,What are you looking for,82
253,כתוב לי מתי את מתכוונת לעבור ,Write me when you get ready to move ,Write me when you plan to move,83
254,אבקש מאמא שלי למצוא מקום בשבילך ,I'll have my mother find a place for you ,I'll ask my mom to find a place for you,78
255,הייי שלום שותפה ,So long partner ,Hi Hello Partner,65
256,היי בוב תקשיב לזה ,Hey you hear that Bob ,Hi Bob listen to that,67
257,היי אתה שומע בוב ,Hey you hear that Bob ,Hey you hear bob,86
258,מהי המילה הזו ,What's that word ,What is this word,85
259,קונגרס ,Congress ,congress,100
260,באותה השנה חרושת שמועות היכתה בכלא שהוקמה לשכה פדרלית של בתי הכלא על ידי הקונגרס ,The prison grapevine hammered out the news that a Federal Bureau of Prisons had been created by an act of Congress ,That same year a rumor mill struck in a prison set up by the Federal Bureau of Prisons by Congress,60
261,המנהל: א ג' ,Director:,Director: A. C.,80
262,מקלאוד ,AJ MacLeod ,McLeod,75
263,המנהל החדש שהגיע ללונוורט היה אלברט קומסטוק ,The new warden who came to Leavenworth was Albert Comstock ,The new director who came to Lonovert was Albert Comstock,78
264,רוברט סטראוד היה אחד האסירים הראשונים שהוא רצה לראות ,One of the first prisoners he asked to see was Robert Stroud ,Robert Stroud was one of the first prisoners he wanted to see,89
265,-שב בבקשה ,- Sit down please ,"-Sit, please",80
266,-תודה ,- Thank you ,-Thanks,67
267,אתה וודאי שמעת כבר על הקמתה של הלשכה של בתי הכלא ,You've heard about the formation of the new Bureau of Prisons of course ,You have probably heard of the establishment of the Prison Bureau,62
268,יש פה מספר הנחיות מוושינגטון שישפיעו עליך באופן אישי ,I have several directives from Washington that will affect you personally ,Here are some guidelines from Washington that will affect you personally,77
269,אני רוצה להקריא לך אותם בעצמי ,I wanted to read them to you myself ,I want to read them to you myself,97
270,ההנחיה הראשונה קובעת כי ששום חיה מכל סוג שהיא תורשה להיכנס לבית כלא פדראלי ,The first one states that no pets of any kind will be allowed in federal penitentiaries ,The first directive states that no animal of any kind is allowed to enter a federal prison,70
271,ההנחייה השנייה אוסרת מכל האסירים לעסוק במסחר או מיזמים ,The second directive forbids any inmate to engage in any commercial enterprise ,The second directive prohibits all prisoners from engaging in trade or enterprise,65
272,אתה יודע מה זה אומר ,Do you know what that means ,You know what that means,94
273,אני מצטער סטראוד אני יודע כמה הם חשובים לך ,I'm sorry Stroud I know how important they are to you ,I'm sorry Stroud I know how important they are to you,100
274,אף אחד לא הסתכל על העבר שלי הא ,Nobody looks at my record huh ,No one looked at my past ha,61
275,-אתה מזגים בחשיבות שלך ,- You're exaggerating your importance ,- You pour in your importance,68
276,האסירים מגדלים כעת כלבים חתולים תוכים ציפוריי קנרית אפילו קופים ,Prisoners now have dogs cats parrots canary birds even monkeys ,"Prisoners are now raising dogs, cats, parrots, canary birds and even monkeys",84
277,תנאי התברואה אינם טובים ,It's bad sanitation ,Sanitation conditions are not good,60
278,האכלה שלהם היא בעיה גדולה ,Feeding becomes a big problem ,Their feeding is a big problem,71
279,אסירים אחרים מתלוננים על כינים ופרעושים ,Other prisoners complain of lice and fleas ,Other inmates complain about lice and fleas,68
280,יש לך 60 ימים להיפטר מכלובי הציפורים שלך זה הכל סטראוד ,You have 60 days to get rid of your aviary That's all Stroud ,You have 60 days to get rid of your bird cages it's all stroud,84
281,מעולם לא חשבתי שהדוד סם יחזור בו מההתחייבות שלו ,I never thought Uncle Sam would go back on his word ,I never thought Uncle Sam would backtrack on his commitment,82
282,למה אתה מתכוון ,Do you know what that means ,What do you mean,74
283,היו הבנות בין ההנהלה לביני במשך 11 שנים שאני יכול לגדל את הציפורים ,There's been an understanding between the government and me for 11 years that I could raise my birds ,There were girls between the management and me for 11 years that I could raise the birds,76
284,-זה נשמע כמו איום ,- That sounds like a threat ,- That sounds like a threat,100
285,המנהל אתה פשוט אומר לי שאני כבר לא כזה חשוב ,Warden you just got through telling' me that I ain't very important ,Manager you're just telling me I'm not that important anymore,66
286,איך אני יכול לאיים על הלשכה הגדולה ובעלת העוצמה בוושינגטון ,How could I threaten a big powerful Washington bureau ,How can I threaten the great and powerful bureau in Washington?,78
287,יש לי תוכנית והיא עשויה לעבוד ,I have a plan and it might work ,I have a plan and it may work,90
288,איזה סוג של תוכנית ,What kind of a plan ,What kind of plan,94
289,אתה זוכר איך הצלת אותי ב 1920 ,Do you remember how you saved my neck in 1920 ,Do you remember how you saved me in 1920?,94
290,-כן אבל אני לא רואה  ,- Yes but I don't see  ,-Yes but I do not see,82
291,זה מה שעשית ,That's what did it ,That's what you did,81
292,אני לא חושבת שאני עוקבת אחרייך ,I don't think I follow you ,I do not think I'm following you,86
293,-רק אחדים ,- Just a few ,-Only a few,60
294,-אז נספר להם ,- Then we'll tell 'em ,- Then we'll tell them,79
295,נצטרך לספר להם שהם מתכוונים לקחת את הציפורים שלי ,We'll tell 'em how they're gonna take my birds away ,We'll have to tell them they're going to take my birds,73
296,נכתוב לעיתונים תחנות רדיו פרשנים בעלי טורים בעיתונים מועדוני מגדלי ציפורים מגזינים ,We'll write to newspapers radio stations commentators columnists bird clubs magazines ,We will write for the newspapers Radio stations Commentators with columns in the newspapers Bird breeders' clubs Magazines,77
297,נמצא אנשים מחוף לחוף שיכעסו לגבי זה ,We'll have people angry from coast to coast ,There are people from coast to coast who will be angry about this,63
298,מצויין רובי ,Excellent Robbie ,Excellent Ruby,80
299,מצויין ,Excellent ,Excellent,100
300,זה יהיה בדיוק כמו בימים ההם ,It'll be just like it was in the old days ,It will be just like in those days,77
301,שנינו ביחד נלחמים בעולם ,Just the two of us together fighting the world ,We both fight in the world together,69
302,אלו הוראות עבור הקמפיין ,It's instructions for the campaign ,These are instructions for the campaign,85
303,למה הוא נתן לך את החומר הזה ,Why should he give you this material ,Why he gave you this stuff,71
304,אלו סוג המשימות שבדרך כלל באחראיות אמא שלו ,The kind of thing he usually entrusts to his mother ,These are the kind of tasks that are usually the responsibility of his mother,61
305,ובכן אני לא יודעת ,Well I don't know ,Well I do not know,91
306,זה לא ממש משנה נכון ,It doesn't really matter does it ,It does not really matter right,73
307,אני אתן לך את ההנחיות ,It's instructions for the campaign ,I'll give you the instructions,62
308,כן גבירתי ,Yes ma'am ,Yes ma'am,100
309,התחילי בכתיבת מכתבים למועדוני מגדלי הציפורים ,Start with letters to the bird clubs ,Start by writing letters to the bird breeders' clubs,80
310,כן גבירתי ,Yes ma'am ,Yes ma'am,100
311,הנה זה בדף השני של הקנזס סיטי סטאר ,Here it is Right here on the second page of the Kansas City Star ,Here it's on the second page of the Kansas City Star,88
312,-הנה ,- Here ,-here,100
313,-אה כן ,- Oh yes ,-Oh yes,100
314,זה לא מספיק ,That's not enough ,it is not enough,67
315,אני רוצה את העמוד הראשי ,I want the front page ,I want the main page,78
316,אנחנו מוכנים להתחיל בשלב השני בקמפיין שלנו ,We're ready now for the next step of our campaign ,We are ready to start the second phase of our campaign,64
317,-יש לך רעיון אחר ,- You got another idea ,-do you have another idea,82
318,סטל את יכולה להציל אותי ,Stell you can save my neck ,"Stell, you can save me",89
319,כיצד ,How ,how,100
320,בוב אתה יודע שאני יעשה כל מה שאוכל ,Bob you know I'd do anything ,Bob you know I'll do anything I can,86
321,האם תרצי להינשא לי ,Now listen how would you like to marry me ,Would you like to marry me?,78
322,תני לי להבין ,Let me understand you now ,Let me understand,81
323,את מנסה לומר לי שנישאת לגבר שמרצה מאסר עולם בבידוד בית הכלא לונוורט ,Are you trying to tell me that you married a man serving a life term in solitary at Leavenworth penitentiary ,You're trying to tell me that you're marrying a man who's serving a life sentence in solitary confinement to Lonworth,73
324,כן אדוני ,Yes sir ,Yes sir,100
325,אתמול ,Yesterday ,Yesterday,100
326,ואיפה התקיים הטכס ,And where did the ceremony take place ,And where the ceremony took place,83
327,לא אדוני ,No sir ,Not sir,92
328,זה היה טקס אזרחי ,It was a civil ceremony ,It was a civil ceremony,100
329,ובכן קדימה ,Well go ahead ,Well go ahead,100
330,אם כבר הקשבתי עד עכשיו ,I've listened this far ,If I've listened by now,67
331,ובכן אתה מבין  כן ,Well you see  Yes ,Well you understand yes,72
332,אתה מבין על פי חוזה פריז וחוקי לואיזיאנה כל איש ואישה שרוצים להתחתן צריכים לחתום על הצהרה ,You see under the laws of the Treaty of Paris and the Louisiana Purchase all a man and woman had to do to be legally married was to sign a declaration ,You understand according to the Treaty of Paris and the laws of Louisiana every man and woman who wants to get married must sign a declaration,75
333,תבין לונוורט היא נכס הפדרלי ולכן היא חסינה מחוקי מדינת קנזס ,You see Leavenworth is still federal property and is therefore immune to the laws of the state of Kansas ,Understand Lonworth is a federal property and therefore is immune from the laws of the State of Kansas,83
334,הכל כתוב כאן אדוני אם אתה רוצה לקרוא ,It's all here sir if you want to read it ,Everything is written here sir if you want to read,69
335,התוצאה:,Result:,The result:,75
336,אחת הועידות המוזרות ביותר בהיסטוריה שהיו בכלא ,One of the strangest conferences in prison history ,One of the strangest conferences in history to have been in prison,86
337,-שלום בוב ,- Hello Bob ,Hello Bob,100
338,ובכן הצלחת ליצור סערה עם ציפורים שלך ,Well you've succeeded in creating quite a little flurry with your birds ,Well you managed to create a storm with your birds,63
339,אתה רוצה לשבת ,Would you like to sit down ,You want to sit down,74
340,כן תודה ,Thank you ,Yes thank you,82
341,בוב  ,Bob  ,Bob,100
342,נשלחתי בשם הלשכה להציע לך הצעה ,I've been sent here as a delegate of the bureau to make you an offer ,I was sent on behalf of the bureau to make you an offer,73
343,לזה אני מחכה ,That's what I've been waiting for ,That's what I'm waiting for,83
344,הלשכה מוכנה לתת לך להשאיר את הציפורים ,Now the bureau is willing to let you keep your birds ,The bureau is ready to let you leave the birds,71
345,אתה תוכל אפילו למכור אותם ,You can even sell 'em ,You will even be able to sell them,63
346,זוהי הצעה רשמית שלהם ,Now this is their official proposal ,This is their official offer,76
347,תוכך להמשיך לגדל או למכור את הציפורים אבל הרווחים יופנו לקרן הרווחה של הכלא ואתה תקבל שכר יחסי לרווחים ,You can continue to raise and sell the birds but the profits will be turned over to the prison welfare fund and you will receive a salary in the form of a share of the profits ,You will continue to raise or sell the birds but the profits will be directed to the welfare fund of the prison and you will receive a relative salary for the profits,84
348,10דולר לחודש ,10 dollars a month ,$ 10 a month,71
349,אני רואה את זה כהצעה נדיבה בהתאם לנסיבות ,I consider that quite a generous offer under the circumstances ,I see this as a generous offer depending on the circumstances,70
350,בכנות זה יותר ממה שאני הייתי מציע אם היתה לי את הסמכות ,Frankly it's more than I would have offered had I the authority ,Honestly this is more than I would suggest if I had the authority,70
351,ובכן סטראוד ,Well Stroud ,Well Stroud,100
352,בוא נראה אם הבנתי אותך ,Let me see if I understand you ,Let's see if I understood you,88
353,ההצעה שלך אומרת שממשלת ארצות הברית נכנסת לעסקיי הקנריות ,You're proposing that the US government go into the canary-bird business ,Your proposal says the United States government is getting into the canary business,76
354,זה נוגד את העניין של עסקים פרטיים ,That's against private enterprise ,This goes against the interest of private businesses,61
355,-אין לך זכות משפטית לגדל קנריות ,- You have no legal right to raise canaries ,- You have no legal right to grow canaries,86
356,-אני יודע ,- I know ,-I know,100
357,"חוק 60 של הלשכה הפדרלי של הכלא קובע: ""אסיר לא רשאי להפעיל עסק גם אם הוא חוקי בעודו בכלא ""","Rule 60 of the Federal Bureau of Prisons Manual: ""An inmate cannot be permitted to operate a business no matter how legitimate while in prison ""","Law 60 of the Federal Bureau of Prisons states: ""An inmate may not operate a business even if it is legal while in prison""",76
358,זה מה שחשבתי ,That's what I thought ,I thought so,67
359,לכן אני מבולבל ,That's why I'm confused ,That's why I'm confused,100
360,החוק אומר שאני לא יכול לנהל עסק ,The rule says I can't have a business ,The law says I can not run a business,78
361,אתה אומר לי שאני יכול בתנאי שאני אתן לך את הרווחים ,You say I can provided I give you the profits ,You tell me I can on the condition that I give you the profits,67
362,מר שומקר הגיע כל הדרך מוושינגטון להציע לך תוכנית בעזרתה תוכל להשאיר את הציפורים הארורות שלך ,Mr Shoemaker came to try to work out a plan so you can keep your blasted birds ,Mr. Schumker has come all the way from Washington to offer you a plan with which you can leave your damn birds,61
363,הוא הגיע בגלל דעת הקהל ואתה יודע את זה ,He came because of public opinion and you know it ,He came because of public opinion and you know it,100
364,50 000חתימות על עצומה ,50 000 signatures on a petition ,"50,000 signatures on petition",97
365,האם זו המילה האחרונה שלך ,Is that your last word ,Is that your last word,100
366,בשביל הציפורים ,For my birds ,For the birds,80
367,אני אדווח על הפגישה שלנו למר מק'לאוד ,I'll report the minutes of our conference to Mr MacLeod ,I will report on our meeting to Mr McLeod,65
368,זה הכל קומסטוק ,That's all Comstock ,It's all Comstock,78
369,שתהייה לך נסיעה טובה חזרה לוושינגטון ,Have a nice trip back to Washington ,Have a good trip back to Washington,86
370,אני לא חוזר לוושינגטון ,I'm not going back to Washington ,I'm not going back to Washington,100
371,אלקטרז ,Alcatraz ,Alcatraz,100
372,אני מאחל לך בהצלחה ,I wish you luck ,I wish you good luck,86
373,תודה ,Yes thanks ,Thanks,75
374,רק תזכור דבר אחד בוב ,Keep one thing in mind Bob ,Just remember one thing Bob,60
375,לציבור יש זיכרון קצר ,The public has a short memory ,The public has a short memory,100
376,שמעת את זה ,You hear that ,did you hear that,87
377,את יודעת מה זה ,You know what that is ,You know what it is,80
378,זה פַּטִּישׁ אֲוִיר ,It's a jackhammer ,It's an air hammer,69
379,את יודעת מה זה עושה ,I don't know what you mean ,You know what it does,77
380,-לא לא הודיעו לי עדיין ,- No I haven't been informed as yet ,- I have not been notified yet,72
381,-הם הורסים את הקיר של התא שלי ,- They're tearing down the wall of my cell ,- They're destroying the wall of my cell,79
382,-אני עומד לקבל שני תאים עבור הציפורים שלי ,- I'm gonna have two cells for my birds ,- I'm about to get two cells for my birds,76
383,-כמה נחמד ,- How nice ,-how nice,100
384,אני מקבל יחידת מגורים גדולה יותר וציוד מעבדה ,I get larger quarters and even some laboratory equipment ,I get a larger living unit and lab equipment,66
385,מה דעתך על זה ,And do you know what it's doin' ,What do you think about this,66
386,שתי נשים ואסיר ואנחנו נכניס את הלישכה למבויי סתום ,Two women and a con and we whipped the bureau to a standstill ,Two women and a prisoner and we'll put the bureau in a dead end,68
387,אלו אכן חדשות טובות מאוד ,That's very good news indeed ,This is indeed very good news,84
388,היו ימים שאני הייתי הראשונה לדעת ,Of course there was a time when I would have been the first to know ,There were days I was the first to know,66
389,זה ניצחון של ממש אמא ,It's a real victory Mother ,It's a real victory mom,90
390,עליי להודות לך ולסטל ,And I got you and Stell to thank ,I have to thank you and Stell,85
391,שב רובי ,Sit down Robbie ,Sit down Ruby,79
392,-אני רוצה לדבר איתך עליה ,- I want to talk to you about her ,- I want to talk to you about her,100
393,-על סטלה ,- About Stella ,- About Stella,100
394,הקשר שלך איתה יביא לך רק צרות ,Your association with her will bring you nothing but trouble ,Your relationship with her will only bring you trouble,72
395,אני לא יודע למה את מתכוונת ,I don't know what you mean ,I do not know what you mean,94
396,היא הצילה אותי ,She saved my bacon ,She saved me,73
397,היא סייע לך אבל היא שרתה את המטרות שלה ,She was of use temporarily but she's served her purpose ,She helped you but she served her purposes,70
398,ועכשיו אם תקשיב לעצתי תיפטר ממנה ,And now if you'll follow my advice you'll get rid of her ,And now if you listen to my advice you will get rid of her,79
399,אני לא מבין על מה את מדברת אמא ,I don't understand what you're talkin' about Mom ,"I do not understand what you're talking about, Mom",92
400,היא אשתי ,She's my wife ,She's my wife,100
401,הצרות שלך החלו עם האישה האחרת באלסקה ,Your trouble began with that other woman in Alaska ,Your troubles started with the other woman in Alaska,84
402,היא אותו סוג של אישה ,She's the same kind of a woman ,She's the same kind of woman,97
403,-הוא בחורה הרפתקנית ,- She's a common adventuress ,- He's an adventurous girl,60
404,היא אישה טובה ,She's a good woman ,She's a good woman,100
405,היא טובת לב ,And she's kind ,She is kind-hearted,67
406,והיא תעשה הכל עבורי ,And she'd do anything in the world for me ,And she will do anything for me,81
407,זה אסון רובי ,It's disaster Robbie ,This is a ruby ​​disaster,70
