,hebrewFromSub,englishFromSub,englishTranslation,ratio
0,אני מכיר אותך כבר 12 שנים סטראוד ,12 years I've known you Stroud ,I've known you for 12 years Stroud,94
1,במשך 12 שנים אני מסתכל על הפרצוף הקפוא שלך ,12 years sun up and sun down I've had to look at that frozen mug of yours ,For 12 years I've been looking at your frozen face,62
2,"ובמשך כל הזמן הזה לא שמעתי אותך אומר ""מה שלומך"" ",And in all that time never so much as a how-de-do out of you ,"And all this time I have not heard you say ""how are you""",65
3,אני משתדל להתנהג אלייך בכבוד כי החיים שלך לא ממש קלים ,I try to treat you decent cos you got no bed of roses ,I try to treat you with respect because your life is not really easy,63
4,או שאולי אני פשוט לא שמעתי אותך ,Or maybe I just didn't hear you ,Or maybe I just did not hear you,89
5,אתה רוצה בקבוק משקה תוסס ,You want a pop bottle ,You want a bottle of fizzy drink,72
6,אתה רוצה בקבוק משקה תוסס ,You want a pop bottle ,You want a bottle of fizzy drink,72
7,"האם אני לפעמים שומע אולי את המילה ""בבקשה"" ","Do I hear maybe the word ""please"" someplace ","Do I sometimes hear the word ""please""",82
8,או אולי אני חרש ,Or maybe I just didn't hear you ,Or maybe I'm deaf,62
9,"אתה אומר לי ""תעביר לי את התיבה"" כאילו שהיית הצאר של רוסיה או משהו כזה ","""Hand over the box"" says you like you was the tsar of Russia or somebody ","You tell me ""pass me the box"" as if you were the Tsar of Russia or something",67
10,תבין את זה בשבילך אני אדם במדים אבל אתה לא מביע את הרגשות שלך ,You get this I may be just a uniform to you but you got no patent on feelings ,Understand this for you I am a person in uniform but you do not express your feelings,67
11,אני גבר בדיוק כמו שאתה ואני רוצה שיתייחסו אלי בהתאם ,I'm a man the same as you and I wanna be treated like one ,I am a man just like you and I want to be treated accordingly,68
12,מר רנסום ,Mr Ransom ,Mr. Ransom,100
13,-אתה יודע מה אני חושב בול ,- You know what I think Bull ,- You know what I think Bull,100
14,-לא מעניין אותי מה אתה חושב ,- You know what I think Bull ,- I do not care what you think,74
15,אני חושב שאתה צודק בהחלט ,I think you're absolutely right ,I think you are absolutely right,92
16,אתה תמיד התייחסת אלי כראוי ,You always treated me square ,You have always treated me properly,76
17,היית טוב כלפיי ,You been good to me ,You were kind to me,63
18,יש משהו שאני רוצה לעשות ,So there's something I wanna do ,There's something I want to do,85
19,אני רוצה להתנצל בפניך ,I wanna apologise to you ,I want to apologize to you,84
20,לא התנצלתי בפני אף אחד במשך 20 שנים ,I ain't apologised to anybody in 20 years ,I have not apologized to anyone for 20 years,73
21,-היי סטראוד ,- Hey Stroud ,- Hi Stroud,84
22,הציפור שלי לא שרה ,My bird won't sing ,My bird did not sing,63
23,הוא חולה ,Is he sick ,He is sick,100
24,אני אבדוק אותו ,I'll check him ,I'll check it out,77
25,אתה חולה ג 'ק הקנרית הקטנה שלי ,You sick little baby canary Jack ,You're sick of my little canary Jack,79
26,"תגיד ""טוויטי-די"" מתוק שלי ","Say ""tweety-dee"" sweetheart ","Say my sweet ""Tweety-D""",78
27,ציוץ ציוץ ציוץ ציוץ ,Tweet tweet tweet tweet ,Tweet Tweet Tweet Tweet,100
28,אני לא יודע ,I don't know ,I do not know,88
29,האם נתת לו לאכול חגבים וחרקים כפי שביקשתי ממך ,You been giving him special feedings of grasshoppers and bugs like I told you ,Did you let him eat grasshoppers and insects as I asked you to,66
30,אני לא מוצא!,I can't find any!,I can not find!,80
31,מה אתה רוצה שאני יעשה ,What do you want me to do ,what do you want me to do,100
32,יש לך גישה לציפורים ,You got a way with birds ,You have access to birds,62
33,קח את ג'ק לזמן מה בסדר ,You take Jack for a while huh ,"Take Jack for a while, okay?",76
34,מה עם אוכל לציפורים ,What about birdseed ,What about bird food,82
35,בסדר אני אחלוק את שלי איתך ,All right I'll split mine with you ,Okay I'll share mine with you,67
36,-מה את אומר ,- What do you say ,- What are you saying?,76
37,-בסדר ,OK ,-OK,100
38,רק למשך שנה ואז אני רוצה אותו חזרה ,Only for about a year or so and then I want him back ,Only for a year and then I want it back,84
39,בסדר ,OK ,OK,100
40,מה דעתך על זה סטראוד ,Well how about it Stroud ,How about this Stroud,76
41,האם הוא חולה ,Is he sick ,Is he sick,100
42,-אני לא חושב כך ,- I don't think so ,-I dont think so,90
43,-למה הוא לא שר ,- Why don't he sing ,- Why he does not sing,76
44,קנרית נקבה ,Lady canary ,Female canary,67
45,-אתה מתכוון לקנרית של ג'ק ,- You mean Jack's a broad canary ,- You mean Jack's canary,85
46,ובכן ביש מזל בוב ,Well tough luck Bob ,Well unlucky Bob,74
47,אתה תקוע עם ציפור שלא שרה ,You're stuck with a bird that don't sing ,You're stuck with a bird that does not sing,92
48,תצטרך להשתמש בהרבה אוכל לציפורים אה ,Use up a lot of birdseed huh ,You'll have to use a lot of bird food ah,62
49,(גאדיס) בעזרת סכין גילוח וחתיכות זכוכית סטראוד הכין 128 רצועות מעץ,Working with a razor blade and a jagged piece of glass ,"(Gadis) Using a razor and pieces of glass, Stroud made 128 strips of wood",65
50,בנוסף ללוחות עבור גגות מתקן שתיה שער כניסה וידיות ,Stroud cut 128 slats in addition to roof boards tier bars gate pieces and a handle ,In addition to panels for roofs drinking facility entrance gate and handles,60
51,הוא בנה את כלוב הציפורים במשך 7 חודשים ,The birdcage took seven months to complete ,He built the birdcage for 7 months,61
52,בוב עשית חתיכת עבודה שם ,Bob that's a hell of a job you did there ,Bob did a piece of work there,61
53,לא רע ,Not bad ,Not bad,100
54,-הבא יהיה טוב יותר ,- Next one'll be better ,-Next will be better,75
55,-הבא ,- The next one ,-the next,80
56,למה אתה רוצה עוד אחת ,What do you want another one for ,Why do you want another one,88
57,אדון וגברת ,Mr and Mrs ,Mr. and Mrs,100
58,-חיים חדשים ,- New life ,-new life,100
59,לידה ,Birth ,Birth,100
60,-כן ,- Yep ,-Yes,67
61,ובכן אני מניח שלא יהיה להם אכפת ,Well I guess they won't mind ,Well I guess they will not care,75
62,קנריות נמצאות בכל מקרה מאחורי סורגים ,Canaries are always behind bars anyway ,Canaries are in any case behind bars,76
63,עדיף שתגלה מי אתה ,You best go find out who you are ,You better find out who you are,89
64,אל תפחד ,Don't be afraid ,Do not be afraid,90
65,תוכל לרקוד לצלילי מוזיקה משעשעת ,You can dance to fiddle music ,You can dance to the sounds of amusing music,60
66,אם אתה רוצה תוכל לצאת לחופשי ,If you like you can  see gold teeth ,If you want you can go free,62
67,תטעם ויסקי מתוק או רוטב טעים ,Taste sweet whisky and red-eyed gravy ,Taste a sweet whiskey or a delicious sauce,66
68,האויר נע בקלות הלילות ארוכים יותר הזמן עובר מהר ,The air breathes easy nights move faster and you tell time by the clock ,The air moves easily the longer nights time passes quickly,64
69,אתה לא רוצה להיות אסיר כל החיים שלך נכון ,Now you don't wanna be a jailbird all your life do ya ,You do not want to be a prisoner all your life right,65
70,אז תעוף גבוה תרנגול זקן ,So you fly high old cock ,So fly high old rooster,68
71,צא החוצה ותנשך את הכוכבים עבורי ,Go out there and bite the stars - for me ,Get out there and bite the stars for me,96
72,תמצא לעצמך אמא שמנה ותקים משפחה ,Find yourself a fat mama and make a family ,Find yourself a fat mom and start a family,86
73,אתה שומע ,You hear ,you hear,100
74,היי סטראוד ,Hey Stroud ,Hi Stroud,84
75,-הציפור שלי הטילה ביצה אה ,- My bird laid an egg ,-My bird laid an egg ah,93
76,-הציפור שלי הטילה ביצה ,- My bird laid an egg ,- My bird laid an egg,100
77,למה נבלה שכמותך!,Why you stinkin' crook!,Why spend like you!,62
78,אני רק השאלתי לך את הקנרית!,I only loaned you my canary!,I just lent you the canary!,60
79,למשך שנה ,For a year ,For a year,100
80,אני רוצה חצי מהביצים ,I want half them eggs ,I want half the eggs,98
81,אתה רוצה להכין חביתה ,You gonna make an omelette ,You want to make an omelet,73
82,ובוגד!,And a rat!,And a traitor!,82
83,כמה סטראוד ,Hey Stroud ,Some stroud,76
84,שניים ,Two ,two,100
85,כמה סטראוד ,Hey Stroud ,Some stroud,76
86,שלושה ,Three ,three,100
87,רמאי מלוכלך ,Dirty crook ,Dirty cheater,67
88,ארבע ,Four ,Four,100
89,היי סטראוד ,Hey Stroud ,Hi Stroud,84
90,משהו קורה שם ,What's goin' on in there ,Something's going on there,61
91,עברו 20 ימים ו18 שעות ,Now it's been 20 days and 18 hours ,20 days and 18 hours have passed,67
92,מה קורה שם ,What's goin' on in there ,What is going on there,89
93,-היי בוב מה הרעש הזה שם ,- Hey Bob what's that noise in there ,-Hey Bob what is this noise there,79
94,-שקט פאטו ,- Quiet Feto ,- Quiet Pato,80
95,סטראוד פיתח מִיקְרוֹקוֹסְמוֹס (עולם זעיר) בעזרת הציפורים שלו ומאחר והוא היה מוגן והוא ידע כי הם לא יבגדו בו,And because it was safe and he knew they would never turn on him he developed a deep but private love for his canaries as he watched the cycle of love and mating and issuing forth ,Stroud developed a microcosm (tiny world) with the help of his birds and since he was protected and he knew they would not betray him,60
96,הוא פיתח אהבה עמוקה כלפי הקנריות שלו בעודו מתבונן במחזור החיים הזדווגות ולידה ,And because it was safe and he knew they would never turn on him he developed a deep but private love for his canaries as he watched the cycle of love and mating and issuing forth ,He developed a deep love for his canaries as he watched the life cycle mating and birth,62
97,ואז ביום אביבי אחד חבר ותיק חזר ,Then one spring day an old friend came back ,Then one spring day an old friend came back,100
98,מה לעזעזאל אתה עושה פה ,What the hell are you doin' back here ,What the hell are you doing here,91
99,קשה מדי שם בחוץ הא ,Too tough out there huh ,Too hard out there ha,73
100,חזרת לקבל מעט תחושת בטחון בכלא ,Come back for a little prison security ,You came back to get a little bit of a sense of security in prison,65
101,אני מניח שאתה אסיר עולם חבר בדיוק כמוני ,I guess you're a lifer pal just like me ,I guess you're a friend prisoner just like me,74
102,היי סטראוד ,Hey Stroud ,Hi Stroud,84
103,כי הן חולות וגם אני ,Because they're sick and so's mine ,Because they are sick and so am I.,78
104,היי סטראוד ,Hey Stroud ,Hi Stroud,84
105,"""ישנה מחלה מדבקת שתוקפת ""ציפוריםשנקראתקדחתזיהומית ","""Dreaded among breeders is a highly contagious disease called septic fever ""","""There is a contagious disease that attacks"" birds called infectious fever",65
106,-בוב!,- Bob!,-Bob!,100
107,-שקט גומז ,- Quiet Feto ,- Quiet Gomez,67
108,"""המוות עשוי להיות מהיר או להתעכב"" ","""Death may be rapid or delayed ""","""Death may be quick or delayed""",86
109,"""הצואה חריגה ובצבע צהוב חיוור"" ","""Faeces are abnormal and always pale yellow in colour ""","""The stool is abnormal and pale yellow""",61
110,סטראוד ,Stroud ,Stroud,100
111,מצאתי בסילוס-פסטאורלה בכמויות גדולות (חיידקים הנמצאים בציפורים) ערכתי ניחוש מושכל שמדובר על וירוס שניתן לרפא אותו ,I found Bacillus pasteurella in great quantity I'd make an educated guess that there's a filterable virus ,I found in silos-pasteurella in large quantities (bacteria found in birds) I made an intelligent guess that it is a virus that can be cured,64
112,יתכן ,Possibly ,It is possible,64
113,האם ישנם חומרים כימיים או תרופות או משהו ,Are there any chemicals or medicines or anything ,Are there chemicals or drugs or something,63
114,לא מצאתי ספרות כלשהי על המחלה ,I couldn't find any literature on the disease ,I did not find any literature on the disease,85
115,אז ללא תרופות ספציפיות אני חושש שאינני יכול לעזור יותר ,So without any specific drug I'm afraid there isn't much I can do to help ,So without specific medications I'm afraid I can no longer help,68
116,תודה דוק ,Thanks Doc ,Thanks Doc,100
117,אני מעריך את מה שעשית ,I appreciate what you done ,I appreciate what you did,90
118,מצטער ,Sorry ,Sorry,100
119,הוא לא היה ממש ציפור ,He wasn't much of a bird ,He was not really a bird,67
120,ניסיתי להיפטר ממנו ביום שישי האחרון ,Tried to get rid of him as late as last Friday ,I tried to get rid of him last Friday,84
121,אני הזהרתי אותו אבל הוא לא הקשיב לי ,I warned him but he wouldn't listen to me ,I warned him but he did not listen to me,84
122,הוא היה יותר מדי חכם ,He was too smart ,He was too smart,100
123,הוא מעדיף להתעסק עם הקירות מאשר לדבר עם מישהו ,He'd rather have the walls than somebody to talk to ,He would rather mess with the walls than talk to someone,75
124,הוא לא הספיק הרבה ,He didn't amount to much ,He did not have much time,61
125,היי בוב ,Hey Bob ,Hi Bob,77
126,אתה מכיר את אייפ ,You know Ape ,You know Ape,100
127,הציפור הקטנה שהעברת לי ,The baby bird you slipped me ,The little bird you passed on to me,60
128,הוא צנח כאילו הוא נורה בראשו ,He dropped like he got shot in the head ,He fell as if he had been shot in the head,64
129,הוא מזכיר לי חברה ותיקה שלי ששמה פגי  ,Reminded me of an old girlfriend of mine named Peggy  ,He reminds me of an old friend of mine named Peggy,90
130,בימן ,Beeman ,Biman,73
131,איזה פנים ,What a face ,What a face,100
132,כמו אסלה מלאה תולעים ,Like a pan full of worms ,Like a toilet full of worms,82
133,איזה גוף היה לה ,What a face ,What a body she had,60
134,היה לה לב רחב אתה יודע ,Good-hearted broad you know ,She had a wide heart you know,64
135,כמו גם עם כל הח'ברה האחרים בשכונה ,And every other guy in the neighbourhood ,As well as with all the other guys in the neighborhood,68
136,חסרת ערך במילים אחרות ,A bum in other words ,Worthless in other words,64
137,גם לה היתה ציפור תוכי ,Well she had a bird too A parrot ,She also had a parrot bird,79
138,וגם הוא היה מכוער ,And he too was ugly also ,"And he, too, was ugly",88
139,פעם אחת ניגשתי לחדר שלה והדלת הייתה פתוחה והיא ניסתה ללמד את התוכי לומר משהו ,And one time I came up to her room and the door was open and she was tryin' to teach the parrot to say somethin' ,I once went to her room and the door was open and she was trying to teach the parrot to say something,88
140,אתה יודע מה היא רצתה שהוא יאמר ,You know what she wanted him to say ,You know what she wanted him to say,100
141,"""אני אוהב אותך פגי"" ","""I love you Peggy ""","""I love you Peggy""",100
142,"פעם אחר פעם אתה יודע היא אמרה לו ""אני אוהב אותך פגי"" ","Over and over you know she kept at him ""I love you Peggy ""","Time and time again you know she told him ""I love you Peggy""",67
143,הו שני המכוערים האלה ,Oh them two uglies ,Oh those two ugly ones,70
144,חשבתי שהיא קצת משוגעת אז מעולם לא ראיתי אותה לאחר המקרה הזה ,I figured she was some kinda nut so I never seen her no more after that time ,I thought she was a little crazy so I never saw her after this incident,63
145,פג הטובה ,The birds died ,The good expired,60
146,אז מה קרה ,So what happens ,so what happened,90
147,אני הגעתי לבית הכלא ואני מדבר עם ציפורים בדיוק כפי שהיא עשתה ,So I wind up in the can and I'm talking to the birds just like she did ,I got to jail and I talk to birds just like she did,71
148,אתה יודע  ,You know  ,You know,100
149,אני חייב להודות ,I gotta admit it ,I must admit,64
150,בפעם הראשונה מאז שנכנסתי לכלא הקנריות גרמו לי להרגיש טוב ,for the first time since I been in stir them baby canaries they make me feel good ,For the first time since I went to the canary prison made me feel good,72
151,היי סטראוד מה אני אמור לעשות איתו הא ,Hey Stroud what am I supposed to do with him huh ,Hi Stroud what am I supposed to do with him ha,91
152,היי בוב ,Hey Bob ,Hi Bob,77
153,הוא כתב לאמא שלו ביקש ממנה שתביא לו את התרופות האלה וציוד נוסף ,He wrote to his mother asking for these drugs plus equipment ,He wrote to his mother asking her to bring him these medicines and other equipment,70
154,בעודו ממתין הוא ניסה להכין תרופות עבור הציפורים שלו כמו פתרון הגופרית שהוא הכין מגפרורים ,While waiting he tried fantastic concoctions on his birds like a sulphur solution made from the heads of matches ,While waiting he tried to make medicine for his birds like the sulfur solution he made from matches,77
155,הציפורים מתו במהירות ,The birds still died ,The birds died quickly,81
156,החבילה עם התרופות והציוד הגיע מאמא שלו ,The package of drugs and equipment came from Mother ,The package with the medicine and equipment came from his mother,73
157,עם מעט מאוד ידע לגבי כמות הכימיקלים שקנריות יכולות לקבל ,With little or no knowledge of the amount of chemicals a canary could tolerate ,With very little knowledge about the amount of chemicals that canaries can get,74
158,סטראוד החל לספק את התרופות שלו לציפורים החולות ,Stroud proceeded to administer the oxidisers to his sick birds ,Stroud began to supply his medicine to the sick birds,68
159,ברור שהתרופות האלה לא היו מתאימות לקדחת הזיהומית אבל סטראוד המשיך והכין תרופות במינונים שונים ,Clearly this drug was no cure for septic fever but Stroud persisted trying different combinations ,It is clear that these drugs were not suitable for infectious fever but Stroud continued to prepare drugs in different doses,62
160,הציפורים עדיין מתו ,The birds still died ,The birds are still dead,86
161,עם זאת לסטראוד היתה תגלית אחת:,However Stroud made one discovery:,"However, Stroud had one discovery:",86
162,לפני מות הציפורים טמפרטורת הגוף שלהם חזרה להיות רגילה ,Before death their temperature dropped to normal ,"Before the birds died, their body temperature returned to normal",72
163,הוא הסיק שהכימיקאלים היו חזקים מידיי צורבים מידיי ,He concluded the chemicals were too harsh too caustic ,He concluded that the chemicals were too strong and too stinging,74
164,הוא החליט למתן אותם בעזרת סודה מוגזת ,He decided to buffer them with effervescent sodas ,He decided to moderate them with carbonated soda,70
165,הציפורים מתו ,The birds died ,The birds died,100
166,היי סטראוד!,Hey Stroud!,Hey Stroud!,100
167,מתי אתה מתכוון למצוא תרופה לציפורים שלי ,When you gonna find a medicine for my birds ,When are you going to find a cure for my birds?,74
168,הם צונחים כמו זבובים ,They're droppin' like flies!,They fall like flies,70
169,-אנחנו פשוט צריכים לחכות ,- We'll just have to wait ,- We just have to wait,93
170,-לחכות ,- Wait ,-wait,100
171,אני הולך להרוג את כולם!,I'm gonna kill 'em all!,I'm going to kill everyone!,60
172,ציטרוקרבוניט ,Citrocarbonate ,Citrocarbonite,93
173,הוא ערבב את זה עם אשלגן כלורי ,He combined this with potassium chlorate ,He mixed it with potassium chloride,69
174,-השעה שלוש בוב ,- Three o'clock Bob ,- Three o'clock Bob,100
175,-תודה ג 'ונסון ,- Thanks Johnson ,-Thanks Johnson,100
176,היי בוב ,Hey Bob ,Hi Bob,77
177,מה קרה ,What happened ,What happened,100
178,מדוע הציפור שרה ,Why is that bird singing' ,Why the bird sang,73
179,מצאת תרופה ,Your second prize ,You found a cure,61
180,(גאדיס) השנים חלפו והשמועות על התרופה של סטראוד הגיעו לכל מגדלי הציפורים ,The years passed and news of Stroud's medicine spread to the gentle world of bird owners ,(Gadis) The years have passed and rumors of Stroud's cure have reached all the bird breeders,61
181,אנשים התחילו לתהות מיהו אותו רופא ציפורים ,People began to wonder who this strange new bird doctor was ,People began to wonder who that bird doctor was,87
182,לבסוף מישהו נהייה מאוד סקרן ,Finally someone got curious ,Eventually someone gets very curious,76
183,בוב האם השתתפת בתחרות באחד מאותם מגזינים של קנריות ,Bob did you enter some kind of a contest in one of those canary magazines ,Bob the mother participated in a contest in one of those canary magazines,73
184,זכיתי בפרס השני - רולר של קנרית ,I won second prize - a roller canary ,I won the second prize - a canary roller,94
185,ובכן מוטב שתלך לקחת את זה ,Well you'd better go pick it up ,Well you better go take it,81
186,זה נמצא במשרדו של הסגן ,It's in the deputy's office ,It's in the lieutenant's office,69
187,טוב ,Good ,are good,67
188,-מה קרה ,What happened ,-What happened,100
189,-לא כלום ,- Not a thing ,-Nothing,78
190,אתה וודאי מר סטראוד ,You must be Mr Stroud ,You must be Mr. Stroud,100
191,הנה זה ,The birds died ,there it is,64
192,הפרס השני ,Your second prize ,The second prize,79
193,אני גברת סטלה ג 'ונסון ,I'm Mrs Stella Johnson ,I'm Mrs. Stella Johnson,100
194,אני הצעתי את הפרס ,I offered the prize ,I offered the prize,100
195,-מי נתן לך להיכנס ,- Who let you in ,-Who let you in,100
196,זה לקח שלושה ימים ,It took three days ,It took three days,100
197,ובכן אני מניחה שאתה תוהה מדוע אני כאן ,Well I suppose you wonder why I'm here ,Well I guess you're wondering why I'm here,80
198,אז התחלתי לתהות מי זה רופא הציפורים החדש ,So I began to wonder who this new bird doctor was ,So I started wondering who the new bird doctor is,71
199,וכשזכית בפרס שהצעתי הסקרנות שלי גברה ,And when you won the prize I put up my curiosity really got the best of me ,And when you won the prize I offered my curiosity increased,69
200,אז הייתי חייבת לגלות למי שייך תא דואר מספר 7 לונוורט קנזס ,So I just had to find out who Box 7 Leavenworth Kansas was ,So I had to find out who mailbox number 7 belongs to Newvert Kansas,70
201,אז אני ,So I  ,so I,100
202,כתבתי מכתב לדוור בלונוורט ושאלתי אותו והוא אמר לי שזה שייך לכלא הפדרלי ,I wrote to the postmaster at Leavenworth and asked him and he told me it was the federal penitentiary ,I wrote a letter to the postman at Lonoworth and asked him and he told me it belonged to the federal prison,76
203,למה באת לראות אותי ,Why did you come to see me ,Why did you come to see me?,100
204,ובכן תבין אני גרה בשלביברי אינדיאנה ,Well you see I live in Shelbyville Indiana ,Well understand I live in Shibibri Indiana,67
205,וביקרתי את בן דודי בסנט לואיס ולונוורט לא כל כך רחוק משם  ביקרת בסנט לואיס וסחבת אותו איתך את כל הדרך ,And I was visiting a cousin in St Louis and Leavenworth isn't far  You were visiting in St Louis and you carried him all the way with you ,And I visited my cousin in St. Louis and Lonworth not so far away you visited St. Louis and carried him with you all the way,80
