,hebrewFromSub,englishFromSub,englishTranslation,ratio
768,אדוני השוטר אין משהו שאנחנו יכולים לעשות בקשר לזה ,Officer isn't there something we can do about this ,"Sir, there's nothing we can do about it",70
769,או היי אל ,Oh hi Al ,Or hey al,71
770,בדיוק הייתי בחוץ בודק את המכונית ,I was just outside checking the car ,I was just outside checking the car,100
771,הנה החזיות שלך אדוני ,Here are your bras sir ,Here are your bras sir,100
772,לא אין לי שולחן פינג פונג ,No I don't have a Ping-Pong table ,No I do not have a ping pong table,90
773,אתה סטרייט ,Are you straight ,You're straight,97
774,השערות על החזה שלי כן ,The hairs on my chest are ,Hair on my chest yes,80
775,או אלוהים ,Oh good ,or God,77
776,אולי אתה יכול לעזור לי ,Maybe you can help me ,Maybe you can help me,100
777,אם היית החבר שלי היית אוהב את זה ,If you were my boyfriend would you like this ,If you were my boyfriend you would love it,86
778,האם הוא היה אוהב את זה ,Will he like it ,Would he like it,84
779,או שאתה חושב שהוא יאהב את זה יותר בלי החזיה ככה ,Or do you think he'd like it better without the bra like this ,Or do you think he would love it more without the bra like that,73
780,כן אתה צודק ,Yeah you're right ,Yes you are right,88
781,אני לא צריכה את החזיה ,I don't need the bra ,I do not need the bra,93
782,את יודעת הם משנים כל דבר טוב ,You know they change everything good ,You know they change everything good,100
783,את זוכרת את התחנת דלק ,Remember full-service gas stations ,Do you remember the gas station?,65
784,הם היו נותנים לך דלק מחליפים לך שמן ושוטפים לך את החלונות ,They used to give you gas change your oil and wash your windows ,"They would give you fuel, change your oil and wash your windows",83
785,עכשיו הם רק מסתכלים מתחת לשמלה שלך ואומרים תשלמי לפני התדלוק,"Now they just look up your dress say ""Pay before you pump """,Now they just look under your dress and say pay before refueling,80
786,ואמריקה פויה הם עושים את זה גם בתוכניות טלויזיה ,"and ""America phooey "" They do it with TV shows too ",And America Poya they do that in TV shows too,83
787,זוכרת את משימה בלתי אפשרית ,Remember Mission: Impossible ,Remember the impossible task,69
788,הם ביטלו אותה ,They canceled it ,They canceled it,100
789,למה הם החליפו אותה עם ,What did they replace it with ,Why did they replace her with,86
790,משימה בלתי אפשרית אני מתגעגע לטייפ שמונה ערוצים ,Mission: Impossible I miss eight-track tapes ,Impossible Task I miss the eight-channel tape,73
791,אני לא משלמת לך בשביל לדבר יקירי ,I'm not paying you to speak dear ,I'm not paying you to talk darling,85
792,היי אמא ,Hi Mom ,Hi Mom,100
793,אבא מת ,Dad dead ,Dad is dead,84
794,לא ,No ,No,100
795,אוקי אז אני מניח שזה זמן טוב לדון בדמי הכיס החדשים שלי ,Well then I guess this is a good time to discuss my new allowance ,Ok so I guess this is a good time to discuss my new out-of-pocket expenses,69
796,אל תדאג באד ,Don't worry Bud ,Do not worry about Bud,76
797,הוא רק רקדן אקזוטי שגברת רודס קנתה לאמא ליום הולדת ,He's just an exotic dancer that Mrs Rhoades got for Mommy's birthday ,He's just an exotic dancer that Mrs. Rhodes bought for Mom for her birthday,86
798,הוא רק מושכר ,It's just a rental ,He's just rented,71
799,היי אמא ,Hi Mom ,Hi Mom,100
800,אבא מת ,Dad dead ,Dad is dead,84
801,רק ברוחו ,Just in spirit ,Only in his spirit,62
802,טוב אני חייב ללכת ,Well  I gotta go ,Well I have to go,69
803,בחינת בר מחר ,Bar exam tomorrow ,Bar exam tomorrow,100
804,יום הולדת שמח גברת ,Happy birthday ma'am ,Happy birthday lady,82
805,אתה מאד מוכשר ,You're under arrest ,You are very talented,65
806,או כן ,Yes ,or yes,67
807,דלת ראשונה מימין ,First door on the right ,First door on the right,100
808,פשוט תעקוב אחרי שביל הדמעות אני יודע שזה לא ירשים אחרי זה ,Just follow the trail of tears [CLEARS THROAT] I know it's anticlimactic but we got you some presents too ,Just follow the trail of tears I know it will not impress after that,62
809,אבל יש לנו גם מתנות בשבילך הו לא הייתם צריכים לעשות את זה ,Oh you didn't have to do that ,But we also have gifts for you oh you did not have to do that,60
810,אמרתי לך שלא היינו היינו צריכים לעשות את זה ,I told you we didn't have to do this ,I told you we did not have to do this,96
811,למה אני מקשיב לך ,Why do I listen to you ,Why I'm listening to you,83
812,זה היום הולדת של אמא ,It's Mom's birthday ,It's Mom's birthday,100
813,הנה תפתחי את ,Drop dead will you ,Here you will open the,65
814,שלי קודם ,Open mine first ,Mine first,80
815,אווו  אל ג'ולסונס הלהיטים הגדולים,Ohhh  Al Jolson's Greatest Hits ,Aww Al Jolson's big hits,67
816,I knew ידעתי שקלי תפציץ עכשיו תפתחי את שלי ,It's a 78 [LAUGHS] I knew Kelly's would bomb ,"I knew Kelly would bomb now, open mine",66
817,שלא כמו קלי ידעתי שאת מדוכאתמהיוםהולדת אז קניתי לך משהו שיגרום לך להרגיש יותר טוב ,Unlike Kelly I knew you were down about your birthday so I got you something to make you feel better ,Unlike Kelly I knew you were depressed from the birthday so I bought you something that will make you feel better,79
818,מסיר קמטים של האתמול ,Mrs Yesterday's Wrinkle Remover ,Removes wrinkles from yesterday,87
819,מסיר את השנים ,"""Smear the years away """,Removes the years,65
820,את יודעת אני אומרת לך כיש לך משפחה טובה יש לך הכל ,You know I'm telling you when you got your family you've got it all ,You know I'm telling you you have a good family you have everything,69
821,ובתול ,And a virgin ,And virgin,91
822,אבא אם יש לך שכל תזרוק את המתנה כאילו היא רימון יד תישן בתחנת דלקכמונו ,Dad if you're smart you'll toss the present like a hand grenade and sleep at the bus station like us ,"Dad, if you have any reason to throw away the gift as if it were a hand grenade, sleep at the gas station",67
823,אל זה היום הולדת שלי ,It's Mom's birthday ,To this is my birthday,73
824,איפה היית ,Where have you been ,Where were you,73
825,אוקונומוק ,Oconomowoc ,Okonomok,67
826,אצל פרנסין ,Francine's ,At Francine's,87
827,אני לא יודע ,I don't know ,I do not know,88
828,היית ילדה קטנה וטובה ,Have you been a good little girl ,You were a good little girl,75
829,או סטיב ,Oh Steve ,Or Steve,88
830,הייתי מאד רעה ,I've been very bad ,I was very bad,62
831,כן אלו נישואים בריאים ,Yeah that's a healthy marriage ,Yes this is a healthy marriage,80
832,תנחשי מה קניתי לך ,Guess what I got you ,Guess what I bought you,88
833,זאת החזיה שלי ,Al it's my birthday ,This is my bra,61
834,אני לא מאמינה ,I can't believe this ,I do not believe,67
835,מצאת את זה ,You found it ,You found it,100
836,יש לי עשר מהם אז ככל שהם קיימים לבחורים תמיד יהיה גג מעל הראש ,I got 10 of them so as long as they live the guys will always have a roof over their heads ,I have ten of them so as long as they exist the guys will always have a roof over their heads,87
837,הו אל  אתה האיש הכי חמוד בעולם ,Oh Al  You are the sweetest man in the whole world ,Oh you are the cutest man in the world,71
838,אני יודע ,I know ,I know,100
839,איפה השגת את האזיקים ,Where did you get the handcuffs ,Where did you get the handcuffs,100
840,הו  הם היו מתנה ,Oh  They were a gift ,Oh they were a gift,100
841,אתה לא חושב שאני נהייתזקנהנכון ,Al you don't think I'm getting old do you ,You do not think I'm getting old right,76
842,פג את נראית בדיוק כמו שנראית ביום שהתחתנתי איתך ,Peg you look just the way you did the day I married you ,You expired looks just like you did the day I married you,77
843,ההבדל היחיד הוא שאני לא שיכור ,Only difference is today I'm not dead drunk ,The only difference is that I'm not drunk,83
844,הו אל ,Oh Al ,Oh Al,100
845,אוקי פג שנינו יודעים שזה לא הסוף ,All right Peg we both know this isn't the end of it ,Ok expired we both know it's not the end,64
846,בואי נסיים את זה ,Yeah but let's finish it ,Let's finish it,77
847,בוא נעלה למעלה ,Let's go upstairs ,Let's go upstairs,100
848,את רואה את אף פעם לא מסופקת ,See you're never satisfied ,You see you are never satisfied,81
849,את יודעת מה הייתי צריך לעבור כדי להשיג את המתנה הזאת ,Do you know what I had to go through to get that present ,You know what I had to go through to get this gift,81
850,הייתי צריך לנסוע עד ויסקונסין ,I had to drive to Wisconsin ,I had to drive all the way to Wisconsin,82
851,היתיי צריל לשכנע את סטיב שהוא מושך מינית ,I had to reassure Steve that I find him attractive ,I had to convince Steve he was sexually attractive,66
852,הייתי צריך לשבת בחנות שעה ולהסתכל בכלום חוץ מ  ,I had to sit in the store for an hour and look at nothing but uh  ,I had to sit in the store for an hour and look at nothing but,98
853,כן בואי נעלה למעלה פג מי השוטר עם המכנסיים הפוכות ,Let's go upstairs ,"Yes, let's go upstairs",89
854,תודה לך ,Thank you ,Thank you,100
855,כמו שאלוקים התכוון ,The way God intended ,As God intended,69
856,עכשיו אני באמת חי ,[SIGHS] Now I'm truly alive ,Now I'm really alive,76
857,הילדים בבית ,Are the kids home ,The children at home,65
858,מה איכפת לך ,Drop dead will you ,why do you care,61
859,פשוט חשבתי שנוכל לבלות קצת זמן ביחד ,I was just thinking we could spend some time together ,I just thought we could spend some time together,87
860,נכון שזה נחמד ,Isn't this nice ,True it's nice,62
861,בוא נעשה סקס ,Let's have sex ,Let's have sex,100
862,חכי שניה פג ,Wait a second Peg ,Wait a second expired,84
863,לא עשינו את זה בחודש שעבר ,Didn't we do it last month ,We did not do that last month,80
864,כן אבל בוא נסיים את זה ,Yeah but let's finish it ,Yes but let's finish it,94
865,שב שתוק ותכין את עצמך ,Sit up shut up and brace yourself ,Sit still and prepare yourself,70
866,ילדים תצילו אותי!,[CRYING] Kids save me!,Kids save me!,77
867,אף אחד לא יכול לעזור לך אל ,No one can help you Al ,No one can help you to,86
868,קח אותי למסע של 30 שניות לירח ,Take me on a 30-second trip to the moon ,Take me on a 30-second journey to the moon,84
869,לעזאזל זה יום ההולדת של אמא ,Damn It's mom's birthday ,"Hell, it's Mom's birthday",83
870,בחיים אל תשאירו אותי לבד עם אמא שלכם ,Don't ever leave me alone with your mother again ,Never leave me alone with your mother,75
871,איך היה בבית הספר ,How was school ,how was school,100
872,היה בסדר אמא ,It was fine Mom ,Was fine mom,89
873,זה השבוע האחרון שלנו ,This is our last week ,This is our last week,100
874,כדאי שאני אתחיל להגיע לשם ,Uh-oh I'd better start going ,I should start getting there,64
875,קלי את שוב נכשלת ,Kelly are you failing again ,Kelly you fail again,85
876,תגיד לה משהו אל ,Say something to her Al ,Tell her something to,73
877,לכי לשחק עכשיו ,Now go play ,Go play now,100
878,בוא לא נשכח שאנחנו הורים ,Let's not forget we're parents ,Let's not forget that we are parents,82
879,באמת קלי בטוח יש מישהו בבית הספר שאת יכולה להעתיק ממנו ,Now come on Kelly There must be someone at school you can cheat off ,Really Kelly sure there's someone at school you can copy from,69
880,קלי את חייבת ללכת לבית הספר ,"""Kelly you have to go to school ","Kelly, you have to go to school",100
881,קלי את חייבת לעבור את המבחן ,"""Kelly you have to pass ","Kelly, you have to pass the test",83
882,קלי את חייבת ללמוד לקרוא ,"Kelly you have to learn to read """,Kelly you must learn to read,78
883,איך אני אמורה להתבגר עם כל זה על הראש שלי ,How am I supposed to grow up with this hanging over my head ,How am I supposed to grow up with all this on my head,86
884,אני יודעת שאת יכולה לעלות כיתה ,I know you can pass ,I know you can go up a grade,68
885,את בחורה חכמה ,You're a smart girl ,You're a smart girl,100
886,את צודקת אמא ולא יראו אותי יושבת ליד אחי הקטן בשיעור מדה ,"You're right Mom and I will not be seen sitting next to my little brother in ""since"" class ",You'm right Mom and they will not see me sitting next to my little brother in a footage class,82
887,זה שיעור מדע קל ,That's science class Kel ,This is an easy science lesson,63
888,הו אל היא באמת מנסה ,Oh Al she's trying so hard ,Oh god she's really trying,65
889,היי אולי מה שאני צריכה זה סוכן קטן וחכם עם חיי חברה שידריך אותי ,Hey maybe what I need is a smart little feeb with no social life to tutor me ,Hey maybe what i need is a smart little agent with a social life who will guide me,80
890,באיזה נושא את צריכה עזרה ,What subjects do you need help in ,What issue do you need help with,71
891,אני לא יודעת ,I don't know ,I do not know,88
892,איזה שיעורים אני לוקחת ,What classes am I taking ,What lessons I take,65
893,הו אל ,Oh Al ,Oh Al,100
894,רגע משפחתי חמים ,A warm family moment ,A warm family moment,100
895,עכשיו שב שתוק ותכין את עצמך ,Now sit up shut up and brace yourself ,Now sit back and prepare yourself,71
896,תזכרי הילדים פה ,Remember the kids are here ,Remember the kids here,92
897,אם את רוצה לעשות סקס הם יצטרכו לעזוב ואם את רוצה שהסקס יהיה טוב את חייבת לעזוב ,Now if you wanna have sex they'll have to leave and if you want it to be good you'll have to leave ,If you want to have sex they will have to leave and if you want the sex to be good you must leave,82
898,אני רוצה שתהיה לנו חוויה יפה שתסמל את האהבה שלנו ,I want us to have a beautiful expression of our love ,I want us to have a beautiful experience that will symbolize our love,74
899,עכשיו בוא נרד למרתף ,Now let's go downstairs ,Now let's go down to the basement,61
900,אתה יכול ללבוש תחתונים מלוכלכים על שולחן הפינג פונג ולהשפיט אותי כמו שרק אתה יודע ,You can put some dirty laundry on the ping-pong table and disappoint me as only you can ,You can wear dirty panties on the ping pong table and judge me as only you know,71
901,ובכן נשים קודם מתוקה ,Well after you sweetheart ,Well women first sweet,64
902,תפתח את הדלת אל!,PEG: Open this door Al!,Open the door to!,70
903,כשאני אצא מכאן אנחנו נעשה את זה פעמיים!,When I get outta here we're gonna do it twice!,When I get out of here we'll do it twice!,80
904,זה אומר דקה שלמה אל!,That means a full minute Al!,That means a whole minute to!,69
905,מגיע לי חוויה טובה של האהבה שלנו בריון שכמותך  ואני הולכת לקבל אותה!,[AL WHIMPERING] I deserve a beautiful expression of our love you slug  and I'm gonna have it!,I deserve a good experience of our love bully like you and I'm going to have it!,70
906,הו  שלום ילדים ,Oh  hi kids ,Oh hello kids,78
907,מעולה אנחנו בדרך לספריה ,Great we're on our way to the library ,Excellent we are on our way to the library,81
908,באד ממש עוזר לי ,Bud's really been helping me ,Bud really helps me,77
909,למדנו הסטוריה ,We've been studying history ,We studied history,76
910,למשל ידעתם שאישתו של תומס ג'פרסון היתה שחורה ,For instance did you know that Thomas Jefferson's wife was black ,"For example, did you know that Thomas Jefferson's wife was black?",87
911,הוא ווויזי היו עניים אתם יודעים ,He and Weezy were poor once you know ,He and Wisey were poor you know,81
912,הוא היה ממש איש רנסנס ,He was a real Renaissance man ,He was really a Renaissance man,97
913,הוא היה אדריכל ועבד בניקוי יבש ,He was an architect and a dry cleaner ,He was an architect and worked in dry cleaning,80
914,תגידי להם קל ,Tell them Kel ,Tell them easy,81
915,ובכן כשתומס ג'פרסון כתב את מגילת העצמאות,The Declaration of Independence on the back he wrote this song  * Well I'm movin' on up *,Well when Thomas Jefferson wrote the Declaration of Independence,67
916,בשמיים מתקדמים למעלה,* In the sky * * We're movin' on up *,In the sky advancing upwards,61
917,מתקדמים למעלה לכיוון המזרח,* Movin' on up * * To the east side *,Progressing up towards the east,61
918,מתקדמים למעלה סוף סוף קיבלנו חלק מהעוגה,* Movin' on up * * We finally got a piece of the pie **,Going upstairs we finally got some of the cake,66
919,אל אני מודאגת בקשר לקלי ,Al I'm worried about Kelly ,Al I'm not worried about Kelly,93
920,נו טוב ,Oh well ,Oh well,100
921,שב שתוק ותכין את עצמך ,Sit up shut up and brace yourself ,Sit still and prepare yourself,70
922,פגי!,Peggy!,Peggy!,100
923,משהו מגעיל קורה בשכונה הזאת!,There's something disgusting going on in this neighborhood!,Something disgusting is happening in this neighborhood!,80
924,את רואה פג ,Well you've killed ,You see expired,61
925,עכשיו כולם יודעים ,Now everybody knows ,Now everyone knows,86
926,ידעתי שהיינו צריכים לדלג על המשחק מקדים ,I knew we should have skipped foreplay ,I knew we had to skip the foreplay,75
927,מה קרה מרסי ,What happened Marce ,What happened to Mercy,83
928,זה היה נורא ,It was awful ,It was awful,100
929,בדיוק לבשתי את כותונת הלילה שלי לפני שסטיב בא הביתה לשלוש שעות של קצת אהבה ,I was just getting into my nightie before Steve came home for a little three-hour love fest ,I just wore my nightgown before Steve came home for three hours of some love,73
930,ואז ראיתי את הפנים המפחידות האלו בחלון שלי ,Then I saw this hideous face in the window ,Then I saw that scary face in my window,69
931,זה היה מציצן ,It was a peeper ,It was a voyeur,73
932,גברים הם חלאות ,Men are slime ,Men are scum,80
933,הנה אחד!,Here's one!,Here's one!,100
934,חשבתי שראיתי אותך כאן ,I thought I saw you over here ,I thought I saw you here,91
935,אז לפני שאני בורח מהעדר כאן מה קורה ,So before I deck the whole herd over there what's going on ,So before I run away from the herd here what's going on,69
936,זה היה נורא ,It was awful ,It was awful,100
937,הוא ראה אותי ערומה לגמרי ,He saw me in all my nakedness ,He saw me completely naked,65
938,הוא ראה את הכל סטיב ,He saw it all Steve ,He saw it all Steve,100
939,בגלל שרק המחשבה על זה עושה לי צמרמורת ,Because I mean just the thought of it gives me the heebie-jeebies ,Because just the thought of it makes me shiver,70
940,בכל מקרה צרחתי וברחתי החוצה ,Anyway I screamed and ran outside ,Anyway I screamed and ran out,94
941,הנשים בשכונה באו לעזרתי ותנחש מה ,The neighborhood women came to my aid and guess what ,The women in the neighborhood came to my aid and guess what,94
942,הוא הציץ לנשים בכל השכונה ,He's been peeping all over the neighborhood ,He peeked at women all over the neighborhood,76
943,הוא הציץ לי אתמול בלילה ,He peeped me last night ,He peeked at me last night,90
944,כן זה היה נורא ,It was awful ,Yes it was awful,86
945,ואיך זה היה בשבילך ,How was it for you ,And how it was for you,90
946,אל  בבקשה ,Al  Please ,Do not please,64
947,גם לנשים שמנות ולא מושכות יש זכויות ,The fat and unattractive have rights too ,Even obese and unattractive women have rights,68
948,גם לי הציצו ,I was peeped too ,I too peeked,79
949,את יכולה להראות לנו מה הוא ראה ,Could you show us what he saw ,You can show us what he saw,89
950,ואנחנו בדיוק הנשים המתאימות לעשות את זה ,Right And we are just the babes to do it ,And we are just the right women to do it,85
951,כן אף גבר לא יסתכל עליי וישאר בחיים ,Yeah no man looks at me and lives ,Yes no man will look at me and stay alive,65
952,בואו נעשה לו לינץ'! נכון מאד ,Let's lynch him!,Let's lynch him! correct,79
953,בסדר אבל לפני שנתלה אותו נביא אותו למוסך שלי ,String him up yes All right but before we hang him we'll bring him to my garage ,Okay but before we hang it we will bring it to my garage,68
954,יש לנו שם מערכת סטריאו שאפשר להשתמש בה כדי שלא ישמעו את הצרחות שלו והוא בהחלט יצרח ,We have a stereo there that we can use to cover his screams and a-screamin' he will be ,We have a stereo system there that can be used so that they will not hear his screams and he will definitely scream,75
955,אני יודעת שציפורן זה לא נשמע כל כך כואב אבל שנמשוך אותה לאט מהגוף של המציצן עם זוג מספריים חלודות  סוף סוף יעשה צדק עם המציצן!,I know a toenail doesn't seem like much but when peeled slowly away from the peeper's body with a pair of rusty tweezers  then justice will finally belong to the peepees!,I know this nail does not sound so painful but pulling it slowly from the voyeur's body with a pair of rusty scissors will finally do justice to the voyeur!,66
956,כן!,Yes!,Yes!,100
957,מרסי ,Marcy ,Mercy,80
958,מה עם הילדים הגדולים ,What about the big boys ,What about the big kids,87
959,הוא ראה גם אותם ,Did he see them too ,He saw them too,76
960,איך יכול להיות שהוא ראה את החזיה ולא את הילדים הגדולים ,Steve how could he see the jimmies and not see the big boys ,How could he have seen the bra and not the big kids,75
961,עכשיו תשתוק ,Now shut up ,Now shut up,100
962,אז בסדר האם כולנו ביחד בענין המוות האיטי והאלים של האיש הזה ,All right then are we all together on the slow and brutal death of this man ,So okay are we all together about this man's slow and violent death,69
963,הו כן!,Oh yes ,Oh yes!,100
964,מה איתך פגי ,What about you Peggy ,"What about you, Peggy?",100
965,ובכן בטח ,Well sure ,Well sure,100
966,--חייבים לעצור הוא הציץ לך גם ,He must be st-- He peeped you too ,- Must stop he peeked at you too,82
967,יש מישהי שהאיש הזה לא הציץ לה ,Is there anyone this guy hasn't peeped ,There's someone this man has not peeked at,62
968,רק לך ולגברת הזקנה מק'גינטי ,Just you and Old Lady McGinty ,Just you and Old Lady McGinty,100
969,חייבים לעשות משהו ,OLD LADY: Something must be done ,Something must be done,83
970,הרגע הציצו לי!,He peeped me last night ,Just peeked at me!,60
971,הו אל ,Oh Al!,Oh Al,100
972,אף אחד לא רוצה להציץ לי ,Nobody wants to peep me ,No one wants to peek at me,78
973,חבק אותי ,Hold me ,hug me,62
974,ובכן אף אחד גם לא רוצה לחבק אותך ,Well nobody wants to hold you either ,Well no one wants to hug you either,85
975,אל הוא מסתכל עליי ,Al he's looking at me ,Al is looking at me,85
976,ובכן הרגת אותו ,Well you've killed ,Well you killed him,81
977,אנחנו יכולים לסגור את החלון עכשיו ,Can we shut the window now ,We can close the window now,79
978,אל תגיד לי את האמת ,Now tell me the truth ,Do not tell me the truth,89
979,אני מאבדת את המראה שלי נכון ,I'm losing my looks aren't I ,I'm losing my look right,77
980,לא!,No!,No!,100
981,הו אתה סתם אומר את זה בגלל שאתה יודע שזה מה שאני רוצה לשמוע ,Oh you're just saying that because you know that's what I want to hear ,Oh you're just saying that because you know that's what I want to hear,100
