,hebrewFromSub,englishFromSub,englishTranslation,ratio
384,יש כאלה ,Are there any ,There are some,67
385,היי אמא ,Hey Mom ,Hi Mom,77
386,את חושבת שאבא בוגד בך ,Do you think Dad's cheating on you ,You think Dad's cheating on you,95
387,טוב מאד כי אנחנו לא רוצים לראות אותך ואת אבא נפרדים ,Good Because we don't wanna see you and Dad break up ,Very good because we do not want to see you and Dad separate,73
388,אנחנו כמעט משפחה ,We're almost like a family here ,We are almost a family,68
389,שניכם צריכים להישאר ביחד לנצח ,You two should stay together forever ,You two need to stay together forever,85
390,אבל בכל זאת אם תראי שאת לא יכולה לעשות את זה האם אני יכול להציע את מר רודניק הקצב ,However if you find that you can't may I suggest Mr Rudnick the butcher ,But still if you see you can not do it can I offer Mr. Rudnik the butcher,67
391,אני לא יכול להגיד שאני אוהב את השם באד רודניק ,Can't say I like the sound of Bud Rudnick ,I can not say that I like the name Bud Rudnik,77
392,אבל בחישוב הסופי הוא האבא היותר טוב ,But pound for pound he's the better father ,But in the final calculation he is the better father,64
393,היי רגע ,Oh wait ,Hey wait,80
394,לא כל כך מהר באד ,Not so fast Bud ,Not so fast Bud,100
395,חקרתי קצת למר פלטשר מניקוי יבש ,I've been scoping out Mr Fletcher the dry cleaner ,I questioned Mr. Fletcher a bit about dry cleaning,63
396,יש פורשה טלוויזיה בכבלים ולב חלש ,He's got a Porsche cable TV and a bad heart ,There is a Porsche cable TV and a weak heart,71
397,רודניק ,- Rudnick ,Rudnik,92
398,פלטשר ,- Fletcher ,Fletcher,100
399,רודניק!,- Rudnick ,Rudnik!,92
400,פלטשר!,- Fletcher ,Fletcher!,100
401,אני ואבא שלכם אוהבים אחד את השני מאד מאד ,Now your father and I love each other very much ,"Your dad and I love each other very, very much",78
402,ואני הולכת לעשות את כל מה שאני יכולה כדי לוודא שאנחנו נשאר ביחד ,And I'm gonna do everything in my power to make sure we stay together ,And I'm going to do everything I can to make sure we stay together,84
403,אז למה גרמת לנו להתרגש כל כך ,Then what'd you get us all excited for ,So why did you make us so excited,62
404,זאת עוד אחת מהבדיחות האכזריות שלך ,Is this another one of your cruel jokes ,This is another one of your cruel jokes,100
405,כן מה אנחנו צעצועים בשביל ההנאה שלך ,Yeah what are we just playthings for your amusement ,Yes what we toys for your enjoyment,67
406,הו זה מזכיר לי ,Oh that reminds me ,Oh it reminds me,76
407,אני מאחרת לדייט שלי ,I'm late for my date ,I'm late for my date,100
408,היי קלי ,Hi Kelly ,Hey Kelly,82
409,היי למה את זורקת עליי דשא ,Hey what are you throwing the grass on me for ,Hey why are you throwing grass at me,81
410,כי אני לא רוצה שיקראו לי רודניק ,Because I don't wanna be a Rudnick ,Because I do not want to be called Rudnik,75
411,שלום אל ,Hello ,Hello to,77
412,איך היה אהה  בבאולינג ,How was bowling ,How was aha in bowling,81
413,ובכן פג היה אהה  בסדר גמור ,Well Peg it was fine ,Well expired was aha just fine,60
414,ובכן פג מה עכשיו ,Well Peg what's next ,Well expired what now,73
415,נלך למצוא ברז כיבוי ונרים את הרגליים שלנו ,We go out find a fire hydrant lift our legs ,We'll go find a fire hydrant and lift our legs,88
416,רק רציתי להיות בטוחה שכל הריח שלך הוא הריח הרגיל ,I just wanted to make sure all the smells are where they should be ,I just wanted to be sure that your whole scent is the usual scent,63
417,האם זה המבורגר שאני מריחה בפה שלך ,Is that a burger I smell on your breath ,Is this a hamburger I smell in your mouth?,75
418,לא פג זאת עוגת החתונה שלנו ,No Peg it's our wedding cake ,It did not expire this our wedding cake,72
419,זאת היתה הפעם האחרונה שאכלתי ,That's the last time I ate ,That was the last time I ate,89
420,מה קורה כאן ,What's going on around here ,what's happening here,71
421,אני יכולה לשאול אותך את אותו הדבר מר מממן טלויזיה לנשים ,I might ask you the same thing Mr 24-lnch-Sony ,I can ask you the same Mr. Finance TV for women,61
422,אל תקראי לי טלויזיה בבית שלי ,Don't call me a TV in my own home ,Do not call me TV in my house,84
423,אבא זה בשבילך איזו אישה ,Dad it's for you It's some woman ,"Dad, this is a woman for you",75
424,הלו ,Hello ,Hello,100
425,הו כן ,Oh yeah ,Oh yes,77
426,זאת היתה אישתו של ג'ים בוואר ,It was Jim Bauer's wife ,This was Jim Brewer's wife,73
427,כנראה שיש לו איזה וירוס בבטן או משהו ,He got some kind of stomach flu or something ,Apparently he has some stomach virus or something,67
428,נראה שאני צריך להחליף אותו בחנות למשך השבוע ,I gotta work for him at the store the rest of the week ,Looks like I need to replace it in the store for the week,61
429,אני שונאת אותך אל ,I hate you Al ,I hate you to,77
430,טוסטר!,Toaster!,toaster!,100
431,אני אראה לאישה הזאת שהיא לא היחידה שיכולה להכין המבורגר ,I'll show that woman she's not the only one who can cook a burger ,I'll show this woman she's not the only one who can make a hamburger,80
432,זה נקרא לטגן משני הצדדים ככה הוא מתבשל בכל הצדדים ,"It's called ""flipping it over "" That way it gets cooked on both sides ",It is called frying on both sides so it is cooked on all sides,73
433,הו מרסי אני לא מאמינה ,Oh Marcie I can't believe it ,Oh Mercy I do not believe,64
434,לקחתי את השנים הכי טובות של אל וככה הוא מודה לי ,I've taken the best years of Al's life and this is how he thanks me ,I took Al's best years and that's how he thanks me,75
435,פגי אני באמת לא חושבת שאל בוגד בך ,Peggy I really don't think Al's cheating on you ,Peggy I really do not think asked to betray you,72
436,וזה אומר שהן יעדיפו לעשות אהבה עם מפית שיש לה ציור של כף יד  מאשר עם בעלך ,They'd rather make love to a piece of cloth with a man's hand in it than with your husband ,And that means they would rather make love with a napkin that has a drawing of a palm than with your husband,69
437,ומה אם הוא בוגד בי ,What if he is cheating on me ,And what if he's cheating on me,85
438,תעמדי לצד הגבר שלך  בבית המשפט ,Stand by your man in court ,Stand by your man in court,100
439,קחי את כל מה שיש לו ותשיגי לך גבר אחר ,Take him for everything and get yourself another man ,Take everything he has and get yourself another man,89
440,גבר אמיתי ,A real man ,real man,89
441,אני לא רוצה גבר אמיתי ,I don't want a real man ,I do not want a real man,85
442,אני רוצה את אל ,I want Al ,I want Al,100
443,למה ,Why ,Why,100
444,הו אני לא יודעת ,Oh I don't know ,Oh I do not know,77
445,האם היו לך פעם זוג נעליים שאהבת יותר מכולם ,Have you ever had a favourite pair of old shoes ,Have you ever had a pair of shoes that you liked most of all,65
446,הן משעממות ומכוערות ומסריחות עד השמים ,They're boring and ugly and stink to high heaven ,They are dull and ugly and stink to the sky,68
447,אבל הן שלך את יודעת ,But they're yours you know ,"But they's yours, you know",94
448,הן משופשפות ושבורות מבפנים וכשאת נועלת אותן ההרגשה היא כאילו אין שם כלום ,They're worn down and broken in and when you put them on it feels like there's nothing there ,They are rubbed and broken on the inside and when you lock them on it feels like there is nothing there,80
449,איבדתי את אל המסריח שלי ,I've lost my stinking Al ,I lost my stinking god,83
450,עדיין לא ,Not yet ,Not yet,100
451,אמרתי לך ביקשתי מסטיב להתחפש ולעקוב אחרי אל מאתמול בלילה ,I told you I had Steve wear a disguise and follow Al since last night ,I told you I asked Steve to dress up and follow me to Al from last night,70
452,אין לו משהו אחר לעשות בגלל שהוא לא מוכן להתקרב אליי עם התסרוקת הזאת ,He has nothing else to do because he won't go near me with this hair ,He has nothing else to do because he is not willing to approach me with this hairstyle,73
453,שלום פגי ,Hello Peggy ,Hello Peggy,100
454,אשת-הדבורים ,Bee- woman ,The bee-woman,82
455,אז מה גילית בקשר לאל ,So what'd you find out about Al ,So what did you find out about God?,86
456,גיליתי שיש לו את החיים הכי מעוררי רחמים מכל יצור אחר על פני כדור הארץ  ושיש לו תספורת יותר טובה משל אישתי ,I found out that he has the most pathetic life of any creature on this planet and has nicer hair than my wife ,I discovered that he has the most pitiful life of any other creature on earth and that he has a better haircut than my wife's,73
457,ועכשיו לדיווח שלי ,Now for my report ,And now for my report,89
458,הנעקב הגיע לעבודה בשבע בערב אתמול בלילה ,"""Subject arrived at work at 7 p m Last night ",The follower arrived at work at seven in the evening last night,62
459,ואז הדליק את האורות ,Then turned on lights ,Then he turned on the lights,86
460,בעשר שלושים ואחת איש האבטחה של הקניון מגיע חובט בי בראש ובאוזניים ולוקח את השעון שלי ,"10:31 the mall security guard comes by clubs me about the head and ears and takes my watch """,At ten thirty-one the mall security guard arrives hitting me on the head and ears and takes my watch,69
461,אז מאותו רגע אני לא יודע באיזה שעות הדברים קרו ,So from here on I don't know what time anything happens ,So from that moment on I do not know what time things happened,68
462,הלכתי הביתה ,"""Went home """,I went home,90
463,והסתכלתי על הקלינגון הישן שהיה פעם אישתי,Looked at the sleeping Klingon that used to be my wife  ,And I looked at the old Klingon that was once my wife,75
464,הוא בוגד בי או לא ,Is he cheating on me or not ,He betrays me or not,64
465,אתה שקרן ,You are a liar ,You're a liar,74
466,כולכם הגברים מחפים אחד על השני ,All you men stick together ,All of you men cover each other,63
467,איפה היית ,Where have you been ,Where were you,73
468,תפסת אותי ,You got me ,You got me,100
469,חברה לשעבר שלי קתלין טרנר היתה בעיר ,An old girlfriend Kathleen Turner was in town ,My ex-girlfriend Kathleen Turner was in town,90
470,אז מרחתי לכלוך ושמתי כינים על הגוף שלי והלכנו לחטט באשפה ,So I rubbed some grime and lice on my body and we went dumpster hopping ,So I smeared dirt and put lice on my body and we went to pry in the trash,68
471,ובכן אתה שונא את השיער שלי כל כך הרבה שבאמת היית עושה את זה נכון ,Well you hate my hair so much you'd really do that wouldn't you ,Well you hate my hair so much that you would really do it right,86
472,ובכן  כן ,Well yeah ,well yeah,100
473,ובכן בוא נראה את קתלין טרנר מכינה כדורי מלון בשבילך ,Well let's just see Kathleen Turner make melon balls for you ,Well let's see Kathleen Turner make melon balls for you,96
474,אני מצטער ,I'm sorry ,I'm sorry,100
475,אני מצטער ,I'm sorry ,I'm sorry,100
476,הרגע ראיתי את סטיב ומרסי ,I just saw Steve and Marcie ,I just saw Steve and Mercy,91
477,בחיי מרסי נראית ממש מגוחך ,Boy Marcie looks ridiculous ,In my life Mercy looks really ridiculous,66
478,היי אל ,Hi Al ,Hi Al,100
479,מותק תראה ,Honey look ,Baby look,63
480,אני הכנתי לך המבורגר ואפילו טיגנתי אותו משני הצדדים ,Look look look I made you a hamburger and I even cooked it on both sides ,I made you a burger and even fried it on both sides,70
481,ובכן פג אני לא רעב ,Well Peg I'm not hungry ,Well expired I'm not hungry,76
482,שבעתי מקטשופ וחרדל בעבודה ,I filled up at the store on ketchup and mustard ,I was satisfied with ketchup and mustard at work,67
483,וחוץ מזה אני הולך לשחק באולינג הלילה ,Besides I'm going bowling tonight ,"And besides, I'm going to play bowling tonight",85
484,הו לא אתה לא ,Oh no you're not ,Oh no you are not,79
485,אני יודעת מה אתה זומם ,I know what you're up to ,I know what you're up to,100
486,אתה מפצל רגליים לאיזה פרחה בלונדינית ,You're making the 7-10 split with some blond floozy ,You split your legs into some blonde flower,64
487,על זה מדובר ,That's what this is about ,That's what it's about,85
488,את חושבת שאני בוגד בך ,You think I'm cheating on you ,You think I'm cheating on you,100
489,ובכן מה עוד אני אמורה לחשוב ,Well what else am I gonna think ,Well what else am I supposed to think,74
490,אתה הולך לעבודה חוזר הביתה ,You go to work come home ,You're going to work back home,78
491,אני לא עיוורת אתה יודע ,I'm not blind you know ,I'm not blind you know,100
492,את חושבת שרק בגלל שאני לא אומר לך שאני אוהב אותך ושאני לא רוצה לבלות זמן איתך ושלפעמים הקול שלך גורם לי להתכווץ אז זה אומר שאני רוצה אישה אחרת ,You think that just because I don't tell you I love you I don't wanna spend any time with you and your voice often makes me cringe that I want another woman ,Do you think that just because I do not tell you that I love you and that I do not want to spend time with you and that sometimes your voice makes me cringe so it means I want another woman,83
493,את האישה היחידה בשבילי ,You're the only one for me ,The only woman for me,72
494,אתה באמת מתכוון לזה ,You really do love me ,You really mean it,72
495,ובכן בודאי מה אני תמיד אומר ,What do I always say ,Well certainly what I always say,69
496,למה ללכת לחפש חלב כשיש לך את הפרה בבית ,"""Why go out for milk when you got a cow at home """,Why go looking for milk when you have the cow at home,79
497,אתה באמת אוהב אותי ,You really do love me ,You really love me,92
498,בוא נעלה למעלה ונעשה אהבה ממש עכשיו ,Let's go upstairs and have sex right now ,Let's go upstairs and make love right now,79
499,עכשיו מותק את יודעת מה אני תמיד אומר:,Now honey you know what I always say:,Now baby you know what I'm always saying:,84
500,לא ,""" No """,No,100
501,אני חייב לעלות למעלה כדי לשטוף את הריח של כפות הרגליים מהידים שלי ,I gotta go upstairs and wash the feet off my hands ,I have to go upstairs to wash the smell of my feet from my hands,72
502,אני יודעת שאתה בוגד בי ואני אגלה את זה ,I know you're cheating on me and I'll find out ,I know you're cheating on me and I'll find out,100
503,תזכור את המילים שלי ,Mark my words ,Remember my words,60
504,אני אזכה בך בחזרה ,I'll win you back ,I will win you back,94
505,וכשזה יקרה כדי שתארוז את הדברים שלך כי אתה עף מכאן ,And when I do you better pack your bags because you're out of here ,And when that happens to pack your things because you're flying out of here,67
506,תראו אותה ,Look at her ,Look at her,100
507,יושבת שם בלונדינית ויפה ,Sitting there all blond and pretty ,Sitting there is blonde and beautiful,68
508,אני מתערבת שאל מוריד את הגרביים שלו בשבילה ,I bet Al takes his socks off for her ,I bet he's taking off his socks for her,83
509,בעלי אפילו לא מוציא את הסיגר מהפה שלו ,Mine doesn't even take the cigar out of his mouth ,My husband does not even take the cigar out of his mouth,82
510,שלי כן מוציא ,Mine does ,Mine does spend,75
511,הוא שם אותו על המצח שלי ,He rests it on my forehead ,He put it on my forehead,88
512,הו מה כבר הוא מוצא בה ,Oh what could he see in her ,Oh what already he finds in her,69
513,את יודעת איך אני אוהבת את זה ,You know how I like it ,You know how I like it,100
514,תעשי את הקצוות שווים אבל אל תקצרי מהאורך ,Even out the ends but don't lose any length ,Make the edges equal but do not shorten the length,65
515,זה מה שמדליק אותו ,That's what turns him on ,That's what turns him on,100
516,הו האם זה כך אל ,That's what turns him on ,Oh is that so to,60
517,מרסי את יכולה בעדינות להסיח את דעתה של הספרית ,Marcie could you subtly distract the hairdresser ,Mercy you can gently distract the hairdresser,75
518,זאת שטיפלה בשיער שלי ,The one who did my hair ,The one who took care of my hair,73
519,אני אנסה ,I'll try ,I'll try,100
520,תזכרי רק בקצוות ,Remember just the ends ,Remember only the edges,76
521,תשאירי אותו ארוך ,Leave it long ,Leave it long,100
522,בדיוק כמו שהוא אוהב את זה,Just like he likes it ,Just the way he likes it,76
523,אז אה כמה בעלים גנבת ,So how many husbands have you stolen ,So oh how many owners you stole,63
524,והחלק הכי טוב בזה הוא שמעולם לא נתפסתי ,And the best part is I've never been caught ,And the best part about it is that I was never caught,75
525,את יודעת אפילו עשיתי איתם סקס במיטה בבית שלהם בזמן שהנשים שלהם היו בקניות ,You know I've even had sex in their own beds while their wives were out shopping ,You know I even had sex with them in bed at their house while their wives were shopping,84
526,פשוט תמשיכי לקרוא מתוקה ואני מיד אחזור ונתחיל ,Just keep on reading honey and I'll get right back and we'll get started ,Just keep reading sweetie and I'll be right back and get started,85
527,היי אל ,Hi Al ,Hi Al,100
528,מה מביא אותך לכאן ,What brings you here ,What brings you here,100
529,ובכן לפי המצב של כדור הבאולינג שלי תיארתי לעצמי שאת תהיי במצב רוח רע ,Judging by the condition of my bowling ball I figured you might be  I figured you might be in a mood ,Well by the state of my bowling ball I imagined you would be in a bad mood,61
530,מה לעזאזל ,What the hell ,What the hell,100
531,חשבתי על זה ,That's what this is about ,I thought about it,65
532,מגיע לך קצת לקפוץ מדי פעם ,You deserve a jump every now and then So I checked the TV Guide ,You deserve a little jump every now and then,69
533,בלוודיר ובכן אולי נוכל לעשות את זה למשך יותר זמן אם אני אלבש את זה ,Well maybe we could go a little longer if I were wearing this ,Belvedere Well maybe we can do it for longer if I wear it,68
534,מה אכפת לי מה את לובשת ,What do I care what you're wearing ,What do I care what you wear,90
535,הדבר היחיד שאני אסתכל עליו הוא השעון ,I'll just be watching the clock Come on ,The only thing I'll look at is the clock,66
536,בוא איתי אני רוצה שתפגוש מישהי ,I want you to meet someone ,Come with me I want you to meet someone,80
537,בסדר ,Look ,OK,67
538,היי מי זה ,- Who's this ,"Hi, who is this",83
539,מי זה ,- Who's this ,Who is,75
540,כלומר את לא שוכבת איתו ,You mean you're not sleeping with him ,That means you do not sleep with him,74
541,ובכן מי יכול להאשים אותך ,Well who can blame you ,Well who can blame you,100
542,סוס הרבעה כמוני בא רק פעם בשנה ,A stallion like me only comes around once a year ,A stud horse like me only comes once a year,77
543,בדיוק פעם בשנה ,Exactly once a year Yeah ,Exactly once a year,88
544,כן כנראה שזה באמת היה טיפשי מצידי לחשוב שאתה בוגד!,I guess it was pretty silly of me thinking you were cheating ,Yes probably it was really stupid of me to think you were cheating!,70
545,ממש טיפשי!,How stupid!,Really stupid!,61
546,כאלו שמישהי אחרת תרצה אותך ,I want you to meet someone ,Such that someone else will want you,68
547,כלומר אתה מוכר נעליים בגיל העמידה ,I mean you are a middle- aged shoe salesman ,That means you sell middle-aged shoes,71
548,לילה טוב ,Good night ,Good night,100
549,תעזבי אותי בשקט ,- Leave me alone ,Leave me alone,100
550,נו טוב ,Oh well ,Oh well,100
551,לפחות טוב לדעת שאני היחידה שאתה לא עושה את זה איתה ,At least it's nice to know I'm the only one you're not doing it with ,At least it's good to know I'm the only one you do not do it with,87
552,לילה טוב מותק ,Good night honey ,good night honey,100
553,מה שאתה צריך האם אתה יודע שיש לי את זה ,* What you need * * Do you know I got it *,What you need Do you know I have it,90
554,כל מה שאני מבקשת' זה רק קצת כבוד כשאתה בא הביתה,* All I'm askin' * * Is for a little respect When you come home *,All I'd ask for 'is just a little respect when you get home,84
555,הי מותק רק קצת כשאתה בא הביתה רק קצת,* Hey baby * * Just a little bit * * When you come home * * Just a little bit *,Hi baby just a little when you come home just a little,91
556,אדוני רק קצת אני לא הולכת לעשות דברים רעים כשאתה לא פה  זה כל כך עצוב,* Mister * * Just a little bit * * I ain't gonna do you wrong While you're gone  * This is so sad ,Sir just a little bit I'm not going to do bad things when you are not here it's so sad,66
557,תסתכל עליה כל שנה  זה אותו דבר,Look at her Every year it's the same thing ,Looking at it every year is the same thing,88
558,תוציא את הפרוקוטול וואו תטיל את זה עלי,* Take out T-C-P * * Oh * * Sock it to me *,Take out the Protocol Wow cast it on me,71
559,קצת כבוד וואו,* A little respect * * Whoa *,A little respect wow,93
560,קצת כבוד רק קצת כבוד אתה חושב שהיא תלמד ,* A little respect * * Just a little bit *,A little respect Just a little respect Do you think she will learn,62
561,אבל כל שנה היא שומעת את התחנות הישנות מגבירה את הווליום ורוקדת את הריקוד של אבותינו ,You'd think she'd learn but every year she turns on the oldies station cranks it up real loud and dances the dances of our forefathers ,But every year she hears the old stations turn up the volume and dance the dance of our ancestors,68
562,או ואז היא מבינה כמה היא זקנה ונכנסת לדיכאון ,Oh and then she realizes how old she is and gets depressed ,Or then she realizes how old she is and goes into depression,81
563,תראה ,Look ,Look,100
564,זוכר את זה ,Remember that one ,Remember that,87
565,אם כן אתה בטח בן 100 בגלל שזה היה לפני 20 שנה לפחות,If you do you must be 100 because it was over 20 years ago ,If so you are probably 100 years old because it was at least 20 years ago,73
566,ואתנהג ככה תוכל בבקשה לירות בי ,Bud if I ever get that old and act like that would you please shoot me ,"And if I act like that, you can please shoot me",74
567,למה לחכות ,Why wait ,Why wait,100
568,היי אמא היי אמא,Hi Mom Hi Mom ,Hey mom hey mom,79
569,עזבו אותי בשקט ,- Leave me alone ,Leave me alone,100
570,מה שלומך ,How you doing ,How are you,67
571,מה שלומי ,How you doing ,How are you?,67
572,זה היום הולדת שלי ויש לך את החוצפה לשאול אותי מה שלומי ,It's my birthday and you have the audacity to ask me how I'm doing ,It's my birthday and you have the audacity to ask me how I'm,95
573,[אנחה] השנים היפות ביותר של חיי נגמרו ,[SIGHS] The best years of my life are over ,[Sigh] The most beautiful years of my life are over,85
574,והחלק הכי גרוע הוא שבזבזתי אותן איתך ,And the worst part is I spent them with you ,And the worst part is I spent them with you,100
575,דרך אגב אל אני עדיין מושכת בעיניך ,By the way Al am I still attractive ,By the way I am still attractive to you,86
