,hebrewFromSub,englishFromSub,englishTranslation,ratio
200,לעולם לא ארד נמוך ואצא עם חנון ,I will never sink so low as to date a nerd ,I will never go low and go out with a nerd,69
201,יכול להיות שאין לי הרבה אבל לפחות יש לי גאווה ,I may not have much but at least I have my pride ,I may not have much but at least I have pride,97
202,זה היה ערב מדהים מיס באנדי ,It's been an illuminating evening Miss Bundy ,It was an amazing evening Miss Bundy,70
203,מצטער ששפכתי את מיץ השזיפים שלי על חולצתך ,I'm sorry I spilled my prune juice on your blouse ,Sorry I spilled my plum juice on your shirt,76
204,כן ואני מצטערת שצבטתי אותך באשכים ,Yeah and I'm sorry I punched you in the pelvis ,Yes and I'm sorry I pinched you in the testicles,79
205,במוזיאון תהיה תערוכה מעניינת על רכיכות ,The museum is having a quite interesting exhibit on the ever- changing mollusk ,The museum will have an interesting exhibit on shellfish,65
206,רק אם תלבש את הפאוץ' הירוק שלך ,Well only if you wear your green pencil pouch ,Only if you wear your green pouch,85
207,הוא מדליק את כולן ,Turns them all on ,He turns them all on,92
208,נהניתי מאוד חבר'ה אבל עליי לזוז ,Well I've had a great time guys but I got to run ,I really enjoyed it guys but I have to move,62
209,קלי את יודעת מה יהפוך את הערב הזה למושלם ,Kelly you know what would make this the perfect evening ,Kelly you know what will make this evening perfect,91
210,מה מיירון ,- Oh what Myron ,What a Myron,80
211,אם איווט תיתן לי נשיקת לילה טוב ,- Lf Yvette would kiss me good night ,If Yvette would give me a goodnight kiss,68
212,כרגע הרסת דבר טוב מותק ,You just blew a good thing baby ,You're currently ruining a good thing baby,68
213,בחיי אני כל כך עייפה ,Oh my I'm so tired ,I'm so tired in my life,73
214,תודה לאל שלימדת אותי איך לישון בבית ספר ,Thank goodness you taught me how to sleep at school ,Thank God you taught me how to sleep in school,89
215,אז איך היה הדייט שלך עם החנון הגדול ,So how was your date with Le Grand Geek ,So how was your date with the big nerd,70
216,ישבנו עם הוריו והם הראו לי תמונות של החופשה שלהם במפעל העפרונות ,Well we sat around with his parents and they showed me slides of their vacation to the Ticonderoga pencil factory ,We sat with his parents and they showed me pictures of their vacation at the pencil factory,79
217,את יודעת עיפרון מספר 2 מאוד חזק בתעשייה ,You know the number 2 pencil is the backbone of the industry ,You know pencil number 2 is very strong in the industry,80
218,זה מאוד מרתק ,- Oh that's very fascinating ,It's very fascinating,81
219,לא זה לא ,- No it isn't ,No it's not,64
220,זה קשקוש ,This is not a joke ,This is nonsense,65
221,תקשיבי איווט עלינו לשוחח  אשמח לשוחח עם אחותי הקטנה והאמריקאית ,Yvette we need to discuss  Oh I would love to talk to my little American sister but my next date will be here any moment ,Listen Yvette we need to talk I would love to talk to my little American sister,71
222,הוא אמר לי שאוכל ללבוש את חצאית המיני שלך מעור ,He told me I could wear your leather mini ,He told me I could wear your leather miniskirt,94
223,לא אכפת לך נכון ,Bud what are you doing ,You do not care right,70
224,תודה ,Thanks ,Thanks,100
225,היי סבתא ,Hi Grandma ,Hi Grandma,100
226,מצטער קל ,Sorry Kel ,Sorry easy,74
227,באד מה אתה עושה ,Bud what are you doing ,Bud what are you doing,100
228,באד אני זקוקה לעזרתך ,Bud I need your help ,Bud I need your help,100
229,אני נואשת ,I'm desperate ,I'm desperate,100
230,לא את לא ,No you're not ,No you do not,77
231,לא תרצה לעזור לי להיפטר מאיווט נכון ,You wouldn't want to help me get rid of Yvette would you ,You will not want to help me get rid of Yvette right,80
232,אני לא סובלת את זה יותר ,Well I can't take this anymore ,I can 't stand it anymore,74
233,אצטרך לעשות זאת בעצמי ,I'm gonna have to do it myself ,I'll have to do it myself,84
234,קלי אני אומר את זה בכל הכנות ,Kelly I say this with all sincerity ,Kelly I say this with all sincerity,100
235,אם את באמת רוצה להיפטר ממנה אהרוג אותך ,If you truly truly want to get rid of her I'll kill you ,If you really want to get rid of her I'll kill you,82
236,באמת אעשה זאת ,I really will ,I will really do it,81
237,זו לא בדיחה ,This is not a joke ,This is not a joke,100
238,באד מה אתה עושה ,Bud what are you doing ,Bud what are you doing,100
239,אני  אני פותח פתח איוורור כדי שהחום יוכל להיכנס אלייך ,I'm  I'm giving you some ventilation You know so the heat can get through ,I'm opening a vent so the heat can get into you,64
240,לא אכפת לי אם תציץ ,I don't mind if you peep ,I do not care if you peek,69
241,כן אוותר על זה  ביום שהם ייקחו אותה מהיד הקרה והמתה שלי ,Yeah I'll give that up The day they pry her from my cold dead hand ,Yes I will give it up the day they take it from my cold and dead hand,79
242,איזה בחור חמוד וקטן ,- What a cute little fellow ,What a cute little guy,81
243,הוא נייר טואלט ,- He's toilet film ,Is toilet paper,65
244,סלחי לי גברת צעירה אבל לאן את חושבת שאת הולכת ,Well excuse me young lady but where are you think you're going ,"Forgive me, young lady, but where do you think you're going?",81
245,לדייט ,- On a date ,For a date,84
246,לא את לא הולכת ,No you're not ,No you're not going,81
247,קיבלתי שיחה מהמנהל היום ,I got a call from the principal today ,I got a call from the manager today,83
248,ונראה שאת נכשלת בכל המקצועות ,And it seems you're failing all your subjects ,And you seem to be failing in all professions,71
249,גם אני נכשלת ,- I'm failing too ,I'm failing too,100
250,קלי בבקשה אנחנו מדברים עם איווט ,Kelly please we're talking to Yvette ,Kelly please we're talking to Yvette,100
251,הוא לא התכוון לזה יקירה ,He didn't mean that dear ,He did not mean it dear,77
252,אבל אם היא תכשל היא תצטרך לחזור הביתה ,But if she fails she has to go back home ,But if she fails she will have to go home,84
253,ויחסרו לנו 500 דולר בחודש!,- And we're out 500 bucks a month ,And we will be short of $ 500 a month!,73
254,אנחנו אחראים על ההשכלה שלך ,- We're responsible for your education ,We are responsible for your education,90
255,ואם יש דבר אחד שאנחנו זה הורים אחראים ,You know and if there's one thing we are it's responsible parents ,And if there is one thing we are responsible parents,87
256,תפסיק אל ,- Stop that Al ,Stop to,63
257,-אני לא יכול ,- No it isn't ,-I can not,70
258,אני מסוחרר ,I'm giddy ,I'm dizzy,67
259,בואי הנה ,Come here Come here ,come here,64
260,אשמח אבל אני צריכה לנקות את האקורדיון שלי בשביל בית ספר מחר ,I'd love to but I've got to go dust off my accordion for school tomorrow ,I'd love to but I need to clear my accordion for school tomorrow,81
261,שמתי עין על נגן הטובה הגדול והשמן ,I've got my eye on the big fat tuba player ,"I kept an eye on the big, fat good player",76
262,בבקשה קלי עלייך לעזור לי ,Oh please Kelly you have to help me ,Please Kelly you must help me,78
263,אתחנן שמישהו יצא איתך ,I'll beg someone to go out with you ,I beg someone to go out with you,96
264,אם אכשל אצטרך לחזור לצרפת ואצטרך לוותר על כל החברים שלך ,If I fail I'll have to go back to France and I'll have to give up all your boyfriends ,If I fail I will have to go back to France and I will have to give up all your friends,80
265,תקשיבי איווט אין טעם ששתינו נשאר בבית ,Listen Yvette there's no point in us both staying home ,Listen Yvette there's no point in us both staying home,100
266,צאי ,Go out ,Get out,77
267,אני אלמד וכשיהיה לנו מבחן תוכלי להעתיק ממני ,I'll study and when we take our test you can copy off me ,I will learn when we have a test you can copy from me,64
268,את תעשי את זה בשבילי ,- Oh no you're not ,You'll do it for me,63
269,בשביל מה יש אחיות אמריקאיות ,What are little American sisters for ,What are American sisters for?,89
270,בסדר מי רוצה חתיכת בצק ,Okay who wants seconds on crust ,Okay who wants a piece of dough,61
271,אני לא מאמין ,I can't believe it ,I do not believe,71
272,איווט נכשלה בכל מקצוע ,Yvette flunked every subject ,Yvette failed in every profession,62
273,היא אפילו נכשלה בצרפתית ,She even flunked French ,She even failed in French,83
274,היא בטח הבחורה הכי טיפשה בעולם ,She must be the stupidest girl in the world ,She's probably the dumbest girl in the world,69
275,אני הבחורה הכי טיפשה באמריקה ,- Well I'm the stupidest girl in America ,I'm the dumbest girl in America,67
276,אני יודע מותק אבל אנחנו מדברים על משהו חשוב עכשיו ,- I know you are pumpkin but we're talking about something important now ,I know baby but we'm talking about something important right now,82
277,מותק גם את חשובה ,Honey you're important too ,Baby you're important too,86
278,רק לא חשובה כמו 500 דולר ,Just not as important as 500 bucks ,Just not as important as $ 500,90
279,מה איתי ,Well what about me ,What about me,84
280,איבדתי אחות ,I lost a sister ,I lost a nurse,76
281,גם לי כואב ,I'm hurting too ,It hurts me too,80
282,הדייטים שלי הגיעו ,My dates are here ,My dates have arrived,79
283,בוקר טוב מותק ,Good morning honey ,Good morning honey,100
284,באמת היית גדול אתמול בלילה אל ,Gee you were great last night Al ,You really were great last night to,75
285,נחרת שיר מתוך שינה בזמן ששערות האף שלך נעו ברומנטיות לפי הקצב ,"You snored ""Vaya con Dios"" in your sleep while your nose hairs swayed romantically to the beat ",Snoring a song out of sleep while your nose hairs move romantically to the beat,70
286,כן היית די טובה בעצמך פג ,You were pretty good yourself ,Yes you were pretty good yourself expired,83
287,הזעת את כל האיפור שלך על הסדינים ,You sweated your silhouette on the sheets ,Sweat all your makeup on the sheets,63
288,הו מותק בוא נעשה משהו מיוחד הלילה ,Oh honey let's do something special tonight ,Oh baby let's do something special tonight,87
289,יודע כמו פעםאתה ,You know like we used to ,Know as you used to,74
290,כלומר אני אגיד שאני לא רוצה להתחתן ואת תסגרי אולם אירועים ,You mean like I say I don't wanna get married and you book the hall ,I mean I'm saying I do not want to get married and you will close a ballroom,67
291,למעשה חשבתי שנוכל למצוא מקום רומנטי ונמשש אחד את השני בחשיכה ,Actually I was thinking we could find someplace romantic and grope each other in the dark ,I actually thought we could find a romantic place and touch each other in the dark,76
292,אני לא יכול למצוא שום דבר בחושך ,I don't think I could find anything in the dark ,I can not find anything in the dark,76
293,לפחות לא את החלקים החשובים שיש להם שימוש בשבילי ,None of the important parts are where they used to be ,At least not the important parts that are of use to me,75
294,למעשה אתה לא יכול למצוא אותם גם באור ,Actually you couldn't find them in the light either ,In fact you can not find them even in the light,71
295,תעשי שיחות מיטה כמה שאת רוצה פג אבל הלילה הוא ערב הבאולינג ,Pillow talk all you want Peg but tonight's bowling night ,Make as many bed calls as you want expired but tonight is bowling night,63
296,אני לא יכול להיות איתך ,I can't be with you ,I can not be with you,95
297,אני הולך להנות ,I'm hurting too ,I'm going to enjoy,61
298,בסדר גמור אני בטח אהיה די עייפה אחרי יום שלם במכון היופי ,I'm gonna be pretty tired after a whole day in the beauty parlour ,All right I'll probably be pretty tired after a full day at the beauty salon,61
299,לשנינו יש הרבה מה לעשות קדימה ,We've both got a lot to do Come on ,We both have a lot to do going forward,64
300,מה אתה רוצה לאכול בארוחת הבוקר מותק ,What do you want for breakfast honey ,What do you want to eat for breakfast baby,82
301,ביצים ובייקון ,Bacon and eggs ,Eggs and bacon,100
302,זה יהיה נהדר ,That'd be great Good ,That will be great,68
303,יופי כאתה מכין את זה תכין גם בשבילי ,While you're at it make me some too ,Beauty as you prepare it will prepare for me too,63
304,בסדר בסדר בסדר בסדר ,Okay okay okay okay ,OK OK OK OK,73
305,כמה צריך לשלם לכן כדי לעשות את מעשה החשיכה עם גארי שנדלינג ,How much would it take for you to do the deed of darkness with Garry Shandling ,How much do you have to pay for it to do the act of darkness with Gary Chandling,71
306,עשר מיליון ,Ten million ,Ten million,100
307,עשרים אם הוא גם רוצה לדבר ,Twenty if he wants to talk ,Twenty if he also wants to talk,91
308,ומה לגבי בעלה של סוניה ,How about with Sonya's husband ,And what about Sonia's husband,80
309,נהיה איתך בעוד רגע מרת רודס ,We'll be with you in a minute Mrs Rhoades ,"We'll be with you in a moment, Mrs. Rhodes",91
310,אני לא אוהבת שמישהו חדש מטפל בשיער שלי ,I don't like new people doing my hair ,I do not like someone new taking care of my hair,66
311,למה מר מאריס היה חייב להיכנס לקרב סטירות עם חוליו ,Why did Mr Maurice have to get in that slap fight with Julio ,Why Mr. Maris had to get into a slap fight with his patients,72
312,אל תדאגי מרסי ,Don't worry Marcie ,Do not worry Mercy,78
313,את תראי נהדר ,You'll look great ,You will look great,78
314,הם ידועים בזה שהם מטפלים בכל שערה בנפרד ,They're known for tailoring each hairdo to the individual ,They are known for taking care of each hair individually,74
315,אז מתי היתה הפעם האחרונה שאת עשית את זה פגי ,So when was the last time you got it Peggy ,So when was the last time you did that Peggy,86
316,ועם סיליקון ,Siliconed ,And with silicone,62
317,מאושרת ,Happy ,Happy,100
318,אנחנו מוכנים בשבילך מרת רודס ואנחנו הולכים לעשות אותך מאד יפה ,We're ready for you now Mrs Rhoades and we're gonna make you beautiful ,We are ready for you Mrs. Rhodes and we are going to make you very beautiful,79
319,אתם מוכרים ביטוח כמו בשדה התעופה ,Do you sell insurance like at the airport ,You sell insurance like at the airport,96
320,מה לא בסדר עם הבעלים שלנו באמת ,What's wrong with our husbands anyway ,What's wrong with our owner really,62
321,אנחנו יוצאות מגדרנו כדי להיראות יפות בשבילם וכל מה שאנחנו זה מישהו לצעוק עליו בזמן המשחק ,We go out of our way to look beautiful for them and all we are are things to strike a match on ,We go out of our way to look beautiful for them and all we are is someone to yell at while playing,73
322,אני יודעת ,I know ,I know,100
323,הזמן היחיד שאל מסתכל עליי הוא כשהוא רוצה שאני אפתח את בקבוק הבירה שלו ,The only time Al looks at me is when he wants the cap off his beer ,The only time he asked looking at me is when he wants me to open his beer bottle,77
324,כאילו שהשיניים שלו פחות טובות משלי!,As if his teeth aren't as good as mine!,As if his teeth are less good than mine!,75
325,אני אומרת לכן אם הייתי יכולה לגרום למחלק העיתונים להיכנס לשתות שוקו חם רק פעם אחת הייתי חונקת את בעלי בלי היסוס ,If I could get the paperboy to come up for some hot cocoa just once I'd chuck my husband in a second ,I say therefore if I could get the news department to come in to drink hot chocolate only once would I strangle my husband without hesitation,60
326,האמת בעלים זה דבר פשוט נפלא  אם זה לא הבעל שלך ,Actually husbands are wonderful if they're not your own ,The truth is a husband is just a wonderful thing if it is not your husband,62
327,ובכן הם אסירי תודה אפילו על גילוי תשומת לב הכי קטנה ,They're grateful for the smallest bit of attention ,Well they are grateful for even the slightest attention,72
328,הם מאד חרמנים ,They're horny as all get- out ,They are very horny,60
329,והחלק הכי טוב בהם:,And the best part of it:,And the best part about them:,67
330,זה שהרוח שלהם כבר שבורה ,Their spirit's already been broken ,It's that their spirit is already broken,78
331,ובכן האם לשבור את הרוח שלהם זה לא חלק מההנאה ,Well isn't breaking it part of the fun ,Well whether breaking their spirit is not part of the pleasure,64
332,הו לא ההנאה היא בתי הפאר המכוניות והסקס בכל לילה ,Oh no The fun is the condos the cars and the sex every night ,Oh no the pleasure is the luxury homes the cars and the sex every night,76
333,הו תאמינו לי הדברים הכי טובים בחיים הם של מישהי אחרת ,Oh believe me the best things in life are someone else's ,Oh believe me the best things in life are someone else's,100
334,ובכן מתי בדיוק יוצא לך לראות אותו ,Well when do you get to see him ,Well when exactly do you get to see it,84
335,כלומר איך בעלים מתחמקים מהנשים שלהם ,I mean how do husbands get out ,I.e. how husbands evade their wives,62
336,ובכן יכול להיות שהם נראים כאילו הם טיפשים אבל הם בדרך כלל מוצאים תירוץ לצאת מהבית ,Well they may appear stupid but they usually find an excuse to get away ,Well they may look like they're stupid but they usually find an excuse to leave the house,71
337,זה מה שהגבר הנוכחי שלי אומר ,That's what my current guy says ,That's what my current man says,90
338,הוא נשוי למישהי ממש מרשעת ,He is married to a real shrew ,He's married to someone really mean,66
339,היא לא מבשלת בשבילו ,She doesn't cook for him ,She does not cook for him,86
340,היא לא מנקה בשבילו ,She doesn't clean for him ,She does not clean for him,86
341,ובכן זה מאד קל לרצות מישהו שאין לו כלום ,Well it's so easy to please a man who has nothing ,Well it's very easy to please someone who has nothing,84
342,את מוכנה לצביעת השיער שלך יקירתי ,Are you ready for your colour now dear ,"You're ready to dye your hair, darling",67
343,הו בודאי ,Oh sure ,Oh for sure,78
344,אבל אל תעשי אותו בצבע אדום ,Now don't let it go red ,But do not make it red,62
345,הוא אומר שהצבע הזה גורם לו לרצות להקיא ,He says that colour makes him wanna throw up ,He says this color makes him want to vomit,79
346,היי כולם אל בוגד בפגי!,Hey everybody Al's cheating on Peggy!,Hey everyone don 't cheat on Peggy!,78
347,הו מרסי תפסיקי להתלונן ,Oh Marcie stop complaining ,"Oh Mercy, stop complaining",90
348,אני חושבת שאת נראית נהדר ,I think you look great ,I think you look great,100
349,הו מרסי אני ממש מודאגת בגלל אל והאישה האחרת הזאת ,Oh Marcie I'm really worried about Al and this other woman ,Oh Mercy I'm really worried about this god and this other woman,86
350,הו למי איכפת מהבעיות מעוררות הרחמים שלך ,Oh who cares about your petty problems ,Oh who cares about your pitiful problems,90
351,יש לי ראש קסדה!,I'm a helmet- head!,I have a helmet head!,81
352,תראו זה האפיפיור!,Look it's the pope!,"Look, this is the Pope!",77
353,תלקק חריץ בקיר!,Lick a wall socket!,Lick a groove in the wall!,60
354,פשוט תעשה את מה שאמרתי והחברה שלך לעולם לא תדע שאתה בוגד בה ,Don't worry Just do what I said and your girlfriend will never find out you're cheating ,Just do what I said and your girlfriend will never know you're cheating on her,82
355,סמוך עליי ,Trust me ,trust me,100
356,אני מומחית ,I'm an expert ,I'm an expert,100
357,אני אראה אותך הלילה מתחת לספסלים ,All right I'll see you tonight under the bleachers ,I'll see you tonight under the benches,84
358,הו והפעם תשאיר את המצלמה שלך בבית תודה ביי ,Oh and this time leave your camera at home ,Oh and this time leave your camera at home thank you bye,86
359,קלי אני רוצה לדבר איתך על משהו ,Kelly I wanna talk to you about something ,Kelly I want to talk to you about something,93
360,אני ילדה טובה אמא ,I'm a good girl Mommy ,I'm a good girl mom,95
361,אמרתי בלי מצלמות ,I said no camera ,I said without cameras,68
362,הו לא אכפת לי מה את עושה ,Oh I don't care what you do ,Oh I do not care what you do,87
363,מותק תראי ,Honey look ,"Honey, look",100
364,ברור שאת כבר היית האישה האחרת מאז שלמדת איך להוריד את החיתולים שלך ,You've obviously been the other woman ever since you learned to slit your diapers up the side ,Obviously you've been the other woman since you learned how to take off your diapers,85
365,אבל תגידי לי איך החברות שלהם אף פעם לא מגלות ,But tell me how come their girlfriends never find out ,But tell me how their girlfriends never find out,95
366,ובכן את יודעת אנשים זורקים את המילה קלת-דעת כל הזמן אבל הם לא מבינים את המחקר והמורכבות שיש בהכנה לזה ,"Well you know people throw the word "" hussy"" around but they don't understand the research and preparation involved ",Well you know people throw the word frivolous all the time but they do not understand the research and complexity that goes into preparing it,76
367,ובלי המספר של המרפאה למחלות מין ,And the number of the free clinic ,And without the number of the venereal clinic,72
368,לך תסתכל במראה ותתחיל לפרפר מפחד ,Go look in the mirror and twitch ,Go look in the mirror and start fluttering in fear,63
369,בכל מקרה הדבר הראשון שאני מלמדת אותם זה שאישה יכולה להריח ריח של אישה אחרת ,Anyway the first thing that I teach them is that a woman can pick up the scent of another woman on her man ,Anyway the first thing I teach them is that a woman can smell another woman's scent,80
370,על הגבר שלה אז כדי להיפטר מזה אני אומרת להם לשפשף את הידיים שלהם בדשא ,So to get rid of it I have them rub their hands in the grass ,About her man so to get rid of it I tell them to rub their hands in the grass,85
371,אין שום אכסניית כלבים שמוכנה לקחת אותו ,Is there no kennel that will take him ,There is no dog lodge willing to take him,69
372,באד בבקשה ,Bud please ,Bud please,100
373,שנינו יודעים שאחותך לא נותנת בקלות ,We both know your sister's not a tramp ,We both know that your sister does not give easily,70
374,היא פשוט פופולרית ,She's just popular ,She's just popular,100
375,בסדר הדייט נגמר ,Okay Date's over ,Okay the date is over,81
376,ואין ריח ,Oh well I mean  ,And no smell,62
377,מה עכשיו ,Now what ,What now,100
378,הם תמיד צריכים להיות בטוחים שיש להם תירוץ טוב ,Always make sure they have an excuse ,They should always be sure that they have a good excuse,66
379,למקום שבו הם היו אממ  בספריה אצל קצין המבחן שלהם ,Somewhere they've been The library their parole officer the drunk tank ,To the place where they were um in the library with their probation officer,63
380,בבאולינג ,Bowling ,In bowling,82
381,אבא שלך משחק באולינג הערב ,Your father's out bowling tonight ,Your dad plays bowling tonight,76
382,הו ובכן ,Oh well I mean  ,Oh well,67
383,--התכוונתי התכוונתי לאנשים יותר מבוגרים מאבא ,I meant people older than Daddy ,--I meant I meant people older than Dad,85
