,hebrewFromSub,englishFromSub,englishTranslation,ratio
292,יש שמן קיק ,- There's castor oil ,There is castor oil,86
293,תני לו קצת ,Give him a little ,Give him some,67
294,אם זה לא עוזר לפחות זה לא מזיק,If it doesn't help at least it won't hurt ,If it does not help at least it is not harmful,71
295,לא תפתח את פיך ,Won't you open your mouth ,You will not open your mouth,79
296,עיו כמו שהיו העיניים של סבתא ,His eyes are just like Gran's were ,Twisted as Grandma's eyes were,69
297,עלינו להיות עדינים ,We have to be gentle ,We must be gentle,76
298,לפחות תפתח את עיניך ,At least open your eyes ,At least open your eyes,100
299,הן סגורות עכשיו ,- They're closed now ,They are closed now,81
300,אולי הוא ישן ,Maybe he's dead ,Maybe he's asleep,75
301,שתה את זה ,Here drink this ,Drink it,61
302,אמא תני לו את ,You give it to him Mother ,Mom give him your,71
303,שיניו קפוצות ,His teeth are clenched ,His teeth are clenched,100
304,אולי הוא מת ,Maybe he's dead ,Maybe he's dead,100
305,בקדושת שמך מלכותך תבוא וכך יעשה על הארץ כמו בשמיים ,Thy kingdom come thy will be done on earth as it is in heaven ,In the holiness of your name your kingdom will come and so it will do on earth as in heaven,67
306,תן לנו את לחם יומנו סלח לנו את חטאנו כפי שאנו סולחים לחטאי אחרים הרחק אותנו מפיתויים ,Give us this day our daily bread and forgive us our trespasses as we forgive those who trespass against us and lead us not into temptation but deliver us from evil ,Give us the bread of his diary Forgive us our sins as we forgive other sins Keep us from temptations,61
307,אני חושב שהוא מת ,I think he's dead ,I think he's dead,100
308,תחוש את ליבו ,Feel his heart ,Feel his heart,100
309,גם אני חושב כך ,I think so too ,I think so too,100
310,הוא מת ,He's dead ,he is dead,95
311,מה את חושבת אמא ,What do you think Mother ,"What do you think, mother?",100
312,אין ספק הוא מת ,There's no doubt He's dead ,No doubt he is dead,71
313,הוא מת ,He's dead ,he is dead,95
314,אחיך מת ,Is your brother dead ,Your brother is dead,100
315,אתה תכרה לא בור ,Will you dig a hole for him ,You will not dig a pit,73
316,השתגעת ,Are you crazy ,are you mad,75
317,הוא אחי ,He's my brother ,He's my brother,100
318,גורג מסכן שלי ,My poor Georges ,My poor George,97
319,הוא עשה זאת כל כך בשקט ,He slipped away so quietly ,He did it so quietly,61
320,לא היה מצב שיכולנו לדעת ,There was no way we could have known ,There was no situation we could have known,82
321,לו נתתי לו את זה קודם ,If only I'd given it to him sooner ,If I had given it to him earlier,64
322,לא יכולת לדעת אם זה יעזור ,You don't know that it would've helped ,You could not know if it would help,71
323,אהו אתה סתם אומר זאת ,Oh you're just saying that ,Ahu you're just saying that,87
324,צודקת אני אומר סתם ,You're right I'm saying that ,Right I'm just saying,65
325,תן לי מסמר ,Give him a little ,Give me a nail,71
326,מה אתה זומם ,- What are you up to ,What are you up to,100
327,כלום ,- Nothing ,is nothing,82
328,לא רע ,Not bad ,Not bad,100
329,מיתקן לא רע בכלל ,Not a bad contraption at all ,Not a bad facility at all,72
330,האם צריכים למסמר את הצלבים ,Do we need to nail those crosses down ,Do you need to nail the crosses,82
331,לא הם חזקים ,- They're closed now ,No they are strong,61
332,אתה זקוק לי ,You need me anymore ,You need me,73
333,תן לי מסמר ואתה חפשי ,Hand me a nail and you can go ,Give me a nail and you're free,68
334,יש לי צלבים ,I've got crosses ,I have crosses,67
335,שלושה ,Why three ,three,71
336,למה שלושה ,Why three ,Why three,100
337,ישנם רק כלבי והחפרפרת את צודקת ,There's only my dog and the mole You're right ,There are only dogs and the mole is right,77
338,לא יש לך כבר קצת ,No you already had some ,You do not have a little already,62
339,את אוהבת אפרוחים ,Do you like chicks ,You love chicks,79
340,כלם לקום!,Everybody up!,Everyone get up!,67
341,מה זה ,What's that ,What is,67
342,תראו תראו ,Look ,Look look,62
343,האם זה הבן של גוארד ,- Is that Gouard's son ,Is this Guard's son?,87
344,המלחמה לא הסתיימה ,They're so warm ,The war did not end,65
345,עם דפוק כמוהו זה לא מפתיע תתגנב מאחור ותראה אם זה פרנסיס ,With bums like him it wouldn't surprise me Sneak around back and see if it's Francis ,With a fuck like him it's not surprising you sneak up behind and see if it's Francis,75
346,אני אקצור קצת עשב לארנבות ,I'll cut some grass for the rabbits ,I'll harvest some grass for the rabbits,84
347,אין יותר מפקדים אין אנגלים אין כלום ,There are no more leaders no more English no more nothing ,No more commanders no English no more,62
348,"כך אמרתי לעצמי  אין סיבה לצעוד ללא סוף"" ","So I said to myself  ""No point marching forever ""","I told myself there was no reason to march endlessly """,60
349,אל תגעי בזה ,Don't touch that ,Do not touch it,77
350,איפה הפרוסים ,Where are the Prussians ,Where are the slices,79
351,ביחידת הפרשים היו לנו סוסים ,- In the cavalry we had horses ,In the cavalry unit we had horses,92
352,היה מסלול מהיר ,- Half-tracks are faster ,There was a fast track,68
353,בשנת 1918 לא הינו צריכים למהר ,In '18 we didn't need to run ,In 1918 we did not have to hurry,64
354,רוצה עזרה ,- Want a hand ,Want Help,60
355,מה אתה זומם ,- What are you up to ,What are you up to,100
356,זה לא שלך ,- It's not yours to cut ,It's not yours,80
357,זה פרנסיס!,It's Francis!,This is Francis!,81
358,ועוד הם מתפלאים איך הפסדנו את המלחמה,And they wonder how we lost the war ,And they are even more amazed at how we lost the war,64
359,את בסדר ,You need me anymore ,you are fine,65
360,כן ,- Yes ,Yes,100
361,הסתכלי ,Look ,Look,100
362,הם כל-כך חמים ,They're so warm ,They're so hot,69
363,את מאושרת ,Are you happy ,You're happy,72
364,נשבעת שלא תהרוג אותם ,- You swear you didn't kill them ,I swear you will not kill them,73
365,כן ,- Yes ,Yes,100
366,אני רק רציתי להשקותם ,I just wanted to give them a drink ,I just wanted to water them,69
367,אבל עינייהם היו עצומות ,But their eyes were closed ,But their eyes were closed,100
368,חשבתי אולי הם ישנים ,"I thought ""Maybe they're asleep """,I thought maybe they were asleep,87
369,אני אעשה להם קישוט ,I'll make them a wreath ,I'll make them a decoration,64
370,שינייהם היו קפוצות אז חשבתי: אולי הם מתים ,"Their teeth were clenched so I thought ""Maybe they're dead """,Their teeth were clenched so I thought: maybe they are dead,94
371,למה ,Why ,Why,100
372,כי ככה זה ,That's just how it is ,Because that's how it is,71
373,את מרוצה ,You're never satisfied ,You are satisfied,82
374,אתה רבט ,You're a corporal ,You are a rabble-rouser,65
375,כן קודמתי במילחמה ,Yes I was promoted in battle ,"Yes, I was promoted in the war",74
376,מי סיפר לך שאני רועה את הפרות ,- Who told you I watch the cows ,Who told you I'm grazing the cows,74
377,מישל ,- Michel ,Michelle,86
378,מישל ופולט הם חברים קטנים ,Paulette Michel's little friend ,Michelle and Pollet are little friends,72
379,כן ,- Yes ,Yes,100
380,חמש  ,Five  six ,five,67
381,שש  זה רחוק ליד הגשר ,It's far off at the bridge ,Six is ​​far by the bridge,72
382,הם עוקבים אחרי ,They're following me ,They follow me,82
383,אין יותר אהבה ,No more lovey-dovey ,There is no more love,65
384,פולט כאן ,- She sure is ,Emits here,67
385,בטח היא כאן ,Michel come here ,She must be here,62
386,הבאת את האפרוחים ,Have you got the chickens ,You brought the chicks,60
387,תראי מה הבאתי ,Look what I got ,Look what I brought,82
388,הם מכוערים ,They're ugly ,They are ugly,96
389,את אף פעם מרוצה ,You're never satisfied ,You are never satisfied,84
390,אנחנו מוכרחים להכניסו ,- Do we have to take it inside ,We have to put it in,75
391,העגלה לא מאד חזקה ,It's not very sturdy ,The cart is not very strong,60
392,אם נגרור את הארון החוצה ופנימה  זה חייב להעשות ,If we keep dragging the coffin out and pushing it back in - It has to be done ,If we drag the closet out and in it must be done,67
393,איזה דבר קרה ,What a thing to happen!,What happened,63
394,לא היית צריכה ,You shouldn't have ,You did not have to,65
395,זו האחרונה אני מפחדת שזו לדודה ,It was the last one so I'm afraid it's for a female cousin ,The latter I'm afraid it's for Auntie,65
396,לפחות תהיה לו הלוויה נוצרית ,At least he'll have a Christian burial ,At least he will have a Christian funeral,78
397,עם דרשה ,- With a mass ,With a sermon,67
398,אתה לא נכנס ,Right You didn't know ,You did not enter,63
399,רק רגע ,Just a minute ,just a minute,100
400,עשר  אחד עשר  שניים עשר ,Ten  eleven  twelve ,Ten Eleven Twelve,100
401,שלשה עשר  ארבעה עשר ,Thirteen  fourteen ,Thirteen Fourteen,100
402,גם כך הם לא יפים כל-כך ,They're not very pretty anyway ,"Even so, they are not so pretty",63
403,הסתכל ,Look ,Look,100
404,זה הקטן טוב בשביל דבורה ,That one would be good for a bee ,This little one is good for a bee,65
405,דבורים עוקצות ,Bees sting ,Stinging bees,87
406,כן אבל הן לא רעות ,Yeah but not too bad ,Yes but they are not bad,73
407,אל תצחקי ,- Don't laugh ,Do not laugh,87
408,זה ממש מוזר ,That's really strange ,That's really weird,65
409,מישל בוא מהר ,Michel come here ,"Michelle, come quickly",65
410,תציית לאביך ,Do as your father says ,Obey your father,68
411,אמרתי לך לבדוק את הצלבים ,I told you to check the crosses ,I told you to check the crosses,100
412,הם היו מחוזקים ,He noticed the crosses were gone ,They were strengthened,63
413,לא אני לא איבדתי אותם ,No we didn't lose them ,No I did not lose them,82
414,אם הם לא אבדו אז מישהוא לקח אותם מי עשה זאת ,If they're not lost then someone took them Who'd do that ,If they were not lost then someone took them who did it,83
415,אני לא יודע ,I don't know ,I do not know,88
416,אולי הגוארדים ,Maybe the Gouards ,Maybe the guards,97
417,הפעמונים מצלצלים ,The bell's ringing ,The bells are ringing,82
418,יתכן שזה מעשה הגוארדים ,Maybe the Gouards ,This may be the act of the guards,60
419,הוא שם לב להעלמות הצלבים ,He noticed the crosses were gone ,He noticed the disappearance of the crosses,72
420,אמרתי שאלו הגוארדים,I said it was the Gouards ,I said these were the guards,72
421,הבט על זה ,- Look at that one ,Look at that,86
422,הם לא אמרו מילה ,They didn't say a word ,They did not say a word,89
423,ריימונד חסר התועלת ,That Raymond's useless ,Raymond is useless,75
424,יש את ברטה היא פועלת טובה ,There's Berthe She's a good worker ,There's Bertha she's doing well,74
425,היא זונה ,She's a whore ,She's a whore,100
426,הלו איפה הנימוסין ,He noticed the crosses were gone ,Hello where is the courtesy,61
427,היה עליך להגן על צרפת עם סוסי הפלדה שלך צרפת ,You should've defended France with your iron horses ,You had to defend France with your steel horses France,74
428,אני לא יכול להתחתן עם צרפת,France I can't marry France ,I can not marry France,82
429,מה אתה מתכוון להתחתן עם ברטה הבובה ,You mean you might marry Berthe Dollé ,What are you going to marry Bertha the doll,63
430,שנהיית טיפש ואולי בעיטה טובה מסוס הייתה דוחפת לך קצת הגיון לתוכך!,And maybe a swift kick from those cavalry horses might have knocked some sense into you!,Being stupid and maybe a good kick from a horse would have pushed some logic into you!,67
431,מה אתה מדבר ככה לאביך ,- You speak to your father like that ,What are you talking like that to your father,78
432,אני מתכוון לזה!,I mean it!,I mean it!,100
433,וזה לא הכל!,And that's not all!,And that's not all!,100
434,אני הולך להתחתן עם ברטה אתה שומע ,I'm going to marry Berthe you hear ,I'm going to marry Bertha you hear,97
435,זהו זה ,- That's the priest's ,that's it,64
436,ועכשיו ידידי מספר מילים למשפחה אשר סוחבת עליה נטל כבד ,And now my friends a few words for a family carrying a very heavy burden ,And now my friend a few words to a family which carries a heavy burden on it,81
437,זה יהיה טוב לסוסה ,That one would be good for a mare ,It would be good for a mare,80
438,וזה ליונה ,And that one for a pigeon ,And that's for a pigeon,88
439,חתול ,A cat ,cat,75
440,וזה מתאים לגירפה ,And that one for a giraffe ,And it's suitable for a giraffe,74
441,אמרתי לעצמי זה מעשה של הגוארדים ,Maybe it was the Gouards ,I told myself it was an act of the guards,65
442,יש לך הוכחות ,You have any proof ,You have proof,88
443,הם קוראים לי עריק ,- They call me a deserter ,They call me a deserter,100
444,הוא מקנא ,- He's jealous ,He is jealous,80
445,לעגו לי פרנסיס יותר עריק ממני ,Francis is more of a deserter than me ,"I was ridiculed by Francis, a deserter more than I am",72
446,אשבור את גבו אם הוא ממשיך עם זה ,I'll break his back if he keeps this up!,I'll break his back if he continues with this,74
447,אני מכבד את המת ולהם אין כבוד בכלל!,I respect the dead but they have no respect at all!,I respect the dead and they have no respect at all!,94
448,זה אתה שלקחת את הצלבים מהכירכרה ,- You took the crosses off the hearse ,It's you who took the crosses from the carriage,66
449,כן אבי ,- Yes Father ,"Yes, my father",87
450,אבל למה ,But why ,but why,100
451,למי ,- For whom ,whom,67
452,לא יכול לומר ,I can't say ,Can not say,73
453,תביא לי אותם מייד ,Bring them to me right away ,Bring them to me right away,100
454,אבינו שבשמיים  פעמיים אבי ,Our Father who art in heaven  Twice Father ,Our Father in heaven twice my Father,86
455,זה היה מסיבה טובה ,- It was for a good reason ,It was a good party,70
456,אני בטוח שכן ,- I'm sure it was ,I'm sure it is,76
457,אבל רתמת אם העגלה לפני הסוס ,But you've put the cart before the horse ,But you harnessed the mother of the cart before the horse,76
458,אנחנו רוצים להתחתן ,We want to get married ,We want to get married,100
459,פשוט אין לנו אומץ לספר להורים ,We just don't dare tell our parents ,We just do not have the courage to tell parents,68
460,אתה מכיר אותם ,You know how they are ,You know them,71
461,כן אני מכיר ,Yes I did ,Yes I know,63
462,חשבנו שאתה ,And we thought you might -,We thought you were,65
463,בדיוק ,- Exactly ,exactly,100
464,מישל ראיתי אותך ,Michel I saw you ,"Michelle, I saw you",94
465,לקחת את הצלב מהמזבח!,Taking the cross right off the altar!,Take the cross from the altar!,80
466,קח את נעליך ועוף מפה!,Get your shoes and get out!,Take off your shoes and fly away!,62
467,מה הוא עשה ,- What did he do now ,what did he do,88
468,זה לא מעיניינך ,- I'm not talking to you anymore ,This is not of interest to you,63
469,נו דיברת עם הגוארדים ,Well did you speak to Gouard ,"Well, you talked to the guards",70
470,כן דיברתי ,Yes I did ,Yes I spoke,60
471,אמרתי אז מה אתם גונבים עכשיו צלבים ,"I said "" So now you steal crosses off hearses """,I said then what are you stealing crosses now,64
472,הוא אמר איזה צלבים ,"He said ""What crosses """,He said some crosses,80
473,אז אמרתי אל תתחכם והוא אמר ,"So I said ""Don't be a wise guy "" And he said ",So I said do not get smart and he said,71
474,אני נשבע על קבר אישתי לא נגעתי בצלבים האלו ,"""I swear on my wife's grave I didn't touch those crosses """,I swear on my wife's grave I did not touch these crosses,92
475,הקבר שלה ,Her grave ,Her grave,100
476,זה בדיוק מה שאמרתי ,Let me finish That's exactly what I said ,That's exactly what I said,79
477,אמרתי לא הייתי נשבע בקבר שלה זה לא קבר ,"I said "" I wouldn't be swearing on her grave That's no grave ",I said I would not swear in her grave it is not a grave,74
478,תשבע על קיברה כמה שתרצה מוטב היה לו ניקית את הקבר ,"Swear on her grave all you want but you'd do better just to clean the thing up """,Swear on her grave as much as you wish he had better clean the grave,63
479,איש לא סיפר להם ,- No one told them ,No one told them,100
480,כאילו לא ידעו ,- As if they didn't know ,As if they did not know,93
481,גם אם ידעו ,- As if they didn't know ,Even if they knew,67
482,זה לא קלרינט זו תצוצרה ,It's not a bugle It's a trumpet ,"It's not a clarinet, it's a product",62
483,מה שזה לא יהיה הוא עדיין עריק ,Whatever it is he's still a deserter ,Whatever it is he is still a deserter,93
484,אפרוח ,"""Chick """,Chick,100
485,אנו צריכים שניים ,We need two ,We need two,100
486,ישנם שני קברים,There are two graves ,There are two tombs,67
487,JOCK WORM CRICKET אה איך קוראים לזה ,JOCK WORM CRICKET What's that called ,JOCK WORM CRICKET Oh what's it called,85
488,צרצר ,"""Chick """,cricket,67
489,הוא עוקץ ,Does it sting ,He stings,64
490,לא אבל הוא מסריח ,No but it stinks ,No but it stinks,100
491,זה לא אני זו הפצצה ,It wasn't me It was a bomb ,It's not me it's the bomb,75
492,השתגעת ,Are you crazy ,are you mad,75
493,אם אנו רוצים לקברם אני לא מדברת איתך יותר טמבלית!,- I'm not talking to you anymore ,If we want to bury them I'm not talking to you anymore stupid!,66
494,גם כך הבטחת לי את הצלב של הכומר ,Anyway you promised me the priest's cross ,"Even so, you promised me the priest's cross",82
495,את לא הוגנת ,You're no fair ,You're not fair,97
496,אני לא רוצה את זה ,I don't want it ,I do not want it,90
497,מה זה ,What is it ,What is,82
498,יד של בובה ,- A doll's hand ,Doll's hand,92
499,לא רוצה את זה ,I don't want it ,Do not want it,83
500,את ברוגז בגלל הצלב ,- What you said about the priest's cross ,You're upset about the cross,73
501,זמן לישון ,Bedtime ,Time for bed,74
502,לילה טוב אדון דולה ,- Good night Mr Dollé ,Good night Mr. Doula,92
503,לילה טוב מתוקה ,- Night sweetie ,Goodnight Sweetheart,73
504,מה אתה עושה ,- What are you doing ,What are you doing,100
505,אתה רוצה שאנשק אותך ,- Want me to kiss you ,You want me to kiss you,90
506,את לא בסדר ,Are you crazy ,you are not okay,69
507,למה ,Why ,Why,100
508,בקשר למה שאמרת על הצלב של הכומר ,- What you said about the priest's cross ,About what you said about the priest's cross,93
509,לא נתת לי אותו ,- You didn't give it to me ,You did not give it to me,94
510,ניסיתי וחטפתי סטירה בגלל זה ,I tried and I got a good slapping for it ,I tried and got slapped for it,80
511,נשקיני כאן ,Kiss me here ,My kiss here,92
512,אמרתי למיטה!,I said get to bed!,I said to the bed!,76
513,אני מגיע ,- I'm coming down ,I'm coming,80
514,אני מכירה מקום עם צלבים ,I know a place with crosses ,I know a place with crosses,100
515,איפה ,- Where ,where,100
516,בבית-קברות ,- The cemetery ,In a cemetery,72
517,את לא מפחדת ,- You're not scared ,You're not scared,100
518,למה ,Why ,Why,100
519,ומה אם המתים יסחבו אותי מהרגליים ,What if dead people grab me by the feet ,And what if the dead dragged me off my feet,66
520,אני לא רוצה ,I don't want it ,I do not want,79
521,אתם רוצים שאני אעלה ,- Want me to kiss you ,You want me to come up,73
522,אני סתם צחקתי ,I was just kidding ,I was just laughing,76
523,מתים לא מפחידים ,Dead people aren't scary ,Dead are not scary,76
524,באמת ,- Really ,really,100
525,כן ,- Yes ,Yes,100
526,מה הפרוש של לרתום את העגלה לפני הסוסים,"What does that mean anyway ""putting the cart before the horse"" ",What does it mean to harness the cart before the horses,71
527,בדיוק מה שאנחנו עושים עכשיו ,What we were doing just now ,Exactly what we are doing now,68
528,מעולם לא שמעתי את המשפט הזה ,I've never heard it called that before ,I've never heard that sentence,62
529,ניקח את המריצה ,- We'll take the wheelbarrow ,We'll take the wheelbarrow,100
530,לשם מה ,- What for ,For what,100
531,נמלא אותה במלא צלבים ,We'll fill it full of crosses!,We'll fill it with crosses,76
532,אני מפחדת!,- I'm scared!,I'm scared!,100
533,זה טיל עצמי את עינייך ,- It's a rocket Close your eyes ,It cast your own eyes,68
534,אני לא רואה את דרכי למטה אם אני עוצמת את עיניי ,I can't see my way down if I close my eyes ,I do not see my way down if I close my eyes,85
535,מה אתה עושה כאן ,- What are you doing ,what are you doing here,88
536,ומה איתך ,- What about you ,What about you,100
537,מה זה עיניינך ,- Is that any of your business ,What's your business?,79
538,אני לוקח את המריצה ,- We'll take the wheelbarrow ,I take the wheelbarrow,88
539,את רואה מה ,- You see what ,You see what,100
540,זה כלום ,- Nothing ,It's nothing,74
541,מריצה בשעה זו!,- A wheelbarrow at this hour!,Wheelbarrow at this time!,76
542,אתה לא מפחד ,- You're not nice ,You're not afraid,75
543,לא ואת ,- No are you ,no and you,80
544,לא אשיר לך שיר ,No Shall I sing a song ,I will not sing you a song,67
545,אם את רוצה ,If you want ,If you want,100
546,עליינו לשכב ,We have to get down ,We must lie down,63
547,הם לא יכולים לראותנו ,They can't see us ,They can not see us,83
548,אבדנו צלב ,- We lost a cross ,We lost a cross,100
549,יש לנו המון ,- We lost a cross ,We have a lot,64
550,זו לנו הדרשה הראשונה בלעדיו ,It's our first Sunday mass without him ,This is our first sermon without him,76
551,קדימה ,- What for ,forward,67
552,אני לא רוצה ,I don't want to ,I do not want,79
553,הא לך ,- You see what ,Ha you,67
554,לכי לקטוף פרחים ,Go pick some flowers ,Go pick flowers,86
555,למה ,- Why ,Why,100
556,מהר לכי לקטוף פרחים ,Go pick some flowers quick ,Quickly go pick flowers,86
557,הם לא היחידים שאיבדו מישהוא ,They're not the only ones who've lost somebody ,They are not the only ones who have lost someone,79
558,אוי אלוהים!,My God!,Oh My God!,80
559,זה הצלב של גורג ,That's Georges's cross ,This is George's cross,86
560,מה ברור ,- What is ,What is clear,70
561,מוכיח מה ,- Proves what ,Proves what,100
562,היא צודקת זה מוכיח הכל ,She's right That proves it ,She's right it proves everything,72
563,אני לא הולך ,I'm not going ,I'm not going,100
564,אלו הגוארדים!,It's the Gouards!,These are the guards!,67
565,הצלב נעלם ,The cross is gone!,The cross is gone,100
566,זה לא שם ,It's not there ,It's not there,100
567,אוי אלוהים,My God!,Oh My God,80
568,מפלצת!,Monster!,monster!,100
569,האם הכאבת לעצמך ,- Did you hurt yourself ,Did you hurt yourself,100
570,אבא ,Father ,father,100
571,ענה לי!,Answer me!,answer me!,100
572,הוא איש רע!,He's a bad one!,He's a bad man!,86
573,זה לא מקום מתאים למכות ,This is no place to be fighting ,This is not a suitable place for beatings,64
574,איפה נלחמת אתה עריק אחד זה אתה העריק ,Where did you fight you deserter You're the deserter ,Where you're fighting you one defector is the one you defected,74
575,יש לי אלבומין ,I have albuminuria ,I have an album,79
576,אלבומין!,Albuminuria!,Albumin!,78
577,די זה מספיק!,That's enough now!,Enough is enough!,67
578,אבות מבוגרים אתם לא מתביישים ,Grown men and fathers - aren't you ashamed ,Older fathers you are not ashamed,74
579,הוא גנב את הצלב של גורג ,- He stole Georges's cross ,He stole George's cross,98
