,hebrewFromSub,englishFromSub,englishTranslation,ratio
580,אני לא גונב ממתים!,- I don't steal from the dead!,I'm not stealing from the dead!,74
581,אתם לא מתביישים ,- Aren't you ashamed ,You are not ashamed,92
582,דולא זה הוא שגנב ,- Who was it then ,It was this doula who stole,62
583,אני מכיר את הקונדסאי שגנב את הצלבים הוא גם ניסה לגנוב ,I know the prankster who's been stealing crosses ,I know the prankster who stole the crosses he also tried to steal,69
584,את צלב המזבח מישל בא לכאן!,He tried to steal the one off the altar Michel come here!,The cross of the altar Michelle came here!,68
585,היי ומה איתי ,Hey what about me ,Hi and what about me,81
586,ערימת ממזרים ,Bunch of bastards!,A pile of bastards,63
587,גוק הכלב ,JOCK THE DOG,Gook the dog,83
588,רובין ,ROBIN,Robin,100
589,אל תכאיב לו ,- Don't hurt him ,Do not hurt him,90
590,אני לא יכול ,I can't ,I can not,88
591,אני לא יודע איפה הוא ,I don't know where he is ,I do not know where he is,94
592,זה עדיין כואב ,Does it still hurt ,It still hurts,81
593,מה הוא עשה עם 14 צלבים ,What could he have done with 14 crosses ,What did he do with 14 crosses,75
594,אני לא מבין ,I don't understand ,I do not understand,92
595,כנסי למיטה ,Get to bed ,Get in bed,80
596,תן לי לגמור ,- Let me finish ,Let me finish,100
597,מה זה ,- What is it ,What is,82
598,אני לא יודעת אבל זה יפה ,- I don't know but it's beautiful ,I do not know but it's beautiful,89
599,ארבעה עשר ,Fourteen ,fourteen,100
600,כן ארבעה עשר ,Yes fourteen ,Yes fourteen,100
601,אני והכומר ספרנו אותם ,The priest and I counted them ,The pastor and I counted them,90
602,וזה בלי הצלב של גורג,- He stole Georges's cross ,And it's without George's cross,69
603,שניים של הברדילונים ,The Bredillons - two ,Two of the Bradylons,79
604,שלשה של אלמנת אנרט הגוארדים!,The widow Entrat - three ,Three of the Guardian Widow's Widow!,63
605,זה קל ,That's easy ,It is easy,76
606,של גורג עלה 250 פרנקים ,Georges's was 250 francs ,Of George cost 250 francs,73
607,מ250 כפול 14 קח 14 ותכפיל ב ,250 multiplied by 14  Take 14 and carry the -,From 250 double 14 take 14 and multiply by,74
608,אף פעם לא ידעת חשבון!,You never could do math!,You never knew an account!,62
609,חכה עד שאתפוס אותו ,Just wait till I find him ,Wait until I catch him,68
610,למה אתה לא רוצה ,Why don't you want to ,why do not you want,85
611,התאמר לי ,Will you tell me ,Tell me,61
612,את יודעת אז תאמר לי ,You know so tell me ,You know so tell me,100
613,אני לא יודעת ,I don't know ,I do not know,88
614,כן את יודעת ,Yes you do ,Yes you know,82
615,אפיך מפרכס למה ,Your nose is twitching ,Your nose twitches for what,69
616,הוא מפרכס מתי שמשקרים ,- Why - It twitches when you lie ,He twitches when you lie,85
617,את מבינה מה מישל עשה ,You realize what Michel did ,You understand what Michelle did,75
618,הוא גנב את הצלב של אחיו!,He stole his own brother's cross!,He stole his brother's cross!,93
619,זה נאה כך לעשות ,Is that a nice thing to do ,It's nice to do that,74
620,לא חשבתי שתיבכי ,I didn't ask you to cry ,I did not think you would cry,69
621,שאלתי איפה הצלבים ,I asked where they are ,I asked where the crosses were,65
622,למה אתם צריכים את הצלבים ,What do you want crosses for ,Why do you need the crosses,73
623,הם לא צעצועים ,They're not toys ,They are not toys,79
624,לא הם לא צעצועים ,No they're not toys ,No they are not toys,82
625,הקשיבי ,Now listen ,Listen,75
626,אדון דולא יחטיף לך עד ש ישבנך ישחיר ויכחיל אז במקום זה ספרי לי ,Mr Dollé will spank your bottom until it's black and blue So just tell me instead ,Mr. Dula will kidnap you until your ass turns black and blue so tell me instead,72
627,אני אביא אותם ואיש לא יוסיף לדבר על זה זה לא יותר טוב ,I'll go get them and no one will say another word Isn't that better ,I will bring them and no one will continue to talk about it it is no better,61
628,את רואה ,- You lie!,you see,71
629,אז איפה הם ,Where are they ,So where are they,90
630,אני לא יודעת ,I don't know ,I do not know,88
631,אז למה לקחתם את המריצה מהאסם אני אספר לאדון דולא!,Then why did you take the wheelbarrow from the barn I'll tell Mr Dollé! - What'll you tell Mr Dollé ,So why did you take the wheelbarrow from the barn I'll tell Mr. Dula!,78
632,הא הנה אתה!,So there you are!,Ha here you are!,84
633,אני גם אומר לו ,- I'll call him ,I also tell him,79
634,מה ,- What ,what,100
635,אם מי היית באסם,- Who you were with in the barn ,If who were you in the barn,86
636,וגם את!,- So do you!,you too!,75
637,אני אקרא לו ,- I'll call him ,I'll call him,100
638,אמרתי למיטות ,I said to get to bed!,I said to the beds,79
639,אם הוא יקיש על הדלת תנו לו להיכנס כאילו כלום ואז תקראו לי ברור ,If he knocks on the door let him in like nothing's happened then come get me understand ,If he knocks on the door let him in like nothing and then call me clear,75
640,לילה טוב מלאכון ,Good morning ,Good night Malchon,67
641,אני לא רואה איך להתפשט ,I can't see to get undressed ,I do not see how to undress,65
642,בשביל מה שיש לך להראות  לילה טוב אדון ריימונד ,For all you've got to show  Good night Mr Raymond ,For what you have to show good night Mr. Raymond,82
643,אני אומר לך לילה טוב כאשר תחזירו את הצלבים,I'll say good night to you when you return the crosses ,I'll tell you good night when you return the crosses,91
644,את באה ,- You coming ,are you coming,83
645,לאן ,- Where ,where,100
646,לבית הקברות ,- To the cemetery ,To the cemetery,100
647,לא עכשיו יש חושך ,- Not now It's dark ,Not now there is darkness,71
648,נלך מחר ,We'll go tomorrow ,We'll go tomorrow,100
649,כל הצלבים והשמות!,All the crosses and names!,All the crosses and names!,100
650,ספר לי ,Will you tell me ,tell me,61
651,ארגנתי כמה חלוקי נחל ,I arranged some pebbles ,I arranged some pebbles,100
652,כל החיות שמה וגם פרחים ,All the animals are there and flowers too ,All the animals are named and also flowers,80
653,חתיכות של שלטים וגם חלזונות,Pieces of broken plate and snails -,Pieces of signs and also snails,66
654,אני הולך לישון באסם ,I'm gonna sleep in the barn ,I'm going to sleep in the barn,88
655,את כאן ,So there you are!,Are you here,86
656,בוקר טוב ,Good morning ,Good Morning,100
657,לאן ,- Where ,where,100
658,לראות את בית הקברות ,To see the cemetery ,See the cemetery,91
659,אני רעבה ,I'm hungry ,I'm hungry,100
660,לא אוהבת תפוחי עץ ,I don't like apples ,Do not like apples,86
661,אין לי משהו אחר ,That's all I have ,I have nothing else,61
662,את בררנית איומה ,You're awful picky!,You're a terrible picky eater,60
663,זהו הגוארדים הגישו תלונה ,The Gouards have filed a complaint!,This is the guards filed a complaint,86
664,אתה חושב שזה מצחיק ,You think that's funny ,You think it's funny,81
665,זה אתה שתשלם עבור הצלבים ,Are you gonna pay for the crosses ,It's you who'll pay for the crosses,71
666,הוא לא רחוק ,- He's not far ,He is not far,80
667,למה לא אמרת זאת מקודם ,- Why didn't you speak up before ,Why did you not say that before,79
668,לא שאלת ,- You didn't ask ,You did not ask,90
669,לעזאזאל המשטרה!,- Damn it the police!,Damn the police!,91
670,מה יעשו לנו ,- What'll they do to us ,What will they do to us,82
671,לא יודע אבל אל תפלטי מילה ,I don't know but don't say a word ,I do not know but do not utter a word,80
672,נשבעת ,I swear ,I swear,100
673,לא אמרי: נשבעת אני ,"No say ""I swear """,I will not say: I swear,78
674,נשבעת ,I swear ,I swear,100
675,וגם אני נשבע ,And I swear too ,"And I swear, too",100
676,פרחח קטן!,You little brat!,Little brat!,85
677,עכשיו המשטרה פה!,Now the police are here!,Now the police are here!,100
678,אתה מתכוון לגלות לי איפה הצלבים ,You gonna tell me where those crosses are ,You're going to tell me where the crosses are,86
679,תגיד לי עקשן קטן ,Tell me you stubborn little runt!,Tell me a little stubborn,81
680,איפה הם דבר ומהר!,Tell me where they are!,Where are they thing and fast!,63
681,אתה מעדיף ללכת לכלא ,- You'd rather go to jail ,You'd rather go to jail,100
682,ו14 צלבים למען השם!,Fourteen crosses for God's sake!,And 14 crosses for God's sake!,73
683,מה עשית עם ארבעה עשרה צלבים ארבעה עשרה צלבים!,What did you do with 14 crosses Fourteen crosses!,What did you do with Fourteen Crosses Fourteen Crosses!,88
684,עזוב אותו!,Leave him alone!,leave him!,75
685,את לא רואה שאני עסוק ,- Can't you see I'm busy ,You do not see that I'm busy,76
686,עזוב אותו!,Leave him alone!,leave him!,75
687,הם לא באו בעינין הצלבים ,Are you gonna pay for the crosses ,They did not come for the crosses,64
688,הם באו בשביל פולט ,They came for Paulette ,They came for Pollet,86
689,הם מחפשים אותה בואי ,That's right They came looking for her Come along ,They're looking for her. Come on,68
690,הם לא יכולים לקחת אותה!,- They can't take her!,They can not take her!,95
691,מי שואל אותך ,- Who asked you ,Who asks you,88
692,הם לא יכאיבו לה ,They won't hurt her ,They will not hurt her,83
693,היא הולכת לבית יתומים עם עוד בנות אני לא יכולה ללכת ,They'll take her to an orphanage with other little girls I don't want to go ,She's going to an orphanage with more girls I can not go,63
694,היא לא הולכת!,- She's not going!,She's not going!,100
695,אל תפחדי ,Don't be afraid ,do not be afraid,90
696,הם נחמדים ,They're nice ,they are nice,72
697,אם אומר לך איפה הצלבים תשאיר אתה כאן ,If I tell you where they are will you keep her ,If I tell you where the crosses are you will leave here,85
698,אין לזה קשר למקרה ,- That's got nothing to do with it ,It has nothing to do with the case,76
699,אם כך לא תראה אותם לעולם!,You'll never get them now!,If so you will never see them!,63
700,אטפל בך אחר כך ,- I'll take care of you later ,I'll take care of you later,100
701,תרשי לה להישאר ,- Then how - Let her stay ,Let her stay,73
702,נחזיר את כל הצלבים ,All the crosses and names!,We will return all the crosses,62
703,ונתנצל בפני כלם היא תהיה נוצריה ותלך לבית-הספר ותעזור סביב הבית ,And she'll go to catechism and school and help around the home ,And apologize to everyone she will be a Christian and go to school and help around the house,70
704,ואז תתחתנו ,And then you'll get married ,Then you will get married,77
705,תאמר לי איפה הם ,Tell me where they are!,Tell me where they are,100
706,לא הבטחת ,- You didn't promise ,You did not promise,86
707,אמור לי איפה הם ,Tell me where they are!,Tell me where they are,100
708,גלה לו מישל ,Tell him Michel ,Michelle revealed to him,67
709,בתחנה ,At the mill ,At the station,64
710,למה בתחנה ,Why the mill ,Why at the station,60
711,בוא איתי ,Come with me ,Come with me,100
712,הנה היא הדבר המסכן ,Here she is the poor thing ,Here is the poor thing,92
713,שלום ילדה ,Hello little girl ,Hello Girl,74
714,מה שמך ,What's your name ,What is your name,85
715,מה שמה ,What's her name ,What's her name,100
716,אנו קוראים לה פולט ,- We call her Paulette ,We call it emitter,63
717,האם הורייך נהרגו בהפצצה ,Your parents were killed in the bombings ,Were your parents killed in the bombing?,99
718,מה ,- What ,what,100
719,זה מה שהיא סיפרה לנו ,- That's what she told us ,That's what she told us,100
720,למה את מתכוונת לא ,What do you mean no ,What do you mean no?,100
721,נסי להיזכר ילדתי ,Try to remember my child ,Try to remember my child,100
722,אל תדאגי ,Don't worry ,Do not worry,87
723,היא תיזכר ,She'll remember ,She will be remembered,70
724,אין לנו אפילו את שמה ,We don't even have her name ,We do not even have her name,95
725,היא תאמר לי ,She'll tell us ,She will tell me,67
726,שמך פולט מה ,What's your name ,Your name emits what,78
727,פולט מה ,What's her name ,Emits what,64
728,דולא ,- Dollé ,dollar,80
729,עכשיו היא אומרת ששמה : דולא!,Now she says her name's Dollé!,Now she says her name is: Dula!,84
730,אני רוצה את השם של מישל ,I want Michel's name ,I want Michelle's name,95
731,כאלה הם הילדים ,Now the police are here!,Such are the children,64
732,אנו זקוקים לעובדות ,- We need the facts ,We need facts,87
733,אתה לוקח אותה נכון ,- You'll take her though right ,You're taking it right,64
734,לצלב האדום ,To the Red Cross ,To the Red Cross,100
735,את רואה עכשיו תצאי לטיול נחמד עם ,You're going for a ride with these nice men ,You see now go on a nice trip with,60
736,תחתום כאן אדון דולא ,Sign here Mr Dollé ,Sign here Mr. Dollar,94
737,אתה לא יכול!,You can't!,You can not!,90
738,אתה הבטחת!,You promised!,you promised!,100
739,ראשית לא הבטחתי שנית שתוק ,First I didn't promise and second shut up ,First I did not promise to be silent again,70
740,שקרן!,Liar!,liar!,100
741,ככה אתה מדבר לאביך ,You talk like that to your father ,This is how you talk to your father,82
742,אם אגלה לו איפה הצלבים שקט ,He said she could stay if I told him where the crosses are Be quiet ,If I tell him where the crosses are quiet,70
743,איזה צלבים ,- What crosses ,What crosses,100
744,טוב אתה מכיר את הילדים ,- Oh you know kids ,Well you know the kids,79
745,הנה שמור לך אותם ל100 שנים ,Here Keep this for a hundred years ,Here you keep them for 100 years,70
746,אל תאבדי את זה ,Don't lose that now ,Do not lose it,67
747,אחות היא אמרה לך את שמה ,Did she tell you her name Sister ,Nurse she told you her name,71
748,יחד עם כל הילדות כמוך כלן יחלקו איתך את הצער אבל יחד תהיינה מאושרות ,With other little girls just like you all with their own share of sorrow but you'll all be very happy together ,Together with all the girls like you all of them will share the grief with you but together you will be happy,69
749,עכשיו אל תזוזי ותהיי טובה ,Now don't move and be good ,Now do not move and be good,87
750,איישו את התורן!,Man the capstan!,Staff the mast!,62
751,נקראתם אל הסיפון להפלגה האחרונה של הפיראט האדום לפני שנים רבות הרחק באיים הקאריבים ,You've been shanghaied aboard for the last cruise of the Crimson Pirate  a long long time ago in the far far Caribbean ,You were called to the deck for the last voyage of the Red Pirate many years ago away in the Caribbean,62
752,זכרו בספינת פיראטים במים פיראטים בעולם של פיראטים  אל תשאלו שאלות ,Remember in a pirate ship in pirate waters in a pirate world  ask no questions ,Remember in a pirate ship in a pirate water in a world of pirates do not ask questions,93
753,האמינו רק למה שתראו ,Believe only what you see ,Just believe what you see,84
754,האמינו רק למחצית ממה שתראו ,No Believe half of what you see ,Believe only half of what you will see,84
755,הרימו עוגן!,Up anchor!,Lift anchor!,70
756,ספינה מימין!,- That's right ,Ship on the right!,69
757,ניתן לראות לפי מיקום הגפיים ,You can tell by the position of the limbs ,Can be seen by the position of the limbs,84
758,ספינה קטנה ומעוטרת קפטן רודריגז ,A trim little ship Captain Rodríguez ,A small ship decorated with Captain Rodriguez,70
759,-רק רע יכול לצאת לנו מספינת מתים ,- Only evil can come from a death ship ,Only bad can get us out of a dead ship,62
760,- כן ,- Aye ,- Yes,67
761,סאנקטוס אחד מהם נגע בי!,Sanctus one of them touched me!,Sanctus one of them touched me!,100
762,מה קרה לשניים הללו ,What happened to those two ,What happened to these two,96
763,משועממת ,Bored ,Bored,100
764,לו רק היה קורה משהו שישבור את השיגרה של ההפלגה הזאת ,If only there was something to break the monotony of this voyage ,If only something would happen that would break the routine of this voyage,68
765,ידיים למעלה בבקשה ,Hands aloft please ,Hands up please,73
766,אתם אסיריו של קפטן ואלו וצוותו הנגוע בצפדינה ,You're the prisoners of Captain Vallo and his scurvy crew ,You are the prisoners of Captain Valo and his team infected with scurvy,75
767,הנך בעל ביטחון מופרז קפטן ואלו ,You may be overconfident Captain Vallo ,You're overconfident Captain Valo,85
768,‏200 מחיילי הצי של המלך נמצאים על כלי השיט הזה ,Two hundred of the King's marines are aboard this vessel ,200 of the King's Navy soldiers are on this vessel,60
769,ורק 20 פיראטים ,And only 20 pirates ,And only 20 pirates,100
770,-מי הוא ,- Who is he ,-who is he,100
771,-הברון גרודה ,- Baron Gruda ,-Baron Groda,91
772,שליח מיוחד של הוד מלכותו ,Special envoy to His Majesty ,A special messenger of His Majesty,65
773,-זה אתה שתלית את רוב חברי ,- You hanged most of my friends ,- It's you who hanged most of my friends,87
774,-באשמת רציחת מרבית חברי ,- For murdering most of mine ,- Accused of murdering most of my friends,68
775,נראה שנותרו לך רק 199 חיילים כעת ברון ,Seems you have only 199 marines now Baron ,You seem to have only 199 soldiers left now Baron,78
776,‏198 ,198 ,198,100
777,מוטב שתשכנע את רב החובל להכנע ,Better persuade the Captain to surrender ,You better convince the captain to surrender,79
778,רב החובל הוא לא מאלו שנכנ  197 ,The Captain is not the type to  197 ,The captain is not one of those who entered 197,69
779,מאידך אם תרשה לי לדבר איתו  אוחו העבר את המסר לרב החובל ,However if you'll permit me to speak to him  Ojo pass the word for the Captain ,"On the other hand, if you will allow me to talk to him, send the message to the captain",60
780,הביאו את רב החובל!,Bring down the Captain!,Bring the captain!,87
781,שלחו מטה את רב החובל!,Send down the Captain!,Send down the captain!,100
782,הצילו את רב החובל!,Save the Captain!,Save the captain!,100
783,שלחו מטה את רב החובל!,Send down the Captain!,Send down the captain!,100
784,האם ביקשת את רב החובל אדוני ,Did you ask for the Captain sir ,Did you ask for the captain sir?,100
785,המזל לצידנו ,We're in luck ,Luck is on our side,62
786,כולנו נניח בקרוב את ידינו על רווח שמן ,All hands will soon be digging into a fat divvy ,We will all soon get our hands on oil gain,65
787,פנינו מועדות לימים הטובים ביותר שידעו הפיראטים מאז ומעולם ,We're heading for the biggest and the best pirate days ever ,We are headed for the best days the pirates have ever known,76
788,והנה מניין עושרנו במספרים שלמים ,And here's the rich tally in round numbers ,And here is the numerator of our wealth in integers,60
789,רובי מוסקט: 3 000 ,"""Muskets: 3 000 ","Ruby Muscat: 3,000",67
790,-מבקש את סליחתך על ההפרעה  אך מתי תגיע אל הזהב ,- Begging thy pardon for interrupting  but when will thee get into the gold ,- Asks your forgiveness for the interruption but when will you get to the gold,68
791,הקשיבו חברים הקשיבו ,Listen fellows listen ,Listen friends listen,81
792,יש איים באזורי הים הזה בהם מבעבע המרד כנגד המלך  ואינם מגיעים לכדי רתיחה רק בגלל מחסור בכלי נשק ,There are islands in these waters steaming with rebellion against the King  and kept from boiling over only for lack of guns ,There are islands in this sea area where the revolt against the king is bubbling and does not come to a boil just because of a shortage of weapons,61
793,איים בהם כלי הנשק שווים יותר מזהב ,Islands where guns are worth more than gold ,Islands where weapons are worth more than gold,85
794,-יותר מיהלומים ,- More than diamonds ,-More than diamonds,100
795,אלו עסקים ,That's business ,These are businesses,69
796,מטען זה יכניס 50 000 פלורינים מכל מורד המכבד את עצמו ,This cargo will bring 50 000 gold florin from any rebels worth the name ,"This charge will put in 50,000 florins from any self-respecting rebel",69
797,-‏50 000 פלורינים ,- 50 000 florin ,- 50 000 florins,96
798,בוא נעלה זאת להצבעה ,Let's put it to the vote ,Let's put this to the vote,84
799,כל מי שבעד  אם תסלח לי על ההפרעה רב החובל הייתי רוצה לחשוב לפני שאצביע ,All those in favor  lf you'll forgive my interrupting Skipper  I'd like to think before I vote ,Anyone in favor of forgiving me for the disruptive captain I would like to think before I vote,61
800,בנתיים אנו צריכים ליישב כמה ענייני פיראטים שבשיגרה ,Meantime we got regular pirate business to settle ,In the meantime we need to settle some routine pirate matters,65
801,יש לנו את הקורה הפושע ואת פסק הדין ,We got the plank the culprit and the verdict ,We have the criminal beam and the verdict,71
802,כל מה שחסר לנו הוא משפט והוצאה לפועל של גזר הדין ,All we need's a trial and execution of a sentence ,All we are missing is a trial and execution of the sentence,78
803,הוא אשם!,He's guilty!,He's guilty!,100
804,הירגו אותי שוטים ,Kill me you fools ,I was killed by fools,63
805,צי המלך יסרוק את כל הימים עד שכל אחד מכם יתלה וגופתו תינמק ,The King's Navy will scour the Seven Seas till every one of you is hung high and dry ,The king's fleet will scan all the days until each of you is hanged and his body is rotted,64
806,סלח לי על תפיסתי האיטית רב החובל אבל האם מבקש אתה מאיתנו לחוס על חייו של הקרפד המתקתק ,Forgive my slow-wittedness Skipper  but are thee asking us to spare this sweet-smelling toad ,Forgive me for my slow perception Captain but are you asking us to spare the life of the sweet toad,68
807,לקפטן שלכם יש שכל מכולכם גם יחד ,Your captain's got more brains than all of you put together ,Your captain has all of you together,69
808,אין ספק שאתה מתכוון להחזיק בי עבור כופר ,No doubt you intend to hold me for ransom ,No doubt you intend to hold me for ransom,100
809,אני שולח אותך לחופשי ,I'm setting you free ,I'm sending you free,90
810,אני אומר שאם אין רווח בקוף לפחות שנהנה ממנו ,I say if there's no profit in the monkey we'll have our pleasure ,I say if there is no profit in the monkey at least enjoy it,70
811,ואני אומר שיהיה רווח ממנו כשהוא בחיים ,I say there is profit in him Alive ,And I say there will be profit from him when he is alive,69
812,-הקשיבו לי כעת ,- Now hear me out ,- Listen to me now,65
813,אני אומר 50 000 פלורינים זהב מהמורדים עבור הנשק  ולפנינו בתוספת עמלה מיוחדת לוכד המורדים הראשי של המלך ,I said 50 000 gold florin from the rebels for the guns  and here by special commission is the King's chief rebel-catcher ,"I say 50,000 gold florins from the rebels for the weapons and before us plus a special commission from the King's Chief Rebel Catcher",82
814,אז מדוע שלא יהיו עוד ‏50 000 ממנו ומהמלך  בעבור זה שנאמר להם לאילו מורדים מכרנו את הנשק ,So why not another 50 000 from him and his king  for telling them which rebels we sell all the guns to ,"So why not have another 50,000 from him and the king for being told which rebels we sold the weapons to",76
815,תוכנית מבריקה קפטן ,A brilliant scheme Captain ,Brilliant captain program,75
816,ברכותיי ,My congratulations ,my congratulations,100
817,ברכותיך!,My congratulations ,Congratulations!,91
