,hebrewFromSub,englishFromSub,englishTranslation,ratio
0,איזו רגל מושלמת!,What a perfect shin,What a perfect leg!,76
1,אם הייתם נוגעים ברגל המשי הזו  הייתם יודעים מי מנצחת!,If you could feel this silken thigh You'd know who has to win,If you touched this silk leg you would know who wins!,64
2,אין לך מושג כמה התגעגעתי  להרגיש שוב גבר  לרקוד איתו להתנשק איתו ,You don't know How much I've missed To feel a man again To dance to kiss,You have no idea how much I missed feeling a man dancing with him again and kissing him,68
3,עינייך חושפות את בדידותך ,Your eyes reveal you're lonely,Your eyes reveal your loneliness,87
4,הערב הזה צריך לעבור לאט ,This evening must pass slowly,This evening should pass slowly,80
5,עד שנהיה יחד  לבי לא ינוח ,Until we're one My heart won't rest,Until we are together my heart will not rest,71
6,האם טומי יחלוק באושרינו ,Will Tommy share our happiness ,Will Tommy share our happiness,100
7,וודאי שכן אגרום לו לחייך ,-Of course he will I'll make him smile,Certainly I will make him smile,71
8,-אינך יודע   אקח אותו לקולנוע ולירידים  ,-You don't know -I'll take him out to cinemas and fairs,- You do not know I will take him to the movies and fairs,72
9,-כמה התגעגעתי  ,-How much I've missed,- How much I missed,92
10,מעולם לא היה שמח יותר  אהיה יותר מדוד אהיה ממש כמו אבא!,Football and cricket Never been a happier lad I'll be more than an uncle I'll be just like a dad,I have never been happier I will be more than an uncle I will be just like Dad!,70
11,גם אני אהיה ג'קט ירוק  וכשאהיה גדול תהיה לי קייטנה משלי!,I will be a green coat too And when I'm big I'll own a holiday camp,I too will be a green jacket and when I grow up I will have my own summer camp!,68
12,קייטנה אחרת  תמיד עם מזג אוויר טוב ,A camp with a difference Always be good weather,Another summer camp always with good weather,68
13,"כשתבואו ל""קייטנת-טומי""  החופשה תימשך לנצח!",When you come to Tommy's The holiday's forever,"When you come to ""Tommy's Camp"", the vacation will last forever!",75
14,אני שמחה שאתה מחבב את דוד פרנק ,I'm glad you like your Uncle Frank,I'm glad you like Uncle Frank,92
15,אני בטוחה שגם הוא יאהב אותך  ממש כמו אב ,He'll surely love you too Just like a dad,I'm sure he's going to love you just like a father,73
16,הוא מאוד נחמד אני חושב  האם הוא נלחם במלחמה ,He's very nice I think Did he fight in the war ,He's very nice I'm wondering if he's fighting a war,68
17,אני חשה ששנת 51' תהיה שנה טובה ,So you think that '51 Is gonna be a good year,I feel that '51 will be a good year,69
18,במיוחד אם שנינו חווים אותה ביחד ,Especially if you and me See it out together,Especially if we both experience it together,61
19,אז את חושבת ששנת 51' תהיה טובה ,So you think that '51 Is gonna be a good year,So you think 51 'will be a good year,76
20,נתחתן כעת ונחווה אותה ביחד ,We'll marry now And see it out together,We will get married now and experience it together,63
21,אין לי סיבות לאופטימיות יתר ,I have no reason To be overoptimistic,I have no reason to be overly optimistic,86
22,אך איכשהו כשאתה מחייך  אני יכולה להתמודד עם מזג אוויר גרוע ,But somehow when you smile I can brave bad weather,But somehow when you smile I can deal with bad weather,85
23,מה עם הילד ,What about the boy ,What about the child,79
24,הוא לא שמע! הוא לא ראה!,You didn't hear it You didn't see it,He did not hear! He did not see!,61
25,אתה לא שמעת! אתה לא ראית!,You didn't hear it You didn't see it,You have not heard! You have not seen!,61
26,לעולם לא תספר דבר לאיש מעולם לא שמעת!,You never heard it Not a word of it,You'll never tell anyone you've never heard of!,62
27,אתה לא שמעת! אתה לא ראית!,You didn't hear it You didn't see it,You have not heard! You have not seen!,61
28,לא שמעת כלום! אף לא מלה אחת!,You never heard it Not a word of it,You did not hear anything! Not a single word!,62
29,לעולם לא תספר לנפש חיה שמה שאתה יודע זוהי האמת!,Never tell a soul What you know is the truth,You will never tell a living soul that what you know is the truth!,81
30,עכשיו הוא חירש  עכשיו הוא אילם  עכשיו הוא עיוור ,Now he is deaf Now he is dumb Now he is blind,Now he is deaf now he is mute now he is blind,89
31,האשמים מוגנים אך לעולם מואשמים על ידי עיניהם הריקות ,The guilty are safe But always accused By his empty eyes,The culprits are protected but are never accused by their empty eyes,65
32,אין מה לומר אין מה לשמוע ,Nothing to say Nothing to hear,Nothing to say Nothing to hear,100
33,ואין מה לראות ,And nothing to see,And there is nothing to see,80
34,המחלה בוודאות תיקח את מוחו לאן שמוחות בדרך כלל אינם הולכים ,Sickness will surely take the mind Where minds can't usually go,The disease will surely take his brain where brains usually do not go,71
35,צא למסע המרגש הזה ולמד כל מה שהינך חייב לדעת ,Come on the amazing journey And learn all you should know,Embark on this exciting journey and learn everything you need to know,62
36,הוא המנהיג שלך הוא המדריך שלך את המסע המרגש הזה נעשה יחד!,He is your leader He is your guide On the amazing journey Together you'll ride,He's Your Leader He's Your Guide This exciting journey is done together!,77
37,המחלה בוודאות תיקח את מוחו לאן שמוחות בדרך כלל לא הולכים ,Sickness will surely take the mind Where minds can't usually go,The disease will surely take his brain where brains usually do not go,71
38,צא למסע המרגש הזה ולמד כל מה שהינך חייב לדעת,Come on the amazing journey And learn all you should know,Embark on this exciting journey and learn everything you need to know,62
39,עיניו הן אלה שמשדרות כל מה שהוא יודע האמת בוהקת כל כך שהיא מסוגלת להמיס שלג ,His eyes are the eyes That transmit all they know The truth burns so bright It can melt winter snow,His eyes are the ones that transmit everything he knows the truth is so bright it is capable of melting snow,71
40,צל כמו מגדל כה שחור וכה גבוה ,A towering shadow So black and so high,Shade like a tower so black and so high,86
41,שמש לבנה ושורפת האדמה והשמים ,A white sun burning The Earth and the sky,A white sun that burns the earth and the sky,89
42,טומי ,Tommy ,Tommy,100
43,האם ראיתם אי פעם את פניהם של הילדים מתרגשים כל כך ,Did you ever see the faces Of the children They get so excited,Have you ever seen the faces of the children so excited,87
44,מתעוררים בבוקר חג המולד שעות לפני ששמש החורף עלתה,Waking up on Christmas morning Hours before The winter's sun's ignited,Waking up on Christmas morning hours before the winter sun has risen,87
45,הם מאמינים בחלומות ובמשמעויותיהם כולל נדיבות גן העדן ,They believe in dreams And all they mean Including heaven's generosity,They believe in dreams and their meanings including the generosity of paradise,78
46,מציצים אל מעבר לדלת כדי לראות אילו חבילות הן פנויות בסקרנות ,Peeping 'round the door to see What parcels are for free In curiosity,Peek over the door to see what packages are curiously available,69
47,וטומי אינו יודע איזה יום היום הוא לא יודע מי היה ישו או מה זה להתפלל ,And Tommy doesn't know What day it is He doesn't know who Jesus was Or what praying is,And Tommy does not know what day he does not know who Jesus was or what it is to pray,89
48,איך ניתן להצילו  מהקבר הנצחי  ,How can he be saved From the eternal grave ,How can he be saved from the eternal tomb,87
49,טומי האם אתה שומע אותי ,Tommy can you hear me ,Tommy Do you hear me?,88
50,טומי ,Tommy ,Tommy,100
51,טומי האם אתה שומע אותי ,Tommy can you hear me ,Tommy Do you hear me?,88
52,טומי האם אתה שומע אותי ,Tommy can you hear me ,Tommy Do you hear me?,88
53,-אתה שומע אותי ,Tommy can you hear me ,-do you hear me,69
54,הרגישי אותי געי בי,Feel me Touch me,Feel me touch me,100
55,רפאי אותי,Heal me,Heal me,100
56,הרגישי אותי געי בי,Feel me Touch me,Feel me touch me,100
57,רפאי אותי,Heal me,Heal me,100
58,טומי אתה שומע אותי ,Tommy can you hear me ,Tommy you hear me,89
59,מוקף בחבריו הוא יושב כל כך בשקט ללא מודעות מכלום,Surrounded by his friends He sits so silently And unaware of anything,Surrounded by his friends he sits so quietly with no awareness of anything,78
60,עיניו ריקות מחטט באפו מחייך בוכה מלקק כל דבר ,Crazy-eyed he picks his nose He smiles he cries He pokes his tongue at everything,His eyes are empty poking his nose smiling and crying licking everything,61
61,אני מאמינה באהבה אך איך מי שמעולם לא ראה אור יוכל להיות מואר ,I believe in love But how can men who've never Seen light be enlightened ,I believe in love but how can anyone who has never seen light be enlightened,88
62,רק אם הוא ירפא חוסנו הנפשי העתידי יגדל ,Only if he's cured Will his spirit's future level Ever heighten,Only if he heals will his future mental resilience increase,61
63,וטומי אינו יודע איזה יום היום ,And Tommy doesn't know What day it is,And Tommy does not know what day it is,96
64,הוא לא יודע מי היה ישו או מה זה להתפלל ,He doesn't know who Jesus was Or what praying is,He does not know who Jesus was or what it is to pray,88
65,איך ניתן להצילו  מהקבר הנצחי ,How can he be saved From the eternal grave ,How can he be saved from the eternal tomb,87
66,אתה מדבר על אשתך הייתי רוצה שתראה את אשתי ,You talk about your woman I wish you could see mine,You're talking about your wife I would like you to see my wife,69
67,אתה מדבר על אשתך הייתי רוצה שתראה את אשתי ,You talk about your woman I wish you could see mine,You're talking about your wife I would like you to see my wife,69
68,בכל פעם שהיא מתחילה לאהוב ,Every time she starts to love,Every time she starts to love,100
69,היא מחזירה את הראיה לעיוורים ,She brings eyesight to the blind,It returns the sight to the blind,77
70,כן כן  אתם יודעים אביה נתן לה קסם ,Oh yeah You know Her daddy gave her magic,Yes yes you know her father gave her magic,80
71,אתם יודעים אביה נתן לה קסם רואים לפי הליכתה ,You know Her daddy gave her magic I can tell by the way she walks,You know her father gave her a magic see as she walks,76
72,בכל פעם שהיא מתחילה לרעוד האילמים מתחילים לדבר ,Every time she starts to shake The dumb begin to talk,Every time she starts shaking the mute ones start talking,64
73,לדבר לדבר לדבר  יש לה הכח לרפא אותך,Talk talk talk She's got the power to heal you,Talk talk talk she has the power to heal you,91
74,אל פחד  יש לה הכח לרפא אותך,Never fear She has got the power to heal you,Do not be afraid she has the power to heal you,80
75,אל פחד  רק מילה אחת בשפתיה ,Never fear Just one word from her lips,Do not be afraid of just one word in her lips,70
76,והחירשים שומעים ,And the deaf can hear,And the deaf hear,89
77,יש לה הכח לרפא אותך אל פחד  ,Never fear She has got the power to heal you,She has the power to heal you into fear,87
78,יש לה הכח לרפא אותך אל פחד  ,Never fear She has got the power to heal you,She has the power to heal you into fear,87
79,רק מילה אחת בשפתיה והחירשים שומעים ,One word from her lips And the deaf can hear,Only one word in her lips and the deaf hear,80
80,כן  אם בנך אינו כל מה שאמור להיות ,Yeah If your child Ain't all he should be now,Yes if your son is not all that he should be,72
81,הבחורה הזאת תטפל בו ,This girl will put him right,This girl will take care of him,71
82,אראה לו מה הוא יוכל להיות עכשיו רק תן לי לילה אחד ,I'll show him What he could be now Just give me one night,I'll show him what he can be now just give me one night,95
83,אני הצוענית מלכת האסיד שלם לי לפני ההתחלה ,I'm the Gypsy The Acid Queen Pay me before I start,I'm the gypsy queen of the acid paid me before the start,89
84,תן לנו חדר סגור הדלת!,Give us a room Close the door,Give us a closed room door!,91
85,השאר אותנו לבד לרגע ,Give us a room Close the door,Leave us alone for a moment,64
86,הוא יחדל מלהיות ילד צעיר אבל לא ילד ,You won't be a boy no more Young but not a child,He will cease to be a young child but not a child,66
87,אני הצוענית מלכת האסיד ,'Cause I'm the Gypsy The Acid Queen,I'm the gypsy queen of acid,79
88,שלם לי לפני ההתחלה ,Pay me before I start,Pay me before the start,86
89,אסוף את מחשבותיך ותאחז חזק נשמתך חייבת ללמוד לנדוד ,Gather your wits And hold on fast Your mind must learn to roam,Gather your thoughts and hold fast your soul must learn to wander,79
90,כפי שהמלכה הצוענית חייבת לעשות אתה תצא למסע!,Just as the Gypsy Queen must do You're gonna hit the road,As the gypsy queen must do you will set out on a journey!,64
91,עבודתי החלה הסתכל עליו כעת מעולם הוא לא היה כה חי ,My work's begun Now look at him He's never been more alive,My work started looking at him now he has never been so alive,81
92,אני הצוענית מלכת האסיד שלם לי לפני ההתחלה ,I'm the Gypsy The Acid Queen Pay me before I start,I'm the gypsy queen of the acid paid me before the start,89
93,אני הצוענית ובאחריותי שאשבור את ליבו הקטן ,I'm the Gypsy I'm guaranteed To break your little heart,I'm the gypsy and it's my responsibility to break his little heart,64
94,אראה לו מה הוא יוכל להיות עכשיו רק תן לי עוד לילה אחד ,I'll show him What he could be now Just give me one more night,I'll show him what he can be now just give me one more night,95
95,אני הצוענית מלכת האסיד שלם לי לפני ההתחלה ,I'm the Gypsy The Acid Queen Pay me before I start,I'm the gypsy queen of the acid paid me before the start,89
96,אתה חושב שזה בסדר  להשאיר את הילד עם בן דודו קווין ,Do you think it's all right To leave the boy With Cousin Kevin ,You think it's okay to leave the child with his cousin Quinn,72
97,אתה חושב שזה בסדר  יש בו משהו שאינו מוצא חן בעיניי ,Do you think it's all right There's something 'bout him I don't really like,You think it's okay to have something in it that I do not like,63
98,אתה חושב שזה בסדר  אני חושב שזה בסדר ,I think it's all right Yes I think it's all right,You think it's okay I think it's okay,63
99,אנחנו ברשות עצמינו בן דודי לגמרי לבדינו בן דודי,We're on our own cousin All alone cousin,We own our own cousin completely alone our cousin,74
100,אינך צפוי לשעשע כשאתה עיוור חירש ואילם אך אין לי היום עם מי לשחק ,You won't be much fun Being blind deaf and dumb But I've no one to play with today,You are not expected to entertain when you are deaf and dumb blind but I have no one today to play with,75
101,"יודע לשחק ""מחבואים"" ",Do you know how to play Hide-and-seek ,"Knows how to play ""hide and seek""",88
102,למצוא אותי יקח לך שבוע אבל קשור לכיסא זה לא תלך לשום מקום ,To find me It would take you a week But tied to that chair You won't go anywhere,Finding me will take you a week but tied to a chair it will not go anywhere,81
103,יש הרבה דברים שאני יכול לעשות למפלצת!,There's a lot I can do to a freak,There are many things I can do for the monster!,63
104,איך היית מרגיש   ,How would you feel lf I turned on the bath ,How would you feel,60
105,אולי כוויה מסיגריה בזרוע שלך  תשנה את הבעתך  לכזו של מצוקה ,Maybe a cigarette burn On your arm Would change your expression,Maybe a burn from a cigarette in your arm will change your expression to one of distress,79
106,הנני הביריון של בית הספר הרמאי של הכיתה ,I'm the school bully The classroom cheat,I'm the bully of the cheating school of the class,81
107,השותף הרע ביותר במשחקים שתמצא אי פעם  אכניס שברי זכוכיות בארוחת הערב שלך ,The nastiest play friend You ever could meet I'll put glass in your dinner,The worst partner in games you will ever find I will put glass fragments in your dinner,61
108,ונעצים בכיסא שלך  אגרור אותך סביב,And spikes in your seat I'll drag you around,And sticking in your chair will drag you around,70
109,בלפיתת שיערך  ואתן לך דחיפה  ממעלה המדרגות ,By a lock of your hair And give you a push At the top of the stairs,Hold your hair and I will give you a push up the stairs,74
110,מה היית עושה אם אנעל אותך בחוץ  לעמוד בגשם ,What would you do If I shut you outside To stand in the rain,What would you do if I locked you outside to stand in the rain,90
111,הנני הביריון של בית הספר הרמאי של הכיתה ,I'm the school bully The classroom cheat,I'm the bully of the cheating school of the class,81
112,אנעץ מחטים באצבעותיך ואמחץ את כפות רגליך ,I'll stick pins in your fingers And tread on your feet,I will stick needles in your fingers and crush your feet,75
113,אנחנו ברשות עצמינו בן דודי לגמרי לבדינו בן דודי,We're on our own cousin All alone cousin,We own our own cousin completely alone our cousin,74
114,חשבנו על משחקים נחמדים לשחק  כשהמבוגרים הלכו להם ,We've thought of Some nice games to play While the grownups Had all gone away,We thought of nice games to play when the adults went for them,69
115,לא היית משעשע כי הנך עיוור חירש ואילם ,You weren't too much fun 'Cause you're blind deaf and dumb,You were not amused because you are deaf and dumb blind,66
116,אך לא היה לי היום עם מי לשחק ,But I'd no one to play with today,But today I had no one to play with,97
117,אתה חושב שזה בסדר  להשאיר את הילד עם הדוד ארני ,Do you think it's all right To leave the boy with Uncle Ernie ,You think it's okay to leave the kid with Uncle Ernie,79
118,אתה חושב שזה בסדר  הוא שתה קצת יותר מדי הערב  אתה חושב שזה בסדר  ,Do you think it's all right He's had a few too many tonight Do you think it's all right ,You think it's okay he drank a little too much tonight you think it's okay,68
119,אני חושב שזה בסדר כן אני חושב שזה בסדר ,Yes I think it's all right Yes I think it's all right,I think it's okay Yes I think it's okay,67
120,אני דודך ארני המרושע שמח שלא תראה או תשמע אותי כל עוד אני עושה שטויות עושה שטויות עושה שטויות ,I'm your wicked Uncle Ernie I'm glad you won't see or hear me As I fiddle about fiddle about Fiddle about,I'm your evil uncle Ernie glad you will not see or hear me as long as I do nonsense do nonsense do nonsense,60
121,אמך השאירה אותי כאן לשמור עליך ואני עושה בדיוק מה שלעזאזל אני אוהב,Your mother left me here To mind you And I'm doing exactly What I bleeding' well want to,Your mother left me here to take care of you and I do exactly what the hell I love,73
122,אתה חושב שזה בסדר  להשאיר את טומי  ,Do you think it's all right Leaving Tommy by the mirror ,You think it's okay to leave Tommy,61
123,היית יכול לחשוב שהוא אכן רואה בוהה בעצמו חצי הלילה ,You would think he had sight Been staring half the night,You might think he does see staring at himself half the night,72
124,אתה חושב שזה בסדר ,Do you think it's all right ,You think that's okay,67
125,אני חושב שזה בסדר כן אני חושב שזה בסדר ,I think it's all right Yes I think it's all right,I think it's okay Yes I think it's okay,70
126,בחור חירש אילם ועיוור מעפיל לגמר הגדול!,Deaf dumb and blind kid Makes the big game,A dumb and blind deaf guy qualifies for the grand final!,64
127,השבת בגמר הוא יתמודד מול האלוף!,Saturday the final He faces the champ,Saturday in the final he will face the champion!,86
128,(הוצאה מיוחדת) פינבול סוף הדרך המיליון ביד!,Pinball big time A million in hand,(Special Edition) Pinball End of the Million Road in Hand!,63
129,אתה יכול לשלוט בעולם מהיאכטה שבמפרץ!,You can rule the world From a yacht in the bay,You can control the world from the yacht in the bay!,85
130,שמפניה זורמת הנך פופולרי בן אדם!,Champagne flowing You're a popular man,Champagne Flows You are a popular person!,77
131,פינבול בוא נשחק!,Pinball let's play,Pinball Let's play!,100
132,טומי ממשיך לנצח הוא מיליונר לאמא יש קדיליאק חדשה,Tommy keeps on winning He's a millionaire Mama's got a brand-new Cadillac,Tommy continues to win is a millionaire mom has a new Cadillac,70
133,מהרו למופע עוד רגע בשידור חי!,Hurry to the show We're nearly on the air,Hurry to the show for another moment live!,61
134,מאז שהייתי ילד אני משחק בכדור הכסף ,Ever since I was a young boy I played the silver ball,Ever since I was a kid I've been playing money ball,67
135,מסוהו ועד ברייטון בטח שיחקתי בכולם ,From Soho down to Brighton I must have played them all,From Soho to Brighton I must have played them all,95
136,אך מעולם לא ראיתי אחד כמוהו באף אולם שעשועים ,But I ain't seen nothin' like him In any amusement hall,But I've never seen one like it in any amusement park,71
137,הבחור החירש אילם ועיוור ההוא בטוח משחק פינבול ברמת-על,That deaf dumb and blind kid Sure plays a mean pinball,That mute and blind deaf guy is sure to play top-level pinball,76
138,עומד כמו פסל הופך לחלק מהמכונה ,He stands like a statue Becomes part of the machine,Standing like a statue becomes part of the machine,93
139,מרגיש את כל המכשולים תמיד משחק נקי ,Feelin' all the bumpers Always playing' clean,Feeling all obstacles always play clean,68
140,משחק עם אינטואיציה המונים הסיפרתיים נופלים ,He plays by intuition The digit counters fall,Playing with intuition the digital masses fall,64
141,הבחור החירש אילם ועיוור ההוא בטוח משחק פינבול ברמת-על ,That deaf dumb and blind kid Sure plays a mean pinball,That mute and blind deaf guy is sure to play top-level pinball,76
142,הוא אשף הפינבול בטח יש איזה טריק ,He's a pinball wizard There has to be a twist,He's the Pinball Wizard. There must be some trick,67
143,אשף הפינבול עם יד כל כך גמישה!,He's a pinball wizard There has to be a twist,The Pinball Wizard with such a flexible hand!,72
144,איך אתה חושב שהוא עושה זאת ,-How do you think he does it ,How do you think he does that?,93
145,אינני יודע!,-l don't know,I do not know!,72
146,מה עושה אותו כזה טוב ,What makes him so good ,What makes him so good,100
147,לא רואה אורות מהבהבים משחק על פי חוש ריח ,Don't see lights a-flashing He plays by sense of smell,Do not see flashing lights playing according to sense of smell,79
148,הבחור החירש אילם ועיוור ההוא בטוח משחק פינבול ברמת-על ,That deaf dumb and blind kid Sure plays a mean pinball,That mute and blind deaf guy is sure to play top-level pinball,76
149,הוא לא יכול לנצח אותי עכשיו תמיד הייתי האלוף!,He can't beat me now I've always been the champ,He can not beat me now I have always been the champion!,83
150,אני יודע שזה טריק!,I know every trick,I know it's a trick!,70
