,hebrewFromSub,englishFromSub,englishTranslation,ratio
675,את בטוחה שזה היה הברון כמובן אוקיי,Are you sure it was the Baron Of course Okay,You're sure it was the Baron of course okay,92
676,אני אסתכל,- I'll take a look ,I'll look,72
677,אם זה הגיע להצלה של אחד או אחר שמור על הזרעים,If it comes to saving one or the other save the seeds ,If it came to the rescue of one or the other keep the seeds,75
678,אני הולך לסגור את זה שוב אז לא תוכל לחזור,I'm going to close it again so you won't be able to come back ,I'm going to close it again so you can 't come back,85
679,בהצלחה קארסון,Good luck Carson ,Good luck Carson,100
680,לקחו איתם ברון לא יותר ממה שמגיע להם ,How much food did they take with them Baron ! No more than they deserved ,Baron took with them no more than they deserved,75
681,וכמה זה היה רק כמה שימורים של בשר ששמרתי כמה שנים שתי פחיות מים,And how much was that Only a few tins of meat that I had stored for a few years Two cans of water ,And how it was just a few canned meats that I kept for two years in two cans of water,69
682,למה הם עזבו,Why'd they leave ,Why they left,76
683,שאנחנו לא לא!,Where'd they go in ,That we do not!,62
684,אני עדיין פה ,No! I'm still here am I not ,I'm still here,70
685,לבתך יש את קארסון טוב אני אשיג עוד איש,Your daughter's got Carson! Well I'll get another man ,Your daughter has a good Carson I'll get another man,85
686,ואנחנו נבנה את הגינה שוב עד אז אנחנו נאכל את ,And we'll build the garden again Until then we'll eat the tinned meat you've got stored away ,And we will build the garden again until then we will eat the,69
687,האם זה מה שאתה אומר,Is that what you're saying ,Is that what you say,87
688,היו רק כמה פחיות עדיף שתחזרו לחדרכם,There were only a very few cans You'd better go back to your rooms ,There were only a few cans it would be better for you to return to your room,77
689,לפנות כנגדנו רק ישמיד אותנו,Turning on our own will only destroy us ,Turning against us will only destroy us,72
690,מתי שהיום הצטנן נעלה לגג ונראה לגבי הגינה,When the day cools we'll go up to the roof and see about the garden ,When it got cold today we went up to the roof and looked around the garden,72
691,! הוא מכר אותנו!,He sold us!,! He sold us!,100
692,זה פתוח,It's open ,It's open,100
693,ברון למה,Baron why ,Baron why,100
694,אחד מאנשי הברון נכנס לפה הוא אומר שהוא מהקומונה,One of the Baron's men just walked in here Says he's quit the commune ,One of the Baron's men enters here and says he is from the commune,74
695,יש לנו בוגד,Got ourselves a traitor ,We have a traitor,60
696,שמתחיל להישבר ,Starting to break up over there eh ,Starting to break down,68
697,אה הוא אומר שהלוחם ובתו של הברון ירדו למטה,He says the fighter and the Baron's daughter took off down below ,Oh he says the warrior and the baron's daughter went downstairs,74
698,תשיג לי את האחים ארקנס וליפרט,You get me the Harkness brothers and Lippert ,Get me the Arkansas Brothers and Lippert,74
699,ברוך הבא חבר,Welcome friend ,Welcome friend,100
700,אני שומע שיש לך חדשות עבורנו,I hear you've got some news for us ,I hear you have news for us,75
701,(כל כך קרוב לחום (למצב,So close to the heat ,(So ​​close to heat),89
702,ספר לנו על הזרעים יש להם את הזרעים,Tell us about the seeds They've got seeds ,Tell us about the seeds they have the seeds,83
703,עגבניות נכון הם לקחו אותם,Tomatos right They took them ,Tomatoes right they took them,98
704,לקחו את הזרעים כן כן,Took the seeds Yes yes,Took the seeds yes yes,100
705,אתה רואה את האנשים האלה הם הגששים הכי טובים מתחת לאדמה,See these men They're the best underground trackers alive ,You see these people are the best trackers underground,81
706,אתה תספר להם - ספר להם על הלוחם,You tell them - tell them about the fighter ,You will tell them - tell them about the warrior,76
707,תפקח את עינייך ותאמר להם,Open your eyes and look at them!,Open your eyes and tell them,78
708,הוא נכנס לביוב תמהר,He went into the cellar ,He went into the sewer and hurried,63
709,אנחנו רוצים אותו,We want him!,We want him,100
710,הבחורה - הבחורה ,The girl - the girl ,The girl - the girl,100
711,בתו של הזקן נכון היא הלכה איתו ,The old man's daughter right She went with him ,The old man's daughter is right she went with him,97
712,להיכן הן נכנסו,Where'd they go in ,Where did they go?,86
713,לתוך המרתף של הקומונה,Into the basement commune ,Into the basement of the commune,88
714,זה בסופה של מנהרת הצינורות ,That's the end of the pipe tunnel How long ago ,It's at the end of the pipe tunnel,78
715,יש לך עוד משהו לספר לנו לא לא,You have anything else to tell us ,You have something else to tell us no no,66
716,העכברושים רצים,The rats are running ,The rats are running,100
717,חייבת להיות סיבה,There must be a reason ,There must be a reason,100
718,את יכולה ללכת,Can you walk ,You can go,73
719,בילי - הבא את קארוט,Billy - go get Carrot ,Billy - Bring Carrot,65
720,הם באים עכשיו,They're coming now ,They're coming now,100
721,שנים מהם,Two of them ,Years of them,67
722,הצעקות שלי שם ,There must be a reason ,My screams are there,71
723,גילו אותך לא משהו כזה אני לא אעשה זאת שוב,Something like that I won't do it again ,Discovered you are not something like that I will not do it again,69
724,יהיו עוד,There will be more ,There will be more,100
725,היכן אחי,Ambush! Where's my brother ,Where is my brother?,73
726,הוא מת ,He's dead!,he is dead,95
727,זאת הדרך,This the way ,this is the way,89
728,כן מייל מתחת למנהרה אני יודע היכן הם יהיו,Yeah a mile under the subway I know where they'll be ,Yes mile under the tunnel I know where they will be,74
729,אני אקדים אותם,There will be more ,I will precede them,65
730,אוליי ננסה את הרחוב,Maybe we'll try the street ,Maybe we'll try the street,100
731,זה חלוד,It's rusted through ,It's rusty,62
732,אני מקבלת התכווצויות ,I'm getting cramps ,I get cramps,80
733,זה לא יכול להיות הזמן נכון לא עוד שבועיים או משהו כזה,It cannot be time yet can it No not for two weeks or so ,It can not be the right time no more two weeks or something,68
734,אני רק אנוח לכמה דקות,Can I just rest a couple minutes ,I'll just rest for a few minutes,75
735,הברון האדם הזה הוא יותר ממה שאני יכול להאמין,The Baron that man is more than I can believe ,This human baron is more than I can believe,80
736,עכשיו אל תלדי את התינוק  עד שניגע לאי בסדר,Now don't you turn out that baby until we get to the island right ,Now do not give birth to the baby until we touch the wrong one,66
737,אנסה לשמור אותו היכן שהוא כרגע,I'll try to keep it where it is ,I'll try to keep it where it is at the moment,82
738,את עדיין כועסת עלינו,Are you still mad at us ,You're still mad at us,84
739,אני לא חושבת כך,I don't think so ,I do not think so,79
740,אני מניחה שהרגשתי בטוחה שם,I guess I just felt safe there ,I guess I felt safe there,91
741,אני מניחה שקאל חשב שזה גם בטוח,I suppose Cal thought it was safe too ,I guess Cal thought it was safe too,81
742,אם החזקת מעמד הרבה זמן כמוני וראית המון אנשים מתים אחרי כמה זמן זה הופך כמו שכיבות שמיכה,If you last on the streets as long as I have and you've seen lots of men die after a while it becomes like doing push ups - daily exercise ,If you lasted a long time like me and saw a lot of people die after a while it becomes like a blanket push-up,67
743,אבל האיש הזה שגסס הטריד אותי,But that man dying bothered me ,But this dying man bothered me,93
744,אנחנו חייבים לחזור למטה שוב פעם,We have to go down below again ,We must go back down again,71
745,הורידו אותו למטה,Sit down ,Take it down,70
746,אני חייבת לעצור פשוט חייבת,You have to tie a knot in it ,I have to stop just have to,62
747,את יכולה להשמיע צרחה קטנה אם את רוצה אני אמרתי שלא אז אני לא,You can make a little scream if you want to I won't - I won't,You can make a little scream if you want I said no then I do not,75
748,אתה צריך לקשור לולאה בתוך זה,You have to tie a knot in it ,You need to tie a loop inside it,67
749,הנה בנך,Here's your son ,Here's your son,100
750,מהרו!,Hurry up!,Hurry up!,100
751,הוא פה בפנים,He's in here!,He's in here,100
752,לעזאזל איתכם,You nun  ,Damn you,67
753,אני ידעתי שהם יהיו חסרי תועלת,I knew they'd be worthless ,I knew they would be useless,70
754,אנחנו נלך יחדיו,We're gonna go together ,We'll go together,75
755,! יחדיו,Together!,! together,100
756,הכבוד האבוד של קתרינה בלום,THE LOST HONOR OF KATHARINA BLUM,Katrina Bloom's Lost Honor,79
757,הלו קתרינה ,Hello Katharina ,Hello Katrina,93
758,איזה רעש ,What a racket ,What a noise,64
759,הנס כל כך שיכור היינו צריכים להכניס אותו למיטה ,Hans is so drunk we had to put him to bed ,Miracle so drunk we had to put him to bed,85
760,וקלאוס נמצא במשימה ,And Klaus is on detail ,And Klaus is on a mission,64
761,באנו לכאן לנסות לקחת מישהו אחר ,We've come here to try and pick up someone else ,We came here to try to take someone else,71
762,נזירה  ,You nun  ,nun,60
763,אל תהיי כזאת מרובעת!,Don't be so nervous ,Do not be so square!,63
764,נתראה ,See you ,see you later,70
765,בואי ניקח אותו איתנו ,Let's take him with us ,Let's take him with us,100
766,הולכת למסיבה ,Going to a party ,Going to a party,100
767,רוצה לבוא למסיבה ,Want to come to a party ,Want to come to the party,88
768,אם אענה על הציפיות שלך ללא תחפושת ,If I meet your expectations and without a costume ,If I meet your expectations without a costume,96
769,נשיג לך אף מזויף ,We'll get you a fake nose ,We'll get you a fake nose,100
770,-לאן אנחנו הולכים ,- Where are we going ,-where are we going,100
771,-לקרובה רחוקה שלי ,- To a distant relative's ,- To my distant relative,84
772,לדודה אלזה ,To Aunt Else ,To Aunt Elsa,92
773,-אנחנו מאותה עיר ,We're from the same hometown ,- We're from the same city,73
774,-דודה נחמדה ,- Nice aunt ,- Nice aunt,100
775,אל תיגע בי ,Don't touch me ,do not touch me,90
776,עוד נראה ,We'll get him ,We shall see,64
777,לא כל כך מהר בן אדם!,Not so fast man!,Not so fast man!,100
778,זין  שייח קארל פון כווית עם ההרמון שלו ,Shit Sheik Karl von Kuwait and his harem ,Sheikh Carl Von Kuwait with his harem,75
779,-אני צריך מפית ,- I need a napkin ,- I need a napkin,100
780,-למה ,Why ,-Why,100
781,-בקבוק יין נפל ,- A bottle of wine fell ,- A bottle of wine fell,100
782,-יין אדום או לבן ,- Red or white wine ,-Red or white wine,100
783,תשתמש רק במלח ,Just use salt ,Use only salt,69
784,זה פלפל ,This is pepper ,It's pepper,80
785,מי היפה הזאת ,Who's that beauty ,Who is this beautiful,74
786,בת הדודה שלי קתרינה בלום ,My cousin Katharina Blum ,My cousin Katrina Bloom,89
787,הנזירה ,The nun eh ,The nun,82
788,כולם מרגישים טוב ,Everybody's feeling good ,Everyone feels good,74
789,הם הלכו ישר על השם הראשון ,They went right on to first name terms ,They went straight for the first name,77
790,לא היתה שום פגישה ,There was no encounter ,There was no meeting,71
791,וולטרשיים אלזה מרגנטיימסטר 3 טלפון 349462 ,Woltersheim Else Mergentheimerstr 3 telephone349462 ,Voltrashim Elsa Mergentimester 3 Phone 349462,71
792,בלום קתרינה ,Blum Katharina ,Bloom Katrina,81
793,כתובת לא ידועה עדיין ,Address still unknown ,Address not yet known,62
794,אני אתקשר שוב ,I'll call back ,I'll call again,76
795,מדבר אל עצמך ,Talking to yourself ,Talk to yourself,91
796,סיפרתי לעצמי כמה בדיחות חדשות ,Just telling myself a couple of new jokes ,I told myself some new jokes,64
797,מרגיש יותר טוב עכשיו ,Feeling better now ,Feeling better now,100
798,אתן הבנות טעימות מאוד ,You girls are pretty tasty ,You girls are very tasty,76
799,כנראה תהיה לך עבודת גריז קטנה ,You might need a little grease job ,You will probably have a little grease work,60
800,ערב טוב תובע מחוזי בייזמן מדבר ,Good evening Mr D A Beizmenne speaking ,Good evening prosecutor Baizman speaks,68
801,אכלת ארוחת ערב ,Were you having dinner ,you had dinner,72
802,אני צריך להמשיך את שירות החירום ,I need to continue the emergency service ,I need to continue the emergency service,100
803,"הפעם מדובר בשתיים ""סכנת בריחה ""","Two this time ""Escape danger ""","This time it is two ""danger of escape""",86
804,וולטרשיים אלזה בלום קתרינה ,Woltersheim Else and Blum Katharina ,Voltrashim Elsa Bloom Katrina,75
805,תודה אדוני ,Thank you sir ,Thanks sir,78
806,לילה טוב ,Good night ,Good night,100
807,יום חמישי 6 לפברואר 1975 ליל הקרנבל,THURSDAY FEBRUARY6 1975 CARNIVAL NIGHT,"Thursday, February 6, 1975 Carnival night",96
808,שימו לב!,Attention!,pay attention!,82
809,שימו לב!,Attention!,pay attention!,82
810,פעילות משטרתית רשמית ,Official police action ,Official police activity,87
811,מי אתה ,Who are you ,Who are you,100
812,פנים מול הקיר ,There was no encounter ,Face in front of the wall,60
813,אל תתנגדי ,Do not resist ,Do not object,69
814,שלא תנסי להתנגד ,Do not resist ,Do not try to resist,79
815,איפה הוא ,Where is he ,where is he,100
816,אין כאן אף אחד בוס ,Nobody here boss ,There's no boss here,67
817,איפה הוא ,Where is he ,where is he,100
818,בלתי אפשרי ,Impossible ,Impossible,100
819,למה ,Why ,Why,100
820,צפינו בבית מאז אמש ,We've watched the house since last night ,We've been watching the house since last night,88
821,אם הוא לא כאן הוא לא יכול להיות רחוק ,If he's not here he can't be far ,If he's not here he can not be far,91
822,אנחנו נתפוס אותו ,We'll get him ,We'll catch him,79
823,מוטב שתאמרי לנו איפה הוא נמצא ,If you want him to be able to walk better tell us where he is ,You better tell us where he is,66
824,הוא לא יכול להתאדות באוויר ,You have to tie a knot in it ,It can not evaporate in the air,61
825,תחפשו נשק בכל מקום ,Look for weapons everywhere ,Look for weapons everywhere,100
826,איך ידעתם שהוא היה כאן ,How do you know he was here ,How did you know he was here?,95
827,את מודה שנתת לו מחסה!,You admit you gave him shelter!,You admit you gave him shelter!,100
828,מתי הוא עזב ,When did he leave ,When he left,69
829,כשהתעוררתי לודוויג כבר עזב ,When I woke up Ludwig had already left ,When I woke up Ludwig had already left,100
830,-בלי להיפרד ,Without knowing him ,- Without parting,65
831,- כן ,- Yes ,- Yes,100
832,הוא זיין אותך ,Did he fuck you ,He fucked you,79
833,לא הייתי משתמשת במילה הזאת ,I wouldn't use that word ,I would not use that word,94
834,אנחנו מכירים אחד את השני ,We know each other ,We know each other,100
835,ראיתי אותך איפשהו מקודם ,I've seen you somewhere before ,I saw you somewhere earlier,74
836,כן אני עובדת עבור הבלורנס ,Yes I work for the Blornas ,Yes I work for the Lawrence,68
837,תתלבשי בבקשה ,Please get dressed ,Please get dressed,100
838,זה נראה רע להסתובב חצי עירומה מול העובדים שלך ,It looks bad when you're parading half naked in front of your employees ,It looks bad to walk around half naked in front of your employees,78
839,גברת בלום בבקשה ,Mrs Blum please ,Mrs. Bloom please,90
840,סליחה ,Sorry ,Sorry,100
841,תתלבשי בבקשה!,Please get dressed ,Please get dressed!,100
842,אל תהיה כזה עצבני ,Don't be so nervous ,Do not be so nervous,82
843,תני לי את זה ,Give me that ,Give it to me,72
844,צלפים פלטו!,Snipers dismissed!,Snipers fired!,73
845,תשימי משהו ללבוש ,Get yourself something to wear ,Put something on to wear,70
846,הוא חמק בין האצבעות שלך שוב ,He slipped through your fingers again ,He slipped between your fingers again,78
847,מודינג!,Moeding!,Moding!,92
848,קדימה ,- What for ,forward,67
849,הדלת תישאר פתוחה ,The door stays open ,The door will remain open,68
850,אני לא מבינה ,I don't understand ,I do not understand,92
851,מה הפשע שלי ,What's my crime ,What's my crime?,100
852,מה לודוויג עשה ,What did Ludwig do ,What Ludwig did,91
853,התובע יסביר לך ,The D A will explain ,The plaintiff will explain to you,60
854,תתכופפי ,Bend over ,Bend down,67
855,האמבטיה שלך ממש נחמדה ,You've fixed up your bathroom real nice ,Your bathroom is really nice,78
856,ארבע סוללות שעון מעורר שני סלילי חוטים וכלים שונים ,Four batteries an alarm clock two reels of wire and various tools ,Four alarm clock batteries Two coils of wires and different tools,74
857,פאה בלונדינית קצרה ,A short blond wig ,Short blonde wig,91
858,ספרים: שני רומנים שלושה ספרי פשע ביוגרפיה של נפוליאון וביוגרפיה של המלכה כריסטינה כולם ממועדון הספר ,Books: two romances three crime stories a biography of Napoleon and a biography of Queen Christina all from a book club ,Books: Two Novels Three Crime Books Biography of Napoleon and Biography of Queen Christina All from the Book Club,85
859,ספרות בורגנית טיפוסית ,Typically bourgeois literature ,Typical bourgeois literature,97
860,שום דבר אחר ,Nothing else ,nothing else,100
861,אין נשק ,No weapons ,No weapons,100
862,מצאנו את הפתק הזה בספר הפשע ,We found this note in a crime novel ,We found this note in the crime book,85
863,אין רמזים אחרים לעת עתה ,No other clues for the time being ,There are no other clues at this time,71
864,למה זה שימושי לך ,What use it is to you ,Why it's useful to you,74
865,"""אני רע חסר מצפון חסר אלוהים אך זהב הוא נערץ ולכן הוא בעליו ","""I am a bad conscienceless godless man but gold is revered and so is its owner ",“I am a bad conscience devoid of God but gold is revered and therefore he is its owner,81
866,הכוח האלוהי של הזהב נעוץ בהיותו מנוכר ומשקף את המהות העצמית המנוכרת של האדם ,The divine strength of gold lies in its being the estranged alienated and self-alienating essence of Man ,The divine power of gold lies in being alienated and reflecting the alienated self-essence of man,80
867,"זהו נכס מנוכר של גברים ""","It is the alienated property of Men ""","It is an alienated property of men """,90
868,שבי כאן ,Sit down here ,Sit here,76
869,גוטן כתב את זה ,Did Goetten write that ,Guten wrote it,61
870,לא זה לא קשור ללודוויג ,No it has nothing to do with Ludwig ,No it has nothing to do with Ludwig,100
871,אלוהים הוא נערץ ולכן הוא בעליו!,God is revered and so is its owner!,God is revered and therefore he is its owner!,85
872,נכתב על ידי שודד הבנק זה הגיוני ,Written by a bank robber it makes sense ,Written by a bank robber it makes sense,100
873,קרל מרקס כתב את זה!,It's by Karl Marx!,Karl Marx wrote it!,74
874,כנראה בכתביו המוקדמים ,Probably the early writings ,Probably in his early writings,81
875,אז את קוראת את מרקס ,So you've read Marx ,So you read Marx,91
876,לא ,No ,No,100
877,אבא אורבנוס דומיניקני כתב את זה בשבילי ,Father Urbanus a Dominican wrote it down for me ,Father Dominican Dominican wrote it for me,81
878,תוכלו לבדוק במנזר הוהנבלונברג ,You can check Hohenblumenberg Convent ,You can check out the Hohenblonberg Monastery,63
879,את מכירה את מרקס דרך הדומיניקנים ,You mean you know Marx through the Dominicans ,You know Marx through the Dominicans,89
880,בחרת במסדר הלא נכון ,You chose the wrong order ,You have chosen the wrong order,89
881,המשטרה מבקשת מכל דיירי הבית לספק את כל המידע שהם יכולים ,The police request all occupants of the house to supply any information they can ,The police ask all the occupants of the house to provide all the information they can,82
882,נא לדווח על כל דבר חשוד לממונה ,Please report anything suspicious to the commissioner ,Please report anything suspicious to the supervisor,77
883,חובת העיתונות ליידע את הציבור ,The duty of the press is to inform the public ,The duty of the press to inform the public,97
884,תרשום את זה: התובע מדבר ,No it has nothing to do with Ludwig ,Write it down: the plaintiff is talking,60
885,אנחנו מתעסקים כאן עם מחבל או כמה מחבלים הפועלים בדם קר בלא התחשבות בחיי אדם ,We're dealing here with one or several terrorists acting in cold blood with little regard for human life ,We are dealing here with a terrorist or some terrorists operating in cold blood without regard to human life,76
886,תודה התובע ,Thank you sir ,Thank you plaintiff,69
887,פראייר!,Sucker!,Sucker!,100
888,פגשת אותו שם לראשונה ,You were on first-name terms ,You first met him there,67
889,כן ,- Yes ,Yes,100
890,בלי לדעת עליו ,Without knowing him ,Without knowing about it,79
891,כן ,- Yes ,Yes,100
892,הרטה שומל לא התקשרה לפני המסיבה ,Didn't Hertha Scheumel call before the party ,Herta Shumel did not call before the party,88
893,כן ,- Yes ,Yes,100
894,למה ,Why ,Why,100
895,הם שאלו אם הם יכולים להביא מישהו ,They asked if they could bring someone ,They asked if they could bring someone,100
896,הם אמרו מי ,Did they say whom ,They said who,73
897,לא היא לא ידעה אז ,No she didn't know then ,No she did not know then,85
898,היא רצתה לעשות לאסוף מישהו בקפה פולקט ,She wanted to make a pickup at Cafe Polkt ,She wanted to do pick up someone at Folket Cafe,66
899,ושלחת את גוטן שלך ,And you sent your Goetten ,And you sent your Guten,92
900,מיד אחרי השיחה גוטן מגיע לבלונדינית הקטנה שקל היה לזהות אותה לפי לבושה ,Right after this call Goetten comes on to that easily recognizable little blonde who was all dressed up ,Immediately after the call Gotten arrives at the little blonde who was easy to identify by her dress,65
901,זה היה תחכום שתואם בין בלום לגוטן שיבוא למסיבה מבלי לעורר חשד ,This sophisticated trick allows Blum to introduce Goetten into the party at her aunt's place without arousing suspicion ,It was a sophistication that matched Bloom and Gotten who would come to the party without arousing suspicion,65
902,היא אפילו ויתרה לנסות לחפות ברגע שהוא הגיע הם רקדו באינטימיות ,There she gave up even trying to cover-up As soon as he arrived both danced intimately ,She even gave up trying to cover up as soon as he arrived they danced intimately,95
903,את לעיתים קרובות רוקדת עם זרים ,Do you often dance with strangers ,You often dance with strangers,95
904,לא ,No ,No,100
905,ציפית לגוטן ,You made an exception for Goetten ,You were expecting a goth,62
906,את שלא רוקדת ,You the one who never dances ,You who do not dance,71
907,רקדתי מקודם ,I've danced before ,I danced before,91
908,עם מר בלורנה והמכרים שלו הרבה פוליטיקאים ואנשי עסקים כשעזרתי בערבים במסיבות ,With Mr Blorna and his acquaintances- lots of politicians and businessmen- when I helped out evenings at parties ,With Mr. Belorna and his acquaintances a lot of politicians and businessmen when I helped in the evenings at parties,93
