,hebrewFromSub,englishFromSub,englishTranslation,ratio
315,"בקשו מן האיש עם פרח הציפורן הגדול והאדום הביאו כל אחד מהאנשים מתחנת ""ויקטוריה"" ",Ask along that man With the big red carnation Bring every single person From Victoria Station,Ask the man with the big red carnation to bring each of the people from Victoria Station,80
316,הכנסו לבית החולים והביאו את האחיות והחולים ,Go into a hospital And bring the nurses and patients,Enter the hospital and bring the nurses and patients,83
317,שכולם יילכו הביתה ויביאו את קרוביהם ,Everyone go home And fetch their relations,That everyone would go home and bring their relatives,72
318,בואו לבית הזה תהיו מהאנשים הנוחים ,Come to this house Be one of the comfortable people,Come to this house you will be one of the comfortable people,92
319,בית חם ומלא אור אנחנו שותים כל הלילה לעולם לא ישנים ,Come to this house We're drinking all night Never sleeping,A warm and light house we drink all night and never sleep,66
320,רגע טומי יש עוד בדלת ,Hold on Tommy There's more at the door ,There's another moment at the door,67
321,הם יכנסו דרך הרצפה ,They'll come through the floor ,They will enter through the floor,76
322,יש עוד בדלת  יש עוד בדלת  ,Hold on Tommy There's more at the door ,There's more at the door There's more at the door,69
323,יש עוד בדלת  יש עוד בדלת  אנו צריכים עוד מקום ,There's more at the door There's more at the door There's more at the door There's more at the door There's more,There's more at the door There's more at the door We need more space,69
324,בנה תוספת ,Build an extension,Build an add-on,67
325,ארמון צבעוני אל תחסוך בהוצאות ,A colorful palace Spare no expense now,Colorful palace Do not save on expenses,83
326,בואו אלי עכשיו! בואו אלי עכשיו!,Come to me now,Come to me now! Come to me now!,65
327,ברוכים הבאים!,Welcome ,Welcome!,100
328,כדי להעיר את נשמותיכם הפגועות בני ילמד את לבבותיכם הדוממים  לדבר!,He'll raise Your weary spirits high My son will teach Your silent hearts To talk,To awaken your hurt souls my son will teach your still hearts to speak!,67
329,בכל בית תהיה תמונתו ,Every home will have his picture,Each house will have its own picture,74
330,כל העולים לרגל יגעו בידו ,Pilgrims all will touch his hand,All the pilgrims will touch his hand,94
331,מכונות פינבול זהב וכסף יהיו מזבחות לתכניתו של האב-הרוחני ,Pinball tables Gold and silver Altars to the master's plan,Gold and silver pinball machines will be altars to the spiritual father’s plan,76
332,ריו פריס  ניו יורק לונדון  מוסקווה בייג'ין טוקיו ,Rio Paris New York London Moscow Peking Tokyo,Rio Paris New York London Moscow Beijing Tokyo,84
333,העולם!,The world!,the world!,100
334,"""מחנה טומי"" בכל עיר ",A Tommy camp in every city,"""Tommy Camp"" in every city",96
335,מה שהם רוצים אינו זול חבל  אבל מי אני שאהרוס להם את החלומות ,What they want ain't cheap It's a pity But who am I To upset their dreams ,What they want is not a cheap pity but who am I to ruin their dreams,85
336,בוקר טוב מומרים ,Good morning converts ,Good morning converts,100
337,אני אחיכם ארני ברוכים הבאים למחנה הנופש של טומי ,I'm your brother Ernie and I welcome you to Tommy's Holiday Camp ,I'm your brother Ernie Welcome to Tommy's Holiday Camp,92
338,מחנה עם הבדל אחד ,The camp with the difference ,A camp with one difference,81
339,לא משנה מזג האוויר ,Never mind the weather ,No matter the weather,70
340,כשאתם באים למחנה של טומי  החופשה לא תיגמר ,When you come to Tommy's the holiday's forever ,When you come to Tommy's camp the vacation will not end,63
341,ברוכים הבאים ,Welcome ,Welcome,100
342,קנו חולצות טי של טומי ומדבקות  ומראות טומי  כדי לנפץ אותן!,Get your Tommy T-shirts and your stickers and your Tommy mirrors to smash!,Buy Tommy t-shirts and stickers and Tommy mirrors to smash them!,81
343,הכינו את כספיכם ,Have your money ready ,Prepare your money,72
344,קנו את כרטיסכם לגן העדן ,Buy your way to heaven ,Buy your ticket to heaven,77
345,קנו מצחיות ואטמי אוזניים ,Buy his shades and earplugs here ,Buy visors and earplugs,73
346,קנו תקליטים של טומי ,Get your Tommy records ,Bought Tommy's records,73
347,תמונות ותגים של טומי חצי לירה תמורת הפקק ,Tommy pics and badges half a nicker for the cork ,Photos and tags of Tommy half a pound for the cork,67
348,אתם בני מזל!,You lucky people!,You are lucky!,62
349,מחנה עם הבדל אחד לא משנה מזג האוויר ,The camp with the difference so never mind the weather ,A camp with one difference no matter the weather,78
350,כשאתם באים למחנה של טומי  החופשה לא תיגמר ,When you come to Tommy's the holiday's forever ,When you come to Tommy's camp the vacation will not end,63
351,האביזרים היקרים האלה לא מלמדים אותנו דבר!,These pricey deals don't teach us,These expensive accessories teach us nothing!,62
352,חירותך לא מגיעה אלינו!,Your freedom doesn't reach us,Your freedom does not come to us!,75
353,המאור בורח מאיתנו!,I am the light,The light escapes from us!,62
354,המודעות לא מעצבת אותנו!,Awareness doesn't shape us,Awareness does not shape us!,91
355,איך יכולים כל הסיפורים האלה  להוביל אותנו למקומות שהגעת ,How can all this trivia Take us to the goal you reached ,How can all these stories lead us to the places you have come to,71
356,באנו לכאן כדי להיות כמוך וכדי למצוא את העולם שהגעת אליו!,We came here to be like you And find the world you've reached,We came here to be like you and to find the world you came to!,85
357,האביזרים היקרים האלה לא מלמדים אותנו דבר!,These pricey deals don't teach us,These expensive accessories teach us nothing!,62
358,חירותך לא מגיעה אלינו!,Your freedom doesn't reach us,Your freedom does not come to us!,75
359,המאור בורח מאיתנו!,I am the light,The light escapes from us!,62
360,המודעות לא מעצבת אותנו!,Awareness doesn't shape us,Awareness does not shape us!,91
361,איך יכולים כל הסיפורים האלה  להוביל אותנו למקומות שהגעת ,How can all this trivia Take us to the goal you reached ,How can all these stories lead us to the places you have come to,71
362,באנו לכאן כדי להיות כמוך וכדי למצוא את העולם אליו הגעת!,We came here to be like you And find the world you've reached,We came here to be like you and to find the world you have come to!,82
363,ברוכים הבאים למחנה ,Welcome to the camp,Welcome to the camp,100
364,אני מניח שכולכם יודעים מדוע אנחנו כאן ,I guess you all know Why we're here,I guess you all know why we're here,100
365,שמי טומי והפכתי למודע השנה ,My name is Tommy And I became aware this year,My name is Tommy and I became conscious this year,83
366,"אם ברצונכם לבוא אחרי  תצטרכו לשחק ""פינבול"" ",If you want to follow me You've got to play pinball,"If you want to come after you will have to play ""pinball""",72
367,אז שימו את אטמי האוזניים המשקפיים הכהים  אתם יודעים איפה לשים את הפקק!,And put in your earplugs Put on your eyeshades You know where to put the cork,So put on the dark eyeglass earplugs you know where to put the cork!,75
368,הי אתה שמשתכר!,Hey you gettin' drunk,"Hi, you're getting drunk!",88
369,מצטער מאוד  שתפסתי אותך ,So sorry I got you sussed,Very sorry I caught you,67
370,הי אתה מעשן אמא טבע  פיספסת את האוטובוס ,Hey you smokin' mother nature You missed the bus,Hi you smoke mom nature you missed the bus,88
371,הי עצור אתה מר נורמלי!,Hey old hung-up Mr Normal,Hi stop you are Mr. Normal!,68
372,אל תנסה לזכות באמוני ,Don't try to gain my trust,Do not try to win my trust,77
373,כי לא תבואו אחרי בדרכים ההן ,'Cause you ain't gonna follow me Any of those ways,Because you will not follow me in those ways,75
374,למרות שאתם חושבים שאתם חייבים ,Although you think you must,Even though you think you must,67
375,כעת אינכם שומעים אותי אוזניכם אטומות לחלוטין!,Now you can't hear me Your ears are truly sealed,Now you do not hear me your ears are completely closed!,63
376,גם לא יכולים לדבר כי פיכם מלא ,You can't speak either 'Cause your mouth is filled,Nor can talk because your mouth is full,61
377,אינכם רואים דבר והפינבול משלים את התמונה ,You can't see nothin' And pinball completes the scene,You see nothing and the pinball completes the picture,80
378,הנה לכם מתנדבים הבאים לכוון אתכם אל מכונותיכם!,Here come willing helpers To guide you to Your very own machine,Here are some volunteers coming to guide you to your machines!,69
379,לא עשינו ולא נעשה זאת!,Never did and never will,We did not and will not do it!,64
380,נשכח אותו כבר עדיף!,Let's forget it better still,Forget it already better!,62
381,אנחנו לא ניקח את זה!,We're not gonna take it,We will not take it!,67
382,לא עשינו ולא נעשה זאת!,Never did and never will,We did not and will not do it!,64
383,לא רוצים שום דת וככל שנוכל לספר,Don't want no religion And as far as we can tell,Do not want any religion and as much as we can tell,85
384,לא נקבל אותך לא עשינו ולא נעשה זאת!,We ain't gonna take you Never did and never will,"We will not accept you, we did not and we will not!",62
385,נכניע אותך או נשכח אותך  כבר עדיף!,Gonna break you Let's forget you Better still,We will subdue you or forget you is already better!,63
386,הרגישי אותי!,Feel me,Feel me!,100
387,רפאי אותי!,Hear me,Heal me!,86
388,הרגישי אותי!,Feel me,Feel me!,100
389,שמעי אותי!,Hear me,Hear me!,100
390,הרגישי אותי!,Feel me,Feel me!,100
391,שמעי אותי!,Hear me,Hear me!,100
392,הרגישי אותי!,Feel me,Feel me!,100
393,שמעי אותי! שמעי אותי!,Hear me,Hear me! Hear me!,64
394,כשאני מקשיב לך אני שומע את המוסיקה ,Listening to you I get the music,When I listen to you I hear the music,78
395,בעקבותיך אני מטפס על ההר ,Following you I climb the mountain,Following you I climb the mountain,100
396,ממש מאחוריך אני רואה מיליוני אנשים ,Right behind you I see the millions,Right behind you I see millions of people,82
397,בך אני רואה את הזוהר ,On you I see the glory,In you I see the radiance,68
398,ממך אני מקבל דעות ,From you I get opinions,I get opinions from you,100
399,ממך אני קולט את הסיפור ,From you I get the story,From you I perceive the story,79
400,כשאני מקשיב לך אני שומע את המוסיקה ,Listening to you I get the music,When I listen to you I hear the music,78
401,כשאני מתבונן בך אני מרגיש את החום ,Gazing at you I get the heat,When I look at you I feel the heat,61
402,בעקבותיך אני מטפס על ההר ,Following you I climb the mountain,Following you I climb the mountain,100
403,ממש מאחוריך אני רואה את המיליונים  בך אני רואה את הזוהר ,Oh right behind you I see the millions On you I see the glory,Right behind you I see the millions in you I see the glow,90
404,ממך אני מקבל דעות ,From you I get opinions,I get opinions from you,100
405,ממך אני קולט את הסיפור ,From you I get the story,From you I perceive the story,79
406,כשאני מקשיב לך אני שומע את המוסיקה ,Listening to you I get the music,When I listen to you I hear the music,78
407,מלהסתכל בך נעשה לי חם ,I hope he's the man you've been looking for ,Looking at you made me hot,61
408,בעקבותיך אני מטפס על ההר ,Following you I climb the mountain,Following you I climb the mountain,100
409,לרגלייך אני חש התרגשות ,I get excitement at your feet,At your feet I feel excitement,92
410,ממש מאחוריך אני רואה את מיליוני האנשים ,Right behind you I see the millions,Right behind you I see the millions of people,88
411,בך אני רואה את הזוהר ,On you I see the glory,In you I see the radiance,68
412,ממך אני מקבל דעות ,From you I get opinions,I get opinions from you,100
413,ממך אני קולט את הסיפור ,From you I get the story,From you I perceive the story,79
414,כשאני מקשיב לך אני שומע את המוסיקה ,Listening to you I get the music,When I listen to you I hear the music,78
415,מלהסתכל בך נעשה לי חם ,You may be kidding me ,Looking at you made me hot,64
416,בעקבותיך אני מטפס על ההר ,Following you I climb the mountain,Following you I climb the mountain,100
417,לרגלייך אני חש התרגשות ,I get excitement at your feet,At your feet I feel excitement,92
418,ממש מאחוריך אני רואה את המיליונים ,Right behind you I see the millions,Right behind you I see the millions,100
419,בך אני רואה את הזוהר ,On you I see the glory,In you I see the radiance,68
420,ממך אני מקבל דעות ,From you I get opinions,I get opinions from you,100
421,ממך אני קולט את הסיפור ,From you I get the story,From you I perceive the story,79
422,כשאני מקשיב לך  ,Listening to you,When I listen to you,72
423,יומיים כבר עברו הלא כן כן אדוני,Yes sir - he hasn't moved a muscle in two days ,"Two days have passed, no, yes, sir",69
424,- הוא לא הזיז שריר כבר יומיים,Yes sir - he hasn't moved a muscle in two days ,- He has not moved a muscle for two days,78
425,מוזר לא זה תלוי על עסקה טובה עם האיש,That depends a good deal on the man ,Strange no it depends on a good deal with the man,79
426,האם הוא קיבל הצעות כלשהן טוב חלק מהמקומונות מהמשך העיר באו לדבר איתו,Has he had any offers Well some of the Bethel commune from across town came to talk to him ,Has he received any offers well some of the local newspapers from the rest of the city have come to talk to him,65
427,אנחנו צריכים את האיש הזה,We need that man ,We need this man,88
428,אני אצטרך לדבר איתו טוב אנחנו יכולים לצעוק אליו ולומר לו שיבוא אלינו,I'll have to talk with him Well we can holler to him and tell him to come over ,I'll have to talk to him well we can yell at him and tell him to come to us,81
429,אתה הולך לעזוב את המתחם אם אתה מכיר להגיע לשם בלי לעזוב את המתחם אשמח לשקול זאת,You are going to leave the compound If you know a way to get there without leaving the compound I'd be happy to consider it ,You're going to leave the compound if you know how to get there without leaving the compound I would love to consider that,82
430,כן אדוני,Yes sir ,Yes sir,100
431,אבל נבולים כמו שהיו אני חושב שהם גדלים כמו שצריך,But being as dead as they were I think they're coming back real fine ,But wilted as they were I think they grow properly,61
432,כן,Yes sir ,Yes,60
433,מה אתה רוצה הברון רוצה שכמה אנשים יבואו איתו לספרייה לא,The Baron wants some men to go with him to the library,What do you want The Baron wants some people to come with him to the library no,77
434,בשביל מה הוא מנסה לגייס איש חדש,What for Trying to recruit a new man ,For what he's trying to recruit a new man,94
435,לוחם,Fighter ,fighter,100
436,אלוהים יודע שנוכל להשתמש באחד,God knows we could use one,God knows we can use one,88
437,אני הולך לדבר עם האיש בספרייה תיזהר,I'm going to talk to the man at the library Be carefull,I'm going to talk to the man at the library be careful,99
438,אני מקווה שזה האיש שאתה מחפש,I hope he's the man you've been looking for ,I hope this is the man you're looking for,76
439,אז אתה יכול לשמוע אותי,So you can hear me ,Then you can hear me,84
440,מה שמך,What's your name ,What is your name,85
441,אני מניח שאתה להשכרה או שלא היית עומד פה,I assume you're for hire or you wouldn't be standing here ,I guess you're for rent or you would not be standing here,75
442,"""טוב לי קוראים ""הברון",Well I'm called the Baron ,"""I'm good to read"" Baron",60
443,האנשים מהקומונה הסתגלו למונח,The people of the commune took to using the term ,The people from the commune adapted to the term,76
444,באם זה נאמר מתוך כבוד זה לא ידוע לי,Whether it's said in respect is unknown to me ,Whether this was said out of respect I do not know,63
445,מה שאני מספר לי זאת העובדה הפשוטה שאנחנו לא מחפשים להרוס,What I'm telling you is the simple fact that we are not searching out to destroy ,What I'm telling you is the simple fact that we are not looking to destroy,86
446,אנחנו לא חומדים רכוש או חיים של שום איש,We do not covet the lives or goods of any people,We do not covet anyone's property or life,72
447,יש לנו אספקה טובה וממושכת של מים נקיים ו אה אנחנו מגדלים את הירקות שלנו,We have a good and lasting supply of fresh water And uh we grow our own vegetables ,We have a good and long supply of clean water and oh we grow our vegetables,85
448,בתור האיש שלנו אתה מוכתר ליותר מהאחרים שלושה מנות מבוגר של אוכל ומים,As our man you are entitled to more than the others Three adult allotments of food and water each meal,As our man you are crowned more than the other three servings of food and water,74
449,חדרך יהיה יבש ונקי מעכברושים,Your room will be dry and free of rats ,Your room will be dry and free of rats,100
450,אם אתה מעשן יש לי ערימה גדולה של סיגרים,If you smoke I have a large cache of cigars ,If you smoke I have a big pile of cigars,77
451,"טוב אני רק חושב ""שתשובתך תהיה ""לא",Well I can only think that your answer is no ,"Well I just think ""your answer will be"" no",71
452,אם תשקול את ההצעה המתחם שלנו הוא שני רחובות מפה בכיוון אליו אתה פונה,If you should reconsider our compound is two city blocks away in the direction you are facing ,If you consider the offer our complex is two blocks away in the direction you are facing,81
453,אתה תראה את המבצר,On you I see the glory,You will see the fort,65
454,עזרו לו בבקשה,Help him will you ,Please help him,62
455,אני אראה לך את הדרך,I'll show you the way ,I'll show you the way,100
456,! קארוט,Carrot!,! Carrot,100
457,מקומו של הברון,Baron's place ,The place of the Baron,69
458,שהברון צריך אותו יש לו את כל האנשים שהוא צריך או להאכיל,He's got all the men he needs or can feed ,That the Baron needs him he has all the people he needs or feed,67
459,אני רוצה שכולכם תכירו,I want all of you to meet  ,I want you all to know,81
460,קארסון קארסון,Carson Carson,Carson Carson,100
461,הוא הציל את חיינו הרגע,He saved our lives just now ,He saved our lives right now,80
462,אה שחלק מהבנות יכינו את החדר מעל חנות הטבאקו הישנה,Have some of the girls ready the room above the old tobacco shop ,Oh that some of the girls would make the room above the old tobacco shop,82
463,מתי שאתה נינוח אני ארצה לדבר,When you are settled I'd like to talk ,When you're relaxed I'll want to talk,70
464,אתה לא נופל לתוך הכסא רוב האנשים נופלים,You don't flop in a chair Most people flop ,You do not fall into the chair most people fall,79
465,טוב אני מקווה שהחדר שלך היה יבש או כן בסדר גמור וכמו שאמרת,I hope your room was dry Oh yes fine and as you said - no rats ,Well I hope your room was dry or just fine and like you said,80
466,זה מזכיר לי משהו שאני תהיתי לגביו,That brings me to something that I've been wondering about ,It reminds me of something I was wondering about,64
467,ההצעה שלי אליך שם ברחוב  מה אמרתי ש  גרם לך להצטרף אלינו,My pitch to you out there in the street what did I say say that caused you to join us ,My offer to you there on the street what I said that made you join us,73
468,יכול להיות ההבטחה  של תוספת מנה של אוכל,Might have been the promise of extra portions of food ,Can be the promise of an extra serving of food,65
469,לא,No ,No,100
470,אז אם כך אה אולי העובדה שאנחנו לא מחפשים  את הרכוש או את החיים של אנשים אחרים,Well then eh maybe the fact that we don't seek the goods or lives of others ,So if so oh maybe the fact that we are not looking for the property or the lives of other people,67
471,לא לא משהו כל כך אצילי,No nothing so noble ,No not something so noble,73
472,יש לך אספקה של סיגרים,You have a supply of cigars ,You have a supply of cigars,100
473,אתה צוחק עליי,You may be kidding me ,Are you kidding me,82
474,זה מעניין מה שהופך לחשוב מתי שרוב הדברים נלקחים,It's interesting what becomes valuable to us when most everything is taken away ,It's interesting what makes you think when most things are taken,62
475,עשרים וחמש לקופסא,Twenty five to the box ,Twenty-five per box,83
476,כולם סגורים בגלילי אלומיניום וחדשים כמו ביום שבו הם נוצרו,And all of them sealed in aluminum tubes and as fresh as the day they were made ,All are enclosed in aluminum cylinders and new as on the day they were created,66
477,אתה יכול לקחת כמה שאתה רוצה,You can have all you want ,You can take as many as you want,74
478,אני מאמין שאני מכיר את זה,I believe I know this ,I believe I know this,100
479,קישוט למכסה מנוע קאדילאק 1981,Hood ornament 1981 Cadillac,1981 Cadillac Hood Decoration,68
480,לאבי היתה אחת,My father had one ,My father had one,100
481,זאת היתה השנה האחרונה שיצרו את המכונית הזו,It was the last year the car was made ,This was the last year they created this car,74
482,הוא באמת סבל כשלא היה יכול להשיג יותר דלק להריץ אותה אני לא מאמין שהוא אי פעם אמר עוד מילה,He really suffered when he couldn't get more gasoline to run it I don't believe he ever said another word,He really suffered when he could not get more fuel to run it I can not believe he ever said another word,85
483,רק ישב שם  בזמן שעולמו התהפך סביבו,Just sat there while his world was turned off around him ,Just sat there while his world turned around,88
484,בלי בתי חולים - בלי תרופות,No hospitals - no medicine,No hospitals - no drugs,67
485,הוא היה הראשון שהלך הוא ואימי,He was one of the first to go - he and my mother ,He was the first to go he and my mother,92
486,היכן נולדת,Where were you born ,where were you born,100
487,דטרויט,Detroit,Detroit,100
488,הרוב ריק,Mostly empty ,The majority is empty,61
489,כמה קבוצות משהו כזה,A few groups - something like this,Some groups something like that,76
490,לא קל,Not easy ,Not easy,100
491,אתה צריך להיות מהיר,You have to be quick ,You need to be fast,62
492,לגבי החוזה שלנו  אני לא יודע כמה זמן אוכל למלא את חלקי בזה,About this contract of ours I don't know how long I can work my end of it ,As for our contract I do not know how long I can fill my part in it,71
493,אתה בדרך למקום כלשהו יש לי משפחה שגרה באי של חוף צפון קרוליינה,I have some family living on an island off the coast of North Carolina out of the way of killers ,You're on your way to somewhere I have a family living on an island off the coast of North Carolina,81
494,אנשים מתחילים לאכול אנשים שם בחוץ,You know - people are beginning to eat people out there ,People are starting to eat people out there,71
495,אני שמעתי סיפורים כן,I've been hearing stories ,I heard stories yes,73
