,hebrewFromSub,englishFromSub,englishTranslation,ratio
0,אני רק אדם פשוט אתה יודע ,I'm only a simple man you know ,I'm just a simple person you know,76
1,אנחנו זקוקים לאש ,We need a fire ,We need fire,92
2,לא הם ימצאו אותנו מייד ,No they'll find us right away ,No they will find us right away,87
3,מוקדם יותר או מאוחר יותר זה לא משנה ,Sooner or later it's all the same ,Sooner or later it does not matter,60
4,הילד יחלה מהקור ,The boy will get sick from the cold ,The child will get sick from the cold,89
5,כך את האבן החמה הזאת ושים אותה על בטנו ,Take this hot rock and lay it on his belly ,So this hot stone and put it on his stomach,66
6,מי מנסה להרוג אותי זה אבי ,The one trying to kill me is it Father ,Who's trying to kill me is my father,78
7,איך אתה יכול לומר דבר כזה ,How can you say such a thing ,How can you say such a thing,100
8,זה בלתי אפשרי ,Not impossible ,it's impossible,83
9,לא!,- No!,No!,100
10,זה לא בלתי אפשרי ,Not impossible ,It's not impossible,85
11,השוגון הוא היחיד חזק מספיק לקשירת קשר שכזה ,The Shogun is the only one who has the power to hatch such a plot ,The shogun is the only one strong enough to tie such a knot,66
12,יש פה יותר  מהנראה לעין ,There's more here than meets the eye ,There is more here than meets the eye,93
13,מה שהוא אומר נכון ,It's true what he says ,What he says is true,95
14,אסור שהאדון הצעיר ישמע דברים כאלה ,Young Master must not hear that kind of talk  ,The young gentleman must not hear such things,61
15,שקרים לא יעזרו לנו עוד!,- Lies won't help anymore!,Lies will not help us anymore!,81
16,זהו אביו ,It is his father ,This is his father,88
17,הוד מעלתו הוא רע ואכזר!,His Majesty is heartless and cruel!,His Majesty is evil and cruel!,86
18,הוא שונא  את העובדה שהאדון הצעיר איננו כמוהו ,He hates that  Young Master isn't like him at all ,He hates the fact that the young gentleman is not like him,72
19,הוא מעולם לא החזיק את טקצ'יו בזרועותיו ,Never once has he held Takechiyo in his arms ,He never held Tacchio in his arms,83
20,"הוא אמר: ""בני הוא אדם חלש"" ","He has said ""My son is a weakling ""","He said: ""My son is a weak man""",80
21,יחסיו עם בנו השני טוקומאצו טובים יותר  ואותו הוא רוצה בתור יורשו ,His relationship is better with his second son Tokumatsu-sama whom he wants as the heir ,His relationship with his second son Tokomatsu is better and he wants him as his successor,81
22,כדי שזה יקרה הוא צריך שבנו הבכור ימות ,In order to make that happen he needs his firstborn dead!,For that to happen he needs his eldest son to die,70
23,האדון הוטה ידע את כל זה ,Lord Hotta knew all of this ,Mr. Huta knew all this,79
24,ציית לאביך ,Obey your father ,Obey your father,100
25,לא!,- No!,No!,100
26,מדוע להביא את האדון הצעיר לאדו שם המוות מחכה לו ,Why take Young Master to Edo where death awaits him ,Why bring the young lord to Edo where death awaits him,84
27,זה לא כל-כך פשוט ,It isn't that simple ,It's not that simple,75
28,באדו מתגוררים שלושה מחברי השבט שלנו ,In Edo three members of our clan reside ,Bado is home to three members of our tribe,69
29,האדון קישו המנהלן של השוגון לצידנו ,Lord Kishu Administrator to the Shogun is on our side ,Mr. Kisho the manager of the shogun by our side,63
30,לא ניתן להביס את השוגון שם ,The Shogun can't be defeated there ,The shogun cannot be defeated there,93
31,הוד מעלתו חזק מדי!,- His Majesty is too powerful!,His Majesty is too strong!,77
32,אין לך מושג כמה ,You have no idea ,You have no idea how many,78
33,גם אם נברח הוד מעלתו ימשיך לשלוח אלינו מרצחים ,Even if we escape His Highness will keep sending more assassins ,Even if His Majesty escapes he will continue to send us murderers,64
34,חלומותיה של אישה לא יגנו עליו ,Awoman's fantasy won't protect him ,A woman's dreams will not protect him,65
35,יש להביס את השוגון!,The Shogun must be beaten!,The shogun must be defeated!,88
36,להילחם זו התקווה היחידה שלנו!,Fighting is the only hope we have!,Fight is our only hope!,69
37,חכו!,- Wait!,Wait!,100
38,תנו לו להחליט ,Let him decide ,Let him decide,100
39,בשביל להילחם באביך באדו  נלך במעלה הנהר ,To Edo and we fight your father go upstream ,To fight your father Bado we will go up the river,72
40,עזוב אותי!,Leave me!,leave me alone!,73
41,תיפסו אותם!,Get them!,Catch them!,67
42,הנה הם!,They're here!,Here they are!,80
43,אחריי!,Leave me!,After me!,62
44,לך!,Thank you ,to you!,67
45,זוז!,Move it!,Move!,73
46,החזק חזק ,Hold tight ,Hold tight,100
47,זהו סוסו של גנזבורו!,That's Genzaburo's horse!,This is Ganzborough's horse!,75
48,תודה ,Thank you ,Thanks,67
49,גיובו!,Go!,Gibo!,67
50,ומה עכשיו ,What now ,And what now,80
51,הפסדנו נכון ,We lost didn't we ,We lost right,60
52,לא  לא הפסדנו ,We lost didn't we ,No we did not lose,69
53,אבל אני חש שכוחנו הולך ונמוג ,But I feel like our strength is gone ,But I feel our power is waning,64
54,אנחנו עדיין בחיים ,We're still alive ,We're still alive,100
55,אתה חושב שאשרוד אם נצליח ,Do you think I can survive if we win ,You think I'll survive if we succeed,69
56,טקצ'יו לא יגיע בזמן לאדו ,Takechiyo won't be in Edo on time ,Tacchio will not arrive in time for Edo,69
57,אני מבטיח ,I promise ,I promise,100
58,אתם יושבים על הר געש ,You're sitting on a volcano ,You are sitting on a volcano,87
59,יש שמן בתוך הבית ,There is oil stored inside ,There is oil inside the house,80
60,צאו או אצית אותו באש!,Come out or I'll set it on fire!,Get out or set it on fire!,79
61,אתה מבין ,Understand ,Do you understand,74
62,אצית אותו!,No we haven't ,I will hasten it!,62
63,הפגיון הזה מורעל ,This blade is poisoned ,This dagger is poisoned,84
64,אם אתה חייב לעשות זאת  גיובו אל תסכן את חייהם  של חבריך הרונין ,If you must  Gyobu-dono don't endanger the lives of your ronin friends ,If you must do this backing do not risk the lives of your friends Heronin,70
65,ברצוני למות בכבוד  בדו-קרב מולך ,I wish to die honorably in a duel with you ,I want to die with dignity in a duel in front of you,68
66,אני איבה שוזמון!,Iba Shozaemon!,I'm Iba Shuzmon!,71
67,אני מוכן לפעולה!,Ready for action!,I'm ready for action!,89
68,אל תתקיפו מבלי שאצווה זאת!,Don't attack without my explicit order!,Do not attack without me ordering it!,76
69,יירו!,Shoot!,Shot!,89
70,אני מצטער ,I'm sorry ,I'm sorry,100
71,אומאן הישאר ,Oman you stay ,Oman stay,82
72,אז  ,Well then ,Then,62
73,"טקצ'יו ה""יורש""  חזר בשלום צר לי לדווח ",Takechiyo the 'Prince' returned safely I'm sorry to say ,"Tacchio the ""heir"" returned in peace I am sorry to report",67
74,טיפש!,- SHUT UP!,Stupid!,62
75,אתה לא יכול אפילו להרוג ילד קטן!,You can't even kill a small child!,You can not even kill a little boy!,72
76,אתה מחליא אותי!,I'm sick of you!,You make me sick!,71
77,אני לא רוצה לשוב ולראות אותך!,I don't want to see you anymore!,I do not want to see you again!,75
78,צא מפה!,Get out of here!,Get out of here!,100
79,אומאן!,Oman!,Oman!,100
80,טקצ'יו חייב למות ,Takechiyo must die ,Tacchio must die,88
81,הוד מעלתך!,- Your Highness!,your Highness!,100
82,הוד מעלתך  בני טוקוגאווה עלולים ליפול,Your Highness  The Tokugawa may fall if you persist!,Your Majesty the Tokugawa people may fall,70
83,מה ,- What ,what,100
84,שבט קישו מאיים עלינו ,We are threatened by the Kishu Clan ,The Kisho tribe threatens us,60
85,הוטה מסאמורי מכין את התקוממותם ,Hotta Masamori has prepared them to arise ,Huta Masamori prepares for their uprising,66
86,אם תיפול בידו ההזדמנות  שליט קישו רוצה להיות שוגון ,Given the opportunity the Kishu Daimyo wants to be Shogun ,"If the opportunity arises, the ruler of Kisho wants to be a shogun",75
87,אני האחראי  לכשלון בנסיון להרוג את טקצ'יו ,I am responsible for the failure to kill Takechiyo ,I'm responsible for the failure to try to kill Tacchio,85
88,טקצ'יו הוא היורש החוקי ,Takechiyo is the legitimate heir ,Tacchio is the legal heir,81
89,"אני מתחנן אליך  בהורגך את ה""יורש"" טקצ'יו  אין לדמיין  אילו תוצאות הרות-אסון יבואו",I beg of you  In killing 'Prince' Takechiyo you can't begin to imagine the dire consequences that would follow such a heinous act!,"I beg you to kill the ""heir"" Takachio, you can not imagine what disastrous results will come",64
90,שתוק!,- SHUT UP!,Shut!,73
91,לא משנה איך  שתוק!,- No matter how you  - SHUT UP!,No matter how silent!,71
92,שתוק!,- SHUT UP!,Shut!,73
93,תנסה להסביר את זה איש לא יבין כיצד  הוד מעלתך  מסוגל להרוג את בנך שלך ,try to explain nobody will understand how Your Highness can kill his own son ,Try to explain it no one will understand how Your Highness is able to kill your own son,83
94,האנשים יתקוממו ושבט קישו יעשו מהלך ,The people will revolt and Kishu Clan will make their move ,The people will revolt and the Kisho tribe will make a move,89
95,הם יגייסו 400 000 רונין  שיצעדו לעבר אדו  כדי להפיל את שושלת טוקוגאווה ,They'll assemble 400 000 ronin who will then march on Edo to destroy the Tokugawa Shogunate!,"They will raise 400,000 Ronin who will march towards Edo to overthrow the Tokugawa dynasty",66
96,מספיק כבר!,Enough!,enough already!,60
97,אומאן!,Oman!,Oman!,100
98,מה אתה עדיין עושה פה ,What are you still doing here ,What are you still doing here?,100
99,הוד מעלתו שלח את התה הזה ,His Highness sent this tea ,His Majesty sent this tea,75
100,בבקשה חכה!,Please wait!,Please wait!,100
101,בשביל מה ,What for ,for what,100
102,כמשרתת של האדון הצעיר  עליי לטעום קודם לבדוק אם הוא מכיל רעל ,As the Young Master's servant I must first test it for poison ,As a servant of the young lord I must first taste to see if it contains poison,75
103,השוגון הכין את התה הזה ,The Shogun made this tea ,The shogun made this tea,100
104,איך את יכולה לחשוד שיש בו רעל ,How could you suspect poison ,How can you suspect there is poison in it,70
105,לא!,- No!,No!,100
106,אני לא רוצה!,I won't!,I do not want!,60
107,איך את מעיזה ,How dare you !,How dare you,100
108,הפגיון הזה  איפה הישגת אותו ,That knife where did you get it ,This dagger where you got it,68
109,זאת מתנה ממישהו  שהאדון הצעיר חב לו את חייו ,It's a gift from someone Young Master owes his life to ,It is a gift from someone to whom the young gentleman owes his life,74
110,האם שמו היה  איגו גיובו ,Was his name Igo Gyobu-dono ,Was his name Igo Giovo,78
111,אומאן!,Oman!,Oman!,100
112,אומאן!,Oman!,Oman!,100
113,אני הייתי עושה  כל דבר ,I gave you everything!,I would do anything,60
114,כשאני חושב על זה  עכשיו    הייתי צריך לעמוד על רגליי  ולסרב    לדרישותיך הלא הגיוניות ,When I think about it now I should have stood up and refused your unreasonable demands ,When I think about it now I had to stand up and refuse your unreasonable demands,89
115,אתה במעצר!,You're under House Arrest!,you're under arrest!,86
116,עד הודעה חדשה  תציית לפקודה זו!,Until further notice you will observe a curfew!,Until further notice you will obey this command!,75
117,אומאן!,Oman!,Oman!,100
118,מדוע הוא עדיין בחיים ,Why is he still alive ,Why he's still alive,98
119,טקצ'יו  הוד מעלתו בנך ,Takechiyo-gimi Your Highness your son ,Tacchio His Majesty your son,62
120,האדון הצעיר שרד  את כל הסכנות!,Young Master survived through so many perils!,The young gentleman survived all the dangers!,61
121,הוד מעלתך!,Your Highness!,your Highness!,100
122,הוד מעלתך אתה עדיין רוצה שהאדון הצעיר ימות ,Your Highness do you still want Young Master to die ,Your Highness you still want the young gentleman to die,79
123,אדון צעיר  בקש מהוד מעלתו שיסלח לך ,Young Master ask His Majesty to spare you ,Young lord ask His Majesty to forgive you,68
124,לעולם לא!,Never!,Never!,100
125,מה ,WHAT !,what,100
126,אומאן מדוע לא  ביצעת את פקודותיי ,Oman why didn't you carry out my instructions ,Oman why did you not carry out my orders,68
127,נתתי לך הכל!,I gave you everything!,I gave you everything!,100
128,רצית הכל!,Everything you wanted!,You wanted everything!,100
129,הוד מעלתך  לא נתת לי דבר שאני רציתי ,- Your Highness you didn't give me anything I wanted!,Your Majesty did not give me anything I wanted,79
130,שום דבר!,Nothing at all!,Nothing!,67
131,גנבת אותי ממשפחתי!,You stole me from my family!,You stole me from my family!,100
132,כי אהבתי אותך!,Because I loved you!,Because I loved you!,100
133,הכל בגלל שאהבתי אותך!,All because I loved you!,All because I loved you!,100
134,שנאתי אותך!,I hate you!,I hated you!,95
135,במיוחד במיטה!,Especially in bed!,Especially in bed!,100
136,הוד מעלתך!,Your Highness!,your Highness!,100
137,אני שונאת אותך!,I hate you!,I hate you!,100
138,כל-כך הרבה סבלתי אבל עכשיו הוד מעלתך אתה מת ותסבול לנצח בגיהנום!,I've suffered so much but now Your Highness you're dead and you'll suffer in Hell for all eternity!,I have suffered so much but now Your Highness you are dead and will suffer forever in hell!,79
139,אסור להיכנס!,You may not enter!,Not to enter!,76
140,השוגון  מת ממחלה פתאומית!,The Shogun has just died of a sudden illness!,The shogun died of a sudden illness!,89
141,"""ע""פ רישומי משפחת טוקוגאווה השוגון השלישי ימיצו מורי  ",ACCORDING TO TOKUGAWA FAMILY RECORDS THE THIRD SHOGUN IMETSU DIED,"""According to the Tokugawa family's, the third shogun will exhaust Moori",77
142,"""ונתיניו אבה והוטה הלכו בעקבותיו ",AND HIS ELDERS ABE AND HOTTA SOON FOLLOWED ,"""And his subjects Abba and Huta followed him",68
143,"""טקצ'יו הפך לשוגון הרביעי """,TAKECHIYO BECAME THE FOURTH SHOGUN ,"""Takachio became the fourth shogun""",96
144,בוקר ,Morning ,Morning,100
145,בוקר ,Morning ,Morning,100
146,בוקר טוב מתוקה ,Good morning darling ,good morning Sweety,62
147,תקומי!,Get up!,Get up!,100
148,בוקר ,Morning ,Morning,100
149,תלבשי את הסוודר האדום שלך ,Wear your read sweater!,Wear your red sweater,98
150,את מוכנה לבית ספר ,Are you ready for school ,You're ready for school,85
151,- אח שלך בא היום - אני,- Your brother's coming tonight ,- Your brother is coming today,84
152,יודעת רוצה לעזור לי עם הקניות ,- I know Wanna help with the shopping ,Know want to help me with the shopping,85
153,אני אאסוף אותך ,I'll pick you up ,I'll pick you up,100
154,תוכלי להביא לי משהו ,Will you bring me back something ,Can you get me something?,71
155,-  מה,WHAT !,- What,100
156,- משהו טעים,- Something good ,- Something delicious,67
157,אבא ואמא יקרים תסלחו לנו לג'ורג' ולי שלקח לנו זמן כה רב לכתוב אבל כל כך הרבה קרה מאז שאימא נפטרה שלא מצאנו את הזמן לעשות זאת לפני כן ,Dear father and mother forgive us Georg and I for taking so long to write but so much has happened since mom passed away that we haven't found the time to do it before now ,Dear Dad and Mom Excuse us George and Lee who took us so long to write but so much has happened since Mom passed away that we did not find the time to do so before,78
158,אחי אלסכנדר היה כה נסער שלא ידענו מה לעשות ,My brother Alexander was so upset that we didn't know what to do ,My brother Alexander was so upset we did not know what to do,92
159,הוא נכנס עמוק לתוך דיכאון שנראה ללא תחתית ,He fell into a deep depression ,He went deep into a depression that seemed bottomless,60
160,בימים מסויימים הוא אפילו לא טרח לקום מהמיטה ,Some days he didn't even get out of bed ,On some days he did not even bother to get out of bed,83
161,לבסוף היו צריכים להעביר אותו לבית חולים איפה שהוא נאלץ לעבור טיפול מכאיב זה היה איום ונורא ,He finally had to be put into the hospital where he underwent painful treatment ,Eventually they had to take him to a hospital where he had to undergo painful treatment that was horrible and terrible,66
162,הייתי צריכה לנהל את החנות בעצמי להסתדר עם הצוואה ולדאוג לבית של המשפחה ושל אחי והכל באותו הזמן ,I had to manage the store by myself handle the will and take care of the house of the family and of my brother all at the same time ,I had to run the store myself to get by with the will and take care of the family and my brother's house and everything at the same time,81
163,אבל תודה לאל דברים פחות או יותר נרגעו ,But thank God things have more or less calmed down ,But thank God things more or less calmed down,95
164,אלכסנדר די החלים בתקופה האחרונה וכך יש לי לבסוף את הלוקסוס לכתוב לכם ,Alexander has recovered well enough that I finally have the luxury to write you ,Alexander quite recovered recently and so I finally have the luxury of writing to you,73
165,במשך כל התקופה הזו ג'ורג' היה ממש נפלא למרות שהוא בעצמו עבר תקופה לא קלה ,Throughout all this Georg was really wonderful even though he was also going through a difficult period ,Throughout this period George was really wonderful even though he himself went through a not easy period,78
166,הוא הועבר למחלקה אחרת ושם אמרו לו שיש לו סיכויים יותר גבוהים לזכות בקידום ,He was transfered to another department where he's been told he has much better chances for advancement ,He was transferred to another department where he was told he had a higher chance of winning the promotion,68
167,למרבה הצער יש לו בוס חדש אחד שאין לו יכולת לנהל ושרחוק רק מספר שנים מפרישה אבל חושב שהוא יודע הכל ומתוך פחד שג'ורג' אולי יחליף אותו הוא הופך את העבודה ליותר קשה ,Unfortunately he has a new boss an incompetent who's a few years away from retirement but thinks he knows everything and fearing that Georg might replace him makes the job very difficult ,Unfortunately he has one new boss who has no ability to manage and who is only a few years away from retiring but thinks he knows everything and out of fear that George might replace him he makes the job harder,77
168,אבל אתם מכירים את הבן שלכם:,But you know your son:,But you know your son:,100
169,זה יכול רק לדרבן אותו והוא משקיע את כל הזמן והאנרגיה שלו לעשות את העבודה הכי טובה שהוא יכול ולהוכיח שהוא הכי טוב ,This can only spur him on and he's focusing all his time and energies to do the best job possible and to prove that he's the best ,It can only spur him on and he invests all his time and energy in doing the best job he can and proving he is the best,71
170,למען האמת הוא קיבל מספיק העלאה שיחד עם הירושה שלי מאמא המצב הפיננסי שלנו הוא די מצוין ,He actually got enough of a raise that with my inheritance from Mom our financial situation is really excellent ,To be honest he got enough raise that along with my inheritance from mom our financial situation is pretty excellent,82
171,מה עוד אני יכולה לספר לכם ,- What can't you see ,What else can I tell you,81
172,כן איבי הדאיגה אותנו אבל מאז זה נראה שבריאותה מושלמת ,Yes Eva had been worrying us but she suddenly seems to be in perfect health ,Yes Ivy worried us but since then it seems her health is perfect,66
173,מאז ביקורינו האחרון בחורף לא היתה לה התקפת אסטמה והרופא מאוד מרוצה ,Since our visit last winter she hasn't had an asthma attack and the doctor's very pleased ,Since our last visit in the winter she has not had an asthma attack and the doctor is very pleased,93
174,היא שולחת חיבוקים ארוכים לשניכם ,She sends big hugs to both of you ,She sends long hugs to both of you,87
175,אני משערת שיש לי רק חדשות טובות לספר לכם ולאיבי שלנו אני אוסיף חיבוקים ונשיקות משלי ,I guess I only have good news to tell you and to our Evi's I add my own hugs and kisses ,I guess I only have good news to tell you and our Ivy I will add hugs and kisses of my own,89
176,כלתך אנה ,Your daughter-in-law Anna ,Your bride Anna,60
177,ומבקש מכל ליבו שתמחלו לו על כך שלא היה לו את הזמן לכתוב בעצמו ,Georg sends you his warmest regards and begs your forgiveness for not having the time to write himself ,And asks with all his heart that you forgive him for not having had the time to write himself,70
178,היא בפנים ,She's inside ,She's inside,100
179,לכו לכיתות שלכם ,Go to your classrooms ,Go to your classes,87
180,נו  עכשיו תגידי לי מה קרה ,Well Now tell me what's the matter ,Well now tell me what happened,75
181,בחייך תהיי הגיונית ותספרי לי ,Come on be reasonable and tell me ,"Come on, make sense and tell me",73
182,היא לא יכולה לראות יותר ,She can't see anymore ,She can see no more,80
183,זה נכון ,Is this true ,This is true,100
184,זה נכון ,Is this true ,This is true,100
185,כן ,Yes ,Yes,100
186,ממתי ,Since when ,since when,100
187,מתי היא הפסיקה לראות ,When did she stop seeing ,When did she stop seeing,100
188,בשירותים ,In the bathroom ,In the bathroom,100
189,זה נכון ,Is this true ,This is true,100
190,תנסי לפקוח את העיניים שלך ,Try to open your eyes ,Try to keep your eyes open,89
191,קדימה תפתחי את העיניים שלך!,Come on open your eyes!,Go ahead and open your eyes!,73
192,אני מבקשת ממך לפקוח את העיניים!,I'm asking you to open your eyes!,I ask you to keep your eyes open!,88
193,איך אני יכולה לראות מה הבעיה שם ,How can I see what the problem is ,How can I see what the problem is there,92
194,אין בעייה אווה אם לא תפקחי את עינייך אנחנו נלך ונשאיר אותך כאן לבד ,Very well Eva If you won't open your eyes we'll go away and leave you here all by yourself ,No problem Eva if you do not open your eyes we will go and leave you here alone,72
195,בואי!,Come!,Come on!,73
196,אני לא יכולה לראות ,I can't see ,I can not see,75
197,עכשיו תסתכלי עליי ,Now look at me ,Now look at me,100
198,את יכול לראות אותי ,Can you see me ,You can see me,100
199,-  ואת זה,- And that ,- and that,100
200,- לא,- No ,- No,100
201,מה ,- What ,what,100
202,"מה ""מה"" ","What ""what"" ","What what""",100
203,- מה את לא יכולה לראות,- What can't you see ,- What you can not see,84
204,אף אחד לא שיער עד כמה קצרת ראייה היא היתה ,No one guessed just how near-sighted she was ,No one imagined how short-sighted she was,68
205,היא הסתירה את זה ממש טוב תודה ,She hid it incredibly well Thank you ,She hid it really well thanks,74
206,לחשוב שהיא היתה חברה שלי ,To think she was my friend ,To think she was my girlfriend,93
207,תתיישרי בבקשה ,Straigten up please ,Straighten up please,97
208,את יכולה לדמיין בגיל הזה:,You can imagine at that age:,You can imagine at this age:,93
209,מכוערת הפרצוף שלה מלא בפצעים ואובססיבית ברעיון של להפוך לחברה הכי טובה שלי ,Ugly her face full of pimples and obsessed with the idea of becoming my best friend ,Her ugly face is full of wounds and obsessed with the idea of ​​becoming my best friend,89
