,hebrewFromSub,englishFromSub,englishTranslation,ratio
422,אולי אתם זוכרים את חג הפסחא שעבר כאשר כולנו הקשבנו ליצירה הווקאלית בכנסייה ,Perhaps you'll remember last Easter when we all heard that cantata at your church ,Maybe you remember last Easter when we all listened to the vocal work in church,68
423,"""אני מתמלאת אושר מהמחשבה על מוות ""","""I rejoice at the thought of death ""","""I am filled with joy at the thought of death""",68
424,ואיבי אמרה לאחר מכן:,And Evi said afterwards:,And Ivy said afterwards:,91
425,"""גם אני""  ואתם כל כך פחדתם ","""Me too""  and you were so scared ","""Me too"" and you were so scared",100
426,דיברנו על זה הרבה מאז ואני יודע שמוות בכלל לא מפחיד את איבי ,We've talked about it a lot since then and I know that death doesn't scare Evi at all ,We've talked about it a lot since and I know death does not scare Ivy at all,86
427,כעת שהחלטנו לקחת אותה עימנו דיברנו על זה שוב איתה וזה היה בו-זמנית יפהפה ועצוב להבין עד כמה זה קל עבורה להסכים להישאר איתנו ,Now that we've decided to take her with us we've talked about it again with her and it was both beautiful and sad to realize how easy it was for her to agree to stay with us ,Now that we have decided to take her with us we talked about it again with her and it was both beautiful and sad to understand how easy it is for her to agree to stay with us,90
428,אני חושב ש   להיזכר בחיים שחיינו זה מקל לקבל את הרעיון של הסוף ,I think that remembering the life we led it is easy to accept the idea of an end ,I think remembering the life we ​​lived makes it easier to accept the idea of ​​the end,85
429,אני מתחנן בפניכם אל תהיו עצובים אל תאשימו את עצמכם ואל תקבלו את זה באף צורה של ביקורת:,I beg you don't be sad don't blame yourselves and don't take it as any kind of criticism:,I beg you do not be sad do not blame yourself and do not accept it in any form of criticism:,74
430,מה שאני אומר לכם היא הבחנה פשוטה שלא קשורה בשום צורה אליכם ,What I'm telling you is a simple observation that has nothing to do with you ,What I am telling you is a simple distinction that has nothing to do with you,81
431,עם כל אהבתי 'בנכם ג'ורג ,With all my love Your son Georg ,With all my love 'your son George,98
432,כדאי שתנעלי נעליים יפות נסיכה ,You'd better put on some nice shoes princess ,You should wear beautiful princess shoes,64
433,ותשמרי על עצמך ,And be careful not to hurt yourself ,And take care of yourself,70
434,לא ,No ,No,100
435,לא תעזבי אותי!,No let go of me!,Do not leave me!,67
436,תפסיקי!,Stop it!,Stop it!,100
437,אני מצטער ,I'm sorry ,I'm sorry,100
438,אני חושב ששמעתי משהו ,I think I heard something ,I think I heard something,100
439,כן ,Yes ,Yes,100
440,אנחנו משירות תיקון טלפונים ,This is the phone repair service ,We are a phone repair service,75
441,התקשרו אלינו בנוגע לטלפון שלך ,We were called about your telephone ,Call us about your phone,75
442,לא רציתי שייצרו איתי קשר ,I didn't want to be reached ,I did not want to be contacted,63
443,- אתה יודע שזה אסור,- You know that's forbidden ,- You know it's forbidden,83
444,- לא אנחנו נדרשים לנתק את הטלפון שלך ,- No We're required to cut off your phone service ,- No We are required to disconnect your phone,69
445,זה לא נחוץ ,That's not necessary ,It's not necessary,79
446,אני אנתק את הטלפון ,I'll hang up the phone ,I'll hang up the phone,100
447,אני יכול לראות את הטלפון שלך ,May I see your phone ,I can see your phone,80
448,לא!,No ,No!,100
449,להתראות ,- What you seek ,See you,70
450,אני עדיין יכולה לצפות בטלוויזיה בחדר שינה ,Can I still watch TV in the bedroom ,I can still watch TV in the bedroom,100
451,ישו היקר תן לי להיות ילדה טובה שאוכל ללכת לגן עדן ,Dear Jesus let me be a good girl so I can go to heaven ,Dear Jesus let me be a good girl I can go to heaven,97
452,חשבתי שכלי נשק אסורים על הכוכב הזה ,I thought weapons were forbidden on this planet ,I thought weapons were forbidden on this planet,100
453,חוץ מזה  אני לא יכול להאמין שתהרוג אותי עבור שדה מלא בבורות ריקים ,Besides   I can't believe you'd kill me for a field of empty holes ,Besides I can not believe you will kill me for a field full of empty pits,85
454,זה כל מה שיש לי ,Is that all ,That's all I have,79
455,הכאב שלך חזק ,Share your pain ,Your pain is strong,71
456,מה אתה יודע על הכאב שלי ,- What do you know of my pain ,What do you know about my pain?,84
457,בוא נחשוף את זה  ביחד ,Let us explore it  together ,Let's reveal it together,60
458,כל איש מסתיר כאב סודי ,Each man hides a secret pain ,Every man hides a secret pain,88
459,חייבים לגרור את זה מהאפלה בכוח אל תוך אור ,It must be dragged from the darkness into the light ,It must be forcibly dragged from the darkness into the light,92
460,חלוק את כאבך ,Share your pain ,Share your pain,100
461,חלוק את כאבך איתי ותצא מחוזק מהשיתוף ,Share your pain with me and gain strength from the sharing ,Share your pain with me and come out strengthened from sharing,83
462,איפה קבלת את הכוח הזה ,Where did you get this power  ,Where did you get that power,93
463,הכוח היה בתוכך ,The power was within you ,The power was within you,100
464,זה כאילו הוסר משקל מעל ליבי ,It is as if a weight has been lifted from my heart ,It's like a weight has been removed from my heart,77
465,איך אוכל לגמול לך ,- How can I repay you ,How can I repay you,100
466,תצטרף לחיפוש שלי ,- Join my quest ,Join my search,67
467,מה אתה מחפש ,- Spock what are you doing here ,What are you looking for,68
468,מה אתה מחפש ,- Spock what are you doing here ,What are you looking for,68
469,מה שכל האנשים חיפשו מאז שהזמן התחיל ,What all men have sought since time began ,What all people have been looking for since time began,67
470,כדי למצוא אותו אנו צריכים ספינת חלל ,To find it we need a starship ,To find him we need a spaceship,87
471,ספינת חלל ,A starship ,Spaceship,63
472,אין ספינות חלל על נימבוס 3 ,There are no starships on Nimbus Ill ,There are no spaceships on the Nimbus 3,80
473,אולי יש לי דרך להביא אחת לכאן ,- I have a way to bring one here ,Maybe I have a way to get one here,81
474,אבל איך ,- But how  ,but how,100
475,תאמין ידידי יש עוד כמונו יותר ממה שאתה יודע ,Have faith my friend There are more of us than you know ,Believe me my friend has more like us than you know,70
476,אתה וולקני ,You're a Vulcan ,You're volcanic,80
477,"""תוכל להירגע""",You're a Vulcan ,"""You can relax""",71
478,אתה קורא לזה להירגע ,You call this relaxing ,You call it relaxation,73
479,אני כולי פקעת עצבים ,I'm a nervous wreck ,I'm all nervous,76
480,אם לא אזהר אגמור כמדבר אל עצמי ,If I'm not careful I'll end up talking to myself ,If I do not warn I will end up talking to myself,75
481,ברכות קפטן ,Greetings Captain ,Congratulations Captain,70
482,ספוק מה מעשיך פה ,- Spock what are you doing here ,Spok what are you doing here,98
483,אני עוקב אחר התקדמותך ,- I'm monitoring your progress ,I'm watching your progress,63
484,אני מצטער לומר לך שהשיא בטיפוס על ההר הזה לא נמצא בסכנת שבירה קפטן ,"If you don't stop distracting me  (CAPTAIN KIRKYELLS) Perhaps ""because it is there"" is not sufficient reason to climb a mountain ",I'm sorry to tell you that the peak in climbing this mountain is not in danger of breaking Captain,63
485,אני לא עושה זאת כדי לשבור שיא אני עושה את זה בגלל שאני נהנה מזה ,I'm doing this because I enjoy it ,I'm not doing this to break a record I'm doing this because I enjoy it,64
486,שלא להזכיר הסיבה החשובה ביותר לטפס על ההר שהיא ,Not to mention the most important reason for climbing a mountain  ,Not to mention the most important reason to climb the mountain is,85
487,בגלל שהוא נמצא שם ,Because it's there ,Because he's there,89
488,קפטן אני חושב שאתה לא מבין את חומרת מצבך ,I do not think you realise the gravity of your situation ,Captain I think you do not understand the seriousness of your situation,71
489,לעזאזל הוא חסר אחריות ,Goddamn irresponsible  !,Hell he's irresponsible,64
490,משחק עם החיים שלו ,Playing games with life ,Playing with his life,86
491,ההתרכזות היא חיונית ,Concentration is vital ,Concentration is essential,75
492,אתה חייב להתאחד עם הסלע ,You must be one with the rock ,You must unite with the rock,77
493,ספוק אני מעריך את דאגתך אם לאתפסיקלהפריעלי אני עלול  אולי בגלל שהוא שם אינה סיבה מספקת לטפס על הר ,"If you don't stop distracting me  (CAPTAIN KIRKYELLS) Perhaps ""because it is there"" is not sufficient reason to climb a mountain ",Spock I appreciate your concern if to the concept of the active I may because it is there is not a sufficient reason to climb a mountain,66
494,אני בקושי נמצא במצב שאוכל לחלוק על דעתך ,I am hardly in a position to disagree ,I'm barely in a position where I can disagree with you,66
495,היי בונז ,Hi Bones ,Hey Bones,82
496,כן נציגת רומולן החדשה שלנו ,Yes! Our new Romulan representative ,Yes our new Romulan representative,100
497,ברוכה הבאה לפרדייס סיטי יקירתי עיר הבירה של מה שנקרא כוכב השלום הגלקטי ,Welcome to Paradise City capital of the Planet of Galactic Peace ,"Welcome to my beloved Paradise City, the capital of the so-called Galactic Peace Star",78
498,אני סנט (הקדוש) ג'והן טלבוט נציג האיחוד על נימבוס 3 ,I'm St John Talbot the Federation Representative here on Nimbus Ill ,I'm St. (Saint) John Talbot Representative of the Union on Nimbus 3,73
499,שותפי המקסים הוא הקונסול של קלינגון קורד ,My charming companion is the Klingon Consul Korrd ,My charming partner is the consul of Klingon Cord,69
500,אני משערת שזה בקלינגונית שלום ,- I expect that's Klingon for hello ,I guess it's a Klingon hello,62
501,היכנסי יקירתי ,- Come in my dear ,"Come in, darling",73
502,לפני 20 שנה הסכימו שלושת ממשלותינו לפתח את הכוכב הזה ביחד ,20 years ago our three governments agreed to develop this planet ,20 years ago our three governments agreed to develop this planet together,93
503,עידן חדש נולד ,- I have a way to bring one here ,A new era is born,60
504,העידן החדש שלנו מת מוות מהיר ,- It died a quick death ,Our new era is dying a quick death,69
505,נראה שהגעתי בדיוק בזמן ,It appears I've arrived just in time ,I seem to have arrived just in time,65
506,תתרחקו מהמשדר הזה ,Get away from that transmitter ,Stay away from this transmitter,85
507,רומולן ,Romulan ,Romulan,100
508,קלינגון ,Klingon ,Klingon,100
509,תחשיבו את עצמכם כאסירי ,- Consider yourselves my prisoners ,Consider yourself a prisoner,83
510,אסירים ,- Prisoners ,Prisoners,100
511,אנו כבר אסירים על גוש הסלע חסר הערך הזה ,We're already prisoners here on this worthless lump of rock ,We are already prisoners on this worthless block of rock,89
512,איזה ערך כבר יכול להיות לנו עבורך ,- What value could we be to you ,What value we can already have for you,69
513,נימבוס 3 אולי גוש סלעי חסר ערך אבל יש בו אוצר מיוחד הוא המקום היחידי בגלקסיה שיש בו את שלושתכם ,- Nimbus Ill is a worthless lump of rock But it is the only place in the galaxy that has the three of you ,Nimbus 3 may be a worthless rocky block but it has a special treasure and is the only place in the galaxy that has the three of you,78
514,בדיוק על זה אני בונה ,That's exactly what I'm counting on ,This is exactly what I am building on,72
515,יש לה מנוע טוב אבל חצי מהדלתות לא נפתחות ונחשו של מי התפקיד לסדר את זה ,Halfthe doors won't open and guess whosejob itis to make itright ,It has a good engine but half of the doors do not open and guess whose job it is to fix it,60
516,סקוטי בוא נראה למה היא מסוגלת אמר הקפטן וגילינו נכון ,"""Let's see what she's got Scotty "" We found out didn't we ",Scotty let's see what she's capable of said the captain and we found out right,71
517,אני יודעת שתכניס אותה לכושר סקוטי אתה תמיד עושה זאת ,- I know you'll whip her into shape ,I know you put her in Scottish shape you always do,60
518,אהורה חשבתי שאת בחופשה ,- Uhura I thought you were on leave ,"Ahora, I thought you were on vacation",67
519,ואני חשבתי שאנו אמורים לצאת ביחד ,- I thought we were going together ,And I thought we were going to go out together,82
520,הייתה לי הרגשה שתגיד משהו כזה ,I had a feeling you would say something like that ,I had a feeling you would say something like that,100
521,אז הבאתי לנו ארוחה ,So I brought us dinner ,So I brought us a meal,73
522,או נחמד את האישה המבינה ביותר שאני מכיר ,You're the most understanding woman I know ,Or nice the most understanding woman I know,87
523,כוננות אדומה ,Red alert ,Red alert,100
524,רק עכשיו תיקנתי את הדבר הארור הזה!,I just fixed that damn thing!,I just repaired this damn thing!,64
525,כבה את זה טוב ,Turn it off will you ,Turn it off well,83
526,כוננות אדומה ,Red alert ,Red alert,100
527,זוהי כוננות אדומה ,This is a red alert ,This is a red alert,100
528,אנטרפרייז תאשרו ,Enterprise acknowledge ,Enterprise Confirm,65
529,זוהי האנטרפרייז ,This is Enterprise Identify yourself ,This is the enterprise,62
530,תזדהה זוהי מפקדת צי הכוכבים ,This is Starfleet ,Identify This is Starfleet Headquarters,61
531,יש לנו מצב של עדיפות 7 באזור המפורז מפקדת הצי המתינו ,We have a Priority 7 situation in the NeutraIZone ,We have a situation of priority 7 in the demilitarized zone Navy Headquarters waited,62
532,סקוטי זה אמיתי! ,- Scotty this is for real ,Scottish is real!,77
533,לא יכול להיות שהם רציניים הספינה הזו מפורקת לגורמים ויש לנו צוות מצומצם על הסיפון ,- They can't be serious! The ship's in pieces and we've got less than a skeleton crew ,It can not be that they are serious this ship is dismantled to the factors and we have a limited crew on board,60
534,מפקדת הצי האם אתם מודעים למצבנו ,Starfleet are you aware of our current status ,Naval Headquarters Are you aware of our situation?,64
535,האם ישנה בעיה רבותיי ,- Is there a problem ,Is there a problem gentlemen,78
536,כן ,Yes ,Yes,100
537,נלכדנו  בסופת שלג ,We've been caught in  a blizzard ,We were trapped in a blizzard,60
538,ואנו לא יכולים לראות דבר ,We can't see a thing ,And we can see nothing,67
539,תכווני אותנו לנקודת המפגש ,Direct us to the co-ordinates ,Direct us to the meeting point,71
540,החיישנים שלי מראים שמים בהירים ו 17 מעלות ,My visual says sunny skies and 70 degrees ,My sensors show clear skies and 17 degrees,60
541,זהו נס ,It's a miracle ,This is a miracle,84
542,אל תדאגו חבר'ה סודכם נצור עימי ,Don't worry your secretis safe with me ,Do not worry guys your secret is kept with me,70
543,אהורה אני חייב לך ,- You can't say we're lost ,Ahora I owe you,62
544,בואו וקחו את זה!,Come and get it!,Come and take it!,77
545,בונז תפסיק את זה ,Bones knock it off ,Bones stop it,65
546,אנו לידך ואנו גוועים מרעב ,We're right here and we're starving ,We are by your side and we are starving,73
547,שעועית ספוק אבל לא רגילה ,- Beans Spock but no ordinary beans ,Spooky beans but not ordinary,84
548,זהו מתכון דרומי נושן שניתן לי בידי אבי ,These are from an old recipe handed down to me by my father ,This is an old-fashioned southern recipe given to me by my father,68
549,ואם תעקם את האף הוולקנישלךמזה  אתה תעליב לא רק אותי אלא דורות שלמים של מקקוים ,If you stick your Vulcan nose up at these you're insulting generations of McCoys ,"And if you twist your volcanic nose, you'll insult not only me but entire generations of cockroaches.",65
550,במקרה הזה אין לי הרבה ברירות אלא לטעום את השעועית שלך ,In that case I have little choice but to sample your beans ,In this case I have not many choices but to taste your beans,80
551,זה המרכיב הסודי ,- That's the secret ingredient ,This is the secret ingredient,88
552,יש לך עוד מהמרכיב הסודי בונז ,- Any more secret ingredient Bones ,You have more of the secret ingredient Bones,74
553,אני מבין שהמרכיב הסודי שלך הוא אלכוהול ,- Your secret ingredient is alcohol ,I understand your secret ingredient is alcohol,84
554,בורבון ושעועית זה שילוב קטלני ,Bourbon and beans an explosive combination ,Bourbon and beans are a deadly combination,81
555,חושב שספוק יוכל להתמודד עם זה ,Can Spock handle it ,Think Spock will be able to handle it,61
556,אתה צוחק עם חילוף החומרים הוולקני הזה הוא יכול לאכול קערה של טרמיטים בלי שזה יציק לו ,With that Vulcan metabolism he could eat a bowl of termites ,You're kidding with this volcanic metabolism he can eat a bowl of termites without it bothering him,66
557,תודה לך ,- Thank you ,Thank you,100
558,אני יורד עליו והוא מבין את זה כמחמאה ,I insult him and he takes it as a compliment ,I get down on him and he understands it as a compliment,73
559,מה אני עשיתי ,- What did I do ,what did I do,100
560,ואפילו בזמן הנפילה ידעתי שלא אמות ,But even as I fell I knew I wouldn't die ,And even at the time of the fall I knew I would not die,69
561,חשבתי שהוא בן אלמוות היחידי ,- Isn't he the only one who's immortal ,I thought he was the only immortal,66
562,לא זה לא זה ,- No it isn't that ,No it's not it,67
563,ידעתי שלא אמות מפני ששניכם הייתם איתי ,I knew I wouldn't die because the two of you were with me ,I knew I would not die because you two were with me,93
564,תמידידעתי  שאמות לבד ,- I've always known   l'll die alone ,I always knew I would die alone,76
565,ובכן  אתקשר לואלהלה ואבקש לשמור לך חדר ,I'll call Valhalla and reserve a room for you ,Well I'll call Wallahla and ask for a room for you,74
566,מאז שנפגשנו כל הזמן הזה בחלל עוליםאחדלשניעלהעצבים  ומה אנו עושים בחופשה ,All that time in space getting on each other´s nerves  So what do we do on shore leave ,Ever since we met all this time in space immigrants have been getting on our nerves and what we do on vacation,66
567,מבלים אותה ביחד ,We spend it together ,Spend it together,92
568,לאנשים אחרים יש משפחות ,- Other people have families ,Other people have families,100
569,אנשים אחרים לא אנחנו ,- Other people not us ,Other people are not us,90
570,מה אתה עושה ,What are you doing ,What are you doing,100
571,מרשמלו ,A marsh melon ,Marshmallow,67
572,איפה למדת לעשות זאת ,Where did you learn to do that ,Where did you learn to do this,93
573,אז תגיד לי ספוק מה נעשה אחרי שנצלה את המר  מרשמלו ,What do we do after we toast the marsh melon ,So tell me Spock what will be done after we roast the bitter marshmallow,60
574,נואכל אותם ,- We consume them ,We'll eat them,62
575,זה משונה לא שרתי ליד מדורת מחנה מאז שהייתי ילד באיווה מה נשיר ,I haven't sung around the campfire since I was a boy in Iowa ,It's weird I haven't sung by a campfire since I was a kid in Iowa what a song,74
576,בונז מה נשיר ,- Good night Bones ,Bones what a song,67
577,מה עם מרוצי קומפטאון אסוף את צרותיך ,"- ""Camptown Races "" - ""Pack up your troubles """,How about competown racing? Pick up your troubles,76
578,אנו עוזבים ,- We're on leave ,We're leaving,81
579,זה שם של שיר ספוק ,- It's a song title ,It's the name of a Spock song,61
580,ירח מעל ריגל 7 חתור חתור חתור בסירתך ,"- ""Moon over Rigel 7 "" - ""Row row row your boat """,Moon over Rigel 7 Row Ride Row in your boat,85
581,"הד""ר ואני נתחיל ואז ניתן לך סימן ואתה תצטרף ",The Doctor and I will start off and you jump in ,Dr. and I will start and then you will be given a sign and you will join,61
582,"ד""ר אם תואיל בבקשה ",- Doctor if you please ,Dr. If you please,89
583,אל תגיד שלא הזהרתי אותך ,- Don't say I didn't warn you ,Do not say I did not warn you,75
584,חתור חתור חתור בסירתך בעצלתיים במורד הזרם ,"- ""Moon over Rigel 7 "" - ""Row row row your boat """,Row Row Ride your boat lazily downstream,66
585,אתה שר המילים לא חשובות ,Don't worry your secretis safe with me ,You sing the words do not matter,60
586,"אני מצטער ד""ר ",- I am sorry Doctor ,I'm sorry Dr.,69
587,האם אנו מבלים בנעימים ,- Were we having a good time ,Do we have a good time?,75
588,אלוהים אהבתי אותו יותר לפני שהוא מת ,- I liked him better before he died ,God I loved him more before he died,71
589,קפטן  ,- Captain  ,Captain,100
590,קרא לי ג'ים ,Call me Jim ,Called me Jim,92
591,ג'ים  ,- Jim  ,Jim,100
592,כן ספוק ,- Yes Spock  ,Yes Spock,100
593,החיים אינם חלום ,Life is not a dream ,Life is not a dream,100
594,לך לישון ספוק ,- Go to sleep Spock ,Go to sleep Spock,100
595,כן קפטן ,- Yes Captain ,Yes Captain,100
596,לילה טוב בונז ,- Good night Bones ,Good night Bones,100
597,לילה טוב ג'ים ,- Good night Jim ,Good night Jim,100
598,לילה טוב ספוק ,- Good night Spock ,Good night Spock,100
599,"לילה טוב ד""ר ",- Good night Doctor ,Good night Dr.,87
600,לילה טוב ספוק ,- Good night Spock ,Good night Spock,100
601,לילה טוב ג'ים ,- Good night Jim ,Good night Jim,100
602,אני לא יודע ,I don't know ,I do not know,88
603,אני פשוט לא יודע ,I just don't know ,I just do not know,91
604,קפטן קלה יש לנו מטרה על הכוונת ,Captain Klaa we have the target in sight ,Captain Easy We have a goal on target,62
605,טוב ,Good ,are good,67
606,כל בקרי הנשק אלי ,All weapons atmy control ,All the weapon controllers to me,64
607,אני צריך מטרה שיכולה לירות בחזרה ,I need a target thatfilghts back ,I need a target that can shoot back,75
608,קפטן מידע חדש יש מצב של בני ערובה בנימבוס 3 ,Captain new data hostages on Nimbus Ill ,Captain New Information has hostage situation in Nimbus 3,69
609,אחד מבני הערובה קלינגוני ,- One ofthe hostages is a Klingon ,One of the Klingon hostages,79
610,והאחרים ,- And the others ,And the others,100
611,ארצן ורומולן ,A marsh melon ,Earth and Romulan,60
612,תמיד רציתי להתעסק עם ספינה של האיחוד ,I've always wanted to engage a Federation ship ,I always wanted to mess with a Union ship,62
613,סלק את האור הארור מפני ,Get the damn light out of my face ,Remove the damn light from,64
614,שכחת לקחת אותו איתך ,- You forgot to take it with you ,You forgot to take it with you,100
615,מעניין למה עשיתי זאת ,- I wonder why I did that ,I wonder why I did that,100
616,אספו את הזבל שלכם ,Pack out your trash ,Collect your trash,70
617,כל מה שבקשתי הוא ספינה גבוהת תרנים וכוכב כדי לנווט אותה ,"""All I ask is a tall ship and a star to steer her by """,All I asked for was a mast-high ship and a star to navigate it,65
618,מלוויל ,- Melville ,Melville,100
619,ג'ון מנספילד (משורר אנגלי) ,- John Masefield ,John Mansfield (English poet),63
