,hebrewFromSub,englishFromSub,englishTranslation,ratio
390,קדימה! קום משם!,Get up there!,forward! Get up from there!,65
391,תן לי ללכת!,Let's go!,let me go!,82
392,אני רוצה שאתם הילדים תבינו שאני לא רוצה אתכם בשטח שלי ,I want you children to understand that I do not want you on my property ,I want you kids to understand that I do not want you in my territory,79
393,תתרחק ממני ,You keep away from me ,stay away from me,74
394,תן לי ללכת ,Let's go!,let me go,82
395,היי!,- Hey!,Hey!,100
396,תקשיב אלי!,Listen to me!,Listen to me!,100
397,אמרתי לכם 50 פעם להתרחק מהעץ הזה!,- I've told you 50 times to keep out of that tree!,I told you 50 times to stay away from this tree!,70
398,תן לי ללכת!,Let's go!,let me go!,82
399,ואני לא רוצה לראות אותך על העץ ,And I don't want you in the tree ,And I do not want to see you on the tree,81
400,אתה שומע אותי ,You hear me ,do you hear me,88
401,אתה תתרחק ממני ,You keep away from me ,You will stay away from me,68
402,זה לא משנה מה שעשית ,Don't you even want to climb it ,It does not matter what you did,65
403,הפעם אני אקרא לשוטר  ואדאג שתתרחקו מהשטח שלי ,I'm gonna call the constable this time  - and see that you keep off my property ,This time I'll call the cop and make sure you get out of my area,69
404,תן לי ללכת!,- Lemme go!,let me go!,82
405,זה כל מה שזה שומע אותי ,- That's all there is to it you hear me ,That's all it's hearing me,70
406,תפסיק!,Stop it!,Stop!,73
407,תפסיק אתה איש רשע וזקן ,Stop it you mean old man ,Stop being an evil old man,60
408,אוה!,- Oh!,Oh!,100
409,חזרת הלא כן ,You came back did you ,You did not come back,86
410,מי את ,Who are you ,Who are you,100
411,דודה שלי פולי תקרא למשטרה ,My Aunt Polly will send for the police ,My aunt Foley will call the police,72
412,והם ימצאו אותנו במרתף הישן ומלא החולדות ואתה תלך לכלא ,And they'll find us in your old rat-filled basement and you'll go to jail ,"And they'll find us in the old, rat-filled basement and you'll go to jail",94
413,אוה אוה הם יודעים עלי האין זאת ,Oh Oh they know about me do they ,Oh oh they know about me isn't it,83
414,הכל!,Everything!,Everything!,100
415,הכל על הילדים שחטפת והפכת לעבדיך ,All about the children you've kidnapped and turned into your slaves ,It's all about the kids you kidnapped and became your slaves,77
416,אנחנו רק רוצים לטפס על עץ זקן ,We just wanna climb your old tree ,We just want to climb an old tree,79
417,אתם נופלים מהעץ ונפגעים ואז אני נתבע על ידי ההורים שלכם ,You fall out of that tree and get hurt and I get sued by your parents ,You fall from the tree and get hurt and then I'm sued by your parents,86
418,אין לי הורים ,I don't got any parents ,I have no parents,60
419,אני יתום ,I'm an orphan ,I'm an orphan,100
420,ובכן לפני שאני זורק אתכם למרתף עם האחרים  מה השם שלך ילד ,Well before I pitch you into the basement with the others  - what name do you go by boy ,Well before I throw you in the basement with the others what's your name kid,81
421,ג'ימי בין ,-Jimmy Bean ,Jimmy Bean,100
422,ג'ימי בין ,-Jimmy Bean ,Jimmy Bean,100
423,אני אוהב לרשום את השמות שלכם אתה רואה ג'ימי  כדי שאוכל להבחין בך למטה במרתף עם החולדות ,I like to keep a record of your names you see Jimmy  so that I can tell you from the rats down there in the basement ,I like to write down your names you see Jimmy so I can spot you down in the basement with the rats,79
424,אתה תן לי ללכת!,- You lemme go! - Hey!,You let me go!,76
425,היי! חזור הנה לעזאזל איתך!,Come back here you little girl!,Hey! Come back here to hell with you!,71
426,אוה לא את לא ,Oh no you don't ,Oh no you are not,69
427,לא את לא ,No you don't ,No you do not,88
428,את חזרי לכאן ,You come back here ,You're back here,76
429,מה אני מתכוון לעשות איתך הא ,What am I going to do with you huh ,What am I going to do with you?,94
430,אינני יודעת אדוני ,I don't know sir ,I do not know sir,79
431,טוב ממילא נהיה צפוף מדי מרוב ילדים במרתף ,Well it was getting too crowded with kids in that basement anyway ,Well anyway we get too crowded from most kids in the basement,78
432,הפעם אתן לך ללכת  אבל עליך להבטיח שאף פעם לא תפריעי לי יותר כאן ,I'll let you go this time  but you've got to promise never to come bothering me here again ,This time I'll let you go but you must ensure you never bother me here again,78
433,את מבטיחה ,- You promise ,You promise,100
434,כן אדוני ,- Yes sir ,Yes sir,100
435,בהן צדקך ,Right-- Right there ,In them you were right,67
436,צאי החוצה ,Get out ,get out,100
437,צאי החוצה!,Get out ,get out!,100
438,למה את מחכה ,What are you waiting for ,What are you waiting for,100
439,אתה יודע מה אני חושבת ,- You know what I think ,You know what I think,100
440,לא ,- No ,No,100
441,מה את חושבת ,What do you think ,what do you think,100
442,אני לא חושבת שיש ילדים במרתף הישן שלך ,I don't think there's any kids in your old basement ,I do not think there are children in your old basement,76
443,אני חושבת שאתה רמאי גדול!,- I think you're just a big bluff!,I think you're a big cheater!,71
444,אוה את חושבת את חושבת ,What do you think ,Oh you think you think,67
445,ובכן תעזבי את זה!,Well it really wasn't that important ,Well leave it at that!,63
446,מה את נוגעת בדברים ,- What What What are you talking about ,What are you talking about?,84
447,אל תגעי בכלום ,Don't touch anything ,Do not touch anything,93
448,הם הדברים שלי ואני לא רוצה שיגעו בהם ,These are my things and I don't want them touched ,They are my things and I do not want to be touched,83
449,זה נראה לי כמו גרוטאות ישנות ומאובקות ,It just looks like a lotta old dusty junk to me ,"It looks to me like old, dusty junk",84
450,טוב את ממילא לא תביני כלום ,Well you wouldn't know anything about that anyway ,Well you will not understand anything anyway,73
451,את רק ילדה ,- I think you're just a big bluff!,You're just a girl,65
452,איך אתה עושה את זה ,Oh no you don't ,How do you do that,73
453,איך אתה עושה את זה ,Oh no you don't ,How do you do that,73
454,את לא יודעת כלום ,- You know what I think ,You know nothing,70
455,אני לא עשיתי את זה ,I didn't make it ,I did not do it,65
456,השמש עשתה את זה ,The sun made it ,The sun did it,69
457,זהו אור המוחזר מהמנסרה ,- That's prismatic reflected light ,This is light reflected from the prism,71
458,מאיפה ,- Where from ,From where,100
459,ובכן אוה  אוה מכאן ,Where from Well uh-- Oh from here ,Well oh oh from here,75
460,אתה רואה את הקריסטלים התלויים שם ,- You see these hanging crystals ,You see the crystals hanging there,91
461,ממ  הממ ,- Mm-hmm ,Mmm hmm,92
462,קרני השמש פוגעים בזה וזה מתנהג כמו מנסרה ,The sun's rays hit it and it acts like a prism ,The sun's rays hit it and it acts like a prism,100
463,את מבינה ,- You do not ,You know,67
464,שאני מבינה את לא ,- Sure I understand ,That I understand the no,68
465,את לא יודעת מה זו מנסרה ,You don't know what a prism is ,You do not know what a prism is,89
466,עכשיו תודי בזה ,Now admit it ,Now admit it,100
467,היא עושה קשת הישר על הקיר שלך ,It makes a rainbow right on your wall ,She makes a bow straight on your wall,76
468,האין זה יפה ,Isn't it beautiful ,Is not it beautiful,92
469,כן אבל כשהשמש שוקעת זה נעלם ,Yes but when the sun sets it'll be gone ,Yes but when the sun goes down it disappears,65
470,אז תפסיקי עם זה ,Stop it!,So stop it,82
471,בטח אבל היא תחזור מחר כשהשמש תופיע שוב ,Sure but it'll be back again tomorrow when the sun comes again ,Sure but she's coming back tomorrow when the sun comes up again,80
472,אתה צריך להודות בזה ,- You have to admit that ,You have to admit it,90
473,אני לא צריך להודות בכלום!,- I don't have to admit anything!,I do not have to admit anything!,95
474,ובכן עדיף שאלך עכשיו הביתה ,Well I better be going back home now ,Well I better go home now,82
475,היה נעים לפגוש אותך ,It was very nice meeting you ,it was nice to meet you,82
476,ותודה על שהראית לי את הבית שלך ,And thank you for showing me your house ,And thanks for showing me your house,93
477,אבל אני לא הראיתי לך את הבית שלי ,But I didn't show you my house ,But I did not show you my house,89
478,את באת והתפרצת לכאן!,You come back here ,You came and broke out here!,67
479,להתראות ,- You promise ,See you,67
480,ובכן אתה תמיד היית בלתי צפוי אדמונד ,Well you always were unpredictable Edmond ,Well you were always unpredictable Edmund,98
481,שלום פולי ,- Hello Polly ,Hello Polly,100
482,מגיע לכאן כך מבלי להתקשר ,- Coming here like this without even calling ,Comes here like this without calling,90
483,אוה לא תשב ,Will you help us ,Oh you will not sit,69
484,אני יכולה לתת לך מעט שרי ,- Could I get you some sherry ,I can give you some sherry,83
485,אני נתקלתי באחיינית שלך למטה בוומפוס קריק ,I ran into your niece down at Wompus Creek ,I came across your niece down at Wampus Creek,74
486,דיברנו עליך וחשבנו מדוע שלא נעצור ונאמר שלום ,We were talking about you and I thought why not stop by and say hello ,We talked about you and thought why we should not stop and say hello,86
487,למה זה מאוד נחמד מצדך ,Why that's very nice ,Why is this very nice of you,71
488,אינני יודעת למה פוליאנה תימצא בוומפוס קריק ,I don't know why Pollyanna would be at Wompus Creek ,I do not know why Polyana will be in Wampus Creek,70
489,אוה היא שיחקה ,Oh she was playing ,Oh she played,71
490,היא אמרה לי שתהיי לבד היום ,She told me you'd be alone today ,She told me to be alone today,85
491,היו כל כך הרבה אנשים בפעם הקודמת כך שלא היתה לנו הזדמנות לשוחח ,There were so many people around the other day we hardly had a chance to talk ,There were so many people last time that we did not have a chance to talk,77
492,כן ובכן אני מצטערת שהפגישה יצאה מכלל שליטה באופן כזה ,Yes well I'm sorry that meeting got out of hand like that ,Yes well I'm sorry the meeting got out of hand in this way,89
493,ובכן אמור לי את מי ראית מאז שחזרת ,Well tell me who have you seen since you've been back ,Well tell me who you've seen since you came back,91
494,אף אחד ,Goodbye ,nobody,62
495,אתה יודע שקרלין דונלי התחתנה ,- You knew that Carleen Donnelly got married didn't you ,You know Carlin Donnelly got married,79
496,לא ,- No ,No,100
497,אתה זוכר את אחיה בקט דונלי ,- You remember her brother Beckett Donnelly ,You remember her brother Beckett Donnelly,100
498,לא ,- No ,No,100
499,שניכם התווכחתם כל הזמן ,You two used to argue all the time ,You two argued all the time,85
500,ובכן אני מצטער אני לא זוכר ,Well I'm sorry I don't ,Well I'm sorry I do not remember,70
501,ובכן זה באמת לא היה כל כך חשוב ,Well it really wasn't that important ,Well it really was not that important,90
502,אני יודעת מה אעשה ,I know what I'll do ,I know what I'll do,100
503,אערוך לך מסיבת ברוך הבא ,I'll give you a welcoming home party ,I'll have a welcome party for you,78
504,יהיה נחמד לראות שוב חלק מהפנים המוכרות ,It might be nice to see some of the old faces again ,It would be nice to see some of the familiar faces again,80
505,אני יודעת שגרי ונל ישמחו לראות אותך ,I know that Gary and Nell would love to see you ,I know Gary and Nell will be happy to see you,74
506,ואני חושבת שהחמישי  פולי ,And I think it's the fifth one-- - Polly - What ,And I think the fifth is Foley,70
507,מה ,That ,what,75
508,אני לא כל כך טוב במסיבות ,I'm not very good at parties ,I'm not that good at parties,86
509,בבקשה לא ,Please don't ,Please do not,80
510,ובכן רק חשבתי שתהנה לראות חלק מחבריך ,Well I just thought you might like to see some of your friends ,Well I just thought you would enjoy seeing some of your friends,77
511,חזרתי לראות אותך ,I'm your friend ,I saw you again,60
512,ובכן זה מאוד מחניף ,Well that's very flattering ,Well it's very flattering,85
513,אדם עסוק כמוך זוכר אותי ,A busy person like you remembering me ,A busy person like you remembers me,94
514,חזרתי כדי לראות אם התחתנת ומה קרה איתך ,I came back to see if you were married and what had happened to you ,I came back to see if you got married and what happened to you,91
515,אוה אני בסדר ,I'm your friend ,Oh I'm fine,69
516,כלום לא השתנה ,- Nothing has changed ,Nothing has changed,100
517,הכל  ,Everything is--,Everything,87
518,חזרתי כדי לראות אם את מרגישה כמוני ,I came back to see if you felt the same as I do ,I came back to see if you feel like me,78
519,אוה אבל עברו חמש שנים ,Oh but it's been five years ,Oh but five years have passed,71
520,אינך יכול לצוץ פתאום  ,- You can't just pop out--,You can not suddenly pop up,61
521,הן היו שנים מבוזבזות ,- They were wasted years ,They were wasted years,100
522,ספר לי על עבודתך אדמונד ,Tell me about your work Edmond ,Tell me about your work Edmund,97
523,שמענו שפתחת מרפאה בבולטימור  ואנחנו מאוד גאים בך ,We've heard that you've opened a clinic in Baltimore  and we're very proud of you ,We heard you opened a clinic in Baltimore and we are very proud of you,88
524,מה היה הדבר שהזכרת על בית היתומים ,- What was it you mentioned yesterday about the orphanage ,What was the thing you mentioned about the orphanage,79
525,אינני זוכר ,- I don't remember ,I do not remember,79
526,או כן אתה כן ,Oh yes you do ,Or yes you are,74
527,זה היה משהו על המרפאה ,It was something about the dispensary ,It was something about the clinic,83
528,היא לא מספיקה לכמות כזו של ילדים ,It's inadequate for that number of children ,It is not enough for such a large number of children,65
529,זה הכל ,That's all ,that's it,74
530,אני רוצה לחדש את זה ,Well I want to modernize it ,I want to renew it,71
531,התעזור לנו ,Will you help us ,Help us,61
532,רק תאמר מה אנחנו צריכים ואני אקנה ,Just tell us what we need and I'll buy it ,Just say what we need and I'll buy,85
533,זוהי אחריות אזרחית ,It's a civic responsibility ,This is a civic responsibility,91
534,למה שאת תיקני הכל ,Everything is--,Why you fixed everything,65
535,ובכן זה לא שאיננו יכולים להרשות לעצמינו ,- Well it isn't as if I couldn't afford it ,Well it's not that we can not afford,63
536,מה הקשר בין הדברים ,What's in the durn thing ,What is the connection between the things,65
537,ובכן זה בגלל שאני רוצה ,Well it's because I want to ,Well it's because I want to,100
538,אני מרגישה שאני צריכה ,I feel I should ,I feel I should,100
539,עדיין לא למדת שאנשים לא אוהבים צדקה מלאכותית ,Haven't you learned yet that people don't like false charity ,You have not yet learned that people do not like artificial charity,76
540,ובכן אינני רוצה לדון בזה יותר ,Well it's because I want to ,Well I do not want to discuss this anymore,67
541,אינני מבינה כיצד הגענו לשוחח על כך ,Well I don't want to talk about it any more ,I do not understand how we came to talk about it,70
542,ובכן זו לא הדרך שרציתי בה ,Well it isn't the way I wanted it ,Well this is not the way I wanted it,87
543,כן אני אעשה את זה ,Yes I'll do that ,Yes i will do it,69
544,פוליאנה הביטי בשמלתך החדשה ,Pollyanna look at your new dress ,Polyana Look at your new dress,97
545,היא מטונפת!,It's filthy!,She's filthy!,78
546,והנעליים שלך!,And your shoes!,And your shoes!,100
547,אוה אני מצטערת דודה פולי ,Oh I'm sorry Aunt Polly ,Oh I'm sorry Aunt Foley,74
548,על מה את ודר' צ'ילטון דיברתם ,What were you and Dr Chilton talking about ,What did you and Dr. Chilton talk about?,85
549,אוה!,Oh!,Oh!,100
550,שום דבר ,Nothing ,Nothing,100
551,דיברנו על השיער שלך ,We were talking about your hair ,We talked about your hair,86
552,השיער שלי ,- My hair ,my hair,100
553,כן ,- Yes ,Yes,100
554,הוא אמר שהוא היה ארוך ורך והגיע עד לכתפיים ,He said you used to wear it very long and soft down to your shoulders ,He said he was long and soft and reached up to his shoulders,67
555,הוא אמר שהוא היה יפהפה!,He said it was beautiful!,He said he was beautiful!,92
556,כן טוב אוה  תנקי עצמך לפני הארוחה יקירה ,Yes well uh-- Clean yourself up for supper dear ,Yes well oh clean yourself before the meal dear,72
557,כן דודה פולי ,Yes Aunt Polly ,Yes Aunt Foley,86
558,אוה אבל דודה פולי בבקשה  ,- Oh but Aunt Polly please--,Oh but Aunt Foley please,75
559,לא יהיו שטויות על זה פוליאנה ,- There'll be no nonsense about it Pollyanna ,There will be no nonsense about this Polyana,79
560,זוהי חובה ועבודה שחייבים לעשותם ,This is a duty and a job that must be done ,It is a duty and a job that must be done,90
561,איזה סוג של משלוח ,- What kind of deliveries ,What kind of delivery,91
562,סלי צדקה ילדה ,- Charity baskets child ,Girl charity baskets,88
563,אוה הסבל בעולם!,- Oh the suffering in this world!,Oh the suffering in the world!,95
564,דעי להעריך איזו בת מזל את ,Appreciate how lucky you are ,Know how lucky you are,68
565,עכשיו שני אלה ראשונים ננסי והחזיקי אותם בזהירות ,Now these two go first Nancy and handle them with care ,Now these are the first two Nancy and hold them carefully,76
566,היכן האחד של גב' סנואו ,- Where's the one for Mrs Snow ,Where's the one from Mrs. Snow,95
567,אוה ,Oh!,Oh,100
568,כן גברת ,- Yes ma'am ,Yes ma'am,100
569,ואל תתבטלו ,- And I don't blame them ,And do not be put off,60
570,ושימרי על בגדייך נקיים לשם שינוי ,And keep your clothes clean for a change ,And keep your clothes clean for a change,100
571,אוה רק רגע ננסי ,- Oh just a minute Nancy ,Oh just a moment Nancy,86
572,אומ אני חושבת שכאן יש רגל קרושה ,Um I think that one's calfs'-foot jelly ,Um I think there's a frozen leg here,62
573,אוה אינך צריך להסתכל על זה כאילו זו צדקה  רק מתנה מחברה אחת לשניה ,Oh you don't have to look at it as though it was charity  just a gift from one friend to another ,Oh you do not have to look at it like it's a charity just a gift from one company to another,79
574,כן ,- Yes ,Yes,100
575,אני חברה שלך ,I'm your friend ,I'm your girlfriend,88
576,טוב או עדיף שאלך עכשיו ,Well uh I better be going now ,Well or better yet I will go now,69
577,להתראות ,You wait and see ,See you,61
578,בטוח שאנשים שונאים לקבל צדקה ,- People sure hate to get charity ,Sure people hate to get charity,100
579,נכון שזו האמת ,- Isn't it the truth ,It is true that this is the truth,67
580,ואני לא מאשימה אותם ,- And I don't blame them ,And I'm not blaming them,78
581,הא!,Ha!,Ha!,100
582,להתראות העלמה פרד ,- Goodbye Miss Ferd ,Goodbye Miss Fred,94
583,להתראות ,You wait and see ,See you,61
584,ועכשיו איך זה הולך שוב ,- Now how does that go again ,And now how is it going again,65
585,אוה  בוקר אחד מוקדם עם זריחת החמה בוקר אחד מוקדם עם זריחת החמה,- Uh-- Early one morning just as the sun was rising Early one morning just as the sun was rising,Oh one early morning with the sunrise one early morning with the sunrise,71
586,שמעתי עלמה שרה בעמק למטה אחד למעלה ,I heard a maiden singing in the valley below One up ,I heard a maiden singing in the valley down one up,95
587,בוקר אחד מוקדם עם זריחת החמה שמעתי עלמה שרה,- Early one morning -Just as the sun was rising I heard a maiden singing,One early morning at sunrise I heard Alma singing,71
588,חילקנו לגב' גאופרסון העלמה נילי  דופסילס ומשפ' פרד ,That takes care of Mrs Gaupherson Miss Neely  Doppsils and the Ferds ,We handed over to Mrs. Geoperson Miss Nili Dopsils and Ms. Fred,66
589,מי נשאר ,- Who's left ,Who stays,63
590,רק זה גב' סנואו ,-Just this one Mrs Snow ,It's just Ms. Snow,67
591,ואני מקוה שעם זה נסיים ,Stop that noise in there!,And I hope we finish that too,60
592,מה קרה לה ,- What'd we bring her today ,what happened to her,62
593,מעולם לא נפגשת עם כזו רגזנית ,You never met anyone so cantankerous ,You have never met such a grumpy,62
594,אם היה יום שישי היא היתה רוצה שיהיה יום שלישי ,If it was Friday she'd wish it was Tuesday ,If it was Friday she would want it to be Tuesday,82
595,מה נביא לה היום ,- What'd we bring her today ,What will we bring her today,87
596,חכי ותראי ,You wait and see ,wait and see,86
597,ואילו הבאנו לה עוף היתה רוצה מרק בשר כבש ,And if we brought her chicken she'd want lamb broth ,While we brought her chicken she would like mutton soup,60
598,היא סתם רגזנית!,She's just cantankerous!,She's just grumpy!,65
599,מילי ,Millie ,Millie,100
600,ננסי בואי קדימה ,Nancy come on in ,"Nancy, come on",90
601,מה שלומך ,- How are you ,How are you,100
602,אוה זוהי פוליאנה וויטיאר ,- Uh this is Pollyanna Whittier ,Oh this is Polyana Vittiar,76
603,אוה בטח ,Oh sure ,Oh sure,100
604,שמעתי שבאת כדי להשאר עם דודתך ,I heard you were coming to stay with your aunt ,I heard you came to stay with your aunt,87
605,וזוהי הבת של גב' סנואו מילדרד ,- And this is Mrs Snow's daughter Mildred ,And this is the daughter of Mrs. Snow Mildred,92
606,מה שלומך ,- How are you ,How are you,100
607,מה שלומך ,- How are you ,How are you,100
608,היכן היית אתמול בלילה ,- Where were you last night ,Where were you last night?,100
609,חיכינו וחיכינו ,We waited and waited ,We waited and waited,100
610,אני יודעת ,I know ,I know,100
611,אמא שלי אמרה שאני יכולה לבוא ולבסוף שינתה דעתה ,My mother said I could go and at the last minute changed her mind ,My mom said I could come and finally changed her mind,68
612,היה לה סוג של אני לא יודעת קלקול קיבה ,- She had some kind of I don't know an upset stomach ,She had a kind of I do not know upset stomach,86
613,הפסיקו עם הרעש שם!,Stop that noise in there!,Stop the noise there!,86
614,אין לכם שום כבוד לאישה גוססת ,Haven't you any respect for a dying woman ,You have no respect for a dying woman,90
615,היום בבוקר אני  אני הכנתי לה כוס קפה כרגיל ,This morning I-I fixed her a cup of coffee as usual ,This morning I made her a cup of coffee as usual,89
616,את יודעת הכנסתי לה ,You know I brought it in ,You know I put her in,67
617,היא לא רצתה קפה הבוקר ,She didn't want coffee this morning ,She did not want coffee this morning,90
618,הבוקר היא רצתה תה ,- This morning she wanted tea ,This morning she wanted tea,100
619,אינני מבינה איך את יכולה לסבול את זה ,- I don't know how you stand it ,I do not understand how you can stand it,75
620,אני נשבעת!,I swear!,I swear!,100
621,גם אני לא יודעת ,I don't know either ,I dont know either,92
622,שפכתי את זה לכיור ,I poured it down the sink ,I poured it into the sink,84
623,הצטרכתי להכין לה כוס תה ,I had to make her a new cup of tea ,I had to make her a cup of tea,94
