,hebrewFromSub,englishFromSub,englishTranslation,ratio
199,עכשיו זה מספיק!,Now that's enough!,Now that's enough!,100
200,שמעת מה שהיא אמרה ,You heard what she said ,You heard what she said,100
201,ובכן בואי נראה מה התפריט שהכינה דודתך למחר ,Well let's see what your aunt has on the menu for tomorrow ,Well let's see what menu your aunt made for tomorrow,85
202,עוף צלוי ,Roast chicken ,roast chicken,100
203,עוף כל יום ראשון ,Chicken every Sunday ,Chicken every Sunday,100
204,לדודה שלך אין כל דימיון ,Your aunt has no imagination ,Your aunt has no resemblance,64
205,אוה אני אוהבת עוף צלוי!,Oh I love roast chicken!,Oh I love roast chicken!,100
206,אני שמחה שמחר יום ראשון ,I'm glad tomorrow's Sunday ,I'm glad tomorrow is Sunday,91
207,כן חכי עד מחר ,Yeah Wait till tomorrow ,Yes wait until tomorrow,70
208,האם אי פעם שמעת על קיבה חמוצה ,Did you ever hear of sour stomach ,Have you ever heard of a sour stomach,86
209,ובכן ימי ראשון כאן  גורמים לכל בני המשפחה לקיבה חמוצה למשך כל השבוע ,Well Sundays around here  give folks sour stomach for the whole rest of the week ,Well Sundays here cause the whole family a sour stomach for the whole week,77
210,חכי עד מחר ,- Wait till tomorrow ,Wait until tomorrow,70
211,יהללוהו כל היצורים כאן למטה,Praise him all creatures Here below,Praise be to all the creatures down here,75
212,יהללוהו למעלה אורחיו השמימיים יהללוהו אב בן,Praise him above ye heavenly host Praise Father Son,Praise him above his heavenly guests Praise him father son,84
213,ורוח הקודש אמן,And Holy Ghost Amen,And the Holy Spirit Amen,70
214,מוות מגיע במפתיע!,Death comes unexpectedly!,Death comes unexpectedly!,100
215,ואלוקים יוציא לפועל את נקמתו על  מי שמתעב את מיתת האהבה שלו ורומס את סיועו מתחת רגליו ,And the god Jehovah will execute his vengeance on ye  who despise his dying love and trample his benefits underfoot ,And Gd will execute His vengeance on the one who despises His death of love and tramples His help under His feet,78
216,הנשמות שאינן מומרות הילדים הטיפשים של איש  באומללות מוליכים עצמם שולל בביטחון העצמי המוטעה  בכוחם ובחכמתם ,The unconverted soul the foolish children of man  do miserably delude themselves in the false confidence  of their own strength and wisdom ,The unconverted souls of a man's foolish children in misery lead themselves astray in the erroneous self-confidence erred in their power and wisdom,76
217,מוות מגיע במפתיע!,Death comes unexpectedly!,Death comes unexpectedly!,100
218,"עכשיו אתם אומרים ""אה לא ","Now you say ""Ah no ","Now you say ""Oh no",82
219,אני  אני לא התכוונתי שיבוא עכשיו ,I-I had not intended it to come now ,I I did not mean for him to come now,70
220,חשבתי שתוכניתי טובה ,I thought my scheme good ,I thought my plan was good,72
221,התכוונתי לתת תשומת לב אך המוות הגיע במפתיע  כמו גנב מערים עלי מהיר מדי עבורי ,I intended to take effectual care but death came unexpectedly  like a thief outwitting me too quick for me ,I was going to pay attention but death came unexpectedly like a thief from cities too fast for me,65
222,אוה טיפשות מקוללת שהחנפתי והייתי שבע רצון מעצמי  עם חלומות חסרי תועלת של חרטה ,Oh cursed foolishness that I had flattered and pleased myself  with vain dreams of repentance ,Oh damn stupidity I flattered and was content with myself with useless dreams of remorse,62
223,"אבל חורבן פתאומי השיג אותי ""","But sudden destruction caught me up ""","But a sudden destruction overtook me """,70
224,ועכשיו הוא יטפל בך ,And now he will deal with you ,And now he will take care of you,69
225,עכשיו המלך הגדול בשמים ובארץ  יבטל וישמיד את הגאווה!,Now the great king of heaven and earth  will abolish and annihilate this pride!,Now the great King in heaven and on earth will abolish and destroy pride!,83
226,ימחץ את האומלל המחוזק בזוהמה ובתועבה האינסופית  וימטיר עליו  מבול של אש וגופרית!,Will crush the hardened wretch of the polluted infinite abomination  and rain on him  a deluge of fire and brimstone!,Will crush the wretched fortified with filth and endless abomination and rain down on him a flood of fire and brimstone!,70
227,ואיפה כוחם אז ,And where's their strength then ,And where is their power then,80
228,והיכן הענקים הגדולים שיתריסו נגד אלוקים ,Where are the great leviathans who defy God then ,And where are the great giants that will defy God,72
229,איפה האומץ שלהם ה  ה  ה  ,And where's their strength then ,Where is their courage e th e,60
230,כן  מוות מגיע במפתיע ,Yes  death comes unexpectedly ,Yes death comes unexpectedly,100
231,ולשופט הנורא יש את המפתח לגהינום ,And the dread judge has the key of hell ,And the terrible judge has the key to hell,77
232,בגהינום  תהיה שמור בשרשראות החושך לעדולעולמיעולמים ,In hell  you will be reserved in chains of darkness forever and ever ,In hell you will be kept in chains of darkness forever and ever,89
233,ומקום הכפרה של הנשמות המקוללות והסובלות  ושום דבר לא יקל עליך ובלי נחמה  בלי מים ללשונך החרבה  בלי מקום מנוחה או אפשרות לנשום  אבל הנצחיות והאין סופיות של הסבל  לעולמים  ולתמיד תמיד!,This place of atonement of damned souls and misery  with nothing to relieve you no comfort  no water for your parched tongues  no place to rest or take a breath  but the everlasting infinite convulsions of misery  forever  and ever and ever!,And the place of atonement of the cursed and suffering souls and nothing will ease you and without comfort without water to your ruined tongue without a place of rest or possibility of breathing but the eternity and infinity of suffering forever and ever!,68
234,והעופות והציפורים ישלטו באדמה ,And the cormorant and the bittern shall possess the land ,And the birds and the birds will rule the land,63
235,והעורבים וצרחות הינשופים יתגוררו בו ,The raven and screech owl shall dwell in it ,And the crows and the screams of the owls will dwell in it,61
236,אל תנעצי מבט על היתומים פוליאנה ,- Don't stare at the orphans Pollyanna ,Do not stare at the Polyana orphans,90
237,ומי הוא איש  לחשוב שאפשר לעמוד כנגד זעמו של הא-ל ,- And who is man  to think he can withstand God's mighty wrath ,And who is a man to think that one can stand against the wrath of God,64
238,הוא יכול להחריב את העולם ברגע  או לנפץ את כל היקום במכת אחת של חרב אש ,Yea he can lay the earth to pieces in one moment  or shatter the whole universe with one stroke of his fiery sword ,He can destroy the world in an instant or smash the whole universe with one blow of a fire sword,67
239,כמה נורא הוא מצבם של אלה הנמצאים בסכנה יומיומית  של חמת זעם זו  של תהום המוות והיאוש ,How dreadful is the state of those who are in daily danger  of this great wrath  this abyss of death and despair ,How terrible is the condition of those who are in daily danger of this rage of death of the abyss of death and despair,75
240,ועדיין זהו המקרה הקודר  על כל נשמה בקהילה שעדיין לא נולדה  בכל אופן מוסרי או קפדן מיושב בדעתו או דתי או כל דבר אחר ,Yet this is the dismal case  of every soul in this congregation who has not been born again  however moral or strict sober and religious you may otherwise be ,And yet this is the grim case of every soul in the community who has not yet been born in any moral or strictly settled mind or religious or anything else,73
241,זוהי לא הגנתו של האכזר  בגלל שאין כל סימנים הנראים לעין על המוות המתקרב!,There is no security for the wicked  because there are no visible signs of death at hand!,This is not the cruel's defense because there are no visible signs of impending death!,73
242,אנשים לא מומרים  צועדים על פתח הגהינום מעל מכסה רקוב ,Unconverted men  walk over the pit of hell on a rotten covering ,Unconverted people walk on the door of hell over a rotten lid,83
243,וישנם מקומות חלשים רבים מספור במכסה הזה  שלא ישאו את משקלם ,And there are innumerable places on this covering so weak  they will not bear their weight ,And there are countless weak spots in this lid that will not carry their weight,71
244,הנה אתם יושבים שם  רגועים ביודעכם את בריאותכם בטוחים ברווחתכם ,There you are sitting there  calm in your knowledge of health secure in your well-being ,Here you sit there relaxed knowing your health is safe and well-being,67
245,מי יכול עדיין לסבול מיסורי המחר הארור ,Yet who could suffer the agonies of the damned of tomorrow ,Who can still endure the torments of the damned tomorrow,63
246,כן אפילו היום או אולי בשעה הבאה  בדקה הבאה ,Yes even today or maybe the next hour  the next minute ,Yes even today or maybe next hour at the next minute,93
247,ואילו ידענו מי מכם זה היה  איזה מראה נורא זה היה ,And if we were to know which of you it was  what an awful sight it would be ,Whereas we knew which of you it was what a horrible sight it was,68
248,נשמה נידונה למוות  לגהינום הניצחי ולחמת הזעם השמיימית!,A soul doomed  to the everlasting bottomless pit of a divine wrath!,A soul doomed to death to eternal hell and to the wrath of heaven!,63
249,כן  מוות מגיע במפתיע!,Yes  death comes unexpectedly ,Yes death comes unexpectedly!,100
250,בדיוק!,Exactly!,exactly!,100
251,חשבתי שההתייחסות לירמיהו בסוף היתה מועילה ,I thought the reference to Jeremiah at the finish was very effective ,I thought the reference to Jeremiah at the end was helpful,79
252,הגם אתה אדון פורד ,- Didn't you Mrs Ford - Yes ,"You're Mr. Ford, too",63
253,כן אני או פעמים תוהה האם זה הכרחי  לדבר בכזו סערת רגשות ,I uh sometimes wonder whether it's necessary  to talk so furiously at them though ,Yes I or sometimes wonder if it is necessary to speak in such a storm of emotions,65
254,ישעיהו ירמיהו יחזקאל היקרים  כולם נרשמו בעטים בוערים ובאש ,Dear Isaiah Jeremiah and Ezekiel  were all recorded with flaming pens and fire ,Dear Isaiah Jeremiah Ezekiel all were recorded with burning pens and fire,89
255,אני  אני אינני יכול להעביר את המסר עם סירופ ,I-I can't deliver the message with syrup ,I I can not convey the message with syrup,81
256,קולך הוא כלי האלוקים ,Your voice is God's instrument ,Your voice is the vessel of God,72
257,צריכים להשתמש בו בהתאם ,- It should be used accordingly ,Should use it accordingly,93
258,טוב אנו עושים כמיטב יכולתנו ,- Well we try our best ,Well we do our best,82
259,מה אמרתי לך ,What'd I tell ya ,what I told you,71
260,היום החופשי היחידי שבשבוע ,- The one day a week we have off ,The only free day of the week,75
261,אני שונאת את ימי ראשון ,- I hate Sundays ,I hate Sundays,100
262,אוהה אני פשוט שונאת אותם ,- Ooh I just hate them ,Oh I just hate them,97
263,ארוחת הבוקר עדיין ככדור חם בבטן  והוא לועס את אוזנינו מעל הבימה!,- Breakfast still a hot ball in our stomachs  and him chewing our ears off from that pulpit!,Breakfast is still like a hot ball in the stomach and it chews our ears off the stage!,76
264,את רוצה להתחיל עם זה שוב ,But what's that got to do with it ,You want to start with that again,64
265,"מה כל העניין הזה עם ""שמחה"" ","What is all this ""glad"" business you talk about ","What's all this about ""joy""?",63
266,אוה רק משחק שאני משחקת ,Oh just a game I play ,Oh just a game I play,100
267,איזה סוג של משחק ,What kind of a game ,What kind of game,94
268,משחק שאבי לימד אותי ,A game my father taught me ,A game my father taught me,100
269,זה עוזר לפעמים ,- It helps sometimes ,It helps sometimes,100
270,עוזר למה ,- Helps what ,Helps why,84
271,כשדברים לא מסתדרים כל כך טוב ,When things aren't going so well ,When things are not going so well,89
272,התרחקי מהאפונה ,- Away from the peas ,Stay away from the peas,88
273,אנשים שונאים את בואו של יום ראשון בגללו ,Folks just hate the coming of Sunday because of him ,People hate the arrival of Sunday because of it,65
274,את יודעת למה אני שונאת את ימי ראשון ,Do you know why I hate Sunday ,You know why I hate Sundays,93
275,בגלל שמשמעותו היא התחלה של שבוע חדש ,Because it means the starting of another week ,Because it means the beginning of a new week,67
276,זה נכון ,-That's true ,This is true,78
277,"זה כשאת יכולה לשחק את משחק ""השמחה"" ",-That's when you can play the glad game ,"This is when you can play the ""Joy"" game",76
278,הנה זה בא ,Here it comes ,here it comes,100
279,אוה תיפטרי ממנה אנג'י ,- Oh lay off her Angie ,"Oh, get rid of Angie",67
280,אוה תפסיקי עם זה!,- Oh stop it!,Oh stop it!,100
281,אילו רק ידעת איך משחקים אותו יכולת גם את למצוא משהו לשמוח בו ,If you knew how to play the game then you could find something to be glad about too ,If you only knew how to play it you could also find something to rejoice in,68
282,אבל את לא!,But you don't!,But you are not!,71
283,"בסדר גב' ""מכנסיים חכמים"" מה כל כך טוב בימי ראשון ",All right Miss Smartie-Pants what's so good about Sunday ,"Okay Ms. ""Smart Pants"" what's so good on Sundays",71
284,ובכן תמיד יש משהו ,- Well there's always something ,Well there is always something,98
285,את יכולה לשמוח בגלל  טוב בגלל מה ,You could be glad because-- Well because what ,You can be happy because of good because of what,75
286,בגלל ששישה ימים שלמים יבוא אחריו בשבוע הא ,Because it will be six whole days before Sunday comes around again huh ,Because six full days will come after him in week a,64
287,למה אינכם נכנסים מהדלת הקידמית כמו אנשים נורמליים ,Why don't you come out of the front door like normal people ,Why do not you enter from the front door like normal people,80
288,הם לא יתנו לנו ,They won't let us ,They will not let us,81
289,אני יכול להכנס ולצאת מתי שאני רוצה מהעץ ,I can come out anytime I want with my tree ,I can come in and out whenever I want from the tree,71
290,אתה גם יכול ליפול ולהפגע קשה ,You can also fall and hurt yourself badly ,You can also fall and get hit hard,67
291,זה טיפשי ,That's stupid ,That's stupid,100
292,את לא מאמינה באלוקים ,Don't you believe in God ,You do not believe in God,94
293,בטח שכן!,Of course not ,of course!,82
294,אבל מה לאלוקים ולזה ,"What is all this ""glad"" business you talk about ",But what about Gd and that,62
295,הוא גידל אותו שם נכון ולכן אני יכול לטפס עליו כרצוני ,He grew it there didn't he so I could climb out anytime I want ,He grew it there right so I can climb it as I please,61
296,אתה צעיר מדי בכדי לדון בדברים שאינך מבין בהם כלום ,You're much too young to go around discussing things you don't know anything about ,You're too young to discuss things you do not understand,64
297,גם הוא טיפס!,He did too!,He climbed too!,75
298,ולמה לדעתך הוא נמצא כאן ,Yes I think she is don't you ,And why do you think he's here,66
299,גם את לא יותר ילדה שכמותך!,You aren't so much you girl!,You're no more a girl like you!,67
300,חוץ מזה אני משהו שאינך יכולה להיות ,Besides I'm somethin' you can't be ,"Besides, I'm something you can not be",90
301,אני יתום ,I'm an orphan ,I'm an orphan,100
302,לך ממני בבקשה ילד קטן ,Go away from me please little boy ,Go away from me please little boy,100
303,"""לך ממני  בבקשה ילד קטן """,Go away from me please little boy ,"""Please get rid of me little boy""",69
304,מה אתה רוצה ,What is it you want ,What you want,81
305,אני רוצה ללכת לדוג ,I wanna go fishin' ,I want to go fishing,81
306,את רוצה לבוא איתי ,What is it you want ,Do you want to come with me,61
307,אתה לא צריך להשתמש עם וו ,Did you used to be in love with her ,You should not use with a hook,62
308,אוה ,Oh ,Oh,100
309,ובכן ראו מי כאן ,- Well look who's here ,Well see who's here,82
310,מה שלומך ,How are you ,How are you,100
311,טוב תודה ,- Fine thank you ,Well thank you,64
312,תפסת משהו ,You wanna see something ,You caught something,65
313,עדיין לא ,- Not yet ,Not yet,100
314,מה זה היה מה שאתה ודודה פולי רבתם עליו ,What was it you and my Aunt Polly fought about ,What it was was what you and Aunt Foley fought over,68
315,עכשיו איפה את שמעת על כך ,Now where did you hear about that ,Now where did you hear about that?,100
316,אוה רק בסביבה ,Oh just around ,Oh only around,64
317,אבל הם לא ידונו על כך כשאני שם ,But they won't discuss it when I'm there ,But they will not discuss it when I'm there,92
318,או   אכפת לך לומר לי מה זה היה ,Um would you mind telling me what it was ,Or do you mind telling me what it was,81
319,ובכן פוליאנה זה מוזר כשחושבים על ויכוחים ,Well Pollyanna it's a strange thing about arguments ,Well polyana it's weird when you think about arguments,72
320,בזמנו זה נראה מאוד חשוב ,At the time they seem very important ,At the time this seemed very important,92
321,אבל עכשיו  את יודעת אני אפילו לא זוכר על מה זה היה ,But now-- You know I can't even remember what it was about ,But now you know I do not even remember what it was about,90
322,הו  דודה פולי מאוד יפה ,Huh Aunt Polly's very pretty ,Oh Aunt Polly is very beautiful,61
323,כן אני סבור כך את לא ,Yes I think she is don't you ,"Yes, I think so",62
324,כן זה מה שאמרתי ,What is it you want ,Yes that's what I said,68
325,אני אוהבת אותה אבל אני לא אוהבת איךשהיאמסדרתאתהשיער ,I love her but I don't love the way she fixes her hair ,I love her but I do not like how she arranges her hair,67
326,לפני שנים שיערה היה ארוך ורך עד הכתפיים ,Years ago she used to wear it long and soft down to her shoulders ,Years ago her hair was long and soft to the shoulders,78
327,הוא היה מאוד רך ,It was very soft ,He was very soft,88
328,זה חייב היה להיות יפה ,It must've been beautiful ,It had to be beautiful,64
329,כן הוא היה מאוד יפה ,Yes it was very beautiful ,Yes he was very beautiful,92
330,היית מאוהב בה ,Did you used to be in love with her ,You were in love with her,73
331,קדימה פוליאנה ,Come on Pollyanna ,Come on Polyana,94
332,בואי נלך!,Let's go!,Let's go!,100
333,הכומר פורד ואישתו נמצאים עםדודהפוליעכשיו ,Reverend Ford and his wife are with Aunt Polly now ,Pastor Ford and his wife are with Aunt Foley now,80
334,אבל הם  הם יעזבו בקרוב ,But they'll-- they'll be leaving soon ,But they are they will leave soon,74
335,אני מתארת לעצמי שדודה פולי תהיה לבדה רוב אחר הצהרים ,I suppose Aunt Polly will be alone by herself most of the afternoon ,I imagine Aunt Foley will be alone most of the afternoon,73
336,ובכן אני  אני  עדיף שאלך עכשיו ,Well I-I'd better be going now ,Well I'm better off going now,81
337,את רוצה לדעת משהו ,- You wanna know something ,You want to know something,88
338,מה ,- What ,what,100
339,עצים הם הדבר הטוב ביותר בעולם ,Trees are the best things in the world ,Trees are the best thing in the world,99
340,את יכולה להתחבא בהם ואנשים אפילו לא ידעו היכן את ,You can hide up in 'em and people don't even know where you are ,You can hide in them and people do not even know where you are,89
341,והם הולכים ממש מתחתיך ,- And they're walking right beneath you ,And they go right under you,66
342,אף פעם לא חשבתי על זה ,- I never thought much about it ,I never thought about it,91
343,ובכן הם כן ,Well they are ,Well they are,100
344,רוצה לראות משהו ,You wanna see something ,Want to see something,77
345,מה ,- What ,what,100
346,אני אראה לך ,I'll show ya ,I'll show you,88
347,את חייבת להיות בשקט ,But you don't!,You must be quiet,60
348,את רואה את המקום שם ,- Ya see that place ,You see the place there,75
349,מה איתו ,He hates kids ,how is he,64
350,הוא האיש הכי רשע בעיר!,He's the meanest man in town!,He's the meanest man in town!,100
351,טוב ומה אנחנו עושים כאן ,- Well what are we doing here ,Well and what are we doing here,93
352,ששש!,- Shh!,Shhh!,86
353,תהיי בשקט ,Keep quiet ,Be Quiet,78
354,בואי כבר פוליאנה ,Come on Pollyanna ,"Come on, Polyana",94
355,זהו המרתף הישן הטחוב עם חולדות בתוכו ,This is his old wet basement with rats in it ,This is the old damp basement with rats inside,76
356,אם הוא תופס אותך  זורק אותך למטה למרתף ושומר אותך לשפחה בשבילו ,If he catches ya  he throws ya down in his basement and keeps ya for his slave ,If he catches you throws you down in the basement and keeps you a slave for him,85
357,אם כך מה אנחנו עושים כאן ,- Well what are we doing here ,So what are we doing here,88
358,בגלל שאני רוצה להראות לך משהו ,- Because I wanna show ya something ,Because I want to show you something,87
359,הנה זה ,There it is ,there it is,100
360,שם למעלה ,Up there ,Up there,100
361,העץ הכי טוב לטיפוס בכל העיר!,The best climbing tree in town!,The best tree to climb in the whole city!,71
362,נכון שזה יפה ,It must've been beautiful ,It's true that it's beautiful,67
363,אתה מתכוון לומר לי שהבאת אותי כל הדרך כאן למעלה  רק כדי שאראה זקן מגעיל  עץ זקן ומגעיל ,Do you mean to tell me that you brought me all the way up here  just to see a crummy old-- a crummy old tree ,You're going to tell me you brought me all the way up here just to make me look disgusting beard old and disgusting tree,71
364,חכי דקה פוליאנה ,Wait a minute Pollyanna ,Wait a minute Polyana,95
365,את אפילו לא רוצה לטפס עליו ,Don't you even want to climb it ,You do not even want to climb it,95
366,לא ,- No ,No,100
367,בבקשה ,Who are you ,you are welcome,77
368,למעלה מכאן ,Up there ,Up from here,70
369,יותר ,More ,More,100
370,גבוה יותר ,Higher ,Higher,100
371,קצת יותר למעלה ,A little bit higher ,A little further up,68
372,רק עוד קצת יותר למעלה ,Just a little bit more ,Just a little further up,70
373,קצת יותר למעלה ,A little bit higher ,A little further up,68
374,בדיוק  בדיוק שם ,Right-- Right there ,Right there,79
375,מה אתם עושים כאן ,- What are you doing here ,What are you doing here?,100
376,תפסתי אותך!,Get out ,I got you!,62
377,אוה אתה הקטן  ,- Oh you little--,Oh you're the little one,70
378,תן לי ללכת!,Let's go!,let me go!,82
379,חזרי הנה את ילדה קטנה!,Come back here you little girl!,Come back here you little girl!,100
380,תן לי ללכת!,Let's go!,let me go!,82
381,חזרי לכאן!,Come back here!,Come back here!,100
382,הפעם אני אקרא לשוטר ,I'm gonna get the constable this time ,This time I'll call the cop,69
383,תן לי ללכת! תן לי ללכת!,- Lemme go lemme go!,let me go! let me go!,78
384,שתוק!,- Shut up!,Shut!,73
385,אני אלמד אותך ,I'll teach you ,I will teach you,73
386,תן לי ללכת!,Let's go!,let me go!,82
387,אני אלמד אותך לקח שאף פעם לא תשכח ,- I'll teach you a lesson you won't forget ,I'll teach you a lesson you'll never forget,84
388,בוא הנה ,Come here ,Come here,100
389,תן לי ללכת ,Let's go!,let me go,82
