,hebrewFromSub,englishFromSub,englishTranslation,ratio
0,כשהאיש מלוס אנג'לס יגיע ביום שלישי הבא אני רוצה שהוא יראה שהעיר הזאת נתונה בשליטתי ,When the man comes in from L A next Tuesday I want him to see I got this town in my back pocket ,When the man from Los Angeles arrives next Tuesday I want him to see that this city is under my control,69
1,הנה הוא ,There he is ,here he is,67
2,אוי לא ,Oh no ,Oh no,100
3,תנו לנו מרחב נשימה ,Give us a break here huh ,Give us breathing space,60
4,-ראית מי עשה את זה ,- Did you see who it was ,- You saw who did it,85
5,אבא מה קרה ,- Dad what happened ,"Dad, what happened?",100
6,-הכול בסדר בן ,- Everything's fine son ,- Everything's fine son,100
7,אתה בסדר ,- You okay ,Are you okay,80
8,אתה יכולים למסור לנו תיאור ,- Were you able to get a description ,You can give us a description,73
9,-ראיתי מכונית כחולה ,- l saw a blue car ,- I saw a blue car,94
10,מק יש לנו בעיר בעית קראק רצינית ,Mac we got a full-blown crack problem in this town ,Mac we have in town a serious crack problem,73
11,איש סמים כבד מקליפורניה הגיע לפה לפני שישה חודשים ונתן לכמה מהילדים המקומיים למכור לו פה את הסם ,Some hotshot from California rolled in about six months ago and took in some of the local kids to set up shop ,A heavy drug man from California came here six months ago and let some of the local kids sell him the drug here.,64
12,שמעתי על סוחרי סמים שמספקים קראק לערים כמו קנזס סיטי וסיאטל אבל לפה ,I've heard of these crack dealers franchising out to places like Kansas City and Seattle but here ,I've heard of drug dealers supplying crack to cities like Kansas City and Seattle but here,78
13,מה   ,What-- ,what,100
14,-לא אדוני ,- No sir ,- Not sir,92
15,"בוא צ'ק אנחנו חייבים למלא דו""ח פשיעה ",- Come on Chuck we gotta fill out a crime report ,Come check we must fill out a crime report,86
16,אנחנו הולכים להביא מטאטאים כדי לנקות את השברים ,Look we'll get some brooms and clean this up ,We're going to get brooms to clean up the debris,63
17,בוא שון ,- Come on Sean ,Come on Sean,100
18,דני דני תקשיב לי ,Danny Danny listen man I'll do something ,Danny Danny listen to me,69
19,אני אפתור את זה אני אדבר איתם או משהו  ,- l'll talk to them maybe or something--,I'll solve it I'll talk to them or something,75
20,האנשים האלה ניסו להרוג אותי והם ינסו לעשות זאת שוב ,Those guys tried to kill me out there and they're gonna do it again ,These people tried to kill me and they will try to do it again,74
21,אתה חייב לספר לאבא שלך מה קורה ,You gotta tell your dad what's going on ,You must tell your father what's going on,82
22,אני לא יכול ,I can't ,I can not,88
23,-מה אתה רוצה ממני ,What do you want from me ,-What do you want from me,100
24,תיעלם לתקופה מסוימת ,Disappear for a while ,Will disappear for a period of time,68
25,כן בטח ומה אחר כך ,- Oh sure and then what ,Yes sure and what next,65
26,-אני לא יודע ,- Look I don't know ,-I do not know,80
27,כן זהו זה ,Yeah that's it ,Yes that's it,89
28,מה אם המשטרה תקבל ידיעה על המשלוח החדש שמגיע ,What if the cops get a tip on the new shipment that's coming in ,What if the police get word of the new shipment coming,72
29,-על מה אתה מדבר ,- What are you talking about ,-What are you talking about,100
30,אוכל להתקשר למשטרה ,I could call the cops ,I can call the police,67
31,הם יתפסו אותם עם הסחורה ,They'd catch him with the goods ,They will catch them with the goods,82
32,גם אם התכנית הזאת תעבוד מה אני אומר לעשות מעכשיו ועד יום שלישי ,Even if this plan works what am I supposed to do - from now until Tuesday ,Even if this plan works what I say do from now until Tuesday,89
33,-פשוט תיעלם אחי ,- Just disappear man ,"- Just disappear, bro",78
34,כן באגם בל תוכל להסתתר בבקתה שלנו ,Yeah Bell Lake you can hide out in our cabin ,Yes in Lake Bell you can hide in our cabin,88
35,בטח ומה אומר לאבא שלי ,- Oh sure and what do I tell my dad ,Sure and what does it mean to my dad,78
36,-את האמת ,- Tell him the truth ,-The truth,67
37,אנחנו דגים באגם הזה מאז שלמדנו ללכת ,I mean we've been fishing up there since we could walk ,We have been fishing in this lake since we learned to walk,70
38,אני לא יודע אחי ,- Look I don't know ,I do not know bro,71
39,-דני זאת הדרך היחידה ,- Danny Danny it's the only way ,-Danny is the only way,80
40,בבקשה אני נשבע לך שזה יעבוד ,Please I swear this is gonna work ,Please I swear to you it will work,72
41,בסדר אעשה את זה ,All right I'll do it ,Okay I'll do it,63
42,אתה תזדקק למפתח הבקתה ארוץ הביתה להביא לך אותו ,Listen you're gonna need a key to the cabin I'll run home and get it ,You'll need the key to the cabin and run home to get it for you,73
43,"תפגוש אותי בעוד שעה בתחנת השאיבה שמאחורי ביה""ח ",Meet me in one hour up at the pump station behind the state hospital ,Meet me in an hour at the pumping station behind the hospital,85
44,"אני צריך לשמוע גם את צידו של דני בשביל הדו""ח ",I still need Danny's side of it for the paperwork ,I also need to hear Danny's side for the report,67
45,רוצה לספר לי מה קורה ,- Wanna tell me what's going on ,Want to tell me what's going on,90
46,-אתה לא תבין ,- You wouldn't understand ,- You will not understand,83
47,אני מבין את זה ,I understand this ,I understand that,88
48,עכשיו מה קורה כאן ,Now what's going on ,Now what's going on here,88
49,הפושעים שאבא של שון דיבר עליהם  הם סיפקו סמים לחבר שלי ואני נקלעתי באמצע ,Those punks that Sean's dad was talking about Been dealing to a friend I got caught in the middle ,The criminals that Sean's dad talked about were supplying drugs to my friend and I got caught in the middle,74
50,וחשבת שהפתרון הכי טוב הוא לקחת אקדח ,And you figure the best way out is to pick up a gun ,And you thought the best solution was to take a gun,71
51,אזדקק לאקדח כדי להפחיד אותם ,- l might need it to scare them off ,I'll need a gun to scare them,71
52,-זה לעולם לא עוצר שם דני ,- lt never stops there Danny ,-It never stops a Danish name,63
53,אם יש לך אקדח דברים קורים ,You got a gun things happen ,If you have a gun things happen,79
54,אנשים נהרגים ,People die ,People are killed,67
55,למה לא פנית לאביך או לניל ,Why didn't you j\ust go to your dad or Neil ,Why did you not turn to your father or Neil,70
56,איפה שון ,Where's Sean ,Where's Sean?,100
57,-תראה זאת לא הבעיה שלך ,Look this isn't your problem ,"- Look, this is not your problem",88
58,תן לי לטפל בזה בסדר ,Just let me handle it okay ,Let me handle this okay,73
59,בבקשה ,Do you hear me ,you are welcome,62
60,אני לא יכול דני ,I can't do that Danny ,I can not Danny,72
61,מוטב שנדבר עם אביך ,We'd better go talk to your dad ,We better talk to your father,80
62,בוא ,Come on ,Come on,100
63,דני לא!,Danny ,Danny no!,77
64,מה עכשיו ,- Now what ,What now,100
65,הוא ברח מהדלת האחורית והוא לקח אקדח ,He j\ust ran out the back He took a gun ,He ran out the back door and he took a gun,81
66,-מה !,- What ,-What!,100
67,בשביל מה דני זקוק לאקדח ,- Why would Danny need a gun ,What does Danny need a gun for?,68
68,זה קשור לפושעים האלה ולבעית הקראק שלכם ,It's got something to do with those punks and your crack problem ,It has to do with these criminals and your crack problem,70
69,אני חושב ששון מעורב בזה ,- l think Sean's involved ,I think Sean is involved in this,76
70,היית חייב לעשות זאת באור יום כשיש אנשים מסביב כמו שעושים בלוס-אנג'לס ,You gotta do it in the daytime with people around like they do in L A ,You had to do it in daylight when there are people around like they do in Los Angeles,75
71,בחיי אני לא יודע למה קניתי את הסיפורים שלך ,Man I don't know why I bought into you and your big talk ,In my life I do not know why I bought your stories,68
72,אם תברח עכשיו לעולם לא תפסיק לברוח ,You run now and you are never gonna stop running ,If you run away now you will never stop running,80
73,אם המשטרה לא תמצא אותך האנשים שלי ימצאו ,If the cops don't find you my people will ,"If the police do not find you, my people will find you",74
74,אבל אם תלך בדרך שלי אתה תהיה ראש הסמים בעיר הזאת אחי ,But see if you do it my way you're gonna be numero uno in this town man ,But if you go my way you'll be the drug lord in this city dude,62
75,שומע אותי ,Do you hear me ,Hears me,64
76,בסדר ,Okay ,OK,67
77,הוא העד היחיד ,He's the only witness ,He is the only witness,88
78,כן ומה עם הילד השני ,Yeah what about the other one ,Yes and what about the other child,79
79,בוא נסתלק מכאן ,Let's get out of here ,Let's get out of here,100
80,בוא נצא לסיבוב ,Let's get after them ,Let's go for a walk,62
81,קדימה תזדרז ,Come on hurry up ,"Come on, hurry up",100
82,זה יום המזל שלך אחי ,It's your lucky day man ,This is your lucky day dude,72
83,אני אשכח מהכסף שאתה חייב לי ואתן לך טעימה בחינם ,I'm gonna forget about the bread you owe me I'm gonna give you a free taste ,I'll forget about the money you owe me and I'll give you a free taste,82
84,-אני לא אגיד לך איפה דני ,Where'd you send them ,- I'll not tell you where Danny is,64
85,אתה כן תגיד ,Yeah you will ,You will say yes,76
86,שון ,Sean ,Shawn,67
87,שון איפה דני ,Sean where's Danny ,Sean where is Danny,97
88,-לא רציתי לספר להם שון ,- l didn't want to tell them ,- I did not want to tell them Sean,83
89,מכרת אותו בשביל זה ,- You sold him out for this ,You sold it for it,74
90,-לא הם הכריחו אותי ,- No they made me do it ,- They did not force me,71
91,הם התכוונו לחתוך לי את האצבעות עם סכין גילוח ,They were gonna cut off my fingers with a razor man ,They were going to cut my fingers with a razor,85
92,דני הוא החבר הכי טוב שלי ,Danny is my best friend ,Danny is my best friend,100
93,אני לא חושב שיש לך יותר חברים ,I don't think you have friends anymore ,I do not think you have more friends,78
94,יש לך רק ספקים ,You have sources ,You only have suppliers,67
95,עכשיו איפה הוא ,Now where is he ,Now where is he,100
96,לאיפה שלחת אותם ,Where'd you send them ,Where did you send them,95
97,"לתחנת השאיבה הישנה שמאחורי ביה""ח ",The old pump station behind the old hospital ,To the old pumping station behind the hospital,89
98,אני לא רציתי לספר להם ,- l didn't want to tell them ,I did not want to tell them,91
99,תירגע ,Calm down ,cool down,78
100,תקשיב לי ,Listen to me ,listen to me,100
101,אם דני באמת החבר הכי טוב שלך זה הזמן להוכיח את זה ,Look if Danny really is your best friend now's the time to prove it ,If Danny is really your best friend it's time to prove it,89
102,לך למצוא את אביך ,Go find your dad ,Go find your father,80
103,תגיד לו לפגוש אותי שם ,Have him meet me up there ,Tell him to meet me there,72
104,שמעת אותי ,- You hear me ,Did you hear me,85
105,אולי הם כבר תפסו אותו צא!,They could have him already ,Maybe they're already caught him out!,63
106,הנה הוא ,There he goes ,here he is,61
107,בוא נלך ,Let's go ,let's go,100
108,זה כזה מגניב ,This is so cool ,It's so cool,74
109,זה עדיין לא נראה לי חבר'ה ,I still don't like this guys ,It still does not seem to me guys,62
110,מה אם ייתפסו אותנו ,What if we get caught ,What if they caught us,74
111,לא ניתפס אם תפסיק לקטר ,We won't if you stop your bellyaching ,We will not be caught if you stop grumbling,60
112,ספיידר ,Spider ,Spider,100
113,תראה כדורים ,Look Bullets ,Look at bullets,89
114,אתה חושב שיש לו אקדח ,You think he's got a gun ,You think he has a gun,78
115,בוא נברר ,Let's find out ,Let's find out,100
116,היכן למדת לירות כך ,Where did you learn how to shoot like that ,Where did you learn to shoot like that,95
117,-אבי לימד אותי ,- My dad taught me ,- My father taught me,80
118,תורך ג'ס ,Your turn Jess ,Your turn Jess,100
119,מה איתי -בטח ,- What about me ,What about me - for sure,74
120,יש ,There he goes ,there is,67
121,תראו את הנשר הזה ,Look at that ,Look at this eagle,67
122,לא!,No!,No!,100
123,אני חושב שפגעתי בו ,I think I got him ,I think I hurt him,74
124,ג'סי!,Jesse!,Jesse!,100
125,תחזיק מעמד ,Hold on Jesse ,hold on,70
126,הוא מת! הוא מת!,He's dead he's dead!,he is dead! he is dead!,95
127,הרגת אותו!,You killed him!,You killed him!,100
128,זה לא הייתי אני ,- lt wasn't me!,it was not me,80
129,-הוא לא מת תעזרו לי ,- He's not dead now help me!,- He's not dead. Help me,91
130,בוא נסתלק מכאן קדימה!,Let's get out of here let's go!,Let's get out of here!,82
131,כואב לי אני לא יכול לנשום ,Hurts I can't breathe ,It hurts me I can not breathe,84
132,תחזיק מעמד ג'סי ,Hold on Jesse ,Hold on to Jesse,90
133,תישאר איתי קדימה ,Stay with me come on ,Stay with me going forward,61
134,תחזיק מעמד ,Hold on Jesse ,hold on,70
135,אתה תהיה בסדר דני ,I'll be back Danny ,You'll be fine Danny,68
136,הם רדפו אחרי ,They were after me ,They chased after me,68
137,שניים מהם ,Two of them ,Two of them,100
138,נעלתי אותם בחדר למעלה ,I locked them in a room upstairs ,I locked them in the room upstairs,91
139,הם באים ,They're coming ,they are coming,76
140,תפיל אותה ,Open the door ,Drop it,60
141,טוב בוא נלך ,Let's go ,Well let's go,76
142,טוב הוא בטח מחפש דרך לצאת ,All right he's gotta be looking for a way out ,Well he's probably looking for a way out,66
143,אתה תחזור למקום שממנו נכנסנו ואני אחפש כאן ,You go back where we came from I'll check up here ,You'll go back to where we came in and I'll look here,71
144,אם תמצא אותו תהרוג אותו ,If you find him you kill him ,If you find him you will kill him,92
145,אל תדבר ,Don't talk ,do not speak,64
146,אמצא לנו דרך לצאת מכאן ,- l'll find us a way out of here ,I'll find a way to get out of here,84
147,-חכה אל תעזוב אותי ,- Wait don't leave me ,"- Wait, do not leave me",92
148,אל תעזוב אותי ,- Don't leave me ,do not leave me,90
149,אל תעזוב אותי ,- Don't leave me ,do not leave me,90
150,אקח אותך לרופא ,I'll get you to a doctor ,I'll take you to the doctor,71
151,אני אחזור דני ,I'll be back Danny ,I'll be back Danny,100
152,מה אתה מתכוון לעשות ,What are you gonna do ,What are you going to do,84
153,אני הולך לוודא שנצא מכאן ,I'm gonna make sure we get out of here ,I'm going to make sure we get out of here,91
154,אני אחזור ,I'll be back ,I'll be back,100
155,היי ,Hey ,Hey,100
156,מי אתה ,Who are you ,Who are you,100
157,מי אתה ,Who are you ,Who are you,100
158,איפה הוא ,- Where is he ,where is he,100
159,גם אתה רוצה למות חוכמולוג ,Do you wanna die too smart mouth ,You too want to die a wise man,61
160,תראה אני לא יודע על מה אתה מדבר ,I don't know what you're talking about ,Look I do not know what you're talking about,85
161,אני רק עובד כאן ,I j\ust work here ,I'm just working here,84
162,אולי פשוט נלך לראות לאן התכוונת ללכת ,Why don't we j\ust go see where you were going ,Maybe we'll just go see where you're going,66
163,תפתח את הדלת ,Open the door ,Open the door,100
164,קדימה תזוז לשם ,Come on Come on Move over there ,"Come on, move there",73
165,איפה הוא ,- Where is he ,where is he,100
166,אמרתי לך אין לי מושג על מה אתה מדבר ,Look I haven't the slightest idea what you're talking about ,I told you I have no idea what you're talking about,75
167,יש לך שנייה אחת לספר לי את האמת ,You've got one second to find the truth ,You have one second to tell me the truth,73
168,-בסדר ,Okay ,-OK,67
169,הוא במטבח למטה ,- He's down in the kitchen ,He's in the kitchen downstairs,89
170,-בוא נלך ,- Let's go ,-let's go,100
171,בחייך תישאר איתי דני ,Oh come on stay with me Danny ,"Come on, Danny, stay with me",95
172,תישאר איתי ,Stay with me ,Stay with me,100
173,-אני יודע ג'סי תחזיק מעמד ,I know Jesse j\ust hang on ,- I know Jesse will hold out,69
174,עצור בבקשה!,Stop please!,Please stop!,100
175,בחייך ג'סי בבקשה אל תמות ,Oh come on Jesse please don't die ,"Come on Jesse, please don 't die",95
176,בבקשה!,Who are you ,you are welcome!,77
177,-תעזור לי בבקשה ,- Help please my friend's hurt ,-help me please,62
178,חברי נפצע הוא זקוק לרופא ,He needs a doctor ,My injured friend needs a doctor,65
179,אלוהים אדירים!,Oh God ,My God!,67
180,הוא יצא מזה ,Let's get him out of here ,He got out of it,73
181,אחת-אל-30 מבקש אמבולנס קוד 3 ,One-L-30 requesting an ambulance code 3 ,One-to-30 requests ambulance code 3,84
182,"אל מאחורי בית החולים הישן שב""ריבר רואד"" ",Up behind the old state hospital on River Road ,Behind the old River Road Hospital,85
183,אני חוזר קוד 3 ,Repeat code 3 ,I repeat code 3,93
184,תילחם דני קדימה ,Fight for it Danny ,Danny will fight forward,81
185,תראה את הילד הזה ,Look at this kid ,Look at this kid,100
186,מתי יתחילו לעשות משהו בנוגע לאקדחים ,When are they gonna do something about guns ,When will they start doing something about guns,76
187,זאת הייתה תאונה ,It was an accident ,It was an accident,100
188,זאת הייתה רק תאונה ,It was an accident ,It was just an accident,88
189,אתם חייבים לעזור לו ,You've gotta help him ,You must help him,68
190,אני מצטער בן ,I'm sorry son ,I'm sorry son,100
191,יש לי דופק ,I've got a pulse ,I have a pulse,67
192,בואו ניקח אותו מכאן ,Let's get him out of here ,Let's take him from here,65
193,הוא יצא מזה הוא יצא מזה ,Let's get him out of here ,He got out of it he got out of it,62
194,אני עדיין לא מבין איך לא שמתי לב לזה ,I still don't know how I missed it ,I still do not understand how I did not notice it,65
195,אל תאכל את עצמך בגלל זה ניל ,Oh don't beat yourself up over it Neil ,Do not eat yourself because it's Neil,72
196,הכנסת אותו לתכנית גמילה ,You got him in a treatment program ,You put him on a rehab program,75
197,זאת התחלה ,That's a start ,This is a start,83
198,הנה זה ,Yeah there it is ,there it is,81
199,בואו נעשה את זה ,- Let's go ,let's do this,67
200,הו כן ,Oh yeah ,Oh yes,77
201,הו כן ,Oh yeah ,Oh yes,77
202,שמת את העכביש הזה על העוגה של יום הולדתך ה-10 ,You put that on the cake at your tenth birthday party ,You put that spider on your 10th birthday cake,77
203,תחילה היא צעקה ואחר כך היא הכתה את העוגה למוות ,First she screamed then she beat the cake to death ,First she screamed and then she beat the cake to death,96
204,'ומה בנוגע לכדור שלך האנץ ,How about this for you honch ,'And what about your ball hunch,62
205,"התכוונתי לשחק בקבוצת ה""טווינס"" ",- l was gonna play for the Twins ,I was going to play for the Twins,86
206,הו כן ,Oh yeah ,Oh yes,77
207,מה זה ,- What is it ,What is,82
208,-אני זוכר את זה ,- l remember this ,- I remember that,80
209,זו מלכודת העכברים המפורסמת של מקגיוור ,The world-famous MacGyver mousetrap ,This is McGuire's famous mousetrap,70
210,"""תפוס אותם ותן להם ללכת """,Snag them and let them go ,"""Grab them and let them go""",80
211,חשבתי שהיא כבר תהיה שווה משהו במכון הסמית'סוני ,Figured it'd be worth something to the Smithsonian ,I thought it would already be worth something to the Smithsonian Institution,70
212,אולי ב-25 השנים הבאות ,- Maybe in the next 25 years ,Maybe in the next 25 years,100
213,אנחנו מתגעגעים אליך ג'סי ,We miss you Jesse ,We miss you Jesse,100
214,כמתנה ליום הולדתי ה-8 סבי הנרי הסיע אותי בטנדר הכחול הישן שלו אל הישורת שמאחורי החווה של משפחת קלמן הוא הניח את כפות-ידיי על ההגה והטיח את רגלו בדוושת הדלק ,For my 8th birthday my Grandpa Harry drove me in his old blue pickup to the straightaway behind the Clemens' farm put my hands on the steering wheel and slammed his foot into the gas ,As a gift for my 8th birthday my grandfather Henry drove me in his old blue van to the line behind the Kalman family farm he put his hands on the wheel and slammed his foot on the gas pedal,75
215,"לעולם לא אשכח את צלילה של הרוח המנשבת את מחוגו הרוטט של מד המהירות שעבר את ה-90 קמ""ש ואת ההגה הרועד בידיי ",I'll never forget the sound of the wind rushing past my ears how the red needle trembled past 90 the wheel shaking in my hands ,I will never forget the dive of the wind blowing the vibrating dial of the speedometer that passed the 90 km / h and the steering wheel shaking in my hands,62
216,זה הפחיד אותי עד מוות וחשבתי שאין בעולם דבר שהוא יותר מרגש מזה ,It scared me to death and I thought nothing in the world could be more exciting ,It scared me to death and I thought there was nothing in the world that was more exciting than that,79
217,קדימה מקגיוור!,Neil come on ,Come on McGuire!,67
218,אז כשחברי הותיק מהמכללה ג'ף סטון ביקש את עזרתי בבניית מנוע פלסטי ידידותי לסביבה הוא לא היה צריך לשכנע אותי להסכים ,So when my old college buddy Jeff Stone asked me to help him build an environmentally efficient all-plastic engine he didn't have to twist my arm to say yes ,So when my old college friend Jeff Stone asked for my help in building an eco-friendly plastic engine he did not have to convince me to agree,72
219,ג'ף פוטר מנבחרת סטריקלנד ומכוניתו נלקחה בדיוק לפני מירוץ האליפות בווסטווד ספרינג אז סידרתי שארגון הפניקס יממן לו מכונית אחרת ואני זכיתי לבחון אותה ,Then Jeff lost his ride with the Strickland team just before the championship race here at Westwood Springs so I got Phoenix to bail him out with another car ,Jeff Potter from the Strickland team and his car was taken just before the championship race in Westwood Spring so I arranged for the Phoenix organization to fund him another car and I got to test it,70
220,-אתה חושב שהוא לא נותן ,You think he isn't ,- You think he does not give,68
221,לא רע ,Not bad ,Not bad,100
222,לא רע בכלל ,Not bad at all ,Not bad at all,100
223,יש לנו בעיה ,- We got a problem ,We have a problem,79
224,-למה אתה מתכוון ,- What do you mean ,-What do you mean,100
225,המנוע הפלסטי ,That plastic engine ,The plastic engine,92
226,הוא מהיר ,It's fast ,He's fast,78
227,הוא מהיר מדי לנסיעת מבחן ,It's too fast for a test run ,It's too fast for a test drive,83
228,-מישהו שנתקלתי בו במסלול הפורמולה אחת באירופה לפני 8 שנים ,- Oh someone I crossed on the Formula 1 circuit in Europe eight years ago ,-Someone I came across on the Formula One track in Europe 8 years ago,75
229,תתרכז בסטון ובזכייה במירוץ ,You keep your mind on Stone and winning that race ,Concentrate on Stone and winning the race,69
230,בשביל זה אני משלם לך ,That's what I'm paying you for ,For that I pay you,75
231,לחצי על הגז -בשמחה אומלי ,I guess she's happy ,Press the gas - happily Omli,67
232,לא היו מכוניות נוספות על המסלול ,There weren't any other cars on the track ,There were no more cars on the track,78
