,hebrewFromSub,englishFromSub,englishTranslation,ratio
421,MacGyver I know what you're thinking ,MacGyver I know what you're thinking ,MacGyver I know what you're thinking,100
422,- You can't blame yourself ,- You can't blame yourself ,- You can not blame yourself,96
423,- I fixed the brakes Pete ,- I fixed the brakes Pete ,- I fixed the brakes Pete,100
424,Good old clever MacGyver can fix anything right ,Good old clever MacGyver can fix anything right ,Good old clever MacGyver can fix anything right,100
425,Look Jeff is a driver a professional ,Look Jeff is a driver a professional ,Look Jeff is a professional driver,97
426,- He knew the risks ,- He knew the risks ,- He knew the risks,100
427,- So did l ,- So did I ,- So did l,88
428,This is all your fault!,This is all your fault!,This is all your fault!,100
429,You said you fixed the brakes -and Dad believed you and now he's,You said you fixed the brakes and Dad believed you and now he's--,You said you fixed the brakes -and Dad believed you and now he's,100
430,-He's gonna I hate you MacGyver I hate you!,He's gonna-- I hate you MacGyver I hate you!,-He's gonna I hate you MacGyver I hate you!,100
431,Look Jeff is a driver a professional ,Look Jeff is a driver a professional ,Look Jeff is a professional driver,97
432,He knew the risks ,- He knew the risks ,He knew the risks,100
433,He knew the risks ,- He knew the risks ,He knew the risks,100
434,So did l ,- So did I ,So did l,88
435,You can't cut me off!,You can't cut me off!,You can not cut me off!,86
436,We've got too much riding on this ,We've got too much riding on this ,We've got too much riding on this,100
437,Yeah we do ,Yeah we do ,Yeah we do,100
438,But you're gonna win this race remember ,But you're gonna win this race remember ,But you're gonna win this race remember,100
439,Then you're rich my people are rich and everybody's happy ,Then you're rich my people are rich and everybody's happy ,Then you're rich my people are rich and everybody's happy,100
440,And that's good ,And that's good ,And that's good,100
441,But if you don't win  ,But if you don't win  ,But if you do not win,93
442,I don't like being threatened ,I don't like being threatened ,I do not like being threatened,95
443,I'm glad we understand each other ,I'm glad we understand each other ,I'm glad we understand each other,100
444,Charlie ,- Charlie  ,Charlie,100
445,MacGyver ,MacGyver ,MacGyver,100
446,I just thought I'd bring some stuff to my Dad ,I just thought I'd bring some stuff to my Dad ,I just thought I'd bring some stuff to my Dad,100
447,You know cheer him up ,You know cheer him up ,You know cheer him up,100
448,Listen Charlie  ,Listen Charlie  ,Listen Charlie,100
449,- - What you said at the hospital,- What you said at the hospital--,- - What you said at the hospital,100
450,- No ,- No!,- No,100
451,No look I was just mad ,No look I was just mad ,No look I was just mad,100
452,I know it wasn't your fault ,I know it wasn't your fault ,I know it was not your fault,95
453,I wish I could be so sure ,I wish I could be so sure ,I wish I could be so sure,100
454,You know l  keep thinking about  ,You know I keep thinking about when my mom left ,You know l keep thinking about,78
455,She and Dad had this humungous fight about his racing and when it was over he came into my room ,She and Dad had this humungous fight about his racing and when it was over he came into my room ,She and Dad had this humungous fight about his racing and when it was over he came into my room,100
456,I guess he knew I could hear them through the wall ,I guess he knew I could hear them through the wall ,I guess he knew I could hear them through the wall,100
457,And he told me that what he did for a living was dangerous but if you let yourself be afraid of dying you're just gonna end up being afraid of living ,And he told me that what he did for a living was dangerous but if you let yourself be afraid of dying you're just gonna end up being afraid of living ,And he told me that what he did for a living was dangerous but if you let yourself be afraid of dying you're just gonna end up being afraid of living,100
458,Your dad's a pretty smart man ,Your dad's a pretty smart man ,Your dad's a pretty smart man,100
459,I love him so much ,I love him so much ,I love him so much,100
460,I'm afraid ,I'm afraid ,I'm afraid,100
461,- I'll see you at the hospital tomorrow ,- I'll see you at the hospital tomorrow ,- I'll see you at the hospital tomorrow,100
462,- Okay ,- Okay ,- Okay,100
463,Good night MacGyver ,Good night MacGyver ,Good night MacGyver,100
464,Hey Pete how's it going ,Hey Pete how's it going ,Hey Pete how's it going,100
465,I just read the accident report ,I just read the accident report ,I just read the accident report,100
466,There was a brake fluid leak ,There was a brake fluid leak ,There was a brake fluid leak,100
467,But the seal that you made was still intact ,But the seal that you made was still intact ,But the seal that you made was still intact,100
468,- What ,- What ,- What,100
469,- The right rear brake line was cut ,- The right rear brake line was cut ,- The right rear brake line was cut,100
470,Cut ,Cut ,Cut,100
471,That's impossible!,That's impossible!,That's impossible!,100
472,No we triple-checked ,No we triple-checked ,No we triple-checked,100
473,I even had the lab do a microscopic on it ,I even had the lab do a microscopic on it ,I even had the lab do a microscopic on it,100
474,It was definitely sabotage no question ,It was definitely sabotage no question ,It was definitely sabotage no question,100
475,- But who on earth-,- But who on earth-- ,- But who on earth-,100
476,- - It could have been anyone in the pit ,- It could have been anyone in the pit ,- - It could have been anyone in the pit,100
477,And it's gonna be almost impossible to find out who ,And it's gonna be almost impossible to find out who ,And it's gonna be almost impossible to find out who,100
478,Maybe not ,Maybe not ,Maybe not,100
479,Hey this ain't no open house here ,Hey this ain't no open house here ,Hey this ain't no open house here,100
480,We need some help ,We need some help ,We need some help,100
481,Join the club man ,Join the club man ,Join the club man,100
482,Those dudes in New York City don't get this footage by breakfast time they're gonna have me for lunch ,Those dudes in New York City don't get this footage by breakfast time they're gonna have me for lunch ,Those dudes in New York City do not get this footage by breakfast time they're gonna have me for lunch,97
483,We just need to know if your cameras got any shots of Jeff Stone's pit before the accident ,We just need to know if your cameras got any shots of Jeff Stone's pit before the accident ,We just need to know if your cameras got any shots of Jeff Stone's pit before the accident,100
484,Yeah we got shots ,Yeah we got shots ,Yeah we got shots,100
485,You'll see it on the news tomorrow ,You'll see it on the news tomorrow ,You'll see it on the news tomorrow,100
486,Goodbye ,Goodbye ,Goodbye,100
487,Now wait a minute this is very important to us ,Now wait a minute this is very important to us ,Now wait a minute this is very important to us,100
488,- Hey you guys cops or what ,- Hey you guys cops or what ,- Hey you guys cops or what,100
489,- We're with the Phoenix team ,- We're with the Phoenix team ,- We're with the Phoenix team,100
490,Our driver was almost killed today ,Our driver was almost killed today ,Our driver was almost killed today,100
491,And we have reason to believe it was not an accident ,And we have reason to believe it was not an accident ,And we have reason to believe it was not an accident,100
492,Would you please show us the footage ,Would you please show us the footage ,Would you please show us the footage,100
493,All right all right all right ,All right all right all right ,All right all right all right,100
494,If it'll get you guys off my case ,If it'll get you guys off my case ,If it'll get you guys off my case,100
495,All right go ahead and run through this ,All right go ahead and run through this ,All right go ahead and run through this,100
496,More ,More ,More,100
497,There freeze that ,There freeze that ,There freeze that,100
498,- Can you clear that up any ,- Can you clear that up any ,- Can you clear that up any,100
499,- That's as good as it gets ,- That's as good as it gets ,- That's as good as it gets,100
500,Got an image enhancer that can bit-map ,Got an image enhancer that can bit-map ,Got an image enhancer that can bit-map,100
501,"Bit-map"" ","""Bit-map"" ","Bitmap """,92
502,"What's that """,What's that ,"What's that """,100
503,Could do it ,Could do it ,Could do it,100
504,Bit-map ,"""Bit-map"" ",Bit-map,100
505,Bit-map ,"""Bit-map"" ",Bit-map,100
506,You mean an enlargement ,You mean an enlargement ,You mean an enlargement,100
507,Now vector in on that guy by the back wheel ,Now vector in on that guy by the back wheel ,Now vector in on that guy by the back wheel,100
508,Okay boss ,Okay boss ,Okay boss,100
509,All right lock on and enlarge the Z-axis ,All right lock on and enlarge the Z-axis ,All right lock on and enlarge the Z-axis,100
510,And enhance the X and Y Now we're cooking all right ,And enhance the X and Y Now we're cooking all right ,And enhance the X and Y Now we're cooking all right,100
511,Boogie!,Boogie!,Boogie!,100
512,Is that who I think it is ,Is that who I think it is ,Is that who I think it is,100
513,Gotcha ,Gotcha ,Gotcha,100
514,Enlarge that again would you ,Enlarge that again would you ,Enlarge that again would you,100
515,Magic fingers do your stuff ,Magic fingers do your stuff ,Magic fingers do your stuff,100
516,It is!,It is!,It is!,100
517,O'Malley ,O'Malley ,O'Malley,100
518,Better call the police ,Better call the police ,Better call the police,100
519,- Can I use this phone ,- Can I use this phone ,- Can I use this phone,100
520,- Yeah man go right ahead ,- Yeah man go right ahead ,- Yeah man go right ahead,100
521,- Can you make a copy of this for us ,- Can you make a copy of this for us ,- Can you make a copy of this for us,100
522,- You got it bro ,- You got it bro ,- You got it bro,100
523,The devil and his minion ,The devil and his minion ,The devil and his minion,100
524,A toast  to the unholy trinity   ,A toast to the unholy trinity ,A toast to the unholy trinity,100
525,You're drunk ,You're drunk ,You're drunk,100
526,That I am sir ,That I am sir ,That I am sir,100
527,Just enough to kill the pain ,Just enough to kill the pain ,Just enough to kill the pain,100
528,But not the guilt ,But not the guilt ,But not the guilt,100
529,I didn't call you in here to listen to whiskey-soaked morality ,I didn't call you in here to listen to whiskey-soaked morality ,I did not call you in here to listen to whiskey-soaked morality,94
530,I've got another job for you ,I've got another job for you ,I've got another job for you,100
531,And what might that be ,And what might that be ,And what might that be,100
532,The design specs for Stone's new plastic engine ,The design specs for Stone's new plastic engine ,The design specs for Stone's new plastic engine,100
533,I want them ,I want them ,I want them,100
534,Do you now ,Do you now ,Do you now,100
535,Just one telephone call to lnterpol could make your life very difficult ,Just one telephone call to Interpol could make your life very difficult ,Just one telephone call to lnterpol could make your life very difficult,87
536,Difficult ,Difficult ,Difficult,100
537,My friend's lying blind in the hospital!,My friend's lying blind in the hospital!,My friend's lying blind in the hospital!,100
538,Why ,Why ,Why,100
539,Because I convinced myself that only the car would be hurt ,Because I convinced myself that only the car would be hurt ,Because I convinced myself that only the car would be hurt,100
540,Because I let you use me on account of one mistake I made 20 years ago ,Because I let you use me on account of one mistake I made 20 years ago ,Because I let you use me on account of one mistake I made 20 years ago,100
541,- But that's all over now ,- But that's all over now ,- But that's all over now,100
542,- Where do you think you're going ,- Where do you think you're going ,- Where do you think you're going,100
543,I'm going to confession lad ,I'm going to confession lad ,I'm going to confession lad,100
544,But not to church ,But not to church ,But not to church,100
545,To the racing commission ,To the racing commission ,To the racing commission,100
546,Like hell you will!,Like hell you will!,Like hell you will!,100
547,Get your stinking hands off me!,Get your stinking hands off me!,Get your stinking hands off me!,100
548,The idiot will drown ,The idiot will drown ,The idiot will drown,100
549,Drowned men can't talk ,Drowned men can't talk ,Drowned men can not talk,96
550,Right there ,Right there ,Right there,100
551,We've concluded that that's when he cut the right rear brake line ,We've concluded that that's when he cut the right rear brake line ,We've concluded that that's when he cut the right rear brake line,100
552,As you can see gentlemen it does appear from the picture that Jake O'Malley sabotaged Jeff Stone's car ,As you can see gentlemen it does appear from the picture that Jake O'Malley sabotaged Jeff Stone's car ,As you can see gentlemen it does appear from the picture that Jake O'Malley sabotaged Jeff Stone's car,100
553,I don't get it ,I don't get it ,I do not get it,90
554,Why would O'Malley do that ,Why would O'Malley do that ,Why would O'Malley do that,100
555,We'll know more as soon as the police question him ,We'll know more as soon as the police question him ,We'll know more as soon as the police question him,100
556,And they have a warrant out now ,And they have a warrant out now ,And they have a warrant out now,100
557,All we're asking is that you delay the race long enough for us to get a new car and driver together ,All we're asking is that you delay the race long enough for us to get a new car and driver together ,All we're asking is that you delay the race long enough for us to get a new car and driver together,100
558,What about the rest of us ,What about the rest of us ,What about the rest of us,100
559,We all have a lot riding on this ,We all have a lot riding on this ,We all have a lot riding on this,100
560,I say we race ,I say we race ,I say we race,100
561,Sorry a delay is out of the question ,Sorry a delay is out of the question ,Sorry a delay is out of the question,100
562,The networks are airing the race live ,The networks are airing the race live ,The networks are airing the race live,100
563,However since Jeff Stone qualified tenth and given the unusual circumstances if you can have a car and driver ready by race time ,However since Jeff Stone qualified tenth and given the unusual circumstances if you can have a car and driver ready by race time ,However since Jeff Stone qualified tenth and given the unusual circumstances if you can have a car and driver ready by race time,100
564,I'll agree to enter you at the back of the starting grid ,I'll agree to enter you at the back of the starting grid ,I'll agree to enter you at the back of the starting grid,100
565,Well that means we only have 24 hours ,Well that means we only have 24 hours ,Well that means we only have 24 hours,100
566,It's the best I can do ,It's the best I can do ,It's the best I can do,100
567,I'm sorry ,I'm sorry ,I'm sorry,100
568,Thank you for your time gentlemen ,Thank you for your time gentlemen ,Thank you for your time gentlemen,100
569,Looks like your friend Visser is gonna win this thing after all ,Looks like your friend Visser is gonna win this thing after all ,Looks like your friend Visser is gonna win this thing after all,100
570,And Strickland stays on top of the series ,And Strickland stays on top of the series ,And Strickland stays on top of the series,100
571,It sure seems like they've got the most to gain from this ,It sure seems like they've got the most to gain from this ,It sure seems like they've got the most to gain from this,100
572,Are you suggesting a motive here ,Are you suggesting a motive here ,Are you suggesting a motive here,100
573,All I'm saying is they've got an awful lot to gain ,All I'm saying is they've got an awful lot to gain ,All I'm saying is they've got an awful lot to gain,100
574,Yeah they sure do don't they ,Yeah they sure do don't they ,Yeah they sure do not they,89
575,Think I'm gonna make a few calls ,Think I'm gonna make a few calls ,Think I'm gonna make a few calls,100
576,So what if we're in the back of the grid we're back in the race!,So what if we're in the back of the grid we're back in the race!,So what if we're in the back of the grid we're back in the race!,100
577,Not so fast Jeff ,Not so fast Jeff ,Not so fast Jeff,100
578,We still don't have a car or a driver ,We still don't have a car or a driver ,We still do not have a car or a driver,91
579,Well what about Wes Granville ,Well what about Wes Granville ,Well what about Wes Granville,100
580,He could drive ,He could drive ,He could drive,100
581,He could fly in from Cleveland in a few hours ,He could fly in from Cleveland in a few hours ,He could fly in from Cleveland in a few hours,100
582,I've got a better idea ,I've got a better idea ,I've got a better idea,100
583,How about you MacGyver ,How about you MacGyver ,How about you MacGyver,100
584,What ,What ,What,100
585,- No way ,- No way ,- No way,100
586,- Why not ,- Why not ,- Why not,100
587,You're as good as Granville ,You're as good as Granville ,You're as good as Granville,100
588,Better ,Better ,Better,100
589,No!,No!,No!,100
590,Just forget it ,Just forget it ,Just forget it,100
591,Okay Charlie call Wes ,Okay Charlie call Wes ,Okay Charlie call Wes,100
592,You can use the display model for the engine ,You can use the display model for the engine ,You can use the display model for the engine,100
593,We still don't have a car ,We still don't have a car ,We still do not have a car,86
594,Oh yes we do ,Oh yes we do ,Oh yes we do,100
595,It's one of Dad's old development cars ,It's one of Dad's old development cars ,It's one of Dad's old development cars,100
596,We've been scrounging parts off it all season ,We've been scrounging parts off it all season ,We've been scrounging parts off it all season,100
597,Needs work ,Needs work ,Needs work,100
598,Engine fresh rubber new brakes drive train ,Engine fresh rubber new brakes drive train ,Engine fresh rubber new brakes drive train,100
599,It needs everything ,It needs everything ,It needs everything,100
600,Well actually ,Well actually ,Well actually,100
601,I've seen you do a lot more  with a lot less   ,I've seen you do a lot more with a lot less ,I've seen you do a lot more with a lot less,100
602,Oh come on MacGyver we can do it ,Oh come on MacGyver we can do it ,Oh come on MacGyver we can do it,100
603,Can't we ,Can't we ,Can't we,100
604,Can't we ,Can't we ,Can't we,100
605,The Manufacturers GT Cup Race will begin at 2 p m ,The Manufacturers GT Cup Race will begin at 2 p m ,The Manufacturers GT Cup Race will begin at 2 p.m.,100
606,Track officials please report for a pre-race meeting ,Track officials please report for a pre-race meeting ,Track officials please report for a pre-race meeting,100
607,Well how's it coming ,Well how's it coming ,Well how's it coming,100
608,We're still behind but Granville's on his way ,We're still behind but Granville's on his way ,We're still behind but Granville's on his way,100
609,Any news on O'Malley ,Any news on O'Malley ,Any news on O'Malley,100
610,- You mean McDowel ,- You mean McDowel ,- You mean McDowel,100
611,- Who ,- Who ,- Who,100
612,Shawn Douglas McDowel ,Shawn Douglas McDowel ,Shawn Douglas McDowel,100
613,We ran a photo and prints through lnterpol ,We ran a photo and prints through Interpol ,We ran a photo and prints through lnterpol,98
614,It seems he delivered a package for the lrish Republican Army 20 years ago ,It seems he delivered a package for the Irish Republican Army 20 years ago ,It seems he delivered a package for the Irish Republican Army 20 years ago,100
615,It turned out to be a bomb ,It turned out to be a bomb ,It turned out to be a bomb,100
616,And a security guard was killed ,And a security guard was killed ,And a security guard was killed,100
617,Twenty years on the run huh ,Twenty years on the run huh ,Twenty years on the run huh,100
618,Something else of interest ,Something else of interest ,Something else of interest,100
619,I did do a little checking on Strickland ,I did do a little checking on Strickland ,I did a little checking on Strickland,96
620,He's borrowed heavily from his Japanese investors ,He's borrowed heavily from his Japanese investors ,He's borrowed heavily from his Japanese investors,100
621,If he loses tomorrow he's gonna be wiped out ,If he loses tomorrow he's gonna be wiped out ,If he loses tomorrow he's gonna be wiped out,100
622,Well that's a desperate combination ,Well that's a desperate combination ,Well that's a desperate combination,100
623,Sounds like Strickland blackmailed O'Malley into sabotaging our car ,Sounds like Strickland blackmailed O'Malley into sabotaging our car ,Sounds like Strickland blackmailed O'Malley into sabotaging our car,100
624,Sure would be nice if the police could find O'Malley wouldn't it ,Sure would be nice if the police could find O'Malley wouldn't it ,Sure would be nice if the police could find O'Malley would not,92
625,Anybody here order some new brake callipers ,Anybody here order some new brake callipers ,Anybody here order some new brake callipers,100
626,Where'd you get new brake callipers ,Where'd you get new brake callipers ,Where'd you get new brake callipers,100
627,I swapped them for the extra impact gun we had in the pit ,I swapped them for the extra impact gun we had in the pit ,I swapped them for the extra impact gun we had in the pit,100
628,When did we get an extra impact gun ,When did we get an extra impact gun ,When did we get an extra impact gun,100
629,When I swapped it for the posi unit off the wreck ,When I swapped it for the posi unit off the wreck ,When I swapped it for the posi unit off the wreck,100
630,You know if you ever give up wanting to be a driver you've got a huge future in commodities ,You know if you ever give up wanting to be a driver you've got a huge future in commodities ,You know if you ever give up wanting to be a driver you've got a huge future in commodities,100
631,And that was the last time you saw O'Malley ,And that was the last time you saw O'Malley ,And that was the last time you saw O'Malley,100
632,Yeah ,Yeah ,Yeah,100
633,He came in when I was closing ,He came in when I was closing ,He came in when I was closing,100
634,Slipped me a 20 to give him a bottle ,Slipped me a 20 to give him a bottle ,Slipped me a 20 to give him a bottle,100
635,You've any idea where he went ,You've any idea where he went ,You've any idea where he went,100
636,No ,No!,No,100
637,He was still here when I left ,He was still here when I left ,He was still here when I left,100
638,Okay ,Okay ,Okay,100
639,Thank you ,Thank you ,Thank you,100
640,One hour and 45 minutes to race time ,One hour and 45 minutes to race time ,One hour and 45 minutes to race time,100
641,All drivers are reminded -that not only,All drivers are reminded that not only--,All drivers are reminded -that not only,100
642,Granville should have been here an hour ago ,Granville should have been here an hour ago ,Granville should have been here an hour ago,100
643,Charlie why don't you run down to registration see if he's checked in yet ,Charlie why don't you run down to registration see if he's checked in yet ,Charlie why not you run down to registration see if he's checked in yet,93
644,Okay ,Okay ,Okay,100
645,Maybe that's him ,Maybe that's him ,Maybe that's him,100
646,Phoenix tent ,Phoenix tent ,Phoenix tent,100
647,Yes ,Yes ,Yes,100
648,You're talking to him ,You're talking to him ,You're talking to him,100
649,What ,What ,What,100
650,Are you sure ,Are you sure ,Are you sure,100
651,It's Gordon Simms the medical examiner ,It's Gordon Simms the medical examiner ,It's Gordon Simms the medical examiner,100
652,- What's he want ,- What's he want ,- What he wants,89
653,- They just found O'Malley ,- They just found O'Malley ,- They just found O'Malley,100
654,Looks like he missed the curve and went straight in the water ,Looks like he missed the curve and went straight in the water ,Looks like he missed the curve and went straight into the water,98
655,- Appears he drowned ,- Appears he drowned ,- Appears he drowned,100
656,- You don't sound too sure ,- You don't sound too sure ,- You do not sound too sure,90
657,And except for a bruise on the jaw there are no impact marks ,And except for a bruise on the jaw there are no impact marks ,And except for a bruise on the jaw there are no impact marks,100
658,Hold on a minute Pete ,Hold on a minute Pete ,Hold on a minute Pete,100
659,Corpses don't bruise ,Corpses don't bruise ,Corpses do not bruise,93
660,Well if he was dead before he hit the lake then where did he drown ,Well if he was dead before he hit the lake then where did he drown ,Well if he was dead before he hit the lake then where did he drown,100
661,The fountain!,The fountain!,The fountain!,100
662,- What ,What ,- What,100
663,- The fountain ,The fountain!,- The fountain,100
664,The one in the hospitality tent ,The one in the hospitality tent ,The one in the hospitality tent,100
665,Here ,Here ,Here,100
666,Look ,Look ,Look,100
667,Okay I'm back Pete ,Okay I'm back Pete ,Okay I'm back Pete,100
668,Ask him to draw a sample of water from O'Malley's lungs ,Ask him to draw a sample of water from O'Malley's lungs ,Ask him to draw a sample of water from O'Malley's lungs,100
669,Simms did you get that about the water ,Simms did you get that about the water ,Simms did you get that about the water,100
670,Good ,Good ,Good,100
