,hebrewFromSub,englishFromSub,englishTranslation,ratio
233,היא שווה כל פרוטה שארגון הפניקס השקיע בה ,Worth every penny the Phoenix Foundation's put into it ,It is worth every penny the Phoenix organization has invested in it,66
234,פליטת הזיהום ירדה ל-18 אחוז והמנוע פועל בטמפרטורה של 10 מעלות פחות מכפי שציפינו ,Emissions are down 18 percent Engine's running 10 degrees cooler than we expected ,Pollution emissions have dropped to 18 percent and the engine is running at a temperature of 10 degrees less than we expected,68
235,ובכן כדי שאמסור את החדשות הטובות למועצת המנהלים ,Well I'd better give the Phoenix Board of Directors the good news ,Well so I can pass on the good news to the board,65
236,אתם יודעים כשמכרתי להם את המיזם הסביבתי הזה אני לא חושב שהם תיארו לעצמם שעלותו תהיה כה גבוהה ,You know when I sold them this environmental project I don't think they figured it was gonna cost this much ,You know when I sold them this environmental venture I do not think they imagined that its cost would be so high,72
237,אפגוש אותך במסיבת העיתונאים ,I'll see you at the press conference ,I'll meet you at the press conference,88
238,אתה תהיה אלוף אבא!,You're gonna be champ Dad ,You'll be a Daddy Champion!,67
239,המעריצה הכי גדולה שלי ,My biggest fan ,My biggest fan,100
240,-יום אחד גם אני אהיה נהגת ונהיה כמו נבחרות האב ובנו המפורסמות ,Someday I'm gonna be a driver too like all the famous father-son racing teams ,-One day I too will be a driver and become like the famous father and son teams,71
241,כמו מריו ומייקל אנדרטי ריצ'רד וקייל פטי והאנסרים ,You know Mario and Michael Andretti and Richard and Kyle Petty and the Unsers ,Like Mario and Michael Anderty Richard and Kyle Petty and the Hansers,77
242,עכשיו שאני חושב על זה מעולם לא שמעתי על נבחרת מירוץ של אב ובתו ,You know come to think of it I've never heard of a father-daughter racing team ,Now that I think about it I have never heard of a father and daughter racing team,74
243,משום שאנחנו נהיה הראשונים נכון אבא ,- We're gonna be the first right Dad - Sure ,Because we'll be the first right Dad,69
244,אחרי שתסיימי את הלימודים -בחיי אתה נשמע בדיוק כמו אמא ,Oh boy you sound just like Mom ,After you graduate - in my life you sound just like mom,60
245,כן כן אני יודעת ,Yeah yeah I know Sorry ,Yes yes I know,67
246,סליחה בואי צ'רלי ,Hey come on Charlie ,Sorry Come on Charlie,75
247,את יכולה לעזור לי לבדוק את הבלמים ,You can help me check the brakes ,You can help me check the brakes,100
248,יש בה להט ,It's fast ,It has passion,61
249,להכניס את המנוע לפס-הייצור שלה אוכל להתיישב ולבנות לה סוף-סוף חיים נורמליים כלשהם ,But if we could get a major car company to put this engine in production I could settle down finally make some sort of normal life for her ,Put the engine on its production line I can sit down and finally build her some normal life,69
250,שמעת ממג ,Heard from Meg ,You heard from Meg,88
251,צ'רלי קיבלה כרטיס ברכה מויסקונסין ,Charlie got a birthday card from Wisconsin ,Charlie received a greeting card from Wisconsin,72
252,אתה עדיין מתגעגע אליה ,You still miss her ,You still miss her,100
253,אני מניח שטוב לה ,I guess she's happy ,I guess she's fine,70
254,כשהיא נשואה לרופא-שיניים היא לא צריכה לפחד שבעלה ימות בהתרסקות ,Being married to a dentist she doesn't have to worry about him buying it in a crash ,When she is married to a dentist she should not be afraid that her husband will die in a crash,62
255,- אוהל אירוח תודה רבה ,Thank you very much ,Thank you very much,100
256,-לא תודה ,- No thanks ,-No thanks,100
257,אני חושב שהעיתונות עומדת לסיים עם סטריקלנד ,Well I think the press is almost finished with Strickland ,I think the press is about to end with Strickland,83
258,אז זה קרל סטריקלנד מה ,So that's Carl Strickland huh ,So this is Carl Strickland what,83
259,כיצד תדרג את מנועו הפלסטי של ג'ף סטון ביחס למנועך ,How would you rate Jeff Stone's plastic engine against yours ,How to rate Jeff Stone's plastic engine relative to your engine,80
260,מנועו של סטון הוא צעצוע מעניין אבל הוא לא משתווה למנוע בעל מערכת הזרקת הדלק החדישה שלי ,Stone's machine is an interesting toy but it's no match for an engine with my new fuel-injection system Right ,Stone's engine is an interesting toy but it does not compare to the engine with my latest fuel injection system,75
261,כשסירבתי למכור לו את הפטנט שלי סטריקלנד התעצבן כל-כך עד שהעיף אותי מהנבחרת שלו ,When I refused to sell him my design patent Strickland got so mad he dumped me from his racing team ,When I refused to sell him my patent Strickland got so upset that he kicked me out of his team,74
262,מערכת הזרקת-הדלק הזו תגרום למכונית הסטריקלנד להיות המכונית המהירה ביותר בכביש!,This fuel-injection system will make the Strickland the fastest car on the road which I intend to prove at Sunday's race ,This fuel-injection system will make the Strickland car the fastest car on the road!,80
263,המכונית הכי טובה במסלול זקוקה לנהג הכי טוב ,The best car on the circuit needs the best driver ,The best car on the track needs the best driver,85
264,אלוף הפורמולה אחת של אירופה בשנה שעברה הנס ויסר ,Last year's European Formula 1 champion Hans Visser - Thank you ,Last year's European Formula One champion Hans Visser,86
265,-אתה מכיר אותו ,- Oh you made it ,-you know him,62
266,קצת יותר מדי טוב ,A little too well Easy Mac ,A little too good,60
267,מה גרם לך לעזוב את מסלול הפורמולה אחת באירופה ,What made you leave the Formula 1 circuit in Europe ,What made you leave the Formula One track in Europe,80
268,כספו של מר סטריקלנד ,Mr Strickland's money ,Mr. Strickland's money,100
269,אז כעת אני חפץ באתגר חדש ,So now I want a new challenge ,So now I want a new challenge,100
270,משום שנכנסת למירוץ האחרון של העונה אתה מפגר ב-7 נקודות מאחורי סטון בניקוד המצטבר מה שאומר שתצטרך להביס את סטון ביום ראשון ותהיה חייב לנצח במירוץ כדי לזכות באליפות ,Going into this final race of the season you're still seven points behind Stone in accumulated points which means you have to beat Stone on Sunday and you have to win the race to take the championship ,Because you entered the last race of the season you are 7 points behind Stone by the cumulative score which means you will have to defeat Stone on Sunday and will have to win the race to win the championship,75
271,מה גורם לך לחשוב שתוכל לעשות את זה ,What makes you think you can do it ,What makes you think you can do it,100
272,אני לא יודע כיצד להפסיד ,I don't know how to lose ,I do not know how to lose,94
273,-כיצד תגיב לזה ג'ף ,How do you respond to that Jeff ,-How will Jeff respond to this?,77
274,אגיב לכך במהלך המירוץ ,I'll respond during the race ,I will respond to this during the race,76
275,תסלחו לי ,If you'll excuse me ,excuse me,64
276,בוא ,Come on ,Come on,100
277,-להנס ויסר יש אגו מאוד נפוח כיצד הארגון שלך מקבל זאת ,--Hans Visser has a massive ego How does that fit into your organization ,-Hanser Visser has a very bloated ego about how your organization accepts this,68
278,היי מקגיוור ,- Hi MacGyver ,Hi McGuire,67
279,-היי טוד ,- Hey Todd ,- Hi Todd,80
280,איזה עולם קטן ,Small world ,What a small world,76
281,כן יותר מדי קטן ,Yeah Too small ,Yes too small,89
282,עדיין נוטר לי טינה אחרי כל השנים האלה ,Still holding a grudge after all these years ,I still harbor resentment after all these years,70
283,אתה רודף-תהילה ויסר ואתה עדיין מהווה סכנה ,You're a glory-hound Visser And you're still dangerous ,You are a chase-fighter and you are still a danger,60
284,את שלך אתה איבדת זוכר ,You lost yours remember ,Yours you lost remember,100
285,ההבטחות שלך לא מספיקות לי סטריקלנד אני זקוק לתוצאות ,I need more than promises from you Strickland I need results ,Your promises are not enough for me Strickland I need results,78
286,נדרש כסף כדי לפתח מערכת הזרקת-דלק פלקו ,It takes money to develop a fuel-injection system Falco ,Money is needed to develop a Falco fuel-injection system,86
287,חריגה של מיליון דולר מהתקציב היא נורמלית בעסק שלי ,A million dollars over budget is normal in my business ,A $ 1 million budget overrun is normal in my business,88
288,אבל בעסק שלי היא לא ,But it's not in my business ,But in my business she is not,93
289,המשקיעים שלי חוששים ,My people are worried ,My investors are worried,62
290,כשהמכונית שלי תזכה במירוץ ביום ראשון תקבל חזרה את ההשקעה שלך כפול 100 ,When my car wins the race on Sunday you'll get back a hundred times return on your investment ,When my car wins the race on Sunday you will get back your investment double 100,75
291,-זאת במידה וננצח ,I will win ,- If we win,74
292,אני מבין שארגון הפניקס בחן היום את המנוע הפלסטי שלו ,I understand Phoenix tested its plastic engine today ,I understand that the Phoenix organization examined its plastic engine today,77
293,אולי השקענו במנוע הלא נכון ,Maybe we invested in the wrong engine ,Maybe we invested in the wrong engine,100
294,המכונית של ארגון הפניקס מהירה ,That Phoenix car is fast ,The Phoenix organization's car is fast,71
295,יותר מדי מהירה ,Too fast ,Too fast,100
296,אנחנו לא יכולים להרשות לסטון לנצח ,We can't let Stone win ,We can not afford Stone to win,77
297,סטון לא משתווה אליי ,Stone is no match for me ,Stone does not compare to me,62
298,אולי הוא אבל מנועו חזק יותר מכפי שציפיתי ,He may not be but his engine's more powerful than I anticipated ,Maybe he but his engine is more powerful than I expected,71
299,אם סטון יביס אותך ביום ראשון אוכל לשכוח ממשקיעיו של פלקו ,If Stone beats you on Sunday I can say goodbye to Falco's investors ,If Stone defeats you on Sunday I can forget about Falco's investors,78
300,אני אנצח ,I will win ,I will win,100
301,למישהו שיוכל להטות את הסיכויים לטובתנו ,Someone who can tilt the odds in our favour ,To someone who can skew the odds in our favor,89
302,למישהו שלא יכול להרשות לעצמו לסרב ,Someone who can't afford to say no ,To someone who can not afford to refuse,88
303,האין אני צודק מר אומלי ,Isn't that right Mr O'Malley ,Am I not right Mr O'Malley?,70
304,איזו נסיעה זה מרשים ביותר בהתחשב בתנאי הרטיבות של המסלול היום ,Especially considering the wet track conditions that we have here today ,Which ride is most impressive given the wet conditions of the track today,65
305,לא הם מתחרים אבל פשוט אחד בכל פעם ,Oh no they are but just one at a time ,No they are competing but just one at a time,84
306,לכל נהג יש חמישה ניסיונות לקבוע את זמן ההקפה הכי טוב שלו ורק עשרת המכוניות המהירות ביותר יזכו להעפיל לאליפות ,See each driver has five laps to make his best time and then only the top ten cars get to go on to the championship ,Each driver has five attempts to determine his best lap time and only the ten fastest cars will qualify for the championship.,70
307,וככל שמהירות ההקפה טובה יותר כך המיקום על קו הזינוק יהיה יותר טוב ,And the faster the time the better the position - on the starting grid ,"And the better the lap speed, the better the position on the starting line",81
308,האמת היא שהוא אף פעם לא מדבר על זה ,Actually he never talks about it ,The truth is he never talks about it,68
309,Great lap Hans ,Great lap Hans ,Great lap Hans,100
310,Qualifying time for the Strickland car 1: 15:,Qualifying time for the Strickland car 1: 15: 58 ,Qualifying time for the Strickland car 1:15:,97
311,58 Driver Hans Visser's time places him in number-one position with two cars left to qualify ,Driver Hans Visser's time places him in number-one position with two cars left to qualify ,58 Driver Hans Visser's time places him in number-one position with two cars left to qualify,98
312,Hey lad would you give me a ratchet with a half-inch on it ,Hey lad would you give me a ratchet with a half-inch on it ,Hey lad would you give me a ratchet with a half-inch on it,100
313,You got it ,You got it ,You got it,100
314,- Here you go ,- Here you go ,- Here you go,100
315,- Oh thanks lad ,- Oh thanks lad ,- Oh thanks lad,100
316,Next for qualifying is car number 1 7 ,Next for qualifying is car number 17 ,Next for qualifying is car number 1 7,99
317,Driver Jeff Stone please proceed to the pre-grid area ,Driver Jeff Stone please proceed to the pre-grid area ,Driver Jeff Stone please proceed to the pre-grid area,100
318,Let's get this baby on the road ,Let's get this baby on the road ,Let's get this baby on the road,100
319,Now remember give her half a lap to warm up the tires ,Now remember give her half a lap to warm up the tires ,Now remember give her half a lap to warm up the tires,100
320,- Okay O'Malley ,- Okay O'Malley ,"- Okay, O'Malley",100
321,- Dad ,- Dad ,- Dad,100
322,Don't forget this ,Don't forget this ,Do not forget this,91
323,A lucky charm ,A lucky charm ,A lucky charm,100
324,My daughter the patron saint of speed demons ,My daughter the patron saint of speed demons ,My daughter the patron saint of speed demons,100
325,Well at 1 60 miles an hour you need all the help you can get ,Well at 160 miles an hour you need all the help you can get ,Well at 1 60 miles an hour you need all the help you can get,99
326,- What is it ,- What is it ,- What is it,100
327,- Used to be a penny ,- Used to be a penny ,- Used to be a penny,100
328,I found it squished on a railway track ,I found it squished on a railway track ,I found it squished on a railway track,100
329,It helped make Dad the point leader this season ,It helped make Dad the point leader this season ,It helped make Dad the point leader this season,100
330,So that's your secret huh ,So that's your secret huh ,So that's your secret huh,100
331,Number 1 7 is on the track ,Number 17 is on the track ,Number 1 7 is on the track,98
332,It's the Phoenix entry ,It's the Phoenix entry ,It's the Phoenix entry,100
333,Stone is really pushing the Phoenix entry to the limit as he brings it out of turn three ,Stone is really pushing the Phoenix entry to the limit as he brings it out of turn three ,Stone is really pushing the Phoenix entry to the limit as he brings it out of turn three,100
334,Here he comes sideways almost!,Here he comes sideways almost!,Here he comes sideways almost!,100
335,He is fighting for control here ,He is fighting for control here ,He is fighting for control here,100
336,This wet track is proving hazardous but it does not seem to be dampening Jeff Stone's determination ,This wet track is proving hazardous but it does not seem to be dampening Jeff Stone's determination ,This wet track is proving hazardous but it does not seem to be dampening Jeff Stone's determination,100
337,- Yeah go Dad!,- Yeah go Dad!,- Yeah go Dad!,100
338,- How's his time O' Malley ,- How's his time O' Malley ,- How's his time O 'Malley,100
339,One-twenty ,One-twenty ,One-twenty,100
340,He's slow ,He's slow ,He's slow,100
341,Don't worry about it ,Don't worry about it ,Do not worry about it,93
342,Dad's just warming up ,Dad's just warming up ,Dad's just warming up,100
343,--right to the edge when it comes to winning this much-coveted pole position ,--right to the edge when it comes to winning this much-coveted pole position ,--right to the edge when it comes to winning this much-coveted pole position,100
344,He is fighting for it really burning up the track ,He is fighting for it really burning up the track ,He is fighting for it really burning up the track,100
345,Number 1 7 down the back straightaway ,Number 17 down the back straightaway ,Number 1 7 down the back straightaway,99
346,Look at that rooster tail!,Look at that rooster tail!,Look at that rooster tail!,100
347,That fuel-efficient plastic engine seems to be doing the trick here ,That fuel-efficient plastic engine seems to be doing the trick here ,That fuel-efficient plastic engine seems to be doing the trick here,100
348,Oh he's got a lot of catching up to do if he hopes to beat the qualifying time set by the Strickland entry ,Oh he's got a lot of catching up to do if he hopes to beat the qualifying time set by the Strickland entry ,Oh he's got a lot of catching up to do if he hopes to beat the qualifying time set by the Strickland entry,100
349,Through corner four he's gonna give it everything he's got to challenge Hans Visser ,Through corner four he's gonna give it everything he's got to challenge Hans Visser Oh no ,Through corner four he's gonna give it everything he's got to challenge Hans Visser,97
350,Oh no Look now-,Look now-,Oh no Look now-,73
351,- Wait a minute ,- Wait a minute ,- Wait a minute,100
352,Oh now number 1 7 is smoking here in turn four ,Oh now number 17 is smoking here in turn four ,Oh now number 1 7 is smoking here in turn four,99
353,Looks like bad news for the Phoenix team ,Looks like bad news for the Phoenix team ,Looks like bad news for the Phoenix team,100
354,That plastic engine is giving Stone a problem ,That plastic engine is giving Stone a problem ,That plastic engine is giving Stone a problem,100
355,That spells trouble for the Phoenix Foundation ,That spells trouble for the Phoenix Foundation ,That spells trouble for the Phoenix Foundation,100
356,Let's go!,Let's go!,Let's go!,100
357,Brakes are soft!,Brakes are soft!,Brakes are soft!,100
358,Phoenix number 1 7 you have five minutes remaining in qualifying ,Phoenix number 17 you have five minutes remaining in qualifying ,Phoenix number 1 7 you have five minutes remaining in qualifying,99
359,Gasket's busted on the master cylinder reservoir ,Gasket's busted on the master cylinder reservoir ,Gasket's busted on the master cylinder reservoir,100
360,- Let's get a spare ,- Let's get a spare ,- Let's get a spare,100
361,- We don't have one ,- We don't have one ,- We do not have one,80
362,What ,What ,What,100
363,Replace the brake fluid ,Replace the brake fluid ,Replace the brake fluid,100
364,- But what's the point-,- But what's the point-- ,- But what's the point-,100
365,- - Just hurry!,- Just hurry!,- - Just hurry!,100
366,- You heard the man ,- You heard the man ,- You heard the man,100
367,- What are you doing ,- What are you doing ,- What are you doing,100
368,I'm gonna make a new gasket ,I'm gonna make a new gasket ,I'm gonna make a new gasket,100
369,All right come on you guys let's go ,All right come on you guys let's go ,All right come on you guys let's go,100
370,We're going back out ,We're going back out ,We're going back out,100
371,- Let's go!,Let's go!,- Let's go!,100
372,- Phoenix number 17 ,- Phoenix number 17 ,- Phoenix number 17,100
373,You now have four minutes left to qualify ,You now have four minutes left to qualify ,You now have four minutes left to qualify,100
374,That should hold you long enough to get some hot laps ,That should hold you long enough to get some hot laps ,That should hold you long enough to get some hot laps,100
375,- Get your time down!,- Get your time down!,- Get your time down!,100
376,- Come on now go!,- Come on now go!,- Come on now go!,100
377,Oh no ,Oh no ,Oh no,100
378,And Jeff Stone is back on the track ,And Jeff Stone is back on the track ,And Jeff Stone is back on the track,100
379,Well with the clock ticking and only four minutes left for qualifying it's gonna be an uphill battle for the Phoenix team to improve their time ,Well with the clock ticking and only four minutes left for qualifying it's gonna be an uphill battle for the Phoenix team to improve their time ,Well with the clock ticking and only four minutes left for qualifying it's gonna be an uphill battle for the Phoenix team to improve their time,100
380,What Stone may have lost in the pit he's making up for with speed ,What Stone may have lost in the pit he's making up for with speed ,What Stone may have lost in the pit he's making up for with speed,100
381,Look at him go out there!,Look at him go out there!,Look at him go out there!,100
382,If not for the technical difficulties at the outset ,If not for the technical difficulties at the outset ,If not for the technical difficulties at the outset,100
383,I am certain we'd be looking at a new track record here ,I am certain we'd be looking at a new track record here ,I am certain we'd be looking at a new track record here,100
384,It's hard to say at this stage if it's that new Phoenix engine or Jeff Stone's years of experience on the professional circuit but whatever it is I tell you it's adding up to a very impressive showing ,It's hard to say at this stage if it's that new Phoenix engine or Jeff Stone's years of experience on the professional circuit but whatever it is I tell you it's adding up to a very impressive showing ,It's hard to say at this stage if it's new Phoenix engine or Jeff Stone's years of experience on the professional circuit but whatever it is I tell you it's adding up to a very impressive showing,99
385,We're watching him wobble a bit on that straight ,We're watching him wobble a bit on that straight ,We're watching him wobble a bit on that straight,100
386,Wait a minute!,- Wait a minute ,Wait a minute!,100
387,He's in trouble ,He's in trouble ,He's in trouble,100
388,He's swerving ,He's swerving ,He's wandering,81
389,He's out of control heading for the tire wall ,He's out of control heading for the tire wall ,He's out of control heading for the tire wall,100
390,He hits it!,He hits it!,He hits it!,100
391,He's over!,He's over!,He's over!,100
392,Jeff Stone is over the wall!,Jeff Stone is over the wall!,Jeff Stone is over the wall!,100
393,- Now a fire under the hood!,- Now a fire under the hood!,- Now a fire under the hood!,100
394,- No Dad!,- No Dad!,- No Dad!,100
395,Dear God ,Dear God ,Dear God,100
396,The emergency crews are now dashing over they hurry to the scene ,The emergency crews are now dashing over they hurry to the scene ,The emergency crews are now dashing over they hurry to the scene,100
397,Oh this is a terrible tragedy for Jeff Stone and the entire Phoenix racing team ,Oh this is a terrible tragedy for Jeff Stone and the entire Phoenix racing team ,Oh this is a terrible tragedy for Jeff Stone and the entire Phoenix racing team,100
398,Emergency crew is on the way all vehicles clear the track ,Emergency crew is on the way all vehicles clear the track ,Emergency crew is on the way all vehicles clear the track,100
399,What a shame ,What a shame ,What a shame,100
400,Cars lose their brakes on the hairpin all the time ,Cars lose their brakes on the hairpin all the time ,Cars lose their brakes on the hairpin all the time,100
401,Jeff should have been okay!,Jeff should have been okay!,Jeff should have been okay!,100
402,- Doctor ,- Doctor ,- Doctor,100
403,How is he ,How is he ,How is he,100
404,- The only thing broken is his leg ,- The only thing broken is his leg ,- The only thing broken is his leg,100
405,- But there is a problem with his eyes ,- But there is a problem with his eyes ,- But there is a problem with his eyes,100
406,- His eyes ,- His eyes ,- His eyes,100
407,He suffered severe flash burn ,He suffered severe flash burn ,He suffered severe flash burn,100
408,What are you saying ,What are you saying ,What are you saying,100
409,He's gonna be blind ,He's gonna be blind ,He's gonna be blind,100
410,We won't know for a day or two ,We won't know for a day or two ,We will not know for a day or two,83
411,- No!,- No!,- No!,100
412,- Charlie  ,- Charlie  ,- Charlie,100
413,This is all your fault!,This is all your fault!,This is all your fault!,100
414,You said you fixed the brakes -and Dad believed you and now he's,You said you fixed the brakes and Dad believed you and now he's--,You said you fixed the brakes -and Dad believed you and now he's,100
415,-He's gonna,He's gonna--,-He's gonna,100
416,- I hate you MacGyver!,- I hate you MacGyver!,- I hate you MacGyver!,100
417,- Charlie wait!,- Charlie wait!,- Charlie wait!,100
418,I'll go after her ,I'll go after her ,I'll go after her,100
419,-MacGyver l,MacGyver l--,-MacGyver l,100
420,Never mind ,Never mind ,Never mind,100
